well_id,Date,Time,ms,DT,raw_Level_m,TEMPERATURE,Rate of Change
KER-2,6/25/2025,03:50:00 pm,0,2025-06-25 15:50:00,8.466,8.987,9.999999999994457e-05
KER-2,6/25/2025,04:00:00 pm,0,2025-06-25 16:00:00,8.4654,8.986,9.999999999994457e-05
KER-2,6/25/2025,04:10:00 pm,0,2025-06-25 16:10:00,8.465,8.987,9.999999999994457e-05
KER-2,6/25/2025,04:20:00 pm,0,2025-06-25 16:20:00,8.465,8.986,0.0002000000000000668
KER-2,6/25/2025,04:30:00 pm,0,2025-06-25 16:30:00,8.4648,8.984,9.999999999994457e-05
KER-2,6/25/2025,04:40:00 pm,0,2025-06-25 16:40:00,8.4644,8.985,0.0
KER-2,6/25/2025,04:50:00 pm,0,2025-06-25 16:50:00,8.4633,8.985,0.0
KER-2,6/25/2025,05:00:00 pm,0,2025-06-25 17:00:00,8.4626,8.985,9.999999999994457e-05
KER-2,6/25/2025,05:10:00 pm,0,2025-06-25 17:10:00,8.4622,8.984,9.999999999994457e-05
KER-2,6/25/2025,05:20:00 pm,0,2025-06-25 17:20:00,8.4623,8.983,0.00010000000000012221
KER-2,6/25/2025,05:30:00 pm,0,2025-06-25 17:30:00,8.4619,8.982,0.0
KER-2,6/25/2025,05:40:00 pm,0,2025-06-25 17:40:00,8.4618,8.982,0.00010000000000012221
KER-2,6/25/2025,05:50:00 pm,0,2025-06-25 17:50:00,8.462,8.983,0.00010000000000012221
KER-2,6/25/2025,06:00:00 pm,0,2025-06-25 18:00:00,8.4623,8.982,0.00019999999999988915
KER-2,6/25/2025,06:10:00 pm,0,2025-06-25 18:10:00,8.4623,8.98,0.00030000000000001136
KER-2,6/25/2025,06:20:00 pm,0,2025-06-25 18:20:00,8.4629,8.983,0.00030000000000001136
KER-2,6/25/2025,06:30:00 pm,0,2025-06-25 18:30:00,8.4636,8.98,0.00010000000000012221
KER-2,6/25/2025,06:40:00 pm,0,2025-06-25 18:40:00,8.4641,8.979,0.0
KER-2,6/25/2025,06:50:00 pm,0,2025-06-25 18:50:00,8.4646,8.979,0.00010000000000012221
KER-2,6/25/2025,07:00:00 pm,0,2025-06-25 19:00:00,8.4656,8.98,0.00030000000000001136
KER-2,6/25/2025,07:10:00 pm,0,2025-06-25 19:10:00,8.4668,8.977,0.0
KER-2,6/25/2025,07:20:00 pm,0,2025-06-25 19:20:00,8.4675,8.977,9.999999999994457e-05
KER-2,6/25/2025,07:30:00 pm,0,2025-06-25 19:30:00,8.4692,8.976,9.999999999994457e-05
KER-2,6/25/2025,07:40:00 pm,0,2025-06-25 19:40:00,8.4715,8.977,0.00030000000000001136
KER-2,6/25/2025,07:50:00 pm,0,2025-06-25 19:50:00,8.4729,8.974,0.0002000000000000668
KER-2,6/25/2025,08:00:00 pm,0,2025-06-25 20:00:00,8.4747,8.976,0.00030000000000001136
KER-2,6/25/2025,08:10:00 pm,0,2025-06-25 20:10:00,8.4764,8.973,9.999999999994457e-05
KER-2,6/25/2025,08:20:00 pm,0,2025-06-25 20:20:00,8.478,8.974,0.0002000000000000668
KER-2,6/25/2025,08:30:00 pm,0,2025-06-25 20:30:00,8.4796,8.972,0.00019999999999988915
KER-2,6/25/2025,08:40:00 pm,0,2025-06-25 20:40:00,8.4808,8.97,0.00010000000000012221
KER-2,6/25/2025,08:50:00 pm,0,2025-06-25 20:50:00,8.4824,8.969,0.00010000000000012221
KER-2,6/25/2025,09:00:00 pm,0,2025-06-25 21:00:00,8.4837,8.97,0.00010000000000012221
KER-2,6/25/2025,09:10:00 pm,0,2025-06-25 21:10:00,8.4851,8.969,9.999999999994457e-05
KER-2,6/25/2025,09:20:00 pm,0,2025-06-25 21:20:00,8.4871,8.968,0.0
KER-2,6/25/2025,09:30:00 pm,0,2025-06-25 21:30:00,8.4883,8.968,0.0002000000000000668
KER-2,6/25/2025,09:40:00 pm,0,2025-06-25 21:40:00,8.4903,8.97,0.0002000000000000668
KER-2,6/25/2025,09:50:00 pm,0,2025-06-25 21:50:00,8.4916,8.968,9.999999999994457e-05
KER-2,6/25/2025,10:00:00 pm,0,2025-06-25 22:00:00,8.493,8.967,9.999999999994457e-05
KER-2,6/25/2025,10:10:00 pm,0,2025-06-25 22:10:00,8.4948,8.968,9.999999999994457e-05
KER-2,6/25/2025,10:20:00 pm,0,2025-06-25 22:20:00,8.4954,8.967,0.0002000000000000668
KER-2,6/25/2025,10:30:00 pm,0,2025-06-25 22:30:00,8.4959,8.965,9.999999999994457e-05
KER-2,6/25/2025,10:40:00 pm,0,2025-06-25 22:40:00,8.4961,8.966,0.0
KER-2,6/25/2025,10:50:00 pm,0,2025-06-25 22:50:00,8.4973,8.966,0.00030000000000001136
KER-2,6/25/2025,11:00:00 pm,0,2025-06-25 23:00:00,8.4987,8.963,0.0002000000000000668
KER-2,6/25/2025,11:10:00 pm,0,2025-06-25 23:10:00,8.499,8.965,0.0
KER-2,6/25/2025,11:20:00 pm,0,2025-06-25 23:20:00,8.5004,8.965,0.00030000000000001136
KER-2,6/25/2025,11:30:00 pm,0,2025-06-25 23:30:00,8.5012,8.962,9.999999999994457e-05
KER-2,6/25/2025,11:40:00 pm,0,2025-06-25 23:40:00,8.5026,8.963,0.00010000000000012221
KER-2,6/25/2025,11:50:00 pm,0,2025-06-25 23:50:00,8.5026,8.964,0.00010000000000012221
KER-2,6/26/2025,12:00:00 am,0,2025-06-26 00:00:00,8.5027,8.963,0.0
KER-2,6/26/2025,12:10:00 am,0,2025-06-26 00:10:00,8.5033,8.963,9.999999999994457e-05
KER-2,6/26/2025,12:20:00 am,0,2025-06-26 00:20:00,8.5038,8.962,0.0
KER-2,6/26/2025,12:30:00 am,0,2025-06-26 00:30:00,8.5043,8.962,0.0
KER-2,6/26/2025,12:40:00 am,0,2025-06-26 00:40:00,8.5052,8.962,9.999999999994457e-05
KER-2,6/26/2025,12:50:00 am,0,2025-06-26 00:50:00,8.506,8.961,9.999999999994457e-05
KER-2,6/26/2025,01:00:00 am,0,2025-06-26 01:00:00,8.5058,8.962,0.0
KER-2,6/26/2025,01:10:00 am,0,2025-06-26 01:10:00,8.5059,8.962,9.999999999994457e-05
KER-2,6/26/2025,01:20:00 am,0,2025-06-26 01:20:00,8.5067,8.961,9.999999999994457e-05
KER-2,6/26/2025,01:30:00 am,0,2025-06-26 01:30:00,8.5068,8.96,0.0
KER-2,6/26/2025,01:40:00 am,0,2025-06-26 01:40:00,8.507,8.96,0.00010000000000012221
KER-2,6/26/2025,01:50:00 am,0,2025-06-26 01:50:00,8.5073,8.959,0.00010000000000012221
KER-2,6/26/2025,02:00:00 am,0,2025-06-26 02:00:00,8.5076,8.96,0.0
KER-2,6/26/2025,02:10:00 am,0,2025-06-26 02:10:00,8.5078,8.96,0.0002000000000000668
KER-2,6/26/2025,02:20:00 am,0,2025-06-26 02:20:00,8.5076,8.958,9.999999999994457e-05
KER-2,6/26/2025,02:30:00 am,0,2025-06-26 02:30:00,8.5079,8.959,0.0
KER-2,6/26/2025,02:40:00 am,0,2025-06-26 02:40:00,8.5079,8.959,9.999999999994457e-05
KER-2,6/26/2025,02:50:00 am,0,2025-06-26 02:50:00,8.5077,8.958,9.999999999994457e-05
KER-2,6/26/2025,03:00:00 am,0,2025-06-26 03:00:00,8.5077,8.959,0.00010000000000012221
KER-2,6/26/2025,03:10:00 am,0,2025-06-26 03:10:00,8.5077,8.96,0.00030000000000001136
KER-2,6/26/2025,03:20:00 am,0,2025-06-26 03:20:00,8.508,8.957,0.00019999999999988915
KER-2,6/26/2025,03:30:00 am,0,2025-06-26 03:30:00,8.5083,8.959,9.999999999994457e-05
KER-2,6/26/2025,03:40:00 am,0,2025-06-26 03:40:00,8.5082,8.958,0.0
KER-2,6/26/2025,03:50:00 am,0,2025-06-26 03:50:00,8.5083,8.958,9.999999999994457e-05
KER-2,6/26/2025,04:00:00 am,0,2025-06-26 04:00:00,8.5087,8.957,0.00030000000000001136
KER-2,6/26/2025,04:10:00 am,0,2025-06-26 04:10:00,8.5088,8.96,0.00010000000000012221
KER-2,6/26/2025,04:20:00 am,0,2025-06-26 04:20:00,8.5094,8.959,9.999999999994457e-05
KER-2,6/26/2025,04:30:00 am,0,2025-06-26 04:30:00,8.5096,8.958,0.0
KER-2,6/26/2025,04:40:00 am,0,2025-06-26 04:40:00,8.51,8.958,9.999999999994457e-05
KER-2,6/26/2025,04:50:00 am,0,2025-06-26 04:50:00,8.5103,8.959,9.999999999994457e-05
KER-2,6/26/2025,05:00:00 am,0,2025-06-26 05:00:00,8.5103,8.958,0.0
KER-2,6/26/2025,05:10:00 am,0,2025-06-26 05:10:00,8.5111,8.958,0.0002000000000000668
KER-2,6/26/2025,05:20:00 am,0,2025-06-26 05:20:00,8.5124,8.96,0.0
KER-2,6/26/2025,05:30:00 am,0,2025-06-26 05:30:00,8.5128,8.96,0.0002000000000000668
KER-2,6/26/2025,05:40:00 am,0,2025-06-26 05:40:00,8.5142,8.958,9.999999999994457e-05
KER-2,6/26/2025,05:50:00 am,0,2025-06-26 05:50:00,8.5144,8.957,0.0
KER-2,6/26/2025,06:00:00 am,0,2025-06-26 06:00:00,8.5147,8.957,0.00019999999999988915
KER-2,6/26/2025,06:10:00 am,0,2025-06-26 06:10:00,8.5156,8.959,9.999999999994457e-05
KER-2,6/26/2025,06:20:00 am,0,2025-06-26 06:20:00,8.5159,8.958,0.0
KER-2,6/26/2025,06:30:00 am,0,2025-06-26 06:30:00,8.5161,8.958,9.999999999994457e-05
KER-2,6/26/2025,06:40:00 am,0,2025-06-26 06:40:00,8.5166,8.959,0.0
KER-2,6/26/2025,06:50:00 am,0,2025-06-26 06:50:00,8.5171,8.959,0.0
KER-2,6/26/2025,07:00:00 am,0,2025-06-26 07:00:00,8.5175,8.959,9.999999999994457e-05
KER-2,6/26/2025,07:10:00 am,0,2025-06-26 07:10:00,8.5172,8.958,9.999999999994457e-05
KER-2,6/26/2025,07:20:00 am,0,2025-06-26 07:20:00,8.5179,8.959,0.00030000000000001136
KER-2,6/26/2025,07:30:00 am,0,2025-06-26 07:30:00,8.5181,8.962,0.00030000000000001136
KER-2,6/26/2025,07:40:00 am,0,2025-06-26 07:40:00,8.5181,8.959,0.0
KER-2,6/26/2025,07:50:00 am,0,2025-06-26 07:50:00,8.5182,8.959,0.0
KER-2,6/26/2025,08:00:00 am,0,2025-06-26 08:00:00,8.5184,8.959,0.00010000000000012221
KER-2,6/26/2025,08:10:00 am,0,2025-06-26 08:10:00,8.5181,8.96,9.999999999994457e-05
KER-2,6/26/2025,08:20:00 am,0,2025-06-26 08:20:00,8.5181,8.961,9.999999999994457e-05
KER-2,6/26/2025,08:30:00 am,0,2025-06-26 08:30:00,8.5179,8.96,0.0
KER-2,6/26/2025,08:40:00 am,0,2025-06-26 08:40:00,8.5181,8.96,0.0
KER-2,6/26/2025,08:50:00 am,0,2025-06-26 08:50:00,8.5178,8.96,9.999999999994457e-05
KER-2,6/26/2025,09:00:00 am,0,2025-06-26 09:00:00,8.5174,8.961,0.0
KER-2,6/26/2025,09:10:00 am,0,2025-06-26 09:10:00,8.5169,8.961,0.0
KER-2,6/26/2025,09:20:00 am,0,2025-06-26 09:20:00,8.5157,8.961,9.999999999994457e-05
KER-2,6/26/2025,09:30:00 am,0,2025-06-26 09:30:00,8.514,8.96,0.0002999999999998337
KER-2,6/26/2025,09:40:00 am,0,2025-06-26 09:40:00,8.5123,8.963,0.00019999999999988915
KER-2,6/26/2025,09:50:00 am,0,2025-06-26 09:50:00,8.5085,8.961,0.00030000000000001136
KER-2,6/26/2025,10:00:00 am,0,2025-06-26 10:00:00,8.5055,8.964,0.00010000000000012221
KER-2,6/26/2025,10:10:00 am,0,2025-06-26 10:10:00,8.5022,8.963,0.0002000000000000668
KER-2,6/26/2025,10:20:00 am,0,2025-06-26 10:20:00,8.4993,8.965,0.0002000000000000668
KER-2,6/26/2025,10:30:00 am,0,2025-06-26 10:30:00,8.4961,8.967,9.999999999994457e-05
KER-2,6/26/2025,10:40:00 am,0,2025-06-26 10:40:00,8.493,8.968,0.0002000000000000668
KER-2,6/26/2025,10:50:00 am,0,2025-06-26 10:50:00,8.4903,8.97,0.0002000000000000668
KER-2,6/26/2025,11:00:00 am,0,2025-06-26 11:00:00,8.4865,8.968,9.999999999994457e-05
KER-2,6/26/2025,11:10:00 am,0,2025-06-26 11:10:00,8.4836,8.969,0.00010000000000012221
KER-2,6/26/2025,11:20:00 am,0,2025-06-26 11:20:00,8.4807,8.97,0.00019999999999988915
KER-2,6/26/2025,11:30:00 am,0,2025-06-26 11:30:00,8.4784,8.972,0.00010000000000012221
KER-2,6/26/2025,11:40:00 am,0,2025-06-26 11:40:00,8.4757,8.973,0.00019999999999988915
KER-2,6/26/2025,11:50:00 am,0,2025-06-26 11:50:00,8.4724,8.975,0.00010000000000012221
KER-2,6/26/2025,12:00:00 pm,0,2025-06-26 12:00:00,8.4701,8.976,9.999999999994457e-05
KER-2,6/26/2025,12:10:00 pm,0,2025-06-26 12:10:00,8.4687,8.977,0.0
KER-2,6/26/2025,12:20:00 pm,0,2025-06-26 12:20:00,8.4663,8.977,0.0
KER-2,6/26/2025,12:30:00 pm,0,2025-06-26 12:30:00,8.4623,8.977,9.999999999994457e-05
KER-2,6/26/2025,12:40:00 pm,0,2025-06-26 12:40:00,8.4601,8.976,0.00019999999999988915
KER-2,6/26/2025,12:50:00 pm,0,2025-06-26 12:50:00,8.4573,8.978,9.999999999994457e-05
KER-2,6/26/2025,01:00:00 pm,0,2025-06-26 13:00:00,8.4545,8.979,9.999999999994457e-05
KER-2,6/26/2025,01:10:00 pm,0,2025-06-26 13:10:00,8.4529,8.978,0.00039999999999995595
KER-2,6/26/2025,01:20:00 pm,0,2025-06-26 13:20:00,8.4518,8.982,9.999999999994457e-05
KER-2,6/26/2025,01:30:00 pm,0,2025-06-26 13:30:00,8.4504,8.981,0.00030000000000001136
KER-2,6/26/2025,01:40:00 pm,0,2025-06-26 13:40:00,8.4496,8.984,0.00039999999999995595
KER-2,6/26/2025,01:50:00 pm,0,2025-06-26 13:50:00,8.449,8.98,0.00030000000000001136
KER-2,6/26/2025,02:00:00 pm,0,2025-06-26 14:00:00,8.4466,8.983,0.0002000000000000668
KER-2,6/26/2025,02:10:00 pm,0,2025-06-26 14:10:00,8.4455,8.981,0.0002000000000000668
KER-2,6/26/2025,02:20:00 pm,0,2025-06-26 14:20:00,8.4448,8.983,0.00010000000000012221
KER-2,6/26/2025,02:30:00 pm,0,2025-06-26 14:30:00,8.4444,8.982,0.0002000000000000668
KER-2,6/26/2025,02:40:00 pm,0,2025-06-26 14:40:00,8.4437,8.984,9.999999999994457e-05
KER-2,6/26/2025,02:50:00 pm,0,2025-06-26 14:50:00,8.4422,8.983,0.00010000000000012221
KER-2,6/26/2025,03:00:00 pm,0,2025-06-26 15:00:00,8.442,8.982,0.00010000000000012221
KER-2,6/26/2025,03:10:00 pm,0,2025-06-26 15:10:00,8.4412,8.983,0.0
KER-2,6/26/2025,03:20:00 pm,0,2025-06-26 15:20:00,8.4408,8.983,0.00010000000000012221
KER-2,6/26/2025,03:30:00 pm,0,2025-06-26 15:30:00,8.44,8.982,0.0002000000000000668
KER-2,6/26/2025,03:40:00 pm,0,2025-06-26 15:40:00,8.4393,8.984,0.0
KER-2,6/26/2025,03:50:00 pm,0,2025-06-26 15:50:00,8.4389,8.984,0.0
KER-2,6/26/2025,04:00:00 pm,0,2025-06-26 16:00:00,8.4385,8.984,9.999999999994457e-05
KER-2,6/26/2025,04:10:00 pm,0,2025-06-26 16:10:00,8.4384,8.985,0.00019999999999988915
KER-2,6/26/2025,04:20:00 pm,0,2025-06-26 16:20:00,8.4383,8.983,0.0002000000000000668
KER-2,6/26/2025,04:30:00 pm,0,2025-06-26 16:30:00,8.4376,8.981,9.999999999994457e-05
KER-2,6/26/2025,04:40:00 pm,0,2025-06-26 16:40:00,8.4377,8.98,0.00019999999999988915
KER-2,6/26/2025,04:50:00 pm,0,2025-06-26 16:50:00,8.4376,8.982,0.0
KER-2,6/26/2025,05:00:00 pm,0,2025-06-26 17:00:00,8.4374,8.982,0.0002000000000000668
KER-2,6/26/2025,05:10:00 pm,0,2025-06-26 17:10:00,8.4375,8.984,0.0002000000000000668
KER-2,6/26/2025,05:20:00 pm,0,2025-06-26 17:20:00,8.4373,8.982,0.00010000000000012221
KER-2,6/26/2025,05:30:00 pm,0,2025-06-26 17:30:00,8.4375,8.983,0.0002000000000000668
KER-2,6/26/2025,05:40:00 pm,0,2025-06-26 17:40:00,8.4376,8.981,0.0
KER-2,6/26/2025,05:50:00 pm,0,2025-06-26 17:50:00,8.4376,8.981,0.0
KER-2,6/26/2025,06:00:00 pm,0,2025-06-26 18:00:00,8.4382,8.981,9.999999999994457e-05
KER-2,6/26/2025,06:10:00 pm,0,2025-06-26 18:10:00,8.4386,8.98,0.0
KER-2,6/26/2025,06:20:00 pm,0,2025-06-26 18:20:00,8.439,8.98,0.0
KER-2,6/26/2025,06:30:00 pm,0,2025-06-26 18:30:00,8.4394,8.98,0.00010000000000012221
KER-2,6/26/2025,06:40:00 pm,0,2025-06-26 18:40:00,8.4404,8.979,0.00019999999999988915
KER-2,6/26/2025,06:50:00 pm,0,2025-06-26 18:50:00,8.4419,8.977,9.999999999994457e-05
KER-2,6/26/2025,07:00:00 pm,0,2025-06-26 19:00:00,8.4433,8.976,9.999999999994457e-05
KER-2,6/26/2025,07:10:00 pm,0,2025-06-26 19:10:00,8.4454,8.977,9.999999999994457e-05
KER-2,6/26/2025,07:20:00 pm,0,2025-06-26 19:20:00,8.4472,8.978,9.999999999994457e-05
KER-2,6/26/2025,07:30:00 pm,0,2025-06-26 19:30:00,8.4492,8.977,0.0
KER-2,6/26/2025,07:40:00 pm,0,2025-06-26 19:40:00,8.4511,8.977,0.0002000000000000668
KER-2,6/26/2025,07:50:00 pm,0,2025-06-26 19:50:00,8.4524,8.975,9.999999999994457e-05
KER-2,6/26/2025,08:00:00 pm,0,2025-06-26 20:00:00,8.4545,8.974,0.0002000000000000668
KER-2,6/26/2025,08:10:00 pm,0,2025-06-26 20:10:00,8.4569,8.976,0.00030000000000001136
KER-2,6/26/2025,08:20:00 pm,0,2025-06-26 20:20:00,8.4584,8.973,9.999999999994457e-05
KER-2,6/26/2025,08:30:00 pm,0,2025-06-26 20:30:00,8.4602,8.974,0.0002000000000000668
KER-2,6/26/2025,08:40:00 pm,0,2025-06-26 20:40:00,8.4622,8.972,9.999999999994457e-05
KER-2,6/26/2025,08:50:00 pm,0,2025-06-26 20:50:00,8.4644,8.971,0.0
KER-2,6/26/2025,09:00:00 pm,0,2025-06-26 21:00:00,8.4672,8.971,9.999999999994457e-05
KER-2,6/26/2025,09:10:00 pm,0,2025-06-26 21:10:00,8.468,8.97,0.00030000000000001136
KER-2,6/26/2025,09:20:00 pm,0,2025-06-26 21:20:00,8.4703,8.973,0.0004000000000001336
KER-2,6/26/2025,09:30:00 pm,0,2025-06-26 21:30:00,8.4723,8.969,0.00030000000000001136
KER-2,6/26/2025,09:40:00 pm,0,2025-06-26 21:40:00,8.4741,8.972,9.999999999994457e-05
KER-2,6/26/2025,09:50:00 pm,0,2025-06-26 21:50:00,8.4756,8.971,0.0
KER-2,6/26/2025,10:00:00 pm,0,2025-06-26 22:00:00,8.4768,8.971,9.999999999994457e-05
KER-2,6/26/2025,10:10:00 pm,0,2025-06-26 22:10:00,8.4774,8.972,0.00030000000000001136
KER-2,6/26/2025,10:20:00 pm,0,2025-06-26 22:20:00,8.4786,8.969,0.00010000000000012221
KER-2,6/26/2025,10:30:00 pm,0,2025-06-26 22:30:00,8.4798,8.97,0.0
KER-2,6/26/2025,10:40:00 pm,0,2025-06-26 22:40:00,8.4805,8.97,0.0002000000000000668
KER-2,6/26/2025,10:50:00 pm,0,2025-06-26 22:50:00,8.4812,8.968,9.999999999994457e-05
KER-2,6/26/2025,11:00:00 pm,0,2025-06-26 23:00:00,8.4814,8.969,9.999999999994457e-05
KER-2,6/26/2025,11:10:00 pm,0,2025-06-26 23:10:00,8.4828,8.968,9.999999999994457e-05
KER-2,6/26/2025,11:20:00 pm,0,2025-06-26 23:20:00,8.4829,8.969,9.999999999994457e-05
KER-2,6/26/2025,11:30:00 pm,0,2025-06-26 23:30:00,8.4842,8.968,9.999999999994457e-05
KER-2,6/26/2025,11:40:00 pm,0,2025-06-26 23:40:00,8.4855,8.967,0.00019999999999988915
KER-2,6/26/2025,11:50:00 pm,0,2025-06-26 23:50:00,8.4865,8.969,9.999999999994457e-05
KER-2,6/27/2025,12:00:00 am,0,2025-06-27 00:00:00,8.4872,8.968,9.999999999994457e-05
KER-2,6/27/2025,12:10:00 am,0,2025-06-27 00:10:00,8.4881,8.969,0.00019999999999988915
KER-2,6/27/2025,12:20:00 am,0,2025-06-27 00:20:00,8.4895,8.967,9.999999999994457e-05
KER-2,6/27/2025,12:30:00 am,0,2025-06-27 00:30:00,8.4903,8.968,0.0
KER-2,6/27/2025,12:40:00 am,0,2025-06-27 00:40:00,8.4903,8.968,0.0
KER-2,6/27/2025,12:50:00 am,0,2025-06-27 00:50:00,8.4907,8.968,9.999999999994457e-05
KER-2,6/27/2025,01:00:00 am,0,2025-06-27 01:00:00,8.491,8.967,9.999999999994457e-05
KER-2,6/27/2025,01:10:00 am,0,2025-06-27 01:10:00,8.4917,8.968,9.999999999994457e-05
KER-2,6/27/2025,01:20:00 am,0,2025-06-27 01:20:00,8.4926,8.969,0.00019999999999988915
KER-2,6/27/2025,01:30:00 am,0,2025-06-27 01:30:00,8.493,8.967,0.0
KER-2,6/27/2025,01:40:00 am,0,2025-06-27 01:40:00,8.4933,8.967,0.0
KER-2,6/27/2025,01:50:00 am,0,2025-06-27 01:50:00,8.4935,8.967,0.0
KER-2,6/27/2025,02:00:00 am,0,2025-06-27 02:00:00,8.4938,8.967,0.00019999999999988915
KER-2,6/27/2025,02:10:00 am,0,2025-06-27 02:10:00,8.4941,8.969,9.999999999994457e-05
KER-2,6/27/2025,02:20:00 am,0,2025-06-27 02:20:00,8.494,8.968,0.0002000000000000668
KER-2,6/27/2025,02:30:00 am,0,2025-06-27 02:30:00,8.4941,8.966,0.0
KER-2,6/27/2025,02:40:00 am,0,2025-06-27 02:40:00,8.4941,8.966,0.00010000000000012221
KER-2,6/27/2025,02:50:00 am,0,2025-06-27 02:50:00,8.4945,8.967,9.999999999994457e-05
KER-2,6/27/2025,03:00:00 am,0,2025-06-27 03:00:00,8.4948,8.968,9.999999999994457e-05
KER-2,6/27/2025,03:10:00 am,0,2025-06-27 03:10:00,8.4955,8.967,0.0
KER-2,6/27/2025,03:20:00 am,0,2025-06-27 03:20:00,8.496,8.967,0.00010000000000012221
KER-2,6/27/2025,03:30:00 am,0,2025-06-27 03:30:00,8.4958,8.966,0.0002000000000000668
KER-2,6/27/2025,03:40:00 am,0,2025-06-27 03:40:00,8.4964,8.968,9.999999999994457e-05
KER-2,6/27/2025,03:50:00 am,0,2025-06-27 03:50:00,8.4964,8.967,0.00019999999999988915
KER-2,6/27/2025,04:00:00 am,0,2025-06-27 04:00:00,8.4963,8.969,0.00019999999999988915
KER-2,6/27/2025,04:10:00 am,0,2025-06-27 04:10:00,8.4962,8.967,0.00019999999999988915
KER-2,6/27/2025,04:20:00 am,0,2025-06-27 04:20:00,8.4963,8.969,9.999999999994457e-05
KER-2,6/27/2025,04:30:00 am,0,2025-06-27 04:30:00,8.4964,8.968,0.0
KER-2,6/27/2025,04:40:00 am,0,2025-06-27 04:40:00,8.4969,8.968,9.999999999994457e-05
KER-2,6/27/2025,04:50:00 am,0,2025-06-27 04:50:00,8.4975,8.969,9.999999999994457e-05
KER-2,6/27/2025,05:00:00 am,0,2025-06-27 05:00:00,8.4981,8.968,0.0
KER-2,6/27/2025,05:10:00 am,0,2025-06-27 05:10:00,8.4999,8.968,9.999999999994457e-05
KER-2,6/27/2025,05:20:00 am,0,2025-06-27 05:20:00,8.5001,8.969,0.00010000000000012221
KER-2,6/27/2025,05:30:00 am,0,2025-06-27 05:30:00,8.501,8.97,0.00010000000000012221
KER-2,6/27/2025,05:40:00 am,0,2025-06-27 05:40:00,8.5019,8.969,9.999999999994457e-05
KER-2,6/27/2025,05:50:00 am,0,2025-06-27 05:50:00,8.503,8.968,9.999999999994457e-05
KER-2,6/27/2025,06:00:00 am,0,2025-06-27 06:00:00,8.5042,8.967,0.00019999999999988915
KER-2,6/27/2025,06:10:00 am,0,2025-06-27 06:10:00,8.5051,8.969,0.0
KER-2,6/27/2025,06:20:00 am,0,2025-06-27 06:20:00,8.5054,8.969,0.00010000000000012221
KER-2,6/27/2025,06:30:00 am,0,2025-06-27 06:30:00,8.5054,8.97,0.0
KER-2,6/27/2025,06:40:00 am,0,2025-06-27 06:40:00,8.506,8.97,0.00019999999999988915
KER-2,6/27/2025,06:50:00 am,0,2025-06-27 06:50:00,8.5065,8.972,9.999999999994457e-05
KER-2,6/27/2025,07:00:00 am,0,2025-06-27 07:00:00,8.5066,8.971,0.0
KER-2,6/27/2025,07:10:00 am,0,2025-06-27 07:10:00,8.5072,8.971,0.0002000000000000668
KER-2,6/27/2025,07:20:00 am,0,2025-06-27 07:20:00,8.5075,8.969,0.0002000000000000668
KER-2,6/27/2025,07:30:00 am,0,2025-06-27 07:30:00,8.5078,8.971,0.0
KER-2,6/27/2025,07:40:00 am,0,2025-06-27 07:40:00,8.5089,8.971,0.0
KER-2,6/27/2025,07:50:00 am,0,2025-06-27 07:50:00,8.509,8.971,0.0002000000000000668
KER-2,6/27/2025,08:00:00 am,0,2025-06-27 08:00:00,8.5093,8.969,0.00030000000000001136
KER-2,6/27/2025,08:10:00 am,0,2025-06-27 08:10:00,8.5098,8.972,0.0002000000000000668
KER-2,6/27/2025,08:20:00 am,0,2025-06-27 08:20:00,8.5104,8.974,9.999999999994457e-05
KER-2,6/27/2025,08:30:00 am,0,2025-06-27 08:30:00,8.5103,8.973,0.0
KER-2,6/27/2025,08:40:00 am,0,2025-06-27 08:40:00,8.5099,8.973,0.0
KER-2,6/27/2025,08:50:00 am,0,2025-06-27 08:50:00,8.5098,8.973,0.00010000000000012221
KER-2,6/27/2025,09:00:00 am,0,2025-06-27 09:00:00,8.5097,8.972,0.0004000000000001336
KER-2,6/27/2025,09:10:00 am,0,2025-06-27 09:10:00,8.5089,8.976,0.00010000000000012221
KER-2,6/27/2025,09:20:00 am,0,2025-06-27 09:20:00,8.5082,8.975,0.00010000000000012221
KER-2,6/27/2025,09:30:00 am,0,2025-06-27 09:30:00,8.5076,8.976,0.0
KER-2,6/27/2025,09:40:00 am,0,2025-06-27 09:40:00,8.5062,8.976,9.999999999994457e-05
KER-2,6/27/2025,09:50:00 am,0,2025-06-27 09:50:00,8.504,8.977,9.999999999994457e-05
KER-2,6/27/2025,10:00:00 am,0,2025-06-27 10:00:00,8.5011,8.976,0.00039999999999995595
KER-2,6/27/2025,10:10:00 am,0,2025-06-27 10:10:00,8.4972,8.98,0.00010000000000012221
KER-2,6/27/2025,10:20:00 am,0,2025-06-27 10:20:00,8.4952,8.979,0.0
KER-2,6/27/2025,10:30:00 am,0,2025-06-27 10:30:00,8.4927,8.979,0.00030000000000001136
KER-2,6/27/2025,10:40:00 am,0,2025-06-27 10:40:00,8.4896,8.982,0.00010000000000012221
KER-2,6/27/2025,10:50:00 am,0,2025-06-27 10:50:00,8.4872,8.983,0.0
KER-2,6/27/2025,11:00:00 am,0,2025-06-27 11:00:00,8.4841,8.983,9.999999999994457e-05
KER-2,6/27/2025,11:10:00 am,0,2025-06-27 11:10:00,8.4812,8.984,0.0
KER-2,6/27/2025,11:20:00 am,0,2025-06-27 11:20:00,8.4788,8.984,0.00030000000000001136
KER-2,6/27/2025,11:30:00 am,0,2025-06-27 11:30:00,8.4751,8.987,9.999999999994457e-05
KER-2,6/27/2025,11:40:00 am,0,2025-06-27 11:40:00,8.472,8.986,9.999999999994457e-05
KER-2,6/27/2025,11:50:00 am,0,2025-06-27 11:50:00,8.4698,8.987,0.0002000000000000668
KER-2,6/27/2025,12:00:00 pm,0,2025-06-27 12:00:00,8.468,8.989,9.999999999994457e-05
KER-2,6/27/2025,12:10:00 pm,0,2025-06-27 12:10:00,8.466,8.99,0.0002000000000000668
KER-2,6/27/2025,12:20:00 pm,0,2025-06-27 12:20:00,8.4638,8.992,0.00019999999999988915
KER-2,6/27/2025,12:30:00 pm,0,2025-06-27 12:30:00,8.4618,8.994,0.00019999999999988915
KER-2,6/27/2025,12:40:00 pm,0,2025-06-27 12:40:00,8.4598,8.992,9.999999999994457e-05
KER-2,6/27/2025,12:50:00 pm,0,2025-06-27 12:50:00,8.4576,8.993,9.999999999994457e-05
KER-2,6/27/2025,01:00:00 pm,0,2025-06-27 13:00:00,8.453,8.994,9.999999999994457e-05
KER-2,6/27/2025,01:10:00 pm,0,2025-06-27 13:10:00,8.4487,8.995,0.0
KER-2,6/27/2025,01:20:00 pm,0,2025-06-27 13:20:00,8.4473,8.995,0.0002000000000000668
KER-2,6/27/2025,01:30:00 pm,0,2025-06-27 13:30:00,8.4462,8.997,9.999999999994457e-05
KER-2,6/27/2025,01:40:00 pm,0,2025-06-27 13:40:00,8.4458,8.996,0.00019999999999988915
KER-2,6/27/2025,01:50:00 pm,0,2025-06-27 13:50:00,8.4446,8.998,0.00010000000000012221
KER-2,6/27/2025,02:00:00 pm,0,2025-06-27 14:00:00,8.4437,8.999,0.00019999999999988915
KER-2,6/27/2025,02:10:00 pm,0,2025-06-27 14:10:00,8.443,9.001,0.00030000000000001136
KER-2,6/27/2025,02:20:00 pm,0,2025-06-27 14:20:00,8.4423,8.998,0.0
KER-2,6/27/2025,02:30:00 pm,0,2025-06-27 14:30:00,8.4414,8.998,0.00010000000000012221
KER-2,6/27/2025,02:40:00 pm,0,2025-06-27 14:40:00,8.4407,8.999,9.999999999994457e-05
KER-2,6/27/2025,02:50:00 pm,0,2025-06-27 14:50:00,8.4398,9.0,0.0002000000000000668
KER-2,6/27/2025,03:00:00 pm,0,2025-06-27 15:00:00,8.4395,8.998,0.0002000000000000668
KER-2,6/27/2025,03:10:00 pm,0,2025-06-27 15:10:00,8.4392,9.0,9.999999999994457e-05
KER-2,6/27/2025,03:20:00 pm,0,2025-06-27 15:20:00,8.439,9.001,0.00019999999999988915
KER-2,6/27/2025,03:30:00 pm,0,2025-06-27 15:30:00,8.4382,8.999,9.999999999994457e-05
KER-2,6/27/2025,03:40:00 pm,0,2025-06-27 15:40:00,8.4376,9.0,9.999999999994457e-05
KER-2,6/27/2025,03:50:00 pm,0,2025-06-27 15:50:00,8.4372,9.001,0.0
KER-2,6/27/2025,04:00:00 pm,0,2025-06-27 16:00:00,8.437,9.001,0.0
KER-2,6/27/2025,04:10:00 pm,0,2025-06-27 16:10:00,8.437,9.001,0.00019999999999988915
KER-2,6/27/2025,04:20:00 pm,0,2025-06-27 16:20:00,8.437,8.999,0.0
KER-2,6/27/2025,04:30:00 pm,0,2025-06-27 16:30:00,8.4372,8.999,0.00010000000000012221
KER-2,6/27/2025,04:40:00 pm,0,2025-06-27 16:40:00,8.4373,8.998,0.00010000000000012221
KER-2,6/27/2025,04:50:00 pm,0,2025-06-27 16:50:00,8.4368,8.999,9.999999999994457e-05
KER-2,6/27/2025,05:00:00 pm,0,2025-06-27 17:00:00,8.4366,9.0,0.0002000000000000668
KER-2,6/27/2025,05:10:00 pm,0,2025-06-27 17:10:00,8.4368,8.998,0.0
KER-2,6/27/2025,05:20:00 pm,0,2025-06-27 17:20:00,8.4367,8.998,0.00010000000000012221
KER-2,6/27/2025,05:30:00 pm,0,2025-06-27 17:30:00,8.4371,8.999,0.00010000000000012221
KER-2,6/27/2025,05:40:00 pm,0,2025-06-27 17:40:00,8.4374,8.998,0.0
KER-2,6/27/2025,05:50:00 pm,0,2025-06-27 17:50:00,8.4377,8.998,0.00019999999999988915
KER-2,6/27/2025,06:00:00 pm,0,2025-06-27 18:00:00,8.4385,8.996,9.999999999994457e-05
KER-2,6/27/2025,06:10:00 pm,0,2025-06-27 18:10:00,8.439,8.997,0.0002000000000000668
KER-2,6/27/2025,06:20:00 pm,0,2025-06-27 18:20:00,8.4398,8.995,0.00030000000000001136
KER-2,6/27/2025,06:30:00 pm,0,2025-06-27 18:30:00,8.4412,8.998,0.00019999999999988915
KER-2,6/27/2025,06:40:00 pm,0,2025-06-27 18:40:00,8.4425,8.996,0.00010000000000012221
KER-2,6/27/2025,06:50:00 pm,0,2025-06-27 18:50:00,8.4436,8.995,9.999999999994457e-05
KER-2,6/27/2025,07:00:00 pm,0,2025-06-27 19:00:00,8.4458,8.994,0.0
KER-2,6/27/2025,07:10:00 pm,0,2025-06-27 19:10:00,8.4481,8.994,9.999999999994457e-05
KER-2,6/27/2025,07:20:00 pm,0,2025-06-27 19:20:00,8.4499,8.993,0.0002000000000000668
KER-2,6/27/2025,07:30:00 pm,0,2025-06-27 19:30:00,8.4521,8.991,0.0
KER-2,6/27/2025,07:40:00 pm,0,2025-06-27 19:40:00,8.4542,8.991,0.00010000000000012221
KER-2,6/27/2025,07:50:00 pm,0,2025-06-27 19:50:00,8.4556,8.992,0.0002000000000000668
KER-2,6/27/2025,08:00:00 pm,0,2025-06-27 20:00:00,8.4576,8.99,0.0
KER-2,6/27/2025,08:10:00 pm,0,2025-06-27 20:10:00,8.4592,8.99,9.999999999994457e-05
KER-2,6/27/2025,08:20:00 pm,0,2025-06-27 20:20:00,8.4615,8.989,0.00019999999999988915
KER-2,6/27/2025,08:30:00 pm,0,2025-06-27 20:30:00,8.4643,8.991,0.00039999999999995595
KER-2,6/27/2025,08:40:00 pm,0,2025-06-27 20:40:00,8.4651,8.987,0.0002000000000000668
KER-2,6/27/2025,08:50:00 pm,0,2025-06-27 20:50:00,8.4673,8.989,0.00010000000000012221
KER-2,6/27/2025,09:00:00 pm,0,2025-06-27 21:00:00,8.4705,8.988,0.0
KER-2,6/27/2025,09:10:00 pm,0,2025-06-27 21:10:00,8.4744,8.988,9.999999999994457e-05
KER-2,6/27/2025,09:20:00 pm,0,2025-06-27 21:20:00,8.4759,8.987,0.0002000000000000668
KER-2,6/27/2025,09:30:00 pm,0,2025-06-27 21:30:00,8.4778,8.989,0.00010000000000012221
KER-2,6/27/2025,09:40:00 pm,0,2025-06-27 21:40:00,8.48,8.988,9.999999999994457e-05
KER-2,6/27/2025,09:50:00 pm,0,2025-06-27 21:50:00,8.4818,8.987,0.0
KER-2,6/27/2025,10:00:00 pm,0,2025-06-27 22:00:00,8.4835,8.987,9.999999999994457e-05
KER-2,6/27/2025,10:10:00 pm,0,2025-06-27 22:10:00,8.485,8.986,0.0002000000000000668
KER-2,6/27/2025,10:20:00 pm,0,2025-06-27 22:20:00,8.4861,8.984,0.0
KER-2,6/27/2025,10:30:00 pm,0,2025-06-27 22:30:00,8.4864,8.984,9.999999999994457e-05
KER-2,6/27/2025,10:40:00 pm,0,2025-06-27 22:40:00,8.4874,8.985,9.999999999994457e-05
KER-2,6/27/2025,10:50:00 pm,0,2025-06-27 22:50:00,8.4886,8.984,0.0
KER-2,6/27/2025,11:00:00 pm,0,2025-06-27 23:00:00,8.4898,8.984,0.00030000000000001136
KER-2,6/27/2025,11:10:00 pm,0,2025-06-27 23:10:00,8.4911,8.987,0.0002000000000000668
KER-2,6/27/2025,11:20:00 pm,0,2025-06-27 23:20:00,8.4915,8.985,0.00019999999999988915
KER-2,6/27/2025,11:30:00 pm,0,2025-06-27 23:30:00,8.4921,8.983,0.00019999999999988915
KER-2,6/27/2025,11:40:00 pm,0,2025-06-27 23:40:00,8.4925,8.985,9.999999999994457e-05
KER-2,6/27/2025,11:50:00 pm,0,2025-06-27 23:50:00,8.4929,8.984,0.0002000000000000668
KER-2,6/28/2025,12:00:00 am,0,2025-06-28 00:00:00,8.4941,8.986,0.0002000000000000668
KER-2,6/28/2025,12:10:00 am,0,2025-06-28 00:10:00,8.4947,8.984,0.0
KER-2,6/28/2025,12:20:00 am,0,2025-06-28 00:20:00,8.4957,8.984,0.0002000000000000668
KER-2,6/28/2025,12:30:00 am,0,2025-06-28 00:30:00,8.4956,8.986,0.00010000000000012221
KER-2,6/28/2025,12:40:00 am,0,2025-06-28 00:40:00,8.4961,8.985,9.999999999994457e-05
KER-2,6/28/2025,12:50:00 am,0,2025-06-28 00:50:00,8.4966,8.984,9.999999999994457e-05
KER-2,6/28/2025,01:00:00 am,0,2025-06-28 01:00:00,8.4975,8.983,9.999999999994457e-05
KER-2,6/28/2025,01:10:00 am,0,2025-06-28 01:10:00,8.4982,8.984,9.999999999994457e-05
KER-2,6/28/2025,01:20:00 am,0,2025-06-28 01:20:00,8.4992,8.985,9.999999999994457e-05
KER-2,6/28/2025,01:30:00 am,0,2025-06-28 01:30:00,8.5001,8.984,0.0
KER-2,6/28/2025,01:40:00 am,0,2025-06-28 01:40:00,8.5005,8.984,0.0
KER-2,6/28/2025,01:50:00 am,0,2025-06-28 01:50:00,8.5006,8.984,9.999999999994457e-05
KER-2,6/28/2025,02:00:00 am,0,2025-06-28 02:00:00,8.5011,8.985,0.0
KER-2,6/28/2025,02:10:00 am,0,2025-06-28 02:10:00,8.5016,8.985,0.00010000000000012221
KER-2,6/28/2025,02:20:00 am,0,2025-06-28 02:20:00,8.5025,8.986,0.00010000000000012221
KER-2,6/28/2025,02:30:00 am,0,2025-06-28 02:30:00,8.5027,8.985,0.00010000000000012221
KER-2,6/28/2025,02:40:00 am,0,2025-06-28 02:40:00,8.5034,8.986,0.00010000000000012221
KER-2,6/28/2025,02:50:00 am,0,2025-06-28 02:50:00,8.504,8.985,0.00010000000000012221
KER-2,6/28/2025,03:00:00 am,0,2025-06-28 03:00:00,8.5048,8.986,0.00010000000000012221
KER-2,6/28/2025,03:10:00 am,0,2025-06-28 03:10:00,8.506,8.985,0.00010000000000012221
KER-2,6/28/2025,03:20:00 am,0,2025-06-28 03:20:00,8.5073,8.986,0.00010000000000012221
KER-2,6/28/2025,03:30:00 am,0,2025-06-28 03:30:00,8.5073,8.985,0.0002000000000000668
KER-2,6/28/2025,03:40:00 am,0,2025-06-28 03:40:00,8.5076,8.987,0.0002000000000000668
KER-2,6/28/2025,03:50:00 am,0,2025-06-28 03:50:00,8.5081,8.985,0.00010000000000012221
KER-2,6/28/2025,04:00:00 am,0,2025-06-28 04:00:00,8.5086,8.986,0.00010000000000012221
KER-2,6/28/2025,04:10:00 am,0,2025-06-28 04:10:00,8.5094,8.985,0.00030000000000001136
KER-2,6/28/2025,04:20:00 am,0,2025-06-28 04:20:00,8.5107,8.988,0.00019999999999988915
KER-2,6/28/2025,04:30:00 am,0,2025-06-28 04:30:00,8.5117,8.986,9.999999999994457e-05
KER-2,6/28/2025,04:40:00 am,0,2025-06-28 04:40:00,8.5124,8.987,9.999999999994457e-05
KER-2,6/28/2025,04:50:00 am,0,2025-06-28 04:50:00,8.5132,8.986,9.999999999994457e-05
KER-2,6/28/2025,05:00:00 am,0,2025-06-28 05:00:00,8.5138,8.987,9.999999999994457e-05
KER-2,6/28/2025,05:10:00 am,0,2025-06-28 05:10:00,8.5154,8.986,0.0
KER-2,6/28/2025,05:20:00 am,0,2025-06-28 05:20:00,8.5158,8.986,0.00030000000000001136
KER-2,6/28/2025,05:30:00 am,0,2025-06-28 05:30:00,8.5169,8.989,9.999999999994457e-05
KER-2,6/28/2025,05:40:00 am,0,2025-06-28 05:40:00,8.5172,8.99,0.0005000000000000782
KER-2,6/28/2025,05:50:00 am,0,2025-06-28 05:50:00,8.5185,8.985,0.0004000000000001336
KER-2,6/28/2025,06:00:00 am,0,2025-06-28 06:00:00,8.5194,8.989,0.0002000000000000668
KER-2,6/28/2025,06:10:00 am,0,2025-06-28 06:10:00,8.5207,8.987,0.0
KER-2,6/28/2025,06:20:00 am,0,2025-06-28 06:20:00,8.5214,8.987,0.00030000000000001136
KER-2,6/28/2025,06:30:00 am,0,2025-06-28 06:30:00,8.5223,8.99,0.0002000000000000668
KER-2,6/28/2025,06:40:00 am,0,2025-06-28 06:40:00,8.5223,8.988,0.00030000000000001136
KER-2,6/28/2025,06:50:00 am,0,2025-06-28 06:50:00,8.523,8.991,0.00030000000000001136
KER-2,6/28/2025,07:00:00 am,0,2025-06-28 07:00:00,8.5234,8.988,0.00010000000000012221
KER-2,6/28/2025,07:10:00 am,0,2025-06-28 07:10:00,8.5236,8.989,0.0
KER-2,6/28/2025,07:20:00 am,0,2025-06-28 07:20:00,8.5244,8.989,9.999999999994457e-05
KER-2,6/28/2025,07:30:00 am,0,2025-06-28 07:30:00,8.5248,8.99,0.0002000000000000668
KER-2,6/28/2025,07:40:00 am,0,2025-06-28 07:40:00,8.5255,8.992,0.00010000000000012221
KER-2,6/28/2025,07:50:00 am,0,2025-06-28 07:50:00,8.5261,8.991,0.0
KER-2,6/28/2025,08:00:00 am,0,2025-06-28 08:00:00,8.5268,8.991,0.00010000000000012221
KER-2,6/28/2025,08:10:00 am,0,2025-06-28 08:10:00,8.527,8.992,9.999999999994457e-05
KER-2,6/28/2025,08:20:00 am,0,2025-06-28 08:20:00,8.5278,8.993,0.0
KER-2,6/28/2025,08:30:00 am,0,2025-06-28 08:30:00,8.5279,8.993,0.0002000000000000668
KER-2,6/28/2025,08:40:00 am,0,2025-06-28 08:40:00,8.5277,8.991,0.0002000000000000668
KER-2,6/28/2025,08:50:00 am,0,2025-06-28 08:50:00,8.527,8.993,0.0
KER-2,6/28/2025,09:00:00 am,0,2025-06-28 09:00:00,8.5254,8.993,9.999999999994457e-05
KER-2,6/28/2025,09:10:00 am,0,2025-06-28 09:10:00,8.5234,8.994,0.0002000000000000668
KER-2,6/28/2025,09:20:00 am,0,2025-06-28 09:20:00,8.5212,8.996,9.999999999994457e-05
KER-2,6/28/2025,09:30:00 am,0,2025-06-28 09:30:00,8.5183,8.997,9.999999999994457e-05
KER-2,6/28/2025,09:40:00 am,0,2025-06-28 09:40:00,8.5155,8.996,0.00019999999999988915
KER-2,6/28/2025,09:50:00 am,0,2025-06-28 09:50:00,8.5124,8.998,0.0002000000000000668
KER-2,6/28/2025,10:00:00 am,0,2025-06-28 10:00:00,8.5096,9.0,9.999999999994457e-05
KER-2,6/28/2025,10:10:00 am,0,2025-06-28 10:10:00,8.5062,8.999,9.999999999994457e-05
KER-2,6/28/2025,10:20:00 am,0,2025-06-28 10:20:00,8.5037,9.0,9.999999999994457e-05
KER-2,6/28/2025,10:30:00 am,0,2025-06-28 10:30:00,8.5011,9.001,0.0
KER-2,6/28/2025,10:40:00 am,0,2025-06-28 10:40:00,8.4987,9.001,0.00030000000000001136
KER-2,6/28/2025,10:50:00 am,0,2025-06-28 10:50:00,8.496,9.004,9.999999999994457e-05
KER-2,6/28/2025,11:00:00 am,0,2025-06-28 11:00:00,8.493,9.003,0.0002000000000000668
KER-2,6/28/2025,11:10:00 am,0,2025-06-28 11:10:00,8.4898,9.005,0.00019999999999988915
KER-2,6/28/2025,11:20:00 am,0,2025-06-28 11:20:00,8.4867,9.007,0.0
KER-2,6/28/2025,11:30:00 am,0,2025-06-28 11:30:00,8.4833,9.007,0.0002000000000000668
KER-2,6/28/2025,11:40:00 am,0,2025-06-28 11:40:00,8.4807,9.009,9.999999999994457e-05
KER-2,6/28/2025,11:50:00 am,0,2025-06-28 11:50:00,8.4781,9.01,9.999999999994457e-05
KER-2,6/28/2025,12:00:00 pm,0,2025-06-28 12:00:00,8.4758,9.011,0.0
KER-2,6/28/2025,12:10:00 pm,0,2025-06-28 12:10:00,8.4726,9.011,0.00030000000000001136
KER-2,6/28/2025,12:20:00 pm,0,2025-06-28 12:20:00,8.4701,9.014,0.00010000000000012221
KER-2,6/28/2025,12:30:00 pm,0,2025-06-28 12:30:00,8.4674,9.015,0.00010000000000012221
KER-2,6/28/2025,12:40:00 pm,0,2025-06-28 12:40:00,8.465,9.014,0.00030000000000001136
KER-2,6/28/2025,12:50:00 pm,0,2025-06-28 12:50:00,8.4632,9.017,0.00019999999999988915
KER-2,6/28/2025,01:00:00 pm,0,2025-06-28 13:00:00,8.4612,9.015,0.00030000000000001136
KER-2,6/28/2025,01:10:00 pm,0,2025-06-28 13:10:00,8.4592,9.018,9.999999999994457e-05
KER-2,6/28/2025,01:20:00 pm,0,2025-06-28 13:20:00,8.4577,9.019,0.0
KER-2,6/28/2025,01:30:00 pm,0,2025-06-28 13:30:00,8.4559,9.019,0.0
KER-2,6/28/2025,01:40:00 pm,0,2025-06-28 13:40:00,8.4544,9.019,9.999999999994457e-05
KER-2,6/28/2025,01:50:00 pm,0,2025-06-28 13:50:00,8.4532,9.02,0.00030000000000001136
KER-2,6/28/2025,02:00:00 pm,0,2025-06-28 14:00:00,8.4523,9.023,0.00030000000000001136
KER-2,6/28/2025,02:10:00 pm,0,2025-06-28 14:10:00,8.4517,9.02,0.0
KER-2,6/28/2025,02:20:00 pm,0,2025-06-28 14:20:00,8.45,9.02,0.00010000000000012221
KER-2,6/28/2025,02:30:00 pm,0,2025-06-28 14:30:00,8.449,9.021,0.0
KER-2,6/28/2025,02:40:00 pm,0,2025-06-28 14:40:00,8.448,9.021,0.0002999999999998337
KER-2,6/28/2025,02:50:00 pm,0,2025-06-28 14:50:00,8.4476,9.024,9.999999999994457e-05
KER-2,6/28/2025,03:00:00 pm,0,2025-06-28 15:00:00,8.4464,9.023,0.0
KER-2,6/28/2025,03:10:00 pm,0,2025-06-28 15:10:00,8.4458,9.023,9.999999999994457e-05
KER-2,6/28/2025,03:20:00 pm,0,2025-06-28 15:20:00,8.4453,9.024,0.00019999999999988915
KER-2,6/28/2025,03:30:00 pm,0,2025-06-28 15:30:00,8.4447,9.022,9.999999999994457e-05
KER-2,6/28/2025,03:40:00 pm,0,2025-06-28 15:40:00,8.4441,9.023,9.999999999994457e-05
KER-2,6/28/2025,03:50:00 pm,0,2025-06-28 15:50:00,8.4434,9.022,0.00019999999999988915
KER-2,6/28/2025,04:00:00 pm,0,2025-06-28 16:00:00,8.443,9.024,9.999999999994457e-05
KER-2,6/28/2025,04:10:00 pm,0,2025-06-28 16:10:00,8.4424,9.023,9.999999999994457e-05
KER-2,6/28/2025,04:20:00 pm,0,2025-06-28 16:20:00,8.4416,9.022,9.999999999994457e-05
KER-2,6/28/2025,04:30:00 pm,0,2025-06-28 16:30:00,8.4415,9.023,9.999999999994457e-05
KER-2,6/28/2025,04:40:00 pm,0,2025-06-28 16:40:00,8.4409,9.024,9.999999999994457e-05
KER-2,6/28/2025,04:50:00 pm,0,2025-06-28 16:50:00,8.4406,9.023,9.999999999994457e-05
KER-2,6/28/2025,05:00:00 pm,0,2025-06-28 17:00:00,8.4404,9.024,9.999999999994457e-05
KER-2,6/28/2025,05:10:00 pm,0,2025-06-28 17:10:00,8.4402,9.023,9.999999999994457e-05
KER-2,6/28/2025,05:20:00 pm,0,2025-06-28 17:20:00,8.4399,9.022,0.00019999999999988915
KER-2,6/28/2025,05:30:00 pm,0,2025-06-28 17:30:00,8.4402,9.024,0.0002999999999998337
KER-2,6/28/2025,05:40:00 pm,0,2025-06-28 17:40:00,8.4396,9.021,0.00019999999999988915
KER-2,6/28/2025,05:50:00 pm,0,2025-06-28 17:50:00,8.4396,9.023,9.999999999994457e-05
KER-2,6/28/2025,06:00:00 pm,0,2025-06-28 18:00:00,8.44,9.022,0.00030000000000001136
KER-2,6/28/2025,06:10:00 pm,0,2025-06-28 18:10:00,8.4402,9.019,0.00030000000000001136
KER-2,6/28/2025,06:20:00 pm,0,2025-06-28 18:20:00,8.4407,9.022,9.999999999994457e-05
KER-2,6/28/2025,06:30:00 pm,0,2025-06-28 18:30:00,8.4414,9.021,0.00030000000000001136
KER-2,6/28/2025,06:40:00 pm,0,2025-06-28 18:40:00,8.4423,9.018,0.0
KER-2,6/28/2025,06:50:00 pm,0,2025-06-28 18:50:00,8.4435,9.018,0.0
KER-2,6/28/2025,07:00:00 pm,0,2025-06-28 19:00:00,8.4454,9.018,0.00019999999999988915
KER-2,6/28/2025,07:10:00 pm,0,2025-06-28 19:10:00,8.4473,9.02,0.00019999999999988915
KER-2,6/28/2025,07:20:00 pm,0,2025-06-28 19:20:00,8.4487,9.018,0.00010000000000012221
KER-2,6/28/2025,07:30:00 pm,0,2025-06-28 19:30:00,8.4513,9.017,0.0
KER-2,6/28/2025,07:40:00 pm,0,2025-06-28 19:40:00,8.4537,9.017,9.999999999994457e-05
KER-2,6/28/2025,07:50:00 pm,0,2025-06-28 19:50:00,8.456,9.016,9.999999999994457e-05
KER-2,6/28/2025,08:00:00 pm,0,2025-06-28 20:00:00,8.4582,9.015,9.999999999994457e-05
KER-2,6/28/2025,08:10:00 pm,0,2025-06-28 20:10:00,8.46,9.016,0.00030000000000001136
KER-2,6/28/2025,08:20:00 pm,0,2025-06-28 20:20:00,8.4617,9.013,0.0
KER-2,6/28/2025,08:30:00 pm,0,2025-06-28 20:30:00,8.464,9.013,9.999999999994457e-05
KER-2,6/28/2025,08:40:00 pm,0,2025-06-28 20:40:00,8.4669,9.014,9.999999999994457e-05
KER-2,6/28/2025,08:50:00 pm,0,2025-06-28 20:50:00,8.4688,9.013,0.0
KER-2,6/28/2025,09:00:00 pm,0,2025-06-28 21:00:00,8.4713,9.013,0.0
KER-2,6/28/2025,09:10:00 pm,0,2025-06-28 21:10:00,8.4732,9.013,0.0
KER-2,6/28/2025,09:20:00 pm,0,2025-06-28 21:20:00,8.4758,9.013,0.0002000000000000668
KER-2,6/28/2025,09:30:00 pm,0,2025-06-28 21:30:00,8.4773,9.011,0.0002000000000000668
KER-2,6/28/2025,09:40:00 pm,0,2025-06-28 21:40:00,8.4787,9.013,9.999999999994457e-05
KER-2,6/28/2025,09:50:00 pm,0,2025-06-28 21:50:00,8.4796,9.012,9.999999999994457e-05
KER-2,6/28/2025,10:00:00 pm,0,2025-06-28 22:00:00,8.4813,9.013,0.0002000000000000668
KER-2,6/28/2025,10:10:00 pm,0,2025-06-28 22:10:00,8.4827,9.011,0.00010000000000012221
KER-2,6/28/2025,10:20:00 pm,0,2025-06-28 22:20:00,8.4833,9.012,9.999999999994457e-05
KER-2,6/28/2025,10:30:00 pm,0,2025-06-28 22:30:00,8.484,9.013,9.999999999994457e-05
KER-2,6/28/2025,10:40:00 pm,0,2025-06-28 22:40:00,8.4853,9.014,0.0
KER-2,6/28/2025,10:50:00 pm,0,2025-06-28 22:50:00,8.4877,9.014,0.00019999999999988915
KER-2,6/28/2025,11:00:00 pm,0,2025-06-28 23:00:00,8.4877,9.012,0.0
KER-2,6/28/2025,11:10:00 pm,0,2025-06-28 23:10:00,8.4889,9.012,0.00010000000000012221
KER-2,6/28/2025,11:20:00 pm,0,2025-06-28 23:20:00,8.4904,9.011,0.0002000000000000668
KER-2,6/28/2025,11:30:00 pm,0,2025-06-28 23:30:00,8.4924,9.013,0.0002000000000000668
KER-2,6/28/2025,11:40:00 pm,0,2025-06-28 23:40:00,8.4938,9.011,9.999999999994457e-05
KER-2,6/28/2025,11:50:00 pm,0,2025-06-28 23:50:00,8.4956,9.01,9.999999999994457e-05
KER-2,6/29/2025,12:00:00 am,0,2025-06-29 00:00:00,8.4964,9.011,0.00030000000000001136
KER-2,6/29/2025,12:10:00 am,0,2025-06-29 00:10:00,8.4968,9.014,0.00019999999999988915
KER-2,6/29/2025,12:20:00 am,0,2025-06-29 00:20:00,8.4977,9.012,9.999999999994457e-05
KER-2,6/29/2025,12:30:00 am,0,2025-06-29 00:30:00,8.4984,9.013,9.999999999994457e-05
KER-2,6/29/2025,12:40:00 am,0,2025-06-29 00:40:00,8.4988,9.014,0.0
KER-2,6/29/2025,12:50:00 am,0,2025-06-29 00:50:00,8.4993,9.014,0.00019999999999988915
KER-2,6/29/2025,01:00:00 am,0,2025-06-29 01:00:00,8.5005,9.012,0.0
KER-2,6/29/2025,01:10:00 am,0,2025-06-29 01:10:00,8.5021,9.012,0.00030000000000001136
KER-2,6/29/2025,01:20:00 am,0,2025-06-29 01:20:00,8.5036,9.015,9.999999999994457e-05
KER-2,6/29/2025,01:30:00 am,0,2025-06-29 01:30:00,8.5047,9.016,0.00030000000000001136
KER-2,6/29/2025,01:40:00 am,0,2025-06-29 01:40:00,8.5052,9.013,9.999999999994457e-05
KER-2,6/29/2025,01:50:00 am,0,2025-06-29 01:50:00,8.5058,9.012,0.00019999999999988915
KER-2,6/29/2025,02:00:00 am,0,2025-06-29 02:00:00,8.5067,9.014,0.0002000000000000668
KER-2,6/29/2025,02:10:00 am,0,2025-06-29 02:10:00,8.507,9.016,9.999999999994457e-05
KER-2,6/29/2025,02:20:00 am,0,2025-06-29 02:20:00,8.5076,9.015,9.999999999994457e-05
KER-2,6/29/2025,02:30:00 am,0,2025-06-29 02:30:00,8.508,9.016,9.999999999994457e-05
KER-2,6/29/2025,02:40:00 am,0,2025-06-29 02:40:00,8.5083,9.015,9.999999999994457e-05
KER-2,6/29/2025,02:50:00 am,0,2025-06-29 02:50:00,8.5088,9.016,9.999999999994457e-05
KER-2,6/29/2025,03:00:00 am,0,2025-06-29 03:00:00,8.5097,9.015,0.00019999999999988915
KER-2,6/29/2025,03:10:00 am,0,2025-06-29 03:10:00,8.5101,9.017,9.999999999994457e-05
KER-2,6/29/2025,03:20:00 am,0,2025-06-29 03:20:00,8.5101,9.016,0.0
KER-2,6/29/2025,03:30:00 am,0,2025-06-29 03:30:00,8.51,9.016,0.00030000000000001136
KER-2,6/29/2025,03:40:00 am,0,2025-06-29 03:40:00,8.5104,9.019,0.0002000000000000668
KER-2,6/29/2025,03:50:00 am,0,2025-06-29 03:50:00,8.5105,9.017,0.00010000000000012221
KER-2,6/29/2025,04:00:00 am,0,2025-06-29 04:00:00,8.5106,9.018,0.00010000000000012221
KER-2,6/29/2025,04:10:00 am,0,2025-06-29 04:10:00,8.512,9.017,0.0
KER-2,6/29/2025,04:20:00 am,0,2025-06-29 04:20:00,8.5122,9.017,0.00010000000000012221
KER-2,6/29/2025,04:30:00 am,0,2025-06-29 04:30:00,8.5126,9.018,0.0
KER-2,6/29/2025,04:40:00 am,0,2025-06-29 04:40:00,8.5135,9.018,0.0
KER-2,6/29/2025,04:50:00 am,0,2025-06-29 04:50:00,8.5145,9.018,9.999999999994457e-05
KER-2,6/29/2025,05:00:00 am,0,2025-06-29 05:00:00,8.5155,9.019,9.999999999994457e-05
KER-2,6/29/2025,05:10:00 am,0,2025-06-29 05:10:00,8.5164,9.02,0.0
KER-2,6/29/2025,05:20:00 am,0,2025-06-29 05:20:00,8.5163,9.02,0.0
KER-2,6/29/2025,05:30:00 am,0,2025-06-29 05:30:00,8.5165,9.02,0.00010000000000012221
KER-2,6/29/2025,05:40:00 am,0,2025-06-29 05:40:00,8.5174,9.021,0.0
KER-2,6/29/2025,05:50:00 am,0,2025-06-29 05:50:00,8.5182,9.021,0.00019999999999988915
KER-2,6/29/2025,06:00:00 am,0,2025-06-29 06:00:00,8.5197,9.023,0.0
KER-2,6/29/2025,06:10:00 am,0,2025-06-29 06:10:00,8.5203,9.023,0.0002000000000000668
KER-2,6/29/2025,06:20:00 am,0,2025-06-29 06:20:00,8.521,9.025,0.0002000000000000668
KER-2,6/29/2025,06:30:00 am,0,2025-06-29 06:30:00,8.5218,9.023,0.0
KER-2,6/29/2025,06:40:00 am,0,2025-06-29 06:40:00,8.523,9.023,9.999999999994457e-05
KER-2,6/29/2025,06:50:00 am,0,2025-06-29 06:50:00,8.5235,9.024,0.0002000000000000668
KER-2,6/29/2025,07:00:00 am,0,2025-06-29 07:00:00,8.5244,9.026,9.999999999994457e-05
KER-2,6/29/2025,07:10:00 am,0,2025-06-29 07:10:00,8.5249,9.025,0.00019999999999988915
KER-2,6/29/2025,07:20:00 am,0,2025-06-29 07:20:00,8.5249,9.027,0.00019999999999988915
KER-2,6/29/2025,07:30:00 am,0,2025-06-29 07:30:00,8.5252,9.025,0.00019999999999988915
KER-2,6/29/2025,07:40:00 am,0,2025-06-29 07:40:00,8.5253,9.027,0.00010000000000012221
KER-2,6/29/2025,07:50:00 am,0,2025-06-29 07:50:00,8.5248,9.028,9.999999999994457e-05
KER-2,6/29/2025,08:00:00 am,0,2025-06-29 08:00:00,8.5247,9.029,9.999999999994457e-05
KER-2,6/29/2025,08:10:00 am,0,2025-06-29 08:10:00,8.5254,9.03,0.0
KER-2,6/29/2025,08:20:00 am,0,2025-06-29 08:20:00,8.5253,9.03,9.999999999994457e-05
KER-2,6/29/2025,08:30:00 am,0,2025-06-29 08:30:00,8.5259,9.029,0.00030000000000001136
KER-2,6/29/2025,08:40:00 am,0,2025-06-29 08:40:00,8.5253,9.032,0.0
KER-2,6/29/2025,08:50:00 am,0,2025-06-29 08:50:00,8.5241,9.032,9.999999999994457e-05
KER-2,6/29/2025,09:00:00 am,0,2025-06-29 09:00:00,8.5225,9.031,0.00030000000000001136
KER-2,6/29/2025,09:10:00 am,0,2025-06-29 09:10:00,8.5204,9.034,9.999999999994457e-05
KER-2,6/29/2025,09:20:00 am,0,2025-06-29 09:20:00,8.5177,9.035,0.0
KER-2,6/29/2025,09:30:00 am,0,2025-06-29 09:30:00,8.515,9.035,0.0
KER-2,6/29/2025,09:40:00 am,0,2025-06-29 09:40:00,8.5114,9.035,9.999999999994457e-05
KER-2,6/29/2025,09:50:00 am,0,2025-06-29 09:50:00,8.5087,9.036,0.00010000000000012221
KER-2,6/29/2025,10:00:00 am,0,2025-06-29 10:00:00,8.5059,9.037,0.0004999999999999005
KER-2,6/29/2025,10:10:00 am,0,2025-06-29 10:10:00,8.5025,9.042,9.999999999994457e-05
KER-2,6/29/2025,10:20:00 am,0,2025-06-29 10:20:00,8.5001,9.041,9.999999999994457e-05
KER-2,6/29/2025,10:30:00 am,0,2025-06-29 10:30:00,8.4968,9.042,0.0002000000000000668
KER-2,6/29/2025,10:40:00 am,0,2025-06-29 10:40:00,8.494,9.044,0.00019999999999988915
KER-2,6/29/2025,10:50:00 am,0,2025-06-29 10:50:00,8.4907,9.046,0.0
KER-2,6/29/2025,11:00:00 am,0,2025-06-29 11:00:00,8.487,9.046,0.0002000000000000668
KER-2,6/29/2025,11:10:00 am,0,2025-06-29 11:10:00,8.4833,9.048,9.999999999994457e-05
KER-2,6/29/2025,11:20:00 am,0,2025-06-29 11:20:00,8.4801,9.049,0.0002000000000000668
KER-2,6/29/2025,11:30:00 am,0,2025-06-29 11:30:00,8.4776,9.051,9.999999999994457e-05
KER-2,6/29/2025,11:40:00 am,0,2025-06-29 11:40:00,8.4752,9.05,0.0
KER-2,6/29/2025,11:50:00 am,0,2025-06-29 11:50:00,8.4728,9.05,0.0005999999999998451
KER-2,6/29/2025,12:00:00 pm,0,2025-06-29 12:00:00,8.4695,9.056,9.999999999994457e-05
KER-2,6/29/2025,12:10:00 pm,0,2025-06-29 12:10:00,8.4658,9.055,0.0
KER-2,6/29/2025,12:20:00 pm,0,2025-06-29 12:20:00,8.4634,9.055,0.0002000000000000668
KER-2,6/29/2025,12:30:00 pm,0,2025-06-29 12:30:00,8.4602,9.057,0.00019999999999988915
KER-2,6/29/2025,12:40:00 pm,0,2025-06-29 12:40:00,8.4581,9.059,0.0
KER-2,6/29/2025,12:50:00 pm,0,2025-06-29 12:50:00,8.4555,9.059,0.0002000000000000668
KER-2,6/29/2025,01:00:00 pm,0,2025-06-29 13:00:00,8.4537,9.061,0.00030000000000001136
KER-2,6/29/2025,01:10:00 pm,0,2025-06-29 13:10:00,8.4507,9.064,0.0002000000000000668
KER-2,6/29/2025,01:20:00 pm,0,2025-06-29 13:20:00,8.4484,9.062,0.00030000000000001136
KER-2,6/29/2025,01:30:00 pm,0,2025-06-29 13:30:00,8.4462,9.065,0.00010000000000012221
KER-2,6/29/2025,01:40:00 pm,0,2025-06-29 13:40:00,8.4446,9.066,9.999999999994457e-05
KER-2,6/29/2025,01:50:00 pm,0,2025-06-29 13:50:00,8.4432,9.067,9.999999999994457e-05
KER-2,6/29/2025,02:00:00 pm,0,2025-06-29 14:00:00,8.4416,9.068,0.00010000000000012221
KER-2,6/29/2025,02:10:00 pm,0,2025-06-29 14:10:00,8.441,9.069,0.0002000000000000668
KER-2,6/29/2025,02:20:00 pm,0,2025-06-29 14:20:00,8.4407,9.067,0.0002000000000000668
KER-2,6/29/2025,02:30:00 pm,0,2025-06-29 14:30:00,8.4394,9.065,0.0004000000000001336
KER-2,6/29/2025,02:40:00 pm,0,2025-06-29 14:40:00,8.4382,9.069,9.999999999994457e-05
KER-2,6/29/2025,02:50:00 pm,0,2025-06-29 14:50:00,8.4363,9.07,9.999999999994457e-05
KER-2,6/29/2025,03:00:00 pm,0,2025-06-29 15:00:00,8.4354,9.069,0.00019999999999988915
KER-2,6/29/2025,03:10:00 pm,0,2025-06-29 15:10:00,8.4348,9.071,9.999999999994457e-05
KER-2,6/29/2025,03:20:00 pm,0,2025-06-29 15:20:00,8.4343,9.07,9.999999999994457e-05
KER-2,6/29/2025,03:30:00 pm,0,2025-06-29 15:30:00,8.4338,9.069,9.999999999994457e-05
KER-2,6/29/2025,03:40:00 pm,0,2025-06-29 15:40:00,8.4333,9.07,9.999999999994457e-05
KER-2,6/29/2025,03:50:00 pm,0,2025-06-29 15:50:00,8.4332,9.069,9.999999999994457e-05
KER-2,6/29/2025,04:00:00 pm,0,2025-06-29 16:00:00,8.4333,9.07,9.999999999994457e-05
KER-2,6/29/2025,04:10:00 pm,0,2025-06-29 16:10:00,8.4334,9.071,0.00019999999999988915
KER-2,6/29/2025,04:20:00 pm,0,2025-06-29 16:20:00,8.4333,9.069,9.999999999994457e-05
KER-2,6/29/2025,04:30:00 pm,0,2025-06-29 16:30:00,8.433,9.07,9.999999999994457e-05
KER-2,6/29/2025,04:40:00 pm,0,2025-06-29 16:40:00,8.4336,9.071,0.00019999999999988915
KER-2,6/29/2025,04:50:00 pm,0,2025-06-29 16:50:00,8.4344,9.069,9.999999999994457e-05
KER-2,6/29/2025,05:00:00 pm,0,2025-06-29 17:00:00,8.4345,9.07,0.0002000000000000668
KER-2,6/29/2025,05:10:00 pm,0,2025-06-29 17:10:00,8.4344,9.068,0.0
KER-2,6/29/2025,05:20:00 pm,0,2025-06-29 17:20:00,8.4348,9.068,0.0
KER-2,6/29/2025,05:30:00 pm,0,2025-06-29 17:30:00,8.4349,9.068,0.0002000000000000668
KER-2,6/29/2025,05:40:00 pm,0,2025-06-29 17:40:00,8.4347,9.07,0.0002000000000000668
KER-2,6/29/2025,05:50:00 pm,0,2025-06-29 17:50:00,8.4344,9.068,0.0002000000000000668
KER-2,6/29/2025,06:00:00 pm,0,2025-06-29 18:00:00,8.434,9.07,0.0
KER-2,6/29/2025,06:10:00 pm,0,2025-06-29 18:10:00,8.4335,9.07,0.0
KER-2,6/29/2025,06:20:00 pm,0,2025-06-29 18:20:00,8.4337,9.07,0.0
KER-2,6/29/2025,06:30:00 pm,0,2025-06-29 18:30:00,8.4333,9.07,0.0
KER-2,6/29/2025,06:40:00 pm,0,2025-06-29 18:40:00,8.4335,9.07,0.0002000000000000668
KER-2,6/29/2025,06:50:00 pm,0,2025-06-29 18:50:00,8.4336,9.068,0.0
KER-2,6/29/2025,07:00:00 pm,0,2025-06-29 19:00:00,8.4339,9.068,0.0002000000000000668
KER-2,6/29/2025,07:10:00 pm,0,2025-06-29 19:10:00,8.4346,9.07,9.999999999994457e-05
KER-2,6/29/2025,07:20:00 pm,0,2025-06-29 19:20:00,8.4354,9.069,0.0
KER-2,6/29/2025,07:30:00 pm,0,2025-06-29 19:30:00,8.4366,9.069,9.999999999994457e-05
KER-2,6/29/2025,07:40:00 pm,0,2025-06-29 19:40:00,8.4375,9.07,9.999999999994457e-05
KER-2,6/29/2025,07:50:00 pm,0,2025-06-29 19:50:00,8.4387,9.069,9.999999999994457e-05
KER-2,6/29/2025,08:00:00 pm,0,2025-06-29 20:00:00,8.4401,9.07,0.0002000000000000668
KER-2,6/29/2025,08:10:00 pm,0,2025-06-29 20:10:00,8.4414,9.068,0.0
KER-2,6/29/2025,08:20:00 pm,0,2025-06-29 20:20:00,8.4426,9.068,0.00019999999999988915
KER-2,6/29/2025,08:30:00 pm,0,2025-06-29 20:30:00,8.444,9.066,0.00019999999999988915
KER-2,6/29/2025,08:40:00 pm,0,2025-06-29 20:40:00,8.446,9.068,0.0
KER-2,6/29/2025,08:50:00 pm,0,2025-06-29 20:50:00,8.4479,9.068,0.00010000000000012221
KER-2,6/29/2025,09:00:00 pm,0,2025-06-29 21:00:00,8.4497,9.069,0.00019999999999988915
KER-2,6/29/2025,09:10:00 pm,0,2025-06-29 21:10:00,8.4522,9.071,0.00019999999999988915
KER-2,6/29/2025,09:20:00 pm,0,2025-06-29 21:20:00,8.4539,9.069,0.00019999999999988915
KER-2,6/29/2025,09:30:00 pm,0,2025-06-29 21:30:00,8.4564,9.071,9.999999999994457e-05
KER-2,6/29/2025,09:40:00 pm,0,2025-06-29 21:40:00,8.4579,9.07,9.999999999994457e-05
KER-2,6/29/2025,09:50:00 pm,0,2025-06-29 21:50:00,8.4593,9.071,0.00039999999999995595
KER-2,6/29/2025,10:00:00 pm,0,2025-06-29 22:00:00,8.4606,9.067,0.00030000000000001136
KER-2,6/29/2025,10:10:00 pm,0,2025-06-29 22:10:00,8.4619,9.07,9.999999999994457e-05
KER-2,6/29/2025,10:20:00 pm,0,2025-06-29 22:20:00,8.4626,9.069,0.0
KER-2,6/29/2025,10:30:00 pm,0,2025-06-29 22:30:00,8.463,9.069,0.00019999999999988915
KER-2,6/29/2025,10:40:00 pm,0,2025-06-29 22:40:00,8.4647,9.071,0.00019999999999988915
KER-2,6/29/2025,10:50:00 pm,0,2025-06-29 22:50:00,8.4655,9.069,0.00019999999999988915
KER-2,6/29/2025,11:00:00 pm,0,2025-06-29 23:00:00,8.4673,9.071,9.999999999994457e-05
KER-2,6/29/2025,11:10:00 pm,0,2025-06-29 23:10:00,8.4687,9.07,9.999999999994457e-05
KER-2,6/29/2025,11:20:00 pm,0,2025-06-29 23:20:00,8.4695,9.071,0.0
KER-2,6/29/2025,11:30:00 pm,0,2025-06-29 23:30:00,8.4699,9.071,9.999999999994457e-05
KER-2,6/29/2025,11:40:00 pm,0,2025-06-29 23:40:00,8.4705,9.07,9.999999999994457e-05
KER-2,6/29/2025,11:50:00 pm,0,2025-06-29 23:50:00,8.4714,9.071,9.999999999994457e-05
KER-2,6/30/2025,12:00:00 am,0,2025-06-30 00:00:00,8.4717,9.072,0.00010000000000012221
KER-2,6/30/2025,12:10:00 am,0,2025-06-30 00:10:00,8.4717,9.073,0.0002000000000000668
KER-2,6/30/2025,12:20:00 am,0,2025-06-30 00:20:00,8.4722,9.071,9.999999999994457e-05
KER-2,6/30/2025,12:30:00 am,0,2025-06-30 00:30:00,8.4714,9.072,0.00010000000000012221
KER-2,6/30/2025,12:40:00 am,0,2025-06-30 00:40:00,8.4725,9.073,0.0
KER-2,6/30/2025,12:50:00 am,0,2025-06-30 00:50:00,8.473,9.073,9.999999999994457e-05
KER-2,6/30/2025,01:00:00 am,0,2025-06-30 01:00:00,8.4731,9.074,0.0
KER-2,6/30/2025,01:10:00 am,0,2025-06-30 01:10:00,8.4737,9.074,0.0
KER-2,6/30/2025,01:20:00 am,0,2025-06-30 01:20:00,8.474,9.074,9.999999999994457e-05
KER-2,6/30/2025,01:30:00 am,0,2025-06-30 01:30:00,8.4741,9.075,0.0
KER-2,6/30/2025,01:40:00 am,0,2025-06-30 01:40:00,8.4743,9.075,0.0
KER-2,6/30/2025,01:50:00 am,0,2025-06-30 01:50:00,8.4751,9.075,0.0002000000000000668
KER-2,6/30/2025,02:00:00 am,0,2025-06-30 02:00:00,8.474,9.077,0.0
KER-2,6/30/2025,02:10:00 am,0,2025-06-30 02:10:00,8.4747,9.077,0.0002000000000000668
KER-2,6/30/2025,02:20:00 am,0,2025-06-30 02:20:00,8.4757,9.079,0.0
KER-2,6/30/2025,02:30:00 am,0,2025-06-30 02:30:00,8.4762,9.079,0.00010000000000012221
KER-2,6/30/2025,02:40:00 am,0,2025-06-30 02:40:00,8.4766,9.078,0.0
KER-2,6/30/2025,02:50:00 am,0,2025-06-30 02:50:00,8.4773,9.078,0.00010000000000012221
KER-2,6/30/2025,03:00:00 am,0,2025-06-30 03:00:00,8.4791,9.079,0.00019999999999988915
KER-2,6/30/2025,03:10:00 am,0,2025-06-30 03:10:00,8.4794,9.081,9.999999999994457e-05
KER-2,6/30/2025,03:20:00 am,0,2025-06-30 03:20:00,8.4808,9.08,0.0002000000000000668
KER-2,6/30/2025,03:30:00 am,0,2025-06-30 03:30:00,8.4814,9.082,0.00010000000000012221
KER-2,6/30/2025,03:40:00 am,0,2025-06-30 03:40:00,8.4808,9.081,0.00010000000000012221
KER-2,6/30/2025,03:50:00 am,0,2025-06-30 03:50:00,8.4804,9.082,9.999999999994457e-05
KER-2,6/30/2025,04:00:00 am,0,2025-06-30 04:00:00,8.4807,9.083,0.0
KER-2,6/30/2025,04:10:00 am,0,2025-06-30 04:10:00,8.4809,9.083,9.999999999994457e-05
KER-2,6/30/2025,04:20:00 am,0,2025-06-30 04:20:00,8.4816,9.084,0.00010000000000012221
KER-2,6/30/2025,04:30:00 am,0,2025-06-30 04:30:00,8.4826,9.085,0.0
KER-2,6/30/2025,04:40:00 am,0,2025-06-30 04:40:00,8.4834,9.085,0.0002000000000000668
KER-2,6/30/2025,04:50:00 am,0,2025-06-30 04:50:00,8.4835,9.083,0.00039999999999995595
KER-2,6/30/2025,05:00:00 am,0,2025-06-30 05:00:00,8.4835,9.087,9.999999999994457e-05
KER-2,6/30/2025,05:10:00 am,0,2025-06-30 05:10:00,8.4829,9.086,0.00019999999999988915
KER-2,6/30/2025,05:20:00 am,0,2025-06-30 05:20:00,8.4838,9.088,0.0
KER-2,6/30/2025,05:30:00 am,0,2025-06-30 05:30:00,8.4851,9.088,0.00010000000000012221
KER-2,6/30/2025,05:40:00 am,0,2025-06-30 05:40:00,8.4866,9.089,0.0002000000000000668
KER-2,6/30/2025,05:50:00 am,0,2025-06-30 05:50:00,8.4871,9.087,0.0002000000000000668
KER-2,6/30/2025,06:00:00 am,0,2025-06-30 06:00:00,8.4868,9.089,0.00019999999999988915
KER-2,6/30/2025,06:10:00 am,0,2025-06-30 06:10:00,8.4868,9.091,0.0
KER-2,6/30/2025,06:20:00 am,0,2025-06-30 06:20:00,8.4872,9.091,0.0002000000000000668
KER-2,6/30/2025,06:30:00 am,0,2025-06-30 06:30:00,8.4882,9.093,9.999999999994457e-05
KER-2,6/30/2025,06:40:00 am,0,2025-06-30 06:40:00,8.4895,9.092,0.00019999999999988915
KER-2,6/30/2025,06:50:00 am,0,2025-06-30 06:50:00,8.4904,9.094,9.999999999994457e-05
KER-2,6/30/2025,07:00:00 am,0,2025-06-30 07:00:00,8.4912,9.093,0.00030000000000001136
KER-2,6/30/2025,07:10:00 am,0,2025-06-30 07:10:00,8.4924,9.096,0.0
KER-2,6/30/2025,07:20:00 am,0,2025-06-30 07:20:00,8.4937,9.096,0.0002000000000000668
KER-2,6/30/2025,07:30:00 am,0,2025-06-30 07:30:00,8.4948,9.098,0.0002000000000000668
KER-2,6/30/2025,07:40:00 am,0,2025-06-30 07:40:00,8.4947,9.096,9.999999999994457e-05
KER-2,6/30/2025,07:50:00 am,0,2025-06-30 07:50:00,8.495,9.097,0.0002000000000000668
KER-2,6/30/2025,08:00:00 am,0,2025-06-30 08:00:00,8.4951,9.099,0.0
KER-2,6/30/2025,08:10:00 am,0,2025-06-30 08:10:00,8.4952,9.099,0.00030000000000001136
KER-2,6/30/2025,08:20:00 am,0,2025-06-30 08:20:00,8.495,9.102,0.0002000000000000668
KER-2,6/30/2025,08:30:00 am,0,2025-06-30 08:30:00,8.4948,9.1,0.0002000000000000668
KER-2,6/30/2025,08:40:00 am,0,2025-06-30 08:40:00,8.4952,9.102,9.999999999994457e-05
KER-2,6/30/2025,08:50:00 am,0,2025-06-30 08:50:00,8.4948,9.103,9.999999999994457e-05
KER-2,6/30/2025,09:00:00 am,0,2025-06-30 09:00:00,8.4939,9.104,0.00010000000000012221
KER-2,6/30/2025,09:10:00 am,0,2025-06-30 09:10:00,8.4914,9.105,9.999999999994457e-05
KER-2,6/30/2025,09:20:00 am,0,2025-06-30 09:20:00,8.4884,9.106,0.0002000000000000668
KER-2,6/30/2025,09:30:00 am,0,2025-06-30 09:30:00,8.4855,9.108,0.0
KER-2,6/30/2025,09:40:00 am,0,2025-06-30 09:40:00,8.4815,9.108,0.00019999999999988915
KER-2,6/30/2025,09:50:00 am,0,2025-06-30 09:50:00,8.4781,9.11,0.00010000000000012221
KER-2,6/30/2025,10:00:00 am,0,2025-06-30 10:00:00,8.4746,9.111,0.00019999999999988915
KER-2,6/30/2025,10:10:00 am,0,2025-06-30 10:10:00,8.4711,9.113,0.00030000000000001136
KER-2,6/30/2025,10:20:00 am,0,2025-06-30 10:20:00,8.4673,9.116,0.0
KER-2,6/30/2025,10:30:00 am,0,2025-06-30 10:30:00,8.4636,9.116,0.00039999999999995595
KER-2,6/30/2025,10:40:00 am,0,2025-06-30 10:40:00,8.4596,9.12,0.00010000000000012221
KER-2,6/30/2025,10:50:00 am,0,2025-06-30 10:50:00,8.4565,9.121,0.00019999999999988915
KER-2,6/30/2025,11:00:00 am,0,2025-06-30 11:00:00,8.4527,9.123,0.0002000000000000668
KER-2,6/30/2025,11:10:00 am,0,2025-06-30 11:10:00,8.45,9.125,0.0
KER-2,6/30/2025,11:20:00 am,0,2025-06-30 11:20:00,8.4462,9.125,0.0002000000000000668
KER-2,6/30/2025,11:30:00 am,0,2025-06-30 11:30:00,8.4426,9.127,0.00019999999999988915
KER-2,6/30/2025,11:40:00 am,0,2025-06-30 11:40:00,8.4394,9.129,0.00010000000000012221
KER-2,6/30/2025,11:50:00 am,0,2025-06-30 11:50:00,8.4365,9.13,9.999999999994457e-05
KER-2,6/30/2025,12:00:00 pm,0,2025-06-30 12:00:00,8.4335,9.131,9.999999999994457e-05
KER-2,6/30/2025,12:10:00 pm,0,2025-06-30 12:10:00,8.4301,9.132,0.00039999999999995595
KER-2,6/30/2025,12:20:00 pm,0,2025-06-30 12:20:00,8.428,9.136,0.0
KER-2,6/30/2025,12:30:00 pm,0,2025-06-30 12:30:00,8.4257,9.136,0.0002000000000000668
KER-2,6/30/2025,12:40:00 pm,0,2025-06-30 12:40:00,8.424,9.138,0.0002000000000000668
KER-2,6/30/2025,12:50:00 pm,0,2025-06-30 12:50:00,8.4227,9.14,0.0
KER-2,6/30/2025,01:00:00 pm,0,2025-06-30 13:00:00,8.4204,9.14,0.00019999999999988915
KER-2,6/30/2025,01:10:00 pm,0,2025-06-30 13:10:00,8.419,9.142,0.0
KER-2,6/30/2025,01:20:00 pm,0,2025-06-30 13:20:00,8.4179,9.142,0.00030000000000001136
KER-2,6/30/2025,01:30:00 pm,0,2025-06-30 13:30:00,8.4162,9.145,0.0002000000000000668
KER-2,6/30/2025,01:40:00 pm,0,2025-06-30 13:40:00,8.4149,9.147,9.999999999994457e-05
KER-2,6/30/2025,01:50:00 pm,0,2025-06-30 13:50:00,8.4139,9.146,9.999999999994457e-05
KER-2,6/30/2025,02:00:00 pm,0,2025-06-30 14:00:00,8.4128,9.147,9.999999999994457e-05
KER-2,6/30/2025,02:10:00 pm,0,2025-06-30 14:10:00,8.4117,9.148,9.999999999994457e-05
KER-2,6/30/2025,02:20:00 pm,0,2025-06-30 14:20:00,8.4108,9.149,0.0
KER-2,6/30/2025,02:30:00 pm,0,2025-06-30 14:30:00,8.4098,9.149,0.0002000000000000668
KER-2,6/30/2025,02:40:00 pm,0,2025-06-30 14:40:00,8.4097,9.151,9.999999999994457e-05
KER-2,6/30/2025,02:50:00 pm,0,2025-06-30 14:50:00,8.4089,9.152,0.00019999999999988915
KER-2,6/30/2025,03:00:00 pm,0,2025-06-30 15:00:00,8.4081,9.15,0.00019999999999988915
KER-2,6/30/2025,03:10:00 pm,0,2025-06-30 15:10:00,8.407,9.152,0.0
KER-2,6/30/2025,03:20:00 pm,0,2025-06-30 15:20:00,8.4065,9.152,0.00010000000000012221
KER-2,6/30/2025,03:30:00 pm,0,2025-06-30 15:30:00,8.4055,9.153,0.0
KER-2,6/30/2025,03:40:00 pm,0,2025-06-30 15:40:00,8.4043,9.153,9.999999999994457e-05
KER-2,6/30/2025,03:50:00 pm,0,2025-06-30 15:50:00,8.4037,9.154,0.0002000000000000668
KER-2,6/30/2025,04:00:00 pm,0,2025-06-30 16:00:00,8.4034,9.152,0.00030000000000001136
KER-2,6/30/2025,04:10:00 pm,0,2025-06-30 16:10:00,8.4032,9.155,0.00010000000000012221
KER-2,6/30/2025,04:20:00 pm,0,2025-06-30 16:20:00,8.4031,9.156,0.0
KER-2,6/30/2025,04:30:00 pm,0,2025-06-30 16:30:00,8.4027,9.156,0.0002000000000000668
KER-2,6/30/2025,04:40:00 pm,0,2025-06-30 16:40:00,8.4022,9.154,0.0
KER-2,6/30/2025,04:50:00 pm,0,2025-06-30 16:50:00,8.4026,9.154,0.0
KER-2,6/30/2025,05:00:00 pm,0,2025-06-30 17:00:00,8.4025,9.154,9.999999999994457e-05
KER-2,6/30/2025,05:10:00 pm,0,2025-06-30 17:10:00,8.4026,9.155,0.00010000000000012221
KER-2,6/30/2025,05:20:00 pm,0,2025-06-30 17:20:00,8.403,9.156,0.0
KER-2,6/30/2025,05:30:00 pm,0,2025-06-30 17:30:00,8.4041,9.156,0.00010000000000012221
KER-2,6/30/2025,05:40:00 pm,0,2025-06-30 17:40:00,8.4041,9.155,9.999999999994457e-05
KER-2,6/30/2025,05:50:00 pm,0,2025-06-30 17:50:00,8.4037,9.154,0.00030000000000001136
KER-2,6/30/2025,06:00:00 pm,0,2025-06-30 18:00:00,8.4036,9.157,9.999999999994457e-05
KER-2,6/30/2025,06:10:00 pm,0,2025-06-30 18:10:00,8.4042,9.156,0.00010000000000012221
KER-2,6/30/2025,06:20:00 pm,0,2025-06-30 18:20:00,8.4047,9.155,0.0
KER-2,6/30/2025,06:30:00 pm,0,2025-06-30 18:30:00,8.4057,9.155,0.0
KER-2,6/30/2025,06:40:00 pm,0,2025-06-30 18:40:00,8.4067,9.155,0.00010000000000012221
KER-2,6/30/2025,06:50:00 pm,0,2025-06-30 18:50:00,8.4087,9.156,0.0002000000000000668
KER-2,6/30/2025,07:00:00 pm,0,2025-06-30 19:00:00,8.4102,9.154,0.0002000000000000668
KER-2,6/30/2025,07:10:00 pm,0,2025-06-30 19:10:00,8.4118,9.156,0.00010000000000012221
KER-2,6/30/2025,07:20:00 pm,0,2025-06-30 19:20:00,8.4143,9.155,0.00010000000000012221
KER-2,6/30/2025,07:30:00 pm,0,2025-06-30 19:30:00,8.4158,9.156,0.00010000000000012221
KER-2,6/30/2025,07:40:00 pm,0,2025-06-30 19:40:00,8.418,9.155,0.00039999999999995595
KER-2,6/30/2025,07:50:00 pm,0,2025-06-30 19:50:00,8.4209,9.151,0.00039999999999995595
KER-2,6/30/2025,08:00:00 pm,0,2025-06-30 20:00:00,8.4218,9.155,0.00019999999999988915
KER-2,6/30/2025,08:10:00 pm,0,2025-06-30 20:10:00,8.4243,9.153,0.0
KER-2,6/30/2025,08:20:00 pm,0,2025-06-30 20:20:00,8.4256,9.153,0.00010000000000012221
KER-2,6/30/2025,08:30:00 pm,0,2025-06-30 20:30:00,8.4283,9.152,0.00010000000000012221
KER-2,6/30/2025,08:40:00 pm,0,2025-06-30 20:40:00,8.4298,9.153,9.999999999994457e-05
KER-2,6/30/2025,08:50:00 pm,0,2025-06-30 20:50:00,8.4313,9.154,9.999999999994457e-05
KER-2,6/30/2025,09:00:00 pm,0,2025-06-30 21:00:00,8.4333,9.155,9.999999999994457e-05
KER-2,6/30/2025,09:10:00 pm,0,2025-06-30 21:10:00,8.4355,9.154,0.0
KER-2,6/30/2025,09:20:00 pm,0,2025-06-30 21:20:00,8.438,9.154,0.0
KER-2,6/30/2025,09:30:00 pm,0,2025-06-30 21:30:00,8.4407,9.154,9.999999999994457e-05
KER-2,6/30/2025,09:40:00 pm,0,2025-06-30 21:40:00,8.4429,9.155,0.00019999999999988915
KER-2,6/30/2025,09:50:00 pm,0,2025-06-30 21:50:00,8.4439,9.153,9.999999999994457e-05
KER-2,6/30/2025,10:00:00 pm,0,2025-06-30 22:00:00,8.4464,9.154,0.0
KER-2,6/30/2025,10:10:00 pm,0,2025-06-30 22:10:00,8.4473,9.154,0.0002000000000000668
KER-2,6/30/2025,10:20:00 pm,0,2025-06-30 22:20:00,8.448,9.156,0.0
KER-2,6/30/2025,10:30:00 pm,0,2025-06-30 22:30:00,8.4496,9.156,9.999999999994457e-05
KER-2,6/30/2025,10:40:00 pm,0,2025-06-30 22:40:00,8.4511,9.157,0.0
KER-2,6/30/2025,10:50:00 pm,0,2025-06-30 22:50:00,8.4525,9.157,9.999999999994457e-05
KER-2,6/30/2025,11:00:00 pm,0,2025-06-30 23:00:00,8.4533,9.156,0.0
KER-2,6/30/2025,11:10:00 pm,0,2025-06-30 23:10:00,8.4537,9.156,9.999999999994457e-05
KER-2,6/30/2025,11:20:00 pm,0,2025-06-30 23:20:00,8.4547,9.157,9.999999999994457e-05
KER-2,6/30/2025,11:30:00 pm,0,2025-06-30 23:30:00,8.4566,9.158,0.0
KER-2,6/30/2025,11:40:00 pm,0,2025-06-30 23:40:00,8.4575,9.158,0.00010000000000012221
KER-2,6/30/2025,11:50:00 pm,0,2025-06-30 23:50:00,8.4592,9.159,0.00019999999999988915
KER-2,7/1/2025,12:00:00 am,0,2025-07-01 00:00:00,8.4598,9.161,0.00019999999999988915
KER-2,7/1/2025,12:10:00 am,0,2025-07-01 00:10:00,8.4602,9.159,9.999999999994457e-05
KER-2,7/1/2025,12:20:00 am,0,2025-07-01 00:20:00,8.4613,9.16,9.999999999994457e-05
KER-2,7/1/2025,12:30:00 am,0,2025-07-01 00:30:00,8.4618,9.161,0.00010000000000012221
KER-2,7/1/2025,12:40:00 am,0,2025-07-01 00:40:00,8.4627,9.162,0.0002000000000000668
KER-2,7/1/2025,12:50:00 am,0,2025-07-01 00:50:00,8.4629,9.16,9.999999999994457e-05
KER-2,7/1/2025,01:00:00 am,0,2025-07-01 01:00:00,8.4636,9.161,0.0002000000000000668
KER-2,7/1/2025,01:10:00 am,0,2025-07-01 01:10:00,8.465,9.163,9.999999999994457e-05
KER-2,7/1/2025,01:20:00 am,0,2025-07-01 01:20:00,8.466,9.164,9.999999999994457e-05
KER-2,7/1/2025,01:30:00 am,0,2025-07-01 01:30:00,8.4662,9.163,9.999999999994457e-05
KER-2,7/1/2025,01:40:00 am,0,2025-07-01 01:40:00,8.4659,9.164,0.0002000000000000668
KER-2,7/1/2025,01:50:00 am,0,2025-07-01 01:50:00,8.4655,9.166,0.00019999999999988915
KER-2,7/1/2025,02:00:00 am,0,2025-07-01 02:00:00,8.4655,9.168,9.999999999994457e-05
KER-2,7/1/2025,02:10:00 am,0,2025-07-01 02:10:00,8.4655,9.167,9.999999999994457e-05
KER-2,7/1/2025,02:20:00 am,0,2025-07-01 02:20:00,8.4652,9.168,0.0002000000000000668
KER-2,7/1/2025,02:30:00 am,0,2025-07-01 02:30:00,8.4654,9.17,9.999999999994457e-05
KER-2,7/1/2025,02:40:00 am,0,2025-07-01 02:40:00,8.4653,9.169,9.999999999994457e-05
KER-2,7/1/2025,02:50:00 am,0,2025-07-01 02:50:00,8.4644,9.17,0.0002000000000000668
KER-2,7/1/2025,03:00:00 am,0,2025-07-01 03:00:00,8.4648,9.168,0.0002000000000000668
KER-2,7/1/2025,03:10:00 am,0,2025-07-01 03:10:00,8.4656,9.17,0.0002000000000000668
KER-2,7/1/2025,03:20:00 am,0,2025-07-01 03:20:00,8.4657,9.172,0.0
KER-2,7/1/2025,03:30:00 am,0,2025-07-01 03:30:00,8.4659,9.172,9.999999999994457e-05
KER-2,7/1/2025,03:40:00 am,0,2025-07-01 03:40:00,8.4663,9.173,9.999999999994457e-05
KER-2,7/1/2025,03:50:00 am,0,2025-07-01 03:50:00,8.4663,9.174,0.00010000000000012221
KER-2,7/1/2025,04:00:00 am,0,2025-07-01 04:00:00,8.4656,9.175,0.0002000000000000668
KER-2,7/1/2025,04:10:00 am,0,2025-07-01 04:10:00,8.4654,9.173,0.0002000000000000668
KER-2,7/1/2025,04:20:00 am,0,2025-07-01 04:20:00,8.466,9.175,9.999999999994457e-05
KER-2,7/1/2025,04:30:00 am,0,2025-07-01 04:30:00,8.466,9.176,0.0002000000000000668
KER-2,7/1/2025,04:40:00 am,0,2025-07-01 04:40:00,8.4664,9.178,9.999999999994457e-05
KER-2,7/1/2025,04:50:00 am,0,2025-07-01 04:50:00,8.4663,9.179,9.999999999994457e-05
KER-2,7/1/2025,05:00:00 am,0,2025-07-01 05:00:00,8.4669,9.18,9.999999999994457e-05
KER-2,7/1/2025,05:10:00 am,0,2025-07-01 05:10:00,8.4683,9.179,9.999999999994457e-05
KER-2,7/1/2025,05:20:00 am,0,2025-07-01 05:20:00,8.4694,9.18,0.0002000000000000668
KER-2,7/1/2025,05:30:00 am,0,2025-07-01 05:30:00,8.4711,9.182,0.00010000000000012221
KER-2,7/1/2025,05:40:00 am,0,2025-07-01 05:40:00,8.4717,9.181,0.0
KER-2,7/1/2025,05:50:00 am,0,2025-07-01 05:50:00,8.4729,9.181,0.0004000000000001336
KER-2,7/1/2025,06:00:00 am,0,2025-07-01 06:00:00,8.4735,9.185,0.0
KER-2,7/1/2025,06:10:00 am,0,2025-07-01 06:10:00,8.4745,9.185,9.999999999994457e-05
KER-2,7/1/2025,06:20:00 am,0,2025-07-01 06:20:00,8.4756,9.186,0.0
KER-2,7/1/2025,06:30:00 am,0,2025-07-01 06:30:00,8.4762,9.186,0.00030000000000001136
KER-2,7/1/2025,06:40:00 am,0,2025-07-01 06:40:00,8.4767,9.189,9.999999999994457e-05
KER-2,7/1/2025,06:50:00 am,0,2025-07-01 06:50:00,8.4793,9.188,0.0
KER-2,7/1/2025,07:00:00 am,0,2025-07-01 07:00:00,8.4795,9.188,0.00019999999999988915
KER-2,7/1/2025,07:10:00 am,0,2025-07-01 07:10:00,8.4798,9.19,0.0
KER-2,7/1/2025,07:20:00 am,0,2025-07-01 07:20:00,8.4798,9.19,0.00030000000000001136
KER-2,7/1/2025,07:30:00 am,0,2025-07-01 07:30:00,8.4798,9.193,0.00010000000000012221
KER-2,7/1/2025,07:40:00 am,0,2025-07-01 07:40:00,8.4804,9.194,9.999999999994457e-05
KER-2,7/1/2025,07:50:00 am,0,2025-07-01 07:50:00,8.4809,9.195,0.0
KER-2,7/1/2025,08:00:00 am,0,2025-07-01 08:00:00,8.4804,9.195,0.0
KER-2,7/1/2025,08:10:00 am,0,2025-07-01 08:10:00,8.4803,9.195,0.00019999999999988915
KER-2,7/1/2025,08:20:00 am,0,2025-07-01 08:20:00,8.4803,9.197,0.0002000000000000668
KER-2,7/1/2025,08:30:00 am,0,2025-07-01 08:30:00,8.4795,9.199,0.0
KER-2,7/1/2025,08:40:00 am,0,2025-07-01 08:40:00,8.4786,9.199,0.00030000000000001136
KER-2,7/1/2025,08:50:00 am,0,2025-07-01 08:50:00,8.4765,9.202,9.999999999994457e-05
KER-2,7/1/2025,09:00:00 am,0,2025-07-01 09:00:00,8.4748,9.201,0.0
KER-2,7/1/2025,09:10:00 am,0,2025-07-01 09:10:00,8.4728,9.201,0.00019999999999988915
KER-2,7/1/2025,09:20:00 am,0,2025-07-01 09:20:00,8.4695,9.203,0.0002000000000000668
KER-2,7/1/2025,09:30:00 am,0,2025-07-01 09:30:00,8.4665,9.205,9.999999999994457e-05
KER-2,7/1/2025,09:40:00 am,0,2025-07-01 09:40:00,8.464,9.206,0.00010000000000012221
KER-2,7/1/2025,09:50:00 am,0,2025-07-01 09:50:00,8.4607,9.207,0.00039999999999995595
KER-2,7/1/2025,10:00:00 am,0,2025-07-01 10:00:00,8.4575,9.211,0.00019999999999988915
KER-2,7/1/2025,10:10:00 am,0,2025-07-01 10:10:00,8.4547,9.213,0.00010000000000012221
KER-2,7/1/2025,10:20:00 am,0,2025-07-01 10:20:00,8.4519,9.214,0.00019999999999988915
KER-2,7/1/2025,10:30:00 am,0,2025-07-01 10:30:00,8.4495,9.216,0.0002000000000000668
KER-2,7/1/2025,10:40:00 am,0,2025-07-01 10:40:00,8.4459,9.218,0.0002000000000000668
KER-2,7/1/2025,10:50:00 am,0,2025-07-01 10:50:00,8.4435,9.22,0.0
KER-2,7/1/2025,11:00:00 am,0,2025-07-01 11:00:00,8.4408,9.22,0.00039999999999995595
KER-2,7/1/2025,11:10:00 am,0,2025-07-01 11:10:00,8.439,9.224,0.0
KER-2,7/1/2025,11:20:00 am,0,2025-07-01 11:20:00,8.4367,9.224,0.0002000000000000668
KER-2,7/1/2025,11:30:00 am,0,2025-07-01 11:30:00,8.4347,9.226,0.00019999999999988915
KER-2,7/1/2025,11:40:00 am,0,2025-07-01 11:40:00,8.4317,9.228,0.00030000000000001136
KER-2,7/1/2025,11:50:00 am,0,2025-07-01 11:50:00,8.4286,9.231,9.999999999994457e-05
KER-2,7/1/2025,12:00:00 pm,0,2025-07-01 12:00:00,8.4265,9.23,0.00019999999999988915
KER-2,7/1/2025,12:10:00 pm,0,2025-07-01 12:10:00,8.4245,9.232,0.00030000000000001136
KER-2,7/1/2025,12:20:00 pm,0,2025-07-01 12:20:00,8.4223,9.235,0.0002000000000000668
KER-2,7/1/2025,12:30:00 pm,0,2025-07-01 12:30:00,8.4212,9.237,0.00030000000000001136
KER-2,7/1/2025,12:40:00 pm,0,2025-07-01 12:40:00,8.4188,9.24,0.0
KER-2,7/1/2025,12:50:00 pm,0,2025-07-01 12:50:00,8.4168,9.24,9.999999999994457e-05
KER-2,7/1/2025,01:00:00 pm,0,2025-07-01 13:00:00,8.4151,9.241,0.00010000000000012221
KER-2,7/1/2025,01:10:00 pm,0,2025-07-01 13:10:00,8.414,9.242,9.999999999994457e-05
KER-2,7/1/2025,01:20:00 pm,0,2025-07-01 13:20:00,8.4114,9.243,0.00019999999999988915
KER-2,7/1/2025,01:30:00 pm,0,2025-07-01 13:30:00,8.4094,9.245,0.00010000000000012221
KER-2,7/1/2025,01:40:00 pm,0,2025-07-01 13:40:00,8.4084,9.246,0.00010000000000012221
KER-2,7/1/2025,01:50:00 pm,0,2025-07-01 13:50:00,8.4068,9.245,0.0004000000000001336
KER-2,7/1/2025,02:00:00 pm,0,2025-07-01 14:00:00,8.4053,9.249,9.999999999994457e-05
KER-2,7/1/2025,02:10:00 pm,0,2025-07-01 14:10:00,8.4039,9.25,9.999999999994457e-05
KER-2,7/1/2025,02:20:00 pm,0,2025-07-01 14:20:00,8.4031,9.251,0.00010000000000012221
KER-2,7/1/2025,02:30:00 pm,0,2025-07-01 14:30:00,8.402,9.252,0.00010000000000012221
KER-2,7/1/2025,02:40:00 pm,0,2025-07-01 14:40:00,8.4011,9.251,0.00010000000000012221
KER-2,7/1/2025,02:50:00 pm,0,2025-07-01 14:50:00,8.3998,9.252,0.0
KER-2,7/1/2025,03:00:00 pm,0,2025-07-01 15:00:00,8.3991,9.252,0.0
KER-2,7/1/2025,03:10:00 pm,0,2025-07-01 15:10:00,8.3987,9.252,0.00019999999999988915
KER-2,7/1/2025,03:20:00 pm,0,2025-07-01 15:20:00,8.3976,9.254,0.0
KER-2,7/1/2025,03:30:00 pm,0,2025-07-01 15:30:00,8.397,9.254,0.00010000000000012221
KER-2,7/1/2025,03:40:00 pm,0,2025-07-01 15:40:00,8.3961,9.255,0.0002000000000000668
KER-2,7/1/2025,03:50:00 pm,0,2025-07-01 15:50:00,8.3963,9.253,9.999999999994457e-05
KER-2,7/1/2025,04:00:00 pm,0,2025-07-01 16:00:00,8.3974,9.252,9.999999999994457e-05
KER-2,7/1/2025,04:10:00 pm,0,2025-07-01 16:10:00,8.4006,9.253,0.00030000000000001136
KER-2,7/1/2025,04:20:00 pm,0,2025-07-01 16:20:00,8.4045,9.256,0.0002000000000000668
KER-2,7/1/2025,04:30:00 pm,0,2025-07-01 16:30:00,8.4063,9.254,9.999999999994457e-05
KER-2,7/1/2025,04:40:00 pm,0,2025-07-01 16:40:00,8.407,9.253,0.0002000000000000668
KER-2,7/1/2025,04:50:00 pm,0,2025-07-01 16:50:00,8.4048,9.255,0.0004000000000001336
KER-2,7/1/2025,05:00:00 pm,0,2025-07-01 17:00:00,8.4097,9.251,9.999999999994457e-05
KER-2,7/1/2025,05:10:00 pm,0,2025-07-01 17:10:00,8.4098,9.25,9.999999999994457e-05
KER-2,7/1/2025,05:20:00 pm,0,2025-07-01 17:20:00,8.4115,9.251,0.00010000000000012221
KER-2,7/1/2025,05:30:00 pm,0,2025-07-01 17:30:00,8.4131,9.252,0.0002000000000000668
KER-2,7/1/2025,05:40:00 pm,0,2025-07-01 17:40:00,8.4133,9.25,0.0
KER-2,7/1/2025,05:50:00 pm,0,2025-07-01 17:50:00,8.4152,9.25,9.999999999994457e-05
KER-2,7/1/2025,06:00:00 pm,0,2025-07-01 18:00:00,8.4179,9.249,9.999999999994457e-05
KER-2,7/1/2025,06:10:00 pm,0,2025-07-01 18:10:00,8.4203,9.25,9.999999999994457e-05
KER-2,7/1/2025,06:20:00 pm,0,2025-07-01 18:20:00,8.4231,9.251,0.00030000000000001136
KER-2,7/1/2025,06:30:00 pm,0,2025-07-01 18:30:00,8.4237,9.254,0.00039999999999995595
KER-2,7/1/2025,06:40:00 pm,0,2025-07-01 18:40:00,8.4231,9.25,0.0002000000000000668
KER-2,7/1/2025,06:50:00 pm,0,2025-07-01 18:50:00,8.4233,9.252,0.0002000000000000668
KER-2,7/1/2025,07:00:00 pm,0,2025-07-01 19:00:00,8.4217,9.25,9.999999999994457e-05
KER-2,7/1/2025,07:10:00 pm,0,2025-07-01 19:10:00,8.4185,9.251,0.00010000000000012221
KER-2,7/1/2025,07:20:00 pm,0,2025-07-01 19:20:00,8.4162,9.252,0.0
KER-2,7/1/2025,07:30:00 pm,0,2025-07-01 19:30:00,8.4166,9.252,0.0
KER-2,7/1/2025,07:40:00 pm,0,2025-07-01 19:40:00,8.4202,9.252,0.00010000000000012221
KER-2,7/1/2025,07:50:00 pm,0,2025-07-01 19:50:00,8.4246,9.251,0.0002000000000000668
KER-2,7/1/2025,08:00:00 pm,0,2025-07-01 20:00:00,8.4272,9.253,0.00030000000000001136
KER-2,7/1/2025,08:10:00 pm,0,2025-07-01 20:10:00,8.4326,9.25,0.00039999999999995595
KER-2,7/1/2025,08:20:00 pm,0,2025-07-01 20:20:00,8.4339,9.254,9.999999999994457e-05
KER-2,7/1/2025,08:30:00 pm,0,2025-07-01 20:30:00,8.4323,9.253,0.0
KER-2,7/1/2025,08:40:00 pm,0,2025-07-01 20:40:00,8.4292,9.253,0.0
KER-2,7/1/2025,08:50:00 pm,0,2025-07-01 20:50:00,8.4312,9.253,9.999999999994457e-05
KER-2,7/1/2025,09:00:00 pm,0,2025-07-01 21:00:00,8.4327,9.254,9.999999999994457e-05
KER-2,7/1/2025,09:10:00 pm,0,2025-07-01 21:10:00,8.4338,9.253,0.0002000000000000668
KER-2,7/1/2025,09:20:00 pm,0,2025-07-01 21:20:00,8.4352,9.255,0.0
KER-2,7/1/2025,09:30:00 pm,0,2025-07-01 21:30:00,8.4363,9.255,0.00010000000000012221
KER-2,7/1/2025,09:40:00 pm,0,2025-07-01 21:40:00,8.4384,9.254,0.0002000000000000668
KER-2,7/1/2025,09:50:00 pm,0,2025-07-01 21:50:00,8.4405,9.256,9.999999999994457e-05
KER-2,7/1/2025,10:00:00 pm,0,2025-07-01 22:00:00,8.4431,9.257,9.999999999994457e-05
KER-2,7/1/2025,10:10:00 pm,0,2025-07-01 22:10:00,8.4441,9.256,9.999999999994457e-05
KER-2,7/1/2025,10:20:00 pm,0,2025-07-01 22:20:00,8.4459,9.257,9.999999999994457e-05
KER-2,7/1/2025,10:30:00 pm,0,2025-07-01 22:30:00,8.4472,9.256,0.00019999999999988915
KER-2,7/1/2025,10:40:00 pm,0,2025-07-01 22:40:00,8.4488,9.258,0.00010000000000012221
KER-2,7/1/2025,10:50:00 pm,0,2025-07-01 22:50:00,8.4497,9.259,9.999999999994457e-05
KER-2,7/1/2025,11:00:00 pm,0,2025-07-01 23:00:00,8.4518,9.26,9.999999999994457e-05
KER-2,7/1/2025,11:10:00 pm,0,2025-07-01 23:10:00,8.4536,9.259,0.0
KER-2,7/1/2025,11:20:00 pm,0,2025-07-01 23:20:00,8.4551,9.259,9.999999999994457e-05
KER-2,7/1/2025,11:30:00 pm,0,2025-07-01 23:30:00,8.4558,9.26,0.0002000000000000668
KER-2,7/1/2025,11:40:00 pm,0,2025-07-01 23:40:00,8.4572,9.262,0.0
KER-2,7/1/2025,11:50:00 pm,0,2025-07-01 23:50:00,8.459,9.262,0.00010000000000012221
KER-2,7/2/2025,12:00:00 am,0,2025-07-02 00:00:00,8.4608,9.261,0.0
KER-2,7/2/2025,12:10:00 am,0,2025-07-02 00:10:00,8.4612,9.261,0.00030000000000001136
KER-2,7/2/2025,12:20:00 am,0,2025-07-02 00:20:00,8.4615,9.264,0.00019999999999988915
KER-2,7/2/2025,12:30:00 am,0,2025-07-02 00:30:00,8.4617,9.262,0.00019999999999988915
KER-2,7/2/2025,12:40:00 am,0,2025-07-02 00:40:00,8.4613,9.264,0.00010000000000012221
KER-2,7/2/2025,12:50:00 am,0,2025-07-02 00:50:00,8.4606,9.265,0.0
KER-2,7/2/2025,01:00:00 am,0,2025-07-02 01:00:00,8.4606,9.265,0.0
KER-2,7/2/2025,01:10:00 am,0,2025-07-02 01:10:00,8.461,9.265,0.00019999999999988915
KER-2,7/2/2025,01:20:00 am,0,2025-07-02 01:20:00,8.4616,9.267,9.999999999994457e-05
KER-2,7/2/2025,01:30:00 am,0,2025-07-02 01:30:00,8.4627,9.266,9.999999999994457e-05
KER-2,7/2/2025,01:40:00 am,0,2025-07-02 01:40:00,8.4633,9.267,0.00010000000000012221
KER-2,7/2/2025,01:50:00 am,0,2025-07-02 01:50:00,8.4641,9.268,0.0
KER-2,7/2/2025,02:00:00 am,0,2025-07-02 02:00:00,8.465,9.268,0.00010000000000012221
KER-2,7/2/2025,02:10:00 am,0,2025-07-02 02:10:00,8.4655,9.267,0.0002000000000000668
KER-2,7/2/2025,02:20:00 am,0,2025-07-02 02:20:00,8.4658,9.269,0.0002000000000000668
KER-2,7/2/2025,02:30:00 am,0,2025-07-02 02:30:00,8.4664,9.271,0.00010000000000012221
KER-2,7/2/2025,02:40:00 am,0,2025-07-02 02:40:00,8.4651,9.27,0.00030000000000001136
KER-2,7/2/2025,02:50:00 am,0,2025-07-02 02:50:00,8.4654,9.273,9.999999999994457e-05
KER-2,7/2/2025,03:00:00 am,0,2025-07-02 03:00:00,8.4655,9.272,9.999999999994457e-05
KER-2,7/2/2025,03:10:00 am,0,2025-07-02 03:10:00,8.4662,9.273,0.0002000000000000668
KER-2,7/2/2025,03:20:00 am,0,2025-07-02 03:20:00,8.4661,9.275,0.00010000000000012221
KER-2,7/2/2025,03:30:00 am,0,2025-07-02 03:30:00,8.4672,9.274,0.00010000000000012221
KER-2,7/2/2025,03:40:00 am,0,2025-07-02 03:40:00,8.467,9.275,0.00019999999999988915
KER-2,7/2/2025,03:50:00 am,0,2025-07-02 03:50:00,8.4672,9.277,9.999999999994457e-05
KER-2,7/2/2025,04:00:00 am,0,2025-07-02 04:00:00,8.4687,9.276,9.999999999994457e-05
KER-2,7/2/2025,04:10:00 am,0,2025-07-02 04:10:00,8.4691,9.277,0.0002000000000000668
KER-2,7/2/2025,04:20:00 am,0,2025-07-02 04:20:00,8.4697,9.279,0.0
KER-2,7/2/2025,04:30:00 am,0,2025-07-02 04:30:00,8.4708,9.279,9.999999999994457e-05
KER-2,7/2/2025,04:40:00 am,0,2025-07-02 04:40:00,8.4708,9.28,9.999999999994457e-05
KER-2,7/2/2025,04:50:00 am,0,2025-07-02 04:50:00,8.4715,9.279,0.0002000000000000668
KER-2,7/2/2025,05:00:00 am,0,2025-07-02 05:00:00,8.4725,9.281,0.0
KER-2,7/2/2025,05:10:00 am,0,2025-07-02 05:10:00,8.4732,9.281,0.00019999999999988915
KER-2,7/2/2025,05:20:00 am,0,2025-07-02 05:20:00,8.4741,9.283,0.00010000000000012221
KER-2,7/2/2025,05:30:00 am,0,2025-07-02 05:30:00,8.4756,9.284,0.0
KER-2,7/2/2025,05:40:00 am,0,2025-07-02 05:40:00,8.4765,9.284,0.0
KER-2,7/2/2025,05:50:00 am,0,2025-07-02 05:50:00,8.4768,9.284,0.00030000000000001136
KER-2,7/2/2025,06:00:00 am,0,2025-07-02 06:00:00,8.477,9.287,9.999999999994457e-05
KER-2,7/2/2025,06:10:00 am,0,2025-07-02 06:10:00,8.4777,9.288,0.00030000000000001136
KER-2,7/2/2025,06:20:00 am,0,2025-07-02 06:20:00,8.4782,9.291,0.0005000000000000782
KER-2,7/2/2025,06:30:00 am,0,2025-07-02 06:30:00,8.479,9.286,0.00030000000000001136
KER-2,7/2/2025,06:40:00 am,0,2025-07-02 06:40:00,8.4786,9.289,0.0002000000000000668
KER-2,7/2/2025,06:50:00 am,0,2025-07-02 06:50:00,8.4795,9.291,0.0
KER-2,7/2/2025,07:00:00 am,0,2025-07-02 07:00:00,8.4799,9.291,0.0
KER-2,7/2/2025,07:10:00 am,0,2025-07-02 07:10:00,8.481,9.291,0.0
KER-2,7/2/2025,07:20:00 am,0,2025-07-02 07:20:00,8.4816,9.291,9.999999999994457e-05
KER-2,7/2/2025,07:30:00 am,0,2025-07-02 07:30:00,8.4821,9.292,9.999999999994457e-05
KER-2,7/2/2025,07:40:00 am,0,2025-07-02 07:40:00,8.4828,9.293,0.0002000000000000668
KER-2,7/2/2025,07:50:00 am,0,2025-07-02 07:50:00,8.4822,9.295,0.0002000000000000668
KER-2,7/2/2025,08:00:00 am,0,2025-07-02 08:00:00,8.4826,9.297,0.00010000000000012221
KER-2,7/2/2025,08:10:00 am,0,2025-07-02 08:10:00,8.4825,9.296,0.0002000000000000668
KER-2,7/2/2025,08:20:00 am,0,2025-07-02 08:20:00,8.482,9.298,0.0
KER-2,7/2/2025,08:30:00 am,0,2025-07-02 08:30:00,8.4823,9.298,0.0
KER-2,7/2/2025,08:40:00 am,0,2025-07-02 08:40:00,8.4821,9.298,9.999999999994457e-05
KER-2,7/2/2025,08:50:00 am,0,2025-07-02 08:50:00,8.4807,9.299,0.0
KER-2,7/2/2025,09:00:00 am,0,2025-07-02 09:00:00,8.479,9.299,0.00030000000000001136
KER-2,7/2/2025,09:10:00 am,0,2025-07-02 09:10:00,8.4779,9.302,0.00010000000000012221
KER-2,7/2/2025,09:20:00 am,0,2025-07-02 09:20:00,8.4756,9.303,9.999999999994457e-05
KER-2,7/2/2025,09:30:00 am,0,2025-07-02 09:30:00,8.4727,9.304,9.999999999994457e-05
KER-2,7/2/2025,09:40:00 am,0,2025-07-02 09:40:00,8.47,9.305,9.999999999994457e-05
KER-2,7/2/2025,09:50:00 am,0,2025-07-02 09:50:00,8.4671,9.306,0.00030000000000001136
KER-2,7/2/2025,10:00:00 am,0,2025-07-02 10:00:00,8.4637,9.309,0.0002000000000000668
KER-2,7/2/2025,10:10:00 am,0,2025-07-02 10:10:00,8.461,9.311,9.999999999994457e-05
KER-2,7/2/2025,10:20:00 am,0,2025-07-02 10:20:00,8.4577,9.312,0.0
KER-2,7/2/2025,10:30:00 am,0,2025-07-02 10:30:00,8.4546,9.312,0.0004000000000001336
KER-2,7/2/2025,10:40:00 am,0,2025-07-02 10:40:00,8.4515,9.316,9.999999999994457e-05
KER-2,7/2/2025,10:50:00 am,0,2025-07-02 10:50:00,8.4478,9.317,0.00030000000000001136
KER-2,7/2/2025,11:00:00 am,0,2025-07-02 11:00:00,8.4441,9.32,9.999999999994457e-05
KER-2,7/2/2025,11:10:00 am,0,2025-07-02 11:10:00,8.4409,9.319,0.0004999999999999005
KER-2,7/2/2025,11:20:00 am,0,2025-07-02 11:20:00,8.4376,9.324,0.0
KER-2,7/2/2025,11:30:00 am,0,2025-07-02 11:30:00,8.4346,9.324,0.0002000000000000668
KER-2,7/2/2025,11:40:00 am,0,2025-07-02 11:40:00,8.4316,9.326,9.999999999994457e-05
KER-2,7/2/2025,11:50:00 am,0,2025-07-02 11:50:00,8.4291,9.327,9.999999999994457e-05
KER-2,7/2/2025,12:00:00 pm,0,2025-07-02 12:00:00,8.4268,9.326,0.00039999999999995595
KER-2,7/2/2025,12:10:00 pm,0,2025-07-02 12:10:00,8.4245,9.33,0.00030000000000001136
KER-2,7/2/2025,12:20:00 pm,0,2025-07-02 12:20:00,8.4221,9.333,0.0
KER-2,7/2/2025,12:30:00 pm,0,2025-07-02 12:30:00,8.4203,9.333,0.0002000000000000668
KER-2,7/2/2025,12:40:00 pm,0,2025-07-02 12:40:00,8.4176,9.335,0.0
KER-2,7/2/2025,12:50:00 pm,0,2025-07-02 12:50:00,8.416,9.335,0.00039999999999995595
KER-2,7/2/2025,01:00:00 pm,0,2025-07-02 13:00:00,8.4143,9.339,0.0
KER-2,7/2/2025,01:10:00 pm,0,2025-07-02 13:10:00,8.4118,9.339,0.00019999999999988915
KER-2,7/2/2025,01:20:00 pm,0,2025-07-02 13:20:00,8.4097,9.341,0.00010000000000012221
KER-2,7/2/2025,01:30:00 pm,0,2025-07-02 13:30:00,8.408,9.342,0.0
KER-2,7/2/2025,01:40:00 pm,0,2025-07-02 13:40:00,8.4082,9.342,0.00019999999999988915
KER-2,7/2/2025,01:50:00 pm,0,2025-07-02 13:50:00,8.408,9.344,0.00019999999999988915
KER-2,7/2/2025,02:00:00 pm,0,2025-07-02 14:00:00,8.4074,9.342,0.00019999999999988915
KER-2,7/2/2025,02:10:00 pm,0,2025-07-02 14:10:00,8.4063,9.344,0.00010000000000012221
KER-2,7/2/2025,02:20:00 pm,0,2025-07-02 14:20:00,8.4047,9.345,9.999999999994457e-05
KER-2,7/2/2025,02:30:00 pm,0,2025-07-02 14:30:00,8.4026,9.346,9.999999999994457e-05
KER-2,7/2/2025,02:40:00 pm,0,2025-07-02 14:40:00,8.4019,9.345,0.00030000000000001136
KER-2,7/2/2025,02:50:00 pm,0,2025-07-02 14:50:00,8.4016,9.348,0.0002000000000000668
KER-2,7/2/2025,03:00:00 pm,0,2025-07-02 15:00:00,8.4013,9.346,9.999999999994457e-05
KER-2,7/2/2025,03:10:00 pm,0,2025-07-02 15:10:00,8.4006,9.347,0.0
KER-2,7/2/2025,03:20:00 pm,0,2025-07-02 15:20:00,8.3998,9.347,0.0
KER-2,7/2/2025,03:30:00 pm,0,2025-07-02 15:30:00,8.3994,9.347,9.999999999994457e-05
KER-2,7/2/2025,03:40:00 pm,0,2025-07-02 15:40:00,8.3952,9.346,0.0002000000000000668
KER-2,7/2/2025,03:50:00 pm,0,2025-07-02 15:50:00,8.3934,9.348,0.0
KER-2,7/2/2025,04:00:00 pm,0,2025-07-02 16:00:00,8.3917,9.348,0.0002000000000000668
KER-2,7/2/2025,04:10:00 pm,0,2025-07-02 16:10:00,8.3914,9.346,0.0002000000000000668
KER-2,7/2/2025,04:20:00 pm,0,2025-07-02 16:20:00,8.3911,9.348,9.999999999994457e-05
KER-2,7/2/2025,04:30:00 pm,0,2025-07-02 16:30:00,8.3906,9.349,0.0
KER-2,7/2/2025,04:40:00 pm,0,2025-07-02 16:40:00,8.3896,9.349,0.0
KER-2,7/2/2025,04:50:00 pm,0,2025-07-02 16:50:00,8.3893,9.349,9.999999999994457e-05
KER-2,7/2/2025,05:00:00 pm,0,2025-07-02 17:00:00,8.3891,9.35,0.00019999999999988915
KER-2,7/2/2025,05:10:00 pm,0,2025-07-02 17:10:00,8.3888,9.348,9.999999999994457e-05
KER-2,7/2/2025,05:20:00 pm,0,2025-07-02 17:20:00,8.3883,9.349,0.0
KER-2,7/2/2025,05:30:00 pm,0,2025-07-02 17:30:00,8.3882,9.349,0.0
KER-2,7/2/2025,05:40:00 pm,0,2025-07-02 17:40:00,8.3881,9.349,0.0002000000000000668
KER-2,7/2/2025,05:50:00 pm,0,2025-07-02 17:50:00,8.3883,9.347,0.00010000000000012221
KER-2,7/2/2025,06:00:00 pm,0,2025-07-02 18:00:00,8.3892,9.348,0.0
KER-2,7/2/2025,06:10:00 pm,0,2025-07-02 18:10:00,8.3899,9.348,0.00010000000000012221
KER-2,7/2/2025,06:20:00 pm,0,2025-07-02 18:20:00,8.3907,9.347,0.00030000000000001136
KER-2,7/2/2025,06:30:00 pm,0,2025-07-02 18:30:00,8.392,9.344,0.00010000000000012221
KER-2,7/2/2025,06:40:00 pm,0,2025-07-02 18:40:00,8.3934,9.345,0.00019999999999988915
KER-2,7/2/2025,06:50:00 pm,0,2025-07-02 18:50:00,8.3957,9.347,0.00019999999999988915
KER-2,7/2/2025,07:00:00 pm,0,2025-07-02 19:00:00,8.3971,9.345,0.00030000000000001136
KER-2,7/2/2025,07:10:00 pm,0,2025-07-02 19:10:00,8.3987,9.342,0.00019999999999988915
KER-2,7/2/2025,07:20:00 pm,0,2025-07-02 19:20:00,8.4008,9.344,0.00010000000000012221
KER-2,7/2/2025,07:30:00 pm,0,2025-07-02 19:30:00,8.4032,9.345,0.0002000000000000668
KER-2,7/2/2025,07:40:00 pm,0,2025-07-02 19:40:00,8.4057,9.343,0.0
KER-2,7/2/2025,07:50:00 pm,0,2025-07-02 19:50:00,8.4082,9.343,0.0002000000000000668
KER-2,7/2/2025,08:00:00 pm,0,2025-07-02 20:00:00,8.4116,9.341,0.0002000000000000668
KER-2,7/2/2025,08:10:00 pm,0,2025-07-02 20:10:00,8.4143,9.343,0.0
KER-2,7/2/2025,08:20:00 pm,0,2025-07-02 20:20:00,8.4166,9.343,9.999999999994457e-05
KER-2,7/2/2025,08:30:00 pm,0,2025-07-02 20:30:00,8.4181,9.342,0.00030000000000001136
KER-2,7/2/2025,08:40:00 pm,0,2025-07-02 20:40:00,8.4198,9.339,9.999999999994457e-05
KER-2,7/2/2025,08:50:00 pm,0,2025-07-02 20:50:00,8.4221,9.34,0.0
KER-2,7/2/2025,09:00:00 pm,0,2025-07-02 21:00:00,8.4241,9.34,9.999999999994457e-05
KER-2,7/2/2025,09:10:00 pm,0,2025-07-02 21:10:00,8.426,9.341,0.00019999999999988915
KER-2,7/2/2025,09:20:00 pm,0,2025-07-02 21:20:00,8.4278,9.339,9.999999999994457e-05
KER-2,7/2/2025,09:30:00 pm,0,2025-07-02 21:30:00,8.4299,9.34,0.0
KER-2,7/2/2025,09:40:00 pm,0,2025-07-02 21:40:00,8.4316,9.34,0.0
KER-2,7/2/2025,09:50:00 pm,0,2025-07-02 21:50:00,8.4327,9.34,0.0
KER-2,7/2/2025,10:00:00 pm,0,2025-07-02 22:00:00,8.4344,9.34,9.999999999994457e-05
KER-2,7/2/2025,10:10:00 pm,0,2025-07-02 22:10:00,8.4356,9.341,9.999999999994457e-05
KER-2,7/2/2025,10:20:00 pm,0,2025-07-02 22:20:00,8.437,9.34,0.0002000000000000668
KER-2,7/2/2025,10:30:00 pm,0,2025-07-02 22:30:00,8.4378,9.342,0.00010000000000012221
KER-2,7/2/2025,10:40:00 pm,0,2025-07-02 22:40:00,8.4389,9.341,0.0
KER-2,7/2/2025,10:50:00 pm,0,2025-07-02 22:50:00,8.4403,9.341,0.0
KER-2,7/2/2025,11:00:00 pm,0,2025-07-02 23:00:00,8.4424,9.341,0.00010000000000012221
KER-2,7/2/2025,11:10:00 pm,0,2025-07-02 23:10:00,8.4432,9.342,0.0
KER-2,7/2/2025,11:20:00 pm,0,2025-07-02 23:20:00,8.445,9.342,0.00019999999999988915
KER-2,7/2/2025,11:30:00 pm,0,2025-07-02 23:30:00,8.4465,9.344,9.999999999994457e-05
KER-2,7/2/2025,11:40:00 pm,0,2025-07-02 23:40:00,8.4468,9.343,9.999999999994457e-05
KER-2,7/2/2025,11:50:00 pm,0,2025-07-02 23:50:00,8.448,9.344,0.00010000000000012221
KER-2,7/3/2025,12:00:00 am,0,2025-07-03 00:00:00,8.4489,9.345,0.0
KER-2,7/3/2025,12:10:00 am,0,2025-07-03 00:10:00,8.4503,9.345,9.999999999994457e-05
KER-2,7/3/2025,12:20:00 am,0,2025-07-03 00:20:00,8.4513,9.346,0.00030000000000001136
KER-2,7/3/2025,12:30:00 am,0,2025-07-03 00:30:00,8.453,9.343,9.999999999994457e-05
KER-2,7/3/2025,12:40:00 am,0,2025-07-03 00:40:00,8.4533,9.344,0.0002000000000000668
KER-2,7/3/2025,12:50:00 am,0,2025-07-03 00:50:00,8.454,9.346,9.999999999994457e-05
KER-2,7/3/2025,01:00:00 am,0,2025-07-03 01:00:00,8.4542,9.345,9.999999999994457e-05
KER-2,7/3/2025,01:10:00 am,0,2025-07-03 01:10:00,8.4548,9.346,0.0002000000000000668
KER-2,7/3/2025,01:20:00 am,0,2025-07-03 01:20:00,8.4554,9.348,0.00010000000000012221
KER-2,7/3/2025,01:30:00 am,0,2025-07-03 01:30:00,8.4563,9.347,0.0
KER-2,7/3/2025,01:40:00 am,0,2025-07-03 01:40:00,8.4566,9.347,9.999999999994457e-05
KER-2,7/3/2025,01:50:00 am,0,2025-07-03 01:50:00,8.458,9.346,0.00039999999999995595
KER-2,7/3/2025,02:00:00 am,0,2025-07-03 02:00:00,8.4585,9.35,0.0
KER-2,7/3/2025,02:10:00 am,0,2025-07-03 02:10:00,8.4582,9.35,0.00019999999999988915
KER-2,7/3/2025,02:20:00 am,0,2025-07-03 02:20:00,8.4586,9.348,0.00019999999999988915
KER-2,7/3/2025,02:30:00 am,0,2025-07-03 02:30:00,8.4597,9.35,0.0002000000000000668
KER-2,7/3/2025,02:40:00 am,0,2025-07-03 02:40:00,8.4602,9.352,9.999999999994457e-05
KER-2,7/3/2025,02:50:00 am,0,2025-07-03 02:50:00,8.4599,9.351,0.00010000000000012221
KER-2,7/3/2025,03:00:00 am,0,2025-07-03 03:00:00,8.4595,9.35,0.00030000000000001136
KER-2,7/3/2025,03:10:00 am,0,2025-07-03 03:10:00,8.4594,9.353,0.0
KER-2,7/3/2025,03:20:00 am,0,2025-07-03 03:20:00,8.4602,9.353,0.00019999999999988915
KER-2,7/3/2025,03:30:00 am,0,2025-07-03 03:30:00,8.4604,9.351,0.0002999999999998337
KER-2,7/3/2025,03:40:00 am,0,2025-07-03 03:40:00,8.4608,9.354,0.0
KER-2,7/3/2025,03:50:00 am,0,2025-07-03 03:50:00,8.4612,9.354,9.999999999994457e-05
KER-2,7/3/2025,04:00:00 am,0,2025-07-03 04:00:00,8.4611,9.353,9.999999999994457e-05
KER-2,7/3/2025,04:10:00 am,0,2025-07-03 04:10:00,8.4615,9.354,0.00010000000000012221
KER-2,7/3/2025,04:20:00 am,0,2025-07-03 04:20:00,8.4623,9.355,0.00010000000000012221
KER-2,7/3/2025,04:30:00 am,0,2025-07-03 04:30:00,8.4627,9.354,0.0004000000000001336
KER-2,7/3/2025,04:40:00 am,0,2025-07-03 04:40:00,8.463,9.358,0.0002000000000000668
KER-2,7/3/2025,04:50:00 am,0,2025-07-03 04:50:00,8.4634,9.356,0.0
KER-2,7/3/2025,05:00:00 am,0,2025-07-03 05:00:00,8.4638,9.356,9.999999999994457e-05
KER-2,7/3/2025,05:10:00 am,0,2025-07-03 05:10:00,8.4645,9.357,0.0
KER-2,7/3/2025,05:20:00 am,0,2025-07-03 05:20:00,8.4652,9.357,0.0002000000000000668
KER-2,7/3/2025,05:30:00 am,0,2025-07-03 05:30:00,8.4665,9.359,0.0
KER-2,7/3/2025,05:40:00 am,0,2025-07-03 05:40:00,8.4668,9.359,0.0
KER-2,7/3/2025,05:50:00 am,0,2025-07-03 05:50:00,8.4681,9.359,0.0002000000000000668
KER-2,7/3/2025,06:00:00 am,0,2025-07-03 06:00:00,8.4679,9.361,0.0
KER-2,7/3/2025,06:10:00 am,0,2025-07-03 06:10:00,8.469,9.361,0.00010000000000012221
KER-2,7/3/2025,06:20:00 am,0,2025-07-03 06:20:00,8.4696,9.36,0.00030000000000001136
KER-2,7/3/2025,06:30:00 am,0,2025-07-03 06:30:00,8.4697,9.363,9.999999999994457e-05
KER-2,7/3/2025,06:40:00 am,0,2025-07-03 06:40:00,8.47,9.362,0.00030000000000001136
KER-2,7/3/2025,06:50:00 am,0,2025-07-03 06:50:00,8.4707,9.365,9.999999999994457e-05
KER-2,7/3/2025,07:00:00 am,0,2025-07-03 07:00:00,8.4707,9.364,0.00030000000000001136
KER-2,7/3/2025,07:10:00 am,0,2025-07-03 07:10:00,8.4721,9.367,9.999999999994457e-05
KER-2,7/3/2025,07:20:00 am,0,2025-07-03 07:20:00,8.4723,9.368,9.999999999994457e-05
KER-2,7/3/2025,07:30:00 am,0,2025-07-03 07:30:00,8.4737,9.367,0.00019999999999988915
KER-2,7/3/2025,07:40:00 am,0,2025-07-03 07:40:00,8.4741,9.369,9.999999999994457e-05
KER-2,7/3/2025,07:50:00 am,0,2025-07-03 07:50:00,8.4736,9.37,9.999999999994457e-05
KER-2,7/3/2025,08:00:00 am,0,2025-07-03 08:00:00,8.4735,9.369,0.0
KER-2,7/3/2025,08:10:00 am,0,2025-07-03 08:10:00,8.4734,9.369,0.00030000000000001136
KER-2,7/3/2025,08:20:00 am,0,2025-07-03 08:20:00,8.4729,9.372,0.0002000000000000668
KER-2,7/3/2025,08:30:00 am,0,2025-07-03 08:30:00,8.4731,9.37,0.0005000000000000782
KER-2,7/3/2025,08:40:00 am,0,2025-07-03 08:40:00,8.4728,9.375,0.0002000000000000668
KER-2,7/3/2025,08:50:00 am,0,2025-07-03 08:50:00,8.4733,9.373,0.00010000000000012221
KER-2,7/3/2025,09:00:00 am,0,2025-07-03 09:00:00,8.4726,9.374,0.00019999999999988915
KER-2,7/3/2025,09:10:00 am,0,2025-07-03 09:10:00,8.4706,9.376,0.0
KER-2,7/3/2025,09:20:00 am,0,2025-07-03 09:20:00,8.4691,9.376,0.0002000000000000668
KER-2,7/3/2025,09:30:00 am,0,2025-07-03 09:30:00,8.4666,9.378,0.0
KER-2,7/3/2025,09:40:00 am,0,2025-07-03 09:40:00,8.4643,9.378,0.00030000000000001136
KER-2,7/3/2025,09:50:00 am,0,2025-07-03 09:50:00,8.4619,9.381,9.999999999994457e-05
KER-2,7/3/2025,10:00:00 am,0,2025-07-03 10:00:00,8.458,9.382,0.0002000000000000668
KER-2,7/3/2025,10:10:00 am,0,2025-07-03 10:10:00,8.4557,9.384,0.0
KER-2,7/3/2025,10:20:00 am,0,2025-07-03 10:20:00,8.4517,9.384,0.00039999999999995595
KER-2,7/3/2025,10:30:00 am,0,2025-07-03 10:30:00,8.449,9.388,9.999999999994457e-05
KER-2,7/3/2025,10:40:00 am,0,2025-07-03 10:40:00,8.4431,9.387,0.0004999999999999005
KER-2,7/3/2025,10:50:00 am,0,2025-07-03 10:50:00,8.4407,9.392,0.00019999999999988915
KER-2,7/3/2025,11:00:00 am,0,2025-07-03 11:00:00,8.4389,9.39,0.00030000000000001136
KER-2,7/3/2025,11:10:00 am,0,2025-07-03 11:10:00,8.4369,9.393,0.00019999999999988915
KER-2,7/3/2025,11:20:00 am,0,2025-07-03 11:20:00,8.4334,9.395,0.00010000000000012221
KER-2,7/3/2025,11:30:00 am,0,2025-07-03 11:30:00,8.4309,9.396,0.0
KER-2,7/3/2025,11:40:00 am,0,2025-07-03 11:40:00,8.4289,9.396,0.00039999999999995595
KER-2,7/3/2025,11:50:00 am,0,2025-07-03 11:50:00,8.4266,9.4,0.00010000000000012221
KER-2,7/3/2025,12:00:00 pm,0,2025-07-03 12:00:00,8.4228,9.399,0.0004000000000001336
KER-2,7/3/2025,12:10:00 pm,0,2025-07-03 12:10:00,8.4207,9.403,9.999999999994457e-05
KER-2,7/3/2025,12:20:00 pm,0,2025-07-03 12:20:00,8.4191,9.404,9.999999999994457e-05
KER-2,7/3/2025,12:30:00 pm,0,2025-07-03 12:30:00,8.4178,9.405,0.0
KER-2,7/3/2025,12:40:00 pm,0,2025-07-03 12:40:00,8.4157,9.405,0.0002000000000000668
KER-2,7/3/2025,12:50:00 pm,0,2025-07-03 12:50:00,8.4135,9.407,9.999999999994457e-05
KER-2,7/3/2025,01:00:00 pm,0,2025-07-03 13:00:00,8.4078,9.408,0.00010000000000012221
KER-2,7/3/2025,01:10:00 pm,0,2025-07-03 13:10:00,8.4056,9.409,9.999999999994457e-05
KER-2,7/3/2025,01:20:00 pm,0,2025-07-03 13:20:00,8.4046,9.41,0.00030000000000001136
KER-2,7/3/2025,01:30:00 pm,0,2025-07-03 13:30:00,8.4027,9.413,0.0002000000000000668
KER-2,7/3/2025,01:40:00 pm,0,2025-07-03 13:40:00,8.4005,9.411,0.0002000000000000668
KER-2,7/3/2025,01:50:00 pm,0,2025-07-03 13:50:00,8.3993,9.413,9.999999999994457e-05
KER-2,7/3/2025,02:00:00 pm,0,2025-07-03 14:00:00,8.3973,9.414,9.999999999994457e-05
KER-2,7/3/2025,02:10:00 pm,0,2025-07-03 14:10:00,8.3982,9.415,9.999999999994457e-05
KER-2,7/3/2025,02:20:00 pm,0,2025-07-03 14:20:00,8.3974,9.414,9.999999999994457e-05
KER-2,7/3/2025,02:30:00 pm,0,2025-07-03 14:30:00,8.3973,9.415,0.0
KER-2,7/3/2025,02:40:00 pm,0,2025-07-03 14:40:00,8.3978,9.415,0.00010000000000012221
KER-2,7/3/2025,02:50:00 pm,0,2025-07-03 14:50:00,8.3974,9.416,9.999999999994457e-05
KER-2,7/3/2025,03:00:00 pm,0,2025-07-03 15:00:00,8.3973,9.417,9.999999999994457e-05
KER-2,7/3/2025,03:10:00 pm,0,2025-07-03 15:10:00,8.3973,9.416,0.0
KER-2,7/3/2025,03:20:00 pm,0,2025-07-03 15:20:00,8.3975,9.416,9.999999999994457e-05
KER-2,7/3/2025,03:30:00 pm,0,2025-07-03 15:30:00,8.3981,9.417,0.0
KER-2,7/3/2025,03:40:00 pm,0,2025-07-03 15:40:00,8.3987,9.417,9.999999999994457e-05
KER-2,7/3/2025,03:50:00 pm,0,2025-07-03 15:50:00,8.3991,9.416,0.00010000000000012221
KER-2,7/3/2025,04:00:00 pm,0,2025-07-03 16:00:00,8.3984,9.415,0.00010000000000012221
KER-2,7/3/2025,04:10:00 pm,0,2025-07-03 16:10:00,8.3973,9.416,0.00010000000000012221
KER-2,7/3/2025,04:20:00 pm,0,2025-07-03 16:20:00,8.3967,9.415,0.0
KER-2,7/3/2025,04:30:00 pm,0,2025-07-03 16:30:00,8.3958,9.415,0.0002000000000000668
KER-2,7/3/2025,04:40:00 pm,0,2025-07-03 16:40:00,8.3952,9.417,0.0
KER-2,7/3/2025,04:50:00 pm,0,2025-07-03 16:50:00,8.3946,9.417,9.999999999994457e-05
KER-2,7/3/2025,05:00:00 pm,0,2025-07-03 17:00:00,8.3942,9.418,0.00030000000000001136
KER-2,7/3/2025,05:10:00 pm,0,2025-07-03 17:10:00,8.3937,9.415,0.00010000000000012221
KER-2,7/3/2025,05:20:00 pm,0,2025-07-03 17:20:00,8.3944,9.416,0.0
KER-2,7/3/2025,05:30:00 pm,0,2025-07-03 17:30:00,8.3948,9.416,0.00010000000000012221
KER-2,7/3/2025,05:40:00 pm,0,2025-07-03 17:40:00,8.3945,9.415,0.00010000000000012221
KER-2,7/3/2025,05:50:00 pm,0,2025-07-03 17:50:00,8.3955,9.416,9.999999999994457e-05
KER-2,7/3/2025,06:00:00 pm,0,2025-07-03 18:00:00,8.3958,9.417,0.0002000000000000668
KER-2,7/3/2025,06:10:00 pm,0,2025-07-03 18:10:00,8.3955,9.415,9.999999999994457e-05
KER-2,7/3/2025,06:20:00 pm,0,2025-07-03 18:20:00,8.3964,9.414,0.0
KER-2,7/3/2025,06:30:00 pm,0,2025-07-03 18:30:00,8.3966,9.414,0.0
KER-2,7/3/2025,06:40:00 pm,0,2025-07-03 18:40:00,8.3982,9.414,9.999999999994457e-05
KER-2,7/3/2025,06:50:00 pm,0,2025-07-03 18:50:00,8.3995,9.415,9.999999999994457e-05
KER-2,7/3/2025,07:00:00 pm,0,2025-07-03 19:00:00,8.4006,9.414,0.0
KER-2,7/3/2025,07:10:00 pm,0,2025-07-03 19:10:00,8.4021,9.414,9.999999999994457e-05
KER-2,7/3/2025,07:20:00 pm,0,2025-07-03 19:20:00,8.4032,9.413,9.999999999994457e-05
KER-2,7/3/2025,07:30:00 pm,0,2025-07-03 19:30:00,8.4051,9.412,0.00010000000000012221
KER-2,7/3/2025,07:40:00 pm,0,2025-07-03 19:40:00,8.4065,9.411,9.999999999994457e-05
KER-2,7/3/2025,07:50:00 pm,0,2025-07-03 19:50:00,8.4088,9.41,9.999999999994457e-05
KER-2,7/3/2025,08:00:00 pm,0,2025-07-03 20:00:00,8.4105,9.409,0.0
KER-2,7/3/2025,08:10:00 pm,0,2025-07-03 20:10:00,8.4128,9.409,0.0
KER-2,7/3/2025,08:20:00 pm,0,2025-07-03 20:20:00,8.4142,9.409,0.0
KER-2,7/3/2025,08:30:00 pm,0,2025-07-03 20:30:00,8.4159,9.409,0.00010000000000012221
KER-2,7/3/2025,08:40:00 pm,0,2025-07-03 20:40:00,8.4164,9.408,0.00010000000000012221
KER-2,7/3/2025,08:50:00 pm,0,2025-07-03 20:50:00,8.4175,9.409,9.999999999994457e-05
KER-2,7/3/2025,09:00:00 pm,0,2025-07-03 21:00:00,8.4189,9.41,9.999999999994457e-05
KER-2,7/3/2025,09:10:00 pm,0,2025-07-03 21:10:00,8.4203,9.409,0.00010000000000012221
KER-2,7/3/2025,09:20:00 pm,0,2025-07-03 21:20:00,8.4227,9.408,0.0
KER-2,7/3/2025,09:30:00 pm,0,2025-07-03 21:30:00,8.4252,9.408,0.00019999999999988915
KER-2,7/3/2025,09:40:00 pm,0,2025-07-03 21:40:00,8.4269,9.406,0.00019999999999988915
KER-2,7/3/2025,09:50:00 pm,0,2025-07-03 21:50:00,8.429,9.408,0.0
KER-2,7/3/2025,10:00:00 pm,0,2025-07-03 22:00:00,8.4312,9.408,0.0002000000000000668
KER-2,7/3/2025,10:10:00 pm,0,2025-07-03 22:10:00,8.4317,9.41,0.0002000000000000668
KER-2,7/3/2025,10:20:00 pm,0,2025-07-03 22:20:00,8.4326,9.408,0.0002000000000000668
KER-2,7/3/2025,10:30:00 pm,0,2025-07-03 22:30:00,8.4335,9.41,0.0002000000000000668
KER-2,7/3/2025,10:40:00 pm,0,2025-07-03 22:40:00,8.4336,9.408,0.00010000000000012221
KER-2,7/3/2025,10:50:00 pm,0,2025-07-03 22:50:00,8.434,9.409,0.00010000000000012221
KER-2,7/3/2025,11:00:00 pm,0,2025-07-03 23:00:00,8.4346,9.408,9.999999999994457e-05
KER-2,7/3/2025,11:10:00 pm,0,2025-07-03 23:10:00,8.4351,9.407,0.00030000000000001136
KER-2,7/3/2025,11:20:00 pm,0,2025-07-03 23:20:00,8.4361,9.41,9.999999999994457e-05
KER-2,7/3/2025,11:30:00 pm,0,2025-07-03 23:30:00,8.4364,9.411,0.00010000000000012221
KER-2,7/3/2025,11:40:00 pm,0,2025-07-03 23:40:00,8.4376,9.412,0.0002000000000000668
KER-2,7/3/2025,11:50:00 pm,0,2025-07-03 23:50:00,8.4389,9.41,0.0002000000000000668
KER-2,7/4/2025,12:00:00 am,0,2025-07-04 00:00:00,8.4403,9.412,0.00010000000000012221
KER-2,7/4/2025,12:10:00 am,0,2025-07-04 00:10:00,8.4407,9.411,9.999999999994457e-05
KER-2,7/4/2025,12:20:00 am,0,2025-07-04 00:20:00,8.4408,9.41,9.999999999994457e-05
KER-2,7/4/2025,12:30:00 am,0,2025-07-04 00:30:00,8.4417,9.411,0.0002000000000000668
KER-2,7/4/2025,12:40:00 am,0,2025-07-04 00:40:00,8.443,9.413,0.0002000000000000668
KER-2,7/4/2025,12:50:00 am,0,2025-07-04 00:50:00,8.4438,9.411,0.0002000000000000668
KER-2,7/4/2025,01:00:00 am,0,2025-07-04 01:00:00,8.4444,9.413,9.999999999994457e-05
KER-2,7/4/2025,01:10:00 am,0,2025-07-04 01:10:00,8.4456,9.412,0.0
KER-2,7/4/2025,01:20:00 am,0,2025-07-04 01:20:00,8.4467,9.412,0.00010000000000012221
KER-2,7/4/2025,01:30:00 am,0,2025-07-04 01:30:00,8.4473,9.411,0.00010000000000012221
KER-2,7/4/2025,01:40:00 am,0,2025-07-04 01:40:00,8.4485,9.412,0.00019999999999988915
KER-2,7/4/2025,01:50:00 am,0,2025-07-04 01:50:00,8.449,9.414,9.999999999994457e-05
KER-2,7/4/2025,02:00:00 am,0,2025-07-04 02:00:00,8.4503,9.415,9.999999999994457e-05
KER-2,7/4/2025,02:10:00 am,0,2025-07-04 02:10:00,8.4509,9.414,9.999999999994457e-05
KER-2,7/4/2025,02:20:00 am,0,2025-07-04 02:20:00,8.4519,9.415,9.999999999994457e-05
KER-2,7/4/2025,02:30:00 am,0,2025-07-04 02:30:00,8.453,9.414,9.999999999994457e-05
KER-2,7/4/2025,02:40:00 am,0,2025-07-04 02:40:00,8.4548,9.415,0.0002000000000000668
KER-2,7/4/2025,02:50:00 am,0,2025-07-04 02:50:00,8.4547,9.417,0.0
KER-2,7/4/2025,03:00:00 am,0,2025-07-04 03:00:00,8.4552,9.417,9.999999999994457e-05
KER-2,7/4/2025,03:10:00 am,0,2025-07-04 03:10:00,8.4551,9.416,0.0
KER-2,7/4/2025,03:20:00 am,0,2025-07-04 03:20:00,8.4556,9.416,0.00019999999999988915
KER-2,7/4/2025,03:30:00 am,0,2025-07-04 03:30:00,8.456,9.418,0.0
KER-2,7/4/2025,03:40:00 am,0,2025-07-04 03:40:00,8.4566,9.418,0.0
KER-2,7/4/2025,03:50:00 am,0,2025-07-04 03:50:00,8.4574,9.418,0.0
KER-2,7/4/2025,04:00:00 am,0,2025-07-04 04:00:00,8.4576,9.418,0.00010000000000012221
KER-2,7/4/2025,04:10:00 am,0,2025-07-04 04:10:00,8.4586,9.419,9.999999999994457e-05
KER-2,7/4/2025,04:20:00 am,0,2025-07-04 04:20:00,8.4593,9.42,9.999999999994457e-05
KER-2,7/4/2025,04:30:00 am,0,2025-07-04 04:30:00,8.4606,9.419,0.00019999999999988915
KER-2,7/4/2025,04:40:00 am,0,2025-07-04 04:40:00,8.4612,9.421,0.00010000000000012221
KER-2,7/4/2025,04:50:00 am,0,2025-07-04 04:50:00,8.4617,9.422,0.0
KER-2,7/4/2025,05:00:00 am,0,2025-07-04 05:00:00,8.4623,9.422,0.00010000000000012221
KER-2,7/4/2025,05:10:00 am,0,2025-07-04 05:10:00,8.4624,9.421,0.0002000000000000668
KER-2,7/4/2025,05:20:00 am,0,2025-07-04 05:20:00,8.463,9.423,9.999999999994457e-05
KER-2,7/4/2025,05:30:00 am,0,2025-07-04 05:30:00,8.4646,9.424,9.999999999994457e-05
KER-2,7/4/2025,05:40:00 am,0,2025-07-04 05:40:00,8.4657,9.423,9.999999999994457e-05
KER-2,7/4/2025,05:50:00 am,0,2025-07-04 05:50:00,8.4676,9.424,0.00010000000000012221
