well_id,Date,Time,ms,DT,raw_Level_m,TEMPERATURE,Rate of Change
KEF-1,5/26/2025,08:00:00 pm,0,2025-05-26 20:00:00,9.1546,4.885,0.0001000000000000334
KEF-1,5/26/2025,08:10:00 pm,0,2025-05-26 20:10:00,9.1563,4.886,0.0001000000000000334
KEF-1,5/26/2025,08:20:00 pm,0,2025-05-26 20:20:00,9.1566,4.885,9.999999999994457e-05
KEF-1,5/26/2025,08:30:00 pm,0,2025-05-26 20:30:00,9.1572,4.884,0.00019999999999997797
KEF-1,5/26/2025,08:40:00 pm,0,2025-05-26 20:40:00,9.1579,4.886,0.0001000000000000334
KEF-1,5/26/2025,08:50:00 pm,0,2025-05-26 20:50:00,9.1592,4.885,0.0001000000000000334
KEF-1,5/26/2025,09:00:00 pm,0,2025-05-26 21:00:00,9.1607,4.886,0.00019999999999997797
KEF-1,5/26/2025,09:10:00 pm,0,2025-05-26 21:10:00,9.1626,4.888,0.0
KEF-1,5/26/2025,09:20:00 pm,0,2025-05-26 21:20:00,9.1643,4.888,0.0001000000000000334
KEF-1,5/26/2025,09:30:00 pm,0,2025-05-26 21:30:00,9.1657,4.889,0.0
KEF-1,5/26/2025,09:40:00 pm,0,2025-05-26 21:40:00,9.1677,4.889,0.0
KEF-1,5/26/2025,09:50:00 pm,0,2025-05-26 21:50:00,9.1688,4.889,0.0
KEF-1,5/26/2025,10:00:00 pm,0,2025-05-26 22:00:00,9.1699,4.889,0.0
KEF-1,5/26/2025,10:10:00 pm,0,2025-05-26 22:10:00,9.1704,4.889,9.999999999994457e-05
KEF-1,5/26/2025,10:20:00 pm,0,2025-05-26 22:20:00,9.1706,4.89,0.0002000000000000668
KEF-1,5/26/2025,10:30:00 pm,0,2025-05-26 22:30:00,9.1697,4.892,0.0001000000000000334
KEF-1,5/26/2025,10:40:00 pm,0,2025-05-26 22:40:00,9.1688,4.891,0.0001000000000000334
KEF-1,5/26/2025,10:50:00 pm,0,2025-05-26 22:50:00,9.1689,4.892,9.999999999994457e-05
KEF-1,5/26/2025,11:00:00 pm,0,2025-05-26 23:00:00,9.169,4.893,0.00019999999999997797
KEF-1,5/26/2025,11:10:00 pm,0,2025-05-26 23:10:00,9.1703,4.895,0.00019999999999997797
KEF-1,5/26/2025,11:20:00 pm,0,2025-05-26 23:20:00,9.1707,4.893,0.0001000000000000334
KEF-1,5/26/2025,11:30:00 pm,0,2025-05-26 23:30:00,9.1715,4.894,9.999999999994457e-05
KEF-1,5/26/2025,11:40:00 pm,0,2025-05-26 23:40:00,9.1726,4.895,0.0001000000000000334
KEF-1,5/26/2025,11:50:00 pm,0,2025-05-26 23:50:00,9.1723,4.896,0.0001000000000000334
KEF-1,5/27/2025,12:00:00 am,0,2025-05-27 00:00:00,9.173,4.897,9.999999999994457e-05
KEF-1,5/27/2025,12:10:00 am,0,2025-05-27 00:10:00,9.1728,4.898,0.0001000000000000334
KEF-1,5/27/2025,12:20:00 am,0,2025-05-27 00:20:00,9.1725,4.899,0.0001000000000000334
KEF-1,5/27/2025,12:30:00 am,0,2025-05-27 00:30:00,9.1717,4.898,0.0001000000000000334
KEF-1,5/27/2025,12:40:00 am,0,2025-05-27 00:40:00,9.172,4.899,0.00019999999999997797
KEF-1,5/27/2025,12:50:00 am,0,2025-05-27 00:50:00,9.1725,4.901,9.999999999994457e-05
KEF-1,5/27/2025,01:00:00 am,0,2025-05-27 01:00:00,9.1724,4.9,0.00019999999999997797
KEF-1,5/27/2025,01:10:00 am,0,2025-05-27 01:10:00,9.1728,4.902,0.0001000000000000334
KEF-1,5/27/2025,01:20:00 am,0,2025-05-27 01:20:00,9.1732,4.901,0.0001000000000000334
KEF-1,5/27/2025,01:30:00 am,0,2025-05-27 01:30:00,9.1735,4.902,9.999999999994457e-05
KEF-1,5/27/2025,01:40:00 am,0,2025-05-27 01:40:00,9.1728,4.903,0.00030000000000001136
KEF-1,5/27/2025,01:50:00 am,0,2025-05-27 01:50:00,9.1723,4.906,0.00019999999999997797
KEF-1,5/27/2025,02:00:00 am,0,2025-05-27 02:00:00,9.1723,4.904,0.00030000000000001136
KEF-1,5/27/2025,02:10:00 am,0,2025-05-27 02:10:00,9.1725,4.907,0.00019999999999997797
KEF-1,5/27/2025,02:20:00 am,0,2025-05-27 02:20:00,9.1728,4.905,0.00019999999999997797
KEF-1,5/27/2025,02:30:00 am,0,2025-05-27 02:30:00,9.1725,4.907,0.00019999999999997797
KEF-1,5/27/2025,02:40:00 am,0,2025-05-27 02:40:00,9.1725,4.909,0.0
KEF-1,5/27/2025,02:50:00 am,0,2025-05-27 02:50:00,9.172,4.909,0.0
KEF-1,5/27/2025,03:00:00 am,0,2025-05-27 03:00:00,9.172,4.909,0.0
KEF-1,5/27/2025,03:10:00 am,0,2025-05-27 03:10:00,9.1708,4.909,0.0001000000000000334
KEF-1,5/27/2025,03:20:00 am,0,2025-05-27 03:20:00,9.1702,4.91,0.00019999999999997797
KEF-1,5/27/2025,03:30:00 am,0,2025-05-27 03:30:00,9.1701,4.912,0.0
KEF-1,5/27/2025,03:40:00 am,0,2025-05-27 03:40:00,9.17,4.912,0.0001000000000000334
KEF-1,5/27/2025,03:50:00 am,0,2025-05-27 03:50:00,9.1704,4.913,0.0
KEF-1,5/27/2025,04:00:00 am,0,2025-05-27 04:00:00,9.1705,4.913,9.999999999994457e-05
KEF-1,5/27/2025,04:10:00 am,0,2025-05-27 04:10:00,9.1705,4.914,0.0001000000000000334
KEF-1,5/27/2025,04:20:00 am,0,2025-05-27 04:20:00,9.1708,4.915,0.0001000000000000334
KEF-1,5/27/2025,04:30:00 am,0,2025-05-27 04:30:00,9.1714,4.916,0.00019999999999997797
KEF-1,5/27/2025,04:40:00 am,0,2025-05-27 04:40:00,9.1719,4.918,0.0
KEF-1,5/27/2025,04:50:00 am,0,2025-05-27 04:50:00,9.1721,4.918,0.00019999999999997797
KEF-1,5/27/2025,05:00:00 am,0,2025-05-27 05:00:00,9.1723,4.92,0.0
KEF-1,5/27/2025,05:10:00 am,0,2025-05-27 05:10:00,9.1727,4.92,0.0001000000000000334
KEF-1,5/27/2025,05:20:00 am,0,2025-05-27 05:20:00,9.1735,4.919,0.0001000000000000334
KEF-1,5/27/2025,05:30:00 am,0,2025-05-27 05:30:00,9.1739,4.92,0.00019999999999997797
KEF-1,5/27/2025,05:40:00 am,0,2025-05-27 05:40:00,9.1747,4.922,0.0001000000000000334
KEF-1,5/27/2025,05:50:00 am,0,2025-05-27 05:50:00,9.1745,4.923,0.0001000000000000334
KEF-1,5/27/2025,06:00:00 am,0,2025-05-27 06:00:00,9.175,4.924,0.00019999999999997797
KEF-1,5/27/2025,06:10:00 am,0,2025-05-27 06:10:00,9.176,4.926,0.0001000000000000334
KEF-1,5/27/2025,06:20:00 am,0,2025-05-27 06:20:00,9.1761,4.925,0.0
KEF-1,5/27/2025,06:30:00 am,0,2025-05-27 06:30:00,9.1762,4.925,0.00030000000000001136
KEF-1,5/27/2025,06:40:00 am,0,2025-05-27 06:40:00,9.1769,4.928,0.00019999999999997797
KEF-1,5/27/2025,06:50:00 am,0,2025-05-27 06:50:00,9.177,4.93,0.00030000000000001136
KEF-1,5/27/2025,07:00:00 am,0,2025-05-27 07:00:00,9.1768,4.927,0.0
KEF-1,5/27/2025,07:10:00 am,0,2025-05-27 07:10:00,9.1772,4.927,0.0002000000000000668
KEF-1,5/27/2025,07:20:00 am,0,2025-05-27 07:20:00,9.177,4.929,0.0
KEF-1,5/27/2025,07:30:00 am,0,2025-05-27 07:30:00,9.1772,4.929,9.999999999994457e-05
KEF-1,5/27/2025,07:40:00 am,0,2025-05-27 07:40:00,9.1771,4.93,0.00030000000000001136
KEF-1,5/27/2025,07:50:00 am,0,2025-05-27 07:50:00,9.177,4.933,0.0001000000000000334
KEF-1,5/27/2025,08:00:00 am,0,2025-05-27 08:00:00,9.1771,4.934,0.0001000000000000334
KEF-1,5/27/2025,08:10:00 am,0,2025-05-27 08:10:00,9.1775,4.933,0.00030000000000001136
KEF-1,5/27/2025,08:20:00 am,0,2025-05-27 08:20:00,9.1781,4.936,0.0001000000000000334
KEF-1,5/27/2025,08:30:00 am,0,2025-05-27 08:30:00,9.1784,4.935,0.0001000000000000334
KEF-1,5/27/2025,08:40:00 am,0,2025-05-27 08:40:00,9.1786,4.936,0.0
KEF-1,5/27/2025,08:50:00 am,0,2025-05-27 08:50:00,9.1786,4.936,0.00030000000000001136
KEF-1,5/27/2025,09:00:00 am,0,2025-05-27 09:00:00,9.1792,4.939,0.0
KEF-1,5/27/2025,09:10:00 am,0,2025-05-27 09:10:00,9.1793,4.939,0.0001000000000000334
KEF-1,5/27/2025,09:20:00 am,0,2025-05-27 09:20:00,9.1787,4.94,0.0
KEF-1,5/27/2025,09:30:00 am,0,2025-05-27 09:30:00,9.1787,4.94,9.999999999994457e-05
KEF-1,5/27/2025,09:40:00 am,0,2025-05-27 09:40:00,9.1787,4.941,0.0
KEF-1,5/27/2025,09:50:00 am,0,2025-05-27 09:50:00,9.1785,4.941,0.00019999999999997797
KEF-1,5/27/2025,10:00:00 am,0,2025-05-27 10:00:00,9.1781,4.943,0.0
KEF-1,5/27/2025,10:10:00 am,0,2025-05-27 10:10:00,9.1774,4.943,0.0002000000000000668
KEF-1,5/27/2025,10:20:00 am,0,2025-05-27 10:20:00,9.1774,4.945,0.0
KEF-1,5/27/2025,10:30:00 am,0,2025-05-27 10:30:00,9.1768,4.945,9.999999999994457e-05
KEF-1,5/27/2025,10:40:00 am,0,2025-05-27 10:40:00,9.1766,4.946,0.0
KEF-1,5/27/2025,10:50:00 am,0,2025-05-27 10:50:00,9.1761,4.946,9.999999999994457e-05
KEF-1,5/27/2025,11:00:00 am,0,2025-05-27 11:00:00,9.1753,4.945,0.00039999999999995595
KEF-1,5/27/2025,11:10:00 am,0,2025-05-27 11:10:00,9.1741,4.949,0.0
KEF-1,5/27/2025,11:20:00 am,0,2025-05-27 11:20:00,9.1729,4.949,0.00030000000000001136
KEF-1,5/27/2025,11:30:00 am,0,2025-05-27 11:30:00,9.1708,4.952,0.0
KEF-1,5/27/2025,11:40:00 am,0,2025-05-27 11:40:00,9.17,4.952,0.0
KEF-1,5/27/2025,11:50:00 am,0,2025-05-27 11:50:00,9.169,4.952,0.00019999999999997797
KEF-1,5/27/2025,12:00:00 pm,0,2025-05-27 12:00:00,9.1674,4.954,0.0
KEF-1,5/27/2025,12:10:00 pm,0,2025-05-27 12:10:00,9.1666,4.954,0.0001000000000000334
KEF-1,5/27/2025,12:20:00 pm,0,2025-05-27 12:20:00,9.1665,4.955,0.0001000000000000334
KEF-1,5/27/2025,12:30:00 pm,0,2025-05-27 12:30:00,9.1657,4.956,0.0001000000000000334
KEF-1,5/27/2025,12:40:00 pm,0,2025-05-27 12:40:00,9.1641,4.955,0.00019999999999997797
KEF-1,5/27/2025,12:50:00 pm,0,2025-05-27 12:50:00,9.1636,4.957,0.0
KEF-1,5/27/2025,01:00:00 pm,0,2025-05-27 13:00:00,9.1624,4.957,0.0001000000000000334
KEF-1,5/27/2025,01:10:00 pm,0,2025-05-27 13:10:00,9.1617,4.958,9.999999999994457e-05
KEF-1,5/27/2025,01:20:00 pm,0,2025-05-27 13:20:00,9.1609,4.959,0.0002000000000000668
KEF-1,5/27/2025,01:30:00 pm,0,2025-05-27 13:30:00,9.1604,4.961,9.999999999994457e-05
KEF-1,5/27/2025,01:40:00 pm,0,2025-05-27 13:40:00,9.1586,4.962,0.0001000000000000334
KEF-1,5/27/2025,01:50:00 pm,0,2025-05-27 13:50:00,9.1579,4.963,0.0001000000000000334
KEF-1,5/27/2025,02:00:00 pm,0,2025-05-27 14:00:00,9.1577,4.964,0.0001000000000000334
KEF-1,5/27/2025,02:10:00 pm,0,2025-05-27 14:10:00,9.1567,4.963,0.0001000000000000334
KEF-1,5/27/2025,02:20:00 pm,0,2025-05-27 14:20:00,9.1564,4.964,0.00029999999999992256
KEF-1,5/27/2025,02:30:00 pm,0,2025-05-27 14:30:00,9.1562,4.967,0.00019999999999997797
KEF-1,5/27/2025,02:40:00 pm,0,2025-05-27 14:40:00,9.1559,4.965,0.00019999999999997797
KEF-1,5/27/2025,02:50:00 pm,0,2025-05-27 14:50:00,9.1551,4.967,0.0002000000000000668
KEF-1,5/27/2025,03:00:00 pm,0,2025-05-27 15:00:00,9.1548,4.969,0.00019999999999997797
KEF-1,5/27/2025,03:10:00 pm,0,2025-05-27 15:10:00,9.1557,4.971,0.00019999999999997797
KEF-1,5/27/2025,03:20:00 pm,0,2025-05-27 15:20:00,9.1543,4.969,0.00019999999999997797
KEF-1,5/27/2025,03:30:00 pm,0,2025-05-27 15:30:00,9.1542,4.971,0.0001000000000000334
KEF-1,5/27/2025,03:40:00 pm,0,2025-05-27 15:40:00,9.1539,4.972,0.0
KEF-1,5/27/2025,03:50:00 pm,0,2025-05-27 15:50:00,9.1535,4.972,9.999999999994457e-05
KEF-1,5/27/2025,04:00:00 pm,0,2025-05-27 16:00:00,9.1531,4.973,0.0001000000000000334
KEF-1,5/27/2025,04:10:00 pm,0,2025-05-27 16:10:00,9.1521,4.974,0.00019999999999997797
KEF-1,5/27/2025,04:20:00 pm,0,2025-05-27 16:20:00,9.1517,4.976,0.0001000000000000334
KEF-1,5/27/2025,04:30:00 pm,0,2025-05-27 16:30:00,9.1506,4.977,9.999999999994457e-05
KEF-1,5/27/2025,04:40:00 pm,0,2025-05-27 16:40:00,9.1509,4.978,0.0001000000000000334
KEF-1,5/27/2025,04:50:00 pm,0,2025-05-27 16:50:00,9.151,4.979,0.0
KEF-1,5/27/2025,05:00:00 pm,0,2025-05-27 17:00:00,9.1506,4.979,0.0001000000000000334
KEF-1,5/27/2025,05:10:00 pm,0,2025-05-27 17:10:00,9.1505,4.98,0.00029999999999992256
KEF-1,5/27/2025,05:20:00 pm,0,2025-05-27 17:20:00,9.1502,4.983,9.999999999994457e-05
KEF-1,5/27/2025,05:30:00 pm,0,2025-05-27 17:30:00,9.1512,4.982,9.999999999994457e-05
KEF-1,5/27/2025,05:40:00 pm,0,2025-05-27 17:40:00,9.1506,4.983,0.0001000000000000334
KEF-1,5/27/2025,05:50:00 pm,0,2025-05-27 17:50:00,9.1508,4.984,0.0001000000000000334
KEF-1,5/27/2025,06:00:00 pm,0,2025-05-27 18:00:00,9.1516,4.985,9.999999999994457e-05
KEF-1,5/27/2025,06:10:00 pm,0,2025-05-27 18:10:00,9.1531,4.986,0.0
KEF-1,5/27/2025,06:20:00 pm,0,2025-05-27 18:20:00,9.1537,4.986,9.999999999994457e-05
KEF-1,5/27/2025,06:30:00 pm,0,2025-05-27 18:30:00,9.1537,4.985,0.0004999999999999894
KEF-1,5/27/2025,06:40:00 pm,0,2025-05-27 18:40:00,9.1543,4.99,0.0001000000000000334
KEF-1,5/27/2025,06:50:00 pm,0,2025-05-27 18:50:00,9.1548,4.989,0.0001000000000000334
KEF-1,5/27/2025,07:00:00 pm,0,2025-05-27 19:00:00,9.1552,4.99,9.999999999994457e-05
KEF-1,5/27/2025,07:10:00 pm,0,2025-05-27 19:10:00,9.1563,4.991,0.0
KEF-1,5/27/2025,07:20:00 pm,0,2025-05-27 19:20:00,9.1571,4.991,0.0002000000000000668
KEF-1,5/27/2025,07:30:00 pm,0,2025-05-27 19:30:00,9.1582,4.993,0.0001000000000000334
KEF-1,5/27/2025,07:40:00 pm,0,2025-05-27 19:40:00,9.1587,4.992,0.0
KEF-1,5/27/2025,07:50:00 pm,0,2025-05-27 19:50:00,9.1587,4.992,0.00019999999999997797
KEF-1,5/27/2025,08:00:00 pm,0,2025-05-27 20:00:00,9.1598,4.994,0.0001000000000000334
KEF-1,5/27/2025,08:10:00 pm,0,2025-05-27 20:10:00,9.1609,4.995,0.00019999999999997797
KEF-1,5/27/2025,08:20:00 pm,0,2025-05-27 20:20:00,9.1618,4.997,0.00030000000000001136
KEF-1,5/27/2025,08:30:00 pm,0,2025-05-27 20:30:00,9.1627,5.0,0.00030000000000001136
KEF-1,5/27/2025,08:40:00 pm,0,2025-05-27 20:40:00,9.1634,4.997,0.00030000000000001136
KEF-1,5/27/2025,08:50:00 pm,0,2025-05-27 20:50:00,9.164,5.0,0.00019999999999997797
KEF-1,5/27/2025,09:00:00 pm,0,2025-05-27 21:00:00,9.1652,5.002,0.0
KEF-1,5/27/2025,09:10:00 pm,0,2025-05-27 21:10:00,9.1667,5.002,0.0001000000000000334
KEF-1,5/27/2025,09:20:00 pm,0,2025-05-27 21:20:00,9.168,5.003,9.999999999994457e-05
KEF-1,5/27/2025,09:30:00 pm,0,2025-05-27 21:30:00,9.1691,5.004,0.0
KEF-1,5/27/2025,09:40:00 pm,0,2025-05-27 21:40:00,9.1699,5.004,0.00030000000000001136
KEF-1,5/27/2025,09:50:00 pm,0,2025-05-27 21:50:00,9.1713,5.007,0.0
KEF-1,5/27/2025,10:00:00 pm,0,2025-05-27 22:00:00,9.1724,5.007,0.0001000000000000334
KEF-1,5/27/2025,10:10:00 pm,0,2025-05-27 22:10:00,9.1739,5.008,0.0
KEF-1,5/27/2025,10:20:00 pm,0,2025-05-27 22:20:00,9.1741,5.008,0.0
KEF-1,5/27/2025,10:30:00 pm,0,2025-05-27 22:30:00,9.1738,5.008,0.00019999999999997797
KEF-1,5/27/2025,10:40:00 pm,0,2025-05-27 22:40:00,9.1743,5.01,0.0001000000000000334
KEF-1,5/27/2025,10:50:00 pm,0,2025-05-27 22:50:00,9.1745,5.011,0.00019999999999997797
KEF-1,5/27/2025,11:00:00 pm,0,2025-05-27 23:00:00,9.1744,5.013,0.0001000000000000334
KEF-1,5/27/2025,11:10:00 pm,0,2025-05-27 23:10:00,9.1737,5.014,0.0002000000000000668
KEF-1,5/27/2025,11:20:00 pm,0,2025-05-27 23:20:00,9.1725,5.012,0.00030000000000001136
KEF-1,5/27/2025,11:30:00 pm,0,2025-05-27 23:30:00,9.1726,5.015,0.0001000000000000334
KEF-1,5/27/2025,11:40:00 pm,0,2025-05-27 23:40:00,9.1736,5.016,0.0
KEF-1,5/27/2025,11:50:00 pm,0,2025-05-27 23:50:00,9.1737,5.016,0.0001000000000000334
KEF-1,5/28/2025,12:00:00 am,0,2025-05-28 00:00:00,9.1734,5.017,9.999999999994457e-05
KEF-1,5/28/2025,12:10:00 am,0,2025-05-28 00:10:00,9.174,5.018,0.0001000000000000334
KEF-1,5/28/2025,12:20:00 am,0,2025-05-28 00:20:00,9.1756,5.019,9.999999999994457e-05
KEF-1,5/28/2025,12:30:00 am,0,2025-05-28 00:30:00,9.1757,5.02,0.0002000000000000668
KEF-1,5/28/2025,12:40:00 am,0,2025-05-28 00:40:00,9.1756,5.022,0.0
KEF-1,5/28/2025,12:50:00 am,0,2025-05-28 00:50:00,9.1748,5.022,9.999999999994457e-05
KEF-1,5/28/2025,01:00:00 am,0,2025-05-28 01:00:00,9.1742,5.023,0.0001000000000000334
KEF-1,5/28/2025,01:10:00 am,0,2025-05-28 01:10:00,9.1744,5.024,0.00019999999999997797
KEF-1,5/28/2025,01:20:00 am,0,2025-05-28 01:20:00,9.1746,5.026,9.999999999994457e-05
KEF-1,5/28/2025,01:30:00 am,0,2025-05-28 01:30:00,9.1741,5.025,0.00019999999999997797
KEF-1,5/28/2025,01:40:00 am,0,2025-05-28 01:40:00,9.1735,5.027,0.0001000000000000334
KEF-1,5/28/2025,01:50:00 am,0,2025-05-28 01:50:00,9.1732,5.026,0.0001000000000000334
KEF-1,5/28/2025,02:00:00 am,0,2025-05-28 02:00:00,9.1727,5.027,9.999999999994457e-05
KEF-1,5/28/2025,02:10:00 am,0,2025-05-28 02:10:00,9.1728,5.028,0.0
KEF-1,5/28/2025,02:20:00 am,0,2025-05-28 02:20:00,9.1729,5.028,0.00030000000000001136
KEF-1,5/28/2025,02:30:00 am,0,2025-05-28 02:30:00,9.172,5.031,9.999999999994457e-05
KEF-1,5/28/2025,02:40:00 am,0,2025-05-28 02:40:00,9.1716,5.03,0.00019999999999997797
KEF-1,5/28/2025,02:50:00 am,0,2025-05-28 02:50:00,9.172,5.032,0.00019999999999997797
KEF-1,5/28/2025,03:00:00 am,0,2025-05-28 03:00:00,9.1719,5.034,0.0001000000000000334
KEF-1,5/28/2025,03:10:00 am,0,2025-05-28 03:10:00,9.1714,5.035,0.0
KEF-1,5/28/2025,03:20:00 am,0,2025-05-28 03:20:00,9.1705,5.035,0.0
KEF-1,5/28/2025,03:30:00 am,0,2025-05-28 03:30:00,9.1709,5.035,0.00019999999999997797
KEF-1,5/28/2025,03:40:00 am,0,2025-05-28 03:40:00,9.1712,5.037,0.00019999999999997797
KEF-1,5/28/2025,03:50:00 am,0,2025-05-28 03:50:00,9.1714,5.039,0.0002000000000000668
KEF-1,5/28/2025,04:00:00 am,0,2025-05-28 04:00:00,9.171,5.041,0.0001000000000000334
KEF-1,5/28/2025,04:10:00 am,0,2025-05-28 04:10:00,9.1702,5.04,0.00030000000000001136
KEF-1,5/28/2025,04:20:00 am,0,2025-05-28 04:20:00,9.1694,5.043,0.00019999999999997797
KEF-1,5/28/2025,04:30:00 am,0,2025-05-28 04:30:00,9.169,5.041,0.00029999999999992256
KEF-1,5/28/2025,04:40:00 am,0,2025-05-28 04:40:00,9.1684,5.044,0.0
KEF-1,5/28/2025,04:50:00 am,0,2025-05-28 04:50:00,9.1684,5.044,0.0001000000000000334
KEF-1,5/28/2025,05:00:00 am,0,2025-05-28 05:00:00,9.1688,5.045,0.0001000000000000334
KEF-1,5/28/2025,05:10:00 am,0,2025-05-28 05:10:00,9.1688,5.044,0.00030000000000001136
KEF-1,5/28/2025,05:20:00 am,0,2025-05-28 05:20:00,9.1693,5.047,0.0001000000000000334
KEF-1,5/28/2025,05:30:00 am,0,2025-05-28 05:30:00,9.1695,5.048,0.0
KEF-1,5/28/2025,05:40:00 am,0,2025-05-28 05:40:00,9.1697,5.048,0.00019999999999997797
KEF-1,5/28/2025,05:50:00 am,0,2025-05-28 05:50:00,9.1699,5.05,0.0
KEF-1,5/28/2025,06:00:00 am,0,2025-05-28 06:00:00,9.1701,5.05,0.00030000000000001136
KEF-1,5/28/2025,06:10:00 am,0,2025-05-28 06:10:00,9.1705,5.053,0.00019999999999997797
KEF-1,5/28/2025,06:20:00 am,0,2025-05-28 06:20:00,9.1699,5.051,9.999999999994457e-05
KEF-1,5/28/2025,06:30:00 am,0,2025-05-28 06:30:00,9.1703,5.052,0.0001000000000000334
KEF-1,5/28/2025,06:40:00 am,0,2025-05-28 06:40:00,9.1716,5.053,0.0001000000000000334
KEF-1,5/28/2025,06:50:00 am,0,2025-05-28 06:50:00,9.1713,5.054,0.00019999999999997797
KEF-1,5/28/2025,07:00:00 am,0,2025-05-28 07:00:00,9.1708,5.056,0.00030000000000001136
KEF-1,5/28/2025,07:10:00 am,0,2025-05-28 07:10:00,9.1708,5.059,0.0
KEF-1,5/28/2025,07:20:00 am,0,2025-05-28 07:20:00,9.1712,5.059,0.0
KEF-1,5/28/2025,07:30:00 am,0,2025-05-28 07:30:00,9.1715,5.059,0.00030000000000001136
KEF-1,5/28/2025,07:40:00 am,0,2025-05-28 07:40:00,9.1716,5.062,0.0
KEF-1,5/28/2025,07:50:00 am,0,2025-05-28 07:50:00,9.1717,5.062,9.999999999994457e-05
KEF-1,5/28/2025,08:00:00 am,0,2025-05-28 08:00:00,9.1715,5.063,0.0001000000000000334
KEF-1,5/28/2025,08:10:00 am,0,2025-05-28 08:10:00,9.1716,5.064,0.0001000000000000334
KEF-1,5/28/2025,08:20:00 am,0,2025-05-28 08:20:00,9.1718,5.063,0.00030000000000001136
KEF-1,5/28/2025,08:30:00 am,0,2025-05-28 08:30:00,9.1715,5.066,9.999999999994457e-05
KEF-1,5/28/2025,08:40:00 am,0,2025-05-28 08:40:00,9.1716,5.065,0.00029999999999992256
KEF-1,5/28/2025,08:50:00 am,0,2025-05-28 08:50:00,9.172,5.068,0.0001000000000000334
KEF-1,5/28/2025,09:00:00 am,0,2025-05-28 09:00:00,9.1718,5.069,0.0
KEF-1,5/28/2025,09:10:00 am,0,2025-05-28 09:10:00,9.1716,5.069,0.00019999999999997797
KEF-1,5/28/2025,09:20:00 am,0,2025-05-28 09:20:00,9.1717,5.071,0.00019999999999997797
KEF-1,5/28/2025,09:30:00 am,0,2025-05-28 09:30:00,9.1715,5.069,0.0
KEF-1,5/28/2025,09:40:00 am,0,2025-05-28 09:40:00,9.1715,5.069,0.00019999999999997797
KEF-1,5/28/2025,09:50:00 am,0,2025-05-28 09:50:00,9.1707,5.071,0.0002000000000000668
KEF-1,5/28/2025,10:00:00 am,0,2025-05-28 10:00:00,9.1696,5.073,0.0
KEF-1,5/28/2025,10:10:00 am,0,2025-05-28 10:10:00,9.1685,5.073,0.00019999999999997797
KEF-1,5/28/2025,10:20:00 am,0,2025-05-28 10:20:00,9.1677,5.075,9.999999999994457e-05
KEF-1,5/28/2025,10:30:00 am,0,2025-05-28 10:30:00,9.167,5.076,0.0001000000000000334
KEF-1,5/28/2025,10:40:00 am,0,2025-05-28 10:40:00,9.1659,5.077,0.0
KEF-1,5/28/2025,10:50:00 am,0,2025-05-28 10:50:00,9.165,5.077,0.0001000000000000334
KEF-1,5/28/2025,11:00:00 am,0,2025-05-28 11:00:00,9.1637,5.078,0.00019999999999997797
KEF-1,5/28/2025,11:10:00 am,0,2025-05-28 11:10:00,9.1623,5.08,0.0
KEF-1,5/28/2025,11:20:00 am,0,2025-05-28 11:20:00,9.1603,5.08,0.0
KEF-1,5/28/2025,11:30:00 am,0,2025-05-28 11:30:00,9.1594,5.08,0.00019999999999997797
KEF-1,5/28/2025,11:40:00 am,0,2025-05-28 11:40:00,9.1587,5.082,0.0
KEF-1,5/28/2025,11:50:00 am,0,2025-05-28 11:50:00,9.1568,5.082,0.00019999999999997797
KEF-1,5/28/2025,12:00:00 pm,0,2025-05-28 12:00:00,9.1571,5.084,0.0
KEF-1,5/28/2025,12:10:00 pm,0,2025-05-28 12:10:00,9.1543,5.084,0.0001000000000000334
KEF-1,5/28/2025,12:20:00 pm,0,2025-05-28 12:20:00,9.1542,5.085,0.00019999999999997797
KEF-1,5/28/2025,12:30:00 pm,0,2025-05-28 12:30:00,9.1525,5.087,0.0
KEF-1,5/28/2025,12:40:00 pm,0,2025-05-28 12:40:00,9.154,5.087,0.0001000000000000334
KEF-1,5/28/2025,12:50:00 pm,0,2025-05-28 12:50:00,9.154,5.088,0.00019999999999997797
KEF-1,5/28/2025,01:00:00 pm,0,2025-05-28 13:00:00,9.1519,5.09,0.0
KEF-1,5/28/2025,01:10:00 pm,0,2025-05-28 13:10:00,9.1507,5.09,0.00030000000000001136
KEF-1,5/28/2025,01:20:00 pm,0,2025-05-28 13:20:00,9.1501,5.093,0.0001000000000000334
KEF-1,5/28/2025,01:30:00 pm,0,2025-05-28 13:30:00,9.1506,5.092,0.00030000000000001136
KEF-1,5/28/2025,01:40:00 pm,0,2025-05-28 13:40:00,9.1506,5.095,9.999999999994457e-05
KEF-1,5/28/2025,01:50:00 pm,0,2025-05-28 13:50:00,9.1503,5.094,0.00030000000000001136
KEF-1,5/28/2025,02:00:00 pm,0,2025-05-28 14:00:00,9.1498,5.097,9.999999999994457e-05
KEF-1,5/28/2025,02:10:00 pm,0,2025-05-28 14:10:00,9.1501,5.098,9.999999999994457e-05
KEF-1,5/28/2025,02:20:00 pm,0,2025-05-28 14:20:00,9.1496,5.097,9.999999999994457e-05
KEF-1,5/28/2025,02:30:00 pm,0,2025-05-28 14:30:00,9.1499,5.098,0.0001000000000000334
KEF-1,5/28/2025,02:40:00 pm,0,2025-05-28 14:40:00,9.1492,5.099,0.0
KEF-1,5/28/2025,02:50:00 pm,0,2025-05-28 14:50:00,9.1492,5.099,0.00019999999999997797
KEF-1,5/28/2025,03:00:00 pm,0,2025-05-28 15:00:00,9.1485,5.101,0.0001000000000000334
KEF-1,5/28/2025,03:10:00 pm,0,2025-05-28 15:10:00,9.1485,5.102,9.999999999994457e-05
KEF-1,5/28/2025,03:20:00 pm,0,2025-05-28 15:20:00,9.151,5.103,0.0001000000000000334
KEF-1,5/28/2025,03:30:00 pm,0,2025-05-28 15:30:00,9.1509,5.104,0.0001000000000000334
KEF-1,5/28/2025,03:40:00 pm,0,2025-05-28 15:40:00,9.1507,5.105,9.999999999994457e-05
KEF-1,5/28/2025,03:50:00 pm,0,2025-05-28 15:50:00,9.1506,5.106,0.0
KEF-1,5/28/2025,04:00:00 pm,0,2025-05-28 16:00:00,9.1504,5.106,0.00019999999999997797
KEF-1,5/28/2025,04:10:00 pm,0,2025-05-28 16:10:00,9.1495,5.108,0.0
KEF-1,5/28/2025,04:20:00 pm,0,2025-05-28 16:20:00,9.1491,5.108,0.0002000000000000668
KEF-1,5/28/2025,04:30:00 pm,0,2025-05-28 16:30:00,9.1502,5.11,0.0001000000000000334
KEF-1,5/28/2025,04:40:00 pm,0,2025-05-28 16:40:00,9.1493,5.109,0.00030000000000001136
KEF-1,5/28/2025,04:50:00 pm,0,2025-05-28 16:50:00,9.1498,5.112,0.0
KEF-1,5/28/2025,05:00:00 pm,0,2025-05-28 17:00:00,9.1506,5.112,0.00019999999999997797
KEF-1,5/28/2025,05:10:00 pm,0,2025-05-28 17:10:00,9.1507,5.114,0.00019999999999997797
KEF-1,5/28/2025,05:20:00 pm,0,2025-05-28 17:20:00,9.1513,5.112,0.00030000000000001136
KEF-1,5/28/2025,05:30:00 pm,0,2025-05-28 17:30:00,9.1512,5.115,0.00019999999999997797
KEF-1,5/28/2025,05:40:00 pm,0,2025-05-28 17:40:00,9.1508,5.117,0.0
KEF-1,5/28/2025,05:50:00 pm,0,2025-05-28 17:50:00,9.1506,5.117,0.0001000000000000334
KEF-1,5/28/2025,06:00:00 pm,0,2025-05-28 18:00:00,9.1507,5.118,0.00019999999999997797
KEF-1,5/28/2025,06:10:00 pm,0,2025-05-28 18:10:00,9.1505,5.12,0.0001000000000000334
KEF-1,5/28/2025,06:20:00 pm,0,2025-05-28 18:20:00,9.1498,5.121,0.00019999999999997797
KEF-1,5/28/2025,06:30:00 pm,0,2025-05-28 18:30:00,9.1496,5.123,0.00019999999999997797
KEF-1,5/28/2025,06:40:00 pm,0,2025-05-28 18:40:00,9.1504,5.121,0.0
KEF-1,5/28/2025,06:50:00 pm,0,2025-05-28 18:50:00,9.1511,5.121,0.00019999999999997797
KEF-1,5/28/2025,07:00:00 pm,0,2025-05-28 19:00:00,9.1526,5.123,0.00019999999999997797
KEF-1,5/28/2025,07:10:00 pm,0,2025-05-28 19:10:00,9.154,5.125,0.0001000000000000334
KEF-1,5/28/2025,07:20:00 pm,0,2025-05-28 19:20:00,9.1551,5.126,9.999999999994457e-05
KEF-1,5/28/2025,07:30:00 pm,0,2025-05-28 19:30:00,9.1565,5.127,0.0001000000000000334
KEF-1,5/28/2025,07:40:00 pm,0,2025-05-28 19:40:00,9.1579,5.128,9.999999999994457e-05
KEF-1,5/28/2025,07:50:00 pm,0,2025-05-28 19:50:00,9.1586,5.129,0.0001000000000000334
KEF-1,5/28/2025,08:00:00 pm,0,2025-05-28 20:00:00,9.1594,5.13,0.0001000000000000334
KEF-1,5/28/2025,08:10:00 pm,0,2025-05-28 20:10:00,9.1598,5.129,0.0002000000000000668
KEF-1,5/28/2025,08:20:00 pm,0,2025-05-28 20:20:00,9.1619,5.131,9.999999999994457e-05
KEF-1,5/28/2025,08:30:00 pm,0,2025-05-28 20:30:00,9.1634,5.132,0.0002000000000000668
KEF-1,5/28/2025,08:40:00 pm,0,2025-05-28 20:40:00,9.1645,5.134,0.00019999999999997797
KEF-1,5/28/2025,08:50:00 pm,0,2025-05-28 20:50:00,9.164,5.136,0.0001000000000000334
KEF-1,5/28/2025,09:00:00 pm,0,2025-05-28 21:00:00,9.1646,5.135,0.00019999999999997797
KEF-1,5/28/2025,09:10:00 pm,0,2025-05-28 21:10:00,9.1652,5.137,9.999999999994457e-05
KEF-1,5/28/2025,09:20:00 pm,0,2025-05-28 21:20:00,9.1668,5.136,0.00019999999999997797
KEF-1,5/28/2025,09:30:00 pm,0,2025-05-28 21:30:00,9.1689,5.138,0.0001000000000000334
KEF-1,5/28/2025,09:40:00 pm,0,2025-05-28 21:40:00,9.1709,5.139,0.0001000000000000334
KEF-1,5/28/2025,09:50:00 pm,0,2025-05-28 21:50:00,9.1725,5.138,0.00040000000000004474
KEF-1,5/28/2025,10:00:00 pm,0,2025-05-28 22:00:00,9.1737,5.142,0.0
KEF-1,5/28/2025,10:10:00 pm,0,2025-05-28 22:10:00,9.1739,5.142,9.999999999994457e-05
KEF-1,5/28/2025,10:20:00 pm,0,2025-05-28 22:20:00,9.1737,5.143,0.0
KEF-1,5/28/2025,10:30:00 pm,0,2025-05-28 22:30:00,9.1742,5.143,0.00019999999999997797
KEF-1,5/28/2025,10:40:00 pm,0,2025-05-28 22:40:00,9.1746,5.145,0.0001000000000000334
KEF-1,5/28/2025,10:50:00 pm,0,2025-05-28 22:50:00,9.1751,5.146,0.0001000000000000334
KEF-1,5/28/2025,11:00:00 pm,0,2025-05-28 23:00:00,9.1749,5.147,9.999999999994457e-05
KEF-1,5/28/2025,11:10:00 pm,0,2025-05-28 23:10:00,9.1759,5.148,0.0001000000000000334
KEF-1,5/28/2025,11:20:00 pm,0,2025-05-28 23:20:00,9.1761,5.149,0.0001000000000000334
KEF-1,5/28/2025,11:30:00 pm,0,2025-05-28 23:30:00,9.1771,5.148,0.0002000000000000668
KEF-1,5/28/2025,11:40:00 pm,0,2025-05-28 23:40:00,9.1779,5.15,0.00029999999999992256
KEF-1,5/28/2025,11:50:00 pm,0,2025-05-28 23:50:00,9.1791,5.153,0.0
KEF-1,5/29/2025,12:00:00 am,0,2025-05-29 00:00:00,9.1794,5.153,0.0001000000000000334
KEF-1,5/29/2025,12:10:00 am,0,2025-05-29 00:10:00,9.1792,5.154,0.0001000000000000334
KEF-1,5/29/2025,12:20:00 am,0,2025-05-29 00:20:00,9.1789,5.155,0.0001000000000000334
KEF-1,5/29/2025,12:30:00 am,0,2025-05-29 00:30:00,9.1789,5.154,0.00040000000000004474
KEF-1,5/29/2025,12:40:00 am,0,2025-05-29 00:40:00,9.1793,5.158,0.0
KEF-1,5/29/2025,12:50:00 am,0,2025-05-29 00:50:00,9.1797,5.158,0.0
KEF-1,5/29/2025,01:00:00 am,0,2025-05-29 01:00:00,9.1792,5.158,0.00019999999999997797
KEF-1,5/29/2025,01:10:00 am,0,2025-05-29 01:10:00,9.179,5.16,0.0
KEF-1,5/29/2025,01:20:00 am,0,2025-05-29 01:20:00,9.179,5.16,9.999999999994457e-05
KEF-1,5/29/2025,01:30:00 am,0,2025-05-29 01:30:00,9.179,5.161,0.00030000000000001136
KEF-1,5/29/2025,01:40:00 am,0,2025-05-29 01:40:00,9.1781,5.164,9.999999999994457e-05
KEF-1,5/29/2025,01:50:00 am,0,2025-05-29 01:50:00,9.1777,5.163,0.00019999999999997797
KEF-1,5/29/2025,02:00:00 am,0,2025-05-29 02:00:00,9.1784,5.165,0.0001000000000000334
KEF-1,5/29/2025,02:10:00 am,0,2025-05-29 02:10:00,9.1783,5.166,0.00029999999999992256
KEF-1,5/29/2025,02:20:00 am,0,2025-05-29 02:20:00,9.1785,5.169,0.0
KEF-1,5/29/2025,02:30:00 am,0,2025-05-29 02:30:00,9.1789,5.169,9.999999999994457e-05
KEF-1,5/29/2025,02:40:00 am,0,2025-05-29 02:40:00,9.1788,5.168,0.0001000000000000334
KEF-1,5/29/2025,02:50:00 am,0,2025-05-29 02:50:00,9.1792,5.167,0.00030000000000001136
KEF-1,5/29/2025,03:00:00 am,0,2025-05-29 03:00:00,9.1794,5.17,0.0
KEF-1,5/29/2025,03:10:00 am,0,2025-05-29 03:10:00,9.1786,5.17,0.00030000000000001136
KEF-1,5/29/2025,03:20:00 am,0,2025-05-29 03:20:00,9.1792,5.173,0.0001000000000000334
KEF-1,5/29/2025,03:30:00 am,0,2025-05-29 03:30:00,9.1798,5.172,0.0001000000000000334
KEF-1,5/29/2025,03:40:00 am,0,2025-05-29 03:40:00,9.1796,5.173,0.00030000000000001136
KEF-1,5/29/2025,03:50:00 am,0,2025-05-29 03:50:00,9.1793,5.176,0.0
KEF-1,5/29/2025,04:00:00 am,0,2025-05-29 04:00:00,9.1794,5.176,0.0001000000000000334
KEF-1,5/29/2025,04:10:00 am,0,2025-05-29 04:10:00,9.1798,5.175,0.00019999999999997797
KEF-1,5/29/2025,04:20:00 am,0,2025-05-29 04:20:00,9.1794,5.177,0.0002000000000000668
KEF-1,5/29/2025,04:30:00 am,0,2025-05-29 04:30:00,9.1793,5.179,0.00019999999999997797
KEF-1,5/29/2025,04:40:00 am,0,2025-05-29 04:40:00,9.1796,5.181,0.0001000000000000334
KEF-1,5/29/2025,04:50:00 am,0,2025-05-29 04:50:00,9.1797,5.18,0.0001000000000000334
KEF-1,5/29/2025,05:00:00 am,0,2025-05-29 05:00:00,9.1793,5.181,0.00019999999999997797
KEF-1,5/29/2025,05:10:00 am,0,2025-05-29 05:10:00,9.1794,5.183,0.0
KEF-1,5/29/2025,05:20:00 am,0,2025-05-29 05:20:00,9.1797,5.183,0.00019999999999997797
KEF-1,5/29/2025,05:30:00 am,0,2025-05-29 05:30:00,9.1793,5.185,0.0001000000000000334
KEF-1,5/29/2025,05:40:00 am,0,2025-05-29 05:40:00,9.1799,5.186,0.0001000000000000334
KEF-1,5/29/2025,05:50:00 am,0,2025-05-29 05:50:00,9.1802,5.187,0.0001000000000000334
KEF-1,5/29/2025,06:00:00 am,0,2025-05-29 06:00:00,9.1798,5.186,0.00019999999999997797
KEF-1,5/29/2025,06:10:00 am,0,2025-05-29 06:10:00,9.1802,5.188,0.0
KEF-1,5/29/2025,06:20:00 am,0,2025-05-29 06:20:00,9.1801,5.188,0.0002000000000000668
KEF-1,5/29/2025,06:30:00 am,0,2025-05-29 06:30:00,9.181,5.19,9.999999999994457e-05
KEF-1,5/29/2025,06:40:00 am,0,2025-05-29 06:40:00,9.1813,5.191,0.00019999999999997797
KEF-1,5/29/2025,06:50:00 am,0,2025-05-29 06:50:00,9.1813,5.193,0.0001000000000000334
KEF-1,5/29/2025,07:00:00 am,0,2025-05-29 07:00:00,9.1813,5.194,0.0
KEF-1,5/29/2025,07:10:00 am,0,2025-05-29 07:10:00,9.182,5.194,0.0001000000000000334
KEF-1,5/29/2025,07:20:00 am,0,2025-05-29 07:20:00,9.1825,5.195,0.00019999999999997797
KEF-1,5/29/2025,07:30:00 am,0,2025-05-29 07:30:00,9.1826,5.197,0.0001000000000000334
KEF-1,5/29/2025,07:40:00 am,0,2025-05-29 07:40:00,9.183,5.196,0.00030000000000001136
KEF-1,5/29/2025,07:50:00 am,0,2025-05-29 07:50:00,9.1832,5.199,0.00019999999999997797
KEF-1,5/29/2025,08:00:00 am,0,2025-05-29 08:00:00,9.1842,5.201,9.999999999994457e-05
KEF-1,5/29/2025,08:10:00 am,0,2025-05-29 08:10:00,9.1849,5.2,9.999999999994457e-05
KEF-1,5/29/2025,08:20:00 am,0,2025-05-29 08:20:00,9.1853,5.201,0.0002000000000000668
KEF-1,5/29/2025,08:30:00 am,0,2025-05-29 08:30:00,9.1845,5.203,0.0
KEF-1,5/29/2025,08:40:00 am,0,2025-05-29 08:40:00,9.1849,5.203,0.0
KEF-1,5/29/2025,08:50:00 am,0,2025-05-29 08:50:00,9.1849,5.203,0.00039999999999995595
KEF-1,5/29/2025,09:00:00 am,0,2025-05-29 09:00:00,9.1859,5.207,9.999999999994457e-05
KEF-1,5/29/2025,09:10:00 am,0,2025-05-29 09:10:00,9.1859,5.206,0.0
KEF-1,5/29/2025,09:20:00 am,0,2025-05-29 09:20:00,9.1853,5.206,9.999999999994457e-05
KEF-1,5/29/2025,09:30:00 am,0,2025-05-29 09:30:00,9.1856,5.207,0.0001000000000000334
KEF-1,5/29/2025,09:40:00 am,0,2025-05-29 09:40:00,9.1856,5.208,9.999999999994457e-05
KEF-1,5/29/2025,09:50:00 am,0,2025-05-29 09:50:00,9.1855,5.209,0.00030000000000001136
KEF-1,5/29/2025,10:00:00 am,0,2025-05-29 10:00:00,9.1856,5.212,9.999999999994457e-05
KEF-1,5/29/2025,10:10:00 am,0,2025-05-29 10:10:00,9.1856,5.211,0.00039999999999995595
KEF-1,5/29/2025,10:20:00 am,0,2025-05-29 10:20:00,9.1855,5.215,9.999999999994457e-05
KEF-1,5/29/2025,10:30:00 am,0,2025-05-29 10:30:00,9.1855,5.214,0.0
KEF-1,5/29/2025,10:40:00 am,0,2025-05-29 10:40:00,9.1849,5.214,0.00019999999999997797
KEF-1,5/29/2025,10:50:00 am,0,2025-05-29 10:50:00,9.184,5.216,9.999999999994457e-05
KEF-1,5/29/2025,11:00:00 am,0,2025-05-29 11:00:00,9.1837,5.217,0.0001000000000000334
KEF-1,5/29/2025,11:10:00 am,0,2025-05-29 11:10:00,9.1825,5.218,0.0001000000000000334
KEF-1,5/29/2025,11:20:00 am,0,2025-05-29 11:20:00,9.1813,5.219,0.00019999999999997797
KEF-1,5/29/2025,11:30:00 am,0,2025-05-29 11:30:00,9.181,5.221,0.0001000000000000334
KEF-1,5/29/2025,11:40:00 am,0,2025-05-29 11:40:00,9.1807,5.222,9.999999999994457e-05
KEF-1,5/29/2025,11:50:00 am,0,2025-05-29 11:50:00,9.1803,5.223,0.0
KEF-1,5/29/2025,12:00:00 pm,0,2025-05-29 12:00:00,9.1799,5.223,0.0001000000000000334
KEF-1,5/29/2025,12:10:00 pm,0,2025-05-29 12:10:00,9.1788,5.224,9.999999999994457e-05
KEF-1,5/29/2025,12:20:00 pm,0,2025-05-29 12:20:00,9.1786,5.225,0.00030000000000001136
KEF-1,5/29/2025,12:30:00 pm,0,2025-05-29 12:30:00,9.1776,5.228,0.0001000000000000334
KEF-1,5/29/2025,12:40:00 pm,0,2025-05-29 12:40:00,9.1772,5.229,0.00030000000000001136
KEF-1,5/29/2025,12:50:00 pm,0,2025-05-29 12:50:00,9.1764,5.226,0.00040000000000004474
KEF-1,5/29/2025,01:00:00 pm,0,2025-05-29 13:00:00,9.1755,5.23,0.0002000000000000668
KEF-1,5/29/2025,01:10:00 pm,0,2025-05-29 13:10:00,9.1752,5.228,0.00030000000000001136
KEF-1,5/29/2025,01:20:00 pm,0,2025-05-29 13:20:00,9.1744,5.231,0.00030000000000001136
KEF-1,5/29/2025,01:30:00 pm,0,2025-05-29 13:30:00,9.174,5.234,0.0
KEF-1,5/29/2025,01:40:00 pm,0,2025-05-29 13:40:00,9.1728,5.234,0.0001000000000000334
KEF-1,5/29/2025,01:50:00 pm,0,2025-05-29 13:50:00,9.1725,5.235,0.0001000000000000334
KEF-1,5/29/2025,02:00:00 pm,0,2025-05-29 14:00:00,9.1723,5.234,0.00030000000000001136
KEF-1,5/29/2025,02:10:00 pm,0,2025-05-29 14:10:00,9.1718,5.237,0.0001000000000000334
KEF-1,5/29/2025,02:20:00 pm,0,2025-05-29 14:20:00,9.1714,5.238,9.999999999994457e-05
KEF-1,5/29/2025,02:30:00 pm,0,2025-05-29 14:30:00,9.1722,5.239,9.999999999994457e-05
KEF-1,5/29/2025,02:40:00 pm,0,2025-05-29 14:40:00,9.1728,5.238,9.999999999994457e-05
KEF-1,5/29/2025,02:50:00 pm,0,2025-05-29 14:50:00,9.173,5.239,0.00030000000000001136
KEF-1,5/29/2025,03:00:00 pm,0,2025-05-29 15:00:00,9.1735,5.242,0.0
KEF-1,5/29/2025,03:10:00 pm,0,2025-05-29 15:10:00,9.1735,5.242,0.0001000000000000334
KEF-1,5/29/2025,03:20:00 pm,0,2025-05-29 15:20:00,9.1737,5.241,0.00040000000000004474
KEF-1,5/29/2025,03:30:00 pm,0,2025-05-29 15:30:00,9.1739,5.245,0.0
KEF-1,5/29/2025,03:40:00 pm,0,2025-05-29 15:40:00,9.1739,5.245,0.00019999999999997797
KEF-1,5/29/2025,03:50:00 pm,0,2025-05-29 15:50:00,9.1733,5.247,0.00019999999999997797
KEF-1,5/29/2025,04:00:00 pm,0,2025-05-29 16:00:00,9.1734,5.245,0.00019999999999997797
KEF-1,5/29/2025,04:10:00 pm,0,2025-05-29 16:10:00,9.1733,5.247,0.00019999999999997797
KEF-1,5/29/2025,04:20:00 pm,0,2025-05-29 16:20:00,9.1733,5.249,0.0
KEF-1,5/29/2025,04:30:00 pm,0,2025-05-29 16:30:00,9.1731,5.249,0.00030000000000001136
KEF-1,5/29/2025,04:40:00 pm,0,2025-05-29 16:40:00,9.1727,5.252,0.0
KEF-1,5/29/2025,04:50:00 pm,0,2025-05-29 16:50:00,9.1728,5.252,0.0001000000000000334
KEF-1,5/29/2025,05:00:00 pm,0,2025-05-29 17:00:00,9.1728,5.253,9.999999999994457e-05
KEF-1,5/29/2025,05:10:00 pm,0,2025-05-29 17:10:00,9.1729,5.254,0.003700000000000081
KEF-1,5/29/2025,05:20:00 pm,0,2025-05-29 17:20:00,9.1752,5.291,0.0016000000000000014
KEF-1,5/29/2025,05:30:00 pm,0,2025-05-29 17:30:00,9.1742,5.275,0.0005000000000000782
KEF-1,5/29/2025,05:40:00 pm,0,2025-05-29 17:40:00,9.1737,5.27,0.00019999999999997797
KEF-1,5/29/2025,05:50:00 pm,0,2025-05-29 17:50:00,9.1731,5.268,9.999999999994457e-05
KEF-1,5/29/2025,06:00:00 pm,0,2025-05-29 18:00:00,9.1736,5.267,0.0001000000000000334
KEF-1,5/29/2025,06:10:00 pm,0,2025-05-29 18:10:00,9.1738,5.266,0.00019999999999997797
KEF-1,5/29/2025,06:20:00 pm,0,2025-05-29 18:20:00,9.1742,5.268,0.0
KEF-1,5/29/2025,06:30:00 pm,0,2025-05-29 18:30:00,9.1747,5.268,0.0001000000000000334
KEF-1,5/29/2025,06:40:00 pm,0,2025-05-29 18:40:00,9.1754,5.269,9.999999999994457e-05
KEF-1,5/29/2025,06:50:00 pm,0,2025-05-29 18:50:00,9.1756,5.27,9.999999999994457e-05
KEF-1,5/29/2025,07:00:00 pm,0,2025-05-29 19:00:00,9.1771,5.269,0.00019999999999997797
KEF-1,5/29/2025,07:10:00 pm,0,2025-05-29 19:10:00,9.1779,5.271,0.0001000000000000334
KEF-1,5/29/2025,07:20:00 pm,0,2025-05-29 19:20:00,9.1794,5.272,9.999999999994457e-05
KEF-1,5/29/2025,07:30:00 pm,0,2025-05-29 19:30:00,9.1806,5.273,0.0001000000000000334
KEF-1,5/29/2025,07:40:00 pm,0,2025-05-29 19:40:00,9.1818,5.274,0.0001000000000000334
KEF-1,5/29/2025,07:50:00 pm,0,2025-05-29 19:50:00,9.1833,5.275,0.0
KEF-1,5/29/2025,08:00:00 pm,0,2025-05-29 20:00:00,9.1844,5.275,0.0
KEF-1,5/29/2025,08:10:00 pm,0,2025-05-29 20:10:00,9.186,5.275,0.00029999999999992256
KEF-1,5/29/2025,08:20:00 pm,0,2025-05-29 20:20:00,9.1872,5.278,0.0
KEF-1,5/29/2025,08:30:00 pm,0,2025-05-29 20:30:00,9.1888,5.278,0.0001000000000000334
KEF-1,5/29/2025,08:40:00 pm,0,2025-05-29 20:40:00,9.1901,5.279,0.0
KEF-1,5/29/2025,08:50:00 pm,0,2025-05-29 20:50:00,9.191,5.279,0.00040000000000004474
KEF-1,5/29/2025,09:00:00 pm,0,2025-05-29 21:00:00,9.1922,5.283,0.0001000000000000334
KEF-1,5/29/2025,09:10:00 pm,0,2025-05-29 21:10:00,9.1931,5.282,0.0
KEF-1,5/29/2025,09:20:00 pm,0,2025-05-29 21:20:00,9.1943,5.282,0.0001000000000000334
KEF-1,5/29/2025,09:30:00 pm,0,2025-05-29 21:30:00,9.1957,5.283,9.999999999994457e-05
KEF-1,5/29/2025,09:40:00 pm,0,2025-05-29 21:40:00,9.1975,5.284,0.0001000000000000334
KEF-1,5/29/2025,09:50:00 pm,0,2025-05-29 21:50:00,9.1989,5.285,0.0
KEF-1,5/29/2025,10:00:00 pm,0,2025-05-29 22:00:00,9.2002,5.285,0.00030000000000001136
KEF-1,5/29/2025,10:10:00 pm,0,2025-05-29 22:10:00,9.2003,5.288,0.0
KEF-1,5/29/2025,10:20:00 pm,0,2025-05-29 22:20:00,9.201,5.288,0.00019999999999997797
KEF-1,5/29/2025,10:30:00 pm,0,2025-05-29 22:30:00,9.2018,5.29,0.0001000000000000334
KEF-1,5/29/2025,10:40:00 pm,0,2025-05-29 22:40:00,9.2023,5.291,0.0
KEF-1,5/29/2025,10:50:00 pm,0,2025-05-29 22:50:00,9.2028,5.291,0.00029999999999992256
KEF-1,5/29/2025,11:00:00 pm,0,2025-05-29 23:00:00,9.2037,5.294,0.0
KEF-1,5/29/2025,11:10:00 pm,0,2025-05-29 23:10:00,9.2041,5.294,0.0
KEF-1,5/29/2025,11:20:00 pm,0,2025-05-29 23:20:00,9.2041,5.294,0.0001000000000000334
KEF-1,5/29/2025,11:30:00 pm,0,2025-05-29 23:30:00,9.2049,5.295,0.00019999999999997797
KEF-1,5/29/2025,11:40:00 pm,0,2025-05-29 23:40:00,9.205,5.297,0.0001000000000000334
KEF-1,5/29/2025,11:50:00 pm,0,2025-05-29 23:50:00,9.2067,5.298,0.0
KEF-1,5/30/2025,12:00:00 am,0,2025-05-30 00:00:00,9.2076,5.298,0.0
KEF-1,5/30/2025,12:10:00 am,0,2025-05-30 00:10:00,9.2074,5.298,0.00030000000000001136
KEF-1,5/30/2025,12:20:00 am,0,2025-05-30 00:20:00,9.2076,5.301,0.0001000000000000334
KEF-1,5/30/2025,12:30:00 am,0,2025-05-30 00:30:00,9.2075,5.3,0.00019999999999997797
KEF-1,5/30/2025,12:40:00 am,0,2025-05-30 00:40:00,9.2077,5.302,0.00030000000000001136
KEF-1,5/30/2025,12:50:00 am,0,2025-05-30 00:50:00,9.2078,5.305,0.0
KEF-1,5/30/2025,01:00:00 am,0,2025-05-30 01:00:00,9.2075,5.305,0.0001000000000000334
KEF-1,5/30/2025,01:10:00 am,0,2025-05-30 01:10:00,9.2083,5.306,0.0001000000000000334
KEF-1,5/30/2025,01:20:00 am,0,2025-05-30 01:20:00,9.2083,5.307,0.0
KEF-1,5/30/2025,01:30:00 am,0,2025-05-30 01:30:00,9.2083,5.307,0.00019999999999997797
KEF-1,5/30/2025,01:40:00 am,0,2025-05-30 01:40:00,9.2086,5.309,0.00019999999999997797
KEF-1,5/30/2025,01:50:00 am,0,2025-05-30 01:50:00,9.2093,5.311,0.0001000000000000334
KEF-1,5/30/2025,02:00:00 am,0,2025-05-30 02:00:00,9.2098,5.31,0.0001000000000000334
KEF-1,5/30/2025,02:10:00 am,0,2025-05-30 02:10:00,9.2104,5.311,0.00019999999999997797
KEF-1,5/30/2025,02:20:00 am,0,2025-05-30 02:20:00,9.2101,5.313,0.0001000000000000334
KEF-1,5/30/2025,02:30:00 am,0,2025-05-30 02:30:00,9.2093,5.314,0.0001000000000000334
KEF-1,5/30/2025,02:40:00 am,0,2025-05-30 02:40:00,9.2101,5.315,9.999999999994457e-05
KEF-1,5/30/2025,02:50:00 am,0,2025-05-30 02:50:00,9.2103,5.316,0.0
KEF-1,5/30/2025,03:00:00 am,0,2025-05-30 03:00:00,9.2113,5.316,0.00030000000000001136
KEF-1,5/30/2025,03:10:00 am,0,2025-05-30 03:10:00,9.2124,5.319,0.0
KEF-1,5/30/2025,03:20:00 am,0,2025-05-30 03:20:00,9.2137,5.319,0.0
KEF-1,5/30/2025,03:30:00 am,0,2025-05-30 03:30:00,9.2139,5.319,0.00019999999999997797
KEF-1,5/30/2025,03:40:00 am,0,2025-05-30 03:40:00,9.2142,5.321,0.00030000000000001136
KEF-1,5/30/2025,03:50:00 am,0,2025-05-30 03:50:00,9.2144,5.324,9.999999999994457e-05
KEF-1,5/30/2025,04:00:00 am,0,2025-05-30 04:00:00,9.2153,5.323,9.999999999994457e-05
KEF-1,5/30/2025,04:10:00 am,0,2025-05-30 04:10:00,9.2163,5.324,0.00030000000000001136
KEF-1,5/30/2025,04:20:00 am,0,2025-05-30 04:20:00,9.2161,5.327,0.00030000000000001136
KEF-1,5/30/2025,04:30:00 am,0,2025-05-30 04:30:00,9.2157,5.324,0.00030000000000001136
KEF-1,5/30/2025,04:40:00 am,0,2025-05-30 04:40:00,9.2163,5.327,0.0001000000000000334
KEF-1,5/30/2025,04:50:00 am,0,2025-05-30 04:50:00,9.2162,5.328,9.999999999994457e-05
KEF-1,5/30/2025,05:00:00 am,0,2025-05-30 05:00:00,9.2164,5.329,0.0001000000000000334
KEF-1,5/30/2025,05:10:00 am,0,2025-05-30 05:10:00,9.2171,5.33,0.00019999999999997797
KEF-1,5/30/2025,05:20:00 am,0,2025-05-30 05:20:00,9.218,5.332,0.00030000000000001136
KEF-1,5/30/2025,05:30:00 am,0,2025-05-30 05:30:00,9.2184,5.335,0.0001000000000000334
KEF-1,5/30/2025,05:40:00 am,0,2025-05-30 05:40:00,9.2186,5.334,0.0001000000000000334
KEF-1,5/30/2025,05:50:00 am,0,2025-05-30 05:50:00,9.2191,5.335,0.0001000000000000334
KEF-1,5/30/2025,06:00:00 am,0,2025-05-30 06:00:00,9.2195,5.336,9.999999999994457e-05
KEF-1,5/30/2025,06:10:00 am,0,2025-05-30 06:10:00,9.2202,5.337,0.0002000000000000668
KEF-1,5/30/2025,06:20:00 am,0,2025-05-30 06:20:00,9.2209,5.339,0.0001000000000000334
KEF-1,5/30/2025,06:30:00 am,0,2025-05-30 06:30:00,9.2215,5.338,0.0001000000000000334
KEF-1,5/30/2025,06:40:00 am,0,2025-05-30 06:40:00,9.222,5.339,0.00029999999999992256
KEF-1,5/30/2025,06:50:00 am,0,2025-05-30 06:50:00,9.2222,5.342,0.0001000000000000334
KEF-1,5/30/2025,07:00:00 am,0,2025-05-30 07:00:00,9.2223,5.343,0.0001000000000000334
KEF-1,5/30/2025,07:10:00 am,0,2025-05-30 07:10:00,9.2234,5.344,9.999999999994457e-05
KEF-1,5/30/2025,07:20:00 am,0,2025-05-30 07:20:00,9.2236,5.345,0.0
KEF-1,5/30/2025,07:30:00 am,0,2025-05-30 07:30:00,9.2243,5.345,0.0002000000000000668
KEF-1,5/30/2025,07:40:00 am,0,2025-05-30 07:40:00,9.2252,5.347,0.0001000000000000334
KEF-1,5/30/2025,07:50:00 am,0,2025-05-30 07:50:00,9.2256,5.346,0.00030000000000001136
KEF-1,5/30/2025,08:00:00 am,0,2025-05-30 08:00:00,9.2259,5.349,0.0001000000000000334
KEF-1,5/30/2025,08:10:00 am,0,2025-05-30 08:10:00,9.2264,5.348,0.00030000000000001136
KEF-1,5/30/2025,08:20:00 am,0,2025-05-30 08:20:00,9.2267,5.351,0.00019999999999997797
KEF-1,5/30/2025,08:30:00 am,0,2025-05-30 08:30:00,9.2265,5.353,0.0001000000000000334
KEF-1,5/30/2025,08:40:00 am,0,2025-05-30 08:40:00,9.226,5.354,0.0001000000000000334
KEF-1,5/30/2025,08:50:00 am,0,2025-05-30 08:50:00,9.2256,5.353,0.00030000000000001136
KEF-1,5/30/2025,09:00:00 am,0,2025-05-30 09:00:00,9.2259,5.356,0.0
KEF-1,5/30/2025,09:10:00 am,0,2025-05-30 09:10:00,9.2265,5.356,0.0
KEF-1,5/30/2025,09:20:00 am,0,2025-05-30 09:20:00,9.2258,5.356,0.00019999999999997797
KEF-1,5/30/2025,09:30:00 am,0,2025-05-30 09:30:00,9.2258,5.358,0.0001000000000000334
KEF-1,5/30/2025,09:40:00 am,0,2025-05-30 09:40:00,9.2258,5.359,0.0001000000000000334
KEF-1,5/30/2025,09:50:00 am,0,2025-05-30 09:50:00,9.2256,5.36,9.999999999994457e-05
KEF-1,5/30/2025,10:00:00 am,0,2025-05-30 10:00:00,9.2251,5.361,0.0
KEF-1,5/30/2025,10:10:00 am,0,2025-05-30 10:10:00,9.2247,5.361,0.00040000000000004474
KEF-1,5/30/2025,10:20:00 am,0,2025-05-30 10:20:00,9.2251,5.365,0.0001000000000000334
KEF-1,5/30/2025,10:30:00 am,0,2025-05-30 10:30:00,9.2245,5.364,0.00019999999999997797
KEF-1,5/30/2025,10:40:00 am,0,2025-05-30 10:40:00,9.2232,5.366,0.0001000000000000334
KEF-1,5/30/2025,10:50:00 am,0,2025-05-30 10:50:00,9.2221,5.367,0.0001000000000000334
KEF-1,5/30/2025,11:00:00 am,0,2025-05-30 11:00:00,9.2211,5.366,0.0002000000000000668
KEF-1,5/30/2025,11:10:00 am,0,2025-05-30 11:10:00,9.2202,5.368,9.999999999994457e-05
KEF-1,5/30/2025,11:20:00 am,0,2025-05-30 11:20:00,9.218,5.369,0.0002000000000000668
KEF-1,5/30/2025,11:30:00 am,0,2025-05-30 11:30:00,9.2174,5.371,0.0
KEF-1,5/30/2025,11:40:00 am,0,2025-05-30 11:40:00,9.2163,5.371,9.999999999994457e-05
KEF-1,5/30/2025,11:50:00 am,0,2025-05-30 11:50:00,9.2148,5.372,0.0
KEF-1,5/30/2025,12:00:00 pm,0,2025-05-30 12:00:00,9.2137,5.372,0.00030000000000001136
KEF-1,5/30/2025,12:10:00 pm,0,2025-05-30 12:10:00,9.2123,5.375,0.00019999999999997797
KEF-1,5/30/2025,12:20:00 pm,0,2025-05-30 12:20:00,9.2111,5.377,0.0001000000000000334
KEF-1,5/30/2025,12:30:00 pm,0,2025-05-30 12:30:00,9.2094,5.378,0.0001000000000000334
KEF-1,5/30/2025,12:40:00 pm,0,2025-05-30 12:40:00,9.2091,5.377,0.0001000000000000334
KEF-1,5/30/2025,12:50:00 pm,0,2025-05-30 12:50:00,9.2076,5.378,0.00030000000000001136
KEF-1,5/30/2025,01:00:00 pm,0,2025-05-30 13:00:00,9.2058,5.381,0.0001000000000000334
KEF-1,5/30/2025,01:10:00 pm,0,2025-05-30 13:10:00,9.2043,5.38,0.00019999999999997797
KEF-1,5/30/2025,01:20:00 pm,0,2025-05-30 13:20:00,9.203,5.382,0.00040000000000004474
KEF-1,5/30/2025,01:30:00 pm,0,2025-05-30 13:30:00,9.2026,5.386,0.0001000000000000334
KEF-1,5/30/2025,01:40:00 pm,0,2025-05-30 13:40:00,9.2014,5.385,9.999999999994457e-05
KEF-1,5/30/2025,01:50:00 pm,0,2025-05-30 13:50:00,9.2001,5.384,9.999999999994457e-05
KEF-1,5/30/2025,02:00:00 pm,0,2025-05-30 14:00:00,9.1987,5.385,0.00030000000000001136
KEF-1,5/30/2025,02:10:00 pm,0,2025-05-30 14:10:00,9.1985,5.388,0.0
KEF-1,5/30/2025,02:20:00 pm,0,2025-05-30 14:20:00,9.1973,5.388,0.0001000000000000334
KEF-1,5/30/2025,02:30:00 pm,0,2025-05-30 14:30:00,9.1973,5.389,9.999999999994457e-05
KEF-1,5/30/2025,02:40:00 pm,0,2025-05-30 14:40:00,9.1969,5.39,0.0001000000000000334
KEF-1,5/30/2025,02:50:00 pm,0,2025-05-30 14:50:00,9.1967,5.391,0.0001000000000000334
KEF-1,5/30/2025,03:00:00 pm,0,2025-05-30 15:00:00,9.1964,5.392,0.0
KEF-1,5/30/2025,03:10:00 pm,0,2025-05-30 15:10:00,9.196,5.392,9.999999999994457e-05
KEF-1,5/30/2025,03:20:00 pm,0,2025-05-30 15:20:00,9.1961,5.393,0.00030000000000001136
KEF-1,5/30/2025,03:30:00 pm,0,2025-05-30 15:30:00,9.1953,5.396,0.0001000000000000334
KEF-1,5/30/2025,03:40:00 pm,0,2025-05-30 15:40:00,9.195,5.397,0.00019999999999997797
KEF-1,5/30/2025,03:50:00 pm,0,2025-05-30 15:50:00,9.1948,5.399,0.0
KEF-1,5/30/2025,04:00:00 pm,0,2025-05-30 16:00:00,9.1932,5.399,0.0
KEF-1,5/30/2025,04:10:00 pm,0,2025-05-30 16:10:00,9.1929,5.399,0.0
KEF-1,5/30/2025,04:20:00 pm,0,2025-05-30 16:20:00,9.1925,5.399,0.00039999999999995595
KEF-1,5/30/2025,04:30:00 pm,0,2025-05-30 16:30:00,9.1921,5.403,0.00019999999999997797
KEF-1,5/30/2025,04:40:00 pm,0,2025-05-30 16:40:00,9.1919,5.401,0.00030000000000001136
KEF-1,5/30/2025,04:50:00 pm,0,2025-05-30 16:50:00,9.192,5.404,0.0
KEF-1,5/30/2025,05:00:00 pm,0,2025-05-30 17:00:00,9.1916,5.404,0.00030000000000001136
KEF-1,5/30/2025,05:10:00 pm,0,2025-05-30 17:10:00,9.1923,5.407,0.0001000000000000334
KEF-1,5/30/2025,05:20:00 pm,0,2025-05-30 17:20:00,9.1914,5.408,0.0
KEF-1,5/30/2025,05:30:00 pm,0,2025-05-30 17:30:00,9.1911,5.408,0.0
KEF-1,5/30/2025,05:40:00 pm,0,2025-05-30 17:40:00,9.1911,5.408,0.00029999999999992256
KEF-1,5/30/2025,05:50:00 pm,0,2025-05-30 17:50:00,9.191,5.411,0.0
KEF-1,5/30/2025,06:00:00 pm,0,2025-05-30 18:00:00,9.1904,5.411,0.0
KEF-1,5/30/2025,06:10:00 pm,0,2025-05-30 18:10:00,9.1901,5.411,0.0002000000000000668
KEF-1,5/30/2025,06:20:00 pm,0,2025-05-30 18:20:00,9.1898,5.413,0.00019999999999997797
KEF-1,5/30/2025,06:30:00 pm,0,2025-05-30 18:30:00,9.1897,5.415,0.0001000000000000334
KEF-1,5/30/2025,06:40:00 pm,0,2025-05-30 18:40:00,9.1896,5.416,9.999999999994457e-05
KEF-1,5/30/2025,06:50:00 pm,0,2025-05-30 18:50:00,9.1901,5.417,9.999999999994457e-05
KEF-1,5/30/2025,07:00:00 pm,0,2025-05-30 19:00:00,9.1909,5.416,0.00029999999999992256
KEF-1,5/30/2025,07:10:00 pm,0,2025-05-30 19:10:00,9.1919,5.419,9.999999999994457e-05
KEF-1,5/30/2025,07:20:00 pm,0,2025-05-30 19:20:00,9.1917,5.418,0.00039999999999995595
KEF-1,5/30/2025,07:30:00 pm,0,2025-05-30 19:30:00,9.1924,5.422,0.0
KEF-1,5/30/2025,07:40:00 pm,0,2025-05-30 19:40:00,9.1936,5.422,0.0001000000000000334
KEF-1,5/30/2025,07:50:00 pm,0,2025-05-30 19:50:00,9.1943,5.423,0.00019999999999997797
KEF-1,5/30/2025,08:00:00 pm,0,2025-05-30 20:00:00,9.1948,5.425,9.999999999994457e-05
KEF-1,5/30/2025,08:10:00 pm,0,2025-05-30 20:10:00,9.195,5.424,0.0
KEF-1,5/30/2025,08:20:00 pm,0,2025-05-30 20:20:00,9.1958,5.424,0.00029999999999992256
KEF-1,5/30/2025,08:30:00 pm,0,2025-05-30 20:30:00,9.1962,5.427,0.0001000000000000334
KEF-1,5/30/2025,08:40:00 pm,0,2025-05-30 20:40:00,9.1968,5.428,0.0001000000000000334
KEF-1,5/30/2025,08:50:00 pm,0,2025-05-30 20:50:00,9.1977,5.429,0.0
KEF-1,5/30/2025,09:00:00 pm,0,2025-05-30 21:00:00,9.1982,5.429,0.00019999999999997797
KEF-1,5/30/2025,09:10:00 pm,0,2025-05-30 21:10:00,9.1992,5.431,0.0001000000000000334
KEF-1,5/30/2025,09:20:00 pm,0,2025-05-30 21:20:00,9.2001,5.432,9.999999999994457e-05
KEF-1,5/30/2025,09:30:00 pm,0,2025-05-30 21:30:00,9.2019,5.433,0.0001000000000000334
KEF-1,5/30/2025,09:40:00 pm,0,2025-05-30 21:40:00,9.2037,5.434,9.999999999994457e-05
KEF-1,5/30/2025,09:50:00 pm,0,2025-05-30 21:50:00,9.2048,5.435,0.0
KEF-1,5/30/2025,10:00:00 pm,0,2025-05-30 22:00:00,9.2062,5.435,0.0001000000000000334
KEF-1,5/30/2025,10:10:00 pm,0,2025-05-30 22:10:00,9.2075,5.436,0.00030000000000001136
KEF-1,5/30/2025,10:20:00 pm,0,2025-05-30 22:20:00,9.2078,5.439,0.0001000000000000334
KEF-1,5/30/2025,10:30:00 pm,0,2025-05-30 22:30:00,9.2084,5.44,0.0
KEF-1,5/30/2025,10:40:00 pm,0,2025-05-30 22:40:00,9.2096,5.44,9.999999999994457e-05
KEF-1,5/30/2025,10:50:00 pm,0,2025-05-30 22:50:00,9.2094,5.441,0.0001000000000000334
KEF-1,5/30/2025,11:00:00 pm,0,2025-05-30 23:00:00,9.2095,5.442,0.00019999999999997797
KEF-1,5/30/2025,11:10:00 pm,0,2025-05-30 23:10:00,9.2097,5.444,0.00019999999999997797
KEF-1,5/30/2025,11:20:00 pm,0,2025-05-30 23:20:00,9.2094,5.446,0.0
KEF-1,5/30/2025,11:30:00 pm,0,2025-05-30 23:30:00,9.2097,5.446,0.0001000000000000334
KEF-1,5/30/2025,11:40:00 pm,0,2025-05-30 23:40:00,9.2099,5.447,0.0001000000000000334
KEF-1,5/30/2025,11:50:00 pm,0,2025-05-30 23:50:00,9.2094,5.448,0.0
KEF-1,5/31/2025,12:00:00 am,0,2025-05-31 00:00:00,9.2091,5.448,0.00019999999999997797
KEF-1,5/31/2025,12:10:00 am,0,2025-05-31 00:10:00,9.2087,5.45,0.0
KEF-1,5/31/2025,12:20:00 am,0,2025-05-31 00:20:00,9.2086,5.45,0.0
KEF-1,5/31/2025,12:30:00 am,0,2025-05-31 00:30:00,9.2088,5.45,0.00030000000000001136
KEF-1,5/31/2025,12:40:00 am,0,2025-05-31 00:40:00,9.2087,5.453,0.00030000000000001136
KEF-1,5/31/2025,12:50:00 am,0,2025-05-31 00:50:00,9.2083,5.456,9.999999999994457e-05
KEF-1,5/31/2025,01:00:00 am,0,2025-05-31 01:00:00,9.208,5.457,9.999999999994457e-05
KEF-1,5/31/2025,01:10:00 am,0,2025-05-31 01:10:00,9.2081,5.456,9.999999999994457e-05
KEF-1,5/31/2025,01:20:00 am,0,2025-05-31 01:20:00,9.2083,5.457,0.0001000000000000334
KEF-1,5/31/2025,01:30:00 am,0,2025-05-31 01:30:00,9.2083,5.458,9.999999999994457e-05
KEF-1,5/31/2025,01:40:00 am,0,2025-05-31 01:40:00,9.2081,5.459,0.0002000000000000668
KEF-1,5/31/2025,01:50:00 am,0,2025-05-31 01:50:00,9.2074,5.461,9.999999999994457e-05
KEF-1,5/31/2025,02:00:00 am,0,2025-05-31 02:00:00,9.2068,5.462,0.0002000000000000668
KEF-1,5/31/2025,02:10:00 am,0,2025-05-31 02:10:00,9.2065,5.464,0.0
KEF-1,5/31/2025,02:20:00 am,0,2025-05-31 02:20:00,9.2068,5.464,0.00019999999999997797
KEF-1,5/31/2025,02:30:00 am,0,2025-05-31 02:30:00,9.2065,5.466,0.0001000000000000334
KEF-1,5/31/2025,02:40:00 am,0,2025-05-31 02:40:00,9.2065,5.465,0.0001000000000000334
KEF-1,5/31/2025,02:50:00 am,0,2025-05-31 02:50:00,9.2062,5.466,0.00039999999999995595
KEF-1,5/31/2025,03:00:00 am,0,2025-05-31 03:00:00,9.2064,5.47,0.0002000000000000668
KEF-1,5/31/2025,03:10:00 am,0,2025-05-31 03:10:00,9.2068,5.472,0.0002000000000000668
KEF-1,5/31/2025,03:20:00 am,0,2025-05-31 03:20:00,9.2063,5.47,0.0001000000000000334
KEF-1,5/31/2025,03:30:00 am,0,2025-05-31 03:30:00,9.2068,5.471,0.00019999999999997797
KEF-1,5/31/2025,03:40:00 am,0,2025-05-31 03:40:00,9.207,5.473,0.0001000000000000334
KEF-1,5/31/2025,03:50:00 am,0,2025-05-31 03:50:00,9.2071,5.474,0.0
KEF-1,5/31/2025,04:00:00 am,0,2025-05-31 04:00:00,9.2069,5.474,0.00030000000000001136
KEF-1,5/31/2025,04:10:00 am,0,2025-05-31 04:10:00,9.2065,5.477,0.0
KEF-1,5/31/2025,04:20:00 am,0,2025-05-31 04:20:00,9.206,5.477,9.999999999994457e-05
KEF-1,5/31/2025,04:30:00 am,0,2025-05-31 04:30:00,9.2059,5.478,0.0001000000000000334
KEF-1,5/31/2025,04:40:00 am,0,2025-05-31 04:40:00,9.2069,5.479,0.00030000000000001136
KEF-1,5/31/2025,04:50:00 am,0,2025-05-31 04:50:00,9.2073,5.482,0.0001000000000000334
KEF-1,5/31/2025,05:00:00 am,0,2025-05-31 05:00:00,9.2074,5.481,0.00019999999999997797
KEF-1,5/31/2025,05:10:00 am,0,2025-05-31 05:10:00,9.2072,5.483,0.0
KEF-1,5/31/2025,05:20:00 am,0,2025-05-31 05:20:00,9.2074,5.483,0.0002000000000000668
KEF-1,5/31/2025,05:30:00 am,0,2025-05-31 05:30:00,9.2076,5.485,0.0002000000000000668
KEF-1,5/31/2025,05:40:00 am,0,2025-05-31 05:40:00,9.208,5.483,0.00040000000000004474
KEF-1,5/31/2025,05:50:00 am,0,2025-05-31 05:50:00,9.2083,5.487,0.0001000000000000334
KEF-1,5/31/2025,06:00:00 am,0,2025-05-31 06:00:00,9.2085,5.488,9.999999999994457e-05
KEF-1,5/31/2025,06:10:00 am,0,2025-05-31 06:10:00,9.2088,5.489,0.0001000000000000334
KEF-1,5/31/2025,06:20:00 am,0,2025-05-31 06:20:00,9.209,5.49,9.999999999994457e-05
KEF-1,5/31/2025,06:30:00 am,0,2025-05-31 06:30:00,9.2094,5.491,0.0002000000000000668
KEF-1,5/31/2025,06:40:00 am,0,2025-05-31 06:40:00,9.2097,5.493,9.999999999994457e-05
KEF-1,5/31/2025,06:50:00 am,0,2025-05-31 06:50:00,9.2102,5.494,0.0
KEF-1,5/31/2025,07:00:00 am,0,2025-05-31 07:00:00,9.2104,5.494,0.0001000000000000334
KEF-1,5/31/2025,07:10:00 am,0,2025-05-31 07:10:00,9.2097,5.495,0.0001000000000000334
KEF-1,5/31/2025,07:20:00 am,0,2025-05-31 07:20:00,9.2096,5.496,0.00019999999999997797
KEF-1,5/31/2025,07:30:00 am,0,2025-05-31 07:30:00,9.2089,5.498,9.999999999994457e-05
KEF-1,5/31/2025,07:40:00 am,0,2025-05-31 07:40:00,9.2087,5.499,0.0001000000000000334
KEF-1,5/31/2025,07:50:00 am,0,2025-05-31 07:50:00,9.2091,5.5,0.0001000000000000334
KEF-1,5/31/2025,08:00:00 am,0,2025-05-31 08:00:00,9.2091,5.501,9.999999999994457e-05
KEF-1,5/31/2025,08:10:00 am,0,2025-05-31 08:10:00,9.2085,5.502,0.0001000000000000334
KEF-1,5/31/2025,08:20:00 am,0,2025-05-31 08:20:00,9.208,5.503,9.999999999994457e-05
KEF-1,5/31/2025,08:30:00 am,0,2025-05-31 08:30:00,9.2078,5.504,0.0001000000000000334
KEF-1,5/31/2025,08:40:00 am,0,2025-05-31 08:40:00,9.2077,5.505,0.0001000000000000334
KEF-1,5/31/2025,08:50:00 am,0,2025-05-31 08:50:00,9.2071,5.506,0.0
KEF-1,5/31/2025,09:00:00 am,0,2025-05-31 09:00:00,9.2063,5.506,0.00019999999999997797
KEF-1,5/31/2025,09:10:00 am,0,2025-05-31 09:10:00,9.2062,5.508,0.0001000000000000334
KEF-1,5/31/2025,09:20:00 am,0,2025-05-31 09:20:00,9.2057,5.509,9.999999999994457e-05
KEF-1,5/31/2025,09:30:00 am,0,2025-05-31 09:30:00,9.2055,5.51,0.0001000000000000334
KEF-1,5/31/2025,09:40:00 am,0,2025-05-31 09:40:00,9.2042,5.511,0.00019999999999997797
KEF-1,5/31/2025,09:50:00 am,0,2025-05-31 09:50:00,9.2036,5.513,0.0001000000000000334
KEF-1,5/31/2025,10:00:00 am,0,2025-05-31 10:00:00,9.2031,5.514,9.999999999994457e-05
KEF-1,5/31/2025,10:10:00 am,0,2025-05-31 10:10:00,9.2022,5.515,0.0
KEF-1,5/31/2025,10:20:00 am,0,2025-05-31 10:20:00,9.2006,5.515,0.00040000000000004474
KEF-1,5/31/2025,10:30:00 am,0,2025-05-31 10:30:00,9.1994,5.519,0.0001000000000000334
KEF-1,5/31/2025,10:40:00 am,0,2025-05-31 10:40:00,9.1982,5.518,0.0001000000000000334
KEF-1,5/31/2025,10:50:00 am,0,2025-05-31 10:50:00,9.1961,5.519,0.00030000000000001136
KEF-1,5/31/2025,11:00:00 am,0,2025-05-31 11:00:00,9.1941,5.522,9.999999999994457e-05
KEF-1,5/31/2025,11:10:00 am,0,2025-05-31 11:10:00,9.192,5.523,0.00019999999999997797
KEF-1,5/31/2025,11:20:00 am,0,2025-05-31 11:20:00,9.191,5.521,0.00019999999999997797
KEF-1,5/31/2025,11:30:00 am,0,2025-05-31 11:30:00,9.1896,5.523,0.0002000000000000668
KEF-1,5/31/2025,11:40:00 am,0,2025-05-31 11:40:00,9.1873,5.525,9.999999999994457e-05
KEF-1,5/31/2025,11:50:00 am,0,2025-05-31 11:50:00,9.1857,5.526,0.0001000000000000334
KEF-1,5/31/2025,12:00:00 pm,0,2025-05-31 12:00:00,9.184,5.527,0.00019999999999997797
KEF-1,5/31/2025,12:10:00 pm,0,2025-05-31 12:10:00,9.184,5.529,0.00019999999999997797
KEF-1,5/31/2025,12:20:00 pm,0,2025-05-31 12:20:00,9.1827,5.531,9.999999999994457e-05
KEF-1,5/31/2025,12:30:00 pm,0,2025-05-31 12:30:00,9.1809,5.53,0.0
KEF-1,5/31/2025,12:40:00 pm,0,2025-05-31 12:40:00,9.1803,5.53,0.00030000000000001136
KEF-1,5/31/2025,12:50:00 pm,0,2025-05-31 12:50:00,9.1786,5.533,9.999999999994457e-05
KEF-1,5/31/2025,01:00:00 pm,0,2025-05-31 13:00:00,9.1782,5.534,0.0001000000000000334
KEF-1,5/31/2025,01:10:00 pm,0,2025-05-31 13:10:00,9.1758,5.535,9.999999999994457e-05
KEF-1,5/31/2025,01:20:00 pm,0,2025-05-31 13:20:00,9.1753,5.536,0.0001000000000000334
KEF-1,5/31/2025,01:30:00 pm,0,2025-05-31 13:30:00,9.1738,5.537,0.00030000000000001136
KEF-1,5/31/2025,01:40:00 pm,0,2025-05-31 13:40:00,9.173,5.54,0.0
KEF-1,5/31/2025,01:50:00 pm,0,2025-05-31 13:50:00,9.1729,5.54,0.0001000000000000334
KEF-1,5/31/2025,02:00:00 pm,0,2025-05-31 14:00:00,9.1721,5.541,9.999999999994457e-05
KEF-1,5/31/2025,02:10:00 pm,0,2025-05-31 14:10:00,9.1709,5.542,9.999999999994457e-05
KEF-1,5/31/2025,02:20:00 pm,0,2025-05-31 14:20:00,9.1714,5.541,0.00039999999999995595
KEF-1,5/31/2025,02:30:00 pm,0,2025-05-31 14:30:00,9.1707,5.545,0.00019999999999997797
KEF-1,5/31/2025,02:40:00 pm,0,2025-05-31 14:40:00,9.1702,5.543,0.00030000000000001136
KEF-1,5/31/2025,02:50:00 pm,0,2025-05-31 14:50:00,9.1702,5.546,0.0
KEF-1,5/31/2025,03:00:00 pm,0,2025-05-31 15:00:00,9.1706,5.546,0.00019999999999997797
KEF-1,5/31/2025,03:10:00 pm,0,2025-05-31 15:10:00,9.1702,5.548,0.0
KEF-1,5/31/2025,03:20:00 pm,0,2025-05-31 15:20:00,9.1699,5.548,0.00019999999999997797
KEF-1,5/31/2025,03:30:00 pm,0,2025-05-31 15:30:00,9.1702,5.55,0.0001000000000000334
KEF-1,5/31/2025,03:40:00 pm,0,2025-05-31 15:40:00,9.1693,5.551,0.00019999999999997797
KEF-1,5/31/2025,03:50:00 pm,0,2025-05-31 15:50:00,9.168,5.553,0.0001000000000000334
KEF-1,5/31/2025,04:00:00 pm,0,2025-05-31 16:00:00,9.1673,5.554,0.0001000000000000334
KEF-1,5/31/2025,04:10:00 pm,0,2025-05-31 16:10:00,9.1665,5.553,0.00019999999999997797
KEF-1,5/31/2025,04:20:00 pm,0,2025-05-31 16:20:00,9.166,5.555,0.0002000000000000668
KEF-1,5/31/2025,04:30:00 pm,0,2025-05-31 16:30:00,9.1653,5.557,0.00019999999999997797
KEF-1,5/31/2025,04:40:00 pm,0,2025-05-31 16:40:00,9.1648,5.559,9.999999999994457e-05
KEF-1,5/31/2025,04:50:00 pm,0,2025-05-31 16:50:00,9.1641,5.56,0.0
KEF-1,5/31/2025,05:00:00 pm,0,2025-05-31 17:00:00,9.1639,5.56,0.0
KEF-1,5/31/2025,05:10:00 pm,0,2025-05-31 17:10:00,9.163,5.56,0.0002000000000000668
KEF-1,5/31/2025,05:20:00 pm,0,2025-05-31 17:20:00,9.1626,5.562,9.999999999994457e-05
KEF-1,5/31/2025,05:30:00 pm,0,2025-05-31 17:30:00,9.1614,5.563,0.0001000000000000334
KEF-1,5/31/2025,05:40:00 pm,0,2025-05-31 17:40:00,9.1605,5.564,0.00019999999999997797
KEF-1,5/31/2025,05:50:00 pm,0,2025-05-31 17:50:00,9.1599,5.566,0.00019999999999997797
KEF-1,5/31/2025,06:00:00 pm,0,2025-05-31 18:00:00,9.1584,5.568,0.0001000000000000334
KEF-1,5/31/2025,06:10:00 pm,0,2025-05-31 18:10:00,9.1577,5.569,0.0001000000000000334
KEF-1,5/31/2025,06:20:00 pm,0,2025-05-31 18:20:00,9.1571,5.568,0.0001000000000000334
KEF-1,5/31/2025,06:30:00 pm,0,2025-05-31 18:30:00,9.1568,5.569,0.00040000000000004474
KEF-1,5/31/2025,06:40:00 pm,0,2025-05-31 18:40:00,9.1567,5.573,0.0
KEF-1,5/31/2025,06:50:00 pm,0,2025-05-31 18:50:00,9.1569,5.573,0.0
KEF-1,5/31/2025,07:00:00 pm,0,2025-05-31 19:00:00,9.1573,5.573,9.999999999994457e-05
KEF-1,5/31/2025,07:10:00 pm,0,2025-05-31 19:10:00,9.1583,5.574,0.00019999999999997797
KEF-1,5/31/2025,07:20:00 pm,0,2025-05-31 19:20:00,9.1589,5.576,0.0001000000000000334
KEF-1,5/31/2025,07:30:00 pm,0,2025-05-31 19:30:00,9.1598,5.577,0.0
KEF-1,5/31/2025,07:40:00 pm,0,2025-05-31 19:40:00,9.1611,5.577,0.00030000000000001136
KEF-1,5/31/2025,07:50:00 pm,0,2025-05-31 19:50:00,9.161,5.58,0.0
KEF-1,5/31/2025,08:00:00 pm,0,2025-05-31 20:00:00,9.1609,5.58,0.0001000000000000334
KEF-1,5/31/2025,08:10:00 pm,0,2025-05-31 20:10:00,9.161,5.579,0.00030000000000001136
KEF-1,5/31/2025,08:20:00 pm,0,2025-05-31 20:20:00,9.1608,5.582,0.00019999999999997797
KEF-1,5/31/2025,08:30:00 pm,0,2025-05-31 20:30:00,9.161,5.584,9.999999999994457e-05
KEF-1,5/31/2025,08:40:00 pm,0,2025-05-31 20:40:00,9.1616,5.583,0.00019999999999997797
KEF-1,5/31/2025,08:50:00 pm,0,2025-05-31 20:50:00,9.1619,5.585,0.00019999999999997797
KEF-1,5/31/2025,09:00:00 pm,0,2025-05-31 21:00:00,9.1627,5.587,0.0
KEF-1,5/31/2025,09:10:00 pm,0,2025-05-31 21:10:00,9.1635,5.587,0.00030000000000001136
KEF-1,5/31/2025,09:20:00 pm,0,2025-05-31 21:20:00,9.1642,5.59,0.0001000000000000334
KEF-1,5/31/2025,09:30:00 pm,0,2025-05-31 21:30:00,9.1648,5.591,0.0001000000000000334
KEF-1,5/31/2025,09:40:00 pm,0,2025-05-31 21:40:00,9.1657,5.59,0.00030000000000001136
KEF-1,5/31/2025,09:50:00 pm,0,2025-05-31 21:50:00,9.1665,5.593,0.0
KEF-1,5/31/2025,10:00:00 pm,0,2025-05-31 22:00:00,9.1664,5.593,0.00019999999999997797
KEF-1,5/31/2025,10:10:00 pm,0,2025-05-31 22:10:00,9.1659,5.595,0.0
KEF-1,5/31/2025,10:20:00 pm,0,2025-05-31 22:20:00,9.1656,5.595,0.0002000000000000668
KEF-1,5/31/2025,10:30:00 pm,0,2025-05-31 22:30:00,9.1663,5.597,9.999999999994457e-05
KEF-1,5/31/2025,10:40:00 pm,0,2025-05-31 22:40:00,9.167,5.598,0.0
KEF-1,5/31/2025,10:50:00 pm,0,2025-05-31 22:50:00,9.1675,5.598,0.00030000000000001136
KEF-1,5/31/2025,11:00:00 pm,0,2025-05-31 23:00:00,9.168,5.601,0.0001000000000000334
KEF-1,5/31/2025,11:10:00 pm,0,2025-05-31 23:10:00,9.1683,5.602,0.0
KEF-1,5/31/2025,11:20:00 pm,0,2025-05-31 23:20:00,9.1679,5.602,0.00019999999999997797
KEF-1,5/31/2025,11:30:00 pm,0,2025-05-31 23:30:00,9.1685,5.604,0.0001000000000000334
KEF-1,5/31/2025,11:40:00 pm,0,2025-05-31 23:40:00,9.1685,5.605,9.999999999994457e-05
KEF-1,5/31/2025,11:50:00 pm,0,2025-05-31 23:50:00,9.1684,5.606,9.999999999994457e-05
KEF-1,6/1/2025,12:00:00 am,0,2025-06-01 00:00:00,9.1677,5.605,0.00019999999999997797
KEF-1,6/1/2025,12:10:00 am,0,2025-06-01 00:10:00,9.1671,5.607,0.00019999999999997797
KEF-1,6/1/2025,12:20:00 am,0,2025-06-01 00:20:00,9.1662,5.609,0.00019999999999997797
KEF-1,6/1/2025,12:30:00 am,0,2025-06-01 00:30:00,9.1651,5.611,0.0
KEF-1,6/1/2025,12:40:00 am,0,2025-06-01 00:40:00,9.1639,5.611,0.0001000000000000334
KEF-1,6/1/2025,12:50:00 am,0,2025-06-01 00:50:00,9.1632,5.612,0.0001000000000000334
KEF-1,6/1/2025,01:00:00 am,0,2025-06-01 01:00:00,9.1627,5.613,0.00029999999999992256
KEF-1,6/1/2025,01:10:00 am,0,2025-06-01 01:10:00,9.1627,5.616,0.0002000000000000668
KEF-1,6/1/2025,01:20:00 am,0,2025-06-01 01:20:00,9.1622,5.618,0.0
KEF-1,6/1/2025,01:30:00 am,0,2025-06-01 01:30:00,9.1622,5.618,0.0
KEF-1,6/1/2025,01:40:00 am,0,2025-06-01 01:40:00,9.1622,5.618,0.00019999999999997797
KEF-1,6/1/2025,01:50:00 am,0,2025-06-01 01:50:00,9.1618,5.62,0.0
KEF-1,6/1/2025,02:00:00 am,0,2025-06-01 02:00:00,9.1619,5.62,0.0001000000000000334
KEF-1,6/1/2025,02:10:00 am,0,2025-06-01 02:10:00,9.1617,5.621,0.00019999999999997797
KEF-1,6/1/2025,02:20:00 am,0,2025-06-01 02:20:00,9.1616,5.623,0.00019999999999997797
KEF-1,6/1/2025,02:30:00 am,0,2025-06-01 02:30:00,9.1618,5.625,0.0001000000000000334
KEF-1,6/1/2025,02:40:00 am,0,2025-06-01 02:40:00,9.1616,5.624,0.0002000000000000668
KEF-1,6/1/2025,02:50:00 am,0,2025-06-01 02:50:00,9.1614,5.626,9.999999999994457e-05
KEF-1,6/1/2025,03:00:00 am,0,2025-06-01 03:00:00,9.1607,5.627,0.00030000000000001136
KEF-1,6/1/2025,03:10:00 am,0,2025-06-01 03:10:00,9.1606,5.63,0.0001000000000000334
KEF-1,6/1/2025,03:20:00 am,0,2025-06-01 03:20:00,9.1601,5.629,0.0
KEF-1,6/1/2025,03:30:00 am,0,2025-06-01 03:30:00,9.1601,5.629,0.00030000000000001136
KEF-1,6/1/2025,03:40:00 am,0,2025-06-01 03:40:00,9.1597,5.632,0.0001000000000000334
KEF-1,6/1/2025,03:50:00 am,0,2025-06-01 03:50:00,9.1597,5.633,0.00019999999999997797
KEF-1,6/1/2025,04:00:00 am,0,2025-06-01 04:00:00,9.1597,5.635,0.00019999999999997797
KEF-1,6/1/2025,04:10:00 am,0,2025-06-01 04:10:00,9.1591,5.637,0.00019999999999997797
KEF-1,6/1/2025,04:20:00 am,0,2025-06-01 04:20:00,9.1587,5.635,9.999999999994457e-05
KEF-1,6/1/2025,04:30:00 am,0,2025-06-01 04:30:00,9.1582,5.634,0.00039999999999995595
KEF-1,6/1/2025,04:40:00 am,0,2025-06-01 04:40:00,9.1578,5.638,0.0
KEF-1,6/1/2025,04:50:00 am,0,2025-06-01 04:50:00,9.1572,5.638,0.00030000000000001136
KEF-1,6/1/2025,05:00:00 am,0,2025-06-01 05:00:00,9.1572,5.641,0.00019999999999997797
KEF-1,6/1/2025,05:10:00 am,0,2025-06-01 05:10:00,9.1574,5.643,0.00019999999999997797
KEF-1,6/1/2025,05:20:00 am,0,2025-06-01 05:20:00,9.1571,5.645,0.0
KEF-1,6/1/2025,05:30:00 am,0,2025-06-01 05:30:00,9.1564,5.645,0.0002000000000000668
KEF-1,6/1/2025,05:40:00 am,0,2025-06-01 05:40:00,9.1564,5.647,0.0
KEF-1,6/1/2025,05:50:00 am,0,2025-06-01 05:50:00,9.1562,5.647,0.0
KEF-1,6/1/2025,06:00:00 am,0,2025-06-01 06:00:00,9.1556,5.647,0.00019999999999997797
KEF-1,6/1/2025,06:10:00 am,0,2025-06-01 06:10:00,9.1552,5.649,0.0001000000000000334
KEF-1,6/1/2025,06:20:00 am,0,2025-06-01 06:20:00,9.1546,5.65,0.00029999999999992256
KEF-1,6/1/2025,06:30:00 am,0,2025-06-01 06:30:00,9.1548,5.653,0.0
KEF-1,6/1/2025,06:40:00 am,0,2025-06-01 06:40:00,9.1552,5.653,0.0
KEF-1,6/1/2025,06:50:00 am,0,2025-06-01 06:50:00,9.1558,5.653,0.0001000000000000334
KEF-1,6/1/2025,07:00:00 am,0,2025-06-01 07:00:00,9.1561,5.654,0.00030000000000001136
KEF-1,6/1/2025,07:10:00 am,0,2025-06-01 07:10:00,9.1561,5.657,0.0
KEF-1,6/1/2025,07:20:00 am,0,2025-06-01 07:20:00,9.1554,5.657,0.0001000000000000334
KEF-1,6/1/2025,07:30:00 am,0,2025-06-01 07:30:00,9.1547,5.658,0.00019999999999997797
KEF-1,6/1/2025,07:40:00 am,0,2025-06-01 07:40:00,9.1536,5.66,0.0
KEF-1,6/1/2025,07:50:00 am,0,2025-06-01 07:50:00,9.153,5.66,9.999999999994457e-05
KEF-1,6/1/2025,08:00:00 am,0,2025-06-01 08:00:00,9.1524,5.661,0.0001000000000000334
KEF-1,6/1/2025,08:10:00 am,0,2025-06-01 08:10:00,9.1516,5.662,0.00030000000000001136
KEF-1,6/1/2025,08:20:00 am,0,2025-06-01 08:20:00,9.1506,5.665,0.0
KEF-1,6/1/2025,08:30:00 am,0,2025-06-01 08:30:00,9.1501,5.665,0.00019999999999997797
KEF-1,6/1/2025,08:40:00 am,0,2025-06-01 08:40:00,9.1498,5.667,0.0001000000000000334
KEF-1,6/1/2025,08:50:00 am,0,2025-06-01 08:50:00,9.1499,5.668,9.999999999994457e-05
KEF-1,6/1/2025,09:00:00 am,0,2025-06-01 09:00:00,9.1487,5.669,0.0001000000000000334
KEF-1,6/1/2025,09:10:00 am,0,2025-06-01 09:10:00,9.1486,5.67,0.00019999999999997797
KEF-1,6/1/2025,09:20:00 am,0,2025-06-01 09:20:00,9.1477,5.672,0.0
KEF-1,6/1/2025,09:30:00 am,0,2025-06-01 09:30:00,9.1469,5.672,0.0002000000000000668
KEF-1,6/1/2025,09:40:00 am,0,2025-06-01 09:40:00,9.1468,5.674,0.00019999999999997797
KEF-1,6/1/2025,09:50:00 am,0,2025-06-01 09:50:00,9.1459,5.676,9.999999999994457e-05
KEF-1,6/1/2025,10:00:00 am,0,2025-06-01 10:00:00,9.1449,5.677,0.0001000000000000334
KEF-1,6/1/2025,10:10:00 am,0,2025-06-01 10:10:00,9.144,5.678,0.0001000000000000334
KEF-1,6/1/2025,10:20:00 am,0,2025-06-01 10:20:00,9.144,5.679,9.999999999994457e-05
KEF-1,6/1/2025,10:30:00 am,0,2025-06-01 10:30:00,9.1424,5.68,0.0001000000000000334
KEF-1,6/1/2025,10:40:00 am,0,2025-06-01 10:40:00,9.1415,5.681,0.0001000000000000334
KEF-1,6/1/2025,10:50:00 am,0,2025-06-01 10:50:00,9.1403,5.68,0.00040000000000004474
KEF-1,6/1/2025,11:00:00 am,0,2025-06-01 11:00:00,9.1388,5.684,0.0
KEF-1,6/1/2025,11:10:00 am,0,2025-06-01 11:10:00,9.1382,5.684,9.999999999994457e-05
KEF-1,6/1/2025,11:20:00 am,0,2025-06-01 11:20:00,9.137,5.685,0.0002000000000000668
KEF-1,6/1/2025,11:30:00 am,0,2025-06-01 11:30:00,9.1357,5.687,0.00019999999999997797
KEF-1,6/1/2025,11:40:00 am,0,2025-06-01 11:40:00,9.1354,5.689,0.0001000000000000334
KEF-1,6/1/2025,11:50:00 am,0,2025-06-01 11:50:00,9.1331,5.688,0.0002000000000000668
KEF-1,6/1/2025,12:00:00 pm,0,2025-06-01 12:00:00,9.1321,5.69,9.999999999994457e-05
KEF-1,6/1/2025,12:10:00 pm,0,2025-06-01 12:10:00,9.1315,5.691,0.0001000000000000334
KEF-1,6/1/2025,12:20:00 pm,0,2025-06-01 12:20:00,9.1309,5.692,0.00019999999999997797
KEF-1,6/1/2025,12:30:00 pm,0,2025-06-01 12:30:00,9.1306,5.694,0.0001000000000000334
KEF-1,6/1/2025,12:40:00 pm,0,2025-06-01 12:40:00,9.1304,5.695,9.999999999994457e-05
KEF-1,6/1/2025,12:50:00 pm,0,2025-06-01 12:50:00,9.1297,5.696,0.0001000000000000334
KEF-1,6/1/2025,01:00:00 pm,0,2025-06-01 13:00:00,9.1291,5.697,0.0001000000000000334
KEF-1,6/1/2025,01:10:00 pm,0,2025-06-01 13:10:00,9.1284,5.698,0.00019999999999997797
KEF-1,6/1/2025,01:20:00 pm,0,2025-06-01 13:20:00,9.1273,5.7,0.0001000000000000334
KEF-1,6/1/2025,01:30:00 pm,0,2025-06-01 13:30:00,9.1263,5.699,0.00030000000000001136
KEF-1,6/1/2025,01:40:00 pm,0,2025-06-01 13:40:00,9.1259,5.702,0.0001000000000000334
KEF-1,6/1/2025,01:50:00 pm,0,2025-06-01 13:50:00,9.1248,5.701,0.00040000000000004474
KEF-1,6/1/2025,02:00:00 pm,0,2025-06-01 14:00:00,9.1238,5.705,0.00019999999999997797
KEF-1,6/1/2025,02:10:00 pm,0,2025-06-01 14:10:00,9.1222,5.707,0.00030000000000001136
KEF-1,6/1/2025,02:20:00 pm,0,2025-06-01 14:20:00,9.1207,5.704,0.0004999999999999894
KEF-1,6/1/2025,02:30:00 pm,0,2025-06-01 14:30:00,9.1193,5.709,0.0
KEF-1,6/1/2025,02:40:00 pm,0,2025-06-01 14:40:00,9.1193,5.709,0.0001000000000000334
KEF-1,6/1/2025,02:50:00 pm,0,2025-06-01 14:50:00,9.1177,5.71,0.0
KEF-1,6/1/2025,03:00:00 pm,0,2025-06-01 15:00:00,9.1171,5.71,0.00030000000000001136
KEF-1,6/1/2025,03:10:00 pm,0,2025-06-01 15:10:00,9.1161,5.713,0.0
KEF-1,6/1/2025,03:20:00 pm,0,2025-06-01 15:20:00,9.1162,5.713,0.00019999999999997797
KEF-1,6/1/2025,03:30:00 pm,0,2025-06-01 15:30:00,9.1157,5.715,0.00030000000000001136
KEF-1,6/1/2025,03:40:00 pm,0,2025-06-01 15:40:00,9.1143,5.718,0.0001000000000000334
KEF-1,6/1/2025,03:50:00 pm,0,2025-06-01 15:50:00,9.1138,5.717,0.0001000000000000334
KEF-1,6/1/2025,04:00:00 pm,0,2025-06-01 16:00:00,9.1118,5.718,0.0001000000000000334
KEF-1,6/1/2025,04:10:00 pm,0,2025-06-01 16:10:00,9.1118,5.719,0.00019999999999997797
KEF-1,6/1/2025,04:20:00 pm,0,2025-06-01 16:20:00,9.1116,5.721,0.00019999999999997797
KEF-1,6/1/2025,04:30:00 pm,0,2025-06-01 16:30:00,9.1108,5.723,0.0
KEF-1,6/1/2025,04:40:00 pm,0,2025-06-01 16:40:00,9.1097,5.723,0.00019999999999997797
KEF-1,6/1/2025,04:50:00 pm,0,2025-06-01 16:50:00,9.1109,5.725,0.0
KEF-1,6/1/2025,05:00:00 pm,0,2025-06-01 17:00:00,9.1108,5.725,0.0002000000000000668
KEF-1,6/1/2025,05:10:00 pm,0,2025-06-01 17:10:00,9.111,5.727,9.999999999994457e-05
KEF-1,6/1/2025,05:20:00 pm,0,2025-06-01 17:20:00,9.1107,5.728,0.00030000000000001136
KEF-1,6/1/2025,05:30:00 pm,0,2025-06-01 17:30:00,9.111,5.731,9.999999999994457e-05
KEF-1,6/1/2025,05:40:00 pm,0,2025-06-01 17:40:00,9.1108,5.73,0.00019999999999997797
KEF-1,6/1/2025,05:50:00 pm,0,2025-06-01 17:50:00,9.1112,5.732,0.00019999999999997797
KEF-1,6/1/2025,06:00:00 pm,0,2025-06-01 18:00:00,9.1119,5.734,0.0
KEF-1,6/1/2025,06:10:00 pm,0,2025-06-01 18:10:00,9.1125,5.734,0.00019999999999997797
KEF-1,6/1/2025,06:20:00 pm,0,2025-06-01 18:20:00,9.1132,5.736,0.0002000000000000668
KEF-1,6/1/2025,06:30:00 pm,0,2025-06-01 18:30:00,9.1139,5.738,9.999999999994457e-05
KEF-1,6/1/2025,06:40:00 pm,0,2025-06-01 18:40:00,9.1135,5.739,0.0
KEF-1,6/1/2025,06:50:00 pm,0,2025-06-01 18:50:00,9.114,5.739,0.0001000000000000334
KEF-1,6/1/2025,07:00:00 pm,0,2025-06-01 19:00:00,9.115,5.74,9.999999999994457e-05
KEF-1,6/1/2025,07:10:00 pm,0,2025-06-01 19:10:00,9.1161,5.741,0.0002000000000000668
KEF-1,6/1/2025,07:20:00 pm,0,2025-06-01 19:20:00,9.1171,5.743,9.999999999994457e-05
KEF-1,6/1/2025,07:30:00 pm,0,2025-06-01 19:30:00,9.1185,5.744,0.0
KEF-1,6/1/2025,07:40:00 pm,0,2025-06-01 19:40:00,9.1195,5.744,0.0002000000000000668
KEF-1,6/1/2025,07:50:00 pm,0,2025-06-01 19:50:00,9.1208,5.746,9.999999999994457e-05
KEF-1,6/1/2025,08:00:00 pm,0,2025-06-01 20:00:00,9.1226,5.747,0.00019999999999997797
KEF-1,6/1/2025,08:10:00 pm,0,2025-06-01 20:10:00,9.1239,5.749,0.0001000000000000334
KEF-1,6/1/2025,08:20:00 pm,0,2025-06-01 20:20:00,9.1244,5.75,0.0
KEF-1,6/1/2025,08:30:00 pm,0,2025-06-01 20:30:00,9.1248,5.75,0.0001000000000000334
KEF-1,6/1/2025,08:40:00 pm,0,2025-06-01 20:40:00,9.1252,5.751,0.00029999999999992256
KEF-1,6/1/2025,08:50:00 pm,0,2025-06-01 20:50:00,9.1261,5.754,0.0001000000000000334
KEF-1,6/1/2025,09:00:00 pm,0,2025-06-01 21:00:00,9.1282,5.755,0.0001000000000000334
KEF-1,6/1/2025,09:10:00 pm,0,2025-06-01 21:10:00,9.1304,5.756,0.0001000000000000334
KEF-1,6/1/2025,09:20:00 pm,0,2025-06-01 21:20:00,9.1323,5.755,0.00030000000000001136
KEF-1,6/1/2025,09:30:00 pm,0,2025-06-01 21:30:00,9.1339,5.758,0.0001000000000000334
KEF-1,6/1/2025,09:40:00 pm,0,2025-06-01 21:40:00,9.1355,5.759,0.00019999999999997797
KEF-1,6/1/2025,09:50:00 pm,0,2025-06-01 21:50:00,9.1377,5.761,9.999999999994457e-05
KEF-1,6/1/2025,10:00:00 pm,0,2025-06-01 22:00:00,9.1395,5.762,9.999999999994457e-05
KEF-1,6/1/2025,10:10:00 pm,0,2025-06-01 22:10:00,9.1417,5.761,0.00030000000000001136
KEF-1,6/1/2025,10:20:00 pm,0,2025-06-01 22:20:00,9.1433,5.764,0.00019999999999997797
KEF-1,6/1/2025,10:30:00 pm,0,2025-06-01 22:30:00,9.1444,5.766,0.00019999999999997797
KEF-1,6/1/2025,10:40:00 pm,0,2025-06-01 22:40:00,9.1449,5.768,9.999999999994457e-05
KEF-1,6/1/2025,10:50:00 pm,0,2025-06-01 22:50:00,9.1454,5.767,0.00019999999999997797
KEF-1,6/1/2025,11:00:00 pm,0,2025-06-01 23:00:00,9.1452,5.769,0.00019999999999997797
KEF-1,6/1/2025,11:10:00 pm,0,2025-06-01 23:10:00,9.1441,5.771,0.0001000000000000334
KEF-1,6/1/2025,11:20:00 pm,0,2025-06-01 23:20:00,9.1429,5.772,0.00019999999999997797
KEF-1,6/1/2025,11:30:00 pm,0,2025-06-01 23:30:00,9.1428,5.774,0.0001000000000000334
KEF-1,6/1/2025,11:40:00 pm,0,2025-06-01 23:40:00,9.1449,5.775,0.0
KEF-1,6/1/2025,11:50:00 pm,0,2025-06-01 23:50:00,9.1475,5.775,0.0
KEF-1,6/2/2025,12:00:00 am,0,2025-06-02 00:00:00,9.1476,5.775,9.999999999994457e-05
KEF-1,6/2/2025,12:10:00 am,0,2025-06-02 00:10:00,9.1477,5.776,0.00030000000000001136
KEF-1,6/2/2025,12:20:00 am,0,2025-06-02 00:20:00,9.148,5.779,0.0001000000000000334
KEF-1,6/2/2025,12:30:00 am,0,2025-06-02 00:30:00,9.1491,5.78,0.00019999999999997797
KEF-1,6/2/2025,12:40:00 am,0,2025-06-02 00:40:00,9.1492,5.782,0.00019999999999997797
KEF-1,6/2/2025,12:50:00 am,0,2025-06-02 00:50:00,9.1491,5.78,0.00039999999999995595
KEF-1,6/2/2025,01:00:00 am,0,2025-06-02 01:00:00,9.1495,5.784,0.0
KEF-1,6/2/2025,01:10:00 am,0,2025-06-02 01:10:00,9.1507,5.784,0.00019999999999997797
KEF-1,6/2/2025,01:20:00 am,0,2025-06-02 01:20:00,9.1509,5.786,0.0
KEF-1,6/2/2025,01:30:00 am,0,2025-06-02 01:30:00,9.1514,5.786,0.00040000000000004474
KEF-1,6/2/2025,01:40:00 am,0,2025-06-02 01:40:00,9.1509,5.79,0.0
KEF-1,6/2/2025,01:50:00 am,0,2025-06-02 01:50:00,9.1509,5.79,0.00019999999999997797
KEF-1,6/2/2025,02:00:00 am,0,2025-06-02 02:00:00,9.1519,5.792,0.0
KEF-1,6/2/2025,02:10:00 am,0,2025-06-02 02:10:00,9.1515,5.792,0.0001000000000000334
KEF-1,6/2/2025,02:20:00 am,0,2025-06-02 02:20:00,9.152,5.793,0.00019999999999997797
KEF-1,6/2/2025,02:30:00 am,0,2025-06-02 02:30:00,9.1521,5.795,0.0001000000000000334
KEF-1,6/2/2025,02:40:00 am,0,2025-06-02 02:40:00,9.1524,5.796,9.999999999994457e-05
KEF-1,6/2/2025,02:50:00 am,0,2025-06-02 02:50:00,9.1531,5.797,0.0
KEF-1,6/2/2025,03:00:00 am,0,2025-06-02 03:00:00,9.153,5.797,0.0002000000000000668
KEF-1,6/2/2025,03:10:00 am,0,2025-06-02 03:10:00,9.1536,5.799,9.999999999994457e-05
KEF-1,6/2/2025,03:20:00 am,0,2025-06-02 03:20:00,9.1538,5.8,0.00019999999999997797
KEF-1,6/2/2025,03:30:00 am,0,2025-06-02 03:30:00,9.1537,5.802,0.0
KEF-1,6/2/2025,03:40:00 am,0,2025-06-02 03:40:00,9.1544,5.802,0.0002000000000000668
KEF-1,6/2/2025,03:50:00 am,0,2025-06-02 03:50:00,9.1555,5.804,0.00019999999999997797
KEF-1,6/2/2025,04:00:00 am,0,2025-06-02 04:00:00,9.1563,5.806,0.00019999999999997797
KEF-1,6/2/2025,04:10:00 am,0,2025-06-02 04:10:00,9.1569,5.808,9.999999999994457e-05
KEF-1,6/2/2025,04:20:00 am,0,2025-06-02 04:20:00,9.157,5.807,0.00019999999999997797
KEF-1,6/2/2025,04:30:00 am,0,2025-06-02 04:30:00,9.158,5.809,0.00030000000000001136
KEF-1,6/2/2025,04:40:00 am,0,2025-06-02 04:40:00,9.1592,5.812,0.00040000000000004474
KEF-1,6/2/2025,04:50:00 am,0,2025-06-02 04:50:00,9.1599,5.808,0.0004999999999999894
KEF-1,6/2/2025,05:00:00 am,0,2025-06-02 05:00:00,9.16,5.813,0.0001000000000000334
KEF-1,6/2/2025,05:10:00 am,0,2025-06-02 05:10:00,9.161,5.814,0.00030000000000001136
KEF-1,6/2/2025,05:20:00 am,0,2025-06-02 05:20:00,9.1618,5.817,0.00019999999999997797
KEF-1,6/2/2025,05:30:00 am,0,2025-06-02 05:30:00,9.1629,5.815,0.00019999999999997797
KEF-1,6/2/2025,05:40:00 am,0,2025-06-02 05:40:00,9.1641,5.817,0.00019999999999997797
KEF-1,6/2/2025,05:50:00 am,0,2025-06-02 05:50:00,9.165,5.819,0.0001000000000000334
KEF-1,6/2/2025,06:00:00 am,0,2025-06-02 06:00:00,9.1656,5.82,9.999999999994457e-05
KEF-1,6/2/2025,06:10:00 am,0,2025-06-02 06:10:00,9.1657,5.821,0.0002000000000000668
KEF-1,6/2/2025,06:20:00 am,0,2025-06-02 06:20:00,9.1663,5.823,0.0001000000000000334
KEF-1,6/2/2025,06:30:00 am,0,2025-06-02 06:30:00,9.167,5.822,0.0001000000000000334
KEF-1,6/2/2025,06:40:00 am,0,2025-06-02 06:40:00,9.1687,5.823,0.00039999999999995595
KEF-1,6/2/2025,06:50:00 am,0,2025-06-02 06:50:00,9.1692,5.827,0.0001000000000000334
KEF-1,6/2/2025,07:00:00 am,0,2025-06-02 07:00:00,9.1696,5.826,0.00030000000000001136
KEF-1,6/2/2025,07:10:00 am,0,2025-06-02 07:10:00,9.1698,5.829,0.0
KEF-1,6/2/2025,07:20:00 am,0,2025-06-02 07:20:00,9.1705,5.829,0.0001000000000000334
KEF-1,6/2/2025,07:30:00 am,0,2025-06-02 07:30:00,9.1709,5.83,0.00039999999999995595
KEF-1,6/2/2025,07:40:00 am,0,2025-06-02 07:40:00,9.1699,5.834,0.0
KEF-1,6/2/2025,07:50:00 am,0,2025-06-02 07:50:00,9.1708,5.834,0.0001000000000000334
KEF-1,6/2/2025,08:00:00 am,0,2025-06-02 08:00:00,9.1716,5.835,0.0
KEF-1,6/2/2025,08:10:00 am,0,2025-06-02 08:10:00,9.1708,5.835,0.00030000000000001136
KEF-1,6/2/2025,08:20:00 am,0,2025-06-02 08:20:00,9.1714,5.838,0.0001000000000000334
KEF-1,6/2/2025,08:30:00 am,0,2025-06-02 08:30:00,9.1724,5.837,0.00030000000000001136
KEF-1,6/2/2025,08:40:00 am,0,2025-06-02 08:40:00,9.1732,5.84,0.0001000000000000334
KEF-1,6/2/2025,08:50:00 am,0,2025-06-02 08:50:00,9.1732,5.841,0.0
KEF-1,6/2/2025,09:00:00 am,0,2025-06-02 09:00:00,9.1726,5.841,0.00030000000000001136
KEF-1,6/2/2025,09:10:00 am,0,2025-06-02 09:10:00,9.1716,5.844,0.0
KEF-1,6/2/2025,09:20:00 am,0,2025-06-02 09:20:00,9.1713,5.844,9.999999999994457e-05
KEF-1,6/2/2025,09:30:00 am,0,2025-06-02 09:30:00,9.1709,5.845,0.0002000000000000668
KEF-1,6/2/2025,09:40:00 am,0,2025-06-02 09:40:00,9.1707,5.847,0.00019999999999997797
KEF-1,6/2/2025,09:50:00 am,0,2025-06-02 09:50:00,9.1705,5.849,9.999999999994457e-05
KEF-1,6/2/2025,10:00:00 am,0,2025-06-02 10:00:00,9.1699,5.85,0.0002000000000000668
KEF-1,6/2/2025,10:10:00 am,0,2025-06-02 10:10:00,9.1696,5.852,0.0001000000000000334
KEF-1,6/2/2025,10:20:00 am,0,2025-06-02 10:20:00,9.1686,5.851,0.00019999999999997797
KEF-1,6/2/2025,10:30:00 am,0,2025-06-02 10:30:00,9.1668,5.853,0.0002000000000000668
KEF-1,6/2/2025,10:40:00 am,0,2025-06-02 10:40:00,9.1662,5.855,0.0
KEF-1,6/2/2025,10:50:00 am,0,2025-06-02 10:50:00,9.1648,5.855,9.999999999994457e-05
KEF-1,6/2/2025,11:00:00 am,0,2025-06-02 11:00:00,9.1637,5.856,0.00030000000000001136
KEF-1,6/2/2025,11:10:00 am,0,2025-06-02 11:10:00,9.1625,5.859,0.0
KEF-1,6/2/2025,11:20:00 am,0,2025-06-02 11:20:00,9.1613,5.859,0.0001000000000000334
KEF-1,6/2/2025,11:30:00 am,0,2025-06-02 11:30:00,9.1604,5.86,0.0
KEF-1,6/2/2025,11:40:00 am,0,2025-06-02 11:40:00,9.1596,5.86,0.00039999999999995595
KEF-1,6/2/2025,11:50:00 am,0,2025-06-02 11:50:00,9.1582,5.864,0.00019999999999997797
KEF-1,6/2/2025,12:00:00 pm,0,2025-06-02 12:00:00,9.1574,5.866,9.999999999994457e-05
KEF-1,6/2/2025,12:10:00 pm,0,2025-06-02 12:10:00,9.1563,5.865,0.00019999999999997797
KEF-1,6/2/2025,12:20:00 pm,0,2025-06-02 12:20:00,9.1555,5.867,0.00019999999999997797
KEF-1,6/2/2025,12:30:00 pm,0,2025-06-02 12:30:00,9.1542,5.869,0.0
KEF-1,6/2/2025,12:40:00 pm,0,2025-06-02 12:40:00,9.1519,5.869,0.0002000000000000668
KEF-1,6/2/2025,12:50:00 pm,0,2025-06-02 12:50:00,9.151,5.871,0.0
KEF-1,6/2/2025,01:00:00 pm,0,2025-06-02 13:00:00,9.1493,5.871,0.00019999999999997797
KEF-1,6/2/2025,01:10:00 pm,0,2025-06-02 13:10:00,9.1475,5.873,9.999999999994457e-05
KEF-1,6/2/2025,01:20:00 pm,0,2025-06-02 13:20:00,9.1462,5.874,0.0002000000000000668
KEF-1,6/2/2025,01:30:00 pm,0,2025-06-02 13:30:00,9.1451,5.876,9.999999999994457e-05
KEF-1,6/2/2025,01:40:00 pm,0,2025-06-02 13:40:00,9.1439,5.877,0.00030000000000001136
KEF-1,6/2/2025,01:50:00 pm,0,2025-06-02 13:50:00,9.143,5.88,0.00019999999999997797
KEF-1,6/2/2025,02:00:00 pm,0,2025-06-02 14:00:00,9.1413,5.882,9.999999999994457e-05
KEF-1,6/2/2025,02:10:00 pm,0,2025-06-02 14:10:00,9.1408,5.881,0.0
KEF-1,6/2/2025,02:20:00 pm,0,2025-06-02 14:20:00,9.1397,5.881,9.999999999994457e-05
KEF-1,6/2/2025,02:30:00 pm,0,2025-06-02 14:30:00,9.1389,5.882,0.0001000000000000334
KEF-1,6/2/2025,02:40:00 pm,0,2025-06-02 14:40:00,9.1383,5.883,0.00030000000000001136
KEF-1,6/2/2025,02:50:00 pm,0,2025-06-02 14:50:00,9.1381,5.886,0.0001000000000000334
KEF-1,6/2/2025,03:00:00 pm,0,2025-06-02 15:00:00,9.1383,5.885,0.0004999999999999894
KEF-1,6/2/2025,03:10:00 pm,0,2025-06-02 15:10:00,9.1379,5.89,0.0
KEF-1,6/2/2025,03:20:00 pm,0,2025-06-02 15:20:00,9.1372,5.89,0.0002000000000000668
KEF-1,6/2/2025,03:30:00 pm,0,2025-06-02 15:30:00,9.1369,5.892,0.0
KEF-1,6/2/2025,03:40:00 pm,0,2025-06-02 15:40:00,9.1367,5.892,0.0001000000000000334
KEF-1,6/2/2025,03:50:00 pm,0,2025-06-02 15:50:00,9.1362,5.891,0.00030000000000001136
KEF-1,6/2/2025,04:00:00 pm,0,2025-06-02 16:00:00,9.1351,5.894,0.0
KEF-1,6/2/2025,04:10:00 pm,0,2025-06-02 16:10:00,9.1348,5.894,9.999999999994457e-05
KEF-1,6/2/2025,04:20:00 pm,0,2025-06-02 16:20:00,9.1345,5.895,0.0002000000000000668
KEF-1,6/2/2025,04:30:00 pm,0,2025-06-02 16:30:00,9.1335,5.897,9.999999999994457e-05
KEF-1,6/2/2025,04:40:00 pm,0,2025-06-02 16:40:00,9.133,5.898,0.00040000000000004474
KEF-1,6/2/2025,04:50:00 pm,0,2025-06-02 16:50:00,9.1334,5.902,0.0001000000000000334
KEF-1,6/2/2025,05:00:00 pm,0,2025-06-02 17:00:00,9.1328,5.901,0.00019999999999997797
KEF-1,6/2/2025,05:10:00 pm,0,2025-06-02 17:10:00,9.1325,5.903,0.0
KEF-1,6/2/2025,05:20:00 pm,0,2025-06-02 17:20:00,9.1321,5.903,0.0001000000000000334
KEF-1,6/2/2025,05:30:00 pm,0,2025-06-02 17:30:00,9.1316,5.904,0.0
KEF-1,6/2/2025,05:40:00 pm,0,2025-06-02 17:40:00,9.1321,5.904,0.00040000000000004474
KEF-1,6/2/2025,05:50:00 pm,0,2025-06-02 17:50:00,9.1313,5.908,9.999999999994457e-05
KEF-1,6/2/2025,06:00:00 pm,0,2025-06-02 18:00:00,9.1312,5.909,0.0
KEF-1,6/2/2025,06:10:00 pm,0,2025-06-02 18:10:00,9.1316,5.909,0.00019999999999997797
KEF-1,6/2/2025,06:20:00 pm,0,2025-06-02 18:20:00,9.1317,5.911,0.0001000000000000334
KEF-1,6/2/2025,06:30:00 pm,0,2025-06-02 18:30:00,9.132,5.912,0.0001000000000000334
KEF-1,6/2/2025,06:40:00 pm,0,2025-06-02 18:40:00,9.1327,5.913,9.999999999994457e-05
KEF-1,6/2/2025,06:50:00 pm,0,2025-06-02 18:50:00,9.1337,5.914,0.00030000000000001136
KEF-1,6/2/2025,07:00:00 pm,0,2025-06-02 19:00:00,9.1347,5.917,0.0001000000000000334
KEF-1,6/2/2025,07:10:00 pm,0,2025-06-02 19:10:00,9.1349,5.918,0.0
KEF-1,6/2/2025,07:20:00 pm,0,2025-06-02 19:20:00,9.1354,5.918,9.999999999994457e-05
KEF-1,6/2/2025,07:30:00 pm,0,2025-06-02 19:30:00,9.1363,5.919,0.0002000000000000668
KEF-1,6/2/2025,07:40:00 pm,0,2025-06-02 19:40:00,9.1372,5.921,0.00019999999999997797
KEF-1,6/2/2025,07:50:00 pm,0,2025-06-02 19:50:00,9.138,5.923,0.0
KEF-1,6/2/2025,08:00:00 pm,0,2025-06-02 20:00:00,9.1386,5.923,0.0
KEF-1,6/2/2025,08:10:00 pm,0,2025-06-02 20:10:00,9.1393,5.923,0.00019999999999997797
KEF-1,6/2/2025,08:20:00 pm,0,2025-06-02 20:20:00,9.1403,5.925,0.0
KEF-1,6/2/2025,08:30:00 pm,0,2025-06-02 20:30:00,9.1412,5.925,0.00019999999999997797
KEF-1,6/2/2025,08:40:00 pm,0,2025-06-02 20:40:00,9.1425,5.927,0.0001000000000000334
KEF-1,6/2/2025,08:50:00 pm,0,2025-06-02 20:50:00,9.1433,5.928,0.00019999999999997797
KEF-1,6/2/2025,09:00:00 pm,0,2025-06-02 21:00:00,9.1443,5.93,0.0001000000000000334
KEF-1,6/2/2025,09:10:00 pm,0,2025-06-02 21:10:00,9.1461,5.931,0.0
KEF-1,6/2/2025,09:20:00 pm,0,2025-06-02 21:20:00,9.1482,5.931,0.00019999999999997797
KEF-1,6/2/2025,09:30:00 pm,0,2025-06-02 21:30:00,9.1499,5.933,0.0
KEF-1,6/2/2025,09:40:00 pm,0,2025-06-02 21:40:00,9.1516,5.933,0.00019999999999997797
KEF-1,6/2/2025,09:50:00 pm,0,2025-06-02 21:50:00,9.1533,5.935,0.0002000000000000668
KEF-1,6/2/2025,10:00:00 pm,0,2025-06-02 22:00:00,9.1544,5.937,9.999999999994457e-05
KEF-1,6/2/2025,10:10:00 pm,0,2025-06-02 22:10:00,9.1559,5.938,0.0002000000000000668
KEF-1,6/2/2025,10:20:00 pm,0,2025-06-02 22:20:00,9.1572,5.94,0.0
KEF-1,6/2/2025,10:30:00 pm,0,2025-06-02 22:30:00,9.1589,5.94,0.00019999999999997797
KEF-1,6/2/2025,10:40:00 pm,0,2025-06-02 22:40:00,9.1593,5.942,9.999999999994457e-05
KEF-1,6/2/2025,10:50:00 pm,0,2025-06-02 22:50:00,9.1609,5.943,0.0001000000000000334
KEF-1,6/2/2025,11:00:00 pm,0,2025-06-02 23:00:00,9.1616,5.944,0.0001000000000000334
KEF-1,6/2/2025,11:10:00 pm,0,2025-06-02 23:10:00,9.1625,5.945,0.00019999999999997797
KEF-1,6/2/2025,11:20:00 pm,0,2025-06-02 23:20:00,9.1627,5.947,0.0001000000000000334
KEF-1,6/2/2025,11:30:00 pm,0,2025-06-02 23:30:00,9.1626,5.948,0.00019999999999997797
KEF-1,6/2/2025,11:40:00 pm,0,2025-06-02 23:40:00,9.1627,5.95,0.0001000000000000334
KEF-1,6/2/2025,11:50:00 pm,0,2025-06-02 23:50:00,9.1629,5.949,0.00019999999999997797
KEF-1,6/3/2025,12:00:00 am,0,2025-06-03 00:00:00,9.1634,5.951,0.0
KEF-1,6/3/2025,12:10:00 am,0,2025-06-03 00:10:00,9.1642,5.951,0.0002000000000000668
KEF-1,6/3/2025,12:20:00 am,0,2025-06-03 00:20:00,9.1648,5.953,0.00030000000000001136
KEF-1,6/3/2025,12:30:00 am,0,2025-06-03 00:30:00,9.165,5.956,0.0
KEF-1,6/3/2025,12:40:00 am,0,2025-06-03 00:40:00,9.165,5.956,0.00019999999999997797
KEF-1,6/3/2025,12:50:00 am,0,2025-06-03 00:50:00,9.1645,5.958,9.999999999994457e-05
KEF-1,6/3/2025,01:00:00 am,0,2025-06-03 01:00:00,9.1642,5.959,0.0
KEF-1,6/3/2025,01:10:00 am,0,2025-06-03 01:10:00,9.1638,5.959,0.0002000000000000668
KEF-1,6/3/2025,01:20:00 am,0,2025-06-03 01:20:00,9.1642,5.961,9.999999999994457e-05
KEF-1,6/3/2025,01:30:00 am,0,2025-06-03 01:30:00,9.1644,5.962,0.0
KEF-1,6/3/2025,01:40:00 am,0,2025-06-03 01:40:00,9.1643,5.962,0.00030000000000001136
KEF-1,6/3/2025,01:50:00 am,0,2025-06-03 01:50:00,9.1639,5.965,0.00019999999999997797
KEF-1,6/3/2025,02:00:00 am,0,2025-06-03 02:00:00,9.1636,5.967,0.0001000000000000334
KEF-1,6/3/2025,02:10:00 am,0,2025-06-03 02:10:00,9.164,5.968,0.0001000000000000334
KEF-1,6/3/2025,02:20:00 am,0,2025-06-03 02:20:00,9.1639,5.969,0.0
KEF-1,6/3/2025,02:30:00 am,0,2025-06-03 02:30:00,9.1648,5.969,0.0001000000000000334
KEF-1,6/3/2025,02:40:00 am,0,2025-06-03 02:40:00,9.1648,5.968,0.0004999999999999894
KEF-1,6/3/2025,02:50:00 am,0,2025-06-03 02:50:00,9.165,5.973,0.0
KEF-1,6/3/2025,03:00:00 am,0,2025-06-03 03:00:00,9.1655,5.973,0.0
KEF-1,6/3/2025,03:10:00 am,0,2025-06-03 03:10:00,9.1656,5.973,0.00019999999999997797
KEF-1,6/3/2025,03:20:00 am,0,2025-06-03 03:20:00,9.1649,5.975,0.0002000000000000668
KEF-1,6/3/2025,03:30:00 am,0,2025-06-03 03:30:00,9.1657,5.977,0.0
KEF-1,6/3/2025,03:40:00 am,0,2025-06-03 03:40:00,9.1657,5.977,9.999999999994457e-05
KEF-1,6/3/2025,03:50:00 am,0,2025-06-03 03:50:00,9.1651,5.978,0.0001000000000000334
KEF-1,6/3/2025,04:00:00 am,0,2025-06-03 04:00:00,9.1652,5.979,0.00019999999999997797
KEF-1,6/3/2025,04:10:00 am,0,2025-06-03 04:10:00,9.1654,5.981,0.0
KEF-1,6/3/2025,04:20:00 am,0,2025-06-03 04:20:00,9.1657,5.981,0.00019999999999997797
KEF-1,6/3/2025,04:30:00 am,0,2025-06-03 04:30:00,9.1664,5.983,0.0001000000000000334
KEF-1,6/3/2025,04:40:00 am,0,2025-06-03 04:40:00,9.1667,5.984,0.0
KEF-1,6/3/2025,04:50:00 am,0,2025-06-03 04:50:00,9.1667,5.984,0.00040000000000004474
KEF-1,6/3/2025,05:00:00 am,0,2025-06-03 05:00:00,9.1666,5.988,0.0001000000000000334
KEF-1,6/3/2025,05:10:00 am,0,2025-06-03 05:10:00,9.1669,5.987,0.00019999999999997797
KEF-1,6/3/2025,05:20:00 am,0,2025-06-03 05:20:00,9.1672,5.989,0.00019999999999997797
KEF-1,6/3/2025,05:30:00 am,0,2025-06-03 05:30:00,9.167,5.991,0.0002000000000000668
KEF-1,6/3/2025,05:40:00 am,0,2025-06-03 05:40:00,9.1674,5.993,9.999999999994457e-05
KEF-1,6/3/2025,05:50:00 am,0,2025-06-03 05:50:00,9.1673,5.994,9.999999999994457e-05
KEF-1,6/3/2025,06:00:00 am,0,2025-06-03 06:00:00,9.1671,5.993,9.999999999994457e-05
KEF-1,6/3/2025,06:10:00 am,0,2025-06-03 06:10:00,9.1678,5.994,0.0002000000000000668
KEF-1,6/3/2025,06:20:00 am,0,2025-06-03 06:20:00,9.1687,5.996,9.999999999994457e-05
KEF-1,6/3/2025,06:30:00 am,0,2025-06-03 06:30:00,9.1693,5.997,0.00040000000000004474
KEF-1,6/3/2025,06:40:00 am,0,2025-06-03 06:40:00,9.1686,6.001,0.00030000000000001136
KEF-1,6/3/2025,06:50:00 am,0,2025-06-03 06:50:00,9.1691,5.998,0.00030000000000001136
KEF-1,6/3/2025,07:00:00 am,0,2025-06-03 07:00:00,9.1688,6.001,9.999999999994457e-05
KEF-1,6/3/2025,07:10:00 am,0,2025-06-03 07:10:00,9.1691,6.002,0.0001000000000000334
KEF-1,6/3/2025,07:20:00 am,0,2025-06-03 07:20:00,9.1693,6.003,9.999999999994457e-05
KEF-1,6/3/2025,07:30:00 am,0,2025-06-03 07:30:00,9.1689,6.004,0.00030000000000001136
KEF-1,6/3/2025,07:40:00 am,0,2025-06-03 07:40:00,9.1693,6.007,0.0
KEF-1,6/3/2025,07:50:00 am,0,2025-06-03 07:50:00,9.1691,6.007,0.0
KEF-1,6/3/2025,08:00:00 am,0,2025-06-03 08:00:00,9.1689,6.007,0.0002000000000000668
KEF-1,6/3/2025,08:10:00 am,0,2025-06-03 08:10:00,9.1692,6.009,9.999999999994457e-05
KEF-1,6/3/2025,08:20:00 am,0,2025-06-03 08:20:00,9.1694,6.01,0.00019999999999997797
KEF-1,6/3/2025,08:30:00 am,0,2025-06-03 08:30:00,9.1695,6.012,0.0
KEF-1,6/3/2025,08:40:00 am,0,2025-06-03 08:40:00,9.1695,6.012,0.00030000000000001136
KEF-1,6/3/2025,08:50:00 am,0,2025-06-03 08:50:00,9.1694,6.015,9.999999999994457e-05
KEF-1,6/3/2025,09:00:00 am,0,2025-06-03 09:00:00,9.1699,6.014,0.00030000000000001136
KEF-1,6/3/2025,09:10:00 am,0,2025-06-03 09:10:00,9.1702,6.017,0.0
KEF-1,6/3/2025,09:20:00 am,0,2025-06-03 09:20:00,9.1702,6.017,0.0001000000000000334
KEF-1,6/3/2025,09:30:00 am,0,2025-06-03 09:30:00,9.1697,6.016,0.00019999999999997797
KEF-1,6/3/2025,09:40:00 am,0,2025-06-03 09:40:00,9.1698,6.018,0.00030000000000001136
KEF-1,6/3/2025,09:50:00 am,0,2025-06-03 09:50:00,9.1705,6.021,0.0001000000000000334
KEF-1,6/3/2025,10:00:00 am,0,2025-06-03 10:00:00,9.1698,6.022,0.0001000000000000334
KEF-1,6/3/2025,10:10:00 am,0,2025-06-03 10:10:00,9.1684,6.021,0.00030000000000001136
KEF-1,6/3/2025,10:20:00 am,0,2025-06-03 10:20:00,9.1665,6.024,0.0001000000000000334
KEF-1,6/3/2025,10:30:00 am,0,2025-06-03 10:30:00,9.1658,6.025,9.999999999994457e-05
KEF-1,6/3/2025,10:40:00 am,0,2025-06-03 10:40:00,9.1642,6.026,0.0001000000000000334
KEF-1,6/3/2025,10:50:00 am,0,2025-06-03 10:50:00,9.1627,6.027,0.00030000000000001136
KEF-1,6/3/2025,11:00:00 am,0,2025-06-03 11:00:00,9.1607,6.03,0.0
KEF-1,6/3/2025,11:10:00 am,0,2025-06-03 11:10:00,9.1592,6.03,0.0
KEF-1,6/3/2025,11:20:00 am,0,2025-06-03 11:20:00,9.1578,6.03,0.00039999999999995595
KEF-1,6/3/2025,11:30:00 am,0,2025-06-03 11:30:00,9.1557,6.034,9.999999999994457e-05
KEF-1,6/3/2025,11:40:00 am,0,2025-06-03 11:40:00,9.1542,6.033,9.999999999994457e-05
KEF-1,6/3/2025,11:50:00 am,0,2025-06-03 11:50:00,9.1533,6.034,9.999999999994457e-05
KEF-1,6/3/2025,12:00:00 pm,0,2025-06-03 12:00:00,9.1523,6.033,0.00039999999999995595
KEF-1,6/3/2025,12:10:00 pm,0,2025-06-03 12:10:00,9.1513,6.037,0.0001000000000000334
KEF-1,6/3/2025,12:20:00 pm,0,2025-06-03 12:20:00,9.1491,6.036,0.0005000000000000782
KEF-1,6/3/2025,12:30:00 pm,0,2025-06-03 12:30:00,9.1478,6.041,0.0
KEF-1,6/3/2025,12:40:00 pm,0,2025-06-03 12:40:00,9.1458,6.041,0.0001000000000000334
KEF-1,6/3/2025,12:50:00 pm,0,2025-06-03 12:50:00,9.1439,6.04,0.00030000000000001136
KEF-1,6/3/2025,01:00:00 pm,0,2025-06-03 13:00:00,9.1433,6.043,0.00019999999999997797
KEF-1,6/3/2025,01:10:00 pm,0,2025-06-03 13:10:00,9.1423,6.045,0.0001000000000000334
KEF-1,6/3/2025,01:20:00 pm,0,2025-06-03 13:20:00,9.1396,6.046,9.999999999994457e-05
KEF-1,6/3/2025,01:30:00 pm,0,2025-06-03 13:30:00,9.1394,6.047,0.0001000000000000334
KEF-1,6/3/2025,01:40:00 pm,0,2025-06-03 13:40:00,9.1381,6.048,0.0001000000000000334
KEF-1,6/3/2025,01:50:00 pm,0,2025-06-03 13:50:00,9.1366,6.047,0.0002000000000000668
KEF-1,6/3/2025,02:00:00 pm,0,2025-06-03 14:00:00,9.1347,6.049,9.999999999994457e-05
KEF-1,6/3/2025,02:10:00 pm,0,2025-06-03 14:10:00,9.1338,6.05,0.0001000000000000334
KEF-1,6/3/2025,02:20:00 pm,0,2025-06-03 14:20:00,9.1328,6.051,9.999999999994457e-05
KEF-1,6/3/2025,02:30:00 pm,0,2025-06-03 14:30:00,9.1329,6.052,0.0
KEF-1,6/3/2025,02:40:00 pm,0,2025-06-03 14:40:00,9.1319,6.052,0.0002000000000000668
KEF-1,6/3/2025,02:50:00 pm,0,2025-06-03 14:50:00,9.1315,6.054,0.0001000000000000334
KEF-1,6/3/2025,03:00:00 pm,0,2025-06-03 15:00:00,9.1321,6.053,0.00030000000000001136
KEF-1,6/3/2025,03:10:00 pm,0,2025-06-03 15:10:00,9.1324,6.056,0.00030000000000001136
KEF-1,6/3/2025,03:20:00 pm,0,2025-06-03 15:20:00,9.1317,6.059,9.999999999994457e-05
KEF-1,6/3/2025,03:30:00 pm,0,2025-06-03 15:30:00,9.1329,6.06,0.0002000000000000668
KEF-1,6/3/2025,03:40:00 pm,0,2025-06-03 15:40:00,9.1314,6.062,0.0001000000000000334
KEF-1,6/3/2025,03:50:00 pm,0,2025-06-03 15:50:00,9.1304,6.061,0.00030000000000001136
KEF-1,6/3/2025,04:00:00 pm,0,2025-06-03 16:00:00,9.1301,6.064,0.0
KEF-1,6/3/2025,04:10:00 pm,0,2025-06-03 16:10:00,9.129,6.064,0.0
KEF-1,6/3/2025,04:20:00 pm,0,2025-06-03 16:20:00,9.1284,6.064,0.00019999999999997797
KEF-1,6/3/2025,04:30:00 pm,0,2025-06-03 16:30:00,9.1279,6.066,0.0001000000000000334
KEF-1,6/3/2025,04:40:00 pm,0,2025-06-03 16:40:00,9.128,6.067,0.0
KEF-1,6/3/2025,04:50:00 pm,0,2025-06-03 16:50:00,9.1271,6.067,9.999999999994457e-05
KEF-1,6/3/2025,05:00:00 pm,0,2025-06-03 17:00:00,9.1272,6.068,0.0002000000000000668
KEF-1,6/3/2025,05:10:00 pm,0,2025-06-03 17:10:00,9.1276,6.07,9.999999999994457e-05
KEF-1,6/3/2025,05:20:00 pm,0,2025-06-03 17:20:00,9.1269,6.071,0.0
KEF-1,6/3/2025,05:30:00 pm,0,2025-06-03 17:30:00,9.1259,6.071,0.00030000000000001136
KEF-1,6/3/2025,05:40:00 pm,0,2025-06-03 17:40:00,9.1255,6.074,0.0
KEF-1,6/3/2025,05:50:00 pm,0,2025-06-03 17:50:00,9.1255,6.074,0.0001000000000000334
KEF-1,6/3/2025,06:00:00 pm,0,2025-06-03 18:00:00,9.1245,6.075,0.0
KEF-1,6/3/2025,06:10:00 pm,0,2025-06-03 18:10:00,9.1243,6.075,0.00039999999999995595
KEF-1,6/3/2025,06:20:00 pm,0,2025-06-03 18:20:00,9.124,6.079,0.0001000000000000334
KEF-1,6/3/2025,06:30:00 pm,0,2025-06-03 18:30:00,9.1238,6.08,0.0
KEF-1,6/3/2025,06:40:00 pm,0,2025-06-03 18:40:00,9.124,6.08,0.0001000000000000334
KEF-1,6/3/2025,06:50:00 pm,0,2025-06-03 18:50:00,9.1241,6.081,0.00029999999999992256
KEF-1,6/3/2025,07:00:00 pm,0,2025-06-03 19:00:00,9.1246,6.084,0.0
KEF-1,6/3/2025,07:10:00 pm,0,2025-06-03 19:10:00,9.1244,6.084,0.0
KEF-1,6/3/2025,07:20:00 pm,0,2025-06-03 19:20:00,9.1249,6.084,0.0001000000000000334
KEF-1,6/3/2025,07:30:00 pm,0,2025-06-03 19:30:00,9.1261,6.085,0.00019999999999997797
KEF-1,6/3/2025,07:40:00 pm,0,2025-06-03 19:40:00,9.1273,6.087,0.00030000000000001136
KEF-1,6/3/2025,07:50:00 pm,0,2025-06-03 19:50:00,9.1278,6.09,9.999999999994457e-05
KEF-1,6/3/2025,08:00:00 pm,0,2025-06-03 20:00:00,9.128,6.089,9.999999999994457e-05
KEF-1,6/3/2025,08:10:00 pm,0,2025-06-03 20:10:00,9.1296,6.09,0.0001000000000000334
KEF-1,6/3/2025,08:20:00 pm,0,2025-06-03 20:20:00,9.1301,6.091,9.999999999994457e-05
KEF-1,6/3/2025,08:30:00 pm,0,2025-06-03 20:30:00,9.1305,6.092,0.0001000000000000334
KEF-1,6/3/2025,08:40:00 pm,0,2025-06-03 20:40:00,9.1314,6.093,0.0001000000000000334
KEF-1,6/3/2025,08:50:00 pm,0,2025-06-03 20:50:00,9.1317,6.094,0.00019999999999997797
KEF-1,6/3/2025,09:00:00 pm,0,2025-06-03 21:00:00,9.1322,6.096,0.0001000000000000334
KEF-1,6/3/2025,09:10:00 pm,0,2025-06-03 21:10:00,9.1335,6.097,0.0
KEF-1,6/3/2025,09:20:00 pm,0,2025-06-03 21:20:00,9.1351,6.097,9.999999999994457e-05
KEF-1,6/3/2025,09:30:00 pm,0,2025-06-03 21:30:00,9.1375,6.098,0.0
KEF-1,6/3/2025,09:40:00 pm,0,2025-06-03 21:40:00,9.1391,6.098,0.00030000000000001136
KEF-1,6/3/2025,09:50:00 pm,0,2025-06-03 21:50:00,9.1405,6.101,0.0
KEF-1,6/3/2025,10:00:00 pm,0,2025-06-03 22:00:00,9.1418,6.101,0.0001000000000000334
KEF-1,6/3/2025,10:10:00 pm,0,2025-06-03 22:10:00,9.1434,6.102,9.999999999994457e-05
KEF-1,6/3/2025,10:20:00 pm,0,2025-06-03 22:20:00,9.1439,6.103,0.00030000000000001136
KEF-1,6/3/2025,10:30:00 pm,0,2025-06-03 22:30:00,9.1442,6.106,0.0
KEF-1,6/3/2025,10:40:00 pm,0,2025-06-03 22:40:00,9.1448,6.106,0.00019999999999997797
KEF-1,6/3/2025,10:50:00 pm,0,2025-06-03 22:50:00,9.1447,6.108,0.0002000000000000668
KEF-1,6/3/2025,11:00:00 pm,0,2025-06-03 23:00:00,9.1446,6.11,0.0002000000000000668
KEF-1,6/3/2025,11:10:00 pm,0,2025-06-03 23:10:00,9.1451,6.108,0.00030000000000001136
KEF-1,6/3/2025,11:20:00 pm,0,2025-06-03 23:20:00,9.1459,6.111,0.0001000000000000334
KEF-1,6/3/2025,11:30:00 pm,0,2025-06-03 23:30:00,9.1465,6.112,0.0001000000000000334
KEF-1,6/3/2025,11:40:00 pm,0,2025-06-03 23:40:00,9.1474,6.113,9.999999999994457e-05
KEF-1,6/3/2025,11:50:00 pm,0,2025-06-03 23:50:00,9.1484,6.114,0.0001000000000000334
KEF-1,6/4/2025,12:00:00 am,0,2025-06-04 00:00:00,9.1488,6.115,0.0
KEF-1,6/4/2025,12:10:00 am,0,2025-06-04 00:10:00,9.1486,6.115,9.999999999994457e-05
KEF-1,6/4/2025,12:20:00 am,0,2025-06-04 00:20:00,9.1484,6.116,0.0002000000000000668
KEF-1,6/4/2025,12:30:00 am,0,2025-06-04 00:30:00,9.1481,6.118,0.00030000000000001136
KEF-1,6/4/2025,12:40:00 am,0,2025-06-04 00:40:00,9.1487,6.121,9.999999999994457e-05
KEF-1,6/4/2025,12:50:00 am,0,2025-06-04 00:50:00,9.1479,6.122,9.999999999994457e-05
KEF-1,6/4/2025,01:00:00 am,0,2025-06-04 01:00:00,9.1487,6.121,9.999999999994457e-05
KEF-1,6/4/2025,01:10:00 am,0,2025-06-04 01:10:00,9.1493,6.122,0.00019999999999997797
KEF-1,6/4/2025,01:20:00 am,0,2025-06-04 01:20:00,9.1494,6.124,0.0001000000000000334
KEF-1,6/4/2025,01:30:00 am,0,2025-06-04 01:30:00,9.1488,6.125,0.0
KEF-1,6/4/2025,01:40:00 am,0,2025-06-04 01:40:00,9.1492,6.125,0.00019999999999997797
KEF-1,6/4/2025,01:50:00 am,0,2025-06-04 01:50:00,9.1491,6.127,0.00019999999999997797
KEF-1,6/4/2025,02:00:00 am,0,2025-06-04 02:00:00,9.149,6.129,0.0001000000000000334
KEF-1,6/4/2025,02:10:00 am,0,2025-06-04 02:10:00,9.1493,6.13,0.0001000000000000334
KEF-1,6/4/2025,02:20:00 am,0,2025-06-04 02:20:00,9.15,6.131,0.0
KEF-1,6/4/2025,02:30:00 am,0,2025-06-04 02:30:00,9.1504,6.131,0.0
KEF-1,6/4/2025,02:40:00 am,0,2025-06-04 02:40:00,9.1504,6.131,0.00030000000000001136
KEF-1,6/4/2025,02:50:00 am,0,2025-06-04 02:50:00,9.1504,6.134,0.0
KEF-1,6/4/2025,03:00:00 am,0,2025-06-04 03:00:00,9.1506,6.134,0.00019999999999997797
KEF-1,6/4/2025,03:10:00 am,0,2025-06-04 03:10:00,9.1504,6.136,9.999999999994457e-05
KEF-1,6/4/2025,03:20:00 am,0,2025-06-04 03:20:00,9.1504,6.137,0.0001000000000000334
KEF-1,6/4/2025,03:30:00 am,0,2025-06-04 03:30:00,9.1507,6.138,0.0001000000000000334
KEF-1,6/4/2025,03:40:00 am,0,2025-06-04 03:40:00,9.1506,6.137,0.0002000000000000668
KEF-1,6/4/2025,03:50:00 am,0,2025-06-04 03:50:00,9.1516,6.139,9.999999999994457e-05
KEF-1,6/4/2025,04:00:00 am,0,2025-06-04 04:00:00,9.1507,6.14,0.0002000000000000668
KEF-1,6/4/2025,04:10:00 am,0,2025-06-04 04:10:00,9.1513,6.142,0.0
KEF-1,6/4/2025,04:20:00 am,0,2025-06-04 04:20:00,9.1507,6.142,9.999999999994457e-05
KEF-1,6/4/2025,04:30:00 am,0,2025-06-04 04:30:00,9.1508,6.143,0.00030000000000001136
KEF-1,6/4/2025,04:40:00 am,0,2025-06-04 04:40:00,9.1509,6.146,0.0
KEF-1,6/4/2025,04:50:00 am,0,2025-06-04 04:50:00,9.1507,6.146,0.0
KEF-1,6/4/2025,05:00:00 am,0,2025-06-04 05:00:00,9.15,6.146,0.0001000000000000334
KEF-1,6/4/2025,05:10:00 am,0,2025-06-04 05:10:00,9.1497,6.147,0.00019999999999997797
KEF-1,6/4/2025,05:20:00 am,0,2025-06-04 05:20:00,9.1496,6.149,0.0001000000000000334
KEF-1,6/4/2025,05:30:00 am,0,2025-06-04 05:30:00,9.1502,6.15,0.00029999999999992256
KEF-1,6/4/2025,05:40:00 am,0,2025-06-04 05:40:00,9.1506,6.153,0.0
KEF-1,6/4/2025,05:50:00 am,0,2025-06-04 05:50:00,9.1508,6.153,0.0
KEF-1,6/4/2025,06:00:00 am,0,2025-06-04 06:00:00,9.1512,6.153,0.0002000000000000668
KEF-1,6/4/2025,06:10:00 am,0,2025-06-04 06:10:00,9.152,6.155,0.0
KEF-1,6/4/2025,06:20:00 am,0,2025-06-04 06:20:00,9.1523,6.155,0.00019999999999997797
KEF-1,6/4/2025,06:30:00 am,0,2025-06-04 06:30:00,9.153,6.157,0.0001000000000000334
KEF-1,6/4/2025,06:40:00 am,0,2025-06-04 06:40:00,9.153,6.158,9.999999999994457e-05
KEF-1,6/4/2025,06:50:00 am,0,2025-06-04 06:50:00,9.1527,6.159,0.0001000000000000334
KEF-1,6/4/2025,07:00:00 am,0,2025-06-04 07:00:00,9.1525,6.16,9.999999999994457e-05
KEF-1,6/4/2025,07:10:00 am,0,2025-06-04 07:10:00,9.1522,6.161,0.0
KEF-1,6/4/2025,07:20:00 am,0,2025-06-04 07:20:00,9.1521,6.161,0.00030000000000001136
KEF-1,6/4/2025,07:30:00 am,0,2025-06-04 07:30:00,9.1524,6.164,9.999999999994457e-05
KEF-1,6/4/2025,07:40:00 am,0,2025-06-04 07:40:00,9.1517,6.163,0.00030000000000001136
KEF-1,6/4/2025,07:50:00 am,0,2025-06-04 07:50:00,9.1513,6.166,0.0
KEF-1,6/4/2025,08:00:00 am,0,2025-06-04 08:00:00,9.151,6.166,9.999999999994457e-05
KEF-1,6/4/2025,08:10:00 am,0,2025-06-04 08:10:00,9.1513,6.167,0.00040000000000004474
KEF-1,6/4/2025,08:20:00 am,0,2025-06-04 08:20:00,9.1511,6.171,0.0002000000000000668
KEF-1,6/4/2025,08:30:00 am,0,2025-06-04 08:30:00,9.1519,6.169,0.0
KEF-1,6/4/2025,08:40:00 am,0,2025-06-04 08:40:00,9.1516,6.169,0.00030000000000001136
KEF-1,6/4/2025,08:50:00 am,0,2025-06-04 08:50:00,9.1514,6.172,0.0
KEF-1,6/4/2025,09:00:00 am,0,2025-06-04 09:00:00,9.152,6.172,0.0
KEF-1,6/4/2025,09:10:00 am,0,2025-06-04 09:10:00,9.1521,6.172,0.00030000000000001136
KEF-1,6/4/2025,09:20:00 am,0,2025-06-04 09:20:00,9.1506,6.175,0.0001000000000000334
