well_id,Date,Time,ms,DT,raw_Level_m,TEMPERATURE,Rate of Change
EWT-2,6/24/2025,03:40:00 pm,0,2025-06-24 15:40:00,8.5105,10.405,0.0818999999999999
EWT-2,6/24/2025,03:50:00 pm,0,2025-06-24 15:50:00,8.5195,9.586,0.031400000000000004
EWT-2,6/24/2025,04:00:00 pm,0,2025-06-24 16:00:00,8.519,9.272,0.01639999999999997
EWT-2,6/24/2025,04:10:00 pm,0,2025-06-24 16:10:00,8.5159,9.108,0.010100000000000086
EWT-2,6/24/2025,04:20:00 pm,0,2025-06-24 16:20:00,8.5104,9.007,0.006700000000000017
EWT-2,6/24/2025,04:30:00 pm,0,2025-06-24 16:30:00,8.5043,8.94,0.004399999999999871
EWT-2,6/24/2025,04:40:00 pm,0,2025-06-24 16:40:00,8.4995,8.896,0.0030000000000001137
EWT-2,6/24/2025,04:50:00 pm,0,2025-06-24 16:50:00,8.4953,8.866,0.0022999999999999687
EWT-2,6/24/2025,05:00:00 pm,0,2025-06-24 17:00:00,8.4917,8.843,0.0016000000000000014
EWT-2,6/24/2025,05:10:00 pm,0,2025-06-24 17:10:00,8.4891,8.827,0.0013999999999999347
EWT-2,6/24/2025,05:20:00 pm,0,2025-06-24 17:20:00,8.4883,8.813,0.001100000000000101
EWT-2,6/24/2025,05:30:00 pm,0,2025-06-24 17:30:00,8.4865,8.802,0.0009000000000000341
EWT-2,6/24/2025,05:40:00 pm,0,2025-06-24 17:40:00,8.4849,8.793,0.0005999999999998451
EWT-2,6/24/2025,05:50:00 pm,0,2025-06-24 17:50:00,8.4835,8.787,0.0006000000000000227
EWT-2,6/24/2025,06:00:00 pm,0,2025-06-24 18:00:00,8.4823,8.781,0.0006000000000000227
EWT-2,6/24/2025,06:10:00 pm,0,2025-06-24 18:10:00,8.4817,8.775,0.00030000000000001136
EWT-2,6/24/2025,06:20:00 pm,0,2025-06-24 18:20:00,8.4812,8.772,0.0006999999999999674
EWT-2,6/24/2025,06:30:00 pm,0,2025-06-24 18:30:00,8.481,8.765,0.00010000000000012221
EWT-2,6/24/2025,06:40:00 pm,0,2025-06-24 18:40:00,8.4809,8.764,0.00019999999999988915
EWT-2,6/24/2025,06:50:00 pm,0,2025-06-24 18:50:00,8.4808,8.762,0.0004000000000001336
EWT-2,6/24/2025,07:00:00 pm,0,2025-06-24 19:00:00,8.4806,8.758,0.0002999999999998337
EWT-2,6/24/2025,07:10:00 pm,0,2025-06-24 19:10:00,8.481,8.755,0.00010000000000012221
EWT-2,6/24/2025,07:20:00 pm,0,2025-06-24 19:20:00,8.4811,8.754,0.00019999999999988915
EWT-2,6/24/2025,07:30:00 pm,0,2025-06-24 19:30:00,8.4816,8.752,0.0002000000000000668
EWT-2,6/24/2025,07:40:00 pm,0,2025-06-24 19:40:00,8.4827,8.75,0.0
EWT-2,6/24/2025,07:50:00 pm,0,2025-06-24 19:50:00,8.4846,8.75,0.0002000000000000668
EWT-2,6/24/2025,08:00:00 pm,0,2025-06-24 20:00:00,8.4862,8.748,0.00030000000000001136
EWT-2,6/24/2025,08:10:00 pm,0,2025-06-24 20:10:00,8.487,8.745,9.999999999994457e-05
EWT-2,6/24/2025,08:20:00 pm,0,2025-06-24 20:20:00,8.4875,8.744,0.0
EWT-2,6/24/2025,08:30:00 pm,0,2025-06-24 20:30:00,8.4881,8.744,9.999999999994457e-05
EWT-2,6/24/2025,08:40:00 pm,0,2025-06-24 20:40:00,8.4888,8.743,9.999999999994457e-05
EWT-2,6/24/2025,08:50:00 pm,0,2025-06-24 20:50:00,8.4895,8.742,9.999999999994457e-05
EWT-2,6/24/2025,09:00:00 pm,0,2025-06-24 21:00:00,8.4906,8.743,0.00030000000000001136
EWT-2,6/24/2025,09:10:00 pm,0,2025-06-24 21:10:00,8.4917,8.74,9.999999999994457e-05
EWT-2,6/24/2025,09:20:00 pm,0,2025-06-24 21:20:00,8.4932,8.739,0.00010000000000012221
EWT-2,6/24/2025,09:30:00 pm,0,2025-06-24 21:30:00,8.4947,8.738,0.00010000000000012221
EWT-2,6/24/2025,09:40:00 pm,0,2025-06-24 21:40:00,8.4964,8.739,0.00030000000000001136
EWT-2,6/24/2025,09:50:00 pm,0,2025-06-24 21:50:00,8.4982,8.736,0.00019999999999988915
EWT-2,6/24/2025,10:00:00 pm,0,2025-06-24 22:00:00,8.5,8.738,0.0
EWT-2,6/24/2025,10:10:00 pm,0,2025-06-24 22:10:00,8.502,8.738,9.999999999994457e-05
EWT-2,6/24/2025,10:20:00 pm,0,2025-06-24 22:20:00,8.5038,8.737,9.999999999994457e-05
EWT-2,6/24/2025,10:30:00 pm,0,2025-06-24 22:30:00,8.5056,8.736,0.00010000000000012221
EWT-2,6/24/2025,10:40:00 pm,0,2025-06-24 22:40:00,8.507,8.735,0.00019999999999988915
EWT-2,6/24/2025,10:50:00 pm,0,2025-06-24 22:50:00,8.5086,8.733,0.0
EWT-2,6/24/2025,11:00:00 pm,0,2025-06-24 23:00:00,8.5104,8.733,0.00010000000000012221
EWT-2,6/24/2025,11:10:00 pm,0,2025-06-24 23:10:00,8.5121,8.732,0.00010000000000012221
EWT-2,6/24/2025,11:20:00 pm,0,2025-06-24 23:20:00,8.5141,8.733,0.0002000000000000668
EWT-2,6/24/2025,11:30:00 pm,0,2025-06-24 23:30:00,8.5158,8.731,0.0
EWT-2,6/24/2025,11:40:00 pm,0,2025-06-24 23:40:00,8.5174,8.731,0.0
EWT-2,6/24/2025,11:50:00 pm,0,2025-06-24 23:50:00,8.519,8.731,9.999999999994457e-05
EWT-2,6/25/2025,12:00:00 am,0,2025-06-25 00:00:00,8.5206,8.73,0.0
EWT-2,6/25/2025,12:10:00 am,0,2025-06-25 00:10:00,8.5216,8.73,0.00019999999999988915
EWT-2,6/25/2025,12:20:00 am,0,2025-06-25 00:20:00,8.5216,8.732,0.00039999999999995595
EWT-2,6/25/2025,12:30:00 am,0,2025-06-25 00:30:00,8.5215,8.728,0.0002000000000000668
EWT-2,6/25/2025,12:40:00 am,0,2025-06-25 00:40:00,8.522,8.73,9.999999999994457e-05
EWT-2,6/25/2025,12:50:00 am,0,2025-06-25 00:50:00,8.5224,8.731,0.0002000000000000668
EWT-2,6/25/2025,01:00:00 am,0,2025-06-25 01:00:00,8.5229,8.729,0.00010000000000012221
EWT-2,6/25/2025,01:10:00 am,0,2025-06-25 01:10:00,8.5243,8.73,0.00030000000000001136
EWT-2,6/25/2025,01:20:00 am,0,2025-06-25 01:20:00,8.5262,8.727,0.00019999999999988915
EWT-2,6/25/2025,01:30:00 am,0,2025-06-25 01:30:00,8.5265,8.729,0.0
EWT-2,6/25/2025,01:40:00 am,0,2025-06-25 01:40:00,8.5268,8.729,0.0
EWT-2,6/25/2025,01:50:00 am,0,2025-06-25 01:50:00,8.527,8.729,9.999999999994457e-05
EWT-2,6/25/2025,02:00:00 am,0,2025-06-25 02:00:00,8.5271,8.728,0.00019999999999988915
EWT-2,6/25/2025,02:10:00 am,0,2025-06-25 02:10:00,8.5278,8.726,9.999999999994457e-05
EWT-2,6/25/2025,02:20:00 am,0,2025-06-25 02:20:00,8.5283,8.727,0.0
EWT-2,6/25/2025,02:30:00 am,0,2025-06-25 02:30:00,8.5291,8.727,0.0
EWT-2,6/25/2025,02:40:00 am,0,2025-06-25 02:40:00,8.5299,8.727,0.0
EWT-2,6/25/2025,02:50:00 am,0,2025-06-25 02:50:00,8.5311,8.727,9.999999999994457e-05
EWT-2,6/25/2025,03:00:00 am,0,2025-06-25 03:00:00,8.532,8.726,0.00019999999999988915
EWT-2,6/25/2025,03:10:00 am,0,2025-06-25 03:10:00,8.5327,8.728,0.00019999999999988915
EWT-2,6/25/2025,03:20:00 am,0,2025-06-25 03:20:00,8.5329,8.726,0.0
EWT-2,6/25/2025,03:30:00 am,0,2025-06-25 03:30:00,8.5333,8.726,0.0
EWT-2,6/25/2025,03:40:00 am,0,2025-06-25 03:40:00,8.5344,8.726,0.00010000000000012221
EWT-2,6/25/2025,03:50:00 am,0,2025-06-25 03:50:00,8.5349,8.725,0.00010000000000012221
EWT-2,6/25/2025,04:00:00 am,0,2025-06-25 04:00:00,8.5355,8.726,0.0
EWT-2,6/25/2025,04:10:00 am,0,2025-06-25 04:10:00,8.5357,8.726,0.00010000000000012221
EWT-2,6/25/2025,04:20:00 am,0,2025-06-25 04:20:00,8.5369,8.725,9.999999999994457e-05
EWT-2,6/25/2025,04:30:00 am,0,2025-06-25 04:30:00,8.5381,8.724,0.0002000000000000668
EWT-2,6/25/2025,04:40:00 am,0,2025-06-25 04:40:00,8.5395,8.726,0.0
EWT-2,6/25/2025,04:50:00 am,0,2025-06-25 04:50:00,8.5407,8.726,0.0002000000000000668
EWT-2,6/25/2025,05:00:00 am,0,2025-06-25 05:00:00,8.5419,8.724,0.0002000000000000668
EWT-2,6/25/2025,05:10:00 am,0,2025-06-25 05:10:00,8.5434,8.722,0.0002000000000000668
EWT-2,6/25/2025,05:20:00 am,0,2025-06-25 05:20:00,8.545,8.724,9.999999999994457e-05
EWT-2,6/25/2025,05:30:00 am,0,2025-06-25 05:30:00,8.5465,8.723,0.00019999999999988915
EWT-2,6/25/2025,05:40:00 am,0,2025-06-25 05:40:00,8.5481,8.725,9.999999999994457e-05
EWT-2,6/25/2025,05:50:00 am,0,2025-06-25 05:50:00,8.5496,8.724,9.999999999994457e-05
EWT-2,6/25/2025,06:00:00 am,0,2025-06-25 06:00:00,8.5508,8.723,0.0
EWT-2,6/25/2025,06:10:00 am,0,2025-06-25 06:10:00,8.5522,8.723,0.00019999999999988915
EWT-2,6/25/2025,06:20:00 am,0,2025-06-25 06:20:00,8.5538,8.725,0.00019999999999988915
EWT-2,6/25/2025,06:30:00 am,0,2025-06-25 06:30:00,8.5554,8.723,0.0
EWT-2,6/25/2025,06:40:00 am,0,2025-06-25 06:40:00,8.5567,8.723,0.0
EWT-2,6/25/2025,06:50:00 am,0,2025-06-25 06:50:00,8.5578,8.723,9.999999999994457e-05
EWT-2,6/25/2025,07:00:00 am,0,2025-06-25 07:00:00,8.5587,8.724,0.0
EWT-2,6/25/2025,07:10:00 am,0,2025-06-25 07:10:00,8.5593,8.724,0.00030000000000001136
EWT-2,6/25/2025,07:20:00 am,0,2025-06-25 07:20:00,8.5603,8.721,0.0002000000000000668
EWT-2,6/25/2025,07:30:00 am,0,2025-06-25 07:30:00,8.5613,8.723,0.0002000000000000668
EWT-2,6/25/2025,07:40:00 am,0,2025-06-25 07:40:00,8.5629,8.721,9.999999999994457e-05
EWT-2,6/25/2025,07:50:00 am,0,2025-06-25 07:50:00,8.5641,8.722,0.0
EWT-2,6/25/2025,08:00:00 am,0,2025-06-25 08:00:00,8.5659,8.722,0.0
EWT-2,6/25/2025,08:10:00 am,0,2025-06-25 08:10:00,8.5681,8.722,0.00010000000000012221
EWT-2,6/25/2025,08:20:00 am,0,2025-06-25 08:20:00,8.5692,8.723,0.0
EWT-2,6/25/2025,08:30:00 am,0,2025-06-25 08:30:00,8.57,8.723,0.0002000000000000668
EWT-2,6/25/2025,08:40:00 am,0,2025-06-25 08:40:00,8.5706,8.721,0.0002000000000000668
EWT-2,6/25/2025,08:50:00 am,0,2025-06-25 08:50:00,8.5706,8.723,0.00010000000000012221
EWT-2,6/25/2025,09:00:00 am,0,2025-06-25 09:00:00,8.5704,8.722,0.00019999999999988915
EWT-2,6/25/2025,09:10:00 am,0,2025-06-25 09:10:00,8.5698,8.72,0.00030000000000001136
EWT-2,6/25/2025,09:20:00 am,0,2025-06-25 09:20:00,8.568,8.723,0.00030000000000001136
EWT-2,6/25/2025,09:30:00 am,0,2025-06-25 09:30:00,8.5663,8.72,9.999999999994457e-05
EWT-2,6/25/2025,09:40:00 am,0,2025-06-25 09:40:00,8.5642,8.721,9.999999999994457e-05
EWT-2,6/25/2025,09:50:00 am,0,2025-06-25 09:50:00,8.5615,8.72,9.999999999994457e-05
EWT-2,6/25/2025,10:00:00 am,0,2025-06-25 10:00:00,8.5586,8.721,9.999999999994457e-05
EWT-2,6/25/2025,10:10:00 am,0,2025-06-25 10:10:00,8.5549,8.722,9.999999999994457e-05
EWT-2,6/25/2025,10:20:00 am,0,2025-06-25 10:20:00,8.5512,8.721,0.0
EWT-2,6/25/2025,10:30:00 am,0,2025-06-25 10:30:00,8.547,8.721,0.0002000000000000668
EWT-2,6/25/2025,10:40:00 am,0,2025-06-25 10:40:00,8.5426,8.719,0.00010000000000012221
EWT-2,6/25/2025,10:50:00 am,0,2025-06-25 10:50:00,8.5382,8.72,0.0
EWT-2,6/25/2025,11:00:00 am,0,2025-06-25 11:00:00,8.5346,8.72,9.999999999994457e-05
EWT-2,6/25/2025,11:10:00 am,0,2025-06-25 11:10:00,8.5318,8.721,9.999999999994457e-05
EWT-2,6/25/2025,11:20:00 am,0,2025-06-25 11:20:00,8.5291,8.72,0.0
EWT-2,6/25/2025,11:30:00 am,0,2025-06-25 11:30:00,8.5261,8.72,0.0
EWT-2,6/25/2025,11:40:00 am,0,2025-06-25 11:40:00,8.525,8.72,0.0
EWT-2,6/25/2025,11:50:00 am,0,2025-06-25 11:50:00,8.5236,8.72,0.0
EWT-2,6/25/2025,12:00:00 pm,0,2025-06-25 12:00:00,8.5224,8.72,0.0
EWT-2,6/25/2025,12:10:00 pm,0,2025-06-25 12:10:00,8.5208,8.72,0.00010000000000012221
EWT-2,6/25/2025,12:20:00 pm,0,2025-06-25 12:20:00,8.5192,8.719,0.00010000000000012221
EWT-2,6/25/2025,12:30:00 pm,0,2025-06-25 12:30:00,8.5169,8.72,9.999999999994457e-05
EWT-2,6/25/2025,12:40:00 pm,0,2025-06-25 12:40:00,8.5144,8.721,0.00030000000000001136
EWT-2,6/25/2025,12:50:00 pm,0,2025-06-25 12:50:00,8.5115,8.718,0.0
EWT-2,6/25/2025,01:00:00 pm,0,2025-06-25 13:00:00,8.5087,8.718,9.999999999994457e-05
EWT-2,6/25/2025,01:10:00 pm,0,2025-06-25 13:10:00,8.5056,8.719,0.00010000000000012221
EWT-2,6/25/2025,01:20:00 pm,0,2025-06-25 13:20:00,8.5032,8.72,0.0002000000000000668
EWT-2,6/25/2025,01:30:00 pm,0,2025-06-25 13:30:00,8.5011,8.718,0.0
EWT-2,6/25/2025,01:40:00 pm,0,2025-06-25 13:40:00,8.4994,8.718,0.00030000000000001136
EWT-2,6/25/2025,01:50:00 pm,0,2025-06-25 13:50:00,8.4981,8.721,0.0002000000000000668
EWT-2,6/25/2025,02:00:00 pm,0,2025-06-25 14:00:00,8.4963,8.719,0.0
EWT-2,6/25/2025,02:10:00 pm,0,2025-06-25 14:10:00,8.4948,8.719,9.999999999994457e-05
EWT-2,6/25/2025,02:20:00 pm,0,2025-06-25 14:20:00,8.494,8.718,0.0
EWT-2,6/25/2025,02:30:00 pm,0,2025-06-25 14:30:00,8.4928,8.718,9.999999999994457e-05
EWT-2,6/25/2025,02:40:00 pm,0,2025-06-25 14:40:00,8.4921,8.719,0.00019999999999988915
EWT-2,6/25/2025,02:50:00 pm,0,2025-06-25 14:50:00,8.491,8.717,0.0
EWT-2,6/25/2025,03:00:00 pm,0,2025-06-25 15:00:00,8.486,8.717,0.00019999999999988915
EWT-2,6/25/2025,03:10:00 pm,0,2025-06-25 15:10:00,8.4837,8.719,0.00019999999999988915
EWT-2,6/25/2025,03:20:00 pm,0,2025-06-25 15:20:00,8.4825,8.717,9.999999999994457e-05
EWT-2,6/25/2025,03:30:00 pm,0,2025-06-25 15:30:00,8.4814,8.718,9.999999999994457e-05
EWT-2,6/25/2025,03:40:00 pm,0,2025-06-25 15:40:00,8.4802,8.719,9.999999999994457e-05
EWT-2,6/25/2025,03:50:00 pm,0,2025-06-25 15:50:00,8.4796,8.718,0.0
EWT-2,6/25/2025,04:00:00 pm,0,2025-06-25 16:00:00,8.4785,8.718,9.999999999994457e-05
EWT-2,6/25/2025,04:10:00 pm,0,2025-06-25 16:10:00,8.4774,8.717,9.999999999994457e-05
EWT-2,6/25/2025,04:20:00 pm,0,2025-06-25 16:20:00,8.4767,8.718,9.999999999994457e-05
EWT-2,6/25/2025,04:30:00 pm,0,2025-06-25 16:30:00,8.4757,8.717,9.999999999994457e-05
EWT-2,6/25/2025,04:40:00 pm,0,2025-06-25 16:40:00,8.4753,8.718,9.999999999994457e-05
EWT-2,6/25/2025,04:50:00 pm,0,2025-06-25 16:50:00,8.4744,8.717,0.00019999999999988915
EWT-2,6/25/2025,05:00:00 pm,0,2025-06-25 17:00:00,8.4739,8.719,0.00030000000000001136
EWT-2,6/25/2025,05:10:00 pm,0,2025-06-25 17:10:00,8.473,8.716,0.0002000000000000668
EWT-2,6/25/2025,05:20:00 pm,0,2025-06-25 17:20:00,8.4721,8.718,0.0
EWT-2,6/25/2025,05:30:00 pm,0,2025-06-25 17:30:00,8.4717,8.718,9.999999999994457e-05
EWT-2,6/25/2025,05:40:00 pm,0,2025-06-25 17:40:00,8.471,8.717,9.999999999994457e-05
EWT-2,6/25/2025,05:50:00 pm,0,2025-06-25 17:50:00,8.4706,8.718,9.999999999994457e-05
EWT-2,6/25/2025,06:00:00 pm,0,2025-06-25 18:00:00,8.4702,8.717,0.0
EWT-2,6/25/2025,06:10:00 pm,0,2025-06-25 18:10:00,8.4699,8.717,0.00019999999999988915
EWT-2,6/25/2025,06:20:00 pm,0,2025-06-25 18:20:00,8.4699,8.719,0.00019999999999988915
EWT-2,6/25/2025,06:30:00 pm,0,2025-06-25 18:30:00,8.4696,8.717,0.00010000000000012221
EWT-2,6/25/2025,06:40:00 pm,0,2025-06-25 18:40:00,8.4698,8.716,0.0
EWT-2,6/25/2025,06:50:00 pm,0,2025-06-25 18:50:00,8.4696,8.716,0.0
EWT-2,6/25/2025,07:00:00 pm,0,2025-06-25 19:00:00,8.4693,8.716,0.00010000000000012221
EWT-2,6/25/2025,07:10:00 pm,0,2025-06-25 19:10:00,8.4695,8.717,0.0
EWT-2,6/25/2025,07:20:00 pm,0,2025-06-25 19:20:00,8.4694,8.717,0.00010000000000012221
EWT-2,6/25/2025,07:30:00 pm,0,2025-06-25 19:30:00,8.4695,8.716,0.0
EWT-2,6/25/2025,07:40:00 pm,0,2025-06-25 19:40:00,8.4697,8.716,0.00010000000000012221
EWT-2,6/25/2025,07:50:00 pm,0,2025-06-25 19:50:00,8.4697,8.717,0.0
EWT-2,6/25/2025,08:00:00 pm,0,2025-06-25 20:00:00,8.4702,8.717,0.00010000000000012221
EWT-2,6/25/2025,08:10:00 pm,0,2025-06-25 20:10:00,8.4701,8.716,9.999999999994457e-05
EWT-2,6/25/2025,08:20:00 pm,0,2025-06-25 20:20:00,8.4703,8.715,9.999999999994457e-05
EWT-2,6/25/2025,08:30:00 pm,0,2025-06-25 20:30:00,8.4705,8.714,0.00019999999999988915
EWT-2,6/25/2025,08:40:00 pm,0,2025-06-25 20:40:00,8.4706,8.716,0.0002000000000000668
EWT-2,6/25/2025,08:50:00 pm,0,2025-06-25 20:50:00,8.4709,8.718,0.00039999999999995595
EWT-2,6/25/2025,09:00:00 pm,0,2025-06-25 21:00:00,8.4712,8.714,9.999999999994457e-05
EWT-2,6/25/2025,09:10:00 pm,0,2025-06-25 21:10:00,8.4714,8.715,9.999999999994457e-05
EWT-2,6/25/2025,09:20:00 pm,0,2025-06-25 21:20:00,8.472,8.716,0.0
EWT-2,6/25/2025,09:30:00 pm,0,2025-06-25 21:30:00,8.4724,8.716,0.00019999999999988915
EWT-2,6/25/2025,09:40:00 pm,0,2025-06-25 21:40:00,8.473,8.714,0.0
EWT-2,6/25/2025,09:50:00 pm,0,2025-06-25 21:50:00,8.4737,8.714,0.0
EWT-2,6/25/2025,10:00:00 pm,0,2025-06-25 22:00:00,8.4748,8.714,0.0
EWT-2,6/25/2025,10:10:00 pm,0,2025-06-25 22:10:00,8.4761,8.714,9.999999999994457e-05
EWT-2,6/25/2025,10:20:00 pm,0,2025-06-25 22:20:00,8.4771,8.715,9.999999999994457e-05
EWT-2,6/25/2025,10:30:00 pm,0,2025-06-25 22:30:00,8.4773,8.714,0.0
EWT-2,6/25/2025,10:40:00 pm,0,2025-06-25 22:40:00,8.4777,8.714,0.0
EWT-2,6/25/2025,10:50:00 pm,0,2025-06-25 22:50:00,8.4785,8.714,0.0
EWT-2,6/25/2025,11:00:00 pm,0,2025-06-25 23:00:00,8.4791,8.714,0.0
EWT-2,6/25/2025,11:10:00 pm,0,2025-06-25 23:10:00,8.4798,8.714,0.00010000000000012221
EWT-2,6/25/2025,11:20:00 pm,0,2025-06-25 23:20:00,8.4811,8.713,0.0
EWT-2,6/25/2025,11:30:00 pm,0,2025-06-25 23:30:00,8.4827,8.713,0.00010000000000012221
EWT-2,6/25/2025,11:40:00 pm,0,2025-06-25 23:40:00,8.4841,8.714,9.999999999994457e-05
EWT-2,6/25/2025,11:50:00 pm,0,2025-06-25 23:50:00,8.4847,8.715,0.0
EWT-2,6/26/2025,12:00:00 am,0,2025-06-26 00:00:00,8.485,8.715,9.999999999994457e-05
EWT-2,6/26/2025,12:10:00 am,0,2025-06-26 00:10:00,8.4856,8.714,0.00010000000000012221
EWT-2,6/26/2025,12:20:00 am,0,2025-06-26 00:20:00,8.4858,8.713,0.0
EWT-2,6/26/2025,12:30:00 am,0,2025-06-26 00:30:00,8.4864,8.713,0.0002000000000000668
EWT-2,6/26/2025,12:40:00 am,0,2025-06-26 00:40:00,8.4872,8.715,0.0002000000000000668
EWT-2,6/26/2025,12:50:00 am,0,2025-06-26 00:50:00,8.4883,8.713,0.00010000000000012221
EWT-2,6/26/2025,01:00:00 am,0,2025-06-26 01:00:00,8.4885,8.714,0.0002000000000000668
EWT-2,6/26/2025,01:10:00 am,0,2025-06-26 01:10:00,8.4889,8.712,0.0
EWT-2,6/26/2025,01:20:00 am,0,2025-06-26 01:20:00,8.4898,8.712,0.0
EWT-2,6/26/2025,01:30:00 am,0,2025-06-26 01:30:00,8.4905,8.712,9.999999999994457e-05
EWT-2,6/26/2025,01:40:00 am,0,2025-06-26 01:40:00,8.491,8.713,0.00019999999999988915
EWT-2,6/26/2025,01:50:00 am,0,2025-06-26 01:50:00,8.4914,8.711,0.0
EWT-2,6/26/2025,02:00:00 am,0,2025-06-26 02:00:00,8.492,8.711,0.00019999999999988915
EWT-2,6/26/2025,02:10:00 am,0,2025-06-26 02:10:00,8.4927,8.713,0.00010000000000012221
EWT-2,6/26/2025,02:20:00 am,0,2025-06-26 02:20:00,8.493,8.714,0.00010000000000012221
EWT-2,6/26/2025,02:30:00 am,0,2025-06-26 02:30:00,8.4931,8.713,0.00010000000000012221
EWT-2,6/26/2025,02:40:00 am,0,2025-06-26 02:40:00,8.4938,8.714,0.0002000000000000668
EWT-2,6/26/2025,02:50:00 am,0,2025-06-26 02:50:00,8.4943,8.712,9.999999999994457e-05
EWT-2,6/26/2025,03:00:00 am,0,2025-06-26 03:00:00,8.4945,8.713,0.0
EWT-2,6/26/2025,03:10:00 am,0,2025-06-26 03:10:00,8.4951,8.713,0.00010000000000012221
EWT-2,6/26/2025,03:20:00 am,0,2025-06-26 03:20:00,8.4959,8.714,0.0
EWT-2,6/26/2025,03:30:00 am,0,2025-06-26 03:30:00,8.4976,8.714,0.0002000000000000668
EWT-2,6/26/2025,03:40:00 am,0,2025-06-26 03:40:00,8.499,8.712,9.999999999994457e-05
EWT-2,6/26/2025,03:50:00 am,0,2025-06-26 03:50:00,8.5006,8.713,0.0
EWT-2,6/26/2025,04:00:00 am,0,2025-06-26 04:00:00,8.5018,8.713,0.0
EWT-2,6/26/2025,04:10:00 am,0,2025-06-26 04:10:00,8.503,8.713,0.0002999999999998337
EWT-2,6/26/2025,04:20:00 am,0,2025-06-26 04:20:00,8.5038,8.71,0.00019999999999988915
EWT-2,6/26/2025,04:30:00 am,0,2025-06-26 04:30:00,8.5049,8.712,0.00019999999999988915
EWT-2,6/26/2025,04:40:00 am,0,2025-06-26 04:40:00,8.506,8.71,0.0
EWT-2,6/26/2025,04:50:00 am,0,2025-06-26 04:50:00,8.5068,8.71,9.999999999994457e-05
EWT-2,6/26/2025,05:00:00 am,0,2025-06-26 05:00:00,8.5069,8.711,9.999999999994457e-05
EWT-2,6/26/2025,05:10:00 am,0,2025-06-26 05:10:00,8.5076,8.71,9.999999999994457e-05
EWT-2,6/26/2025,05:20:00 am,0,2025-06-26 05:20:00,8.508,8.711,9.999999999994457e-05
EWT-2,6/26/2025,05:30:00 am,0,2025-06-26 05:30:00,8.5084,8.712,0.00019999999999988915
EWT-2,6/26/2025,05:40:00 am,0,2025-06-26 05:40:00,8.5088,8.71,0.00019999999999988915
EWT-2,6/26/2025,05:50:00 am,0,2025-06-26 05:50:00,8.5093,8.712,9.999999999994457e-05
EWT-2,6/26/2025,06:00:00 am,0,2025-06-26 06:00:00,8.5096,8.711,9.999999999994457e-05
EWT-2,6/26/2025,06:10:00 am,0,2025-06-26 06:10:00,8.5102,8.712,0.0
EWT-2,6/26/2025,06:20:00 am,0,2025-06-26 06:20:00,8.5104,8.712,9.999999999994457e-05
EWT-2,6/26/2025,06:30:00 am,0,2025-06-26 06:30:00,8.5113,8.711,9.999999999994457e-05
EWT-2,6/26/2025,06:40:00 am,0,2025-06-26 06:40:00,8.5119,8.71,0.0
EWT-2,6/26/2025,06:50:00 am,0,2025-06-26 06:50:00,8.5128,8.71,0.0
EWT-2,6/26/2025,07:00:00 am,0,2025-06-26 07:00:00,8.5144,8.71,0.0
EWT-2,6/26/2025,07:10:00 am,0,2025-06-26 07:10:00,8.5155,8.71,0.0
EWT-2,6/26/2025,07:20:00 am,0,2025-06-26 07:20:00,8.5171,8.71,0.00019999999999988915
EWT-2,6/26/2025,07:30:00 am,0,2025-06-26 07:30:00,8.5179,8.712,0.00019999999999988915
EWT-2,6/26/2025,07:40:00 am,0,2025-06-26 07:40:00,8.5186,8.71,0.00019999999999988915
EWT-2,6/26/2025,07:50:00 am,0,2025-06-26 07:50:00,8.5194,8.712,0.0
EWT-2,6/26/2025,08:00:00 am,0,2025-06-26 08:00:00,8.5201,8.712,0.00019999999999988915
EWT-2,6/26/2025,08:10:00 am,0,2025-06-26 08:10:00,8.5207,8.71,9.999999999994457e-05
EWT-2,6/26/2025,08:20:00 am,0,2025-06-26 08:20:00,8.521,8.711,0.0
EWT-2,6/26/2025,08:30:00 am,0,2025-06-26 08:30:00,8.5215,8.711,9.999999999994457e-05
EWT-2,6/26/2025,08:40:00 am,0,2025-06-26 08:40:00,8.5221,8.71,0.0
EWT-2,6/26/2025,08:50:00 am,0,2025-06-26 08:50:00,8.5228,8.71,9.999999999994457e-05
EWT-2,6/26/2025,09:00:00 am,0,2025-06-26 09:00:00,8.5224,8.711,0.0002000000000000668
EWT-2,6/26/2025,09:10:00 am,0,2025-06-26 09:10:00,8.5219,8.709,0.0
EWT-2,6/26/2025,09:20:00 am,0,2025-06-26 09:20:00,8.521,8.709,0.00010000000000012221
EWT-2,6/26/2025,09:30:00 am,0,2025-06-26 09:30:00,8.5196,8.71,0.00019999999999988915
EWT-2,6/26/2025,09:40:00 am,0,2025-06-26 09:40:00,8.5179,8.712,0.00019999999999988915
EWT-2,6/26/2025,09:50:00 am,0,2025-06-26 09:50:00,8.5157,8.71,0.0
EWT-2,6/26/2025,10:00:00 am,0,2025-06-26 10:00:00,8.5134,8.71,0.0
EWT-2,6/26/2025,10:10:00 am,0,2025-06-26 10:10:00,8.5114,8.71,0.00010000000000012221
EWT-2,6/26/2025,10:20:00 am,0,2025-06-26 10:20:00,8.5088,8.709,0.0002000000000000668
EWT-2,6/26/2025,10:30:00 am,0,2025-06-26 10:30:00,8.5064,8.711,0.0
EWT-2,6/26/2025,10:40:00 am,0,2025-06-26 10:40:00,8.5037,8.711,9.999999999994457e-05
EWT-2,6/26/2025,10:50:00 am,0,2025-06-26 10:50:00,8.5017,8.712,0.00030000000000001136
EWT-2,6/26/2025,11:00:00 am,0,2025-06-26 11:00:00,8.5004,8.709,0.0
EWT-2,6/26/2025,11:10:00 am,0,2025-06-26 11:10:00,8.4991,8.709,0.00010000000000012221
EWT-2,6/26/2025,11:20:00 am,0,2025-06-26 11:20:00,8.4979,8.71,0.00010000000000012221
EWT-2,6/26/2025,11:30:00 am,0,2025-06-26 11:30:00,8.4972,8.709,9.999999999994457e-05
EWT-2,6/26/2025,11:40:00 am,0,2025-06-26 11:40:00,8.4965,8.708,9.999999999994457e-05
EWT-2,6/26/2025,11:50:00 am,0,2025-06-26 11:50:00,8.4949,8.709,0.00010000000000012221
EWT-2,6/26/2025,12:00:00 pm,0,2025-06-26 12:00:00,8.4934,8.71,0.00030000000000001136
EWT-2,6/26/2025,12:10:00 pm,0,2025-06-26 12:10:00,8.4912,8.707,0.00019999999999988915
EWT-2,6/26/2025,12:20:00 pm,0,2025-06-26 12:20:00,8.4884,8.709,9.999999999994457e-05
EWT-2,6/26/2025,12:30:00 pm,0,2025-06-26 12:30:00,8.4853,8.708,0.0002000000000000668
EWT-2,6/26/2025,12:40:00 pm,0,2025-06-26 12:40:00,8.4838,8.71,0.0002000000000000668
EWT-2,6/26/2025,12:50:00 pm,0,2025-06-26 12:50:00,8.4817,8.708,0.0002000000000000668
EWT-2,6/26/2025,01:00:00 pm,0,2025-06-26 13:00:00,8.4784,8.71,0.0
EWT-2,6/26/2025,01:10:00 pm,0,2025-06-26 13:10:00,8.4722,8.71,0.0
EWT-2,6/26/2025,01:20:00 pm,0,2025-06-26 13:20:00,8.4687,8.71,0.00010000000000012221
EWT-2,6/26/2025,01:30:00 pm,0,2025-06-26 13:30:00,8.4669,8.709,9.999999999994457e-05
EWT-2,6/26/2025,01:40:00 pm,0,2025-06-26 13:40:00,8.4654,8.708,0.0
EWT-2,6/26/2025,01:50:00 pm,0,2025-06-26 13:50:00,8.464,8.708,0.00030000000000001136
EWT-2,6/26/2025,02:00:00 pm,0,2025-06-26 14:00:00,8.4628,8.711,0.00030000000000001136
EWT-2,6/26/2025,02:10:00 pm,0,2025-06-26 14:10:00,8.4614,8.708,0.0
EWT-2,6/26/2025,02:20:00 pm,0,2025-06-26 14:20:00,8.4605,8.708,9.999999999994457e-05
EWT-2,6/26/2025,02:30:00 pm,0,2025-06-26 14:30:00,8.4595,8.709,0.0
EWT-2,6/26/2025,02:40:00 pm,0,2025-06-26 14:40:00,8.4579,8.709,9.999999999994457e-05
EWT-2,6/26/2025,02:50:00 pm,0,2025-06-26 14:50:00,8.4536,8.708,9.999999999994457e-05
EWT-2,6/26/2025,03:00:00 pm,0,2025-06-26 15:00:00,8.4492,8.707,0.00030000000000001136
EWT-2,6/26/2025,03:10:00 pm,0,2025-06-26 15:10:00,8.4473,8.71,0.00010000000000012221
EWT-2,6/26/2025,03:20:00 pm,0,2025-06-26 15:20:00,8.4454,8.709,0.00030000000000001136
EWT-2,6/26/2025,03:30:00 pm,0,2025-06-26 15:30:00,8.4439,8.706,0.0002000000000000668
EWT-2,6/26/2025,03:40:00 pm,0,2025-06-26 15:40:00,8.4426,8.708,9.999999999994457e-05
EWT-2,6/26/2025,03:50:00 pm,0,2025-06-26 15:50:00,8.4413,8.707,0.0
EWT-2,6/26/2025,04:00:00 pm,0,2025-06-26 16:00:00,8.4401,8.707,0.00019999999999988915
EWT-2,6/26/2025,04:10:00 pm,0,2025-06-26 16:10:00,8.4388,8.709,0.00039999999999995595
EWT-2,6/26/2025,04:20:00 pm,0,2025-06-26 16:20:00,8.4378,8.705,9.999999999994457e-05
EWT-2,6/26/2025,04:30:00 pm,0,2025-06-26 16:30:00,8.437,8.706,0.00010000000000012221
EWT-2,6/26/2025,04:40:00 pm,0,2025-06-26 16:40:00,8.4362,8.707,0.00019999999999988915
EWT-2,6/26/2025,04:50:00 pm,0,2025-06-26 16:50:00,8.4356,8.709,0.00019999999999988915
EWT-2,6/26/2025,05:00:00 pm,0,2025-06-26 17:00:00,8.435,8.707,0.00019999999999988915
EWT-2,6/26/2025,05:10:00 pm,0,2025-06-26 17:10:00,8.4347,8.709,0.00030000000000001136
EWT-2,6/26/2025,05:20:00 pm,0,2025-06-26 17:20:00,8.434,8.706,0.00010000000000012221
EWT-2,6/26/2025,05:30:00 pm,0,2025-06-26 17:30:00,8.4339,8.707,0.0
EWT-2,6/26/2025,05:40:00 pm,0,2025-06-26 17:40:00,8.4333,8.707,0.00010000000000012221
EWT-2,6/26/2025,05:50:00 pm,0,2025-06-26 17:50:00,8.4331,8.706,0.0002000000000000668
EWT-2,6/26/2025,06:00:00 pm,0,2025-06-26 18:00:00,8.4327,8.708,0.0
EWT-2,6/26/2025,06:10:00 pm,0,2025-06-26 18:10:00,8.4327,8.708,0.0002000000000000668
EWT-2,6/26/2025,06:20:00 pm,0,2025-06-26 18:20:00,8.4327,8.71,0.0002000000000000668
EWT-2,6/26/2025,06:30:00 pm,0,2025-06-26 18:30:00,8.4325,8.708,9.999999999994457e-05
EWT-2,6/26/2025,06:40:00 pm,0,2025-06-26 18:40:00,8.4325,8.707,0.0
EWT-2,6/26/2025,06:50:00 pm,0,2025-06-26 18:50:00,8.4324,8.707,0.00010000000000012221
EWT-2,6/26/2025,07:00:00 pm,0,2025-06-26 19:00:00,8.4325,8.706,0.0
EWT-2,6/26/2025,07:10:00 pm,0,2025-06-26 19:10:00,8.4323,8.706,0.00010000000000012221
EWT-2,6/26/2025,07:20:00 pm,0,2025-06-26 19:20:00,8.4326,8.707,0.0
EWT-2,6/26/2025,07:30:00 pm,0,2025-06-26 19:30:00,8.4327,8.707,9.999999999994457e-05
EWT-2,6/26/2025,07:40:00 pm,0,2025-06-26 19:40:00,8.4329,8.708,0.0002000000000000668
EWT-2,6/26/2025,07:50:00 pm,0,2025-06-26 19:50:00,8.433,8.706,9.999999999994457e-05
EWT-2,6/26/2025,08:00:00 pm,0,2025-06-26 20:00:00,8.4333,8.705,9.999999999994457e-05
EWT-2,6/26/2025,08:10:00 pm,0,2025-06-26 20:10:00,8.4334,8.706,0.00010000000000012221
EWT-2,6/26/2025,08:20:00 pm,0,2025-06-26 20:20:00,8.4337,8.707,9.999999999994457e-05
EWT-2,6/26/2025,08:30:00 pm,0,2025-06-26 20:30:00,8.4342,8.708,0.0002000000000000668
EWT-2,6/26/2025,08:40:00 pm,0,2025-06-26 20:40:00,8.4347,8.706,0.0
EWT-2,6/26/2025,08:50:00 pm,0,2025-06-26 20:50:00,8.4359,8.706,9.999999999994457e-05
EWT-2,6/26/2025,09:00:00 pm,0,2025-06-26 21:00:00,8.4369,8.705,9.999999999994457e-05
EWT-2,6/26/2025,09:10:00 pm,0,2025-06-26 21:10:00,8.4376,8.706,9.999999999994457e-05
EWT-2,6/26/2025,09:20:00 pm,0,2025-06-26 21:20:00,8.4382,8.705,9.999999999994457e-05
EWT-2,6/26/2025,09:30:00 pm,0,2025-06-26 21:30:00,8.4393,8.706,0.0
EWT-2,6/26/2025,09:40:00 pm,0,2025-06-26 21:40:00,8.4404,8.706,0.00010000000000012221
EWT-2,6/26/2025,09:50:00 pm,0,2025-06-26 21:50:00,8.4414,8.707,0.0002000000000000668
EWT-2,6/26/2025,10:00:00 pm,0,2025-06-26 22:00:00,8.4424,8.705,0.0
EWT-2,6/26/2025,10:10:00 pm,0,2025-06-26 22:10:00,8.4431,8.705,0.0002000000000000668
EWT-2,6/26/2025,10:20:00 pm,0,2025-06-26 22:20:00,8.4439,8.707,0.00030000000000001136
EWT-2,6/26/2025,10:30:00 pm,0,2025-06-26 22:30:00,8.4446,8.704,0.0
EWT-2,6/26/2025,10:40:00 pm,0,2025-06-26 22:40:00,8.4454,8.704,0.00030000000000001136
EWT-2,6/26/2025,10:50:00 pm,0,2025-06-26 22:50:00,8.4461,8.707,0.0002000000000000668
EWT-2,6/26/2025,11:00:00 pm,0,2025-06-26 23:00:00,8.4466,8.705,9.999999999994457e-05
EWT-2,6/26/2025,11:10:00 pm,0,2025-06-26 23:10:00,8.4473,8.706,9.999999999994457e-05
EWT-2,6/26/2025,11:20:00 pm,0,2025-06-26 23:20:00,8.4484,8.705,0.0
EWT-2,6/26/2025,11:30:00 pm,0,2025-06-26 23:30:00,8.4494,8.705,0.0
EWT-2,6/26/2025,11:40:00 pm,0,2025-06-26 23:40:00,8.4501,8.705,9.999999999994457e-05
EWT-2,6/26/2025,11:50:00 pm,0,2025-06-26 23:50:00,8.4511,8.704,0.0
EWT-2,6/27/2025,12:00:00 am,0,2025-06-27 00:00:00,8.4526,8.704,9.999999999994457e-05
EWT-2,6/27/2025,12:10:00 am,0,2025-06-27 00:10:00,8.4533,8.705,0.0
EWT-2,6/27/2025,12:20:00 am,0,2025-06-27 00:20:00,8.455,8.705,0.0
EWT-2,6/27/2025,12:30:00 am,0,2025-06-27 00:30:00,8.456,8.705,9.999999999994457e-05
EWT-2,6/27/2025,12:40:00 am,0,2025-06-27 00:40:00,8.4567,8.704,0.0
EWT-2,6/27/2025,12:50:00 am,0,2025-06-27 00:50:00,8.4575,8.704,0.00019999999999988915
EWT-2,6/27/2025,01:00:00 am,0,2025-06-27 01:00:00,8.4585,8.706,0.0
EWT-2,6/27/2025,01:10:00 am,0,2025-06-27 01:10:00,8.4593,8.706,9.999999999994457e-05
EWT-2,6/27/2025,01:20:00 am,0,2025-06-27 01:20:00,8.4603,8.705,0.0
EWT-2,6/27/2025,01:30:00 am,0,2025-06-27 01:30:00,8.4616,8.705,9.999999999994457e-05
EWT-2,6/27/2025,01:40:00 am,0,2025-06-27 01:40:00,8.4626,8.704,9.999999999994457e-05
EWT-2,6/27/2025,01:50:00 am,0,2025-06-27 01:50:00,8.4633,8.705,9.999999999994457e-05
EWT-2,6/27/2025,02:00:00 am,0,2025-06-27 02:00:00,8.4638,8.704,0.0002000000000000668
EWT-2,6/27/2025,02:10:00 am,0,2025-06-27 02:10:00,8.4644,8.702,0.0002000000000000668
EWT-2,6/27/2025,02:20:00 am,0,2025-06-27 02:20:00,8.4653,8.704,9.999999999994457e-05
EWT-2,6/27/2025,02:30:00 am,0,2025-06-27 02:30:00,8.4658,8.705,0.0
EWT-2,6/27/2025,02:40:00 am,0,2025-06-27 02:40:00,8.466,8.705,9.999999999994457e-05
EWT-2,6/27/2025,02:50:00 am,0,2025-06-27 02:50:00,8.4666,8.704,0.0
EWT-2,6/27/2025,03:00:00 am,0,2025-06-27 03:00:00,8.4674,8.704,0.0
EWT-2,6/27/2025,03:10:00 am,0,2025-06-27 03:10:00,8.4682,8.704,0.0
EWT-2,6/27/2025,03:20:00 am,0,2025-06-27 03:20:00,8.4688,8.704,9.999999999994457e-05
EWT-2,6/27/2025,03:30:00 am,0,2025-06-27 03:30:00,8.4691,8.705,0.0
EWT-2,6/27/2025,03:40:00 am,0,2025-06-27 03:40:00,8.4697,8.705,9.999999999994457e-05
EWT-2,6/27/2025,03:50:00 am,0,2025-06-27 03:50:00,8.4706,8.704,9.999999999994457e-05
EWT-2,6/27/2025,04:00:00 am,0,2025-06-27 04:00:00,8.4709,8.705,0.00030000000000001136
EWT-2,6/27/2025,04:10:00 am,0,2025-06-27 04:10:00,8.4712,8.702,9.999999999994457e-05
EWT-2,6/27/2025,04:20:00 am,0,2025-06-27 04:20:00,8.4715,8.703,0.00010000000000012221
EWT-2,6/27/2025,04:30:00 am,0,2025-06-27 04:30:00,8.4719,8.704,0.00010000000000012221
EWT-2,6/27/2025,04:40:00 am,0,2025-06-27 04:40:00,8.4724,8.703,9.999999999994457e-05
EWT-2,6/27/2025,04:50:00 am,0,2025-06-27 04:50:00,8.4727,8.702,0.0002000000000000668
EWT-2,6/27/2025,05:00:00 am,0,2025-06-27 05:00:00,8.4732,8.704,9.999999999994457e-05
EWT-2,6/27/2025,05:10:00 am,0,2025-06-27 05:10:00,8.4736,8.705,0.0
EWT-2,6/27/2025,05:20:00 am,0,2025-06-27 05:20:00,8.4741,8.705,0.00030000000000001136
EWT-2,6/27/2025,05:30:00 am,0,2025-06-27 05:30:00,8.4746,8.702,0.0002000000000000668
EWT-2,6/27/2025,05:40:00 am,0,2025-06-27 05:40:00,8.4752,8.704,0.00010000000000012221
EWT-2,6/27/2025,05:50:00 am,0,2025-06-27 05:50:00,8.4757,8.703,0.0
EWT-2,6/27/2025,06:00:00 am,0,2025-06-27 06:00:00,8.4763,8.703,0.00010000000000012221
EWT-2,6/27/2025,06:10:00 am,0,2025-06-27 06:10:00,8.4766,8.704,0.00010000000000012221
EWT-2,6/27/2025,06:20:00 am,0,2025-06-27 06:20:00,8.4787,8.703,0.0
EWT-2,6/27/2025,06:30:00 am,0,2025-06-27 06:30:00,8.4835,8.703,0.0
EWT-2,6/27/2025,06:40:00 am,0,2025-06-27 06:40:00,8.4872,8.703,0.00010000000000012221
EWT-2,6/27/2025,06:50:00 am,0,2025-06-27 06:50:00,8.4902,8.704,0.0
EWT-2,6/27/2025,07:00:00 am,0,2025-06-27 07:00:00,8.4921,8.704,0.0002000000000000668
EWT-2,6/27/2025,07:10:00 am,0,2025-06-27 07:10:00,8.4941,8.702,0.00030000000000001136
EWT-2,6/27/2025,07:20:00 am,0,2025-06-27 07:20:00,8.4958,8.705,9.999999999994457e-05
EWT-2,6/27/2025,07:30:00 am,0,2025-06-27 07:30:00,8.4976,8.704,9.999999999994457e-05
EWT-2,6/27/2025,07:40:00 am,0,2025-06-27 07:40:00,8.4991,8.705,0.0002000000000000668
EWT-2,6/27/2025,07:50:00 am,0,2025-06-27 07:50:00,8.5006,8.703,0.00010000000000012221
EWT-2,6/27/2025,08:00:00 am,0,2025-06-27 08:00:00,8.5019,8.704,0.00010000000000012221
EWT-2,6/27/2025,08:10:00 am,0,2025-06-27 08:10:00,8.5031,8.703,0.0
EWT-2,6/27/2025,08:20:00 am,0,2025-06-27 08:20:00,8.5047,8.703,0.00010000000000012221
EWT-2,6/27/2025,08:30:00 am,0,2025-06-27 08:30:00,8.5056,8.704,0.0002000000000000668
EWT-2,6/27/2025,08:40:00 am,0,2025-06-27 08:40:00,8.5064,8.702,0.0002000000000000668
EWT-2,6/27/2025,08:50:00 am,0,2025-06-27 08:50:00,8.5071,8.704,0.0
EWT-2,6/27/2025,09:00:00 am,0,2025-06-27 09:00:00,8.5074,8.704,0.0002000000000000668
EWT-2,6/27/2025,09:10:00 am,0,2025-06-27 09:10:00,8.5069,8.702,9.999999999994457e-05
EWT-2,6/27/2025,09:20:00 am,0,2025-06-27 09:20:00,8.5064,8.703,0.00010000000000012221
EWT-2,6/27/2025,09:30:00 am,0,2025-06-27 09:30:00,8.5057,8.704,0.0002000000000000668
EWT-2,6/27/2025,09:40:00 am,0,2025-06-27 09:40:00,8.5047,8.702,9.999999999994457e-05
EWT-2,6/27/2025,09:50:00 am,0,2025-06-27 09:50:00,8.5029,8.703,0.0
EWT-2,6/27/2025,10:00:00 am,0,2025-06-27 10:00:00,8.5007,8.703,0.00010000000000012221
EWT-2,6/27/2025,10:10:00 am,0,2025-06-27 10:10:00,8.4983,8.704,0.00010000000000012221
EWT-2,6/27/2025,10:20:00 am,0,2025-06-27 10:20:00,8.496,8.703,9.999999999994457e-05
EWT-2,6/27/2025,10:30:00 am,0,2025-06-27 10:30:00,8.4936,8.702,0.0002000000000000668
EWT-2,6/27/2025,10:40:00 am,0,2025-06-27 10:40:00,8.4918,8.704,0.0002000000000000668
EWT-2,6/27/2025,10:50:00 am,0,2025-06-27 10:50:00,8.4898,8.702,9.999999999994457e-05
EWT-2,6/27/2025,11:00:00 am,0,2025-06-27 11:00:00,8.4874,8.703,0.00010000000000012221
EWT-2,6/27/2025,11:10:00 am,0,2025-06-27 11:10:00,8.4848,8.704,0.0
EWT-2,6/27/2025,11:20:00 am,0,2025-06-27 11:20:00,8.4824,8.704,0.0002000000000000668
EWT-2,6/27/2025,11:30:00 am,0,2025-06-27 11:30:00,8.4797,8.702,9.999999999994457e-05
EWT-2,6/27/2025,11:40:00 am,0,2025-06-27 11:40:00,8.477,8.703,0.00019999999999988915
EWT-2,6/27/2025,11:50:00 am,0,2025-06-27 11:50:00,8.4739,8.701,0.00019999999999988915
EWT-2,6/27/2025,12:00:00 pm,0,2025-06-27 12:00:00,8.4715,8.703,9.999999999994457e-05
EWT-2,6/27/2025,12:10:00 pm,0,2025-06-27 12:10:00,8.4688,8.702,9.999999999994457e-05
EWT-2,6/27/2025,12:20:00 pm,0,2025-06-27 12:20:00,8.4679,8.701,0.00019999999999988915
EWT-2,6/27/2025,12:30:00 pm,0,2025-06-27 12:30:00,8.4671,8.703,9.999999999994457e-05
EWT-2,6/27/2025,12:40:00 pm,0,2025-06-27 12:40:00,8.4661,8.702,9.999999999994457e-05
EWT-2,6/27/2025,12:50:00 pm,0,2025-06-27 12:50:00,8.4652,8.701,9.999999999994457e-05
EWT-2,6/27/2025,01:00:00 pm,0,2025-06-27 13:00:00,8.4644,8.702,0.0002000000000000668
EWT-2,6/27/2025,01:10:00 pm,0,2025-06-27 13:10:00,8.4635,8.704,0.0002000000000000668
EWT-2,6/27/2025,01:20:00 pm,0,2025-06-27 13:20:00,8.4622,8.702,9.999999999994457e-05
EWT-2,6/27/2025,01:30:00 pm,0,2025-06-27 13:30:00,8.4606,8.703,0.0
EWT-2,6/27/2025,01:40:00 pm,0,2025-06-27 13:40:00,8.4587,8.703,9.999999999994457e-05
EWT-2,6/27/2025,01:50:00 pm,0,2025-06-27 13:50:00,8.4569,8.702,0.0
EWT-2,6/27/2025,02:00:00 pm,0,2025-06-27 14:00:00,8.4547,8.702,0.0002000000000000668
EWT-2,6/27/2025,02:10:00 pm,0,2025-06-27 14:10:00,8.4529,8.704,0.0002000000000000668
EWT-2,6/27/2025,02:20:00 pm,0,2025-06-27 14:20:00,8.4519,8.702,0.0
EWT-2,6/27/2025,02:30:00 pm,0,2025-06-27 14:30:00,8.4507,8.702,0.0
EWT-2,6/27/2025,02:40:00 pm,0,2025-06-27 14:40:00,8.4489,8.702,9.999999999994457e-05
EWT-2,6/27/2025,02:50:00 pm,0,2025-06-27 14:50:00,8.4475,8.703,0.0
EWT-2,6/27/2025,03:00:00 pm,0,2025-06-27 15:00:00,8.4424,8.703,0.00019999999999988915
EWT-2,6/27/2025,03:10:00 pm,0,2025-06-27 15:10:00,8.4406,8.701,0.00019999999999988915
EWT-2,6/27/2025,03:20:00 pm,0,2025-06-27 15:20:00,8.439,8.703,0.00019999999999988915
EWT-2,6/27/2025,03:30:00 pm,0,2025-06-27 15:30:00,8.4377,8.701,9.999999999994457e-05
EWT-2,6/27/2025,03:40:00 pm,0,2025-06-27 15:40:00,8.4366,8.702,0.0
EWT-2,6/27/2025,03:50:00 pm,0,2025-06-27 15:50:00,8.4358,8.702,9.999999999994457e-05
EWT-2,6/27/2025,04:00:00 pm,0,2025-06-27 16:00:00,8.4354,8.701,0.0
EWT-2,6/27/2025,04:10:00 pm,0,2025-06-27 16:10:00,8.4351,8.701,0.00010000000000012221
EWT-2,6/27/2025,04:20:00 pm,0,2025-06-27 16:20:00,8.4348,8.7,0.00030000000000001136
EWT-2,6/27/2025,04:30:00 pm,0,2025-06-27 16:30:00,8.4343,8.703,0.00019999999999988915
EWT-2,6/27/2025,04:40:00 pm,0,2025-06-27 16:40:00,8.434,8.701,9.999999999994457e-05
EWT-2,6/27/2025,04:50:00 pm,0,2025-06-27 16:50:00,8.4332,8.702,9.999999999994457e-05
EWT-2,6/27/2025,05:00:00 pm,0,2025-06-27 17:00:00,8.433,8.701,0.00010000000000012221
EWT-2,6/27/2025,05:10:00 pm,0,2025-06-27 17:10:00,8.4326,8.7,0.0002000000000000668
EWT-2,6/27/2025,05:20:00 pm,0,2025-06-27 17:20:00,8.4322,8.702,0.0002000000000000668
EWT-2,6/27/2025,05:30:00 pm,0,2025-06-27 17:30:00,8.4321,8.7,0.0004000000000001336
EWT-2,6/27/2025,05:40:00 pm,0,2025-06-27 17:40:00,8.4318,8.704,0.0002000000000000668
EWT-2,6/27/2025,05:50:00 pm,0,2025-06-27 17:50:00,8.4318,8.702,9.999999999994457e-05
EWT-2,6/27/2025,06:00:00 pm,0,2025-06-27 18:00:00,8.4316,8.701,0.0
EWT-2,6/27/2025,06:10:00 pm,0,2025-06-27 18:10:00,8.4315,8.701,0.00019999999999988915
EWT-2,6/27/2025,06:20:00 pm,0,2025-06-27 18:20:00,8.4313,8.703,9.999999999994457e-05
EWT-2,6/27/2025,06:30:00 pm,0,2025-06-27 18:30:00,8.4314,8.702,0.0
EWT-2,6/27/2025,06:40:00 pm,0,2025-06-27 18:40:00,8.4313,8.702,0.0
EWT-2,6/27/2025,06:50:00 pm,0,2025-06-27 18:50:00,8.4313,8.702,0.0002000000000000668
EWT-2,6/27/2025,07:00:00 pm,0,2025-06-27 19:00:00,8.4311,8.7,0.0002000000000000668
EWT-2,6/27/2025,07:10:00 pm,0,2025-06-27 19:10:00,8.4315,8.702,0.0
EWT-2,6/27/2025,07:20:00 pm,0,2025-06-27 19:20:00,8.4316,8.702,9.999999999994457e-05
EWT-2,6/27/2025,07:30:00 pm,0,2025-06-27 19:30:00,8.4318,8.701,9.999999999994457e-05
EWT-2,6/27/2025,07:40:00 pm,0,2025-06-27 19:40:00,8.432,8.702,9.999999999994457e-05
EWT-2,6/27/2025,07:50:00 pm,0,2025-06-27 19:50:00,8.4319,8.701,0.0002000000000000668
EWT-2,6/27/2025,08:00:00 pm,0,2025-06-27 20:00:00,8.432,8.699,0.00030000000000001136
EWT-2,6/27/2025,08:10:00 pm,0,2025-06-27 20:10:00,8.4322,8.702,9.999999999994457e-05
EWT-2,6/27/2025,08:20:00 pm,0,2025-06-27 20:20:00,8.4327,8.701,0.00010000000000012221
EWT-2,6/27/2025,08:30:00 pm,0,2025-06-27 20:30:00,8.4331,8.7,0.00010000000000012221
EWT-2,6/27/2025,08:40:00 pm,0,2025-06-27 20:40:00,8.4332,8.701,9.999999999994457e-05
EWT-2,6/27/2025,08:50:00 pm,0,2025-06-27 20:50:00,8.4336,8.702,9.999999999994457e-05
EWT-2,6/27/2025,09:00:00 pm,0,2025-06-27 21:00:00,8.4338,8.701,0.00010000000000012221
EWT-2,6/27/2025,09:10:00 pm,0,2025-06-27 21:10:00,8.4344,8.7,0.0002000000000000668
EWT-2,6/27/2025,09:20:00 pm,0,2025-06-27 21:20:00,8.4352,8.702,0.0002000000000000668
EWT-2,6/27/2025,09:30:00 pm,0,2025-06-27 21:30:00,8.4359,8.7,0.0
EWT-2,6/27/2025,09:40:00 pm,0,2025-06-27 21:40:00,8.4367,8.7,0.00010000000000012221
EWT-2,6/27/2025,09:50:00 pm,0,2025-06-27 21:50:00,8.4377,8.701,0.0
EWT-2,6/27/2025,10:00:00 pm,0,2025-06-27 22:00:00,8.4388,8.701,0.00010000000000012221
EWT-2,6/27/2025,10:10:00 pm,0,2025-06-27 22:10:00,8.44,8.7,0.00010000000000012221
EWT-2,6/27/2025,10:20:00 pm,0,2025-06-27 22:20:00,8.4407,8.701,0.0002000000000000668
EWT-2,6/27/2025,10:30:00 pm,0,2025-06-27 22:30:00,8.4409,8.699,0.00030000000000001136
EWT-2,6/27/2025,10:40:00 pm,0,2025-06-27 22:40:00,8.4415,8.702,0.0002000000000000668
EWT-2,6/27/2025,10:50:00 pm,0,2025-06-27 22:50:00,8.4416,8.7,0.0
EWT-2,6/27/2025,11:00:00 pm,0,2025-06-27 23:00:00,8.4421,8.7,0.00010000000000012221
EWT-2,6/27/2025,11:10:00 pm,0,2025-06-27 23:10:00,8.443,8.701,0.00010000000000012221
EWT-2,6/27/2025,11:20:00 pm,0,2025-06-27 23:20:00,8.4436,8.7,0.00010000000000012221
EWT-2,6/27/2025,11:30:00 pm,0,2025-06-27 23:30:00,8.4437,8.701,0.00010000000000012221
EWT-2,6/27/2025,11:40:00 pm,0,2025-06-27 23:40:00,8.4439,8.7,0.0
EWT-2,6/27/2025,11:50:00 pm,0,2025-06-27 23:50:00,8.4441,8.7,0.00010000000000012221
EWT-2,6/28/2025,12:00:00 am,0,2025-06-28 00:00:00,8.4447,8.701,0.00010000000000012221
EWT-2,6/28/2025,12:10:00 am,0,2025-06-28 00:10:00,8.445,8.7,0.0
EWT-2,6/28/2025,12:20:00 am,0,2025-06-28 00:20:00,8.4455,8.7,9.999999999994457e-05
EWT-2,6/28/2025,12:30:00 am,0,2025-06-28 00:30:00,8.4461,8.699,9.999999999994457e-05
EWT-2,6/28/2025,12:40:00 am,0,2025-06-28 00:40:00,8.4466,8.7,0.0002000000000000668
EWT-2,6/28/2025,12:50:00 am,0,2025-06-28 00:50:00,8.4469,8.702,0.00039999999999995595
EWT-2,6/28/2025,01:00:00 am,0,2025-06-28 01:00:00,8.4478,8.698,0.00039999999999995595
EWT-2,6/28/2025,01:10:00 am,0,2025-06-28 01:10:00,8.4483,8.702,0.0002000000000000668
EWT-2,6/28/2025,01:20:00 am,0,2025-06-28 01:20:00,8.4491,8.7,0.00010000000000012221
EWT-2,6/28/2025,01:30:00 am,0,2025-06-28 01:30:00,8.4496,8.701,0.0
EWT-2,6/28/2025,01:40:00 am,0,2025-06-28 01:40:00,8.4506,8.701,0.0
EWT-2,6/28/2025,01:50:00 am,0,2025-06-28 01:50:00,8.4515,8.701,0.0
EWT-2,6/28/2025,02:00:00 am,0,2025-06-28 02:00:00,8.4517,8.701,0.0
EWT-2,6/28/2025,02:10:00 am,0,2025-06-28 02:10:00,8.4519,8.701,0.00010000000000012221
EWT-2,6/28/2025,02:20:00 am,0,2025-06-28 02:20:00,8.4523,8.7,9.999999999994457e-05
EWT-2,6/28/2025,02:30:00 am,0,2025-06-28 02:30:00,8.4524,8.699,0.0
EWT-2,6/28/2025,02:40:00 am,0,2025-06-28 02:40:00,8.4527,8.699,0.0002000000000000668
EWT-2,6/28/2025,02:50:00 am,0,2025-06-28 02:50:00,8.4529,8.701,0.00010000000000012221
EWT-2,6/28/2025,03:00:00 am,0,2025-06-28 03:00:00,8.4535,8.7,0.0
EWT-2,6/28/2025,03:10:00 am,0,2025-06-28 03:10:00,8.4537,8.7,9.999999999994457e-05
EWT-2,6/28/2025,03:20:00 am,0,2025-06-28 03:20:00,8.4544,8.699,9.999999999994457e-05
EWT-2,6/28/2025,03:30:00 am,0,2025-06-28 03:30:00,8.4547,8.7,0.00010000000000012221
EWT-2,6/28/2025,03:40:00 am,0,2025-06-28 03:40:00,8.455,8.701,0.00010000000000012221
EWT-2,6/28/2025,03:50:00 am,0,2025-06-28 03:50:00,8.4557,8.7,9.999999999994457e-05
EWT-2,6/28/2025,04:00:00 am,0,2025-06-28 04:00:00,8.4558,8.699,9.999999999994457e-05
EWT-2,6/28/2025,04:10:00 am,0,2025-06-28 04:10:00,8.4565,8.7,9.999999999994457e-05
EWT-2,6/28/2025,04:20:00 am,0,2025-06-28 04:20:00,8.4575,8.699,0.0002000000000000668
EWT-2,6/28/2025,04:30:00 am,0,2025-06-28 04:30:00,8.4629,8.701,0.0002000000000000668
EWT-2,6/28/2025,04:40:00 am,0,2025-06-28 04:40:00,8.4672,8.699,0.0
EWT-2,6/28/2025,04:50:00 am,0,2025-06-28 04:50:00,8.47,8.699,0.0002000000000000668
EWT-2,6/28/2025,05:00:00 am,0,2025-06-28 05:00:00,8.4722,8.701,9.999999999994457e-05
EWT-2,6/28/2025,05:10:00 am,0,2025-06-28 05:10:00,8.474,8.702,0.0002000000000000668
EWT-2,6/28/2025,05:20:00 am,0,2025-06-28 05:20:00,8.4757,8.7,9.999999999994457e-05
EWT-2,6/28/2025,05:30:00 am,0,2025-06-28 05:30:00,8.4774,8.699,0.0
EWT-2,6/28/2025,05:40:00 am,0,2025-06-28 05:40:00,8.479,8.699,0.0002000000000000668
EWT-2,6/28/2025,05:50:00 am,0,2025-06-28 05:50:00,8.4803,8.701,0.0
EWT-2,6/28/2025,06:00:00 am,0,2025-06-28 06:00:00,8.4819,8.701,0.00010000000000012221
EWT-2,6/28/2025,06:10:00 am,0,2025-06-28 06:10:00,8.4836,8.7,0.0
EWT-2,6/28/2025,06:20:00 am,0,2025-06-28 06:20:00,8.4853,8.7,9.999999999994457e-05
EWT-2,6/28/2025,06:30:00 am,0,2025-06-28 06:30:00,8.4867,8.699,9.999999999994457e-05
EWT-2,6/28/2025,06:40:00 am,0,2025-06-28 06:40:00,8.4879,8.698,9.999999999994457e-05
EWT-2,6/28/2025,06:50:00 am,0,2025-06-28 06:50:00,8.4892,8.699,0.0
EWT-2,6/28/2025,07:00:00 am,0,2025-06-28 07:00:00,8.4903,8.699,0.0
EWT-2,6/28/2025,07:10:00 am,0,2025-06-28 07:10:00,8.4913,8.699,0.0
EWT-2,6/28/2025,07:20:00 am,0,2025-06-28 07:20:00,8.4924,8.699,0.0002000000000000668
EWT-2,6/28/2025,07:30:00 am,0,2025-06-28 07:30:00,8.4935,8.701,0.00010000000000012221
EWT-2,6/28/2025,07:40:00 am,0,2025-06-28 07:40:00,8.4947,8.7,0.0
EWT-2,6/28/2025,07:50:00 am,0,2025-06-28 07:50:00,8.4959,8.7,9.999999999994457e-05
EWT-2,6/28/2025,08:00:00 am,0,2025-06-28 08:00:00,8.4969,8.699,0.0
EWT-2,6/28/2025,08:10:00 am,0,2025-06-28 08:10:00,8.4971,8.699,9.999999999994457e-05
EWT-2,6/28/2025,08:20:00 am,0,2025-06-28 08:20:00,8.4974,8.7,0.0
EWT-2,6/28/2025,08:30:00 am,0,2025-06-28 08:30:00,8.4976,8.7,9.999999999994457e-05
EWT-2,6/28/2025,08:40:00 am,0,2025-06-28 08:40:00,8.4977,8.699,0.0
EWT-2,6/28/2025,08:50:00 am,0,2025-06-28 08:50:00,8.4979,8.699,9.999999999994457e-05
EWT-2,6/28/2025,09:00:00 am,0,2025-06-28 09:00:00,8.4978,8.7,0.00019999999999988915
EWT-2,6/28/2025,09:10:00 am,0,2025-06-28 09:10:00,8.4975,8.698,9.999999999994457e-05
EWT-2,6/28/2025,09:20:00 am,0,2025-06-28 09:20:00,8.4974,8.699,9.999999999994457e-05
EWT-2,6/28/2025,09:30:00 am,0,2025-06-28 09:30:00,8.497,8.7,9.999999999994457e-05
EWT-2,6/28/2025,09:40:00 am,0,2025-06-28 09:40:00,8.4966,8.699,0.0
EWT-2,6/28/2025,09:50:00 am,0,2025-06-28 09:50:00,8.4963,8.699,9.999999999994457e-05
EWT-2,6/28/2025,10:00:00 am,0,2025-06-28 10:00:00,8.496,8.7,9.999999999994457e-05
EWT-2,6/28/2025,10:10:00 am,0,2025-06-28 10:10:00,8.4952,8.699,9.999999999994457e-05
EWT-2,6/28/2025,10:20:00 am,0,2025-06-28 10:20:00,8.4948,8.7,0.00010000000000012221
EWT-2,6/28/2025,10:30:00 am,0,2025-06-28 10:30:00,8.4944,8.701,0.00010000000000012221
EWT-2,6/28/2025,10:40:00 am,0,2025-06-28 10:40:00,8.4938,8.7,0.0
EWT-2,6/28/2025,10:50:00 am,0,2025-06-28 10:50:00,8.4931,8.7,0.0
EWT-2,6/28/2025,11:00:00 am,0,2025-06-28 11:00:00,8.4926,8.7,0.0
EWT-2,6/28/2025,11:10:00 am,0,2025-06-28 11:10:00,8.4918,8.7,9.999999999994457e-05
EWT-2,6/28/2025,11:20:00 am,0,2025-06-28 11:20:00,8.4908,8.699,0.0
EWT-2,6/28/2025,11:30:00 am,0,2025-06-28 11:30:00,8.4902,8.699,0.0002000000000000668
EWT-2,6/28/2025,11:40:00 am,0,2025-06-28 11:40:00,8.4894,8.701,0.0002000000000000668
EWT-2,6/28/2025,11:50:00 am,0,2025-06-28 11:50:00,8.4884,8.699,0.0002000000000000668
EWT-2,6/28/2025,12:00:00 pm,0,2025-06-28 12:00:00,8.4872,8.701,0.00010000000000012221
EWT-2,6/28/2025,12:10:00 pm,0,2025-06-28 12:10:00,8.4857,8.7,0.00010000000000012221
EWT-2,6/28/2025,12:20:00 pm,0,2025-06-28 12:20:00,8.4832,8.701,0.0
EWT-2,6/28/2025,12:30:00 pm,0,2025-06-28 12:30:00,8.4801,8.701,0.0
EWT-2,6/28/2025,12:40:00 pm,0,2025-06-28 12:40:00,8.4775,8.701,0.00010000000000012221
EWT-2,6/28/2025,12:50:00 pm,0,2025-06-28 12:50:00,8.4759,8.7,0.0
EWT-2,6/28/2025,01:00:00 pm,0,2025-06-28 13:00:00,8.4735,8.7,9.999999999994457e-05
EWT-2,6/28/2025,01:10:00 pm,0,2025-06-28 13:10:00,8.4675,8.699,9.999999999994457e-05
EWT-2,6/28/2025,01:20:00 pm,0,2025-06-28 13:20:00,8.4654,8.7,0.0
EWT-2,6/28/2025,01:30:00 pm,0,2025-06-28 13:30:00,8.4631,8.7,0.00010000000000012221
EWT-2,6/28/2025,01:40:00 pm,0,2025-06-28 13:40:00,8.4604,8.701,0.0
EWT-2,6/28/2025,01:50:00 pm,0,2025-06-28 13:50:00,8.4584,8.701,0.00010000000000012221
EWT-2,6/28/2025,02:00:00 pm,0,2025-06-28 14:00:00,8.4574,8.7,0.0
EWT-2,6/28/2025,02:10:00 pm,0,2025-06-28 14:10:00,8.4557,8.7,0.00010000000000012221
EWT-2,6/28/2025,02:20:00 pm,0,2025-06-28 14:20:00,8.4543,8.701,0.0002000000000000668
EWT-2,6/28/2025,02:30:00 pm,0,2025-06-28 14:30:00,8.4527,8.699,0.0002000000000000668
EWT-2,6/28/2025,02:40:00 pm,0,2025-06-28 14:40:00,8.4514,8.701,0.00010000000000012221
EWT-2,6/28/2025,02:50:00 pm,0,2025-06-28 14:50:00,8.4496,8.7,0.0002000000000000668
EWT-2,6/28/2025,03:00:00 pm,0,2025-06-28 15:00:00,8.4474,8.702,0.00030000000000001136
EWT-2,6/28/2025,03:10:00 pm,0,2025-06-28 15:10:00,8.4458,8.699,0.0
EWT-2,6/28/2025,03:20:00 pm,0,2025-06-28 15:20:00,8.4448,8.699,0.0
EWT-2,6/28/2025,03:30:00 pm,0,2025-06-28 15:30:00,8.4438,8.699,9.999999999994457e-05
EWT-2,6/28/2025,03:40:00 pm,0,2025-06-28 15:40:00,8.4428,8.698,0.00019999999999988915
EWT-2,6/28/2025,03:50:00 pm,0,2025-06-28 15:50:00,8.4419,8.7,9.999999999994457e-05
EWT-2,6/28/2025,04:00:00 pm,0,2025-06-28 16:00:00,8.441,8.699,0.0002000000000000668
EWT-2,6/28/2025,04:10:00 pm,0,2025-06-28 16:10:00,8.4397,8.701,0.00010000000000012221
EWT-2,6/28/2025,04:20:00 pm,0,2025-06-28 16:20:00,8.4383,8.7,0.00010000000000012221
EWT-2,6/28/2025,04:30:00 pm,0,2025-06-28 16:30:00,8.4368,8.701,0.00010000000000012221
EWT-2,6/28/2025,04:40:00 pm,0,2025-06-28 16:40:00,8.4359,8.7,0.0
EWT-2,6/28/2025,04:50:00 pm,0,2025-06-28 16:50:00,8.4343,8.7,9.999999999994457e-05
EWT-2,6/28/2025,05:00:00 pm,0,2025-06-28 17:00:00,8.4338,8.699,9.999999999994457e-05
EWT-2,6/28/2025,05:10:00 pm,0,2025-06-28 17:10:00,8.4321,8.7,0.00010000000000012221
EWT-2,6/28/2025,05:20:00 pm,0,2025-06-28 17:20:00,8.4274,8.701,0.0002000000000000668
EWT-2,6/28/2025,05:30:00 pm,0,2025-06-28 17:30:00,8.426,8.699,9.999999999994457e-05
EWT-2,6/28/2025,05:40:00 pm,0,2025-06-28 17:40:00,8.4252,8.7,9.999999999994457e-05
EWT-2,6/28/2025,05:50:00 pm,0,2025-06-28 17:50:00,8.4241,8.699,0.0
EWT-2,6/28/2025,06:00:00 pm,0,2025-06-28 18:00:00,8.4235,8.699,0.00030000000000001136
EWT-2,6/28/2025,06:10:00 pm,0,2025-06-28 18:10:00,8.4232,8.702,0.00030000000000001136
EWT-2,6/28/2025,06:20:00 pm,0,2025-06-28 18:20:00,8.4227,8.699,9.999999999994457e-05
EWT-2,6/28/2025,06:30:00 pm,0,2025-06-28 18:30:00,8.4221,8.7,9.999999999994457e-05
EWT-2,6/28/2025,06:40:00 pm,0,2025-06-28 18:40:00,8.4222,8.699,9.999999999994457e-05
EWT-2,6/28/2025,06:50:00 pm,0,2025-06-28 18:50:00,8.4221,8.7,0.00019999999999988915
EWT-2,6/28/2025,07:00:00 pm,0,2025-06-28 19:00:00,8.4219,8.698,9.999999999994457e-05
EWT-2,6/28/2025,07:10:00 pm,0,2025-06-28 19:10:00,8.4218,8.699,0.00030000000000001136
EWT-2,6/28/2025,07:20:00 pm,0,2025-06-28 19:20:00,8.4217,8.702,9.999999999994457e-05
EWT-2,6/28/2025,07:30:00 pm,0,2025-06-28 19:30:00,8.4217,8.701,0.00010000000000012221
EWT-2,6/28/2025,07:40:00 pm,0,2025-06-28 19:40:00,8.4219,8.7,0.0
EWT-2,6/28/2025,07:50:00 pm,0,2025-06-28 19:50:00,8.422,8.7,9.999999999994457e-05
EWT-2,6/28/2025,08:00:00 pm,0,2025-06-28 20:00:00,8.422,8.699,0.0002000000000000668
EWT-2,6/28/2025,08:10:00 pm,0,2025-06-28 20:10:00,8.422,8.701,0.00010000000000012221
EWT-2,6/28/2025,08:20:00 pm,0,2025-06-28 20:20:00,8.4221,8.7,0.0002000000000000668
EWT-2,6/28/2025,08:30:00 pm,0,2025-06-28 20:30:00,8.4224,8.702,0.0002000000000000668
EWT-2,6/28/2025,08:40:00 pm,0,2025-06-28 20:40:00,8.4229,8.7,0.00019999999999988915
EWT-2,6/28/2025,08:50:00 pm,0,2025-06-28 20:50:00,8.4235,8.698,0.00030000000000001136
EWT-2,6/28/2025,09:00:00 pm,0,2025-06-28 21:00:00,8.4244,8.701,9.999999999994457e-05
EWT-2,6/28/2025,09:10:00 pm,0,2025-06-28 21:10:00,8.4257,8.702,9.999999999994457e-05
EWT-2,6/28/2025,09:20:00 pm,0,2025-06-28 21:20:00,8.4272,8.701,0.0002000000000000668
EWT-2,6/28/2025,09:30:00 pm,0,2025-06-28 21:30:00,8.4289,8.699,9.999999999994457e-05
EWT-2,6/28/2025,09:40:00 pm,0,2025-06-28 21:40:00,8.4292,8.7,9.999999999994457e-05
EWT-2,6/28/2025,09:50:00 pm,0,2025-06-28 21:50:00,8.4294,8.699,0.0002000000000000668
EWT-2,6/28/2025,10:00:00 pm,0,2025-06-28 22:00:00,8.4298,8.701,0.0
EWT-2,6/28/2025,10:10:00 pm,0,2025-06-28 22:10:00,8.4302,8.701,0.00010000000000012221
EWT-2,6/28/2025,10:20:00 pm,0,2025-06-28 22:20:00,8.4303,8.7,0.00010000000000012221
EWT-2,6/28/2025,10:30:00 pm,0,2025-06-28 22:30:00,8.4306,8.701,0.0002000000000000668
EWT-2,6/28/2025,10:40:00 pm,0,2025-06-28 22:40:00,8.431,8.699,0.0002000000000000668
EWT-2,6/28/2025,10:50:00 pm,0,2025-06-28 22:50:00,8.4316,8.701,0.00010000000000012221
EWT-2,6/28/2025,11:00:00 pm,0,2025-06-28 23:00:00,8.4314,8.7,0.00010000000000012221
EWT-2,6/28/2025,11:10:00 pm,0,2025-06-28 23:10:00,8.4317,8.701,0.0
EWT-2,6/28/2025,11:20:00 pm,0,2025-06-28 23:20:00,8.4323,8.701,9.999999999994457e-05
EWT-2,6/28/2025,11:30:00 pm,0,2025-06-28 23:30:00,8.4325,8.702,0.0002000000000000668
EWT-2,6/28/2025,11:40:00 pm,0,2025-06-28 23:40:00,8.4338,8.7,0.0
EWT-2,6/28/2025,11:50:00 pm,0,2025-06-28 23:50:00,8.4344,8.7,0.00010000000000012221
EWT-2,6/29/2025,12:00:00 am,0,2025-06-29 00:00:00,8.4351,8.701,0.00010000000000012221
EWT-2,6/29/2025,12:10:00 am,0,2025-06-29 00:10:00,8.4354,8.7,0.00010000000000012221
EWT-2,6/29/2025,12:20:00 am,0,2025-06-29 00:20:00,8.4357,8.701,0.00010000000000012221
EWT-2,6/29/2025,12:30:00 am,0,2025-06-29 00:30:00,8.4361,8.7,0.0
EWT-2,6/29/2025,12:40:00 am,0,2025-06-29 00:40:00,8.4359,8.7,0.0
EWT-2,6/29/2025,12:50:00 am,0,2025-06-29 00:50:00,8.4362,8.7,9.999999999994457e-05
EWT-2,6/29/2025,01:00:00 am,0,2025-06-29 01:00:00,8.4368,8.699,0.0002000000000000668
EWT-2,6/29/2025,01:10:00 am,0,2025-06-29 01:10:00,8.4379,8.701,0.00010000000000012221
EWT-2,6/29/2025,01:20:00 am,0,2025-06-29 01:20:00,8.4385,8.7,9.999999999994457e-05
EWT-2,6/29/2025,01:30:00 am,0,2025-06-29 01:30:00,8.4392,8.699,9.999999999994457e-05
EWT-2,6/29/2025,01:40:00 am,0,2025-06-29 01:40:00,8.44,8.7,0.0
EWT-2,6/29/2025,01:50:00 am,0,2025-06-29 01:50:00,8.4406,8.7,0.00010000000000012221
EWT-2,6/29/2025,02:00:00 am,0,2025-06-29 02:00:00,8.4412,8.701,9.999999999994457e-05
EWT-2,6/29/2025,02:10:00 am,0,2025-06-29 02:10:00,8.4417,8.702,0.00030000000000001136
EWT-2,6/29/2025,02:20:00 am,0,2025-06-29 02:20:00,8.442,8.699,0.0002000000000000668
EWT-2,6/29/2025,02:30:00 am,0,2025-06-29 02:30:00,8.4423,8.701,0.00010000000000012221
EWT-2,6/29/2025,02:40:00 am,0,2025-06-29 02:40:00,8.4426,8.7,9.999999999994457e-05
EWT-2,6/29/2025,02:50:00 am,0,2025-06-29 02:50:00,8.4431,8.699,0.0
EWT-2,6/29/2025,03:00:00 am,0,2025-06-29 03:00:00,8.4433,8.699,0.0002000000000000668
EWT-2,6/29/2025,03:10:00 am,0,2025-06-29 03:10:00,8.4437,8.701,0.00030000000000001136
EWT-2,6/29/2025,03:20:00 am,0,2025-06-29 03:20:00,8.4439,8.698,0.0
EWT-2,6/29/2025,03:30:00 am,0,2025-06-29 03:30:00,8.4444,8.698,0.00039999999999995595
EWT-2,6/29/2025,03:40:00 am,0,2025-06-29 03:40:00,8.4445,8.702,9.999999999994457e-05
EWT-2,6/29/2025,03:50:00 am,0,2025-06-29 03:50:00,8.445,8.701,9.999999999994457e-05
EWT-2,6/29/2025,04:00:00 am,0,2025-06-29 04:00:00,8.4453,8.702,0.0002000000000000668
EWT-2,6/29/2025,04:10:00 am,0,2025-06-29 04:10:00,8.4463,8.7,0.0
EWT-2,6/29/2025,04:20:00 am,0,2025-06-29 04:20:00,8.4474,8.7,0.0
EWT-2,6/29/2025,04:30:00 am,0,2025-06-29 04:30:00,8.4481,8.7,0.00010000000000012221
EWT-2,6/29/2025,04:40:00 am,0,2025-06-29 04:40:00,8.4491,8.701,0.0
EWT-2,6/29/2025,04:50:00 am,0,2025-06-29 04:50:00,8.4498,8.701,9.999999999994457e-05
EWT-2,6/29/2025,05:00:00 am,0,2025-06-29 05:00:00,8.4513,8.702,0.00030000000000001136
EWT-2,6/29/2025,05:10:00 am,0,2025-06-29 05:10:00,8.4525,8.699,0.0002000000000000668
EWT-2,6/29/2025,05:20:00 am,0,2025-06-29 05:20:00,8.4532,8.701,0.0
EWT-2,6/29/2025,05:30:00 am,0,2025-06-29 05:30:00,8.4544,8.701,0.00010000000000012221
EWT-2,6/29/2025,05:40:00 am,0,2025-06-29 05:40:00,8.456,8.7,0.0002000000000000668
EWT-2,6/29/2025,05:50:00 am,0,2025-06-29 05:50:00,8.457,8.702,0.0
EWT-2,6/29/2025,06:00:00 am,0,2025-06-29 06:00:00,8.4581,8.702,0.0002000000000000668
EWT-2,6/29/2025,06:10:00 am,0,2025-06-29 06:10:00,8.4593,8.7,0.0
EWT-2,6/29/2025,06:20:00 am,0,2025-06-29 06:20:00,8.4602,8.7,0.0
EWT-2,6/29/2025,06:30:00 am,0,2025-06-29 06:30:00,8.4614,8.7,0.0
EWT-2,6/29/2025,06:40:00 am,0,2025-06-29 06:40:00,8.4624,8.7,0.00010000000000012221
EWT-2,6/29/2025,06:50:00 am,0,2025-06-29 06:50:00,8.4639,8.701,0.0
EWT-2,6/29/2025,07:00:00 am,0,2025-06-29 07:00:00,8.4643,8.701,0.00010000000000012221
EWT-2,6/29/2025,07:10:00 am,0,2025-06-29 07:10:00,8.4646,8.7,0.0
EWT-2,6/29/2025,07:20:00 am,0,2025-06-29 07:20:00,8.4648,8.7,0.00010000000000012221
EWT-2,6/29/2025,07:30:00 am,0,2025-06-29 07:30:00,8.4652,8.701,0.0
EWT-2,6/29/2025,07:40:00 am,0,2025-06-29 07:40:00,8.465,8.701,0.0
EWT-2,6/29/2025,07:50:00 am,0,2025-06-29 07:50:00,8.4652,8.701,0.0
EWT-2,6/29/2025,08:00:00 am,0,2025-06-29 08:00:00,8.4655,8.701,0.00010000000000012221
EWT-2,6/29/2025,08:10:00 am,0,2025-06-29 08:10:00,8.4658,8.7,0.0
EWT-2,6/29/2025,08:20:00 am,0,2025-06-29 08:20:00,8.4661,8.7,0.0
EWT-2,6/29/2025,08:30:00 am,0,2025-06-29 08:30:00,8.4665,8.7,0.0
EWT-2,6/29/2025,08:40:00 am,0,2025-06-29 08:40:00,8.4667,8.7,0.0
EWT-2,6/29/2025,08:50:00 am,0,2025-06-29 08:50:00,8.4668,8.7,0.0
EWT-2,6/29/2025,09:00:00 am,0,2025-06-29 09:00:00,8.4669,8.7,9.999999999994457e-05
EWT-2,6/29/2025,09:10:00 am,0,2025-06-29 09:10:00,8.4669,8.699,9.999999999994457e-05
EWT-2,6/29/2025,09:20:00 am,0,2025-06-29 09:20:00,8.4668,8.7,0.0002000000000000668
EWT-2,6/29/2025,09:30:00 am,0,2025-06-29 09:30:00,8.4664,8.702,0.00030000000000001136
EWT-2,6/29/2025,09:40:00 am,0,2025-06-29 09:40:00,8.4661,8.699,0.00030000000000001136
EWT-2,6/29/2025,09:50:00 am,0,2025-06-29 09:50:00,8.4658,8.702,9.999999999994457e-05
EWT-2,6/29/2025,10:00:00 am,0,2025-06-29 10:00:00,8.4654,8.703,0.00030000000000001136
EWT-2,6/29/2025,10:10:00 am,0,2025-06-29 10:10:00,8.4651,8.7,0.00010000000000012221
EWT-2,6/29/2025,10:20:00 am,0,2025-06-29 10:20:00,8.4647,8.701,0.0
EWT-2,6/29/2025,10:30:00 am,0,2025-06-29 10:30:00,8.4642,8.701,0.00030000000000001136
EWT-2,6/29/2025,10:40:00 am,0,2025-06-29 10:40:00,8.4638,8.704,0.00030000000000001136
EWT-2,6/29/2025,10:50:00 am,0,2025-06-29 10:50:00,8.4631,8.701,0.00010000000000012221
EWT-2,6/29/2025,11:00:00 am,0,2025-06-29 11:00:00,8.4623,8.7,0.0004000000000001336
EWT-2,6/29/2025,11:10:00 am,0,2025-06-29 11:10:00,8.4617,8.704,0.0002000000000000668
EWT-2,6/29/2025,11:20:00 am,0,2025-06-29 11:20:00,8.461,8.702,9.999999999994457e-05
EWT-2,6/29/2025,11:30:00 am,0,2025-06-29 11:30:00,8.4604,8.701,0.0
EWT-2,6/29/2025,11:40:00 am,0,2025-06-29 11:40:00,8.4598,8.701,0.0
EWT-2,6/29/2025,11:50:00 am,0,2025-06-29 11:50:00,8.4591,8.701,9.999999999994457e-05
EWT-2,6/29/2025,12:00:00 pm,0,2025-06-29 12:00:00,8.4583,8.702,0.0
EWT-2,6/29/2025,12:10:00 pm,0,2025-06-29 12:10:00,8.4573,8.702,0.0
EWT-2,6/29/2025,12:20:00 pm,0,2025-06-29 12:20:00,8.4565,8.702,9.999999999994457e-05
EWT-2,6/29/2025,12:30:00 pm,0,2025-06-29 12:30:00,8.4556,8.703,0.00030000000000001136
EWT-2,6/29/2025,12:40:00 pm,0,2025-06-29 12:40:00,8.4548,8.7,0.0002000000000000668
EWT-2,6/29/2025,12:50:00 pm,0,2025-06-29 12:50:00,8.4537,8.702,0.0
EWT-2,6/29/2025,01:00:00 pm,0,2025-06-29 13:00:00,8.453,8.702,0.0002000000000000668
EWT-2,6/29/2025,01:10:00 pm,0,2025-06-29 13:10:00,8.4519,8.704,0.00010000000000012221
EWT-2,6/29/2025,01:20:00 pm,0,2025-06-29 13:20:00,8.4501,8.703,0.00019999999999988915
EWT-2,6/29/2025,01:30:00 pm,0,2025-06-29 13:30:00,8.4479,8.701,0.0
EWT-2,6/29/2025,01:40:00 pm,0,2025-06-29 13:40:00,8.4456,8.701,0.00019999999999988915
EWT-2,6/29/2025,01:50:00 pm,0,2025-06-29 13:50:00,8.4435,8.703,0.00019999999999988915
EWT-2,6/29/2025,02:00:00 pm,0,2025-06-29 14:00:00,8.442,8.701,9.999999999994457e-05
EWT-2,6/29/2025,02:10:00 pm,0,2025-06-29 14:10:00,8.4406,8.702,9.999999999994457e-05
EWT-2,6/29/2025,02:20:00 pm,0,2025-06-29 14:20:00,8.4385,8.701,0.0
EWT-2,6/29/2025,02:30:00 pm,0,2025-06-29 14:30:00,8.4371,8.701,9.999999999994457e-05
EWT-2,6/29/2025,02:40:00 pm,0,2025-06-29 14:40:00,8.4307,8.702,9.999999999994457e-05
EWT-2,6/29/2025,02:50:00 pm,0,2025-06-29 14:50:00,8.4272,8.703,9.999999999994457e-05
EWT-2,6/29/2025,03:00:00 pm,0,2025-06-29 15:00:00,8.4251,8.702,0.0
EWT-2,6/29/2025,03:10:00 pm,0,2025-06-29 15:10:00,8.4237,8.702,9.999999999994457e-05
EWT-2,6/29/2025,03:20:00 pm,0,2025-06-29 15:20:00,8.4227,8.703,9.999999999994457e-05
EWT-2,6/29/2025,03:30:00 pm,0,2025-06-29 15:30:00,8.4214,8.702,0.0002000000000000668
EWT-2,6/29/2025,03:40:00 pm,0,2025-06-29 15:40:00,8.4205,8.704,0.00030000000000001136
EWT-2,6/29/2025,03:50:00 pm,0,2025-06-29 15:50:00,8.4192,8.701,9.999999999994457e-05
EWT-2,6/29/2025,04:00:00 pm,0,2025-06-29 16:00:00,8.4176,8.702,0.0
EWT-2,6/29/2025,04:10:00 pm,0,2025-06-29 16:10:00,8.4125,8.702,9.999999999994457e-05
EWT-2,6/29/2025,04:20:00 pm,0,2025-06-29 16:20:00,8.4101,8.703,0.0
EWT-2,6/29/2025,04:30:00 pm,0,2025-06-29 16:30:00,8.4086,8.703,0.0002000000000000668
EWT-2,6/29/2025,04:40:00 pm,0,2025-06-29 16:40:00,8.4068,8.705,0.00030000000000001136
EWT-2,6/29/2025,04:50:00 pm,0,2025-06-29 16:50:00,8.4059,8.702,0.0
EWT-2,6/29/2025,05:00:00 pm,0,2025-06-29 17:00:00,8.4047,8.702,9.999999999994457e-05
EWT-2,6/29/2025,05:10:00 pm,0,2025-06-29 17:10:00,8.4032,8.703,0.0
EWT-2,6/29/2025,05:20:00 pm,0,2025-06-29 17:20:00,8.4024,8.703,9.999999999994457e-05
EWT-2,6/29/2025,05:30:00 pm,0,2025-06-29 17:30:00,8.4014,8.702,0.0
EWT-2,6/29/2025,05:40:00 pm,0,2025-06-29 17:40:00,8.4004,8.702,9.999999999994457e-05
EWT-2,6/29/2025,05:50:00 pm,0,2025-06-29 17:50:00,8.3995,8.703,9.999999999994457e-05
EWT-2,6/29/2025,06:00:00 pm,0,2025-06-29 18:00:00,8.3982,8.702,9.999999999994457e-05
EWT-2,6/29/2025,06:10:00 pm,0,2025-06-29 18:10:00,8.3975,8.701,0.0
EWT-2,6/29/2025,06:20:00 pm,0,2025-06-29 18:20:00,8.3966,8.701,0.00030000000000001136
EWT-2,6/29/2025,06:30:00 pm,0,2025-06-29 18:30:00,8.3959,8.704,0.00030000000000001136
EWT-2,6/29/2025,06:40:00 pm,0,2025-06-29 18:40:00,8.3953,8.701,0.00030000000000001136
EWT-2,6/29/2025,06:50:00 pm,0,2025-06-29 18:50:00,8.3945,8.704,0.0002000000000000668
EWT-2,6/29/2025,07:00:00 pm,0,2025-06-29 19:00:00,8.3943,8.702,0.00030000000000001136
EWT-2,6/29/2025,07:10:00 pm,0,2025-06-29 19:10:00,8.3941,8.705,0.0002000000000000668
EWT-2,6/29/2025,07:20:00 pm,0,2025-06-29 19:20:00,8.394,8.703,9.999999999994457e-05
EWT-2,6/29/2025,07:30:00 pm,0,2025-06-29 19:30:00,8.3938,8.702,9.999999999994457e-05
EWT-2,6/29/2025,07:40:00 pm,0,2025-06-29 19:40:00,8.3935,8.703,0.0
EWT-2,6/29/2025,07:50:00 pm,0,2025-06-29 19:50:00,8.3934,8.703,0.0
EWT-2,6/29/2025,08:00:00 pm,0,2025-06-29 20:00:00,8.393,8.703,0.0
EWT-2,6/29/2025,08:10:00 pm,0,2025-06-29 20:10:00,8.3931,8.703,0.0
EWT-2,6/29/2025,08:20:00 pm,0,2025-06-29 20:20:00,8.3929,8.703,9.999999999994457e-05
EWT-2,6/29/2025,08:30:00 pm,0,2025-06-29 20:30:00,8.3929,8.702,9.999999999994457e-05
EWT-2,6/29/2025,08:40:00 pm,0,2025-06-29 20:40:00,8.3931,8.703,0.0002000000000000668
EWT-2,6/29/2025,08:50:00 pm,0,2025-06-29 20:50:00,8.393,8.705,0.00030000000000001136
EWT-2,6/29/2025,09:00:00 pm,0,2025-06-29 21:00:00,8.3932,8.702,0.0002000000000000668
EWT-2,6/29/2025,09:10:00 pm,0,2025-06-29 21:10:00,8.3936,8.704,0.0
EWT-2,6/29/2025,09:20:00 pm,0,2025-06-29 21:20:00,8.3937,8.704,0.0002000000000000668
EWT-2,6/29/2025,09:30:00 pm,0,2025-06-29 21:30:00,8.3941,8.702,9.999999999994457e-05
EWT-2,6/29/2025,09:40:00 pm,0,2025-06-29 21:40:00,8.3944,8.703,0.00010000000000012221
EWT-2,6/29/2025,09:50:00 pm,0,2025-06-29 21:50:00,8.3943,8.704,0.0
EWT-2,6/29/2025,10:00:00 pm,0,2025-06-29 22:00:00,8.3944,8.704,0.0
EWT-2,6/29/2025,10:10:00 pm,0,2025-06-29 22:10:00,8.3948,8.704,0.00030000000000001136
EWT-2,6/29/2025,10:20:00 pm,0,2025-06-29 22:20:00,8.3946,8.701,0.0
EWT-2,6/29/2025,10:30:00 pm,0,2025-06-29 22:30:00,8.3946,8.701,9.999999999994457e-05
EWT-2,6/29/2025,10:40:00 pm,0,2025-06-29 22:40:00,8.3946,8.702,0.00030000000000001136
EWT-2,6/29/2025,10:50:00 pm,0,2025-06-29 22:50:00,8.3945,8.705,0.00030000000000001136
EWT-2,6/29/2025,11:00:00 pm,0,2025-06-29 23:00:00,8.3949,8.702,9.999999999994457e-05
EWT-2,6/29/2025,11:10:00 pm,0,2025-06-29 23:10:00,8.3951,8.703,0.0
EWT-2,6/29/2025,11:20:00 pm,0,2025-06-29 23:20:00,8.3953,8.703,9.999999999994457e-05
EWT-2,6/29/2025,11:30:00 pm,0,2025-06-29 23:30:00,8.3952,8.702,9.999999999994457e-05
EWT-2,6/29/2025,11:40:00 pm,0,2025-06-29 23:40:00,8.3952,8.703,0.0
EWT-2,6/29/2025,11:50:00 pm,0,2025-06-29 23:50:00,8.395,8.703,0.00010000000000012221
EWT-2,6/30/2025,12:00:00 am,0,2025-06-30 00:00:00,8.395,8.704,0.00010000000000012221
EWT-2,6/30/2025,12:10:00 am,0,2025-06-30 00:10:00,8.395,8.703,0.0
EWT-2,6/30/2025,12:20:00 am,0,2025-06-30 00:20:00,8.395,8.703,0.0002000000000000668
EWT-2,6/30/2025,12:30:00 am,0,2025-06-30 00:30:00,8.3949,8.705,0.0
EWT-2,6/30/2025,12:40:00 am,0,2025-06-30 00:40:00,8.3946,8.705,0.0
EWT-2,6/30/2025,12:50:00 am,0,2025-06-30 00:50:00,8.3949,8.705,0.0
EWT-2,6/30/2025,01:00:00 am,0,2025-06-30 01:00:00,8.3949,8.705,0.0
EWT-2,6/30/2025,01:10:00 am,0,2025-06-30 01:10:00,8.3946,8.705,9.999999999994457e-05
EWT-2,6/30/2025,01:20:00 am,0,2025-06-30 01:20:00,8.3947,8.704,0.0
EWT-2,6/30/2025,01:30:00 am,0,2025-06-30 01:30:00,8.3944,8.704,0.00010000000000012221
EWT-2,6/30/2025,01:40:00 am,0,2025-06-30 01:40:00,8.3944,8.703,0.00010000000000012221
EWT-2,6/30/2025,01:50:00 am,0,2025-06-30 01:50:00,8.3946,8.704,9.999999999994457e-05
EWT-2,6/30/2025,02:00:00 am,0,2025-06-30 02:00:00,8.3944,8.705,9.999999999994457e-05
EWT-2,6/30/2025,02:10:00 am,0,2025-06-30 02:10:00,8.3942,8.704,0.00010000000000012221
EWT-2,6/30/2025,02:20:00 am,0,2025-06-30 02:20:00,8.3946,8.703,9.999999999994457e-05
EWT-2,6/30/2025,02:30:00 am,0,2025-06-30 02:30:00,8.3949,8.702,0.00039999999999995595
EWT-2,6/30/2025,02:40:00 am,0,2025-06-30 02:40:00,8.3951,8.706,0.00019999999999988915
EWT-2,6/30/2025,02:50:00 am,0,2025-06-30 02:50:00,8.3953,8.704,0.0
EWT-2,6/30/2025,03:00:00 am,0,2025-06-30 03:00:00,8.3963,8.704,0.00030000000000001136
EWT-2,6/30/2025,03:10:00 am,0,2025-06-30 03:10:00,8.3966,8.707,0.0002000000000000668
EWT-2,6/30/2025,03:20:00 am,0,2025-06-30 03:20:00,8.3972,8.705,9.999999999994457e-05
EWT-2,6/30/2025,03:30:00 am,0,2025-06-30 03:30:00,8.3976,8.704,0.0
EWT-2,6/30/2025,03:40:00 am,0,2025-06-30 03:40:00,8.3981,8.704,0.00030000000000001136
EWT-2,6/30/2025,03:50:00 am,0,2025-06-30 03:50:00,8.3982,8.707,0.00030000000000001136
EWT-2,6/30/2025,04:00:00 am,0,2025-06-30 04:00:00,8.3983,8.704,0.00019999999999988915
EWT-2,6/30/2025,04:10:00 am,0,2025-06-30 04:10:00,8.3984,8.706,9.999999999994457e-05
EWT-2,6/30/2025,04:20:00 am,0,2025-06-30 04:20:00,8.399,8.705,0.0
EWT-2,6/30/2025,04:30:00 am,0,2025-06-30 04:30:00,8.3995,8.705,9.999999999994457e-05
EWT-2,6/30/2025,04:40:00 am,0,2025-06-30 04:40:00,8.4002,8.704,0.0
EWT-2,6/30/2025,04:50:00 am,0,2025-06-30 04:50:00,8.4004,8.704,9.999999999994457e-05
EWT-2,6/30/2025,05:00:00 am,0,2025-06-30 05:00:00,8.4009,8.705,9.999999999994457e-05
EWT-2,6/30/2025,05:10:00 am,0,2025-06-30 05:10:00,8.401,8.706,0.0
EWT-2,6/30/2025,05:20:00 am,0,2025-06-30 05:20:00,8.401,8.706,0.00019999999999988915
EWT-2,6/30/2025,05:30:00 am,0,2025-06-30 05:30:00,8.4021,8.704,0.00010000000000012221
EWT-2,6/30/2025,05:40:00 am,0,2025-06-30 05:40:00,8.4032,8.703,0.0002000000000000668
EWT-2,6/30/2025,05:50:00 am,0,2025-06-30 05:50:00,8.4045,8.705,0.0
EWT-2,6/30/2025,06:00:00 am,0,2025-06-30 06:00:00,8.4046,8.705,9.999999999994457e-05
EWT-2,6/30/2025,06:10:00 am,0,2025-06-30 06:10:00,8.4048,8.706,0.0
EWT-2,6/30/2025,06:20:00 am,0,2025-06-30 06:20:00,8.4055,8.706,0.0
EWT-2,6/30/2025,06:30:00 am,0,2025-06-30 06:30:00,8.4061,8.706,0.0
EWT-2,6/30/2025,06:40:00 am,0,2025-06-30 06:40:00,8.4071,8.706,0.00019999999999988915
EWT-2,6/30/2025,06:50:00 am,0,2025-06-30 06:50:00,8.4077,8.704,0.0
EWT-2,6/30/2025,07:00:00 am,0,2025-06-30 07:00:00,8.4085,8.704,0.0
EWT-2,6/30/2025,07:10:00 am,0,2025-06-30 07:10:00,8.4096,8.704,0.00019999999999988915
EWT-2,6/30/2025,07:20:00 am,0,2025-06-30 07:20:00,8.411,8.706,0.00010000000000012221
EWT-2,6/30/2025,07:30:00 am,0,2025-06-30 07:30:00,8.4123,8.707,0.0002000000000000668
EWT-2,6/30/2025,07:40:00 am,0,2025-06-30 07:40:00,8.4137,8.705,0.0
EWT-2,6/30/2025,07:50:00 am,0,2025-06-30 07:50:00,8.4144,8.705,9.999999999994457e-05
EWT-2,6/30/2025,08:00:00 am,0,2025-06-30 08:00:00,8.4152,8.704,0.00019999999999988915
EWT-2,6/30/2025,08:10:00 am,0,2025-06-30 08:10:00,8.4153,8.706,9.999999999994457e-05
EWT-2,6/30/2025,08:20:00 am,0,2025-06-30 08:20:00,8.4157,8.705,0.0002000000000000668
EWT-2,6/30/2025,08:30:00 am,0,2025-06-30 08:30:00,8.416,8.703,0.0002000000000000668
EWT-2,6/30/2025,08:40:00 am,0,2025-06-30 08:40:00,8.4167,8.705,9.999999999994457e-05
EWT-2,6/30/2025,08:50:00 am,0,2025-06-30 08:50:00,8.4176,8.706,9.999999999994457e-05
EWT-2,6/30/2025,09:00:00 am,0,2025-06-30 09:00:00,8.4184,8.705,9.999999999994457e-05
EWT-2,6/30/2025,09:10:00 am,0,2025-06-30 09:10:00,8.4183,8.706,0.0
EWT-2,6/30/2025,09:20:00 am,0,2025-06-30 09:20:00,8.4185,8.706,0.00010000000000012221
EWT-2,6/30/2025,09:30:00 am,0,2025-06-30 09:30:00,8.4179,8.707,0.0002000000000000668
EWT-2,6/30/2025,09:40:00 am,0,2025-06-30 09:40:00,8.4176,8.705,0.0002000000000000668
EWT-2,6/30/2025,09:50:00 am,0,2025-06-30 09:50:00,8.4174,8.707,0.00010000000000012221
EWT-2,6/30/2025,10:00:00 am,0,2025-06-30 10:00:00,8.4171,8.706,9.999999999994457e-05
EWT-2,6/30/2025,10:10:00 am,0,2025-06-30 10:10:00,8.4169,8.705,9.999999999994457e-05
EWT-2,6/30/2025,10:20:00 am,0,2025-06-30 10:20:00,8.4163,8.706,0.0
EWT-2,6/30/2025,10:30:00 am,0,2025-06-30 10:30:00,8.4162,8.706,0.0
EWT-2,6/30/2025,10:40:00 am,0,2025-06-30 10:40:00,8.4157,8.706,0.00010000000000012221
EWT-2,6/30/2025,10:50:00 am,0,2025-06-30 10:50:00,8.4153,8.707,0.0
EWT-2,6/30/2025,11:00:00 am,0,2025-06-30 11:00:00,8.4148,8.707,0.0
EWT-2,6/30/2025,11:10:00 am,0,2025-06-30 11:10:00,8.4145,8.707,0.0
EWT-2,6/30/2025,11:20:00 am,0,2025-06-30 11:20:00,8.4138,8.707,0.0
EWT-2,6/30/2025,11:30:00 am,0,2025-06-30 11:30:00,8.4133,8.707,0.0
EWT-2,6/30/2025,11:40:00 am,0,2025-06-30 11:40:00,8.4123,8.707,0.00019999999999988915
EWT-2,6/30/2025,11:50:00 am,0,2025-06-30 11:50:00,8.4117,8.709,0.00039999999999995595
EWT-2,6/30/2025,12:00:00 pm,0,2025-06-30 12:00:00,8.4108,8.705,0.00039999999999995595
EWT-2,6/30/2025,12:10:00 pm,0,2025-06-30 12:10:00,8.4097,8.709,0.00019999999999988915
EWT-2,6/30/2025,12:20:00 pm,0,2025-06-30 12:20:00,8.4084,8.707,9.999999999994457e-05
EWT-2,6/30/2025,12:30:00 pm,0,2025-06-30 12:30:00,8.4067,8.708,0.0
EWT-2,6/30/2025,12:40:00 pm,0,2025-06-30 12:40:00,8.4055,8.708,0.0002000000000000668
EWT-2,6/30/2025,12:50:00 pm,0,2025-06-30 12:50:00,8.4046,8.706,0.0002000000000000668
EWT-2,6/30/2025,01:00:00 pm,0,2025-06-30 13:00:00,8.403,8.708,0.0
EWT-2,6/30/2025,01:10:00 pm,0,2025-06-30 13:10:00,8.4018,8.708,9.999999999994457e-05
EWT-2,6/30/2025,01:20:00 pm,0,2025-06-30 13:20:00,8.4003,8.709,9.999999999994457e-05
EWT-2,6/30/2025,01:30:00 pm,0,2025-06-30 13:30:00,8.3988,8.708,0.0
EWT-2,6/30/2025,01:40:00 pm,0,2025-06-30 13:40:00,8.3969,8.708,0.0
EWT-2,6/30/2025,01:50:00 pm,0,2025-06-30 13:50:00,8.3956,8.708,0.0
EWT-2,6/30/2025,02:00:00 pm,0,2025-06-30 14:00:00,8.3941,8.708,9.999999999994457e-05
EWT-2,6/30/2025,02:10:00 pm,0,2025-06-30 14:10:00,8.3923,8.709,0.00019999999999988915
EWT-2,6/30/2025,02:20:00 pm,0,2025-06-30 14:20:00,8.3913,8.707,0.00039999999999995595
EWT-2,6/30/2025,02:30:00 pm,0,2025-06-30 14:30:00,8.3905,8.711,0.00030000000000001136
EWT-2,6/30/2025,02:40:00 pm,0,2025-06-30 14:40:00,8.3893,8.708,9.999999999994457e-05
EWT-2,6/30/2025,02:50:00 pm,0,2025-06-30 14:50:00,8.388,8.709,0.0
EWT-2,6/30/2025,03:00:00 pm,0,2025-06-30 15:00:00,8.3869,8.709,9.999999999994457e-05
EWT-2,6/30/2025,03:10:00 pm,0,2025-06-30 15:10:00,8.3855,8.708,9.999999999994457e-05
EWT-2,6/30/2025,03:20:00 pm,0,2025-06-30 15:20:00,8.3841,8.709,0.0
EWT-2,6/30/2025,03:30:00 pm,0,2025-06-30 15:30:00,8.3827,8.709,0.0
EWT-2,6/30/2025,03:40:00 pm,0,2025-06-30 15:40:00,8.3811,8.709,0.0
EWT-2,6/30/2025,03:50:00 pm,0,2025-06-30 15:50:00,8.3801,8.709,0.0
EWT-2,6/30/2025,04:00:00 pm,0,2025-06-30 16:00:00,8.3788,8.709,0.0
EWT-2,6/30/2025,04:10:00 pm,0,2025-06-30 16:10:00,8.3782,8.709,9.999999999994457e-05
EWT-2,6/30/2025,04:20:00 pm,0,2025-06-30 16:20:00,8.3774,8.708,0.0002000000000000668
EWT-2,6/30/2025,04:30:00 pm,0,2025-06-30 16:30:00,8.3767,8.71,9.999999999994457e-05
EWT-2,6/30/2025,04:40:00 pm,0,2025-06-30 16:40:00,8.3759,8.711,0.0002000000000000668
EWT-2,6/30/2025,04:50:00 pm,0,2025-06-30 16:50:00,8.3751,8.709,9.999999999994457e-05
EWT-2,6/30/2025,05:00:00 pm,0,2025-06-30 17:00:00,8.3746,8.708,0.0002000000000000668
EWT-2,6/30/2025,05:10:00 pm,0,2025-06-30 17:10:00,8.374,8.71,9.999999999994457e-05
EWT-2,6/30/2025,05:20:00 pm,0,2025-06-30 17:20:00,8.3731,8.711,0.0
EWT-2,6/30/2025,05:30:00 pm,0,2025-06-30 17:30:00,8.3724,8.711,0.0002000000000000668
EWT-2,6/30/2025,05:40:00 pm,0,2025-06-30 17:40:00,8.3714,8.709,9.999999999994457e-05
EWT-2,6/30/2025,05:50:00 pm,0,2025-06-30 17:50:00,8.3699,8.708,0.0002000000000000668
EWT-2,6/30/2025,06:00:00 pm,0,2025-06-30 18:00:00,8.3685,8.71,0.00010000000000012221
EWT-2,6/30/2025,06:10:00 pm,0,2025-06-30 18:10:00,8.3676,8.709,0.0
EWT-2,6/30/2025,06:20:00 pm,0,2025-06-30 18:20:00,8.367,8.709,0.0002000000000000668
EWT-2,6/30/2025,06:30:00 pm,0,2025-06-30 18:30:00,8.3667,8.711,9.999999999994457e-05
EWT-2,6/30/2025,06:40:00 pm,0,2025-06-30 18:40:00,8.366,8.71,0.00010000000000012221
EWT-2,6/30/2025,06:50:00 pm,0,2025-06-30 18:50:00,8.3658,8.709,0.0
EWT-2,6/30/2025,07:00:00 pm,0,2025-06-30 19:00:00,8.3658,8.709,0.0
EWT-2,6/30/2025,07:10:00 pm,0,2025-06-30 19:10:00,8.3654,8.709,0.00030000000000001136
EWT-2,6/30/2025,07:20:00 pm,0,2025-06-30 19:20:00,8.3658,8.712,0.0
EWT-2,6/30/2025,07:30:00 pm,0,2025-06-30 19:30:00,8.3656,8.712,0.00030000000000001136
EWT-2,6/30/2025,07:40:00 pm,0,2025-06-30 19:40:00,8.3655,8.709,0.0002000000000000668
EWT-2,6/30/2025,07:50:00 pm,0,2025-06-30 19:50:00,8.3655,8.711,9.999999999994457e-05
EWT-2,6/30/2025,08:00:00 pm,0,2025-06-30 20:00:00,8.3655,8.71,0.0
EWT-2,6/30/2025,08:10:00 pm,0,2025-06-30 20:10:00,8.3655,8.71,0.00010000000000012221
EWT-2,6/30/2025,08:20:00 pm,0,2025-06-30 20:20:00,8.3653,8.709,0.0002000000000000668
EWT-2,6/30/2025,08:30:00 pm,0,2025-06-30 20:30:00,8.3656,8.711,0.0
EWT-2,6/30/2025,08:40:00 pm,0,2025-06-30 20:40:00,8.3656,8.711,0.0
EWT-2,6/30/2025,08:50:00 pm,0,2025-06-30 20:50:00,8.3657,8.711,0.0
EWT-2,6/30/2025,09:00:00 pm,0,2025-06-30 21:00:00,8.366,8.711,0.0
EWT-2,6/30/2025,09:10:00 pm,0,2025-06-30 21:10:00,8.3664,8.711,9.999999999994457e-05
EWT-2,6/30/2025,09:20:00 pm,0,2025-06-30 21:20:00,8.3669,8.712,0.00019999999999988915
EWT-2,6/30/2025,09:30:00 pm,0,2025-06-30 21:30:00,8.3675,8.71,9.999999999994457e-05
EWT-2,6/30/2025,09:40:00 pm,0,2025-06-30 21:40:00,8.3683,8.711,9.999999999994457e-05
EWT-2,6/30/2025,09:50:00 pm,0,2025-06-30 21:50:00,8.3689,8.712,0.0
EWT-2,6/30/2025,10:00:00 pm,0,2025-06-30 22:00:00,8.3699,8.712,0.00019999999999988915
EWT-2,6/30/2025,10:10:00 pm,0,2025-06-30 22:10:00,8.3706,8.71,0.0
EWT-2,6/30/2025,10:20:00 pm,0,2025-06-30 22:20:00,8.3708,8.71,0.00019999999999988915
EWT-2,6/30/2025,10:30:00 pm,0,2025-06-30 22:30:00,8.3713,8.712,9.999999999994457e-05
EWT-2,6/30/2025,10:40:00 pm,0,2025-06-30 22:40:00,8.3717,8.713,0.0
EWT-2,6/30/2025,10:50:00 pm,0,2025-06-30 22:50:00,8.3725,8.713,9.999999999994457e-05
EWT-2,6/30/2025,11:00:00 pm,0,2025-06-30 23:00:00,8.3728,8.712,9.999999999994457e-05
EWT-2,6/30/2025,11:10:00 pm,0,2025-06-30 23:10:00,8.373,8.711,9.999999999994457e-05
EWT-2,6/30/2025,11:20:00 pm,0,2025-06-30 23:20:00,8.3732,8.712,9.999999999994457e-05
EWT-2,6/30/2025,11:30:00 pm,0,2025-06-30 23:30:00,8.3738,8.713,0.00019999999999988915
EWT-2,6/30/2025,11:40:00 pm,0,2025-06-30 23:40:00,8.3743,8.711,9.999999999994457e-05
EWT-2,6/30/2025,11:50:00 pm,0,2025-06-30 23:50:00,8.3753,8.712,0.0
EWT-2,7/1/2025,12:00:00 am,0,2025-07-01 00:00:00,8.3756,8.712,9.999999999994457e-05
EWT-2,7/1/2025,12:10:00 am,0,2025-07-01 00:10:00,8.3756,8.713,9.999999999994457e-05
EWT-2,7/1/2025,12:20:00 am,0,2025-07-01 00:20:00,8.3758,8.712,0.0
EWT-2,7/1/2025,12:30:00 am,0,2025-07-01 00:30:00,8.3757,8.712,9.999999999994457e-05
EWT-2,7/1/2025,12:40:00 am,0,2025-07-01 00:40:00,8.3756,8.713,0.0
EWT-2,7/1/2025,12:50:00 am,0,2025-07-01 00:50:00,8.3756,8.713,0.00019999999999988915
EWT-2,7/1/2025,01:00:00 am,0,2025-07-01 01:00:00,8.3755,8.711,9.999999999994457e-05
EWT-2,7/1/2025,01:10:00 am,0,2025-07-01 01:10:00,8.3759,8.712,0.0
EWT-2,7/1/2025,01:20:00 am,0,2025-07-01 01:20:00,8.3764,8.712,0.0
EWT-2,7/1/2025,01:30:00 am,0,2025-07-01 01:30:00,8.3767,8.712,0.0002000000000000668
EWT-2,7/1/2025,01:40:00 am,0,2025-07-01 01:40:00,8.3767,8.714,0.0002000000000000668
EWT-2,7/1/2025,01:50:00 am,0,2025-07-01 01:50:00,8.3764,8.712,0.0
EWT-2,7/1/2025,02:00:00 am,0,2025-07-01 02:00:00,8.3764,8.712,0.0002000000000000668
EWT-2,7/1/2025,02:10:00 am,0,2025-07-01 02:10:00,8.376,8.714,0.00010000000000012221
EWT-2,7/1/2025,02:20:00 am,0,2025-07-01 02:20:00,8.376,8.713,0.00010000000000012221
EWT-2,7/1/2025,02:30:00 am,0,2025-07-01 02:30:00,8.3758,8.714,0.0
EWT-2,7/1/2025,02:40:00 am,0,2025-07-01 02:40:00,8.3758,8.714,0.0
EWT-2,7/1/2025,02:50:00 am,0,2025-07-01 02:50:00,8.3755,8.714,0.00030000000000001136
EWT-2,7/1/2025,03:00:00 am,0,2025-07-01 03:00:00,8.3753,8.711,0.00019999999999988915
EWT-2,7/1/2025,03:10:00 am,0,2025-07-01 03:10:00,8.3756,8.713,0.00010000000000012221
EWT-2,7/1/2025,03:20:00 am,0,2025-07-01 03:20:00,8.3753,8.714,0.00010000000000012221
EWT-2,7/1/2025,03:30:00 am,0,2025-07-01 03:30:00,8.3752,8.713,0.0002000000000000668
EWT-2,7/1/2025,03:40:00 am,0,2025-07-01 03:40:00,8.3753,8.715,9.999999999994457e-05
EWT-2,7/1/2025,03:50:00 am,0,2025-07-01 03:50:00,8.3753,8.714,0.00030000000000001136
EWT-2,7/1/2025,04:00:00 am,0,2025-07-01 04:00:00,8.3752,8.717,0.00030000000000001136
EWT-2,7/1/2025,04:10:00 am,0,2025-07-01 04:10:00,8.375,8.714,0.0
EWT-2,7/1/2025,04:20:00 am,0,2025-07-01 04:20:00,8.3749,8.714,0.0
EWT-2,7/1/2025,04:30:00 am,0,2025-07-01 04:30:00,8.3748,8.714,9.999999999994457e-05
EWT-2,7/1/2025,04:40:00 am,0,2025-07-01 04:40:00,8.3752,8.715,9.999999999994457e-05
EWT-2,7/1/2025,04:50:00 am,0,2025-07-01 04:50:00,8.3752,8.714,0.00010000000000012221
EWT-2,7/1/2025,05:00:00 am,0,2025-07-01 05:00:00,8.3754,8.713,0.00010000000000012221
EWT-2,7/1/2025,05:10:00 am,0,2025-07-01 05:10:00,8.3761,8.714,9.999999999994457e-05
EWT-2,7/1/2025,05:20:00 am,0,2025-07-01 05:20:00,8.3773,8.715,9.999999999994457e-05
EWT-2,7/1/2025,05:30:00 am,0,2025-07-01 05:30:00,8.3782,8.716,0.00030000000000001136
EWT-2,7/1/2025,05:40:00 am,0,2025-07-01 05:40:00,8.379,8.713,0.00030000000000001136
EWT-2,7/1/2025,05:50:00 am,0,2025-07-01 05:50:00,8.3797,8.716,9.999999999994457e-05
EWT-2,7/1/2025,06:00:00 am,0,2025-07-01 06:00:00,8.3804,8.715,9.999999999994457e-05
EWT-2,7/1/2025,06:10:00 am,0,2025-07-01 06:10:00,8.3811,8.714,0.00010000000000012221
EWT-2,7/1/2025,06:20:00 am,0,2025-07-01 06:20:00,8.3819,8.713,0.00030000000000001136
EWT-2,7/1/2025,06:30:00 am,0,2025-07-01 06:30:00,8.3826,8.716,0.0
EWT-2,7/1/2025,06:40:00 am,0,2025-07-01 06:40:00,8.3826,8.716,0.0
EWT-2,7/1/2025,06:50:00 am,0,2025-07-01 06:50:00,8.3834,8.716,0.00010000000000012221
EWT-2,7/1/2025,07:00:00 am,0,2025-07-01 07:00:00,8.3839,8.717,0.0002000000000000668
EWT-2,7/1/2025,07:10:00 am,0,2025-07-01 07:10:00,8.3842,8.715,9.999999999994457e-05
EWT-2,7/1/2025,07:20:00 am,0,2025-07-01 07:20:00,8.3845,8.714,9.999999999994457e-05
EWT-2,7/1/2025,07:30:00 am,0,2025-07-01 07:30:00,8.3847,8.715,9.999999999994457e-05
EWT-2,7/1/2025,07:40:00 am,0,2025-07-01 07:40:00,8.3855,8.714,0.00039999999999995595
EWT-2,7/1/2025,07:50:00 am,0,2025-07-01 07:50:00,8.3861,8.718,0.00039999999999995595
EWT-2,7/1/2025,08:00:00 am,0,2025-07-01 08:00:00,8.3865,8.714,0.00019999999999988915
EWT-2,7/1/2025,08:10:00 am,0,2025-07-01 08:10:00,8.3868,8.716,0.00010000000000012221
EWT-2,7/1/2025,08:20:00 am,0,2025-07-01 08:20:00,8.3873,8.717,0.00010000000000012221
EWT-2,7/1/2025,08:30:00 am,0,2025-07-01 08:30:00,8.3871,8.716,0.0
EWT-2,7/1/2025,08:40:00 am,0,2025-07-01 08:40:00,8.387,8.716,0.00010000000000012221
EWT-2,7/1/2025,08:50:00 am,0,2025-07-01 08:50:00,8.3868,8.717,0.00010000000000012221
EWT-2,7/1/2025,09:00:00 am,0,2025-07-01 09:00:00,8.3867,8.716,0.0002000000000000668
EWT-2,7/1/2025,09:10:00 am,0,2025-07-01 09:10:00,8.3867,8.718,0.00030000000000001136
EWT-2,7/1/2025,09:20:00 am,0,2025-07-01 09:20:00,8.3862,8.715,9.999999999994457e-05
EWT-2,7/1/2025,09:30:00 am,0,2025-07-01 09:30:00,8.3859,8.716,0.0002000000000000668
EWT-2,7/1/2025,09:40:00 am,0,2025-07-01 09:40:00,8.3857,8.718,9.999999999994457e-05
EWT-2,7/1/2025,09:50:00 am,0,2025-07-01 09:50:00,8.3853,8.717,0.00010000000000012221
EWT-2,7/1/2025,10:00:00 am,0,2025-07-01 10:00:00,8.3851,8.716,0.00010000000000012221
EWT-2,7/1/2025,10:10:00 am,0,2025-07-01 10:10:00,8.3849,8.717,0.00010000000000012221
EWT-2,7/1/2025,10:20:00 am,0,2025-07-01 10:20:00,8.3848,8.716,0.00010000000000012221
EWT-2,7/1/2025,10:30:00 am,0,2025-07-01 10:30:00,8.3845,8.717,0.0
EWT-2,7/1/2025,10:40:00 am,0,2025-07-01 10:40:00,8.3841,8.717,0.0
EWT-2,7/1/2025,10:50:00 am,0,2025-07-01 10:50:00,8.3839,8.717,0.00019999999999988915
EWT-2,7/1/2025,11:00:00 am,0,2025-07-01 11:00:00,8.3838,8.719,0.0
EWT-2,7/1/2025,11:10:00 am,0,2025-07-01 11:10:00,8.3835,8.719,9.999999999994457e-05
EWT-2,7/1/2025,11:20:00 am,0,2025-07-01 11:20:00,8.3833,8.718,9.999999999994457e-05
EWT-2,7/1/2025,11:30:00 am,0,2025-07-01 11:30:00,8.3825,8.719,9.999999999994457e-05
EWT-2,7/1/2025,11:40:00 am,0,2025-07-01 11:40:00,8.382,8.718,0.0
EWT-2,7/1/2025,11:50:00 am,0,2025-07-01 11:50:00,8.3815,8.718,0.0002000000000000668
EWT-2,7/1/2025,12:00:00 pm,0,2025-07-01 12:00:00,8.3809,8.72,0.0
EWT-2,7/1/2025,12:10:00 pm,0,2025-07-01 12:10:00,8.3805,8.72,0.0
EWT-2,7/1/2025,12:20:00 pm,0,2025-07-01 12:20:00,8.3798,8.72,0.0
EWT-2,7/1/2025,12:30:00 pm,0,2025-07-01 12:30:00,8.3795,8.72,9.999999999994457e-05
EWT-2,7/1/2025,12:40:00 pm,0,2025-07-01 12:40:00,8.379,8.721,9.999999999994457e-05
EWT-2,7/1/2025,12:50:00 pm,0,2025-07-01 12:50:00,8.3783,8.72,0.0
EWT-2,7/1/2025,01:00:00 pm,0,2025-07-01 13:00:00,8.3773,8.72,0.00010000000000012221
EWT-2,7/1/2025,01:10:00 pm,0,2025-07-01 13:10:00,8.3764,8.719,0.0002000000000000668
EWT-2,7/1/2025,01:20:00 pm,0,2025-07-01 13:20:00,8.3756,8.721,0.0002000000000000668
EWT-2,7/1/2025,01:30:00 pm,0,2025-07-01 13:30:00,8.375,8.719,0.00010000000000012221
EWT-2,7/1/2025,01:40:00 pm,0,2025-07-01 13:40:00,8.3738,8.72,9.999999999994457e-05
EWT-2,7/1/2025,01:50:00 pm,0,2025-07-01 13:50:00,8.3731,8.721,9.999999999994457e-05
EWT-2,7/1/2025,02:00:00 pm,0,2025-07-01 14:00:00,8.372,8.722,9.999999999994457e-05
EWT-2,7/1/2025,02:10:00 pm,0,2025-07-01 14:10:00,8.3705,8.721,0.0002000000000000668
EWT-2,7/1/2025,02:20:00 pm,0,2025-07-01 14:20:00,8.3685,8.719,0.00010000000000012221
EWT-2,7/1/2025,02:30:00 pm,0,2025-07-01 14:30:00,8.367,8.72,0.0
EWT-2,7/1/2025,02:40:00 pm,0,2025-07-01 14:40:00,8.366,8.72,0.00010000000000012221
EWT-2,7/1/2025,02:50:00 pm,0,2025-07-01 14:50:00,8.3641,8.719,0.00030000000000001136
EWT-2,7/1/2025,03:00:00 pm,0,2025-07-01 15:00:00,8.3624,8.722,0.00019999999999988915
EWT-2,7/1/2025,03:10:00 pm,0,2025-07-01 15:10:00,8.3596,8.72,9.999999999994457e-05
EWT-2,7/1/2025,03:20:00 pm,0,2025-07-01 15:20:00,8.3572,8.721,0.0
EWT-2,7/1/2025,03:30:00 pm,0,2025-07-01 15:30:00,8.3549,8.721,0.0
EWT-2,7/1/2025,03:40:00 pm,0,2025-07-01 15:40:00,8.3529,8.721,9.999999999994457e-05
EWT-2,7/1/2025,03:50:00 pm,0,2025-07-01 15:50:00,8.3515,8.72,0.00019999999999988915
EWT-2,7/1/2025,04:00:00 pm,0,2025-07-01 16:00:00,8.3515,8.722,9.999999999994457e-05
EWT-2,7/1/2025,04:10:00 pm,0,2025-07-01 16:10:00,8.3525,8.721,9.999999999994457e-05
EWT-2,7/1/2025,04:20:00 pm,0,2025-07-01 16:20:00,8.3538,8.722,0.00030000000000001136
EWT-2,7/1/2025,04:30:00 pm,0,2025-07-01 16:30:00,8.3541,8.719,0.00030000000000001136
EWT-2,7/1/2025,04:40:00 pm,0,2025-07-01 16:40:00,8.3532,8.722,9.999999999994457e-05
EWT-2,7/1/2025,04:50:00 pm,0,2025-07-01 16:50:00,8.3515,8.721,0.0
EWT-2,7/1/2025,05:00:00 pm,0,2025-07-01 17:00:00,8.3509,8.721,0.0
EWT-2,7/1/2025,05:10:00 pm,0,2025-07-01 17:10:00,8.3506,8.721,9.999999999994457e-05
EWT-2,7/1/2025,05:20:00 pm,0,2025-07-01 17:20:00,8.3502,8.722,0.00010000000000012221
EWT-2,7/1/2025,05:30:00 pm,0,2025-07-01 17:30:00,8.35,8.723,9.999999999994457e-05
EWT-2,7/1/2025,05:40:00 pm,0,2025-07-01 17:40:00,8.3494,8.724,0.0002000000000000668
EWT-2,7/1/2025,05:50:00 pm,0,2025-07-01 17:50:00,8.3495,8.722,0.0
EWT-2,7/1/2025,06:00:00 pm,0,2025-07-01 18:00:00,8.3498,8.722,0.0004000000000001336
EWT-2,7/1/2025,06:10:00 pm,0,2025-07-01 18:10:00,8.3503,8.726,0.00030000000000001136
EWT-2,7/1/2025,06:20:00 pm,0,2025-07-01 18:20:00,8.3512,8.723,0.0
EWT-2,7/1/2025,06:30:00 pm,0,2025-07-01 18:30:00,8.3506,8.723,0.00019999999999988915
EWT-2,7/1/2025,06:40:00 pm,0,2025-07-01 18:40:00,8.3499,8.725,0.00019999999999988915
EWT-2,7/1/2025,06:50:00 pm,0,2025-07-01 18:50:00,8.3498,8.723,9.999999999994457e-05
EWT-2,7/1/2025,07:00:00 pm,0,2025-07-01 19:00:00,8.3489,8.724,0.00030000000000001136
EWT-2,7/1/2025,07:10:00 pm,0,2025-07-01 19:10:00,8.3472,8.721,0.00030000000000001136
EWT-2,7/1/2025,07:20:00 pm,0,2025-07-01 19:20:00,8.3452,8.724,0.0002000000000000668
EWT-2,7/1/2025,07:30:00 pm,0,2025-07-01 19:30:00,8.3436,8.722,0.0
EWT-2,7/1/2025,07:40:00 pm,0,2025-07-01 19:40:00,8.3436,8.722,0.0
EWT-2,7/1/2025,07:50:00 pm,0,2025-07-01 19:50:00,8.3444,8.722,0.00030000000000001136
EWT-2,7/1/2025,08:00:00 pm,0,2025-07-01 20:00:00,8.3448,8.725,0.0
EWT-2,7/1/2025,08:10:00 pm,0,2025-07-01 20:10:00,8.3463,8.725,9.999999999994457e-05
EWT-2,7/1/2025,08:20:00 pm,0,2025-07-01 20:20:00,8.3467,8.724,0.0
EWT-2,7/1/2025,08:30:00 pm,0,2025-07-01 20:30:00,8.3458,8.724,9.999999999994457e-05
EWT-2,7/1/2025,08:40:00 pm,0,2025-07-01 20:40:00,8.3445,8.725,9.999999999994457e-05
EWT-2,7/1/2025,08:50:00 pm,0,2025-07-01 20:50:00,8.3446,8.724,0.0002000000000000668
EWT-2,7/1/2025,09:00:00 pm,0,2025-07-01 21:00:00,8.3445,8.726,0.0
EWT-2,7/1/2025,09:10:00 pm,0,2025-07-01 21:10:00,8.3447,8.726,0.0002000000000000668
EWT-2,7/1/2025,09:20:00 pm,0,2025-07-01 21:20:00,8.345,8.724,0.0002000000000000668
EWT-2,7/1/2025,09:30:00 pm,0,2025-07-01 21:30:00,8.3453,8.726,0.0002000000000000668
EWT-2,7/1/2025,09:40:00 pm,0,2025-07-01 21:40:00,8.3456,8.724,0.0
EWT-2,7/1/2025,09:50:00 pm,0,2025-07-01 21:50:00,8.3462,8.724,9.999999999994457e-05
EWT-2,7/1/2025,10:00:00 pm,0,2025-07-01 22:00:00,8.3471,8.725,0.0002000000000000668
EWT-2,7/1/2025,10:10:00 pm,0,2025-07-01 22:10:00,8.3474,8.727,0.00030000000000001136
EWT-2,7/1/2025,10:20:00 pm,0,2025-07-01 22:20:00,8.3483,8.724,0.00030000000000001136
EWT-2,7/1/2025,10:30:00 pm,0,2025-07-01 22:30:00,8.3486,8.727,9.999999999994457e-05
EWT-2,7/1/2025,10:40:00 pm,0,2025-07-01 22:40:00,8.3491,8.726,0.0002000000000000668
EWT-2,7/1/2025,10:50:00 pm,0,2025-07-01 22:50:00,8.3498,8.724,0.0002000000000000668
EWT-2,7/1/2025,11:00:00 pm,0,2025-07-01 23:00:00,8.3509,8.726,9.999999999994457e-05
EWT-2,7/1/2025,11:10:00 pm,0,2025-07-01 23:10:00,8.3521,8.727,9.999999999994457e-05
EWT-2,7/1/2025,11:20:00 pm,0,2025-07-01 23:20:00,8.3532,8.726,9.999999999994457e-05
EWT-2,7/1/2025,11:30:00 pm,0,2025-07-01 23:30:00,8.3538,8.727,0.0
EWT-2,7/1/2025,11:40:00 pm,0,2025-07-01 23:40:00,8.3549,8.727,0.0
EWT-2,7/1/2025,11:50:00 pm,0,2025-07-01 23:50:00,8.3561,8.727,9.999999999994457e-05
EWT-2,7/2/2025,12:00:00 am,0,2025-07-02 00:00:00,8.3571,8.726,0.0002999999999998337
EWT-2,7/2/2025,12:10:00 am,0,2025-07-02 00:10:00,8.3577,8.729,0.00019999999999988915
EWT-2,7/2/2025,12:20:00 am,0,2025-07-02 00:20:00,8.3581,8.727,0.0002000000000000668
EWT-2,7/2/2025,12:30:00 am,0,2025-07-02 00:30:00,8.3585,8.725,0.00030000000000001136
EWT-2,7/2/2025,12:40:00 am,0,2025-07-02 00:40:00,8.3585,8.728,0.0
EWT-2,7/2/2025,12:50:00 am,0,2025-07-02 00:50:00,8.3579,8.728,0.00019999999999988915
EWT-2,7/2/2025,01:00:00 am,0,2025-07-02 01:00:00,8.3581,8.726,9.999999999994457e-05
EWT-2,7/2/2025,01:10:00 am,0,2025-07-02 01:10:00,8.3582,8.727,0.0
EWT-2,7/2/2025,01:20:00 am,0,2025-07-02 01:20:00,8.3588,8.727,9.999999999994457e-05
EWT-2,7/2/2025,01:30:00 am,0,2025-07-02 01:30:00,8.3591,8.728,0.0002000000000000668
EWT-2,7/2/2025,01:40:00 am,0,2025-07-02 01:40:00,8.3597,8.73,0.0002000000000000668
EWT-2,7/2/2025,01:50:00 am,0,2025-07-02 01:50:00,8.3603,8.728,0.0
EWT-2,7/2/2025,02:00:00 am,0,2025-07-02 02:00:00,8.3607,8.728,9.999999999994457e-05
EWT-2,7/2/2025,02:10:00 am,0,2025-07-02 02:10:00,8.3612,8.729,0.0
EWT-2,7/2/2025,02:20:00 am,0,2025-07-02 02:20:00,8.3615,8.729,0.0
EWT-2,7/2/2025,02:30:00 am,0,2025-07-02 02:30:00,8.362,8.729,0.0
EWT-2,7/2/2025,02:40:00 am,0,2025-07-02 02:40:00,8.3615,8.729,0.0
EWT-2,7/2/2025,02:50:00 am,0,2025-07-02 02:50:00,8.3612,8.729,0.0
EWT-2,7/2/2025,03:00:00 am,0,2025-07-02 03:00:00,8.3614,8.729,9.999999999994457e-05
EWT-2,7/2/2025,03:10:00 am,0,2025-07-02 03:10:00,8.3614,8.728,0.0
EWT-2,7/2/2025,03:20:00 am,0,2025-07-02 03:20:00,8.3619,8.728,9.999999999994457e-05
EWT-2,7/2/2025,03:30:00 am,0,2025-07-02 03:30:00,8.3625,8.729,0.0
EWT-2,7/2/2025,03:40:00 am,0,2025-07-02 03:40:00,8.3628,8.729,0.0002000000000000668
EWT-2,7/2/2025,03:50:00 am,0,2025-07-02 03:50:00,8.363,8.731,9.999999999994457e-05
EWT-2,7/2/2025,04:00:00 am,0,2025-07-02 04:00:00,8.3633,8.73,0.0
EWT-2,7/2/2025,04:10:00 am,0,2025-07-02 04:10:00,8.3638,8.73,0.00030000000000001136
EWT-2,7/2/2025,04:20:00 am,0,2025-07-02 04:20:00,8.3645,8.733,0.0002000000000000668
EWT-2,7/2/2025,04:30:00 am,0,2025-07-02 04:30:00,8.3644,8.731,9.999999999994457e-05
EWT-2,7/2/2025,04:40:00 am,0,2025-07-02 04:40:00,8.3647,8.73,0.00019999999999988915
EWT-2,7/2/2025,04:50:00 am,0,2025-07-02 04:50:00,8.3647,8.732,9.999999999994457e-05
EWT-2,7/2/2025,05:00:00 am,0,2025-07-02 05:00:00,8.3652,8.731,0.0
EWT-2,7/2/2025,05:10:00 am,0,2025-07-02 05:10:00,8.3656,8.731,0.0
EWT-2,7/2/2025,05:20:00 am,0,2025-07-02 05:20:00,8.3667,8.731,9.999999999994457e-05
EWT-2,7/2/2025,05:30:00 am,0,2025-07-02 05:30:00,8.3678,8.73,9.999999999994457e-05
EWT-2,7/2/2025,05:40:00 am,0,2025-07-02 05:40:00,8.3681,8.731,0.0
EWT-2,7/2/2025,05:50:00 am,0,2025-07-02 05:50:00,8.3681,8.731,0.0002000000000000668
EWT-2,7/2/2025,06:00:00 am,0,2025-07-02 06:00:00,8.3682,8.733,0.0
EWT-2,7/2/2025,06:10:00 am,0,2025-07-02 06:10:00,8.3683,8.733,0.00030000000000001136
EWT-2,7/2/2025,06:20:00 am,0,2025-07-02 06:20:00,8.3683,8.73,0.00030000000000001136
EWT-2,7/2/2025,06:30:00 am,0,2025-07-02 06:30:00,8.3687,8.733,0.00010000000000012221
EWT-2,7/2/2025,06:40:00 am,0,2025-07-02 06:40:00,8.3692,8.732,9.999999999994457e-05
EWT-2,7/2/2025,06:50:00 am,0,2025-07-02 06:50:00,8.3698,8.731,0.0002000000000000668
EWT-2,7/2/2025,07:00:00 am,0,2025-07-02 07:00:00,8.3705,8.733,0.00030000000000001136
EWT-2,7/2/2025,07:10:00 am,0,2025-07-02 07:10:00,8.3718,8.73,0.00039999999999995595
EWT-2,7/2/2025,07:20:00 am,0,2025-07-02 07:20:00,8.3729,8.734,9.999999999994457e-05
EWT-2,7/2/2025,07:30:00 am,0,2025-07-02 07:30:00,8.3739,8.735,0.00030000000000001136
EWT-2,7/2/2025,07:40:00 am,0,2025-07-02 07:40:00,8.3746,8.732,0.0
EWT-2,7/2/2025,07:50:00 am,0,2025-07-02 07:50:00,8.3747,8.732,0.0002000000000000668
EWT-2,7/2/2025,08:00:00 am,0,2025-07-02 08:00:00,8.3749,8.734,9.999999999994457e-05
EWT-2,7/2/2025,08:10:00 am,0,2025-07-02 08:10:00,8.375,8.735,9.999999999994457e-05
EWT-2,7/2/2025,08:20:00 am,0,2025-07-02 08:20:00,8.375,8.734,0.0
EWT-2,7/2/2025,08:30:00 am,0,2025-07-02 08:30:00,8.3753,8.734,9.999999999994457e-05
EWT-2,7/2/2025,08:40:00 am,0,2025-07-02 08:40:00,8.3754,8.735,0.0
EWT-2,7/2/2025,08:50:00 am,0,2025-07-02 08:50:00,8.3754,8.735,9.999999999994457e-05
EWT-2,7/2/2025,09:00:00 am,0,2025-07-02 09:00:00,8.375,8.734,9.999999999994457e-05
EWT-2,7/2/2025,09:10:00 am,0,2025-07-02 09:10:00,8.3751,8.735,0.00010000000000012221
EWT-2,7/2/2025,09:20:00 am,0,2025-07-02 09:20:00,8.3749,8.736,0.00010000000000012221
EWT-2,7/2/2025,09:30:00 am,0,2025-07-02 09:30:00,8.3747,8.735,0.0002000000000000668
EWT-2,7/2/2025,09:40:00 am,0,2025-07-02 09:40:00,8.3745,8.737,0.0002000000000000668
EWT-2,7/2/2025,09:50:00 am,0,2025-07-02 09:50:00,8.3742,8.735,0.0002000000000000668
EWT-2,7/2/2025,10:00:00 am,0,2025-07-02 10:00:00,8.3739,8.737,9.999999999994457e-05
EWT-2,7/2/2025,10:10:00 am,0,2025-07-02 10:10:00,8.3738,8.736,9.999999999994457e-05
EWT-2,7/2/2025,10:20:00 am,0,2025-07-02 10:20:00,8.3735,8.737,0.0
EWT-2,7/2/2025,10:30:00 am,0,2025-07-02 10:30:00,8.3732,8.737,0.0
EWT-2,7/2/2025,10:40:00 am,0,2025-07-02 10:40:00,8.3729,8.737,0.0002000000000000668
EWT-2,7/2/2025,10:50:00 am,0,2025-07-02 10:50:00,8.3722,8.735,0.0002000000000000668
EWT-2,7/2/2025,11:00:00 am,0,2025-07-02 11:00:00,8.3719,8.737,9.999999999994457e-05
EWT-2,7/2/2025,11:10:00 am,0,2025-07-02 11:10:00,8.3716,8.736,9.999999999994457e-05
EWT-2,7/2/2025,11:20:00 am,0,2025-07-02 11:20:00,8.371,8.737,9.999999999994457e-05
EWT-2,7/2/2025,11:30:00 am,0,2025-07-02 11:30:00,8.3703,8.738,0.0
EWT-2,7/2/2025,11:40:00 am,0,2025-07-02 11:40:00,8.3698,8.738,0.00019999999999988915
EWT-2,7/2/2025,11:50:00 am,0,2025-07-02 11:50:00,8.3691,8.736,9.999999999994457e-05
EWT-2,7/2/2025,12:00:00 pm,0,2025-07-02 12:00:00,8.3687,8.737,9.999999999994457e-05
EWT-2,7/2/2025,12:10:00 pm,0,2025-07-02 12:10:00,8.3682,8.738,0.0
EWT-2,7/2/2025,12:20:00 pm,0,2025-07-02 12:20:00,8.3672,8.738,0.00010000000000012221
EWT-2,7/2/2025,12:30:00 pm,0,2025-07-02 12:30:00,8.366,8.739,0.00010000000000012221
EWT-2,7/2/2025,12:40:00 pm,0,2025-07-02 12:40:00,8.3644,8.738,9.999999999994457e-05
EWT-2,7/2/2025,12:50:00 pm,0,2025-07-02 12:50:00,8.363,8.737,9.999999999994457e-05
EWT-2,7/2/2025,01:00:00 pm,0,2025-07-02 13:00:00,8.3614,8.738,0.0
EWT-2,7/2/2025,01:10:00 pm,0,2025-07-02 13:10:00,8.358,8.738,0.00010000000000012221
EWT-2,7/2/2025,01:20:00 pm,0,2025-07-02 13:20:00,8.3534,8.739,0.00019999999999988915
EWT-2,7/2/2025,01:30:00 pm,0,2025-07-02 13:30:00,8.3506,8.741,9.999999999994457e-05
EWT-2,7/2/2025,01:40:00 pm,0,2025-07-02 13:40:00,8.3492,8.74,0.0
EWT-2,7/2/2025,01:50:00 pm,0,2025-07-02 13:50:00,8.3479,8.74,0.0
EWT-2,7/2/2025,02:00:00 pm,0,2025-07-02 14:00:00,8.3472,8.74,9.999999999994457e-05
EWT-2,7/2/2025,02:10:00 pm,0,2025-07-02 14:10:00,8.3463,8.739,0.0
EWT-2,7/2/2025,02:20:00 pm,0,2025-07-02 14:20:00,8.3451,8.739,9.999999999994457e-05
EWT-2,7/2/2025,02:30:00 pm,0,2025-07-02 14:30:00,8.3438,8.74,9.999999999994457e-05
EWT-2,7/2/2025,02:40:00 pm,0,2025-07-02 14:40:00,8.3427,8.741,0.0
EWT-2,7/2/2025,02:50:00 pm,0,2025-07-02 14:50:00,8.3441,8.741,9.999999999994457e-05
EWT-2,7/2/2025,03:00:00 pm,0,2025-07-02 15:00:00,8.3478,8.74,0.0
EWT-2,7/2/2025,03:10:00 pm,0,2025-07-02 15:10:00,8.348,8.74,0.0
EWT-2,7/2/2025,03:20:00 pm,0,2025-07-02 15:20:00,8.3463,8.74,0.00030000000000001136
EWT-2,7/2/2025,03:30:00 pm,0,2025-07-02 15:30:00,8.3446,8.743,0.0002000000000000668
EWT-2,7/2/2025,03:40:00 pm,0,2025-07-02 15:40:00,8.3435,8.741,0.0002000000000000668
EWT-2,7/2/2025,03:50:00 pm,0,2025-07-02 15:50:00,8.3417,8.743,0.0002000000000000668
EWT-2,7/2/2025,04:00:00 pm,0,2025-07-02 16:00:00,8.3399,8.741,0.00010000000000012221
EWT-2,7/2/2025,04:10:00 pm,0,2025-07-02 16:10:00,8.3393,8.742,0.00010000000000012221
EWT-2,7/2/2025,04:20:00 pm,0,2025-07-02 16:20:00,8.339,8.741,0.00010000000000012221
EWT-2,7/2/2025,04:30:00 pm,0,2025-07-02 16:30:00,8.3381,8.742,9.999999999994457e-05
EWT-2,7/2/2025,04:40:00 pm,0,2025-07-02 16:40:00,8.3375,8.743,0.00030000000000001136
EWT-2,7/2/2025,04:50:00 pm,0,2025-07-02 16:50:00,8.3361,8.74,0.00030000000000001136
EWT-2,7/2/2025,05:00:00 pm,0,2025-07-02 17:00:00,8.3347,8.743,0.0002000000000000668
EWT-2,7/2/2025,05:10:00 pm,0,2025-07-02 17:10:00,8.3305,8.741,0.00010000000000012221
EWT-2,7/2/2025,05:20:00 pm,0,2025-07-02 17:20:00,8.3276,8.742,0.00019999999999988915
EWT-2,7/2/2025,05:30:00 pm,0,2025-07-02 17:30:00,8.3256,8.744,9.999999999994457e-05
EWT-2,7/2/2025,05:40:00 pm,0,2025-07-02 17:40:00,8.3244,8.743,9.999999999994457e-05
EWT-2,7/2/2025,05:50:00 pm,0,2025-07-02 17:50:00,8.3233,8.744,0.00019999999999988915
EWT-2,7/2/2025,06:00:00 pm,0,2025-07-02 18:00:00,8.3224,8.742,0.00019999999999988915
EWT-2,7/2/2025,06:10:00 pm,0,2025-07-02 18:10:00,8.3221,8.744,0.0
EWT-2,7/2/2025,06:20:00 pm,0,2025-07-02 18:20:00,8.3215,8.744,9.999999999994457e-05
EWT-2,7/2/2025,06:30:00 pm,0,2025-07-02 18:30:00,8.3212,8.745,0.0002999999999998337
EWT-2,7/2/2025,06:40:00 pm,0,2025-07-02 18:40:00,8.3209,8.742,0.0002999999999998337
EWT-2,7/2/2025,06:50:00 pm,0,2025-07-02 18:50:00,8.321,8.745,0.0
EWT-2,7/2/2025,07:00:00 pm,0,2025-07-02 19:00:00,8.3212,8.745,0.00019999999999988915
EWT-2,7/2/2025,07:10:00 pm,0,2025-07-02 19:10:00,8.3211,8.743,0.0
EWT-2,7/2/2025,07:20:00 pm,0,2025-07-02 19:20:00,8.3211,8.743,0.00019999999999988915
EWT-2,7/2/2025,07:30:00 pm,0,2025-07-02 19:30:00,8.3214,8.745,9.999999999994457e-05
EWT-2,7/2/2025,07:40:00 pm,0,2025-07-02 19:40:00,8.3216,8.744,0.0
EWT-2,7/2/2025,07:50:00 pm,0,2025-07-02 19:50:00,8.322,8.744,0.0002000000000000668
EWT-2,7/2/2025,08:00:00 pm,0,2025-07-02 20:00:00,8.3228,8.746,0.0002000000000000668
EWT-2,7/2/2025,08:10:00 pm,0,2025-07-02 20:10:00,8.3235,8.744,0.0002000000000000668
EWT-2,7/2/2025,08:20:00 pm,0,2025-07-02 20:20:00,8.3239,8.746,0.00010000000000012221
EWT-2,7/2/2025,08:30:00 pm,0,2025-07-02 20:30:00,8.3245,8.745,0.00010000000000012221
EWT-2,7/2/2025,08:40:00 pm,0,2025-07-02 20:40:00,8.3253,8.746,0.00010000000000012221
EWT-2,7/2/2025,08:50:00 pm,0,2025-07-02 20:50:00,8.3262,8.745,0.0002000000000000668
EWT-2,7/2/2025,09:00:00 pm,0,2025-07-02 21:00:00,8.327,8.747,9.999999999994457e-05
EWT-2,7/2/2025,09:10:00 pm,0,2025-07-02 21:10:00,8.3275,8.746,0.00010000000000012221
EWT-2,7/2/2025,09:20:00 pm,0,2025-07-02 21:20:00,8.3285,8.745,0.00010000000000012221
EWT-2,7/2/2025,09:30:00 pm,0,2025-07-02 21:30:00,8.3293,8.746,9.999999999994457e-05
EWT-2,7/2/2025,09:40:00 pm,0,2025-07-02 21:40:00,8.3303,8.747,0.0
EWT-2,7/2/2025,09:50:00 pm,0,2025-07-02 21:50:00,8.3311,8.747,9.999999999994457e-05
EWT-2,7/2/2025,10:00:00 pm,0,2025-07-02 22:00:00,8.3317,8.748,9.999999999994457e-05
EWT-2,7/2/2025,10:10:00 pm,0,2025-07-02 22:10:00,8.3325,8.747,0.0002000000000000668
EWT-2,7/2/2025,10:20:00 pm,0,2025-07-02 22:20:00,8.3333,8.749,0.0
EWT-2,7/2/2025,10:30:00 pm,0,2025-07-02 22:30:00,8.334,8.749,0.00010000000000012221
EWT-2,7/2/2025,10:40:00 pm,0,2025-07-02 22:40:00,8.3344,8.748,9.999999999994457e-05
EWT-2,7/2/2025,10:50:00 pm,0,2025-07-02 22:50:00,8.3353,8.747,0.0002000000000000668
EWT-2,7/2/2025,11:00:00 pm,0,2025-07-02 23:00:00,8.3362,8.749,0.00010000000000012221
EWT-2,7/2/2025,11:10:00 pm,0,2025-07-02 23:10:00,8.3371,8.748,9.999999999994457e-05
EWT-2,7/2/2025,11:20:00 pm,0,2025-07-02 23:20:00,8.338,8.747,0.00030000000000001136
EWT-2,7/2/2025,11:30:00 pm,0,2025-07-02 23:30:00,8.3388,8.75,9.999999999994457e-05
EWT-2,7/2/2025,11:40:00 pm,0,2025-07-02 23:40:00,8.3395,8.749,0.0
EWT-2,7/2/2025,11:50:00 pm,0,2025-07-02 23:50:00,8.3407,8.749,0.00019999999999988915
EWT-2,7/3/2025,12:00:00 am,0,2025-07-03 00:00:00,8.3425,8.751,0.00019999999999988915
EWT-2,7/3/2025,12:10:00 am,0,2025-07-03 00:10:00,8.3432,8.749,0.0
EWT-2,7/3/2025,12:20:00 am,0,2025-07-03 00:20:00,8.3435,8.749,0.00019999999999988915
EWT-2,7/3/2025,12:30:00 am,0,2025-07-03 00:30:00,8.3441,8.751,9.999999999994457e-05
EWT-2,7/3/2025,12:40:00 am,0,2025-07-03 00:40:00,8.3444,8.75,9.999999999994457e-05
EWT-2,7/3/2025,12:50:00 am,0,2025-07-03 00:50:00,8.3449,8.751,9.999999999994457e-05
EWT-2,7/3/2025,01:00:00 am,0,2025-07-03 01:00:00,8.3452,8.75,0.0
EWT-2,7/3/2025,01:10:00 am,0,2025-07-03 01:10:00,8.3454,8.75,0.0
EWT-2,7/3/2025,01:20:00 am,0,2025-07-03 01:20:00,8.3456,8.75,9.999999999994457e-05
EWT-2,7/3/2025,01:30:00 am,0,2025-07-03 01:30:00,8.3457,8.751,9.999999999994457e-05
EWT-2,7/3/2025,01:40:00 am,0,2025-07-03 01:40:00,8.3462,8.75,0.0002000000000000668
EWT-2,7/3/2025,01:50:00 am,0,2025-07-03 01:50:00,8.3468,8.752,9.999999999994457e-05
EWT-2,7/3/2025,02:00:00 am,0,2025-07-03 02:00:00,8.3467,8.753,0.0
EWT-2,7/3/2025,02:10:00 am,0,2025-07-03 02:10:00,8.3471,8.753,9.999999999994457e-05
EWT-2,7/3/2025,02:20:00 am,0,2025-07-03 02:20:00,8.3474,8.752,0.00010000000000012221
EWT-2,7/3/2025,02:30:00 am,0,2025-07-03 02:30:00,8.3478,8.751,0.00010000000000012221
EWT-2,7/3/2025,02:40:00 am,0,2025-07-03 02:40:00,8.3481,8.752,0.0
EWT-2,7/3/2025,02:50:00 am,0,2025-07-03 02:50:00,8.3488,8.752,0.00019999999999988915
EWT-2,7/3/2025,03:00:00 am,0,2025-07-03 03:00:00,8.3488,8.754,0.0
EWT-2,7/3/2025,03:10:00 am,0,2025-07-03 03:10:00,8.3484,8.754,0.00019999999999988915
EWT-2,7/3/2025,03:20:00 am,0,2025-07-03 03:20:00,8.3484,8.752,0.00019999999999988915
EWT-2,7/3/2025,03:30:00 am,0,2025-07-03 03:30:00,8.3489,8.754,0.0
EWT-2,7/3/2025,03:40:00 am,0,2025-07-03 03:40:00,8.3491,8.754,0.0
EWT-2,7/3/2025,03:50:00 am,0,2025-07-03 03:50:00,8.3492,8.754,9.999999999994457e-05
EWT-2,7/3/2025,04:00:00 am,0,2025-07-03 04:00:00,8.3491,8.753,9.999999999994457e-05
EWT-2,7/3/2025,04:10:00 am,0,2025-07-03 04:10:00,8.3492,8.754,9.999999999994457e-05
EWT-2,7/3/2025,04:20:00 am,0,2025-07-03 04:20:00,8.3491,8.753,9.999999999994457e-05
EWT-2,7/3/2025,04:30:00 am,0,2025-07-03 04:30:00,8.3494,8.754,0.0
EWT-2,7/3/2025,04:40:00 am,0,2025-07-03 04:40:00,8.3495,8.754,0.0
EWT-2,7/3/2025,04:50:00 am,0,2025-07-03 04:50:00,8.3495,8.754,0.0
EWT-2,7/3/2025,05:00:00 am,0,2025-07-03 05:00:00,8.3496,8.754,0.0
EWT-2,7/3/2025,05:10:00 am,0,2025-07-03 05:10:00,8.3498,8.754,0.00010000000000012221
EWT-2,7/3/2025,05:20:00 am,0,2025-07-03 05:20:00,8.3503,8.755,0.00010000000000012221
EWT-2,7/3/2025,05:30:00 am,0,2025-07-03 05:30:00,8.3509,8.754,0.00010000000000012221
EWT-2,7/3/2025,05:40:00 am,0,2025-07-03 05:40:00,8.3522,8.755,9.999999999994457e-05
EWT-2,7/3/2025,05:50:00 am,0,2025-07-03 05:50:00,8.3527,8.756,9.999999999994457e-05
EWT-2,7/3/2025,06:00:00 am,0,2025-07-03 06:00:00,8.3532,8.755,0.0
EWT-2,7/3/2025,06:10:00 am,0,2025-07-03 06:10:00,8.3544,8.755,0.0002999999999998337
EWT-2,7/3/2025,06:20:00 am,0,2025-07-03 06:20:00,8.3555,8.758,9.999999999994457e-05
EWT-2,7/3/2025,06:30:00 am,0,2025-07-03 06:30:00,8.3555,8.757,9.999999999994457e-05
EWT-2,7/3/2025,06:40:00 am,0,2025-07-03 06:40:00,8.3555,8.756,0.0
EWT-2,7/3/2025,06:50:00 am,0,2025-07-03 06:50:00,8.3561,8.756,0.0
EWT-2,7/3/2025,07:00:00 am,0,2025-07-03 07:00:00,8.357,8.756,9.999999999994457e-05
EWT-2,7/3/2025,07:10:00 am,0,2025-07-03 07:10:00,8.3576,8.757,9.999999999994457e-05
EWT-2,7/3/2025,07:20:00 am,0,2025-07-03 07:20:00,8.3579,8.758,0.0
EWT-2,7/3/2025,07:30:00 am,0,2025-07-03 07:30:00,8.3581,8.758,9.999999999994457e-05
EWT-2,7/3/2025,07:40:00 am,0,2025-07-03 07:40:00,8.3584,8.757,9.999999999994457e-05
EWT-2,7/3/2025,07:50:00 am,0,2025-07-03 07:50:00,8.3586,8.758,0.0
EWT-2,7/3/2025,08:00:00 am,0,2025-07-03 08:00:00,8.3584,8.758,0.0002000000000000668
EWT-2,7/3/2025,08:10:00 am,0,2025-07-03 08:10:00,8.3584,8.76,0.00030000000000001136
EWT-2,7/3/2025,08:20:00 am,0,2025-07-03 08:20:00,8.3581,8.757,9.999999999994457e-05
EWT-2,7/3/2025,08:30:00 am,0,2025-07-03 08:30:00,8.3582,8.758,0.00010000000000012221
