well_id,Date,Time,ms,DT,raw_Level_m,TEMPERATURE,Rate of Change
KER-1,5/29/2025,05:40:00 pm,0,2025-05-29 17:40:00,8.8314,18.806,1.1022000000000003
KER-1,5/29/2025,05:50:00 pm,0,2025-05-29 17:50:00,8.8195,7.784,0.05779999999999994
KER-1,5/29/2025,06:00:00 pm,0,2025-05-29 18:00:00,8.8199,7.206,0.029300000000000014
KER-1,5/29/2025,06:10:00 pm,0,2025-05-29 18:10:00,8.8214,6.913,0.01749999999999998
KER-1,5/29/2025,06:20:00 pm,0,2025-05-29 18:20:00,8.8221,6.738,0.010600000000000076
KER-1,5/29/2025,06:30:00 pm,0,2025-05-29 18:30:00,8.8232,6.632,0.006999999999999939
KER-1,5/29/2025,06:40:00 pm,0,2025-05-29 18:40:00,8.8241,6.562,0.004600000000000026
KER-1,5/29/2025,06:50:00 pm,0,2025-05-29 18:50:00,8.8248,6.516,0.0028999999999999916
KER-1,5/29/2025,07:00:00 pm,0,2025-05-29 19:00:00,8.8267,6.487,0.002400000000000002
KER-1,5/29/2025,07:10:00 pm,0,2025-05-29 19:10:00,8.8278,6.463,0.0017000000000000348
KER-1,5/29/2025,07:20:00 pm,0,2025-05-29 19:20:00,8.8294,6.446,0.00129999999999999
KER-1,5/29/2025,07:30:00 pm,0,2025-05-29 19:30:00,8.8311,6.433,0.0008000000000000007
KER-1,5/29/2025,07:40:00 pm,0,2025-05-29 19:40:00,8.8325,6.425,0.001100000000000012
KER-1,5/29/2025,07:50:00 pm,0,2025-05-29 19:50:00,8.8342,6.414,0.0004999999999999894
KER-1,5/29/2025,08:00:00 pm,0,2025-05-29 20:00:00,8.8358,6.409,0.0006000000000000227
KER-1,5/29/2025,08:10:00 pm,0,2025-05-29 20:10:00,8.8377,6.403,0.00029999999999992256
KER-1,5/29/2025,08:20:00 pm,0,2025-05-29 20:20:00,8.839,6.4,0.00030000000000001136
KER-1,5/29/2025,08:30:00 pm,0,2025-05-29 20:30:00,8.841,6.397,0.0004999999999999894
KER-1,5/29/2025,08:40:00 pm,0,2025-05-29 20:40:00,8.8428,6.392,0.00040000000000004474
KER-1,5/29/2025,08:50:00 pm,0,2025-05-29 20:50:00,8.8436,6.388,0.00019999999999997797
KER-1,5/29/2025,09:00:00 pm,0,2025-05-29 21:00:00,8.8451,6.386,0.00030000000000001136
KER-1,5/29/2025,09:10:00 pm,0,2025-05-29 21:10:00,8.8463,6.383,0.00030000000000001136
KER-1,5/29/2025,09:20:00 pm,0,2025-05-29 21:20:00,8.8475,6.38,0.0
KER-1,5/29/2025,09:30:00 pm,0,2025-05-29 21:30:00,8.8491,6.38,0.00030000000000001136
KER-1,5/29/2025,09:40:00 pm,0,2025-05-29 21:40:00,8.8509,6.377,0.0
KER-1,5/29/2025,09:50:00 pm,0,2025-05-29 21:50:00,8.8521,6.377,0.0
KER-1,5/29/2025,10:00:00 pm,0,2025-05-29 22:00:00,8.8537,6.377,9.999999999994457e-05
KER-1,5/29/2025,10:10:00 pm,0,2025-05-29 22:10:00,8.854,6.376,0.0
KER-1,5/29/2025,10:20:00 pm,0,2025-05-29 22:20:00,8.8547,6.376,9.999999999994457e-05
KER-1,5/29/2025,10:30:00 pm,0,2025-05-29 22:30:00,8.8555,6.377,0.00030000000000001136
KER-1,5/29/2025,10:40:00 pm,0,2025-05-29 22:40:00,8.856,6.374,0.0001000000000000334
KER-1,5/29/2025,10:50:00 pm,0,2025-05-29 22:50:00,8.8567,6.375,0.0
KER-1,5/29/2025,11:00:00 pm,0,2025-05-29 23:00:00,8.8578,6.375,0.0
KER-1,5/29/2025,11:10:00 pm,0,2025-05-29 23:10:00,8.8582,6.375,0.0001000000000000334
KER-1,5/29/2025,11:20:00 pm,0,2025-05-29 23:20:00,8.8584,6.374,9.999999999994457e-05
KER-1,5/29/2025,11:30:00 pm,0,2025-05-29 23:30:00,8.859,6.373,9.999999999994457e-05
KER-1,5/29/2025,11:40:00 pm,0,2025-05-29 23:40:00,8.8592,6.374,0.0002000000000000668
KER-1,5/29/2025,11:50:00 pm,0,2025-05-29 23:50:00,8.8609,6.376,0.0
KER-1,5/30/2025,12:00:00 am,0,2025-05-30 00:00:00,8.862,6.376,0.0
KER-1,5/30/2025,12:10:00 am,0,2025-05-30 00:10:00,8.8617,6.376,9.999999999994457e-05
KER-1,5/30/2025,12:20:00 am,0,2025-05-30 00:20:00,8.8621,6.377,0.0
KER-1,5/30/2025,12:30:00 am,0,2025-05-30 00:30:00,8.862,6.377,0.0
KER-1,5/30/2025,12:40:00 am,0,2025-05-30 00:40:00,8.862,6.377,0.00019999999999997797
KER-1,5/30/2025,12:50:00 am,0,2025-05-30 00:50:00,8.8623,6.379,0.0001000000000000334
KER-1,5/30/2025,01:00:00 am,0,2025-05-30 01:00:00,8.8623,6.38,0.0
KER-1,5/30/2025,01:10:00 am,0,2025-05-30 01:10:00,8.8629,6.38,0.0001000000000000334
KER-1,5/30/2025,01:20:00 am,0,2025-05-30 01:20:00,8.8631,6.381,9.999999999994457e-05
KER-1,5/30/2025,01:30:00 am,0,2025-05-30 01:30:00,8.8631,6.382,0.0
KER-1,5/30/2025,01:40:00 am,0,2025-05-30 01:40:00,8.8633,6.382,0.0
KER-1,5/30/2025,01:50:00 am,0,2025-05-30 01:50:00,8.8641,6.382,0.0001000000000000334
KER-1,5/30/2025,02:00:00 am,0,2025-05-30 02:00:00,8.8645,6.383,0.0
KER-1,5/30/2025,02:10:00 am,0,2025-05-30 02:10:00,8.8655,6.383,0.00039999999999995595
KER-1,5/30/2025,02:20:00 am,0,2025-05-30 02:20:00,8.8652,6.387,9.999999999994457e-05
KER-1,5/30/2025,02:30:00 am,0,2025-05-30 02:30:00,8.8643,6.386,9.999999999994457e-05
KER-1,5/30/2025,02:40:00 am,0,2025-05-30 02:40:00,8.8653,6.387,0.0001000000000000334
KER-1,5/30/2025,02:50:00 am,0,2025-05-30 02:50:00,8.8657,6.388,0.00030000000000001136
KER-1,5/30/2025,03:00:00 am,0,2025-05-30 03:00:00,8.8667,6.391,0.0001000000000000334
KER-1,5/30/2025,03:10:00 am,0,2025-05-30 03:10:00,8.868,6.39,0.0001000000000000334
KER-1,5/30/2025,03:20:00 am,0,2025-05-30 03:20:00,8.8689,6.391,0.0001000000000000334
KER-1,5/30/2025,03:30:00 am,0,2025-05-30 03:30:00,8.8694,6.392,9.999999999994457e-05
KER-1,5/30/2025,03:40:00 am,0,2025-05-30 03:40:00,8.8696,6.393,0.0001000000000000334
KER-1,5/30/2025,03:50:00 am,0,2025-05-30 03:50:00,8.8701,6.394,0.00030000000000001136
KER-1,5/30/2025,04:00:00 am,0,2025-05-30 04:00:00,8.8711,6.397,9.999999999994457e-05
KER-1,5/30/2025,04:10:00 am,0,2025-05-30 04:10:00,8.872,6.398,9.999999999994457e-05
KER-1,5/30/2025,04:20:00 am,0,2025-05-30 04:20:00,8.8717,6.397,9.999999999994457e-05
KER-1,5/30/2025,04:30:00 am,0,2025-05-30 04:30:00,8.8714,6.398,0.00030000000000001136
KER-1,5/30/2025,04:40:00 am,0,2025-05-30 04:40:00,8.8719,6.401,0.0
KER-1,5/30/2025,04:50:00 am,0,2025-05-30 04:50:00,8.8719,6.401,0.0001000000000000334
KER-1,5/30/2025,05:00:00 am,0,2025-05-30 05:00:00,8.8725,6.402,0.00030000000000001136
KER-1,5/30/2025,05:10:00 am,0,2025-05-30 05:10:00,8.8729,6.405,9.999999999994457e-05
KER-1,5/30/2025,05:20:00 am,0,2025-05-30 05:20:00,8.8739,6.406,0.0002000000000000668
KER-1,5/30/2025,05:30:00 am,0,2025-05-30 05:30:00,8.8743,6.408,9.999999999994457e-05
KER-1,5/30/2025,05:40:00 am,0,2025-05-30 05:40:00,8.8744,6.409,0.0001000000000000334
KER-1,5/30/2025,05:50:00 am,0,2025-05-30 05:50:00,8.8751,6.41,9.999999999994457e-05
KER-1,5/30/2025,06:00:00 am,0,2025-05-30 06:00:00,8.8756,6.411,0.0
KER-1,5/30/2025,06:10:00 am,0,2025-05-30 06:10:00,8.8763,6.411,0.0001000000000000334
KER-1,5/30/2025,06:20:00 am,0,2025-05-30 06:20:00,8.8768,6.412,0.00019999999999997797
KER-1,5/30/2025,06:30:00 am,0,2025-05-30 06:30:00,8.8775,6.414,0.0
KER-1,5/30/2025,06:40:00 am,0,2025-05-30 06:40:00,8.8777,6.414,0.00030000000000001136
KER-1,5/30/2025,06:50:00 am,0,2025-05-30 06:50:00,8.878,6.417,0.0001000000000000334
KER-1,5/30/2025,07:00:00 am,0,2025-05-30 07:00:00,8.8784,6.418,0.00019999999999997797
KER-1,5/30/2025,07:10:00 am,0,2025-05-30 07:10:00,8.8794,6.42,0.0
KER-1,5/30/2025,07:20:00 am,0,2025-05-30 07:20:00,8.8796,6.42,0.00040000000000004474
KER-1,5/30/2025,07:30:00 am,0,2025-05-30 07:30:00,8.8803,6.424,9.999999999994457e-05
KER-1,5/30/2025,07:40:00 am,0,2025-05-30 07:40:00,8.8811,6.425,0.0
KER-1,5/30/2025,07:50:00 am,0,2025-05-30 07:50:00,8.8813,6.425,0.00030000000000001136
KER-1,5/30/2025,08:00:00 am,0,2025-05-30 08:00:00,8.8819,6.428,0.0001000000000000334
KER-1,5/30/2025,08:10:00 am,0,2025-05-30 08:10:00,8.8821,6.429,0.00030000000000001136
KER-1,5/30/2025,08:20:00 am,0,2025-05-30 08:20:00,8.8823,6.432,0.00019999999999997797
KER-1,5/30/2025,08:30:00 am,0,2025-05-30 08:30:00,8.8818,6.434,0.00019999999999997797
KER-1,5/30/2025,08:40:00 am,0,2025-05-30 08:40:00,8.8806,6.436,0.0
KER-1,5/30/2025,08:50:00 am,0,2025-05-30 08:50:00,8.8791,6.436,0.00040000000000004474
KER-1,5/30/2025,09:00:00 am,0,2025-05-30 09:00:00,8.8788,6.44,0.00019999999999997797
KER-1,5/30/2025,09:10:00 am,0,2025-05-30 09:10:00,8.8782,6.442,9.999999999994457e-05
KER-1,5/30/2025,09:20:00 am,0,2025-05-30 09:20:00,8.8766,6.443,0.00030000000000001136
KER-1,5/30/2025,09:30:00 am,0,2025-05-30 09:30:00,8.8756,6.446,0.0002000000000000668
KER-1,5/30/2025,09:40:00 am,0,2025-05-30 09:40:00,8.8746,6.448,9.999999999994457e-05
KER-1,5/30/2025,09:50:00 am,0,2025-05-30 09:50:00,8.8734,6.449,0.00040000000000004474
KER-1,5/30/2025,10:00:00 am,0,2025-05-30 10:00:00,8.8715,6.453,0.0
KER-1,5/30/2025,10:10:00 am,0,2025-05-30 10:10:00,8.8708,6.453,0.00019999999999997797
KER-1,5/30/2025,10:20:00 am,0,2025-05-30 10:20:00,8.8699,6.455,0.00030000000000001136
KER-1,5/30/2025,10:30:00 am,0,2025-05-30 10:30:00,8.8696,6.458,0.00019999999999997797
KER-1,5/30/2025,10:40:00 am,0,2025-05-30 10:40:00,8.868,6.46,0.00019999999999997797
KER-1,5/30/2025,10:50:00 am,0,2025-05-30 10:50:00,8.8674,6.462,0.00030000000000001136
KER-1,5/30/2025,11:00:00 am,0,2025-05-30 11:00:00,8.8658,6.465,0.0
KER-1,5/30/2025,11:10:00 am,0,2025-05-30 11:10:00,8.8648,6.465,0.00030000000000001136
KER-1,5/30/2025,11:20:00 am,0,2025-05-30 11:20:00,8.8635,6.468,0.00019999999999997797
KER-1,5/30/2025,11:30:00 am,0,2025-05-30 11:30:00,8.8633,6.47,0.00030000000000001136
KER-1,5/30/2025,11:40:00 am,0,2025-05-30 11:40:00,8.8614,6.473,0.00019999999999997797
KER-1,5/30/2025,11:50:00 am,0,2025-05-30 11:50:00,8.8607,6.475,0.0002000000000000668
KER-1,5/30/2025,12:00:00 pm,0,2025-05-30 12:00:00,8.8589,6.477,0.00019999999999997797
KER-1,5/30/2025,12:10:00 pm,0,2025-05-30 12:10:00,8.8575,6.479,0.0001000000000000334
KER-1,5/30/2025,12:20:00 pm,0,2025-05-30 12:20:00,8.8564,6.48,9.999999999994457e-05
KER-1,5/30/2025,12:30:00 pm,0,2025-05-30 12:30:00,8.8545,6.481,0.0001000000000000334
KER-1,5/30/2025,12:40:00 pm,0,2025-05-30 12:40:00,8.854,6.482,9.999999999994457e-05
KER-1,5/30/2025,12:50:00 pm,0,2025-05-30 12:50:00,8.8523,6.483,0.0002000000000000668
KER-1,5/30/2025,01:00:00 pm,0,2025-05-30 13:00:00,8.8516,6.485,9.999999999994457e-05
KER-1,5/30/2025,01:10:00 pm,0,2025-05-30 13:10:00,8.8503,6.486,0.00019999999999997797
KER-1,5/30/2025,01:20:00 pm,0,2025-05-30 13:20:00,8.8487,6.484,0.0001000000000000334
KER-1,5/30/2025,01:30:00 pm,0,2025-05-30 13:30:00,8.848,6.485,0.00030000000000001136
KER-1,5/30/2025,01:40:00 pm,0,2025-05-30 13:40:00,8.847,6.488,9.999999999994457e-05
KER-1,5/30/2025,01:50:00 pm,0,2025-05-30 13:50:00,8.846,6.489,9.999999999994457e-05
KER-1,5/30/2025,02:00:00 pm,0,2025-05-30 14:00:00,8.8449,6.488,0.00019999999999997797
KER-1,5/30/2025,02:10:00 pm,0,2025-05-30 14:10:00,8.844,6.49,0.0
KER-1,5/30/2025,02:20:00 pm,0,2025-05-30 14:20:00,8.8426,6.49,0.00019999999999997797
KER-1,5/30/2025,02:30:00 pm,0,2025-05-30 14:30:00,8.842,6.492,0.0
KER-1,5/30/2025,02:40:00 pm,0,2025-05-30 14:40:00,8.8414,6.492,0.0
KER-1,5/30/2025,02:50:00 pm,0,2025-05-30 14:50:00,8.8402,6.492,0.0001000000000000334
KER-1,5/30/2025,03:00:00 pm,0,2025-05-30 15:00:00,8.8394,6.491,0.0002000000000000668
KER-1,5/30/2025,03:10:00 pm,0,2025-05-30 15:10:00,8.8391,6.493,0.0001000000000000334
KER-1,5/30/2025,03:20:00 pm,0,2025-05-30 15:20:00,8.8391,6.492,0.0001000000000000334
KER-1,5/30/2025,03:30:00 pm,0,2025-05-30 15:30:00,8.8384,6.493,0.00039999999999995595
KER-1,5/30/2025,03:40:00 pm,0,2025-05-30 15:40:00,8.8377,6.497,0.00019999999999997797
KER-1,5/30/2025,03:50:00 pm,0,2025-05-30 15:50:00,8.838,6.499,0.0
KER-1,5/30/2025,04:00:00 pm,0,2025-05-30 16:00:00,8.8365,6.499,0.0001000000000000334
KER-1,5/30/2025,04:10:00 pm,0,2025-05-30 16:10:00,8.8372,6.5,0.0001000000000000334
KER-1,5/30/2025,04:20:00 pm,0,2025-05-30 16:20:00,8.8374,6.501,0.00019999999999997797
KER-1,5/30/2025,04:30:00 pm,0,2025-05-30 16:30:00,8.8374,6.503,0.0
KER-1,5/30/2025,04:40:00 pm,0,2025-05-30 16:40:00,8.8378,6.503,9.999999999994457e-05
KER-1,5/30/2025,04:50:00 pm,0,2025-05-30 16:50:00,8.8383,6.504,0.0001000000000000334
KER-1,5/30/2025,05:00:00 pm,0,2025-05-30 17:00:00,8.8389,6.505,0.00040000000000004474
KER-1,5/30/2025,05:10:00 pm,0,2025-05-30 17:10:00,8.8397,6.509,0.0001000000000000334
KER-1,5/30/2025,05:20:00 pm,0,2025-05-30 17:20:00,8.8397,6.508,0.0
KER-1,5/30/2025,05:30:00 pm,0,2025-05-30 17:30:00,8.8403,6.508,0.0001000000000000334
KER-1,5/30/2025,05:40:00 pm,0,2025-05-30 17:40:00,8.8409,6.509,9.999999999994457e-05
KER-1,5/30/2025,05:50:00 pm,0,2025-05-30 17:50:00,8.8412,6.51,0.0
KER-1,5/30/2025,06:00:00 pm,0,2025-05-30 18:00:00,8.8417,6.51,0.0001000000000000334
KER-1,5/30/2025,06:10:00 pm,0,2025-05-30 18:10:00,8.8416,6.511,0.00019999999999997797
KER-1,5/30/2025,06:20:00 pm,0,2025-05-30 18:20:00,8.8417,6.513,0.0001000000000000334
KER-1,5/30/2025,06:30:00 pm,0,2025-05-30 18:30:00,8.8422,6.512,0.0
KER-1,5/30/2025,06:40:00 pm,0,2025-05-30 18:40:00,8.8428,6.512,0.0002000000000000668
KER-1,5/30/2025,06:50:00 pm,0,2025-05-30 18:50:00,8.8439,6.514,0.0
KER-1,5/30/2025,07:00:00 pm,0,2025-05-30 19:00:00,8.8452,6.514,0.00019999999999997797
KER-1,5/30/2025,07:10:00 pm,0,2025-05-30 19:10:00,8.8462,6.516,0.0
KER-1,5/30/2025,07:20:00 pm,0,2025-05-30 19:20:00,8.8466,6.516,0.0001000000000000334
KER-1,5/30/2025,07:30:00 pm,0,2025-05-30 19:30:00,8.8478,6.517,0.00019999999999997797
KER-1,5/30/2025,07:40:00 pm,0,2025-05-30 19:40:00,8.8491,6.519,0.0001000000000000334
KER-1,5/30/2025,07:50:00 pm,0,2025-05-30 19:50:00,8.8503,6.518,0.0001000000000000334
KER-1,5/30/2025,08:00:00 pm,0,2025-05-30 20:00:00,8.8508,6.519,0.0
KER-1,5/30/2025,08:10:00 pm,0,2025-05-30 20:10:00,8.8513,6.519,9.999999999994457e-05
KER-1,5/30/2025,08:20:00 pm,0,2025-05-30 20:20:00,8.8521,6.52,0.0001000000000000334
KER-1,5/30/2025,08:30:00 pm,0,2025-05-30 20:30:00,8.8528,6.521,0.00019999999999997797
KER-1,5/30/2025,08:40:00 pm,0,2025-05-30 20:40:00,8.8539,6.523,0.0
KER-1,5/30/2025,08:50:00 pm,0,2025-05-30 20:50:00,8.8549,6.523,0.0
KER-1,5/30/2025,09:00:00 pm,0,2025-05-30 21:00:00,8.8554,6.523,0.0
KER-1,5/30/2025,09:10:00 pm,0,2025-05-30 21:10:00,8.8566,6.523,0.0002000000000000668
KER-1,5/30/2025,09:20:00 pm,0,2025-05-30 21:20:00,8.8578,6.525,0.00019999999999997797
KER-1,5/30/2025,09:30:00 pm,0,2025-05-30 21:30:00,8.8593,6.527,0.00019999999999997797
KER-1,5/30/2025,09:40:00 pm,0,2025-05-30 21:40:00,8.8615,6.525,0.00039999999999995595
KER-1,5/30/2025,09:50:00 pm,0,2025-05-30 21:50:00,8.8623,6.529,0.0
KER-1,5/30/2025,10:00:00 pm,0,2025-05-30 22:00:00,8.8637,6.529,0.00030000000000001136
KER-1,5/30/2025,10:10:00 pm,0,2025-05-30 22:10:00,8.8652,6.532,0.0001000000000000334
KER-1,5/30/2025,10:20:00 pm,0,2025-05-30 22:20:00,8.8653,6.533,0.00019999999999997797
KER-1,5/30/2025,10:30:00 pm,0,2025-05-30 22:30:00,8.8662,6.535,0.0001000000000000334
KER-1,5/30/2025,10:40:00 pm,0,2025-05-30 22:40:00,8.8671,6.534,0.00019999999999997797
KER-1,5/30/2025,10:50:00 pm,0,2025-05-30 22:50:00,8.8668,6.536,0.0002000000000000668
KER-1,5/30/2025,11:00:00 pm,0,2025-05-30 23:00:00,8.867,6.538,0.0001000000000000334
KER-1,5/30/2025,11:10:00 pm,0,2025-05-30 23:10:00,8.8669,6.537,0.00019999999999997797
KER-1,5/30/2025,11:20:00 pm,0,2025-05-30 23:20:00,8.8669,6.539,0.0001000000000000334
KER-1,5/30/2025,11:30:00 pm,0,2025-05-30 23:30:00,8.867,6.54,0.00019999999999997797
KER-1,5/30/2025,11:40:00 pm,0,2025-05-30 23:40:00,8.867,6.542,0.00019999999999997797
KER-1,5/30/2025,11:50:00 pm,0,2025-05-30 23:50:00,8.8665,6.544,0.0
KER-1,5/31/2025,12:00:00 am,0,2025-05-31 00:00:00,8.8665,6.544,0.00030000000000001136
KER-1,5/31/2025,12:10:00 am,0,2025-05-31 00:10:00,8.866,6.547,0.00030000000000001136
KER-1,5/31/2025,12:20:00 am,0,2025-05-31 00:20:00,8.866,6.544,0.0005000000000000782
KER-1,5/31/2025,12:30:00 am,0,2025-05-31 00:30:00,8.8661,6.549,0.0
KER-1,5/31/2025,12:40:00 am,0,2025-05-31 00:40:00,8.8659,6.549,0.0
KER-1,5/31/2025,12:50:00 am,0,2025-05-31 00:50:00,8.8656,6.549,0.00029999999999992256
KER-1,5/31/2025,01:00:00 am,0,2025-05-31 01:00:00,8.8651,6.552,0.0002000000000000668
KER-1,5/31/2025,01:10:00 am,0,2025-05-31 01:10:00,8.8654,6.554,0.0001000000000000334
KER-1,5/31/2025,01:20:00 am,0,2025-05-31 01:20:00,8.8658,6.553,0.00019999999999997797
KER-1,5/31/2025,01:30:00 am,0,2025-05-31 01:30:00,8.8657,6.555,0.0002000000000000668
KER-1,5/31/2025,01:40:00 am,0,2025-05-31 01:40:00,8.8655,6.557,0.0
KER-1,5/31/2025,01:50:00 am,0,2025-05-31 01:50:00,8.865,6.557,0.00019999999999997797
KER-1,5/31/2025,02:00:00 am,0,2025-05-31 02:00:00,8.864,6.559,9.999999999994457e-05
KER-1,5/31/2025,02:10:00 am,0,2025-05-31 02:10:00,8.864,6.56,0.0002000000000000668
KER-1,5/31/2025,02:20:00 am,0,2025-05-31 02:20:00,8.8644,6.562,0.00030000000000001136
KER-1,5/31/2025,02:30:00 am,0,2025-05-31 02:30:00,8.864,6.565,0.0001000000000000334
KER-1,5/31/2025,02:40:00 am,0,2025-05-31 02:40:00,8.8642,6.564,0.00019999999999997797
KER-1,5/31/2025,02:50:00 am,0,2025-05-31 02:50:00,8.8639,6.566,0.0
KER-1,5/31/2025,03:00:00 am,0,2025-05-31 03:00:00,8.8643,6.566,0.00030000000000001136
KER-1,5/31/2025,03:10:00 am,0,2025-05-31 03:10:00,8.8645,6.569,0.0001000000000000334
KER-1,5/31/2025,03:20:00 am,0,2025-05-31 03:20:00,8.864,6.57,9.999999999994457e-05
KER-1,5/31/2025,03:30:00 am,0,2025-05-31 03:30:00,8.8645,6.571,0.0001000000000000334
KER-1,5/31/2025,03:40:00 am,0,2025-05-31 03:40:00,8.8648,6.572,0.00030000000000001136
KER-1,5/31/2025,03:50:00 am,0,2025-05-31 03:50:00,8.8647,6.575,9.999999999994457e-05
KER-1,5/31/2025,04:00:00 am,0,2025-05-31 04:00:00,8.8646,6.576,0.0002000000000000668
KER-1,5/31/2025,04:10:00 am,0,2025-05-31 04:10:00,8.8642,6.578,0.0
KER-1,5/31/2025,04:20:00 am,0,2025-05-31 04:20:00,8.8639,6.578,9.999999999994457e-05
KER-1,5/31/2025,04:30:00 am,0,2025-05-31 04:30:00,8.8637,6.579,0.0002000000000000668
KER-1,5/31/2025,04:40:00 am,0,2025-05-31 04:40:00,8.8648,6.581,0.00029999999999992256
KER-1,5/31/2025,04:50:00 am,0,2025-05-31 04:50:00,8.8652,6.584,0.0001000000000000334
KER-1,5/31/2025,05:00:00 am,0,2025-05-31 05:00:00,8.865,6.585,0.0001000000000000334
KER-1,5/31/2025,05:10:00 am,0,2025-05-31 05:10:00,8.865,6.586,9.999999999994457e-05
KER-1,5/31/2025,05:20:00 am,0,2025-05-31 05:20:00,8.8655,6.587,0.0001000000000000334
KER-1,5/31/2025,05:30:00 am,0,2025-05-31 05:30:00,8.8656,6.588,0.00030000000000001136
KER-1,5/31/2025,05:40:00 am,0,2025-05-31 05:40:00,8.866,6.591,9.999999999994457e-05
KER-1,5/31/2025,05:50:00 am,0,2025-05-31 05:50:00,8.8661,6.592,0.0001000000000000334
KER-1,5/31/2025,06:00:00 am,0,2025-05-31 06:00:00,8.8665,6.593,0.0001000000000000334
KER-1,5/31/2025,06:10:00 am,0,2025-05-31 06:10:00,8.8668,6.594,0.00030000000000001136
KER-1,5/31/2025,06:20:00 am,0,2025-05-31 06:20:00,8.8673,6.597,0.00019999999999997797
KER-1,5/31/2025,06:30:00 am,0,2025-05-31 06:30:00,8.8676,6.599,0.00030000000000001136
KER-1,5/31/2025,06:40:00 am,0,2025-05-31 06:40:00,8.8679,6.602,9.999999999994457e-05
KER-1,5/31/2025,06:50:00 am,0,2025-05-31 06:50:00,8.8682,6.603,0.0
KER-1,5/31/2025,07:00:00 am,0,2025-05-31 07:00:00,8.8683,6.603,0.0004999999999999894
KER-1,5/31/2025,07:10:00 am,0,2025-05-31 07:10:00,8.868,6.608,0.0
KER-1,5/31/2025,07:20:00 am,0,2025-05-31 07:20:00,8.8675,6.608,0.00040000000000004474
KER-1,5/31/2025,07:30:00 am,0,2025-05-31 07:30:00,8.8668,6.612,0.0
KER-1,5/31/2025,07:40:00 am,0,2025-05-31 07:40:00,8.8666,6.612,0.00030000000000001136
KER-1,5/31/2025,07:50:00 am,0,2025-05-31 07:50:00,8.8668,6.615,9.999999999994457e-05
KER-1,5/31/2025,08:00:00 am,0,2025-05-31 08:00:00,8.8666,6.616,0.0001000000000000334
KER-1,5/31/2025,08:10:00 am,0,2025-05-31 08:10:00,8.8656,6.617,0.00040000000000004474
KER-1,5/31/2025,08:20:00 am,0,2025-05-31 08:20:00,8.8648,6.621,0.00019999999999997797
KER-1,5/31/2025,08:30:00 am,0,2025-05-31 08:30:00,8.864,6.623,9.999999999994457e-05
KER-1,5/31/2025,08:40:00 am,0,2025-05-31 08:40:00,8.863,6.624,0.00030000000000001136
KER-1,5/31/2025,08:50:00 am,0,2025-05-31 08:50:00,8.8617,6.627,0.00019999999999997797
KER-1,5/31/2025,09:00:00 am,0,2025-05-31 09:00:00,8.8596,6.629,0.00040000000000004474
KER-1,5/31/2025,09:10:00 am,0,2025-05-31 09:10:00,8.8584,6.633,0.0001000000000000334
KER-1,5/31/2025,09:20:00 am,0,2025-05-31 09:20:00,8.8572,6.632,0.0006000000000000227
KER-1,5/31/2025,09:30:00 am,0,2025-05-31 09:30:00,8.8558,6.638,0.0001000000000000334
KER-1,5/31/2025,09:40:00 am,0,2025-05-31 09:40:00,8.8535,6.639,0.00019999999999997797
KER-1,5/31/2025,09:50:00 am,0,2025-05-31 09:50:00,8.8516,6.641,0.00030000000000001136
KER-1,5/31/2025,10:00:00 am,0,2025-05-31 10:00:00,8.8499,6.644,0.00039999999999995595
KER-1,5/31/2025,10:10:00 am,0,2025-05-31 10:10:00,8.848,6.648,0.0001000000000000334
KER-1,5/31/2025,10:20:00 am,0,2025-05-31 10:20:00,8.8463,6.649,0.00019999999999997797
KER-1,5/31/2025,10:30:00 am,0,2025-05-31 10:30:00,8.8454,6.651,0.00019999999999997797
KER-1,5/31/2025,10:40:00 am,0,2025-05-31 10:40:00,8.8435,6.653,0.00040000000000004474
KER-1,5/31/2025,10:50:00 am,0,2025-05-31 10:50:00,8.8418,6.657,0.0001000000000000334
KER-1,5/31/2025,11:00:00 am,0,2025-05-31 11:00:00,8.8397,6.658,0.00029999999999992256
KER-1,5/31/2025,11:10:00 am,0,2025-05-31 11:10:00,8.8383,6.661,0.00040000000000004474
KER-1,5/31/2025,11:20:00 am,0,2025-05-31 11:20:00,8.8365,6.665,0.0001000000000000334
KER-1,5/31/2025,11:30:00 am,0,2025-05-31 11:30:00,8.8356,6.666,0.00029999999999992256
KER-1,5/31/2025,11:40:00 am,0,2025-05-31 11:40:00,8.8338,6.669,0.00040000000000004474
KER-1,5/31/2025,11:50:00 am,0,2025-05-31 11:50:00,8.832,6.673,0.0
KER-1,5/31/2025,12:00:00 pm,0,2025-05-31 12:00:00,8.8301,6.673,0.00019999999999997797
KER-1,5/31/2025,12:10:00 pm,0,2025-05-31 12:10:00,8.8298,6.675,0.00019999999999997797
KER-1,5/31/2025,12:20:00 pm,0,2025-05-31 12:20:00,8.8284,6.677,0.0001000000000000334
KER-1,5/31/2025,12:30:00 pm,0,2025-05-31 12:30:00,8.8274,6.678,0.0
KER-1,5/31/2025,12:40:00 pm,0,2025-05-31 12:40:00,8.8261,6.678,0.0
KER-1,5/31/2025,12:50:00 pm,0,2025-05-31 12:50:00,8.8242,6.678,0.0001000000000000334
KER-1,5/31/2025,01:00:00 pm,0,2025-05-31 13:00:00,8.8242,6.679,0.00030000000000001136
KER-1,5/31/2025,01:10:00 pm,0,2025-05-31 13:10:00,8.822,6.682,0.00030000000000001136
KER-1,5/31/2025,01:20:00 pm,0,2025-05-31 13:20:00,8.8211,6.679,0.00030000000000001136
KER-1,5/31/2025,01:30:00 pm,0,2025-05-31 13:30:00,8.8205,6.682,0.0
KER-1,5/31/2025,01:40:00 pm,0,2025-05-31 13:40:00,8.82,6.682,0.0
KER-1,5/31/2025,01:50:00 pm,0,2025-05-31 13:50:00,8.8198,6.682,0.0
KER-1,5/31/2025,02:00:00 pm,0,2025-05-31 14:00:00,8.8191,6.682,9.999999999994457e-05
KER-1,5/31/2025,02:10:00 pm,0,2025-05-31 14:10:00,8.818,6.683,0.0
KER-1,5/31/2025,02:20:00 pm,0,2025-05-31 14:20:00,8.8176,6.683,0.0001000000000000334
KER-1,5/31/2025,02:30:00 pm,0,2025-05-31 14:30:00,8.8168,6.684,9.999999999994457e-05
KER-1,5/31/2025,02:40:00 pm,0,2025-05-31 14:40:00,8.8161,6.685,0.0
KER-1,5/31/2025,02:50:00 pm,0,2025-05-31 14:50:00,8.8151,6.685,0.0001000000000000334
KER-1,5/31/2025,03:00:00 pm,0,2025-05-31 15:00:00,8.8151,6.686,0.0
KER-1,5/31/2025,03:10:00 pm,0,2025-05-31 15:10:00,8.8141,6.686,0.0001000000000000334
KER-1,5/31/2025,03:20:00 pm,0,2025-05-31 15:20:00,8.8144,6.687,9.999999999994457e-05
KER-1,5/31/2025,03:30:00 pm,0,2025-05-31 15:30:00,8.8137,6.688,0.0002000000000000668
KER-1,5/31/2025,03:40:00 pm,0,2025-05-31 15:40:00,8.8129,6.69,0.00019999999999997797
KER-1,5/31/2025,03:50:00 pm,0,2025-05-31 15:50:00,8.8126,6.692,9.999999999994457e-05
KER-1,5/31/2025,04:00:00 pm,0,2025-05-31 16:00:00,8.8121,6.693,0.00030000000000001136
KER-1,5/31/2025,04:10:00 pm,0,2025-05-31 16:10:00,8.8123,6.696,0.0001000000000000334
KER-1,5/31/2025,04:20:00 pm,0,2025-05-31 16:20:00,8.8123,6.697,0.00019999999999997797
KER-1,5/31/2025,04:30:00 pm,0,2025-05-31 16:30:00,8.8125,6.695,0.0005999999999999339
KER-1,5/31/2025,04:40:00 pm,0,2025-05-31 16:40:00,8.8123,6.701,0.00019999999999997797
KER-1,5/31/2025,04:50:00 pm,0,2025-05-31 16:50:00,8.8128,6.699,0.00030000000000001136
KER-1,5/31/2025,05:00:00 pm,0,2025-05-31 17:00:00,8.8133,6.702,0.0001000000000000334
KER-1,5/31/2025,05:10:00 pm,0,2025-05-31 17:10:00,8.8135,6.701,0.0001000000000000334
KER-1,5/31/2025,05:20:00 pm,0,2025-05-31 17:20:00,8.8135,6.702,0.00019999999999997797
KER-1,5/31/2025,05:30:00 pm,0,2025-05-31 17:30:00,8.8137,6.704,0.0
KER-1,5/31/2025,05:40:00 pm,0,2025-05-31 17:40:00,8.8127,6.704,0.00040000000000004474
KER-1,5/31/2025,05:50:00 pm,0,2025-05-31 17:50:00,8.8128,6.708,0.00019999999999997797
KER-1,5/31/2025,06:00:00 pm,0,2025-05-31 18:00:00,8.8122,6.706,0.00019999999999997797
KER-1,5/31/2025,06:10:00 pm,0,2025-05-31 18:10:00,8.8123,6.708,0.0001000000000000334
KER-1,5/31/2025,06:20:00 pm,0,2025-05-31 18:20:00,8.8124,6.707,0.00040000000000004474
KER-1,5/31/2025,06:30:00 pm,0,2025-05-31 18:30:00,8.8126,6.711,0.0001000000000000334
KER-1,5/31/2025,06:40:00 pm,0,2025-05-31 18:40:00,8.8127,6.71,0.00019999999999997797
KER-1,5/31/2025,06:50:00 pm,0,2025-05-31 18:50:00,8.8136,6.712,0.0
KER-1,5/31/2025,07:00:00 pm,0,2025-05-31 19:00:00,8.8142,6.712,0.0
KER-1,5/31/2025,07:10:00 pm,0,2025-05-31 19:10:00,8.8157,6.712,0.00030000000000001136
KER-1,5/31/2025,07:20:00 pm,0,2025-05-31 19:20:00,8.8167,6.715,0.00019999999999997797
KER-1,5/31/2025,07:30:00 pm,0,2025-05-31 19:30:00,8.8178,6.717,0.0
KER-1,5/31/2025,07:40:00 pm,0,2025-05-31 19:40:00,8.8192,6.717,0.0
KER-1,5/31/2025,07:50:00 pm,0,2025-05-31 19:50:00,8.8193,6.717,0.0005000000000000782
KER-1,5/31/2025,08:00:00 pm,0,2025-05-31 20:00:00,8.8196,6.722,0.0005000000000000782
KER-1,5/31/2025,08:10:00 pm,0,2025-05-31 20:10:00,8.82,6.717,0.0005000000000000782
KER-1,5/31/2025,08:20:00 pm,0,2025-05-31 20:20:00,8.8202,6.722,0.0001000000000000334
KER-1,5/31/2025,08:30:00 pm,0,2025-05-31 20:30:00,8.8204,6.721,0.00019999999999997797
KER-1,5/31/2025,08:40:00 pm,0,2025-05-31 20:40:00,8.8214,6.723,0.0001000000000000334
KER-1,5/31/2025,08:50:00 pm,0,2025-05-31 20:50:00,8.8218,6.724,0.00019999999999997797
KER-1,5/31/2025,09:00:00 pm,0,2025-05-31 21:00:00,8.8225,6.726,0.0001000000000000334
KER-1,5/31/2025,09:10:00 pm,0,2025-05-31 21:10:00,8.8236,6.727,0.0004999999999999894
KER-1,5/31/2025,09:20:00 pm,0,2025-05-31 21:20:00,8.8246,6.732,0.0
KER-1,5/31/2025,09:30:00 pm,0,2025-05-31 21:30:00,8.825,6.732,0.00039999999999995595
KER-1,5/31/2025,09:40:00 pm,0,2025-05-31 21:40:00,8.8258,6.736,9.999999999994457e-05
KER-1,5/31/2025,09:50:00 pm,0,2025-05-31 21:50:00,8.8264,6.735,0.0
KER-1,5/31/2025,10:00:00 pm,0,2025-05-31 22:00:00,8.8266,6.735,0.00030000000000001136
KER-1,5/31/2025,10:10:00 pm,0,2025-05-31 22:10:00,8.8261,6.738,9.999999999994457e-05
KER-1,5/31/2025,10:20:00 pm,0,2025-05-31 22:20:00,8.8257,6.739,9.999999999994457e-05
KER-1,5/31/2025,10:30:00 pm,0,2025-05-31 22:30:00,8.826,6.738,0.00039999999999995595
KER-1,5/31/2025,10:40:00 pm,0,2025-05-31 22:40:00,8.8272,6.742,0.00019999999999997797
KER-1,5/31/2025,10:50:00 pm,0,2025-05-31 22:50:00,8.8273,6.744,0.0002000000000000668
KER-1,5/31/2025,11:00:00 pm,0,2025-05-31 23:00:00,8.8278,6.746,0.00029999999999992256
KER-1,5/31/2025,11:10:00 pm,0,2025-05-31 23:10:00,8.8281,6.749,0.0
KER-1,5/31/2025,11:20:00 pm,0,2025-05-31 23:20:00,8.8277,6.749,0.00030000000000001136
KER-1,5/31/2025,11:30:00 pm,0,2025-05-31 23:30:00,8.8279,6.752,0.00019999999999997797
KER-1,5/31/2025,11:40:00 pm,0,2025-05-31 23:40:00,8.8281,6.754,0.0
KER-1,5/31/2025,11:50:00 pm,0,2025-05-31 23:50:00,8.8277,6.754,0.0001000000000000334
KER-1,6/1/2025,12:00:00 am,0,2025-06-01 00:00:00,8.8269,6.755,0.00030000000000001136
KER-1,6/1/2025,12:10:00 am,0,2025-06-01 00:10:00,8.8264,6.758,0.00019999999999997797
KER-1,6/1/2025,12:20:00 am,0,2025-06-01 00:20:00,8.8253,6.76,0.00019999999999997797
KER-1,6/1/2025,12:30:00 am,0,2025-06-01 00:30:00,8.8241,6.762,0.0001000000000000334
KER-1,6/1/2025,12:40:00 am,0,2025-06-01 00:40:00,8.8229,6.763,0.00019999999999997797
KER-1,6/1/2025,12:50:00 am,0,2025-06-01 00:50:00,8.8216,6.765,0.00030000000000001136
KER-1,6/1/2025,01:00:00 am,0,2025-06-01 01:00:00,8.8213,6.768,0.00019999999999997797
KER-1,6/1/2025,01:10:00 am,0,2025-06-01 01:10:00,8.8215,6.77,9.999999999994457e-05
KER-1,6/1/2025,01:20:00 am,0,2025-06-01 01:20:00,8.8209,6.769,0.00019999999999997797
KER-1,6/1/2025,01:30:00 am,0,2025-06-01 01:30:00,8.8209,6.771,0.00030000000000001136
KER-1,6/1/2025,01:40:00 am,0,2025-06-01 01:40:00,8.8209,6.774,0.0001000000000000334
KER-1,6/1/2025,01:50:00 am,0,2025-06-01 01:50:00,8.8208,6.775,0.00019999999999997797
KER-1,6/1/2025,02:00:00 am,0,2025-06-01 02:00:00,8.8206,6.777,9.999999999994457e-05
KER-1,6/1/2025,02:10:00 am,0,2025-06-01 02:10:00,8.82,6.778,0.0002000000000000668
KER-1,6/1/2025,02:20:00 am,0,2025-06-01 02:20:00,8.82,6.78,0.0001000000000000334
KER-1,6/1/2025,02:30:00 am,0,2025-06-01 02:30:00,8.8207,6.779,0.00030000000000001136
KER-1,6/1/2025,02:40:00 am,0,2025-06-01 02:40:00,8.8201,6.782,0.00030000000000001136
KER-1,6/1/2025,02:50:00 am,0,2025-06-01 02:50:00,8.8197,6.785,0.0001000000000000334
KER-1,6/1/2025,03:00:00 am,0,2025-06-01 03:00:00,8.8192,6.784,0.00040000000000004474
KER-1,6/1/2025,03:10:00 am,0,2025-06-01 03:10:00,8.819,6.788,0.0001000000000000334
KER-1,6/1/2025,03:20:00 am,0,2025-06-01 03:20:00,8.8187,6.787,0.00019999999999997797
KER-1,6/1/2025,03:30:00 am,0,2025-06-01 03:30:00,8.8187,6.789,0.0002000000000000668
KER-1,6/1/2025,03:40:00 am,0,2025-06-01 03:40:00,8.8183,6.791,0.00019999999999997797
KER-1,6/1/2025,03:50:00 am,0,2025-06-01 03:50:00,8.8183,6.793,9.999999999994457e-05
KER-1,6/1/2025,04:00:00 am,0,2025-06-01 04:00:00,8.8181,6.794,0.0
KER-1,6/1/2025,04:10:00 am,0,2025-06-01 04:10:00,8.8176,6.794,0.00030000000000001136
KER-1,6/1/2025,04:20:00 am,0,2025-06-01 04:20:00,8.8172,6.797,0.0002000000000000668
KER-1,6/1/2025,04:30:00 am,0,2025-06-01 04:30:00,8.8167,6.799,0.00029999999999992256
KER-1,6/1/2025,04:40:00 am,0,2025-06-01 04:40:00,8.8165,6.802,9.999999999994457e-05
KER-1,6/1/2025,04:50:00 am,0,2025-06-01 04:50:00,8.8157,6.801,0.00019999999999997797
KER-1,6/1/2025,05:00:00 am,0,2025-06-01 05:00:00,8.8156,6.803,0.00030000000000001136
KER-1,6/1/2025,05:10:00 am,0,2025-06-01 05:10:00,8.8158,6.806,0.0001000000000000334
KER-1,6/1/2025,05:20:00 am,0,2025-06-01 05:20:00,8.8156,6.805,0.00030000000000001136
KER-1,6/1/2025,05:30:00 am,0,2025-06-01 05:30:00,8.8149,6.808,0.00030000000000001136
KER-1,6/1/2025,05:40:00 am,0,2025-06-01 05:40:00,8.8148,6.811,0.0001000000000000334
KER-1,6/1/2025,05:50:00 am,0,2025-06-01 05:50:00,8.8145,6.812,0.0
KER-1,6/1/2025,06:00:00 am,0,2025-06-01 06:00:00,8.8142,6.812,0.00030000000000001136
KER-1,6/1/2025,06:10:00 am,0,2025-06-01 06:10:00,8.8135,6.815,0.00019999999999997797
KER-1,6/1/2025,06:20:00 am,0,2025-06-01 06:20:00,8.8129,6.817,0.00019999999999997797
KER-1,6/1/2025,06:30:00 am,0,2025-06-01 06:30:00,8.813,6.819,0.00019999999999997797
KER-1,6/1/2025,06:40:00 am,0,2025-06-01 06:40:00,8.8135,6.821,0.0
KER-1,6/1/2025,06:50:00 am,0,2025-06-01 06:50:00,8.8141,6.821,0.0006000000000000227
KER-1,6/1/2025,07:00:00 am,0,2025-06-01 07:00:00,8.8144,6.827,0.0001000000000000334
KER-1,6/1/2025,07:10:00 am,0,2025-06-01 07:10:00,8.8143,6.826,0.00040000000000004474
KER-1,6/1/2025,07:20:00 am,0,2025-06-01 07:20:00,8.8134,6.83,0.0
KER-1,6/1/2025,07:30:00 am,0,2025-06-01 07:30:00,8.8126,6.83,0.00039999999999995595
KER-1,6/1/2025,07:40:00 am,0,2025-06-01 07:40:00,8.8116,6.834,0.0001000000000000334
KER-1,6/1/2025,07:50:00 am,0,2025-06-01 07:50:00,8.811,6.835,0.00019999999999997797
KER-1,6/1/2025,08:00:00 am,0,2025-06-01 08:00:00,8.8098,6.837,0.00040000000000004474
KER-1,6/1/2025,08:10:00 am,0,2025-06-01 08:10:00,8.8087,6.841,0.00030000000000001136
KER-1,6/1/2025,08:20:00 am,0,2025-06-01 08:20:00,8.8072,6.844,0.0
KER-1,6/1/2025,08:30:00 am,0,2025-06-01 08:30:00,8.805,6.844,0.00030000000000001136
KER-1,6/1/2025,08:40:00 am,0,2025-06-01 08:40:00,8.8039,6.847,0.0004999999999999894
KER-1,6/1/2025,08:50:00 am,0,2025-06-01 08:50:00,8.8024,6.852,9.999999999994457e-05
KER-1,6/1/2025,09:00:00 am,0,2025-06-01 09:00:00,8.8003,6.853,0.0002000000000000668
KER-1,6/1/2025,09:10:00 am,0,2025-06-01 09:10:00,8.7989,6.855,9.999999999994457e-05
KER-1,6/1/2025,09:20:00 am,0,2025-06-01 09:20:00,8.7975,6.856,0.0004999999999999894
KER-1,6/1/2025,09:30:00 am,0,2025-06-01 09:30:00,8.7969,6.861,0.0001000000000000334
KER-1,6/1/2025,09:40:00 am,0,2025-06-01 09:40:00,8.7956,6.862,0.0
KER-1,6/1/2025,09:50:00 am,0,2025-06-01 09:50:00,8.7936,6.862,0.00039999999999995595
KER-1,6/1/2025,10:00:00 am,0,2025-06-01 10:00:00,8.7927,6.866,0.0002000000000000668
KER-1,6/1/2025,10:10:00 am,0,2025-06-01 10:10:00,8.7914,6.868,9.999999999994457e-05
KER-1,6/1/2025,10:20:00 am,0,2025-06-01 10:20:00,8.791,6.869,0.0004999999999999894
KER-1,6/1/2025,10:30:00 am,0,2025-06-01 10:30:00,8.7899,6.874,0.0
KER-1,6/1/2025,10:40:00 am,0,2025-06-01 10:40:00,8.7883,6.874,0.00030000000000001136
KER-1,6/1/2025,10:50:00 am,0,2025-06-01 10:50:00,8.7865,6.877,0.00019999999999997797
KER-1,6/1/2025,11:00:00 am,0,2025-06-01 11:00:00,8.7859,6.879,0.00040000000000004474
KER-1,6/1/2025,11:10:00 am,0,2025-06-01 11:10:00,8.785,6.883,0.00019999999999997797
KER-1,6/1/2025,11:20:00 am,0,2025-06-01 11:20:00,8.7841,6.885,0.00019999999999997797
KER-1,6/1/2025,11:30:00 am,0,2025-06-01 11:30:00,8.7826,6.887,0.0
KER-1,6/1/2025,11:40:00 am,0,2025-06-01 11:40:00,8.7823,6.887,0.00040000000000004474
KER-1,6/1/2025,11:50:00 am,0,2025-06-01 11:50:00,8.7806,6.891,0.0
KER-1,6/1/2025,12:00:00 pm,0,2025-06-01 12:00:00,8.7794,6.891,0.00030000000000001136
KER-1,6/1/2025,12:10:00 pm,0,2025-06-01 12:10:00,8.7794,6.894,0.00019999999999997797
KER-1,6/1/2025,12:20:00 pm,0,2025-06-01 12:20:00,8.7785,6.892,0.00019999999999997797
KER-1,6/1/2025,12:30:00 pm,0,2025-06-01 12:30:00,8.7781,6.894,0.0001000000000000334
KER-1,6/1/2025,12:40:00 pm,0,2025-06-01 12:40:00,8.7774,6.893,9.999999999994457e-05
KER-1,6/1/2025,12:50:00 pm,0,2025-06-01 12:50:00,8.7765,6.892,0.00039999999999995595
KER-1,6/1/2025,01:00:00 pm,0,2025-06-01 13:00:00,8.7757,6.896,0.0
KER-1,6/1/2025,01:10:00 pm,0,2025-06-01 13:10:00,8.7746,6.896,0.0
KER-1,6/1/2025,01:20:00 pm,0,2025-06-01 13:20:00,8.7736,6.896,0.0
KER-1,6/1/2025,01:30:00 pm,0,2025-06-01 13:30:00,8.7725,6.896,0.00030000000000001136
KER-1,6/1/2025,01:40:00 pm,0,2025-06-01 13:40:00,8.772,6.899,0.0
KER-1,6/1/2025,01:50:00 pm,0,2025-06-01 13:50:00,8.7716,6.899,0.0001000000000000334
KER-1,6/1/2025,02:00:00 pm,0,2025-06-01 14:00:00,8.7707,6.9,9.999999999994457e-05
KER-1,6/1/2025,02:10:00 pm,0,2025-06-01 14:10:00,8.7687,6.901,0.00019999999999997797
KER-1,6/1/2025,02:20:00 pm,0,2025-06-01 14:20:00,8.7673,6.903,0.00030000000000001136
KER-1,6/1/2025,02:30:00 pm,0,2025-06-01 14:30:00,8.7655,6.906,0.0002000000000000668
KER-1,6/1/2025,02:40:00 pm,0,2025-06-01 14:40:00,8.7659,6.908,0.0
KER-1,6/1/2025,02:50:00 pm,0,2025-06-01 14:50:00,8.7647,6.908,0.0001000000000000334
KER-1,6/1/2025,03:00:00 pm,0,2025-06-01 15:00:00,8.7628,6.907,0.00019999999999997797
KER-1,6/1/2025,03:10:00 pm,0,2025-06-01 15:10:00,8.7623,6.909,0.00019999999999997797
KER-1,6/1/2025,03:20:00 pm,0,2025-06-01 15:20:00,8.7619,6.907,0.00019999999999997797
KER-1,6/1/2025,03:30:00 pm,0,2025-06-01 15:30:00,8.7618,6.909,0.00019999999999997797
KER-1,6/1/2025,03:40:00 pm,0,2025-06-01 15:40:00,8.7604,6.911,0.0002000000000000668
KER-1,6/1/2025,03:50:00 pm,0,2025-06-01 15:50:00,8.7593,6.913,0.00030000000000001136
KER-1,6/1/2025,04:00:00 pm,0,2025-06-01 16:00:00,8.7582,6.916,0.0
KER-1,6/1/2025,04:10:00 pm,0,2025-06-01 16:10:00,8.7584,6.916,0.0
KER-1,6/1/2025,04:20:00 pm,0,2025-06-01 16:20:00,8.7589,6.916,0.00029999999999992256
KER-1,6/1/2025,04:30:00 pm,0,2025-06-01 16:30:00,8.7581,6.919,0.0001000000000000334
KER-1,6/1/2025,04:40:00 pm,0,2025-06-01 16:40:00,8.7587,6.92,0.0001000000000000334
KER-1,6/1/2025,04:50:00 pm,0,2025-06-01 16:50:00,8.7597,6.921,9.999999999994457e-05
KER-1,6/1/2025,05:00:00 pm,0,2025-06-01 17:00:00,8.7599,6.922,9.999999999994457e-05
KER-1,6/1/2025,05:10:00 pm,0,2025-06-01 17:10:00,8.7617,6.921,0.00019999999999997797
KER-1,6/1/2025,05:20:00 pm,0,2025-06-01 17:20:00,8.7609,6.923,0.0
KER-1,6/1/2025,05:30:00 pm,0,2025-06-01 17:30:00,8.7621,6.923,0.0
KER-1,6/1/2025,05:40:00 pm,0,2025-06-01 17:40:00,8.7629,6.923,0.0
KER-1,6/1/2025,05:50:00 pm,0,2025-06-01 17:50:00,8.7643,6.923,0.0001000000000000334
KER-1,6/1/2025,06:00:00 pm,0,2025-06-01 18:00:00,8.7655,6.924,0.00029999999999992256
KER-1,6/1/2025,06:10:00 pm,0,2025-06-01 18:10:00,8.7673,6.927,9.999999999994457e-05
KER-1,6/1/2025,06:20:00 pm,0,2025-06-01 18:20:00,8.7684,6.926,0.00019999999999997797
KER-1,6/1/2025,06:30:00 pm,0,2025-06-01 18:30:00,8.7699,6.928,0.0001000000000000334
KER-1,6/1/2025,06:40:00 pm,0,2025-06-01 18:40:00,8.7702,6.929,0.00019999999999997797
KER-1,6/1/2025,06:50:00 pm,0,2025-06-01 18:50:00,8.771,6.931,0.00019999999999997797
KER-1,6/1/2025,07:00:00 pm,0,2025-06-01 19:00:00,8.7725,6.929,9.999999999994457e-05
KER-1,6/1/2025,07:10:00 pm,0,2025-06-01 19:10:00,8.7741,6.93,0.0002000000000000668
KER-1,6/1/2025,07:20:00 pm,0,2025-06-01 19:20:00,8.7752,6.932,9.999999999994457e-05
KER-1,6/1/2025,07:30:00 pm,0,2025-06-01 19:30:00,8.7771,6.933,0.00019999999999997797
KER-1,6/1/2025,07:40:00 pm,0,2025-06-01 19:40:00,8.7785,6.935,9.999999999994457e-05
KER-1,6/1/2025,07:50:00 pm,0,2025-06-01 19:50:00,8.7803,6.934,0.00019999999999997797
KER-1,6/1/2025,08:00:00 pm,0,2025-06-01 20:00:00,8.7822,6.936,0.0001000000000000334
KER-1,6/1/2025,08:10:00 pm,0,2025-06-01 20:10:00,8.7839,6.937,0.00030000000000001136
KER-1,6/1/2025,08:20:00 pm,0,2025-06-01 20:20:00,8.7848,6.94,0.0001000000000000334
KER-1,6/1/2025,08:30:00 pm,0,2025-06-01 20:30:00,8.7855,6.939,0.00039999999999995595
KER-1,6/1/2025,08:40:00 pm,0,2025-06-01 20:40:00,8.7861,6.943,9.999999999994457e-05
KER-1,6/1/2025,08:50:00 pm,0,2025-06-01 20:50:00,8.787,6.942,9.999999999994457e-05
KER-1,6/1/2025,09:00:00 pm,0,2025-06-01 21:00:00,8.7892,6.943,0.00040000000000004474
KER-1,6/1/2025,09:10:00 pm,0,2025-06-01 21:10:00,8.7916,6.947,0.0001000000000000334
KER-1,6/1/2025,09:20:00 pm,0,2025-06-01 21:20:00,8.7933,6.946,0.0002000000000000668
KER-1,6/1/2025,09:30:00 pm,0,2025-06-01 21:30:00,8.7946,6.948,0.0
KER-1,6/1/2025,09:40:00 pm,0,2025-06-01 21:40:00,8.7959,6.948,9.999999999994457e-05
KER-1,6/1/2025,09:50:00 pm,0,2025-06-01 21:50:00,8.7979,6.949,0.00030000000000001136
KER-1,6/1/2025,10:00:00 pm,0,2025-06-01 22:00:00,8.7999,6.952,0.0001000000000000334
KER-1,6/1/2025,10:10:00 pm,0,2025-06-01 22:10:00,8.8016,6.953,0.0
KER-1,6/1/2025,10:20:00 pm,0,2025-06-01 22:20:00,8.8031,6.953,9.999999999994457e-05
KER-1,6/1/2025,10:30:00 pm,0,2025-06-01 22:30:00,8.8039,6.954,0.0002000000000000668
KER-1,6/1/2025,10:40:00 pm,0,2025-06-01 22:40:00,8.8043,6.956,0.00029999999999992256
KER-1,6/1/2025,10:50:00 pm,0,2025-06-01 22:50:00,8.8046,6.959,9.999999999994457e-05
KER-1,6/1/2025,11:00:00 pm,0,2025-06-01 23:00:00,8.8043,6.958,0.00030000000000001136
KER-1,6/1/2025,11:10:00 pm,0,2025-06-01 23:10:00,8.8032,6.961,0.0001000000000000334
KER-1,6/1/2025,11:20:00 pm,0,2025-06-01 23:20:00,8.802,6.96,0.00019999999999997797
KER-1,6/1/2025,11:30:00 pm,0,2025-06-01 23:30:00,8.8017,6.962,0.0
KER-1,6/1/2025,11:40:00 pm,0,2025-06-01 23:40:00,8.8037,6.962,0.00030000000000001136
KER-1,6/1/2025,11:50:00 pm,0,2025-06-01 23:50:00,8.8069,6.965,9.999999999994457e-05
KER-1,6/2/2025,12:00:00 am,0,2025-06-02 00:00:00,8.8064,6.964,0.0
KER-1,6/2/2025,12:10:00 am,0,2025-06-02 00:10:00,8.8059,6.964,0.00019999999999997797
KER-1,6/2/2025,12:20:00 am,0,2025-06-02 00:20:00,8.8064,6.966,9.999999999994457e-05
KER-1,6/2/2025,12:30:00 am,0,2025-06-02 00:30:00,8.8069,6.967,0.0002000000000000668
KER-1,6/2/2025,12:40:00 am,0,2025-06-02 00:40:00,8.8072,6.969,0.0
KER-1,6/2/2025,12:50:00 am,0,2025-06-02 00:50:00,8.8068,6.969,9.999999999994457e-05
KER-1,6/2/2025,01:00:00 am,0,2025-06-02 01:00:00,8.8073,6.97,0.0002000000000000668
KER-1,6/2/2025,01:10:00 am,0,2025-06-02 01:10:00,8.8084,6.972,0.0
KER-1,6/2/2025,01:20:00 am,0,2025-06-02 01:20:00,8.8083,6.972,9.999999999994457e-05
KER-1,6/2/2025,01:30:00 am,0,2025-06-02 01:30:00,8.8088,6.973,0.00019999999999997797
KER-1,6/2/2025,01:40:00 am,0,2025-06-02 01:40:00,8.8082,6.975,0.0
KER-1,6/2/2025,01:50:00 am,0,2025-06-02 01:50:00,8.808,6.975,0.0002000000000000668
KER-1,6/2/2025,02:00:00 am,0,2025-06-02 02:00:00,8.8092,6.977,9.999999999994457e-05
KER-1,6/2/2025,02:10:00 am,0,2025-06-02 02:10:00,8.8082,6.978,0.0002000000000000668
KER-1,6/2/2025,02:20:00 am,0,2025-06-02 02:20:00,8.8087,6.98,0.0
KER-1,6/2/2025,02:30:00 am,0,2025-06-02 02:30:00,8.8086,6.98,0.00019999999999997797
KER-1,6/2/2025,02:40:00 am,0,2025-06-02 02:40:00,8.809,6.982,9.999999999994457e-05
KER-1,6/2/2025,02:50:00 am,0,2025-06-02 02:50:00,8.8097,6.983,0.0002000000000000668
KER-1,6/2/2025,03:00:00 am,0,2025-06-02 03:00:00,8.8098,6.985,9.999999999994457e-05
KER-1,6/2/2025,03:10:00 am,0,2025-06-02 03:10:00,8.8105,6.986,0.0
KER-1,6/2/2025,03:20:00 am,0,2025-06-02 03:20:00,8.8104,6.986,0.00040000000000004474
KER-1,6/2/2025,03:30:00 am,0,2025-06-02 03:30:00,8.8108,6.99,0.0001000000000000334
KER-1,6/2/2025,03:40:00 am,0,2025-06-02 03:40:00,8.8113,6.989,0.00019999999999997797
KER-1,6/2/2025,03:50:00 am,0,2025-06-02 03:50:00,8.8124,6.991,0.0002000000000000668
KER-1,6/2/2025,04:00:00 am,0,2025-06-02 04:00:00,8.8132,6.993,9.999999999994457e-05
KER-1,6/2/2025,04:10:00 am,0,2025-06-02 04:10:00,8.8134,6.994,0.0001000000000000334
KER-1,6/2/2025,04:20:00 am,0,2025-06-02 04:20:00,8.8137,6.995,0.0
KER-1,6/2/2025,04:30:00 am,0,2025-06-02 04:30:00,8.8147,6.995,0.0001000000000000334
KER-1,6/2/2025,04:40:00 am,0,2025-06-02 04:40:00,8.8157,6.996,0.00019999999999997797
KER-1,6/2/2025,04:50:00 am,0,2025-06-02 04:50:00,8.8166,6.998,9.999999999994457e-05
KER-1,6/2/2025,05:00:00 am,0,2025-06-02 05:00:00,8.8167,6.999,0.0001000000000000334
KER-1,6/2/2025,05:10:00 am,0,2025-06-02 05:10:00,8.8177,7.0,0.00019999999999997797
KER-1,6/2/2025,05:20:00 am,0,2025-06-02 05:20:00,8.8182,7.002,0.0001000000000000334
KER-1,6/2/2025,05:30:00 am,0,2025-06-02 05:30:00,8.8196,7.003,0.0
KER-1,6/2/2025,05:40:00 am,0,2025-06-02 05:40:00,8.8205,7.003,9.999999999994457e-05
KER-1,6/2/2025,05:50:00 am,0,2025-06-02 05:50:00,8.8215,7.004,0.00030000000000001136
KER-1,6/2/2025,06:00:00 am,0,2025-06-02 06:00:00,8.822,7.007,0.0002000000000000668
KER-1,6/2/2025,06:10:00 am,0,2025-06-02 06:10:00,8.822,7.009,9.999999999994457e-05
KER-1,6/2/2025,06:20:00 am,0,2025-06-02 06:20:00,8.8228,7.01,0.0
KER-1,6/2/2025,06:30:00 am,0,2025-06-02 06:30:00,8.8236,7.01,0.00019999999999997797
KER-1,6/2/2025,06:40:00 am,0,2025-06-02 06:40:00,8.8252,7.012,0.0
KER-1,6/2/2025,06:50:00 am,0,2025-06-02 06:50:00,8.8255,7.012,0.0
KER-1,6/2/2025,07:00:00 am,0,2025-06-02 07:00:00,8.826,7.012,0.0005000000000000782
KER-1,6/2/2025,07:10:00 am,0,2025-06-02 07:10:00,8.8261,7.017,0.0
KER-1,6/2/2025,07:20:00 am,0,2025-06-02 07:20:00,8.8268,7.017,0.00039999999999995595
KER-1,6/2/2025,07:30:00 am,0,2025-06-02 07:30:00,8.8271,7.021,0.00019999999999997797
KER-1,6/2/2025,07:40:00 am,0,2025-06-02 07:40:00,8.8259,7.019,0.00019999999999997797
KER-1,6/2/2025,07:50:00 am,0,2025-06-02 07:50:00,8.827,7.021,0.00040000000000004474
KER-1,6/2/2025,08:00:00 am,0,2025-06-02 08:00:00,8.8273,7.025,0.0001000000000000334
KER-1,6/2/2025,08:10:00 am,0,2025-06-02 08:10:00,8.8265,7.024,0.00030000000000001136
KER-1,6/2/2025,08:20:00 am,0,2025-06-02 08:20:00,8.8265,7.027,9.999999999994457e-05
KER-1,6/2/2025,08:30:00 am,0,2025-06-02 08:30:00,8.8268,7.028,0.0001000000000000334
KER-1,6/2/2025,08:40:00 am,0,2025-06-02 08:40:00,8.8269,7.029,0.00030000000000001136
KER-1,6/2/2025,08:50:00 am,0,2025-06-02 08:50:00,8.8261,7.032,0.0001000000000000334
KER-1,6/2/2025,09:00:00 am,0,2025-06-02 09:00:00,8.8242,7.033,0.00039999999999995595
KER-1,6/2/2025,09:10:00 am,0,2025-06-02 09:10:00,8.8223,7.037,0.0001000000000000334
KER-1,6/2/2025,09:20:00 am,0,2025-06-02 09:20:00,8.8208,7.036,0.00040000000000004474
KER-1,6/2/2025,09:30:00 am,0,2025-06-02 09:30:00,8.8195,7.04,0.0
KER-1,6/2/2025,09:40:00 am,0,2025-06-02 09:40:00,8.8183,7.04,0.00030000000000001136
KER-1,6/2/2025,09:50:00 am,0,2025-06-02 09:50:00,8.817,7.043,0.00030000000000001136
KER-1,6/2/2025,10:00:00 am,0,2025-06-02 10:00:00,8.8155,7.046,0.00019999999999997797
KER-1,6/2/2025,10:10:00 am,0,2025-06-02 10:10:00,8.8148,7.048,0.0001000000000000334
KER-1,6/2/2025,10:20:00 am,0,2025-06-02 10:20:00,8.8137,7.049,0.00019999999999997797
KER-1,6/2/2025,10:30:00 am,0,2025-06-02 10:30:00,8.8113,7.051,9.999999999994457e-05
KER-1,6/2/2025,10:40:00 am,0,2025-06-02 10:40:00,8.8109,7.052,0.0002000000000000668
KER-1,6/2/2025,10:50:00 am,0,2025-06-02 10:50:00,8.8097,7.054,9.999999999994457e-05
KER-1,6/2/2025,11:00:00 am,0,2025-06-02 11:00:00,8.8081,7.055,0.0002000000000000668
KER-1,6/2/2025,11:10:00 am,0,2025-06-02 11:10:00,8.8075,7.057,0.00029999999999992256
KER-1,6/2/2025,11:20:00 am,0,2025-06-02 11:20:00,8.8073,7.06,0.0
KER-1,6/2/2025,11:30:00 am,0,2025-06-02 11:30:00,8.8057,7.06,0.0001000000000000334
KER-1,6/2/2025,11:40:00 am,0,2025-06-02 11:40:00,8.8051,7.061,0.0
KER-1,6/2/2025,11:50:00 am,0,2025-06-02 11:50:00,8.8042,7.061,0.00019999999999997797
KER-1,6/2/2025,12:00:00 pm,0,2025-06-02 12:00:00,8.8029,7.063,0.0001000000000000334
KER-1,6/2/2025,12:10:00 pm,0,2025-06-02 12:10:00,8.8022,7.064,0.0001000000000000334
KER-1,6/2/2025,12:20:00 pm,0,2025-06-02 12:20:00,8.8008,7.065,0.0
KER-1,6/2/2025,12:30:00 pm,0,2025-06-02 12:30:00,8.7991,7.065,0.00019999999999997797
KER-1,6/2/2025,12:40:00 pm,0,2025-06-02 12:40:00,8.7975,7.067,0.0
KER-1,6/2/2025,12:50:00 pm,0,2025-06-02 12:50:00,8.7968,7.067,9.999999999994457e-05
KER-1,6/2/2025,01:00:00 pm,0,2025-06-02 13:00:00,8.795,7.068,9.999999999994457e-05
KER-1,6/2/2025,01:10:00 pm,0,2025-06-02 13:10:00,8.7931,7.067,0.0001000000000000334
KER-1,6/2/2025,01:20:00 pm,0,2025-06-02 13:20:00,8.7916,7.066,0.0001000000000000334
KER-1,6/2/2025,01:30:00 pm,0,2025-06-02 13:30:00,8.7913,7.067,0.00019999999999997797
KER-1,6/2/2025,01:40:00 pm,0,2025-06-02 13:40:00,8.7898,7.065,0.0
KER-1,6/2/2025,01:50:00 pm,0,2025-06-02 13:50:00,8.7888,7.065,0.0
KER-1,6/2/2025,02:00:00 pm,0,2025-06-02 14:00:00,8.7877,7.065,9.999999999994457e-05
KER-1,6/2/2025,02:10:00 pm,0,2025-06-02 14:10:00,8.7867,7.066,9.999999999994457e-05
KER-1,6/2/2025,02:20:00 pm,0,2025-06-02 14:20:00,8.7853,7.065,0.00019999999999997797
KER-1,6/2/2025,02:30:00 pm,0,2025-06-02 14:30:00,8.7848,7.067,0.00019999999999997797
KER-1,6/2/2025,02:40:00 pm,0,2025-06-02 14:40:00,8.7832,7.065,0.00019999999999997797
KER-1,6/2/2025,02:50:00 pm,0,2025-06-02 14:50:00,8.7826,7.067,0.0001000000000000334
KER-1,6/2/2025,03:00:00 pm,0,2025-06-02 15:00:00,8.7821,7.066,0.0
KER-1,6/2/2025,03:10:00 pm,0,2025-06-02 15:10:00,8.7806,7.066,0.00030000000000001136
KER-1,6/2/2025,03:20:00 pm,0,2025-06-02 15:20:00,8.7802,7.063,0.0002000000000000668
KER-1,6/2/2025,03:30:00 pm,0,2025-06-02 15:30:00,8.7801,7.065,0.00019999999999997797
KER-1,6/2/2025,03:40:00 pm,0,2025-06-02 15:40:00,8.7796,7.067,0.00019999999999997797
KER-1,6/2/2025,03:50:00 pm,0,2025-06-02 15:50:00,8.7793,7.065,0.0001000000000000334
KER-1,6/2/2025,04:00:00 pm,0,2025-06-02 16:00:00,8.7786,7.064,0.00030000000000001136
KER-1,6/2/2025,04:10:00 pm,0,2025-06-02 16:10:00,8.7794,7.067,0.0
KER-1,6/2/2025,04:20:00 pm,0,2025-06-02 16:20:00,8.7795,7.067,9.999999999994457e-05
KER-1,6/2/2025,04:30:00 pm,0,2025-06-02 16:30:00,8.7783,7.068,9.999999999994457e-05
KER-1,6/2/2025,04:40:00 pm,0,2025-06-02 16:40:00,8.7792,7.067,0.00019999999999997797
KER-1,6/2/2025,04:50:00 pm,0,2025-06-02 16:50:00,8.7801,7.069,0.0
KER-1,6/2/2025,05:00:00 pm,0,2025-06-02 17:00:00,8.7806,7.069,0.0001000000000000334
KER-1,6/2/2025,05:10:00 pm,0,2025-06-02 17:10:00,8.7809,7.07,0.0001000000000000334
KER-1,6/2/2025,05:20:00 pm,0,2025-06-02 17:20:00,8.7811,7.069,0.0
KER-1,6/2/2025,05:30:00 pm,0,2025-06-02 17:30:00,8.7813,7.069,0.0001000000000000334
KER-1,6/2/2025,05:40:00 pm,0,2025-06-02 17:40:00,8.7828,7.07,9.999999999994457e-05
KER-1,6/2/2025,05:50:00 pm,0,2025-06-02 17:50:00,8.7828,7.071,0.0001000000000000334
KER-1,6/2/2025,06:00:00 pm,0,2025-06-02 18:00:00,8.7835,7.072,0.0001000000000000334
KER-1,6/2/2025,06:10:00 pm,0,2025-06-02 18:10:00,8.7846,7.073,0.0001000000000000334
KER-1,6/2/2025,06:20:00 pm,0,2025-06-02 18:20:00,8.7851,7.072,0.00019999999999997797
KER-1,6/2/2025,06:30:00 pm,0,2025-06-02 18:30:00,8.7861,7.07,0.00030000000000001136
KER-1,6/2/2025,06:40:00 pm,0,2025-06-02 18:40:00,8.7875,7.073,9.999999999994457e-05
KER-1,6/2/2025,06:50:00 pm,0,2025-06-02 18:50:00,8.7887,7.074,0.0001000000000000334
KER-1,6/2/2025,07:00:00 pm,0,2025-06-02 19:00:00,8.7903,7.075,0.0
KER-1,6/2/2025,07:10:00 pm,0,2025-06-02 19:10:00,8.791,7.075,0.0
KER-1,6/2/2025,07:20:00 pm,0,2025-06-02 19:20:00,8.7919,7.075,0.00030000000000001136
KER-1,6/2/2025,07:30:00 pm,0,2025-06-02 19:30:00,8.7933,7.078,0.0
KER-1,6/2/2025,07:40:00 pm,0,2025-06-02 19:40:00,8.7946,7.078,0.0
KER-1,6/2/2025,07:50:00 pm,0,2025-06-02 19:50:00,8.7956,7.078,0.0
KER-1,6/2/2025,08:00:00 pm,0,2025-06-02 20:00:00,8.7965,7.078,0.0
KER-1,6/2/2025,08:10:00 pm,0,2025-06-02 20:10:00,8.7977,7.078,0.0
KER-1,6/2/2025,08:20:00 pm,0,2025-06-02 20:20:00,8.7985,7.078,9.999999999994457e-05
KER-1,6/2/2025,08:30:00 pm,0,2025-06-02 20:30:00,8.7998,7.079,0.0001000000000000334
KER-1,6/2/2025,08:40:00 pm,0,2025-06-02 20:40:00,8.8012,7.08,0.0001000000000000334
KER-1,6/2/2025,08:50:00 pm,0,2025-06-02 20:50:00,8.8022,7.081,0.00019999999999997797
KER-1,6/2/2025,09:00:00 pm,0,2025-06-02 21:00:00,8.8031,7.083,0.0001000000000000334
KER-1,6/2/2025,09:10:00 pm,0,2025-06-02 21:10:00,8.8048,7.082,0.0001000000000000334
KER-1,6/2/2025,09:20:00 pm,0,2025-06-02 21:20:00,8.8067,7.083,9.999999999994457e-05
KER-1,6/2/2025,09:30:00 pm,0,2025-06-02 21:30:00,8.8082,7.084,0.0
KER-1,6/2/2025,09:40:00 pm,0,2025-06-02 21:40:00,8.8097,7.084,0.0
KER-1,6/2/2025,09:50:00 pm,0,2025-06-02 21:50:00,8.8112,7.084,0.0002000000000000668
KER-1,6/2/2025,10:00:00 pm,0,2025-06-02 22:00:00,8.8126,7.086,0.00019999999999997797
KER-1,6/2/2025,10:10:00 pm,0,2025-06-02 22:10:00,8.8137,7.088,0.0001000000000000334
KER-1,6/2/2025,10:20:00 pm,0,2025-06-02 22:20:00,8.8147,7.087,0.0001000000000000334
KER-1,6/2/2025,10:30:00 pm,0,2025-06-02 22:30:00,8.8163,7.088,0.0001000000000000334
KER-1,6/2/2025,10:40:00 pm,0,2025-06-02 22:40:00,8.8167,7.089,0.00029999999999992256
KER-1,6/2/2025,10:50:00 pm,0,2025-06-02 22:50:00,8.818,7.092,9.999999999994457e-05
KER-1,6/2/2025,11:00:00 pm,0,2025-06-02 23:00:00,8.8187,7.091,9.999999999994457e-05
KER-1,6/2/2025,11:10:00 pm,0,2025-06-02 23:10:00,8.8194,7.092,0.0
KER-1,6/2/2025,11:20:00 pm,0,2025-06-02 23:20:00,8.8193,7.092,0.0002000000000000668
KER-1,6/2/2025,11:30:00 pm,0,2025-06-02 23:30:00,8.8191,7.094,9.999999999994457e-05
KER-1,6/2/2025,11:40:00 pm,0,2025-06-02 23:40:00,8.8194,7.095,9.999999999994457e-05
KER-1,6/2/2025,11:50:00 pm,0,2025-06-02 23:50:00,8.8194,7.094,0.0
KER-1,6/3/2025,12:00:00 am,0,2025-06-03 00:00:00,8.82,7.094,0.00019999999999997797
KER-1,6/3/2025,12:10:00 am,0,2025-06-03 00:10:00,8.8204,7.096,0.0
KER-1,6/3/2025,12:20:00 am,0,2025-06-03 00:20:00,8.8209,7.096,0.0001000000000000334
KER-1,6/3/2025,12:30:00 am,0,2025-06-03 00:30:00,8.8211,7.097,0.0
KER-1,6/3/2025,12:40:00 am,0,2025-06-03 00:40:00,8.8209,7.097,0.0
KER-1,6/3/2025,12:50:00 am,0,2025-06-03 00:50:00,8.8202,7.097,9.999999999994457e-05
KER-1,6/3/2025,01:00:00 am,0,2025-06-03 01:00:00,8.82,7.098,0.00019999999999997797
KER-1,6/3/2025,01:10:00 am,0,2025-06-03 01:10:00,8.8197,7.1,0.0001000000000000334
KER-1,6/3/2025,01:20:00 am,0,2025-06-03 01:20:00,8.8201,7.101,0.0
KER-1,6/3/2025,01:30:00 am,0,2025-06-03 01:30:00,8.8199,7.101,0.0001000000000000334
KER-1,6/3/2025,01:40:00 am,0,2025-06-03 01:40:00,8.82,7.102,0.00030000000000001136
KER-1,6/3/2025,01:50:00 am,0,2025-06-03 01:50:00,8.8195,7.105,0.0
KER-1,6/3/2025,02:00:00 am,0,2025-06-03 02:00:00,8.8193,7.105,9.999999999994457e-05
KER-1,6/3/2025,02:10:00 am,0,2025-06-03 02:10:00,8.8196,7.106,0.00019999999999997797
KER-1,6/3/2025,02:20:00 am,0,2025-06-03 02:20:00,8.8194,7.108,0.0001000000000000334
KER-1,6/3/2025,02:30:00 am,0,2025-06-03 02:30:00,8.8202,7.109,0.0
KER-1,6/3/2025,02:40:00 am,0,2025-06-03 02:40:00,8.8204,7.109,0.0
KER-1,6/3/2025,02:50:00 am,0,2025-06-03 02:50:00,8.8206,7.109,0.00030000000000001136
KER-1,6/3/2025,03:00:00 am,0,2025-06-03 03:00:00,8.8209,7.112,0.00040000000000004474
KER-1,6/3/2025,03:10:00 am,0,2025-06-03 03:10:00,8.8209,7.108,0.0005000000000000782
KER-1,6/3/2025,03:20:00 am,0,2025-06-03 03:20:00,8.8206,7.113,0.00019999999999997797
KER-1,6/3/2025,03:30:00 am,0,2025-06-03 03:30:00,8.8212,7.115,0.0
KER-1,6/3/2025,03:40:00 am,0,2025-06-03 03:40:00,8.8212,7.115,0.00030000000000001136
KER-1,6/3/2025,03:50:00 am,0,2025-06-03 03:50:00,8.8206,7.112,0.00019999999999997797
KER-1,6/3/2025,04:00:00 am,0,2025-06-03 04:00:00,8.8207,7.114,0.00019999999999997797
KER-1,6/3/2025,04:10:00 am,0,2025-06-03 04:10:00,8.821,7.116,0.0
KER-1,6/3/2025,04:20:00 am,0,2025-06-03 04:20:00,8.8212,7.116,0.0002000000000000668
KER-1,6/3/2025,04:30:00 am,0,2025-06-03 04:30:00,8.8217,7.118,9.999999999994457e-05
KER-1,6/3/2025,04:40:00 am,0,2025-06-03 04:40:00,8.8225,7.119,0.0
KER-1,6/3/2025,04:50:00 am,0,2025-06-03 04:50:00,8.8219,7.119,0.00019999999999997797
KER-1,6/3/2025,05:00:00 am,0,2025-06-03 05:00:00,8.8221,7.117,0.0004999999999999894
KER-1,6/3/2025,05:10:00 am,0,2025-06-03 05:10:00,8.8224,7.122,0.0
KER-1,6/3/2025,05:20:00 am,0,2025-06-03 05:20:00,8.8226,7.122,0.0001000000000000334
KER-1,6/3/2025,05:30:00 am,0,2025-06-03 05:30:00,8.8225,7.123,0.0
KER-1,6/3/2025,05:40:00 am,0,2025-06-03 05:40:00,8.8229,7.123,0.0001000000000000334
KER-1,6/3/2025,05:50:00 am,0,2025-06-03 05:50:00,8.8226,7.122,0.00030000000000001136
KER-1,6/3/2025,06:00:00 am,0,2025-06-03 06:00:00,8.8225,7.125,0.0001000000000000334
KER-1,6/3/2025,06:10:00 am,0,2025-06-03 06:10:00,8.8232,7.126,0.0001000000000000334
KER-1,6/3/2025,06:20:00 am,0,2025-06-03 06:20:00,8.8242,7.125,0.0004999999999999894
KER-1,6/3/2025,06:30:00 am,0,2025-06-03 06:30:00,8.8245,7.13,0.0001000000000000334
KER-1,6/3/2025,06:40:00 am,0,2025-06-03 06:40:00,8.8242,7.129,0.0002000000000000668
KER-1,6/3/2025,06:50:00 am,0,2025-06-03 06:50:00,8.8247,7.131,0.00019999999999997797
KER-1,6/3/2025,07:00:00 am,0,2025-06-03 07:00:00,8.8241,7.133,0.0001000000000000334
KER-1,6/3/2025,07:10:00 am,0,2025-06-03 07:10:00,8.8246,7.132,0.0002000000000000668
KER-1,6/3/2025,07:20:00 am,0,2025-06-03 07:20:00,8.8249,7.134,0.00019999999999997797
KER-1,6/3/2025,07:30:00 am,0,2025-06-03 07:30:00,8.8243,7.136,0.0
KER-1,6/3/2025,07:40:00 am,0,2025-06-03 07:40:00,8.8247,7.136,0.0
KER-1,6/3/2025,07:50:00 am,0,2025-06-03 07:50:00,8.8241,7.136,0.00030000000000001136
KER-1,6/3/2025,08:00:00 am,0,2025-06-03 08:00:00,8.8241,7.139,9.999999999994457e-05
KER-1,6/3/2025,08:10:00 am,0,2025-06-03 08:10:00,8.824,7.14,0.00019999999999997797
KER-1,6/3/2025,08:20:00 am,0,2025-06-03 08:20:00,8.8239,7.138,0.00030000000000001136
KER-1,6/3/2025,08:30:00 am,0,2025-06-03 08:30:00,8.8234,7.141,0.00019999999999997797
KER-1,6/3/2025,08:40:00 am,0,2025-06-03 08:40:00,8.8229,7.143,0.0
KER-1,6/3/2025,08:50:00 am,0,2025-06-03 08:50:00,8.8219,7.143,0.00019999999999997797
KER-1,6/3/2025,09:00:00 am,0,2025-06-03 09:00:00,8.8212,7.145,0.0002000000000000668
KER-1,6/3/2025,09:10:00 am,0,2025-06-03 09:10:00,8.8203,7.147,0.00030000000000001136
KER-1,6/3/2025,09:20:00 am,0,2025-06-03 09:20:00,8.8192,7.15,0.0
KER-1,6/3/2025,09:30:00 am,0,2025-06-03 09:30:00,8.8177,7.15,9.999999999994457e-05
KER-1,6/3/2025,09:40:00 am,0,2025-06-03 09:40:00,8.8168,7.151,0.0001000000000000334
KER-1,6/3/2025,09:50:00 am,0,2025-06-03 09:50:00,8.8159,7.152,0.0006000000000000227
KER-1,6/3/2025,10:00:00 am,0,2025-06-03 10:00:00,8.8141,7.158,0.0001000000000000334
KER-1,6/3/2025,10:10:00 am,0,2025-06-03 10:10:00,8.8117,7.157,0.00030000000000001136
KER-1,6/3/2025,10:20:00 am,0,2025-06-03 10:20:00,8.8098,7.16,0.00019999999999997797
KER-1,6/3/2025,10:30:00 am,0,2025-06-03 10:30:00,8.8084,7.162,0.0001000000000000334
KER-1,6/3/2025,10:40:00 am,0,2025-06-03 10:40:00,8.8066,7.161,0.0002000000000000668
KER-1,6/3/2025,10:50:00 am,0,2025-06-03 10:50:00,8.8056,7.163,0.00030000000000001136
KER-1,6/3/2025,11:00:00 am,0,2025-06-03 11:00:00,8.8039,7.166,9.999999999994457e-05
KER-1,6/3/2025,11:10:00 am,0,2025-06-03 11:10:00,8.8022,7.167,0.0
KER-1,6/3/2025,11:20:00 am,0,2025-06-03 11:20:00,8.801,7.167,0.00019999999999997797
KER-1,6/3/2025,11:30:00 am,0,2025-06-03 11:30:00,8.7994,7.169,0.0002000000000000668
KER-1,6/3/2025,11:40:00 am,0,2025-06-03 11:40:00,8.7988,7.171,9.999999999994457e-05
KER-1,6/3/2025,11:50:00 am,0,2025-06-03 11:50:00,8.7973,7.172,0.0001000000000000334
KER-1,6/3/2025,12:00:00 pm,0,2025-06-03 12:00:00,8.7958,7.173,0.0001000000000000334
KER-1,6/3/2025,12:10:00 pm,0,2025-06-03 12:10:00,8.7954,7.172,0.0
KER-1,6/3/2025,12:20:00 pm,0,2025-06-03 12:20:00,8.7931,7.172,0.00019999999999997797
KER-1,6/3/2025,12:30:00 pm,0,2025-06-03 12:30:00,8.7912,7.17,0.00019999999999997797
KER-1,6/3/2025,12:40:00 pm,0,2025-06-03 12:40:00,8.7889,7.172,0.0
KER-1,6/3/2025,12:50:00 pm,0,2025-06-03 12:50:00,8.7879,7.172,9.999999999994457e-05
KER-1,6/3/2025,01:00:00 pm,0,2025-06-03 13:00:00,8.7872,7.171,0.0002000000000000668
KER-1,6/3/2025,01:10:00 pm,0,2025-06-03 13:10:00,8.7854,7.169,0.00030000000000001136
KER-1,6/3/2025,01:20:00 pm,0,2025-06-03 13:20:00,8.7841,7.172,0.00039999999999995595
KER-1,6/3/2025,01:30:00 pm,0,2025-06-03 13:30:00,8.7838,7.168,9.999999999994457e-05
KER-1,6/3/2025,01:40:00 pm,0,2025-06-03 13:40:00,8.7825,7.169,0.0
KER-1,6/3/2025,01:50:00 pm,0,2025-06-03 13:50:00,8.7808,7.169,0.0
KER-1,6/3/2025,02:00:00 pm,0,2025-06-03 14:00:00,8.7797,7.169,0.0
KER-1,6/3/2025,02:10:00 pm,0,2025-06-03 14:10:00,8.7785,7.169,0.0
KER-1,6/3/2025,02:20:00 pm,0,2025-06-03 14:20:00,8.7774,7.169,0.00029999999999992256
KER-1,6/3/2025,02:30:00 pm,0,2025-06-03 14:30:00,8.7766,7.166,0.00019999999999997797
KER-1,6/3/2025,02:40:00 pm,0,2025-06-03 14:40:00,8.7756,7.168,0.0
KER-1,6/3/2025,02:50:00 pm,0,2025-06-03 14:50:00,8.7737,7.168,0.00019999999999997797
KER-1,6/3/2025,03:00:00 pm,0,2025-06-03 15:00:00,8.7745,7.17,0.00019999999999997797
KER-1,6/3/2025,03:10:00 pm,0,2025-06-03 15:10:00,8.774,7.168,0.0001000000000000334
KER-1,6/3/2025,03:20:00 pm,0,2025-06-03 15:20:00,8.7733,7.167,0.00019999999999997797
KER-1,6/3/2025,03:30:00 pm,0,2025-06-03 15:30:00,8.7736,7.165,0.0
KER-1,6/3/2025,03:40:00 pm,0,2025-06-03 15:40:00,8.7732,7.165,0.00030000000000001136
KER-1,6/3/2025,03:50:00 pm,0,2025-06-03 15:50:00,8.7723,7.168,9.999999999994457e-05
KER-1,6/3/2025,04:00:00 pm,0,2025-06-03 16:00:00,8.7729,7.169,9.999999999994457e-05
KER-1,6/3/2025,04:10:00 pm,0,2025-06-03 16:10:00,8.772,7.168,9.999999999994457e-05
KER-1,6/3/2025,04:20:00 pm,0,2025-06-03 16:20:00,8.772,7.169,9.999999999994457e-05
KER-1,6/3/2025,04:30:00 pm,0,2025-06-03 16:30:00,8.7721,7.168,0.00019999999999997797
KER-1,6/3/2025,04:40:00 pm,0,2025-06-03 16:40:00,8.7728,7.17,0.0
KER-1,6/3/2025,04:50:00 pm,0,2025-06-03 16:50:00,8.773,7.17,0.0
KER-1,6/3/2025,05:00:00 pm,0,2025-06-03 17:00:00,8.7741,7.17,0.0
KER-1,6/3/2025,05:10:00 pm,0,2025-06-03 17:10:00,8.7745,7.17,0.0
KER-1,6/3/2025,05:20:00 pm,0,2025-06-03 17:20:00,8.7746,7.17,0.0001000000000000334
KER-1,6/3/2025,05:30:00 pm,0,2025-06-03 17:30:00,8.7748,7.169,0.0
KER-1,6/3/2025,05:40:00 pm,0,2025-06-03 17:40:00,8.775,7.169,0.0002000000000000668
KER-1,6/3/2025,05:50:00 pm,0,2025-06-03 17:50:00,8.7755,7.171,9.999999999994457e-05
KER-1,6/3/2025,06:00:00 pm,0,2025-06-03 18:00:00,8.7759,7.172,0.0001000000000000334
KER-1,6/3/2025,06:10:00 pm,0,2025-06-03 18:10:00,8.7761,7.173,0.0001000000000000334
KER-1,6/3/2025,06:20:00 pm,0,2025-06-03 18:20:00,8.7768,7.172,0.0
KER-1,6/3/2025,06:30:00 pm,0,2025-06-03 18:30:00,8.7769,7.172,0.0001000000000000334
KER-1,6/3/2025,06:40:00 pm,0,2025-06-03 18:40:00,8.7782,7.173,0.0001000000000000334
KER-1,6/3/2025,06:50:00 pm,0,2025-06-03 18:50:00,8.779,7.174,0.00019999999999997797
KER-1,6/3/2025,07:00:00 pm,0,2025-06-03 19:00:00,8.7794,7.176,0.0
KER-1,6/3/2025,07:10:00 pm,0,2025-06-03 19:10:00,8.7799,7.176,0.00030000000000001136
KER-1,6/3/2025,07:20:00 pm,0,2025-06-03 19:20:00,8.781,7.179,0.0
KER-1,6/3/2025,07:30:00 pm,0,2025-06-03 19:30:00,8.7828,7.179,0.0002000000000000668
KER-1,6/3/2025,07:40:00 pm,0,2025-06-03 19:40:00,8.7844,7.177,0.0002000000000000668
KER-1,6/3/2025,07:50:00 pm,0,2025-06-03 19:50:00,8.7854,7.179,9.999999999994457e-05
KER-1,6/3/2025,08:00:00 pm,0,2025-06-03 20:00:00,8.786,7.18,0.0
KER-1,6/3/2025,08:10:00 pm,0,2025-06-03 20:10:00,8.7878,7.18,0.0
KER-1,6/3/2025,08:20:00 pm,0,2025-06-03 20:20:00,8.7884,7.18,0.0002000000000000668
KER-1,6/3/2025,08:30:00 pm,0,2025-06-03 20:30:00,8.7892,7.182,9.999999999994457e-05
KER-1,6/3/2025,08:40:00 pm,0,2025-06-03 20:40:00,8.7903,7.183,9.999999999994457e-05
KER-1,6/3/2025,08:50:00 pm,0,2025-06-03 20:50:00,8.791,7.182,9.999999999994457e-05
KER-1,6/3/2025,09:00:00 pm,0,2025-06-03 21:00:00,8.7915,7.183,0.00019999999999997797
KER-1,6/3/2025,09:10:00 pm,0,2025-06-03 21:10:00,8.7927,7.185,0.0001000000000000334
KER-1,6/3/2025,09:20:00 pm,0,2025-06-03 21:20:00,8.7944,7.186,0.0001000000000000334
KER-1,6/3/2025,09:30:00 pm,0,2025-06-03 21:30:00,8.7965,7.187,9.999999999994457e-05
KER-1,6/3/2025,09:40:00 pm,0,2025-06-03 21:40:00,8.7978,7.188,0.0
KER-1,6/3/2025,09:50:00 pm,0,2025-06-03 21:50:00,8.7989,7.188,0.0001000000000000334
KER-1,6/3/2025,10:00:00 pm,0,2025-06-03 22:00:00,8.8,7.189,0.0
KER-1,6/3/2025,10:10:00 pm,0,2025-06-03 22:10:00,8.801,7.189,0.0001000000000000334
KER-1,6/3/2025,10:20:00 pm,0,2025-06-03 22:20:00,8.8015,7.19,9.999999999994457e-05
KER-1,6/3/2025,10:30:00 pm,0,2025-06-03 22:30:00,8.8014,7.191,0.00019999999999997797
KER-1,6/3/2025,10:40:00 pm,0,2025-06-03 22:40:00,8.8018,7.193,0.0001000000000000334
KER-1,6/3/2025,10:50:00 pm,0,2025-06-03 22:50:00,8.8013,7.194,0.0001000000000000334
KER-1,6/3/2025,11:00:00 pm,0,2025-06-03 23:00:00,8.8012,7.195,9.999999999994457e-05
KER-1,6/3/2025,11:10:00 pm,0,2025-06-03 23:10:00,8.8017,7.196,0.0001000000000000334
KER-1,6/3/2025,11:20:00 pm,0,2025-06-03 23:20:00,8.8023,7.197,0.0
KER-1,6/3/2025,11:30:00 pm,0,2025-06-03 23:30:00,8.8023,7.197,0.0001000000000000334
KER-1,6/3/2025,11:40:00 pm,0,2025-06-03 23:40:00,8.8031,7.198,9.999999999994457e-05
KER-1,6/3/2025,11:50:00 pm,0,2025-06-03 23:50:00,8.8042,7.199,0.00030000000000001136
KER-1,6/4/2025,12:00:00 am,0,2025-06-04 00:00:00,8.8043,7.202,0.00039999999999995595
KER-1,6/4/2025,12:10:00 am,0,2025-06-04 00:10:00,8.804,7.198,9.999999999994457e-05
KER-1,6/4/2025,12:20:00 am,0,2025-06-04 00:20:00,8.8036,7.199,0.00030000000000001136
KER-1,6/4/2025,12:30:00 am,0,2025-06-04 00:30:00,8.8035,7.202,0.0
KER-1,6/4/2025,12:40:00 am,0,2025-06-04 00:40:00,8.8037,7.202,0.00030000000000001136
KER-1,6/4/2025,12:50:00 am,0,2025-06-04 00:50:00,8.8031,7.205,0.0001000000000000334
KER-1,6/4/2025,01:00:00 am,0,2025-06-04 01:00:00,8.8036,7.204,0.0002000000000000668
KER-1,6/4/2025,01:10:00 am,0,2025-06-04 01:10:00,8.804,7.206,0.0
KER-1,6/4/2025,01:20:00 am,0,2025-06-04 01:20:00,8.8041,7.206,9.999999999994457e-05
KER-1,6/4/2025,01:30:00 am,0,2025-06-04 01:30:00,8.8036,7.207,0.00030000000000001136
KER-1,6/4/2025,01:40:00 am,0,2025-06-04 01:40:00,8.8037,7.21,0.0
KER-1,6/4/2025,01:50:00 am,0,2025-06-04 01:50:00,8.8035,7.21,0.0
KER-1,6/4/2025,02:00:00 am,0,2025-06-04 02:00:00,8.8033,7.21,0.00019999999999997797
KER-1,6/4/2025,02:10:00 am,0,2025-06-04 02:10:00,8.8036,7.212,0.0001000000000000334
KER-1,6/4/2025,02:20:00 am,0,2025-06-04 02:20:00,8.8043,7.213,0.0001000000000000334
KER-1,6/4/2025,02:30:00 am,0,2025-06-04 02:30:00,8.8045,7.214,9.999999999994457e-05
KER-1,6/4/2025,02:40:00 am,0,2025-06-04 02:40:00,8.8047,7.215,9.999999999994457e-05
KER-1,6/4/2025,02:50:00 am,0,2025-06-04 02:50:00,8.8046,7.214,0.00029999999999992256
KER-1,6/4/2025,03:00:00 am,0,2025-06-04 03:00:00,8.8047,7.217,0.0
KER-1,6/4/2025,03:10:00 am,0,2025-06-04 03:10:00,8.8044,7.217,0.0
KER-1,6/4/2025,03:20:00 am,0,2025-06-04 03:20:00,8.8041,7.217,0.0
KER-1,6/4/2025,03:30:00 am,0,2025-06-04 03:30:00,8.8044,7.217,0.0002000000000000668
KER-1,6/4/2025,03:40:00 am,0,2025-06-04 03:40:00,8.8046,7.219,0.0001000000000000334
KER-1,6/4/2025,03:50:00 am,0,2025-06-04 03:50:00,8.8053,7.218,0.00040000000000004474
KER-1,6/4/2025,04:00:00 am,0,2025-06-04 04:00:00,8.8045,7.222,9.999999999994457e-05
KER-1,6/4/2025,04:10:00 am,0,2025-06-04 04:10:00,8.8051,7.223,9.999999999994457e-05
KER-1,6/4/2025,04:20:00 am,0,2025-06-04 04:20:00,8.8044,7.222,0.0
KER-1,6/4/2025,04:30:00 am,0,2025-06-04 04:30:00,8.8046,7.222,0.00039999999999995595
KER-1,6/4/2025,04:40:00 am,0,2025-06-04 04:40:00,8.8046,7.226,0.0001000000000000334
KER-1,6/4/2025,04:50:00 am,0,2025-06-04 04:50:00,8.8042,7.225,0.0001000000000000334
KER-1,6/4/2025,05:00:00 am,0,2025-06-04 05:00:00,8.8038,7.226,0.0
KER-1,6/4/2025,05:10:00 am,0,2025-06-04 05:10:00,8.8036,7.226,0.0001000000000000334
KER-1,6/4/2025,05:20:00 am,0,2025-06-04 05:20:00,8.8034,7.227,0.00030000000000001136
KER-1,6/4/2025,05:30:00 am,0,2025-06-04 05:30:00,8.8039,7.23,0.0
KER-1,6/4/2025,05:40:00 am,0,2025-06-04 05:40:00,8.8043,7.23,0.0001000000000000334
KER-1,6/4/2025,05:50:00 am,0,2025-06-04 05:50:00,8.8045,7.229,0.0001000000000000334
KER-1,6/4/2025,06:00:00 am,0,2025-06-04 06:00:00,8.805,7.23,9.999999999994457e-05
KER-1,6/4/2025,06:10:00 am,0,2025-06-04 06:10:00,8.8056,7.231,0.00030000000000001136
KER-1,6/4/2025,06:20:00 am,0,2025-06-04 06:20:00,8.8062,7.234,0.0001000000000000334
KER-1,6/4/2025,06:30:00 am,0,2025-06-04 06:30:00,8.8072,7.235,0.00019999999999997797
KER-1,6/4/2025,06:40:00 am,0,2025-06-04 06:40:00,8.8069,7.237,0.0
KER-1,6/4/2025,06:50:00 am,0,2025-06-04 06:50:00,8.8064,7.237,0.00030000000000001136
KER-1,6/4/2025,07:00:00 am,0,2025-06-04 07:00:00,8.8063,7.24,0.0
KER-1,6/4/2025,07:10:00 am,0,2025-06-04 07:10:00,8.8061,7.24,0.00019999999999997797
KER-1,6/4/2025,07:20:00 am,0,2025-06-04 07:20:00,8.8058,7.242,0.00019999999999997797
KER-1,6/4/2025,07:30:00 am,0,2025-06-04 07:30:00,8.806,7.244,9.999999999994457e-05
KER-1,6/4/2025,07:40:00 am,0,2025-06-04 07:40:00,8.8052,7.243,0.00030000000000001136
KER-1,6/4/2025,07:50:00 am,0,2025-06-04 07:50:00,8.8045,7.246,9.999999999994457e-05
KER-1,6/4/2025,08:00:00 am,0,2025-06-04 08:00:00,8.8045,7.247,0.0
KER-1,6/4/2025,08:10:00 am,0,2025-06-04 08:10:00,8.8045,7.247,0.0001000000000000334
KER-1,6/4/2025,08:20:00 am,0,2025-06-04 08:20:00,8.8042,7.248,0.00019999999999997797
KER-1,6/4/2025,08:30:00 am,0,2025-06-04 08:30:00,8.8042,7.25,0.00019999999999997797
KER-1,6/4/2025,08:40:00 am,0,2025-06-04 08:40:00,8.803,7.252,0.00019999999999997797
KER-1,6/4/2025,08:50:00 am,0,2025-06-04 08:50:00,8.8021,7.254,0.0
KER-1,6/4/2025,09:00:00 am,0,2025-06-04 09:00:00,8.8016,7.254,0.00030000000000001136
KER-1,6/4/2025,09:10:00 am,0,2025-06-04 09:10:00,8.8007,7.257,0.0001000000000000334
KER-1,6/4/2025,09:20:00 am,0,2025-06-04 09:20:00,8.798,7.258,0.0001000000000000334
KER-1,6/4/2025,09:30:00 am,0,2025-06-04 09:30:00,8.7954,7.259,0.00019999999999997797
KER-1,6/4/2025,09:40:00 am,0,2025-06-04 09:40:00,8.7936,7.261,0.00030000000000001136
KER-1,6/4/2025,09:50:00 am,0,2025-06-04 09:50:00,8.7928,7.264,0.00019999999999997797
KER-1,6/4/2025,10:00:00 am,0,2025-06-04 10:00:00,8.7909,7.266,0.0001000000000000334
KER-1,6/4/2025,10:10:00 am,0,2025-06-04 10:10:00,8.7889,7.267,0.0
KER-1,6/4/2025,10:20:00 am,0,2025-06-04 10:20:00,8.7866,7.267,0.00019999999999997797
KER-1,6/4/2025,10:30:00 am,0,2025-06-04 10:30:00,8.7859,7.269,0.0
KER-1,6/4/2025,10:40:00 am,0,2025-06-04 10:40:00,8.7841,7.269,0.00030000000000001136
KER-1,6/4/2025,10:50:00 am,0,2025-06-04 10:50:00,8.7826,7.272,0.00019999999999997797
KER-1,6/4/2025,11:00:00 am,0,2025-06-04 11:00:00,8.7814,7.274,0.0001000000000000334
KER-1,6/4/2025,11:10:00 am,0,2025-06-04 11:10:00,8.78,7.275,9.999999999994457e-05
KER-1,6/4/2025,11:20:00 am,0,2025-06-04 11:20:00,8.7792,7.276,0.00019999999999997797
KER-1,6/4/2025,11:30:00 am,0,2025-06-04 11:30:00,8.7776,7.278,0.0001000000000000334
KER-1,6/4/2025,11:40:00 am,0,2025-06-04 11:40:00,8.7759,7.279,0.0
KER-1,6/4/2025,11:50:00 am,0,2025-06-04 11:50:00,8.775,7.279,0.00030000000000001136
KER-1,6/4/2025,12:00:00 pm,0,2025-06-04 12:00:00,8.7739,7.282,0.0001000000000000334
KER-1,6/4/2025,12:10:00 pm,0,2025-06-04 12:10:00,8.7718,7.283,9.999999999994457e-05
KER-1,6/4/2025,12:20:00 pm,0,2025-06-04 12:20:00,8.7693,7.284,0.0001000000000000334
KER-1,6/4/2025,12:30:00 pm,0,2025-06-04 12:30:00,8.7676,7.285,0.0001000000000000334
KER-1,6/4/2025,12:40:00 pm,0,2025-06-04 12:40:00,8.7656,7.284,0.0
KER-1,6/4/2025,12:50:00 pm,0,2025-06-04 12:50:00,8.7638,7.284,0.00030000000000001136
KER-1,6/4/2025,01:00:00 pm,0,2025-06-04 13:00:00,8.7631,7.287,0.0001000000000000334
KER-1,6/4/2025,01:10:00 pm,0,2025-06-04 13:10:00,8.7616,7.286,0.00030000000000001136
KER-1,6/4/2025,01:20:00 pm,0,2025-06-04 13:20:00,8.7592,7.289,0.00030000000000001136
KER-1,6/4/2025,01:30:00 pm,0,2025-06-04 13:30:00,8.757,7.286,0.00029999999999992256
KER-1,6/4/2025,01:40:00 pm,0,2025-06-04 13:40:00,8.7555,7.283,0.0
KER-1,6/4/2025,01:50:00 pm,0,2025-06-04 13:50:00,8.7541,7.283,0.0
KER-1,6/4/2025,02:00:00 pm,0,2025-06-04 14:00:00,8.753,7.283,0.0
KER-1,6/4/2025,02:10:00 pm,0,2025-06-04 14:10:00,8.7517,7.283,9.999999999994457e-05
KER-1,6/4/2025,02:20:00 pm,0,2025-06-04 14:20:00,8.7504,7.284,9.999999999994457e-05
KER-1,6/4/2025,02:30:00 pm,0,2025-06-04 14:30:00,8.7486,7.283,0.00019999999999997797
KER-1,6/4/2025,02:40:00 pm,0,2025-06-04 14:40:00,8.7476,7.285,0.00030000000000001136
KER-1,6/4/2025,02:50:00 pm,0,2025-06-04 14:50:00,8.7472,7.282,0.0001000000000000334
KER-1,6/4/2025,03:00:00 pm,0,2025-06-04 15:00:00,8.7464,7.281,0.0001000000000000334
KER-1,6/4/2025,03:10:00 pm,0,2025-06-04 15:10:00,8.7457,7.282,0.0001000000000000334
KER-1,6/4/2025,03:20:00 pm,0,2025-06-04 15:20:00,8.7446,7.281,0.0001000000000000334
KER-1,6/4/2025,03:30:00 pm,0,2025-06-04 15:30:00,8.7445,7.282,0.0001000000000000334
KER-1,6/4/2025,03:40:00 pm,0,2025-06-04 15:40:00,8.7444,7.283,9.999999999994457e-05
KER-1,6/4/2025,03:50:00 pm,0,2025-06-04 15:50:00,8.7448,7.284,0.0001000000000000334
KER-1,6/4/2025,04:00:00 pm,0,2025-06-04 16:00:00,8.7443,7.285,0.00019999999999997797
KER-1,6/4/2025,04:10:00 pm,0,2025-06-04 16:10:00,8.7446,7.287,0.0
KER-1,6/4/2025,04:20:00 pm,0,2025-06-04 16:20:00,8.7436,7.287,0.0
KER-1,6/4/2025,04:30:00 pm,0,2025-06-04 16:30:00,8.7437,7.287,0.0
KER-1,6/4/2025,04:40:00 pm,0,2025-06-04 16:40:00,8.7431,7.287,0.0001000000000000334
KER-1,6/4/2025,04:50:00 pm,0,2025-06-04 16:50:00,8.7427,7.286,0.00030000000000001136
KER-1,6/4/2025,05:00:00 pm,0,2025-06-04 17:00:00,8.7432,7.289,0.0001000000000000334
KER-1,6/4/2025,05:10:00 pm,0,2025-06-04 17:10:00,8.7446,7.29,0.0001000000000000334
KER-1,6/4/2025,05:20:00 pm,0,2025-06-04 17:20:00,8.7462,7.289,9.999999999994457e-05
KER-1,6/4/2025,05:30:00 pm,0,2025-06-04 17:30:00,8.747,7.288,0.0001000000000000334
KER-1,6/4/2025,05:40:00 pm,0,2025-06-04 17:40:00,8.7483,7.287,0.00030000000000001136
KER-1,6/4/2025,05:50:00 pm,0,2025-06-04 17:50:00,8.7495,7.29,0.00019999999999997797
KER-1,6/4/2025,06:00:00 pm,0,2025-06-04 18:00:00,8.7508,7.288,9.999999999994457e-05
KER-1,6/4/2025,06:10:00 pm,0,2025-06-04 18:10:00,8.7519,7.289,0.0
KER-1,6/4/2025,06:20:00 pm,0,2025-06-04 18:20:00,8.7527,7.289,0.0002000000000000668
KER-1,6/4/2025,06:30:00 pm,0,2025-06-04 18:30:00,8.7534,7.291,0.0001000000000000334
KER-1,6/4/2025,06:40:00 pm,0,2025-06-04 18:40:00,8.7539,7.29,0.0001000000000000334
KER-1,6/4/2025,06:50:00 pm,0,2025-06-04 18:50:00,8.755,7.291,9.999999999994457e-05
KER-1,6/4/2025,07:00:00 pm,0,2025-06-04 19:00:00,8.756,7.292,9.999999999994457e-05
KER-1,6/4/2025,07:10:00 pm,0,2025-06-04 19:10:00,8.757,7.291,9.999999999994457e-05
KER-1,6/4/2025,07:20:00 pm,0,2025-06-04 19:20:00,8.7584,7.292,0.0001000000000000334
KER-1,6/4/2025,07:30:00 pm,0,2025-06-04 19:30:00,8.7599,7.293,9.999999999994457e-05
KER-1,6/4/2025,07:40:00 pm,0,2025-06-04 19:40:00,8.7615,7.294,0.00030000000000001136
KER-1,6/4/2025,07:50:00 pm,0,2025-06-04 19:50:00,8.763,7.297,9.999999999994457e-05
KER-1,6/4/2025,08:00:00 pm,0,2025-06-04 20:00:00,8.7639,7.296,0.0
KER-1,6/4/2025,08:10:00 pm,0,2025-06-04 20:10:00,8.7653,7.296,0.00030000000000001136
KER-1,6/4/2025,08:20:00 pm,0,2025-06-04 20:20:00,8.7669,7.299,9.999999999994457e-05
KER-1,6/4/2025,08:30:00 pm,0,2025-06-04 20:30:00,8.7681,7.3,0.0001000000000000334
KER-1,6/4/2025,08:40:00 pm,0,2025-06-04 20:40:00,8.7689,7.301,0.0
KER-1,6/4/2025,08:50:00 pm,0,2025-06-04 20:50:00,8.7693,7.301,0.0001000000000000334
KER-1,6/4/2025,09:00:00 pm,0,2025-06-04 21:00:00,8.7704,7.3,0.00030000000000001136
KER-1,6/4/2025,09:10:00 pm,0,2025-06-04 21:10:00,8.7721,7.303,0.0001000000000000334
KER-1,6/4/2025,09:20:00 pm,0,2025-06-04 21:20:00,8.7738,7.304,9.999999999994457e-05
KER-1,6/4/2025,09:30:00 pm,0,2025-06-04 21:30:00,8.7754,7.305,0.0002000000000000668
KER-1,6/4/2025,09:40:00 pm,0,2025-06-04 21:40:00,8.7771,7.307,0.0
KER-1,6/4/2025,09:50:00 pm,0,2025-06-04 21:50:00,8.7784,7.307,9.999999999994457e-05
KER-1,6/4/2025,10:00:00 pm,0,2025-06-04 22:00:00,8.7796,7.308,0.0
KER-1,6/4/2025,10:10:00 pm,0,2025-06-04 22:10:00,8.7806,7.308,0.00019999999999997797
KER-1,6/4/2025,10:20:00 pm,0,2025-06-04 22:20:00,8.7807,7.31,9.999999999994457e-05
KER-1,6/4/2025,10:30:00 pm,0,2025-06-04 22:30:00,8.7815,7.309,0.00030000000000001136
KER-1,6/4/2025,10:40:00 pm,0,2025-06-04 22:40:00,8.7819,7.312,0.00019999999999997797
KER-1,6/4/2025,10:50:00 pm,0,2025-06-04 22:50:00,8.7821,7.314,0.0001000000000000334
KER-1,6/4/2025,11:00:00 pm,0,2025-06-04 23:00:00,8.7823,7.313,0.0001000000000000334
KER-1,6/4/2025,11:10:00 pm,0,2025-06-04 23:10:00,8.7823,7.314,0.0001000000000000334
KER-1,6/4/2025,11:20:00 pm,0,2025-06-04 23:20:00,8.7824,7.313,0.0004999999999999894
KER-1,6/4/2025,11:30:00 pm,0,2025-06-04 23:30:00,8.7827,7.318,0.0001000000000000334
KER-1,6/4/2025,11:40:00 pm,0,2025-06-04 23:40:00,8.7821,7.319,0.0001000000000000334
KER-1,6/4/2025,11:50:00 pm,0,2025-06-04 23:50:00,8.782,7.32,0.00019999999999997797
KER-1,6/5/2025,12:00:00 am,0,2025-06-05 00:00:00,8.7817,7.322,0.0
KER-1,6/5/2025,12:10:00 am,0,2025-06-05 00:10:00,8.7817,7.322,0.00019999999999997797
KER-1,6/5/2025,12:20:00 am,0,2025-06-05 00:20:00,8.7823,7.324,0.00019999999999997797
KER-1,6/5/2025,12:30:00 am,0,2025-06-05 00:30:00,8.7813,7.322,0.00019999999999997797
KER-1,6/5/2025,12:40:00 am,0,2025-06-05 00:40:00,8.7818,7.324,0.00030000000000001136
KER-1,6/5/2025,12:50:00 am,0,2025-06-05 00:50:00,8.782,7.327,0.0
KER-1,6/5/2025,01:00:00 am,0,2025-06-05 01:00:00,8.7824,7.327,0.0
KER-1,6/5/2025,01:10:00 am,0,2025-06-05 01:10:00,8.7818,7.327,0.0
KER-1,6/5/2025,01:20:00 am,0,2025-06-05 01:20:00,8.7819,7.327,0.00019999999999997797
KER-1,6/5/2025,01:30:00 am,0,2025-06-05 01:30:00,8.7816,7.329,0.0
KER-1,6/5/2025,01:40:00 am,0,2025-06-05 01:40:00,8.7817,7.329,0.0001000000000000334
KER-1,6/5/2025,01:50:00 am,0,2025-06-05 01:50:00,8.7807,7.33,0.0001000000000000334
KER-1,6/5/2025,02:00:00 am,0,2025-06-05 02:00:00,8.7806,7.331,0.0
KER-1,6/5/2025,02:10:00 am,0,2025-06-05 02:10:00,8.7804,7.331,0.00029999999999992256
KER-1,6/5/2025,02:20:00 am,0,2025-06-05 02:20:00,8.7804,7.334,0.0
KER-1,6/5/2025,02:30:00 am,0,2025-06-05 02:30:00,8.7806,7.334,0.0001000000000000334
KER-1,6/5/2025,02:40:00 am,0,2025-06-05 02:40:00,8.7805,7.335,0.0001000000000000334
KER-1,6/5/2025,02:50:00 am,0,2025-06-05 02:50:00,8.7804,7.336,0.00019999999999997797
KER-1,6/5/2025,03:00:00 am,0,2025-06-05 03:00:00,8.7805,7.338,0.00019999999999997797
KER-1,6/5/2025,03:10:00 am,0,2025-06-05 03:10:00,8.7802,7.336,9.999999999994457e-05
KER-1,6/5/2025,03:20:00 am,0,2025-06-05 03:20:00,8.7804,7.337,0.00040000000000004474
KER-1,6/5/2025,03:30:00 am,0,2025-06-05 03:30:00,8.7804,7.341,0.0001000000000000334
KER-1,6/5/2025,03:40:00 am,0,2025-06-05 03:40:00,8.7805,7.34,0.00019999999999997797
KER-1,6/5/2025,03:50:00 am,0,2025-06-05 03:50:00,8.7801,7.342,0.0001000000000000334
KER-1,6/5/2025,04:00:00 am,0,2025-06-05 04:00:00,8.7802,7.343,0.0001000000000000334
KER-1,6/5/2025,04:10:00 am,0,2025-06-05 04:10:00,8.7809,7.344,0.0
KER-1,6/5/2025,04:20:00 am,0,2025-06-05 04:20:00,8.7811,7.344,0.00039999999999995595
KER-1,6/5/2025,04:30:00 am,0,2025-06-05 04:30:00,8.7812,7.348,9.999999999994457e-05
KER-1,6/5/2025,04:40:00 am,0,2025-06-05 04:40:00,8.781,7.347,0.00019999999999997797
KER-1,6/5/2025,04:50:00 am,0,2025-06-05 04:50:00,8.7813,7.349,0.00019999999999997797
KER-1,6/5/2025,05:00:00 am,0,2025-06-05 05:00:00,8.7819,7.351,0.0001000000000000334
KER-1,6/5/2025,05:10:00 am,0,2025-06-05 05:10:00,8.7826,7.352,0.0
KER-1,6/5/2025,05:20:00 am,0,2025-06-05 05:20:00,8.7834,7.352,0.00019999999999997797
KER-1,6/5/2025,05:30:00 am,0,2025-06-05 05:30:00,8.7841,7.354,0.0001000000000000334
KER-1,6/5/2025,05:40:00 am,0,2025-06-05 05:40:00,8.7842,7.355,0.0
KER-1,6/5/2025,05:50:00 am,0,2025-06-05 05:50:00,8.7847,7.355,0.00029999999999992256
KER-1,6/5/2025,06:00:00 am,0,2025-06-05 06:00:00,8.7849,7.358,0.0
KER-1,6/5/2025,06:10:00 am,0,2025-06-05 06:10:00,8.7856,7.358,0.0
KER-1,6/5/2025,06:20:00 am,0,2025-06-05 06:20:00,8.7855,7.358,0.00030000000000001136
KER-1,6/5/2025,06:30:00 am,0,2025-06-05 06:30:00,8.7853,7.361,0.0
KER-1,6/5/2025,06:40:00 am,0,2025-06-05 06:40:00,8.7852,7.361,0.0001000000000000334
KER-1,6/5/2025,06:50:00 am,0,2025-06-05 06:50:00,8.7857,7.362,0.00019999999999997797
KER-1,6/5/2025,07:00:00 am,0,2025-06-05 07:00:00,8.7867,7.364,0.00030000000000001136
KER-1,6/5/2025,07:10:00 am,0,2025-06-05 07:10:00,8.7875,7.367,0.0
KER-1,6/5/2025,07:20:00 am,0,2025-06-05 07:20:00,8.788,7.367,0.0
KER-1,6/5/2025,07:30:00 am,0,2025-06-05 07:30:00,8.7872,7.367,0.00019999999999997797
KER-1,6/5/2025,07:40:00 am,0,2025-06-05 07:40:00,8.7874,7.369,0.0001000000000000334
KER-1,6/5/2025,07:50:00 am,0,2025-06-05 07:50:00,8.7871,7.37,0.00030000000000001136
KER-1,6/5/2025,08:00:00 am,0,2025-06-05 08:00:00,8.7869,7.373,0.0
KER-1,6/5/2025,08:10:00 am,0,2025-06-05 08:10:00,8.7869,7.373,0.00030000000000001136
KER-1,6/5/2025,08:20:00 am,0,2025-06-05 08:20:00,8.7857,7.376,0.00019999999999997797
KER-1,6/5/2025,08:30:00 am,0,2025-06-05 08:30:00,8.7852,7.378,0.00019999999999997797
KER-1,6/5/2025,08:40:00 am,0,2025-06-05 08:40:00,8.7853,7.38,0.0
KER-1,6/5/2025,08:50:00 am,0,2025-06-05 08:50:00,8.7849,7.38,0.0001000000000000334
KER-1,6/5/2025,09:00:00 am,0,2025-06-05 09:00:00,8.7845,7.381,0.0004999999999999894
KER-1,6/5/2025,09:10:00 am,0,2025-06-05 09:10:00,8.7833,7.386,0.0001000000000000334
KER-1,6/5/2025,09:20:00 am,0,2025-06-05 09:20:00,8.7815,7.385,0.0001000000000000334
KER-1,6/5/2025,09:30:00 am,0,2025-06-05 09:30:00,8.7797,7.386,0.00030000000000001136
KER-1,6/5/2025,09:40:00 am,0,2025-06-05 09:40:00,8.779,7.389,9.999999999994457e-05
KER-1,6/5/2025,09:50:00 am,0,2025-06-05 09:50:00,8.7763,7.39,0.00030000000000001136
KER-1,6/5/2025,10:00:00 am,0,2025-06-05 10:00:00,8.7751,7.393,0.00030000000000001136
KER-1,6/5/2025,10:10:00 am,0,2025-06-05 10:10:00,8.7735,7.396,0.0
KER-1,6/5/2025,10:20:00 am,0,2025-06-05 10:20:00,8.772,7.396,0.00019999999999997797
KER-1,6/5/2025,10:30:00 am,0,2025-06-05 10:30:00,8.7702,7.398,0.00040000000000004474
KER-1,6/5/2025,10:40:00 am,0,2025-06-05 10:40:00,8.7702,7.402,0.00019999999999997797
KER-1,6/5/2025,10:50:00 am,0,2025-06-05 10:50:00,8.7686,7.4,0.00029999999999992256
KER-1,6/5/2025,11:00:00 am,0,2025-06-05 11:00:00,8.767,7.403,0.0
KER-1,6/5/2025,11:10:00 am,0,2025-06-05 11:10:00,8.766,7.403,0.00030000000000001136
KER-1,6/5/2025,11:20:00 am,0,2025-06-05 11:20:00,8.7648,7.406,0.0002000000000000668
KER-1,6/5/2025,11:30:00 am,0,2025-06-05 11:30:00,8.7637,7.408,0.0001000000000000334
KER-1,6/5/2025,11:40:00 am,0,2025-06-05 11:40:00,8.7626,7.407,0.0001000000000000334
KER-1,6/5/2025,11:50:00 am,0,2025-06-05 11:50:00,8.7614,7.406,0.00040000000000004474
KER-1,6/5/2025,12:00:00 pm,0,2025-06-05 12:00:00,8.7605,7.41,9.999999999994457e-05
KER-1,6/5/2025,12:10:00 pm,0,2025-06-05 12:10:00,8.7596,7.411,9.999999999994457e-05
KER-1,6/5/2025,12:20:00 pm,0,2025-06-05 12:20:00,8.7585,7.41,0.00019999999999997797
KER-1,6/5/2025,12:30:00 pm,0,2025-06-05 12:30:00,8.7571,7.412,0.0
KER-1,6/5/2025,12:40:00 pm,0,2025-06-05 12:40:00,8.7559,7.412,0.0001000000000000334
KER-1,6/5/2025,12:50:00 pm,0,2025-06-05 12:50:00,8.7553,7.413,0.0001000000000000334
KER-1,6/5/2025,01:00:00 pm,0,2025-06-05 13:00:00,8.7541,7.412,0.0001000000000000334
KER-1,6/5/2025,01:10:00 pm,0,2025-06-05 13:10:00,8.753,7.411,0.0
KER-1,6/5/2025,01:20:00 pm,0,2025-06-05 13:20:00,8.7522,7.411,9.999999999994457e-05
KER-1,6/5/2025,01:30:00 pm,0,2025-06-05 13:30:00,8.7515,7.41,0.00019999999999997797
KER-1,6/5/2025,01:40:00 pm,0,2025-06-05 13:40:00,8.7502,7.412,0.00030000000000001136
KER-1,6/5/2025,01:50:00 pm,0,2025-06-05 13:50:00,8.7495,7.409,0.0001000000000000334
KER-1,6/5/2025,02:00:00 pm,0,2025-06-05 14:00:00,8.7483,7.41,0.0001000000000000334
KER-1,6/5/2025,02:10:00 pm,0,2025-06-05 14:10:00,8.7469,7.409,0.00019999999999997797
KER-1,6/5/2025,02:20:00 pm,0,2025-06-05 14:20:00,8.7468,7.411,0.00019999999999997797
KER-1,6/5/2025,02:30:00 pm,0,2025-06-05 14:30:00,8.7456,7.409,0.0
KER-1,6/5/2025,02:40:00 pm,0,2025-06-05 14:40:00,8.7449,7.409,0.0
KER-1,6/5/2025,02:50:00 pm,0,2025-06-05 14:50:00,8.7447,7.409,9.999999999994457e-05
KER-1,6/5/2025,03:00:00 pm,0,2025-06-05 15:00:00,8.7454,7.408,9.999999999994457e-05
KER-1,6/5/2025,03:10:00 pm,0,2025-06-05 15:10:00,8.7453,7.409,0.00039999999999995595
KER-1,6/5/2025,03:20:00 pm,0,2025-06-05 15:20:00,8.7448,7.405,9.999999999994457e-05
KER-1,6/5/2025,03:30:00 pm,0,2025-06-05 15:30:00,8.7438,7.406,0.0001000000000000334
KER-1,6/5/2025,03:40:00 pm,0,2025-06-05 15:40:00,8.744,7.407,0.0
KER-1,6/5/2025,03:50:00 pm,0,2025-06-05 15:50:00,8.7433,7.407,0.0
KER-1,6/5/2025,04:00:00 pm,0,2025-06-05 16:00:00,8.7435,7.407,0.00019999999999997797
KER-1,6/5/2025,04:10:00 pm,0,2025-06-05 16:10:00,8.7431,7.409,0.0
KER-1,6/5/2025,04:20:00 pm,0,2025-06-05 16:20:00,8.7436,7.409,0.0001000000000000334
KER-1,6/5/2025,04:30:00 pm,0,2025-06-05 16:30:00,8.7441,7.41,0.0001000000000000334
KER-1,6/5/2025,04:40:00 pm,0,2025-06-05 16:40:00,8.7444,7.409,0.0
KER-1,6/5/2025,04:50:00 pm,0,2025-06-05 16:50:00,8.7453,7.409,0.0
KER-1,6/5/2025,05:00:00 pm,0,2025-06-05 17:00:00,8.7465,7.409,0.00019999999999997797
KER-1,6/5/2025,05:10:00 pm,0,2025-06-05 17:10:00,8.7472,7.411,9.999999999994457e-05
KER-1,6/5/2025,05:20:00 pm,0,2025-06-05 17:20:00,8.7479,7.41,0.00030000000000001136
KER-1,6/5/2025,05:30:00 pm,0,2025-06-05 17:30:00,8.7492,7.413,0.0001000000000000334
KER-1,6/5/2025,05:40:00 pm,0,2025-06-05 17:40:00,8.7497,7.412,0.0
KER-1,6/5/2025,05:50:00 pm,0,2025-06-05 17:50:00,8.75,7.412,0.0001000000000000334
KER-1,6/5/2025,06:00:00 pm,0,2025-06-05 18:00:00,8.75,7.413,0.00030000000000001136
KER-1,6/5/2025,06:10:00 pm,0,2025-06-05 18:10:00,8.7511,7.416,0.00040000000000004474
KER-1,6/5/2025,06:20:00 pm,0,2025-06-05 18:20:00,8.7527,7.412,0.00030000000000001136
KER-1,6/5/2025,06:30:00 pm,0,2025-06-05 18:30:00,8.7535,7.415,0.00019999999999997797
KER-1,6/5/2025,06:40:00 pm,0,2025-06-05 18:40:00,8.7551,7.417,0.0
KER-1,6/5/2025,06:50:00 pm,0,2025-06-05 18:50:00,8.7568,7.417,0.00030000000000001136
KER-1,6/5/2025,07:00:00 pm,0,2025-06-05 19:00:00,8.7579,7.42,0.0
KER-1,6/5/2025,07:10:00 pm,0,2025-06-05 19:10:00,8.7592,7.42,0.0001000000000000334
KER-1,6/5/2025,07:20:00 pm,0,2025-06-05 19:20:00,8.7606,7.421,0.0
KER-1,6/5/2025,07:30:00 pm,0,2025-06-05 19:30:00,8.7621,7.421,0.0
KER-1,6/5/2025,07:40:00 pm,0,2025-06-05 19:40:00,8.7647,7.421,0.00030000000000001136
KER-1,6/5/2025,07:50:00 pm,0,2025-06-05 19:50:00,8.7672,7.424,0.0
KER-1,6/5/2025,08:00:00 pm,0,2025-06-05 20:00:00,8.7697,7.424,0.00019999999999997797
KER-1,6/5/2025,08:10:00 pm,0,2025-06-05 20:10:00,8.7717,7.426,9.999999999994457e-05
KER-1,6/5/2025,08:20:00 pm,0,2025-06-05 20:20:00,8.773,7.427,0.0
KER-1,6/5/2025,08:30:00 pm,0,2025-06-05 20:30:00,8.7751,7.427,0.0
KER-1,6/5/2025,08:40:00 pm,0,2025-06-05 20:40:00,8.7773,7.427,0.0002000000000000668
KER-1,6/5/2025,08:50:00 pm,0,2025-06-05 20:50:00,8.7773,7.429,9.999999999994457e-05
KER-1,6/5/2025,09:00:00 pm,0,2025-06-05 21:00:00,8.779,7.43,0.0001000000000000334
KER-1,6/5/2025,09:10:00 pm,0,2025-06-05 21:10:00,8.7789,7.431,0.0001000000000000334
KER-1,6/5/2025,09:20:00 pm,0,2025-06-05 21:20:00,8.7792,7.43,0.00030000000000001136
KER-1,6/5/2025,09:30:00 pm,0,2025-06-05 21:30:00,8.7809,7.433,0.00019999999999997797
KER-1,6/5/2025,09:40:00 pm,0,2025-06-05 21:40:00,8.783,7.435,0.0001000000000000334
KER-1,6/5/2025,09:50:00 pm,0,2025-06-05 21:50:00,8.7847,7.436,0.00019999999999997797
KER-1,6/5/2025,10:00:00 pm,0,2025-06-05 22:00:00,8.786,7.438,0.0002000000000000668
KER-1,6/5/2025,10:10:00 pm,0,2025-06-05 22:10:00,8.7864,7.44,0.0
KER-1,6/5/2025,10:20:00 pm,0,2025-06-05 22:20:00,8.7878,7.44,0.00029999999999992256
KER-1,6/5/2025,10:30:00 pm,0,2025-06-05 22:30:00,8.7889,7.443,0.00019999999999997797
KER-1,6/5/2025,10:40:00 pm,0,2025-06-05 22:40:00,8.79,7.441,0.00040000000000004474
KER-1,6/5/2025,10:50:00 pm,0,2025-06-05 22:50:00,8.7904,7.445,0.0
KER-1,6/5/2025,11:00:00 pm,0,2025-06-05 23:00:00,8.7907,7.445,0.0
KER-1,6/5/2025,11:10:00 pm,0,2025-06-05 23:10:00,8.7908,7.445,0.0
KER-1,6/5/2025,11:20:00 pm,0,2025-06-05 23:20:00,8.7909,7.445,0.00019999999999997797
KER-1,6/5/2025,11:30:00 pm,0,2025-06-05 23:30:00,8.7915,7.447,0.0
KER-1,6/5/2025,11:40:00 pm,0,2025-06-05 23:40:00,8.7913,7.447,0.00019999999999997797
KER-1,6/5/2025,11:50:00 pm,0,2025-06-05 23:50:00,8.7907,7.449,0.00019999999999997797
KER-1,6/6/2025,12:00:00 am,0,2025-06-06 00:00:00,8.7906,7.451,0.0
KER-1,6/6/2025,12:10:00 am,0,2025-06-06 00:10:00,8.79,7.451,0.0001000000000000334
KER-1,6/6/2025,12:20:00 am,0,2025-06-06 00:20:00,8.7899,7.452,0.00019999999999997797
KER-1,6/6/2025,12:30:00 am,0,2025-06-06 00:30:00,8.7896,7.454,0.0002000000000000668
KER-1,6/6/2025,12:40:00 am,0,2025-06-06 00:40:00,8.7897,7.456,0.0
KER-1,6/6/2025,12:50:00 am,0,2025-06-06 00:50:00,8.7901,7.456,0.0
KER-1,6/6/2025,01:00:00 am,0,2025-06-06 01:00:00,8.7904,7.456,9.999999999994457e-05
KER-1,6/6/2025,01:10:00 am,0,2025-06-06 01:10:00,8.7902,7.457,0.0001000000000000334
KER-1,6/6/2025,01:20:00 am,0,2025-06-06 01:20:00,8.7899,7.458,9.999999999994457e-05
KER-1,6/6/2025,01:30:00 am,0,2025-06-06 01:30:00,8.7895,7.459,0.0001000000000000334
KER-1,6/6/2025,01:40:00 am,0,2025-06-06 01:40:00,8.7899,7.46,0.00019999999999997797
KER-1,6/6/2025,01:50:00 am,0,2025-06-06 01:50:00,8.7904,7.462,0.0001000000000000334
KER-1,6/6/2025,02:00:00 am,0,2025-06-06 02:00:00,8.7914,7.463,0.00030000000000001136
KER-1,6/6/2025,02:10:00 am,0,2025-06-06 02:10:00,8.7919,7.466,0.00019999999999997797
KER-1,6/6/2025,02:20:00 am,0,2025-06-06 02:20:00,8.7925,7.468,0.0
KER-1,6/6/2025,02:30:00 am,0,2025-06-06 02:30:00,8.793,7.468,0.00019999999999997797
KER-1,6/6/2025,02:40:00 am,0,2025-06-06 02:40:00,8.7925,7.47,0.0001000000000000334
KER-1,6/6/2025,02:50:00 am,0,2025-06-06 02:50:00,8.7927,7.471,0.00019999999999997797
KER-1,6/6/2025,03:00:00 am,0,2025-06-06 03:00:00,8.7932,7.473,9.999999999994457e-05
KER-1,6/6/2025,03:10:00 am,0,2025-06-06 03:10:00,8.7936,7.472,0.00029999999999992256
KER-1,6/6/2025,03:20:00 am,0,2025-06-06 03:20:00,8.7934,7.475,0.0002000000000000668
KER-1,6/6/2025,03:30:00 am,0,2025-06-06 03:30:00,8.7937,7.477,0.0001000000000000334
KER-1,6/6/2025,03:40:00 am,0,2025-06-06 03:40:00,8.7942,7.476,0.00019999999999997797
KER-1,6/6/2025,03:50:00 am,0,2025-06-06 03:50:00,8.794,7.478,0.0001000000000000334
KER-1,6/6/2025,04:00:00 am,0,2025-06-06 04:00:00,8.7937,7.479,0.0001000000000000334
KER-1,6/6/2025,04:10:00 am,0,2025-06-06 04:10:00,8.7938,7.48,0.0
KER-1,6/6/2025,04:20:00 am,0,2025-06-06 04:20:00,8.7939,7.48,9.999999999994457e-05
KER-1,6/6/2025,04:30:00 am,0,2025-06-06 04:30:00,8.7946,7.481,0.00030000000000001136
KER-1,6/6/2025,04:40:00 am,0,2025-06-06 04:40:00,8.7957,7.484,0.0001000000000000334
KER-1,6/6/2025,04:50:00 am,0,2025-06-06 04:50:00,8.7961,7.485,9.999999999994457e-05
KER-1,6/6/2025,05:00:00 am,0,2025-06-06 05:00:00,8.7968,7.486,0.0002000000000000668
KER-1,6/6/2025,05:10:00 am,0,2025-06-06 05:10:00,8.7979,7.488,0.00029999999999992256
KER-1,6/6/2025,05:20:00 am,0,2025-06-06 05:20:00,8.7991,7.491,9.999999999994457e-05
KER-1,6/6/2025,05:30:00 am,0,2025-06-06 05:30:00,8.7998,7.49,0.00030000000000001136
KER-1,6/6/2025,05:40:00 am,0,2025-06-06 05:40:00,8.8,7.493,0.0
KER-1,6/6/2025,05:50:00 am,0,2025-06-06 05:50:00,8.8011,7.493,9.999999999994457e-05
KER-1,6/6/2025,06:00:00 am,0,2025-06-06 06:00:00,8.802,7.494,0.0001000000000000334
KER-1,6/6/2025,06:10:00 am,0,2025-06-06 06:10:00,8.8026,7.495,0.00030000000000001136
KER-1,6/6/2025,06:20:00 am,0,2025-06-06 06:20:00,8.8039,7.498,0.0
KER-1,6/6/2025,06:30:00 am,0,2025-06-06 06:30:00,8.8053,7.498,0.0001000000000000334
KER-1,6/6/2025,06:40:00 am,0,2025-06-06 06:40:00,8.8056,7.497,0.00019999999999997797
KER-1,6/6/2025,06:50:00 am,0,2025-06-06 06:50:00,8.8058,7.499,0.0002000000000000668
KER-1,6/6/2025,07:00:00 am,0,2025-06-06 07:00:00,8.8065,7.501,9.999999999994457e-05
KER-1,6/6/2025,07:10:00 am,0,2025-06-06 07:10:00,8.8064,7.502,0.00040000000000004474
KER-1,6/6/2025,07:20:00 am,0,2025-06-06 07:20:00,8.8063,7.506,0.00019999999999997797
KER-1,6/6/2025,07:30:00 am,0,2025-06-06 07:30:00,8.8066,7.508,0.0001000000000000334
KER-1,6/6/2025,07:40:00 am,0,2025-06-06 07:40:00,8.8073,7.507,0.00030000000000001136
KER-1,6/6/2025,07:50:00 am,0,2025-06-06 07:50:00,8.8081,7.51,0.0001000000000000334
KER-1,6/6/2025,08:00:00 am,0,2025-06-06 08:00:00,8.8083,7.511,0.0004999999999999894
KER-1,6/6/2025,08:10:00 am,0,2025-06-06 08:10:00,8.809,7.516,0.0001000000000000334
KER-1,6/6/2025,08:20:00 am,0,2025-06-06 08:20:00,8.8094,7.515,0.00030000000000001136
KER-1,6/6/2025,08:30:00 am,0,2025-06-06 08:30:00,8.8094,7.518,0.00019999999999997797
KER-1,6/6/2025,08:40:00 am,0,2025-06-06 08:40:00,8.809,7.52,0.0001000000000000334
KER-1,6/6/2025,08:50:00 am,0,2025-06-06 08:50:00,8.8088,7.521,0.0001000000000000334
KER-1,6/6/2025,09:00:00 am,0,2025-06-06 09:00:00,8.8089,7.522,0.00030000000000001136
KER-1,6/6/2025,09:10:00 am,0,2025-06-06 09:10:00,8.8081,7.525,9.999999999994457e-05
KER-1,6/6/2025,09:20:00 am,0,2025-06-06 09:20:00,8.8069,7.526,0.00030000000000001136
KER-1,6/6/2025,09:30:00 am,0,2025-06-06 09:30:00,8.8058,7.529,0.0
KER-1,6/6/2025,09:40:00 am,0,2025-06-06 09:40:00,8.8044,7.529,0.00019999999999997797
KER-1,6/6/2025,09:50:00 am,0,2025-06-06 09:50:00,8.8035,7.531,0.0002000000000000668
KER-1,6/6/2025,10:00:00 am,0,2025-06-06 10:00:00,8.8022,7.533,0.0
KER-1,6/6/2025,10:10:00 am,0,2025-06-06 10:10:00,8.8007,7.533,0.0004999999999999894
KER-1,6/6/2025,10:20:00 am,0,2025-06-06 10:20:00,8.7997,7.538,0.0
KER-1,6/6/2025,10:30:00 am,0,2025-06-06 10:30:00,8.7987,7.538,9.999999999994457e-05
KER-1,6/6/2025,10:40:00 am,0,2025-06-06 10:40:00,8.7972,7.539,0.0001000000000000334
KER-1,6/6/2025,10:50:00 am,0,2025-06-06 10:50:00,8.7962,7.54,0.00039999999999995595
KER-1,6/6/2025,11:00:00 am,0,2025-06-06 11:00:00,8.7951,7.544,0.0001000000000000334
KER-1,6/6/2025,11:10:00 am,0,2025-06-06 11:10:00,8.7936,7.545,0.0001000000000000334
KER-1,6/6/2025,11:20:00 am,0,2025-06-06 11:20:00,8.7929,7.546,0.0
KER-1,6/6/2025,11:30:00 am,0,2025-06-06 11:30:00,8.7912,7.546,9.999999999994457e-05
KER-1,6/6/2025,11:40:00 am,0,2025-06-06 11:40:00,8.7898,7.547,0.0001000000000000334
KER-1,6/6/2025,11:50:00 am,0,2025-06-06 11:50:00,8.7882,7.548,0.00019999999999997797
KER-1,6/6/2025,12:00:00 pm,0,2025-06-06 12:00:00,8.7855,7.55,0.00030000000000001136
KER-1,6/6/2025,12:10:00 pm,0,2025-06-06 12:10:00,8.7839,7.553,0.0001000000000000334
KER-1,6/6/2025,12:20:00 pm,0,2025-06-06 12:20:00,8.7822,7.552,0.0
KER-1,6/6/2025,12:30:00 pm,0,2025-06-06 12:30:00,8.781,7.552,0.0001000000000000334
KER-1,6/6/2025,12:40:00 pm,0,2025-06-06 12:40:00,8.779,7.553,0.0
KER-1,6/6/2025,12:50:00 pm,0,2025-06-06 12:50:00,8.7776,7.553,0.00019999999999997797
KER-1,6/6/2025,01:00:00 pm,0,2025-06-06 13:00:00,8.7764,7.551,0.00030000000000001136
KER-1,6/6/2025,01:10:00 pm,0,2025-06-06 13:10:00,8.7762,7.548,0.00019999999999997797
KER-1,6/6/2025,01:20:00 pm,0,2025-06-06 13:20:00,8.7748,7.55,0.0001000000000000334
KER-1,6/6/2025,01:30:00 pm,0,2025-06-06 13:30:00,8.7737,7.551,0.00019999999999997797
KER-1,6/6/2025,01:40:00 pm,0,2025-06-06 13:40:00,8.7731,7.549,9.999999999994457e-05
KER-1,6/6/2025,01:50:00 pm,0,2025-06-06 13:50:00,8.7719,7.55,0.0001000000000000334
KER-1,6/6/2025,02:00:00 pm,0,2025-06-06 14:00:00,8.7699,7.551,0.0001000000000000334
KER-1,6/6/2025,02:10:00 pm,0,2025-06-06 14:10:00,8.7703,7.55,0.00019999999999997797
KER-1,6/6/2025,02:20:00 pm,0,2025-06-06 14:20:00,8.7692,7.548,0.0001000000000000334
KER-1,6/6/2025,02:30:00 pm,0,2025-06-06 14:30:00,8.7681,7.549,0.0
KER-1,6/6/2025,02:40:00 pm,0,2025-06-06 14:40:00,8.7678,7.549,0.0001000000000000334
KER-1,6/6/2025,02:50:00 pm,0,2025-06-06 14:50:00,8.7669,7.548,0.00019999999999997797
KER-1,6/6/2025,03:00:00 pm,0,2025-06-06 15:00:00,8.7659,7.55,0.00019999999999997797
KER-1,6/6/2025,03:10:00 pm,0,2025-06-06 15:10:00,8.7659,7.548,0.0
KER-1,6/6/2025,03:20:00 pm,0,2025-06-06 15:20:00,8.7656,7.548,0.00019999999999997797
KER-1,6/6/2025,03:30:00 pm,0,2025-06-06 15:30:00,8.765,7.546,0.00039999999999995595
KER-1,6/6/2025,03:40:00 pm,0,2025-06-06 15:40:00,8.7649,7.55,0.0001000000000000334
KER-1,6/6/2025,03:50:00 pm,0,2025-06-06 15:50:00,8.7658,7.551,0.0
KER-1,6/6/2025,04:00:00 pm,0,2025-06-06 16:00:00,8.7656,7.551,0.00030000000000001136
KER-1,6/6/2025,04:10:00 pm,0,2025-06-06 16:10:00,8.7668,7.554,9.999999999994457e-05
KER-1,6/6/2025,04:20:00 pm,0,2025-06-06 16:20:00,8.767,7.555,0.00019999999999997797
KER-1,6/6/2025,04:30:00 pm,0,2025-06-06 16:30:00,8.7669,7.553,0.0
KER-1,6/6/2025,04:40:00 pm,0,2025-06-06 16:40:00,8.7681,7.553,0.0001000000000000334
KER-1,6/6/2025,04:50:00 pm,0,2025-06-06 16:50:00,8.7694,7.552,9.999999999994457e-05
KER-1,6/6/2025,05:00:00 pm,0,2025-06-06 17:00:00,8.7707,7.551,0.00030000000000001136
KER-1,6/6/2025,05:10:00 pm,0,2025-06-06 17:10:00,8.772,7.554,0.0
KER-1,6/6/2025,05:20:00 pm,0,2025-06-06 17:20:00,8.7717,7.554,9.999999999994457e-05
KER-1,6/6/2025,05:30:00 pm,0,2025-06-06 17:30:00,8.7705,7.555,0.00040000000000004474
KER-1,6/6/2025,05:40:00 pm,0,2025-06-06 17:40:00,8.7714,7.559,0.00040000000000004474
KER-1,6/6/2025,05:50:00 pm,0,2025-06-06 17:50:00,8.7709,7.555,0.0002000000000000668
KER-1,6/6/2025,06:00:00 pm,0,2025-06-06 18:00:00,8.7722,7.557,0.00029999999999992256
KER-1,6/6/2025,06:10:00 pm,0,2025-06-06 18:10:00,8.7732,7.56,0.00019999999999997797
KER-1,6/6/2025,06:20:00 pm,0,2025-06-06 18:20:00,8.7729,7.558,0.00030000000000001136
KER-1,6/6/2025,06:30:00 pm,0,2025-06-06 18:30:00,8.7748,7.561,0.0001000000000000334
KER-1,6/6/2025,06:40:00 pm,0,2025-06-06 18:40:00,8.7762,7.562,9.999999999994457e-05
KER-1,6/6/2025,06:50:00 pm,0,2025-06-06 18:50:00,8.7767,7.563,0.0001000000000000334
KER-1,6/6/2025,07:00:00 pm,0,2025-06-06 19:00:00,8.78,7.564,0.00039999999999995595
KER-1,6/6/2025,07:10:00 pm,0,2025-06-06 19:10:00,8.782,7.568,0.00019999999999997797
KER-1,6/6/2025,07:20:00 pm,0,2025-06-06 19:20:00,8.7833,7.566,0.0001000000000000334
KER-1,6/6/2025,07:30:00 pm,0,2025-06-06 19:30:00,8.7854,7.567,0.0
KER-1,6/6/2025,07:40:00 pm,0,2025-06-06 19:40:00,8.7866,7.567,0.00019999999999997797
KER-1,6/6/2025,07:50:00 pm,0,2025-06-06 19:50:00,8.7874,7.569,0.0001000000000000334
KER-1,6/6/2025,08:00:00 pm,0,2025-06-06 20:00:00,8.7866,7.57,0.0001000000000000334
KER-1,6/6/2025,08:10:00 pm,0,2025-06-06 20:10:00,8.7857,7.569,0.0001000000000000334
KER-1,6/6/2025,08:20:00 pm,0,2025-06-06 20:20:00,8.7858,7.57,9.999999999994457e-05
KER-1,6/6/2025,08:30:00 pm,0,2025-06-06 20:30:00,8.7868,7.571,9.999999999994457e-05
KER-1,6/6/2025,08:40:00 pm,0,2025-06-06 20:40:00,8.7896,7.57,0.00039999999999995595
KER-1,6/6/2025,08:50:00 pm,0,2025-06-06 20:50:00,8.7927,7.574,0.0
KER-1,6/6/2025,09:00:00 pm,0,2025-06-06 21:00:00,8.7952,7.574,0.0001000000000000334
KER-1,6/6/2025,09:10:00 pm,0,2025-06-06 21:10:00,8.7967,7.575,0.00019999999999997797
KER-1,6/6/2025,09:20:00 pm,0,2025-06-06 21:20:00,8.7986,7.577,0.0001000000000000334
KER-1,6/6/2025,09:30:00 pm,0,2025-06-06 21:30:00,8.8004,7.578,0.00019999999999997797
KER-1,6/6/2025,09:40:00 pm,0,2025-06-06 21:40:00,8.8023,7.58,0.0
KER-1,6/6/2025,09:50:00 pm,0,2025-06-06 21:50:00,8.804,7.58,0.00019999999999997797
KER-1,6/6/2025,10:00:00 pm,0,2025-06-06 22:00:00,8.805,7.582,0.00019999999999997797
KER-1,6/6/2025,10:10:00 pm,0,2025-06-06 22:10:00,8.8068,7.584,0.0
KER-1,6/6/2025,10:20:00 pm,0,2025-06-06 22:20:00,8.8077,7.584,0.0001000000000000334
KER-1,6/6/2025,10:30:00 pm,0,2025-06-06 22:30:00,8.8081,7.585,0.0001000000000000334
KER-1,6/6/2025,10:40:00 pm,0,2025-06-06 22:40:00,8.8086,7.586,0.00039999999999995595
KER-1,6/6/2025,10:50:00 pm,0,2025-06-06 22:50:00,8.8102,7.59,0.00030000000000001136
KER-1,6/6/2025,11:00:00 pm,0,2025-06-06 23:00:00,8.8108,7.593,0.0001000000000000334
KER-1,6/6/2025,11:10:00 pm,0,2025-06-06 23:10:00,8.8114,7.592,0.0002000000000000668
KER-1,6/6/2025,11:20:00 pm,0,2025-06-06 23:20:00,8.812,7.594,0.0
KER-1,6/6/2025,11:30:00 pm,0,2025-06-06 23:30:00,8.8125,7.594,9.999999999994457e-05
KER-1,6/6/2025,11:40:00 pm,0,2025-06-06 23:40:00,8.8133,7.595,0.00030000000000001136
KER-1,6/6/2025,11:50:00 pm,0,2025-06-06 23:50:00,8.8137,7.598,0.0001000000000000334
KER-1,6/7/2025,12:00:00 am,0,2025-06-07 00:00:00,8.8143,7.599,0.0001000000000000334
KER-1,6/7/2025,12:10:00 am,0,2025-06-07 00:10:00,8.8144,7.598,0.00030000000000001136
KER-1,6/7/2025,12:20:00 am,0,2025-06-07 00:20:00,8.815,7.601,0.00019999999999997797
KER-1,6/7/2025,12:30:00 am,0,2025-06-07 00:30:00,8.8155,7.603,0.0002000000000000668
KER-1,6/7/2025,12:40:00 am,0,2025-06-07 00:40:00,8.8164,7.605,0.0
KER-1,6/7/2025,12:50:00 am,0,2025-06-07 00:50:00,8.8159,7.605,0.0
KER-1,6/7/2025,01:00:00 am,0,2025-06-07 01:00:00,8.8159,7.605,0.00019999999999997797
KER-1,6/7/2025,01:10:00 am,0,2025-06-07 01:10:00,8.8157,7.607,9.999999999994457e-05
KER-1,6/7/2025,01:20:00 am,0,2025-06-07 01:20:00,8.815,7.608,0.00030000000000001136
KER-1,6/7/2025,01:30:00 am,0,2025-06-07 01:30:00,8.8145,7.611,0.0001000000000000334
KER-1,6/7/2025,01:40:00 am,0,2025-06-07 01:40:00,8.8147,7.612,0.0001000000000000334
KER-1,6/7/2025,01:50:00 am,0,2025-06-07 01:50:00,8.8146,7.613,0.0
KER-1,6/7/2025,02:00:00 am,0,2025-06-07 02:00:00,8.8147,7.613,9.999999999994457e-05
KER-1,6/7/2025,02:10:00 am,0,2025-06-07 02:10:00,8.8147,7.614,0.00030000000000001136
KER-1,6/7/2025,02:20:00 am,0,2025-06-07 02:20:00,8.8145,7.617,0.0
KER-1,6/7/2025,02:30:00 am,0,2025-06-07 02:30:00,8.8151,7.617,0.0001000000000000334
KER-1,6/7/2025,02:40:00 am,0,2025-06-07 02:40:00,8.8152,7.618,0.00030000000000001136
KER-1,6/7/2025,02:50:00 am,0,2025-06-07 02:50:00,8.8158,7.621,9.999999999994457e-05
KER-1,6/7/2025,03:00:00 am,0,2025-06-07 03:00:00,8.8156,7.622,0.0
KER-1,6/7/2025,03:10:00 am,0,2025-06-07 03:10:00,8.8157,7.622,0.00040000000000004474
KER-1,6/7/2025,03:20:00 am,0,2025-06-07 03:20:00,8.8161,7.626,0.0
KER-1,6/7/2025,03:30:00 am,0,2025-06-07 03:30:00,8.8163,7.626,0.0001000000000000334
KER-1,6/7/2025,03:40:00 am,0,2025-06-07 03:40:00,8.8165,7.625,0.00019999999999997797
KER-1,6/7/2025,03:50:00 am,0,2025-06-07 03:50:00,8.8166,7.627,0.00019999999999997797
KER-1,6/7/2025,04:00:00 am,0,2025-06-07 04:00:00,8.817,7.629,0.00030000000000001136
KER-1,6/7/2025,04:10:00 am,0,2025-06-07 04:10:00,8.8169,7.632,0.0001000000000000334
KER-1,6/7/2025,04:20:00 am,0,2025-06-07 04:20:00,8.8173,7.633,0.0
KER-1,6/7/2025,04:30:00 am,0,2025-06-07 04:30:00,8.8183,7.633,0.00030000000000001136
KER-1,6/7/2025,04:40:00 am,0,2025-06-07 04:40:00,8.8188,7.636,0.00019999999999997797
KER-1,6/7/2025,04:50:00 am,0,2025-06-07 04:50:00,8.8188,7.634,0.00029999999999992256
KER-1,6/7/2025,05:00:00 am,0,2025-06-07 05:00:00,8.8197,7.637,0.00019999999999997797
KER-1,6/7/2025,05:10:00 am,0,2025-06-07 05:10:00,8.8204,7.635,0.00040000000000004474
KER-1,6/7/2025,05:20:00 am,0,2025-06-07 05:20:00,8.822,7.639,9.999999999994457e-05
KER-1,6/7/2025,05:30:00 am,0,2025-06-07 05:30:00,8.8227,7.64,0.0002000000000000668
KER-1,6/7/2025,05:40:00 am,0,2025-06-07 05:40:00,8.8237,7.642,0.0
KER-1,6/7/2025,05:50:00 am,0,2025-06-07 05:50:00,8.8243,7.642,0.00019999999999997797
KER-1,6/7/2025,06:00:00 am,0,2025-06-07 06:00:00,8.8249,7.644,9.999999999994457e-05
KER-1,6/7/2025,06:10:00 am,0,2025-06-07 06:10:00,8.8256,7.645,0.0
KER-1,6/7/2025,06:20:00 am,0,2025-06-07 06:20:00,8.8266,7.645,0.00030000000000001136
KER-1,6/7/2025,06:30:00 am,0,2025-06-07 06:30:00,8.8279,7.648,0.0002000000000000668
KER-1,6/7/2025,06:40:00 am,0,2025-06-07 06:40:00,8.8284,7.65,9.999999999994457e-05
KER-1,6/7/2025,06:50:00 am,0,2025-06-07 06:50:00,8.8291,7.651,0.00019999999999997797
KER-1,6/7/2025,07:00:00 am,0,2025-06-07 07:00:00,8.8293,7.653,0.0
KER-1,6/7/2025,07:10:00 am,0,2025-06-07 07:10:00,8.8299,7.653,0.0002000000000000668
KER-1,6/7/2025,07:20:00 am,0,2025-06-07 07:20:00,8.8304,7.655,0.00019999999999997797
KER-1,6/7/2025,07:30:00 am,0,2025-06-07 07:30:00,8.8303,7.657,0.0001000000000000334
KER-1,6/7/2025,07:40:00 am,0,2025-06-07 07:40:00,8.8305,7.658,0.00029999999999992256
KER-1,6/7/2025,07:50:00 am,0,2025-06-07 07:50:00,8.8311,7.661,0.0001000000000000334
KER-1,6/7/2025,08:00:00 am,0,2025-06-07 08:00:00,8.8312,7.662,0.0001000000000000334
KER-1,6/7/2025,08:10:00 am,0,2025-06-07 08:10:00,8.8314,7.663,0.00019999999999997797
