well_id,Date,Time,ms,DT,raw_Level_m,TEMPERATURE,Rate of Change
KHR-1,5/26/2025,08:00:00 pm,0,2025-05-26 20:00:00,8.9625,7.119,0.0002000000000000668
KHR-1,5/26/2025,08:10:00 pm,0,2025-05-26 20:10:00,8.9641,7.121,0.0
KHR-1,5/26/2025,08:20:00 pm,0,2025-05-26 20:20:00,8.9641,7.121,0.00029999999999992256
KHR-1,5/26/2025,08:30:00 pm,0,2025-05-26 20:30:00,8.9651,7.124,0.00029999999999992256
KHR-1,5/26/2025,08:40:00 pm,0,2025-05-26 20:40:00,8.9657,7.121,0.00039999999999995595
KHR-1,5/26/2025,08:50:00 pm,0,2025-05-26 20:50:00,8.9672,7.125,0.0
KHR-1,5/26/2025,09:00:00 pm,0,2025-05-26 21:00:00,8.9689,7.125,0.0001000000000000334
KHR-1,5/26/2025,09:10:00 pm,0,2025-05-26 21:10:00,8.9705,7.124,0.0002000000000000668
KHR-1,5/26/2025,09:20:00 pm,0,2025-05-26 21:20:00,8.9725,7.126,0.00019999999999997797
KHR-1,5/26/2025,09:30:00 pm,0,2025-05-26 21:30:00,8.9741,7.128,0.0001000000000000334
KHR-1,5/26/2025,09:40:00 pm,0,2025-05-26 21:40:00,8.9768,7.127,0.00019999999999997797
KHR-1,5/26/2025,09:50:00 pm,0,2025-05-26 21:50:00,8.9785,7.129,0.0001000000000000334
KHR-1,5/26/2025,10:00:00 pm,0,2025-05-26 22:00:00,8.9801,7.13,0.0
KHR-1,5/26/2025,10:10:00 pm,0,2025-05-26 22:10:00,8.9813,7.13,0.0001000000000000334
KHR-1,5/26/2025,10:20:00 pm,0,2025-05-26 22:20:00,8.9818,7.131,9.999999999994457e-05
KHR-1,5/26/2025,10:30:00 pm,0,2025-05-26 22:30:00,8.9812,7.132,9.999999999994457e-05
KHR-1,5/26/2025,10:40:00 pm,0,2025-05-26 22:40:00,8.9815,7.131,0.00019999999999997797
KHR-1,5/26/2025,10:50:00 pm,0,2025-05-26 22:50:00,8.9817,7.133,0.00019999999999997797
KHR-1,5/26/2025,11:00:00 pm,0,2025-05-26 23:00:00,8.9821,7.135,0.0
KHR-1,5/26/2025,11:10:00 pm,0,2025-05-26 23:10:00,8.9831,7.135,0.0001000000000000334
KHR-1,5/26/2025,11:20:00 pm,0,2025-05-26 23:20:00,8.9838,7.136,0.0
KHR-1,5/26/2025,11:30:00 pm,0,2025-05-26 23:30:00,8.9851,7.136,0.0
KHR-1,5/26/2025,11:40:00 pm,0,2025-05-26 23:40:00,8.9862,7.136,0.00030000000000001136
KHR-1,5/26/2025,11:50:00 pm,0,2025-05-26 23:50:00,8.9867,7.139,0.00019999999999997797
KHR-1,5/27/2025,12:00:00 am,0,2025-05-27 00:00:00,8.9874,7.141,0.00019999999999997797
KHR-1,5/27/2025,12:10:00 am,0,2025-05-27 00:10:00,8.9879,7.143,0.0
KHR-1,5/27/2025,12:20:00 am,0,2025-05-27 00:20:00,8.9883,7.143,0.0
KHR-1,5/27/2025,12:30:00 am,0,2025-05-27 00:30:00,8.988,7.143,0.00019999999999997797
KHR-1,5/27/2025,12:40:00 am,0,2025-05-27 00:40:00,8.9883,7.145,0.0
KHR-1,5/27/2025,12:50:00 am,0,2025-05-27 00:50:00,8.9891,7.145,0.0001000000000000334
KHR-1,5/27/2025,01:00:00 am,0,2025-05-27 01:00:00,8.9894,7.146,0.0001000000000000334
KHR-1,5/27/2025,01:10:00 am,0,2025-05-27 01:10:00,8.9897,7.147,0.0
KHR-1,5/27/2025,01:20:00 am,0,2025-05-27 01:20:00,8.9904,7.147,0.0
KHR-1,5/27/2025,01:30:00 am,0,2025-05-27 01:30:00,8.9911,7.147,0.00019999999999997797
KHR-1,5/27/2025,01:40:00 am,0,2025-05-27 01:40:00,8.991,7.149,0.0001000000000000334
KHR-1,5/27/2025,01:50:00 am,0,2025-05-27 01:50:00,8.9908,7.15,0.00019999999999997797
KHR-1,5/27/2025,02:00:00 am,0,2025-05-27 02:00:00,8.9914,7.152,0.0001000000000000334
KHR-1,5/27/2025,02:10:00 am,0,2025-05-27 02:10:00,8.9913,7.151,0.00019999999999997797
KHR-1,5/27/2025,02:20:00 am,0,2025-05-27 02:20:00,8.9919,7.153,0.0001000000000000334
KHR-1,5/27/2025,02:30:00 am,0,2025-05-27 02:30:00,8.9921,7.154,0.0001000000000000334
KHR-1,5/27/2025,02:40:00 am,0,2025-05-27 02:40:00,8.9922,7.155,0.00019999999999997797
KHR-1,5/27/2025,02:50:00 am,0,2025-05-27 02:50:00,8.9923,7.157,0.0
KHR-1,5/27/2025,03:00:00 am,0,2025-05-27 03:00:00,8.9925,7.157,0.0001000000000000334
KHR-1,5/27/2025,03:10:00 am,0,2025-05-27 03:10:00,8.9922,7.158,9.999999999994457e-05
KHR-1,5/27/2025,03:20:00 am,0,2025-05-27 03:20:00,8.992,7.159,0.0001000000000000334
KHR-1,5/27/2025,03:30:00 am,0,2025-05-27 03:30:00,8.9921,7.16,9.999999999994457e-05
KHR-1,5/27/2025,03:40:00 am,0,2025-05-27 03:40:00,8.9923,7.161,0.0
KHR-1,5/27/2025,03:50:00 am,0,2025-05-27 03:50:00,8.9926,7.161,0.0002000000000000668
KHR-1,5/27/2025,04:00:00 am,0,2025-05-27 04:00:00,8.993,7.163,9.999999999994457e-05
KHR-1,5/27/2025,04:10:00 am,0,2025-05-27 04:10:00,8.9932,7.164,0.0
KHR-1,5/27/2025,04:20:00 am,0,2025-05-27 04:20:00,8.9936,7.164,0.00030000000000001136
KHR-1,5/27/2025,04:30:00 am,0,2025-05-27 04:30:00,8.9942,7.167,9.999999999994457e-05
KHR-1,5/27/2025,04:40:00 am,0,2025-05-27 04:40:00,8.9945,7.166,9.999999999994457e-05
KHR-1,5/27/2025,04:50:00 am,0,2025-05-27 04:50:00,8.995,7.167,0.00030000000000001136
KHR-1,5/27/2025,05:00:00 am,0,2025-05-27 05:00:00,8.9958,7.17,0.0001000000000000334
KHR-1,5/27/2025,05:10:00 am,0,2025-05-27 05:10:00,8.9966,7.171,0.0001000000000000334
KHR-1,5/27/2025,05:20:00 am,0,2025-05-27 05:20:00,8.9975,7.17,0.00019999999999997797
KHR-1,5/27/2025,05:30:00 am,0,2025-05-27 05:30:00,8.9981,7.172,0.0
KHR-1,5/27/2025,05:40:00 am,0,2025-05-27 05:40:00,8.9989,7.172,0.00030000000000001136
KHR-1,5/27/2025,05:50:00 am,0,2025-05-27 05:50:00,8.9988,7.175,0.0001000000000000334
KHR-1,5/27/2025,06:00:00 am,0,2025-05-27 06:00:00,8.9996,7.176,0.0001000000000000334
KHR-1,5/27/2025,06:10:00 am,0,2025-05-27 06:10:00,9.0003,7.175,9.999999999994457e-05
KHR-1,5/27/2025,06:20:00 am,0,2025-05-27 06:20:00,9.0008,7.174,0.00029999999999992256
KHR-1,5/27/2025,06:30:00 am,0,2025-05-27 06:30:00,9.0023,7.177,0.0
KHR-1,5/27/2025,06:40:00 am,0,2025-05-27 06:40:00,9.0029,7.177,0.00030000000000001136
KHR-1,5/27/2025,06:50:00 am,0,2025-05-27 06:50:00,9.0033,7.18,9.999999999994457e-05
KHR-1,5/27/2025,07:00:00 am,0,2025-05-27 07:00:00,9.0034,7.179,0.00039999999999995595
KHR-1,5/27/2025,07:10:00 am,0,2025-05-27 07:10:00,9.0038,7.183,0.0001000000000000334
KHR-1,5/27/2025,07:20:00 am,0,2025-05-27 07:20:00,9.004,7.184,0.0
KHR-1,5/27/2025,07:30:00 am,0,2025-05-27 07:30:00,9.0043,7.184,9.999999999994457e-05
KHR-1,5/27/2025,07:40:00 am,0,2025-05-27 07:40:00,9.0044,7.185,0.0001000000000000334
KHR-1,5/27/2025,07:50:00 am,0,2025-05-27 07:50:00,9.0043,7.186,0.0
KHR-1,5/27/2025,08:00:00 am,0,2025-05-27 08:00:00,9.0046,7.186,0.00040000000000004474
KHR-1,5/27/2025,08:10:00 am,0,2025-05-27 08:10:00,9.0051,7.19,0.0002000000000000668
KHR-1,5/27/2025,08:20:00 am,0,2025-05-27 08:20:00,9.0054,7.188,0.00030000000000001136
KHR-1,5/27/2025,08:30:00 am,0,2025-05-27 08:30:00,9.006,7.191,0.0001000000000000334
KHR-1,5/27/2025,08:40:00 am,0,2025-05-27 08:40:00,9.0066,7.192,0.0
KHR-1,5/27/2025,08:50:00 am,0,2025-05-27 08:50:00,9.0072,7.192,9.999999999994457e-05
KHR-1,5/27/2025,09:00:00 am,0,2025-05-27 09:00:00,9.0079,7.193,9.999999999994457e-05
KHR-1,5/27/2025,09:10:00 am,0,2025-05-27 09:10:00,9.0078,7.192,0.00039999999999995595
KHR-1,5/27/2025,09:20:00 am,0,2025-05-27 09:20:00,9.008,7.196,0.0
KHR-1,5/27/2025,09:30:00 am,0,2025-05-27 09:30:00,9.0083,7.196,9.999999999994457e-05
KHR-1,5/27/2025,09:40:00 am,0,2025-05-27 09:40:00,9.0084,7.195,0.0004999999999999894
KHR-1,5/27/2025,09:50:00 am,0,2025-05-27 09:50:00,9.0085,7.2,9.999999999994457e-05
KHR-1,5/27/2025,10:00:00 am,0,2025-05-27 10:00:00,9.0083,7.201,0.0001000000000000334
KHR-1,5/27/2025,10:10:00 am,0,2025-05-27 10:10:00,9.0082,7.202,0.0001000000000000334
KHR-1,5/27/2025,10:20:00 am,0,2025-05-27 10:20:00,9.008,7.201,0.0001000000000000334
KHR-1,5/27/2025,10:30:00 am,0,2025-05-27 10:30:00,9.0074,7.202,0.00040000000000004474
KHR-1,5/27/2025,10:40:00 am,0,2025-05-27 10:40:00,9.0075,7.206,0.0001000000000000334
KHR-1,5/27/2025,10:50:00 am,0,2025-05-27 10:50:00,9.007,7.205,0.00019999999999997797
KHR-1,5/27/2025,11:00:00 am,0,2025-05-27 11:00:00,9.0066,7.207,0.0
KHR-1,5/27/2025,11:10:00 am,0,2025-05-27 11:10:00,9.006,7.207,0.0001000000000000334
KHR-1,5/27/2025,11:20:00 am,0,2025-05-27 11:20:00,9.0048,7.208,0.00019999999999997797
KHR-1,5/27/2025,11:30:00 am,0,2025-05-27 11:30:00,9.0036,7.21,0.0
KHR-1,5/27/2025,11:40:00 am,0,2025-05-27 11:40:00,9.0029,7.21,0.00040000000000004474
KHR-1,5/27/2025,11:50:00 am,0,2025-05-27 11:50:00,9.0018,7.214,0.0
KHR-1,5/27/2025,12:00:00 pm,0,2025-05-27 12:00:00,9.0006,7.214,9.999999999994457e-05
KHR-1,5/27/2025,12:10:00 pm,0,2025-05-27 12:10:00,8.9997,7.215,0.0
KHR-1,5/27/2025,12:20:00 pm,0,2025-05-27 12:20:00,8.9988,7.215,0.00030000000000001136
KHR-1,5/27/2025,12:30:00 pm,0,2025-05-27 12:30:00,8.9975,7.218,0.00019999999999997797
KHR-1,5/27/2025,12:40:00 pm,0,2025-05-27 12:40:00,8.9958,7.22,0.0
KHR-1,5/27/2025,12:50:00 pm,0,2025-05-27 12:50:00,8.9949,7.22,0.0001000000000000334
KHR-1,5/27/2025,01:00:00 pm,0,2025-05-27 13:00:00,8.9931,7.221,0.00019999999999997797
KHR-1,5/27/2025,01:10:00 pm,0,2025-05-27 13:10:00,8.992,7.223,0.0
KHR-1,5/27/2025,01:20:00 pm,0,2025-05-27 13:20:00,8.9904,7.223,0.0001000000000000334
KHR-1,5/27/2025,01:30:00 pm,0,2025-05-27 13:30:00,8.9889,7.224,9.999999999994457e-05
KHR-1,5/27/2025,01:40:00 pm,0,2025-05-27 13:40:00,8.9867,7.225,0.0002000000000000668
KHR-1,5/27/2025,01:50:00 pm,0,2025-05-27 13:50:00,8.9852,7.227,9.999999999994457e-05
KHR-1,5/27/2025,02:00:00 pm,0,2025-05-27 14:00:00,8.984,7.228,0.0001000000000000334
KHR-1,5/27/2025,02:10:00 pm,0,2025-05-27 14:10:00,8.9817,7.229,0.00019999999999997797
KHR-1,5/27/2025,02:20:00 pm,0,2025-05-27 14:20:00,8.9794,7.231,0.00019999999999997797
KHR-1,5/27/2025,02:30:00 pm,0,2025-05-27 14:30:00,8.9784,7.229,0.00030000000000001136
KHR-1,5/27/2025,02:40:00 pm,0,2025-05-27 14:40:00,8.9767,7.232,0.0
KHR-1,5/27/2025,02:50:00 pm,0,2025-05-27 14:50:00,8.9749,7.232,0.00030000000000001136
KHR-1,5/27/2025,03:00:00 pm,0,2025-05-27 15:00:00,8.9735,7.235,0.0
KHR-1,5/27/2025,03:10:00 pm,0,2025-05-27 15:10:00,8.9728,7.235,0.00030000000000001136
KHR-1,5/27/2025,03:20:00 pm,0,2025-05-27 15:20:00,8.9703,7.238,0.0
KHR-1,5/27/2025,03:30:00 pm,0,2025-05-27 15:30:00,8.9688,7.238,0.0001000000000000334
KHR-1,5/27/2025,03:40:00 pm,0,2025-05-27 15:40:00,8.9682,7.237,0.00039999999999995595
KHR-1,5/27/2025,03:50:00 pm,0,2025-05-27 15:50:00,8.9668,7.241,9.999999999994457e-05
KHR-1,5/27/2025,04:00:00 pm,0,2025-05-27 16:00:00,8.9659,7.24,9.999999999994457e-05
KHR-1,5/27/2025,04:10:00 pm,0,2025-05-27 16:10:00,8.9643,7.241,0.0001000000000000334
KHR-1,5/27/2025,04:20:00 pm,0,2025-05-27 16:20:00,8.9633,7.242,0.00030000000000001136
KHR-1,5/27/2025,04:30:00 pm,0,2025-05-27 16:30:00,8.9622,7.245,0.0001000000000000334
KHR-1,5/27/2025,04:40:00 pm,0,2025-05-27 16:40:00,8.962,7.244,0.00030000000000001136
KHR-1,5/27/2025,04:50:00 pm,0,2025-05-27 16:50:00,8.9616,7.247,0.0
KHR-1,5/27/2025,05:00:00 pm,0,2025-05-27 17:00:00,8.9611,7.247,9.999999999994457e-05
KHR-1,5/27/2025,05:10:00 pm,0,2025-05-27 17:10:00,8.9601,7.246,0.00039999999999995595
KHR-1,5/27/2025,05:20:00 pm,0,2025-05-27 17:20:00,8.9599,7.25,0.0001000000000000334
KHR-1,5/27/2025,05:30:00 pm,0,2025-05-27 17:30:00,8.9599,7.249,0.00040000000000004474
KHR-1,5/27/2025,05:40:00 pm,0,2025-05-27 17:40:00,8.9593,7.253,0.0001000000000000334
KHR-1,5/27/2025,05:50:00 pm,0,2025-05-27 17:50:00,8.9595,7.252,0.0
KHR-1,5/27/2025,06:00:00 pm,0,2025-05-27 18:00:00,8.9594,7.252,0.00030000000000001136
KHR-1,5/27/2025,06:10:00 pm,0,2025-05-27 18:10:00,8.9601,7.255,0.0
KHR-1,5/27/2025,06:20:00 pm,0,2025-05-27 18:20:00,8.96,7.255,0.00030000000000001136
KHR-1,5/27/2025,06:30:00 pm,0,2025-05-27 18:30:00,8.9599,7.258,0.0
KHR-1,5/27/2025,06:40:00 pm,0,2025-05-27 18:40:00,8.9601,7.258,0.00019999999999997797
KHR-1,5/27/2025,06:50:00 pm,0,2025-05-27 18:50:00,8.9598,7.26,9.999999999994457e-05
KHR-1,5/27/2025,07:00:00 pm,0,2025-05-27 19:00:00,8.9601,7.259,0.00019999999999997797
KHR-1,5/27/2025,07:10:00 pm,0,2025-05-27 19:10:00,8.9606,7.261,0.0
KHR-1,5/27/2025,07:20:00 pm,0,2025-05-27 19:20:00,8.9607,7.261,0.00019999999999997797
KHR-1,5/27/2025,07:30:00 pm,0,2025-05-27 19:30:00,8.9616,7.263,0.0
KHR-1,5/27/2025,07:40:00 pm,0,2025-05-27 19:40:00,8.962,7.263,0.0001000000000000334
KHR-1,5/27/2025,07:50:00 pm,0,2025-05-27 19:50:00,8.9626,7.264,0.0
KHR-1,5/27/2025,08:00:00 pm,0,2025-05-27 20:00:00,8.9632,7.264,0.00030000000000001136
KHR-1,5/27/2025,08:10:00 pm,0,2025-05-27 20:10:00,8.9644,7.267,0.00019999999999997797
KHR-1,5/27/2025,08:20:00 pm,0,2025-05-27 20:20:00,8.9653,7.269,0.00019999999999997797
KHR-1,5/27/2025,08:30:00 pm,0,2025-05-27 20:30:00,8.9661,7.271,0.0001000000000000334
KHR-1,5/27/2025,08:40:00 pm,0,2025-05-27 20:40:00,8.967,7.27,0.0002000000000000668
KHR-1,5/27/2025,08:50:00 pm,0,2025-05-27 20:50:00,8.9678,7.272,9.999999999994457e-05
KHR-1,5/27/2025,09:00:00 pm,0,2025-05-27 21:00:00,8.969,7.273,0.0
KHR-1,5/27/2025,09:10:00 pm,0,2025-05-27 21:10:00,8.9701,7.273,0.0
KHR-1,5/27/2025,09:20:00 pm,0,2025-05-27 21:20:00,8.9715,7.273,0.0
KHR-1,5/27/2025,09:30:00 pm,0,2025-05-27 21:30:00,8.9724,7.273,0.00040000000000004474
KHR-1,5/27/2025,09:40:00 pm,0,2025-05-27 21:40:00,8.9735,7.277,0.0001000000000000334
KHR-1,5/27/2025,09:50:00 pm,0,2025-05-27 21:50:00,8.9748,7.276,0.00030000000000001136
KHR-1,5/27/2025,10:00:00 pm,0,2025-05-27 22:00:00,8.9761,7.279,0.0
KHR-1,5/27/2025,10:10:00 pm,0,2025-05-27 22:10:00,8.9779,7.279,0.00019999999999997797
KHR-1,5/27/2025,10:20:00 pm,0,2025-05-27 22:20:00,8.9786,7.281,0.0
KHR-1,5/27/2025,10:30:00 pm,0,2025-05-27 22:30:00,8.9796,7.281,0.00030000000000001136
KHR-1,5/27/2025,10:40:00 pm,0,2025-05-27 22:40:00,8.9804,7.284,0.0
KHR-1,5/27/2025,10:50:00 pm,0,2025-05-27 22:50:00,8.9808,7.284,0.0001000000000000334
KHR-1,5/27/2025,11:00:00 pm,0,2025-05-27 23:00:00,8.9813,7.285,0.0
KHR-1,5/27/2025,11:10:00 pm,0,2025-05-27 23:10:00,8.9819,7.285,0.00039999999999995595
KHR-1,5/27/2025,11:20:00 pm,0,2025-05-27 23:20:00,8.9818,7.289,0.00019999999999997797
KHR-1,5/27/2025,11:30:00 pm,0,2025-05-27 23:30:00,8.9817,7.287,0.00040000000000004474
KHR-1,5/27/2025,11:40:00 pm,0,2025-05-27 23:40:00,8.9825,7.291,0.0
KHR-1,5/27/2025,11:50:00 pm,0,2025-05-27 23:50:00,8.9834,7.291,9.999999999994457e-05
KHR-1,5/28/2025,12:00:00 am,0,2025-05-28 00:00:00,8.9832,7.292,0.0
KHR-1,5/28/2025,12:10:00 am,0,2025-05-28 00:10:00,8.9839,7.292,0.00030000000000001136
KHR-1,5/28/2025,12:20:00 am,0,2025-05-28 00:20:00,8.9853,7.295,0.0001000000000000334
KHR-1,5/28/2025,12:30:00 am,0,2025-05-28 00:30:00,8.9857,7.296,0.0
KHR-1,5/28/2025,12:40:00 am,0,2025-05-28 00:40:00,8.986,7.296,9.999999999994457e-05
KHR-1,5/28/2025,12:50:00 am,0,2025-05-28 00:50:00,8.9857,7.297,0.0002000000000000668
KHR-1,5/28/2025,01:00:00 am,0,2025-05-28 01:00:00,8.9857,7.299,0.0002000000000000668
KHR-1,5/28/2025,01:10:00 am,0,2025-05-28 01:10:00,8.9862,7.297,0.00030000000000001136
KHR-1,5/28/2025,01:20:00 am,0,2025-05-28 01:20:00,8.9866,7.3,0.0001000000000000334
KHR-1,5/28/2025,01:30:00 am,0,2025-05-28 01:30:00,8.9864,7.301,0.00030000000000001136
KHR-1,5/28/2025,01:40:00 am,0,2025-05-28 01:40:00,8.9866,7.304,0.0001000000000000334
KHR-1,5/28/2025,01:50:00 am,0,2025-05-28 01:50:00,8.9864,7.303,0.00019999999999997797
KHR-1,5/28/2025,02:00:00 am,0,2025-05-28 02:00:00,8.9865,7.305,0.0002000000000000668
KHR-1,5/28/2025,02:10:00 am,0,2025-05-28 02:10:00,8.9866,7.307,0.0001000000000000334
KHR-1,5/28/2025,02:20:00 am,0,2025-05-28 02:20:00,8.9871,7.306,0.00019999999999997797
KHR-1,5/28/2025,02:30:00 am,0,2025-05-28 02:30:00,8.9868,7.308,9.999999999994457e-05
KHR-1,5/28/2025,02:40:00 am,0,2025-05-28 02:40:00,8.9869,7.307,0.00039999999999995595
KHR-1,5/28/2025,02:50:00 am,0,2025-05-28 02:50:00,8.9871,7.311,0.0001000000000000334
KHR-1,5/28/2025,03:00:00 am,0,2025-05-28 03:00:00,8.9872,7.312,0.0
KHR-1,5/28/2025,03:10:00 am,0,2025-05-28 03:10:00,8.9872,7.312,0.00019999999999997797
KHR-1,5/28/2025,03:20:00 am,0,2025-05-28 03:20:00,8.9867,7.314,0.0
KHR-1,5/28/2025,03:30:00 am,0,2025-05-28 03:30:00,8.9873,7.314,0.0
KHR-1,5/28/2025,03:40:00 am,0,2025-05-28 03:40:00,8.9875,7.314,0.00030000000000001136
KHR-1,5/28/2025,03:50:00 am,0,2025-05-28 03:50:00,8.9879,7.317,0.0
KHR-1,5/28/2025,04:00:00 am,0,2025-05-28 04:00:00,8.9879,7.317,9.999999999994457e-05
KHR-1,5/28/2025,04:10:00 am,0,2025-05-28 04:10:00,8.9875,7.318,0.00030000000000001136
KHR-1,5/28/2025,04:20:00 am,0,2025-05-28 04:20:00,8.9873,7.321,9.999999999994457e-05
KHR-1,5/28/2025,04:30:00 am,0,2025-05-28 04:30:00,8.9873,7.32,0.00019999999999997797
KHR-1,5/28/2025,04:40:00 am,0,2025-05-28 04:40:00,8.9873,7.322,0.00019999999999997797
KHR-1,5/28/2025,04:50:00 am,0,2025-05-28 04:50:00,8.9873,7.324,0.0001000000000000334
KHR-1,5/28/2025,05:00:00 am,0,2025-05-28 05:00:00,8.9878,7.325,0.00019999999999997797
KHR-1,5/28/2025,05:10:00 am,0,2025-05-28 05:10:00,8.9884,7.327,0.0
KHR-1,5/28/2025,05:20:00 am,0,2025-05-28 05:20:00,8.9899,7.327,0.00019999999999997797
KHR-1,5/28/2025,05:30:00 am,0,2025-05-28 05:30:00,8.9903,7.329,0.0
KHR-1,5/28/2025,05:40:00 am,0,2025-05-28 05:40:00,8.9904,7.329,0.0001000000000000334
KHR-1,5/28/2025,05:50:00 am,0,2025-05-28 05:50:00,8.9907,7.33,0.0
KHR-1,5/28/2025,06:00:00 am,0,2025-05-28 06:00:00,8.9909,7.33,0.00030000000000001136
KHR-1,5/28/2025,06:10:00 am,0,2025-05-28 06:10:00,8.9912,7.333,9.999999999994457e-05
KHR-1,5/28/2025,06:20:00 am,0,2025-05-28 06:20:00,8.9909,7.334,0.0
KHR-1,5/28/2025,06:30:00 am,0,2025-05-28 06:30:00,8.9915,7.334,0.00030000000000001136
KHR-1,5/28/2025,06:40:00 am,0,2025-05-28 06:40:00,8.9922,7.337,0.00019999999999997797
KHR-1,5/28/2025,06:50:00 am,0,2025-05-28 06:50:00,8.9922,7.335,0.00030000000000001136
KHR-1,5/28/2025,07:00:00 am,0,2025-05-28 07:00:00,8.992,7.338,0.00019999999999997797
KHR-1,5/28/2025,07:10:00 am,0,2025-05-28 07:10:00,8.9921,7.34,0.0
KHR-1,5/28/2025,07:20:00 am,0,2025-05-28 07:20:00,8.9925,7.34,0.00019999999999997797
KHR-1,5/28/2025,07:30:00 am,0,2025-05-28 07:30:00,8.9934,7.342,0.0001000000000000334
KHR-1,5/28/2025,07:40:00 am,0,2025-05-28 07:40:00,8.9934,7.343,0.0
KHR-1,5/28/2025,07:50:00 am,0,2025-05-28 07:50:00,8.9941,7.343,0.00019999999999997797
KHR-1,5/28/2025,08:00:00 am,0,2025-05-28 08:00:00,8.9947,7.345,0.0
KHR-1,5/28/2025,08:10:00 am,0,2025-05-28 08:10:00,8.9946,7.345,0.0002000000000000668
KHR-1,5/28/2025,08:20:00 am,0,2025-05-28 08:20:00,8.9951,7.347,0.0
KHR-1,5/28/2025,08:30:00 am,0,2025-05-28 08:30:00,8.9949,7.347,0.00019999999999997797
KHR-1,5/28/2025,08:40:00 am,0,2025-05-28 08:40:00,8.9956,7.349,0.0
KHR-1,5/28/2025,08:50:00 am,0,2025-05-28 08:50:00,8.9958,7.349,0.00019999999999997797
KHR-1,5/28/2025,09:00:00 am,0,2025-05-28 09:00:00,8.996,7.351,0.0
KHR-1,5/28/2025,09:10:00 am,0,2025-05-28 09:10:00,8.9959,7.351,0.00040000000000004474
KHR-1,5/28/2025,09:20:00 am,0,2025-05-28 09:20:00,8.9964,7.355,0.0
KHR-1,5/28/2025,09:30:00 am,0,2025-05-28 09:30:00,8.9965,7.355,0.00019999999999997797
KHR-1,5/28/2025,09:40:00 am,0,2025-05-28 09:40:00,8.9965,7.357,9.999999999994457e-05
KHR-1,5/28/2025,09:50:00 am,0,2025-05-28 09:50:00,8.9962,7.358,0.0001000000000000334
KHR-1,5/28/2025,10:00:00 am,0,2025-05-28 10:00:00,8.9954,7.359,0.0001000000000000334
KHR-1,5/28/2025,10:10:00 am,0,2025-05-28 10:10:00,8.9944,7.36,9.999999999994457e-05
KHR-1,5/28/2025,10:20:00 am,0,2025-05-28 10:20:00,8.994,7.361,0.00030000000000001136
KHR-1,5/28/2025,10:30:00 am,0,2025-05-28 10:30:00,8.9936,7.364,9.999999999994457e-05
KHR-1,5/28/2025,10:40:00 am,0,2025-05-28 10:40:00,8.9928,7.363,0.00029999999999992256
KHR-1,5/28/2025,10:50:00 am,0,2025-05-28 10:50:00,8.9921,7.366,0.0
KHR-1,5/28/2025,11:00:00 am,0,2025-05-28 11:00:00,8.9913,7.366,0.0002000000000000668
KHR-1,5/28/2025,11:10:00 am,0,2025-05-28 11:10:00,8.9906,7.368,0.0001000000000000334
KHR-1,5/28/2025,11:20:00 am,0,2025-05-28 11:20:00,8.9891,7.367,0.00030000000000001136
KHR-1,5/28/2025,11:30:00 am,0,2025-05-28 11:30:00,8.9883,7.37,0.0001000000000000334
KHR-1,5/28/2025,11:40:00 am,0,2025-05-28 11:40:00,8.9874,7.371,0.00019999999999997797
KHR-1,5/28/2025,11:50:00 am,0,2025-05-28 11:50:00,8.9857,7.373,9.999999999994457e-05
KHR-1,5/28/2025,12:00:00 pm,0,2025-05-28 12:00:00,8.9853,7.374,0.0
KHR-1,5/28/2025,12:10:00 pm,0,2025-05-28 12:10:00,8.983,7.374,0.0002000000000000668
KHR-1,5/28/2025,12:20:00 pm,0,2025-05-28 12:20:00,8.9817,7.376,9.999999999994457e-05
KHR-1,5/28/2025,12:30:00 pm,0,2025-05-28 12:30:00,8.9805,7.377,0.0001000000000000334
KHR-1,5/28/2025,12:40:00 pm,0,2025-05-28 12:40:00,8.9801,7.378,9.999999999994457e-05
KHR-1,5/28/2025,12:50:00 pm,0,2025-05-28 12:50:00,8.9791,7.379,0.0002000000000000668
KHR-1,5/28/2025,01:00:00 pm,0,2025-05-28 13:00:00,8.9767,7.381,0.0
KHR-1,5/28/2025,01:10:00 pm,0,2025-05-28 13:10:00,8.9754,7.381,9.999999999994457e-05
KHR-1,5/28/2025,01:20:00 pm,0,2025-05-28 13:20:00,8.9737,7.382,0.0001000000000000334
KHR-1,5/28/2025,01:30:00 pm,0,2025-05-28 13:30:00,8.9728,7.383,0.00019999999999997797
KHR-1,5/28/2025,01:40:00 pm,0,2025-05-28 13:40:00,8.9715,7.385,0.0
KHR-1,5/28/2025,01:50:00 pm,0,2025-05-28 13:50:00,8.9698,7.385,0.00030000000000001136
KHR-1,5/28/2025,02:00:00 pm,0,2025-05-28 14:00:00,8.9681,7.388,0.0001000000000000334
KHR-1,5/28/2025,02:10:00 pm,0,2025-05-28 14:10:00,8.9678,7.389,0.0
KHR-1,5/28/2025,02:20:00 pm,0,2025-05-28 14:20:00,8.9655,7.389,9.999999999994457e-05
KHR-1,5/28/2025,02:30:00 pm,0,2025-05-28 14:30:00,8.9644,7.39,0.0002000000000000668
KHR-1,5/28/2025,02:40:00 pm,0,2025-05-28 14:40:00,8.9623,7.392,0.0
KHR-1,5/28/2025,02:50:00 pm,0,2025-05-28 14:50:00,8.9609,7.392,0.00029999999999992256
KHR-1,5/28/2025,03:00:00 pm,0,2025-05-28 15:00:00,8.9598,7.395,0.0001000000000000334
KHR-1,5/28/2025,03:10:00 pm,0,2025-05-28 15:10:00,8.9585,7.396,0.0001000000000000334
KHR-1,5/28/2025,03:20:00 pm,0,2025-05-28 15:20:00,8.9579,7.397,0.0001000000000000334
KHR-1,5/28/2025,03:30:00 pm,0,2025-05-28 15:30:00,8.9563,7.396,0.00019999999999997797
KHR-1,5/28/2025,03:40:00 pm,0,2025-05-28 15:40:00,8.955,7.398,0.00030000000000001136
KHR-1,5/28/2025,03:50:00 pm,0,2025-05-28 15:50:00,8.9547,7.401,0.0
KHR-1,5/28/2025,04:00:00 pm,0,2025-05-28 16:00:00,8.9546,7.401,0.0
KHR-1,5/28/2025,04:10:00 pm,0,2025-05-28 16:10:00,8.952,7.401,0.0001000000000000334
KHR-1,5/28/2025,04:20:00 pm,0,2025-05-28 16:20:00,8.951,7.402,0.00019999999999997797
KHR-1,5/28/2025,04:30:00 pm,0,2025-05-28 16:30:00,8.9513,7.404,0.0001000000000000334
KHR-1,5/28/2025,04:40:00 pm,0,2025-05-28 16:40:00,8.9503,7.403,0.00030000000000001136
KHR-1,5/28/2025,04:50:00 pm,0,2025-05-28 16:50:00,8.9497,7.406,0.0002000000000000668
KHR-1,5/28/2025,05:00:00 pm,0,2025-05-28 17:00:00,8.9493,7.408,9.999999999994457e-05
KHR-1,5/28/2025,05:10:00 pm,0,2025-05-28 17:10:00,8.9492,7.409,0.0001000000000000334
KHR-1,5/28/2025,05:20:00 pm,0,2025-05-28 17:20:00,8.9496,7.41,0.0001000000000000334
KHR-1,5/28/2025,05:30:00 pm,0,2025-05-28 17:30:00,8.9487,7.409,0.0001000000000000334
KHR-1,5/28/2025,05:40:00 pm,0,2025-05-28 17:40:00,8.9481,7.41,0.00030000000000001136
KHR-1,5/28/2025,05:50:00 pm,0,2025-05-28 17:50:00,8.948,7.413,0.0001000000000000334
KHR-1,5/28/2025,06:00:00 pm,0,2025-05-28 18:00:00,8.9478,7.412,0.00040000000000004474
KHR-1,5/28/2025,06:10:00 pm,0,2025-05-28 18:10:00,8.9465,7.416,9.999999999994457e-05
KHR-1,5/28/2025,06:20:00 pm,0,2025-05-28 18:20:00,8.9461,7.417,0.0
KHR-1,5/28/2025,06:30:00 pm,0,2025-05-28 18:30:00,8.9452,7.417,0.0001000000000000334
KHR-1,5/28/2025,06:40:00 pm,0,2025-05-28 18:40:00,8.9453,7.418,9.999999999994457e-05
KHR-1,5/28/2025,06:50:00 pm,0,2025-05-28 18:50:00,8.9452,7.419,0.0001000000000000334
KHR-1,5/28/2025,07:00:00 pm,0,2025-05-28 19:00:00,8.9459,7.42,0.0001000000000000334
KHR-1,5/28/2025,07:10:00 pm,0,2025-05-28 19:10:00,8.9464,7.421,0.00019999999999997797
KHR-1,5/28/2025,07:20:00 pm,0,2025-05-28 19:20:00,8.9466,7.423,0.00030000000000001136
KHR-1,5/28/2025,07:30:00 pm,0,2025-05-28 19:30:00,8.9476,7.426,0.00019999999999997797
KHR-1,5/28/2025,07:40:00 pm,0,2025-05-28 19:40:00,8.948,7.424,9.999999999994457e-05
KHR-1,5/28/2025,07:50:00 pm,0,2025-05-28 19:50:00,8.9494,7.425,0.0001000000000000334
KHR-1,5/28/2025,08:00:00 pm,0,2025-05-28 20:00:00,8.9496,7.426,0.00019999999999997797
KHR-1,5/28/2025,08:10:00 pm,0,2025-05-28 20:10:00,8.9504,7.428,0.0001000000000000334
KHR-1,5/28/2025,08:20:00 pm,0,2025-05-28 20:20:00,8.9518,7.429,9.999999999994457e-05
KHR-1,5/28/2025,08:30:00 pm,0,2025-05-28 20:30:00,8.9531,7.43,0.0001000000000000334
KHR-1,5/28/2025,08:40:00 pm,0,2025-05-28 20:40:00,8.9542,7.431,0.0
KHR-1,5/28/2025,08:50:00 pm,0,2025-05-28 20:50:00,8.9543,7.431,0.00019999999999997797
KHR-1,5/28/2025,09:00:00 pm,0,2025-05-28 21:00:00,8.9551,7.433,0.0001000000000000334
KHR-1,5/28/2025,09:10:00 pm,0,2025-05-28 21:10:00,8.9558,7.434,0.00019999999999997797
KHR-1,5/28/2025,09:20:00 pm,0,2025-05-28 21:20:00,8.9573,7.436,0.0
KHR-1,5/28/2025,09:30:00 pm,0,2025-05-28 21:30:00,8.9602,7.436,0.00019999999999997797
KHR-1,5/28/2025,09:40:00 pm,0,2025-05-28 21:40:00,8.9624,7.438,0.0001000000000000334
KHR-1,5/28/2025,09:50:00 pm,0,2025-05-28 21:50:00,8.9641,7.439,0.0001000000000000334
KHR-1,5/28/2025,10:00:00 pm,0,2025-05-28 22:00:00,8.9654,7.44,0.00019999999999997797
KHR-1,5/28/2025,10:10:00 pm,0,2025-05-28 22:10:00,8.9683,7.442,0.0
KHR-1,5/28/2025,10:20:00 pm,0,2025-05-28 22:20:00,8.9688,7.442,9.999999999994457e-05
KHR-1,5/28/2025,10:30:00 pm,0,2025-05-28 22:30:00,8.9696,7.443,0.0002000000000000668
KHR-1,5/28/2025,10:40:00 pm,0,2025-05-28 22:40:00,8.9702,7.445,0.0
KHR-1,5/28/2025,10:50:00 pm,0,2025-05-28 22:50:00,8.9712,7.445,9.999999999994457e-05
KHR-1,5/28/2025,11:00:00 pm,0,2025-05-28 23:00:00,8.9718,7.446,0.0001000000000000334
KHR-1,5/28/2025,11:10:00 pm,0,2025-05-28 23:10:00,8.9728,7.447,0.0001000000000000334
KHR-1,5/28/2025,11:20:00 pm,0,2025-05-28 23:20:00,8.9737,7.448,9.999999999994457e-05
KHR-1,5/28/2025,11:30:00 pm,0,2025-05-28 23:30:00,8.975,7.449,0.0001000000000000334
KHR-1,5/28/2025,11:40:00 pm,0,2025-05-28 23:40:00,8.9763,7.45,0.00030000000000001136
KHR-1,5/28/2025,11:50:00 pm,0,2025-05-28 23:50:00,8.9776,7.453,9.999999999994457e-05
KHR-1,5/29/2025,12:00:00 am,0,2025-05-29 00:00:00,8.9787,7.454,0.0001000000000000334
KHR-1,5/29/2025,12:10:00 am,0,2025-05-29 00:10:00,8.979,7.455,0.00019999999999997797
KHR-1,5/29/2025,12:20:00 am,0,2025-05-29 00:20:00,8.9795,7.457,0.0
KHR-1,5/29/2025,12:30:00 am,0,2025-05-29 00:30:00,8.9795,7.457,0.00019999999999997797
KHR-1,5/29/2025,12:40:00 am,0,2025-05-29 00:40:00,8.9804,7.459,0.0
KHR-1,5/29/2025,12:50:00 am,0,2025-05-29 00:50:00,8.981,7.459,0.0002000000000000668
KHR-1,5/29/2025,01:00:00 am,0,2025-05-29 01:00:00,8.9815,7.461,0.0
KHR-1,5/29/2025,01:10:00 am,0,2025-05-29 01:10:00,8.9815,7.461,0.00019999999999997797
KHR-1,5/29/2025,01:20:00 am,0,2025-05-29 01:20:00,8.9819,7.463,0.0
KHR-1,5/29/2025,01:30:00 am,0,2025-05-29 01:30:00,8.9823,7.463,0.0001000000000000334
KHR-1,5/29/2025,01:40:00 am,0,2025-05-29 01:40:00,8.9823,7.464,9.999999999994457e-05
KHR-1,5/29/2025,01:50:00 am,0,2025-05-29 01:50:00,8.9823,7.465,0.0001000000000000334
KHR-1,5/29/2025,02:00:00 am,0,2025-05-29 02:00:00,8.983,7.466,0.00019999999999997797
KHR-1,5/29/2025,02:10:00 am,0,2025-05-29 02:10:00,8.9831,7.468,0.00019999999999997797
KHR-1,5/29/2025,02:20:00 am,0,2025-05-29 02:20:00,8.9838,7.47,0.0
KHR-1,5/29/2025,02:30:00 am,0,2025-05-29 02:30:00,8.9849,7.47,0.0
KHR-1,5/29/2025,02:40:00 am,0,2025-05-29 02:40:00,8.9851,7.47,0.00030000000000001136
KHR-1,5/29/2025,02:50:00 am,0,2025-05-29 02:50:00,8.9857,7.473,9.999999999994457e-05
KHR-1,5/29/2025,03:00:00 am,0,2025-05-29 03:00:00,8.9864,7.472,9.999999999994457e-05
KHR-1,5/29/2025,03:10:00 am,0,2025-05-29 03:10:00,8.9862,7.473,0.00030000000000001136
KHR-1,5/29/2025,03:20:00 am,0,2025-05-29 03:20:00,8.9871,7.476,0.0001000000000000334
KHR-1,5/29/2025,03:30:00 am,0,2025-05-29 03:30:00,8.9879,7.475,0.00030000000000001136
KHR-1,5/29/2025,03:40:00 am,0,2025-05-29 03:40:00,8.988,7.478,0.0
KHR-1,5/29/2025,03:50:00 am,0,2025-05-29 03:50:00,8.9881,7.478,0.0
KHR-1,5/29/2025,04:00:00 am,0,2025-05-29 04:00:00,8.9886,7.478,0.00040000000000004474
KHR-1,5/29/2025,04:10:00 am,0,2025-05-29 04:10:00,8.9893,7.482,0.0
KHR-1,5/29/2025,04:20:00 am,0,2025-05-29 04:20:00,8.9894,7.482,0.00019999999999997797
KHR-1,5/29/2025,04:30:00 am,0,2025-05-29 04:30:00,8.9897,7.484,0.00030000000000001136
KHR-1,5/29/2025,04:40:00 am,0,2025-05-29 04:40:00,8.9902,7.487,0.00019999999999997797
KHR-1,5/29/2025,04:50:00 am,0,2025-05-29 04:50:00,8.9905,7.485,0.00019999999999997797
KHR-1,5/29/2025,05:00:00 am,0,2025-05-29 05:00:00,8.9907,7.487,0.0001000000000000334
KHR-1,5/29/2025,05:10:00 am,0,2025-05-29 05:10:00,8.9911,7.488,9.999999999994457e-05
KHR-1,5/29/2025,05:20:00 am,0,2025-05-29 05:20:00,8.9914,7.489,0.00019999999999997797
KHR-1,5/29/2025,05:30:00 am,0,2025-05-29 05:30:00,8.9915,7.491,9.999999999994457e-05
KHR-1,5/29/2025,05:40:00 am,0,2025-05-29 05:40:00,8.9923,7.49,0.00030000000000001136
KHR-1,5/29/2025,05:50:00 am,0,2025-05-29 05:50:00,8.9925,7.493,9.999999999994457e-05
KHR-1,5/29/2025,06:00:00 am,0,2025-05-29 06:00:00,8.9928,7.494,0.0001000000000000334
KHR-1,5/29/2025,06:10:00 am,0,2025-05-29 06:10:00,8.9931,7.495,0.00039999999999995595
KHR-1,5/29/2025,06:20:00 am,0,2025-05-29 06:20:00,8.9935,7.499,0.0
KHR-1,5/29/2025,06:30:00 am,0,2025-05-29 06:30:00,8.9944,7.499,9.999999999994457e-05
KHR-1,5/29/2025,06:40:00 am,0,2025-05-29 06:40:00,8.995,7.498,9.999999999994457e-05
KHR-1,5/29/2025,06:50:00 am,0,2025-05-29 06:50:00,8.9952,7.499,0.0002000000000000668
KHR-1,5/29/2025,07:00:00 am,0,2025-05-29 07:00:00,8.9957,7.501,0.0001000000000000334
KHR-1,5/29/2025,07:10:00 am,0,2025-05-29 07:10:00,8.9965,7.5,0.00030000000000001136
KHR-1,5/29/2025,07:20:00 am,0,2025-05-29 07:20:00,8.9974,7.503,0.00039999999999995595
KHR-1,5/29/2025,07:30:00 am,0,2025-05-29 07:30:00,8.9979,7.507,0.00030000000000001136
KHR-1,5/29/2025,07:40:00 am,0,2025-05-29 07:40:00,8.9985,7.504,0.0001000000000000334
KHR-1,5/29/2025,07:50:00 am,0,2025-05-29 07:50:00,8.9988,7.505,0.00030000000000001136
KHR-1,5/29/2025,08:00:00 am,0,2025-05-29 08:00:00,9.0,7.508,0.0001000000000000334
KHR-1,5/29/2025,08:10:00 am,0,2025-05-29 08:10:00,9.0012,7.507,0.0002000000000000668
KHR-1,5/29/2025,08:20:00 am,0,2025-05-29 08:20:00,9.0017,7.509,9.999999999994457e-05
KHR-1,5/29/2025,08:30:00 am,0,2025-05-29 08:30:00,9.0019,7.51,0.00019999999999997797
KHR-1,5/29/2025,08:40:00 am,0,2025-05-29 08:40:00,9.0023,7.512,0.0001000000000000334
KHR-1,5/29/2025,08:50:00 am,0,2025-05-29 08:50:00,9.0026,7.513,0.0001000000000000334
KHR-1,5/29/2025,09:00:00 am,0,2025-05-29 09:00:00,9.0036,7.514,0.0
KHR-1,5/29/2025,09:10:00 am,0,2025-05-29 09:10:00,9.0043,7.514,0.00030000000000001136
KHR-1,5/29/2025,09:20:00 am,0,2025-05-29 09:20:00,9.0041,7.517,0.0
KHR-1,5/29/2025,09:30:00 am,0,2025-05-29 09:30:00,9.0048,7.517,9.999999999994457e-05
KHR-1,5/29/2025,09:40:00 am,0,2025-05-29 09:40:00,9.0053,7.518,0.0001000000000000334
KHR-1,5/29/2025,09:50:00 am,0,2025-05-29 09:50:00,9.0052,7.519,0.00019999999999997797
KHR-1,5/29/2025,10:00:00 am,0,2025-05-29 10:00:00,9.0054,7.521,0.0001000000000000334
KHR-1,5/29/2025,10:10:00 am,0,2025-05-29 10:10:00,9.0053,7.522,9.999999999994457e-05
KHR-1,5/29/2025,10:20:00 am,0,2025-05-29 10:20:00,9.0051,7.523,0.0
KHR-1,5/29/2025,10:30:00 am,0,2025-05-29 10:30:00,9.0049,7.523,0.00040000000000004474
KHR-1,5/29/2025,10:40:00 am,0,2025-05-29 10:40:00,9.0046,7.527,9.999999999994457e-05
KHR-1,5/29/2025,10:50:00 am,0,2025-05-29 10:50:00,9.004,7.528,0.0
KHR-1,5/29/2025,11:00:00 am,0,2025-05-29 11:00:00,9.0036,7.528,0.0001000000000000334
KHR-1,5/29/2025,11:10:00 am,0,2025-05-29 11:10:00,9.0029,7.529,0.00030000000000001136
KHR-1,5/29/2025,11:20:00 am,0,2025-05-29 11:20:00,9.002,7.532,0.0
KHR-1,5/29/2025,11:30:00 am,0,2025-05-29 11:30:00,9.0015,7.532,0.00030000000000001136
KHR-1,5/29/2025,11:40:00 am,0,2025-05-29 11:40:00,9.0007,7.535,0.0001000000000000334
KHR-1,5/29/2025,11:50:00 am,0,2025-05-29 11:50:00,9.0,7.534,0.00030000000000001136
KHR-1,5/29/2025,12:00:00 pm,0,2025-05-29 12:00:00,8.999,7.537,0.0
KHR-1,5/29/2025,12:10:00 pm,0,2025-05-29 12:10:00,8.998,7.537,0.0001000000000000334
KHR-1,5/29/2025,12:20:00 pm,0,2025-05-29 12:20:00,8.9968,7.538,9.999999999994457e-05
KHR-1,5/29/2025,12:30:00 pm,0,2025-05-29 12:30:00,8.9955,7.539,0.0001000000000000334
KHR-1,5/29/2025,12:40:00 pm,0,2025-05-29 12:40:00,8.9942,7.54,0.00039999999999995595
KHR-1,5/29/2025,12:50:00 pm,0,2025-05-29 12:50:00,8.9931,7.544,0.00019999999999997797
KHR-1,5/29/2025,01:00:00 pm,0,2025-05-29 13:00:00,8.9911,7.542,0.00030000000000001136
KHR-1,5/29/2025,01:10:00 pm,0,2025-05-29 13:10:00,8.9899,7.545,0.0
KHR-1,5/29/2025,01:20:00 pm,0,2025-05-29 13:20:00,8.9884,7.545,0.00019999999999997797
KHR-1,5/29/2025,01:30:00 pm,0,2025-05-29 13:30:00,8.9865,7.547,9.999999999994457e-05
KHR-1,5/29/2025,01:40:00 pm,0,2025-05-29 13:40:00,8.985,7.546,9.999999999994457e-05
KHR-1,5/29/2025,01:50:00 pm,0,2025-05-29 13:50:00,8.9838,7.547,0.0002000000000000668
KHR-1,5/29/2025,02:00:00 pm,0,2025-05-29 14:00:00,8.9818,7.549,0.00019999999999997797
KHR-1,5/29/2025,02:10:00 pm,0,2025-05-29 14:10:00,8.9805,7.551,9.999999999994457e-05
KHR-1,5/29/2025,02:20:00 pm,0,2025-05-29 14:20:00,8.9787,7.552,0.0
KHR-1,5/29/2025,02:30:00 pm,0,2025-05-29 14:30:00,8.9777,7.552,0.00030000000000001136
KHR-1,5/29/2025,02:40:00 pm,0,2025-05-29 14:40:00,8.9766,7.555,0.0002000000000000668
KHR-1,5/29/2025,02:50:00 pm,0,2025-05-29 14:50:00,8.9753,7.557,0.0002000000000000668
KHR-1,5/29/2025,03:00:00 pm,0,2025-05-29 15:00:00,8.9742,7.555,0.0002000000000000668
KHR-1,5/29/2025,03:10:00 pm,0,2025-05-29 15:10:00,8.973,7.557,0.00029999999999992256
KHR-1,5/29/2025,03:20:00 pm,0,2025-05-29 15:20:00,8.9718,7.56,9.999999999994457e-05
KHR-1,5/29/2025,03:30:00 pm,0,2025-05-29 15:30:00,8.9709,7.559,0.00019999999999997797
KHR-1,5/29/2025,03:40:00 pm,0,2025-05-29 15:40:00,8.97,7.561,0.00019999999999997797
KHR-1,5/29/2025,03:50:00 pm,0,2025-05-29 15:50:00,8.9687,7.563,0.0001000000000000334
KHR-1,5/29/2025,04:00:00 pm,0,2025-05-29 16:00:00,8.9676,7.564,0.0
KHR-1,5/29/2025,04:10:00 pm,0,2025-05-29 16:10:00,8.967,7.564,0.0001000000000000334
KHR-1,5/29/2025,04:20:00 pm,0,2025-05-29 16:20:00,8.9663,7.565,9.999999999994457e-05
KHR-1,5/29/2025,04:30:00 pm,0,2025-05-29 16:30:00,8.9653,7.566,0.00030000000000001136
KHR-1,5/29/2025,04:40:00 pm,0,2025-05-29 16:40:00,8.9646,7.569,0.00940000000000003
KHR-1,5/29/2025,04:50:00 pm,0,2025-05-29 16:50:00,8.958,7.663,0.0004999999999999894
KHR-1,5/29/2025,05:00:00 pm,0,2025-05-29 17:00:00,8.9577,7.658,0.0007000000000000562
KHR-1,5/29/2025,05:10:00 pm,0,2025-05-29 17:10:00,8.9568,7.651,0.0006000000000000227
KHR-1,5/29/2025,05:20:00 pm,0,2025-05-29 17:20:00,8.9564,7.645,0.0
KHR-1,5/29/2025,05:30:00 pm,0,2025-05-29 17:30:00,8.9557,7.645,9.999999999994457e-05
KHR-1,5/29/2025,05:40:00 pm,0,2025-05-29 17:40:00,8.9556,7.644,0.00019999999999997797
KHR-1,5/29/2025,05:50:00 pm,0,2025-05-29 17:50:00,8.9547,7.642,0.00030000000000001136
KHR-1,5/29/2025,06:00:00 pm,0,2025-05-29 18:00:00,8.9541,7.639,0.00030000000000001136
KHR-1,5/29/2025,06:10:00 pm,0,2025-05-29 18:10:00,8.9539,7.642,0.0001000000000000334
KHR-1,5/29/2025,06:20:00 pm,0,2025-05-29 18:20:00,8.9539,7.641,0.00019999999999997797
KHR-1,5/29/2025,06:30:00 pm,0,2025-05-29 18:30:00,8.9535,7.643,0.00019999999999997797
KHR-1,5/29/2025,06:40:00 pm,0,2025-05-29 18:40:00,8.9536,7.641,0.0001000000000000334
KHR-1,5/29/2025,06:50:00 pm,0,2025-05-29 18:50:00,8.9532,7.642,0.0001000000000000334
KHR-1,5/29/2025,07:00:00 pm,0,2025-05-29 19:00:00,8.9537,7.641,0.0
KHR-1,5/29/2025,07:10:00 pm,0,2025-05-29 19:10:00,8.9541,7.641,0.00030000000000001136
KHR-1,5/29/2025,07:20:00 pm,0,2025-05-29 19:20:00,8.955,7.638,0.00019999999999997797
KHR-1,5/29/2025,07:30:00 pm,0,2025-05-29 19:30:00,8.9561,7.636,0.0004999999999999894
KHR-1,5/29/2025,07:40:00 pm,0,2025-05-29 19:40:00,8.9573,7.631,0.00030000000000001136
KHR-1,5/29/2025,07:50:00 pm,0,2025-05-29 19:50:00,8.9588,7.628,0.0001000000000000334
KHR-1,5/29/2025,08:00:00 pm,0,2025-05-29 20:00:00,8.9602,7.627,0.00019999999999997797
KHR-1,5/29/2025,08:10:00 pm,0,2025-05-29 20:10:00,8.9623,7.625,0.0001000000000000334
KHR-1,5/29/2025,08:20:00 pm,0,2025-05-29 20:20:00,8.9641,7.624,0.0
KHR-1,5/29/2025,08:30:00 pm,0,2025-05-29 20:30:00,8.9664,7.624,0.0001000000000000334
KHR-1,5/29/2025,08:40:00 pm,0,2025-05-29 20:40:00,8.9685,7.625,0.0001000000000000334
KHR-1,5/29/2025,08:50:00 pm,0,2025-05-29 20:50:00,8.9702,7.624,0.0001000000000000334
KHR-1,5/29/2025,09:00:00 pm,0,2025-05-29 21:00:00,8.9718,7.625,0.0
KHR-1,5/29/2025,09:10:00 pm,0,2025-05-29 21:10:00,8.9734,7.625,0.0
KHR-1,5/29/2025,09:20:00 pm,0,2025-05-29 21:20:00,8.9751,7.625,0.0
KHR-1,5/29/2025,09:30:00 pm,0,2025-05-29 21:30:00,8.977,7.625,0.0
KHR-1,5/29/2025,09:40:00 pm,0,2025-05-29 21:40:00,8.9789,7.625,0.00019999999999997797
KHR-1,5/29/2025,09:50:00 pm,0,2025-05-29 21:50:00,8.9811,7.627,9.999999999994457e-05
KHR-1,5/29/2025,10:00:00 pm,0,2025-05-29 22:00:00,8.9827,7.626,0.00029999999999992256
KHR-1,5/29/2025,10:10:00 pm,0,2025-05-29 22:10:00,8.9838,7.629,0.00019999999999997797
KHR-1,5/29/2025,10:20:00 pm,0,2025-05-29 22:20:00,8.9849,7.627,0.0001000000000000334
KHR-1,5/29/2025,10:30:00 pm,0,2025-05-29 22:30:00,8.9858,7.628,9.999999999994457e-05
KHR-1,5/29/2025,10:40:00 pm,0,2025-05-29 22:40:00,8.9871,7.629,0.00030000000000001136
KHR-1,5/29/2025,10:50:00 pm,0,2025-05-29 22:50:00,8.9881,7.632,0.0
KHR-1,5/29/2025,11:00:00 pm,0,2025-05-29 23:00:00,8.9894,7.632,0.0001000000000000334
KHR-1,5/29/2025,11:10:00 pm,0,2025-05-29 23:10:00,8.9901,7.633,0.0001000000000000334
KHR-1,5/29/2025,11:20:00 pm,0,2025-05-29 23:20:00,8.9907,7.632,0.0002000000000000668
KHR-1,5/29/2025,11:30:00 pm,0,2025-05-29 23:30:00,8.9919,7.634,9.999999999994457e-05
KHR-1,5/29/2025,11:40:00 pm,0,2025-05-29 23:40:00,8.9928,7.635,0.0
KHR-1,5/29/2025,11:50:00 pm,0,2025-05-29 23:50:00,8.9945,7.635,0.0001000000000000334
KHR-1,5/30/2025,12:00:00 am,0,2025-05-30 00:00:00,8.9959,7.636,0.0
KHR-1,5/30/2025,12:10:00 am,0,2025-05-30 00:10:00,8.9965,7.636,0.00019999999999997797
KHR-1,5/30/2025,12:20:00 am,0,2025-05-30 00:20:00,8.9974,7.638,0.0
KHR-1,5/30/2025,12:30:00 am,0,2025-05-30 00:30:00,8.9978,7.638,0.00019999999999997797
KHR-1,5/30/2025,12:40:00 am,0,2025-05-30 00:40:00,8.9982,7.64,0.0002000000000000668
KHR-1,5/30/2025,12:50:00 am,0,2025-05-30 00:50:00,8.9988,7.642,0.0
KHR-1,5/30/2025,01:00:00 am,0,2025-05-30 01:00:00,8.9991,7.642,9.999999999994457e-05
KHR-1,5/30/2025,01:10:00 am,0,2025-05-30 01:10:00,9.0001,7.643,0.00019999999999997797
KHR-1,5/30/2025,01:20:00 am,0,2025-05-30 01:20:00,9.0009,7.645,0.0
KHR-1,5/30/2025,01:30:00 am,0,2025-05-30 01:30:00,9.0014,7.645,0.00030000000000001136
KHR-1,5/30/2025,01:40:00 am,0,2025-05-30 01:40:00,9.0019,7.648,0.00019999999999997797
KHR-1,5/30/2025,01:50:00 am,0,2025-05-30 01:50:00,9.0028,7.646,0.0001000000000000334
KHR-1,5/30/2025,02:00:00 am,0,2025-05-30 02:00:00,9.0042,7.647,0.00019999999999997797
KHR-1,5/30/2025,02:10:00 am,0,2025-05-30 02:10:00,9.0054,7.649,0.00019999999999997797
KHR-1,5/30/2025,02:20:00 am,0,2025-05-30 02:20:00,9.0056,7.651,0.0
KHR-1,5/30/2025,02:30:00 am,0,2025-05-30 02:30:00,9.0058,7.651,0.00019999999999997797
KHR-1,5/30/2025,02:40:00 am,0,2025-05-30 02:40:00,9.0063,7.653,0.0001000000000000334
KHR-1,5/30/2025,02:50:00 am,0,2025-05-30 02:50:00,9.0072,7.654,0.00019999999999997797
KHR-1,5/30/2025,03:00:00 am,0,2025-05-30 03:00:00,9.0083,7.656,0.0
KHR-1,5/30/2025,03:10:00 am,0,2025-05-30 03:10:00,9.01,7.656,0.0002000000000000668
KHR-1,5/30/2025,03:20:00 am,0,2025-05-30 03:20:00,9.0114,7.658,0.0001000000000000334
KHR-1,5/30/2025,03:30:00 am,0,2025-05-30 03:30:00,9.0123,7.657,0.0
KHR-1,5/30/2025,03:40:00 am,0,2025-05-30 03:40:00,9.013,7.657,0.00030000000000001136
KHR-1,5/30/2025,03:50:00 am,0,2025-05-30 03:50:00,9.014,7.66,0.0
KHR-1,5/30/2025,04:00:00 am,0,2025-05-30 04:00:00,9.0149,7.66,0.00030000000000001136
KHR-1,5/30/2025,04:10:00 am,0,2025-05-30 04:10:00,9.0165,7.663,0.0001000000000000334
KHR-1,5/30/2025,04:20:00 am,0,2025-05-30 04:20:00,9.0168,7.662,0.0001000000000000334
KHR-1,5/30/2025,04:30:00 am,0,2025-05-30 04:30:00,9.0168,7.663,0.00019999999999997797
KHR-1,5/30/2025,04:40:00 am,0,2025-05-30 04:40:00,9.0176,7.665,0.0001000000000000334
KHR-1,5/30/2025,04:50:00 am,0,2025-05-30 04:50:00,9.0177,7.664,0.00030000000000001136
KHR-1,5/30/2025,05:00:00 am,0,2025-05-30 05:00:00,9.0185,7.667,0.00019999999999997797
KHR-1,5/30/2025,05:10:00 am,0,2025-05-30 05:10:00,9.0192,7.669,0.0
KHR-1,5/30/2025,05:20:00 am,0,2025-05-30 05:20:00,9.0205,7.669,0.0
KHR-1,5/30/2025,05:30:00 am,0,2025-05-30 05:30:00,9.0211,7.669,0.0002000000000000668
KHR-1,5/30/2025,05:40:00 am,0,2025-05-30 05:40:00,9.0217,7.671,0.00019999999999997797
KHR-1,5/30/2025,05:50:00 am,0,2025-05-30 05:50:00,9.0227,7.673,0.0
KHR-1,5/30/2025,06:00:00 am,0,2025-05-30 06:00:00,9.0235,7.673,0.0001000000000000334
KHR-1,5/30/2025,06:10:00 am,0,2025-05-30 06:10:00,9.0244,7.674,9.999999999994457e-05
KHR-1,5/30/2025,06:20:00 am,0,2025-05-30 06:20:00,9.0253,7.675,0.0001000000000000334
KHR-1,5/30/2025,06:30:00 am,0,2025-05-30 06:30:00,9.0263,7.676,0.00019999999999997797
KHR-1,5/30/2025,06:40:00 am,0,2025-05-30 06:40:00,9.027,7.678,0.0
KHR-1,5/30/2025,06:50:00 am,0,2025-05-30 06:50:00,9.0276,7.678,0.0001000000000000334
KHR-1,5/30/2025,07:00:00 am,0,2025-05-30 07:00:00,9.0282,7.679,0.00039999999999995595
KHR-1,5/30/2025,07:10:00 am,0,2025-05-30 07:10:00,9.0289,7.683,0.0001000000000000334
KHR-1,5/30/2025,07:20:00 am,0,2025-05-30 07:20:00,9.0299,7.684,0.0
KHR-1,5/30/2025,07:30:00 am,0,2025-05-30 07:30:00,9.0307,7.684,0.0
KHR-1,5/30/2025,07:40:00 am,0,2025-05-30 07:40:00,9.0319,7.684,9.999999999994457e-05
KHR-1,5/30/2025,07:50:00 am,0,2025-05-30 07:50:00,9.0327,7.685,0.0001000000000000334
KHR-1,5/30/2025,08:00:00 am,0,2025-05-30 08:00:00,9.0334,7.686,0.00030000000000001136
KHR-1,5/30/2025,08:10:00 am,0,2025-05-30 08:10:00,9.0343,7.689,0.0
KHR-1,5/30/2025,08:20:00 am,0,2025-05-30 08:20:00,9.035,7.689,0.00030000000000001136
KHR-1,5/30/2025,08:30:00 am,0,2025-05-30 08:30:00,9.0354,7.692,0.0001000000000000334
KHR-1,5/30/2025,08:40:00 am,0,2025-05-30 08:40:00,9.0353,7.691,0.00019999999999997797
KHR-1,5/30/2025,08:50:00 am,0,2025-05-30 08:50:00,9.0352,7.693,0.0
KHR-1,5/30/2025,09:00:00 am,0,2025-05-30 09:00:00,9.0356,7.693,0.0002000000000000668
KHR-1,5/30/2025,09:10:00 am,0,2025-05-30 09:10:00,9.0363,7.695,0.00019999999999997797
KHR-1,5/30/2025,09:20:00 am,0,2025-05-30 09:20:00,9.0361,7.697,0.00039999999999995595
KHR-1,5/30/2025,09:30:00 am,0,2025-05-30 09:30:00,9.0362,7.701,0.00040000000000004474
KHR-1,5/30/2025,09:40:00 am,0,2025-05-30 09:40:00,9.0364,7.705,0.00039999999999995595
KHR-1,5/30/2025,09:50:00 am,0,2025-05-30 09:50:00,9.0363,7.709,0.0001000000000000334
KHR-1,5/30/2025,10:00:00 am,0,2025-05-30 10:00:00,9.0354,7.71,0.00040000000000004474
KHR-1,5/30/2025,10:10:00 am,0,2025-05-30 10:10:00,9.0351,7.714,0.00019999999999997797
KHR-1,5/30/2025,10:20:00 am,0,2025-05-30 10:20:00,9.0347,7.716,0.0
KHR-1,5/30/2025,10:30:00 am,0,2025-05-30 10:30:00,9.0343,7.716,0.0006999999999999674
KHR-1,5/30/2025,10:40:00 am,0,2025-05-30 10:40:00,9.0332,7.723,0.00019999999999997797
KHR-1,5/30/2025,10:50:00 am,0,2025-05-30 10:50:00,9.0326,7.725,0.0
KHR-1,5/30/2025,11:00:00 am,0,2025-05-30 11:00:00,9.0316,7.725,0.00030000000000001136
KHR-1,5/30/2025,11:10:00 am,0,2025-05-30 11:10:00,9.0306,7.728,0.00030000000000001136
KHR-1,5/30/2025,11:20:00 am,0,2025-05-30 11:20:00,9.0294,7.731,0.0001000000000000334
KHR-1,5/30/2025,11:30:00 am,0,2025-05-30 11:30:00,9.0282,7.732,0.00019999999999997797
KHR-1,5/30/2025,11:40:00 am,0,2025-05-30 11:40:00,9.027,7.734,0.0
KHR-1,5/30/2025,11:50:00 am,0,2025-05-30 11:50:00,9.0257,7.734,0.00030000000000001136
KHR-1,5/30/2025,12:00:00 pm,0,2025-05-30 12:00:00,9.0242,7.737,0.00019999999999997797
KHR-1,5/30/2025,12:10:00 pm,0,2025-05-30 12:10:00,9.0225,7.739,0.0
KHR-1,5/30/2025,12:20:00 pm,0,2025-05-30 12:20:00,9.0208,7.739,0.00019999999999997797
KHR-1,5/30/2025,12:30:00 pm,0,2025-05-30 12:30:00,9.0187,7.741,0.0001000000000000334
KHR-1,5/30/2025,12:40:00 pm,0,2025-05-30 12:40:00,9.0175,7.742,0.0001000000000000334
KHR-1,5/30/2025,12:50:00 pm,0,2025-05-30 12:50:00,9.0152,7.743,0.00019999999999997797
KHR-1,5/30/2025,01:00:00 pm,0,2025-05-30 13:00:00,9.0131,7.745,0.0001000000000000334
KHR-1,5/30/2025,01:10:00 pm,0,2025-05-30 13:10:00,9.0113,7.746,0.0
KHR-1,5/30/2025,01:20:00 pm,0,2025-05-30 13:20:00,9.0089,7.746,0.0
KHR-1,5/30/2025,01:30:00 pm,0,2025-05-30 13:30:00,9.0071,7.746,0.00019999999999997797
KHR-1,5/30/2025,01:40:00 pm,0,2025-05-30 13:40:00,9.0046,7.748,9.999999999994457e-05
KHR-1,5/30/2025,01:50:00 pm,0,2025-05-30 13:50:00,9.0027,7.749,0.0002000000000000668
KHR-1,5/30/2025,02:00:00 pm,0,2025-05-30 14:00:00,9.0004,7.751,0.0
KHR-1,5/30/2025,02:10:00 pm,0,2025-05-30 14:10:00,8.9984,7.751,0.00019999999999997797
KHR-1,5/30/2025,02:20:00 pm,0,2025-05-30 14:20:00,8.9961,7.753,0.00019999999999997797
KHR-1,5/30/2025,02:30:00 pm,0,2025-05-30 14:30:00,8.9945,7.755,0.0001000000000000334
KHR-1,5/30/2025,02:40:00 pm,0,2025-05-30 14:40:00,8.9923,7.756,0.0001000000000000334
KHR-1,5/30/2025,02:50:00 pm,0,2025-05-30 14:50:00,8.9902,7.755,0.0
KHR-1,5/30/2025,03:00:00 pm,0,2025-05-30 15:00:00,8.9889,7.755,0.00019999999999997797
KHR-1,5/30/2025,03:10:00 pm,0,2025-05-30 15:10:00,8.9875,7.757,0.0002000000000000668
KHR-1,5/30/2025,03:20:00 pm,0,2025-05-30 15:20:00,8.9868,7.759,0.0
KHR-1,5/30/2025,03:30:00 pm,0,2025-05-30 15:30:00,8.9852,7.759,0.00019999999999997797
KHR-1,5/30/2025,03:40:00 pm,0,2025-05-30 15:40:00,8.9835,7.761,0.00030000000000001136
KHR-1,5/30/2025,03:50:00 pm,0,2025-05-30 15:50:00,8.9824,7.764,0.00019999999999997797
KHR-1,5/30/2025,04:00:00 pm,0,2025-05-30 16:00:00,8.9807,7.766,0.0001000000000000334
KHR-1,5/30/2025,04:10:00 pm,0,2025-05-30 16:10:00,8.9796,7.767,0.00039999999999995595
KHR-1,5/30/2025,04:20:00 pm,0,2025-05-30 16:20:00,8.9787,7.771,0.0001000000000000334
KHR-1,5/30/2025,04:30:00 pm,0,2025-05-30 16:30:00,8.9776,7.772,0.00019999999999997797
KHR-1,5/30/2025,04:40:00 pm,0,2025-05-30 16:40:00,8.9766,7.774,0.0001000000000000334
KHR-1,5/30/2025,04:50:00 pm,0,2025-05-30 16:50:00,8.9758,7.775,0.0001000000000000334
KHR-1,5/30/2025,05:00:00 pm,0,2025-05-30 17:00:00,8.9753,7.774,0.00039999999999995595
KHR-1,5/30/2025,05:10:00 pm,0,2025-05-30 17:10:00,8.9745,7.778,0.0001000000000000334
KHR-1,5/30/2025,05:20:00 pm,0,2025-05-30 17:20:00,8.9738,7.779,0.0001000000000000334
KHR-1,5/30/2025,05:30:00 pm,0,2025-05-30 17:30:00,8.9732,7.778,0.00040000000000004474
KHR-1,5/30/2025,05:40:00 pm,0,2025-05-30 17:40:00,8.9727,7.782,0.0001000000000000334
KHR-1,5/30/2025,05:50:00 pm,0,2025-05-30 17:50:00,8.972,7.783,0.00019999999999997797
KHR-1,5/30/2025,06:00:00 pm,0,2025-05-30 18:00:00,8.971,7.785,0.0
KHR-1,5/30/2025,06:10:00 pm,0,2025-05-30 18:10:00,8.9704,7.785,0.0
KHR-1,5/30/2025,06:20:00 pm,0,2025-05-30 18:20:00,8.9698,7.785,9.999999999994457e-05
KHR-1,5/30/2025,06:30:00 pm,0,2025-05-30 18:30:00,8.9688,7.786,0.0001000000000000334
KHR-1,5/30/2025,06:40:00 pm,0,2025-05-30 18:40:00,8.9685,7.787,0.0
KHR-1,5/30/2025,06:50:00 pm,0,2025-05-30 18:50:00,8.9685,7.787,0.0001000000000000334
KHR-1,5/30/2025,07:00:00 pm,0,2025-05-30 19:00:00,8.9686,7.788,0.0001000000000000334
KHR-1,5/30/2025,07:10:00 pm,0,2025-05-30 19:10:00,8.9686,7.787,0.00019999999999997797
KHR-1,5/30/2025,07:20:00 pm,0,2025-05-30 19:20:00,8.9684,7.785,0.0001000000000000334
KHR-1,5/30/2025,07:30:00 pm,0,2025-05-30 19:30:00,8.9688,7.784,0.0004999999999999894
KHR-1,5/30/2025,07:40:00 pm,0,2025-05-30 19:40:00,8.9693,7.779,0.0
KHR-1,5/30/2025,07:50:00 pm,0,2025-05-30 19:50:00,8.9702,7.779,0.00019999999999997797
KHR-1,5/30/2025,08:00:00 pm,0,2025-05-30 20:00:00,8.9709,7.777,0.00019999999999997797
KHR-1,5/30/2025,08:10:00 pm,0,2025-05-30 20:10:00,8.9712,7.775,0.00019999999999997797
KHR-1,5/30/2025,08:20:00 pm,0,2025-05-30 20:20:00,8.9728,7.777,0.0001000000000000334
KHR-1,5/30/2025,08:30:00 pm,0,2025-05-30 20:30:00,8.9731,7.776,0.00019999999999997797
KHR-1,5/30/2025,08:40:00 pm,0,2025-05-30 20:40:00,8.9735,7.774,0.0001000000000000334
KHR-1,5/30/2025,08:50:00 pm,0,2025-05-30 20:50:00,8.9744,7.775,0.0002000000000000668
KHR-1,5/30/2025,09:00:00 pm,0,2025-05-30 21:00:00,8.9749,7.773,0.00030000000000001136
KHR-1,5/30/2025,09:10:00 pm,0,2025-05-30 21:10:00,8.9758,7.776,0.00019999999999997797
KHR-1,5/30/2025,09:20:00 pm,0,2025-05-30 21:20:00,8.9769,7.778,0.00019999999999997797
KHR-1,5/30/2025,09:30:00 pm,0,2025-05-30 21:30:00,8.978,7.776,0.00019999999999997797
KHR-1,5/30/2025,09:40:00 pm,0,2025-05-30 21:40:00,8.9795,7.778,0.0
KHR-1,5/30/2025,09:50:00 pm,0,2025-05-30 21:50:00,8.9803,7.778,0.0
KHR-1,5/30/2025,10:00:00 pm,0,2025-05-30 22:00:00,8.9814,7.778,0.0002000000000000668
KHR-1,5/30/2025,10:10:00 pm,0,2025-05-30 22:10:00,8.9828,7.78,0.00019999999999997797
KHR-1,5/30/2025,10:20:00 pm,0,2025-05-30 22:20:00,8.9838,7.782,0.0001000000000000334
KHR-1,5/30/2025,10:30:00 pm,0,2025-05-30 22:30:00,8.9856,7.783,0.0002000000000000668
KHR-1,5/30/2025,10:40:00 pm,0,2025-05-30 22:40:00,8.987,7.781,0.0004999999999999894
KHR-1,5/30/2025,10:50:00 pm,0,2025-05-30 22:50:00,8.9875,7.786,9.999999999994457e-05
KHR-1,5/30/2025,11:00:00 pm,0,2025-05-30 23:00:00,8.9881,7.785,0.00019999999999997797
KHR-1,5/30/2025,11:10:00 pm,0,2025-05-30 23:10:00,8.9887,7.787,0.0
KHR-1,5/30/2025,11:20:00 pm,0,2025-05-30 23:20:00,8.989,7.787,0.00019999999999997797
KHR-1,5/30/2025,11:30:00 pm,0,2025-05-30 23:30:00,8.9893,7.789,0.0
KHR-1,5/30/2025,11:40:00 pm,0,2025-05-30 23:40:00,8.9898,7.789,0.0001000000000000334
KHR-1,5/30/2025,11:50:00 pm,0,2025-05-30 23:50:00,8.99,7.79,0.0001000000000000334
KHR-1,5/31/2025,12:00:00 am,0,2025-05-31 00:00:00,8.9904,7.789,0.00030000000000001136
KHR-1,5/31/2025,12:10:00 am,0,2025-05-31 00:10:00,8.9905,7.792,0.0001000000000000334
KHR-1,5/31/2025,12:20:00 am,0,2025-05-31 00:20:00,8.9907,7.793,0.00030000000000001136
KHR-1,5/31/2025,12:30:00 am,0,2025-05-31 00:30:00,8.9912,7.796,0.0001000000000000334
KHR-1,5/31/2025,12:40:00 am,0,2025-05-31 00:40:00,8.9914,7.795,0.00019999999999997797
KHR-1,5/31/2025,12:50:00 am,0,2025-05-31 00:50:00,8.9917,7.797,0.00019999999999997797
KHR-1,5/31/2025,01:00:00 am,0,2025-05-31 01:00:00,8.9918,7.795,0.0001000000000000334
KHR-1,5/31/2025,01:10:00 am,0,2025-05-31 01:10:00,8.9922,7.796,0.00030000000000001136
KHR-1,5/31/2025,01:20:00 am,0,2025-05-31 01:20:00,8.9928,7.799,9.999999999994457e-05
KHR-1,5/31/2025,01:30:00 am,0,2025-05-31 01:30:00,8.9932,7.8,0.00030000000000001136
KHR-1,5/31/2025,01:40:00 am,0,2025-05-31 01:40:00,8.9935,7.803,0.0
KHR-1,5/31/2025,01:50:00 am,0,2025-05-31 01:50:00,8.9933,7.803,0.0001000000000000334
KHR-1,5/31/2025,02:00:00 am,0,2025-05-31 02:00:00,8.9932,7.804,0.0
KHR-1,5/31/2025,02:10:00 am,0,2025-05-31 02:10:00,8.9935,7.804,0.00019999999999997797
KHR-1,5/31/2025,02:20:00 am,0,2025-05-31 02:20:00,8.9938,7.806,0.0001000000000000334
KHR-1,5/31/2025,02:30:00 am,0,2025-05-31 02:30:00,8.9941,7.805,0.00030000000000001136
KHR-1,5/31/2025,02:40:00 am,0,2025-05-31 02:40:00,8.9944,7.808,0.00019999999999997797
KHR-1,5/31/2025,02:50:00 am,0,2025-05-31 02:50:00,8.9949,7.81,0.0
KHR-1,5/31/2025,03:00:00 am,0,2025-05-31 03:00:00,8.9956,7.81,0.0001000000000000334
KHR-1,5/31/2025,03:10:00 am,0,2025-05-31 03:10:00,8.996,7.811,0.00030000000000001136
KHR-1,5/31/2025,03:20:00 am,0,2025-05-31 03:20:00,8.996,7.814,0.0
KHR-1,5/31/2025,03:30:00 am,0,2025-05-31 03:30:00,8.997,7.814,0.0001000000000000334
KHR-1,5/31/2025,03:40:00 am,0,2025-05-31 03:40:00,8.9975,7.813,0.0002000000000000668
KHR-1,5/31/2025,03:50:00 am,0,2025-05-31 03:50:00,8.998,7.815,9.999999999994457e-05
KHR-1,5/31/2025,04:00:00 am,0,2025-05-31 04:00:00,8.9984,7.816,0.00019999999999997797
KHR-1,5/31/2025,04:10:00 am,0,2025-05-31 04:10:00,8.9985,7.818,9.999999999994457e-05
KHR-1,5/31/2025,04:20:00 am,0,2025-05-31 04:20:00,8.9988,7.817,0.00019999999999997797
KHR-1,5/31/2025,04:30:00 am,0,2025-05-31 04:30:00,8.9988,7.819,0.00019999999999997797
KHR-1,5/31/2025,04:40:00 am,0,2025-05-31 04:40:00,9.0,7.821,0.0
KHR-1,5/31/2025,04:50:00 am,0,2025-05-31 04:50:00,9.0008,7.821,0.0002000000000000668
KHR-1,5/31/2025,05:00:00 am,0,2025-05-31 05:00:00,9.0012,7.823,9.999999999994457e-05
KHR-1,5/31/2025,05:10:00 am,0,2025-05-31 05:10:00,9.0015,7.824,0.0
KHR-1,5/31/2025,05:20:00 am,0,2025-05-31 05:20:00,9.0021,7.824,0.0001000000000000334
KHR-1,5/31/2025,05:30:00 am,0,2025-05-31 05:30:00,9.0028,7.825,0.00019999999999997797
KHR-1,5/31/2025,05:40:00 am,0,2025-05-31 05:40:00,9.0035,7.827,0.00019999999999997797
KHR-1,5/31/2025,05:50:00 am,0,2025-05-31 05:50:00,9.0041,7.829,9.999999999994457e-05
KHR-1,5/31/2025,06:00:00 am,0,2025-05-31 06:00:00,9.0046,7.828,0.00019999999999997797
KHR-1,5/31/2025,06:10:00 am,0,2025-05-31 06:10:00,9.0055,7.83,0.0001000000000000334
KHR-1,5/31/2025,06:20:00 am,0,2025-05-31 06:20:00,9.0062,7.831,9.999999999994457e-05
KHR-1,5/31/2025,06:30:00 am,0,2025-05-31 06:30:00,9.0069,7.832,0.0
KHR-1,5/31/2025,06:40:00 am,0,2025-05-31 06:40:00,9.0074,7.832,0.00019999999999997797
KHR-1,5/31/2025,06:50:00 am,0,2025-05-31 06:50:00,9.0082,7.834,0.0001000000000000334
KHR-1,5/31/2025,07:00:00 am,0,2025-05-31 07:00:00,9.0087,7.835,0.0001000000000000334
KHR-1,5/31/2025,07:10:00 am,0,2025-05-31 07:10:00,9.009,7.836,0.00019999999999997797
KHR-1,5/31/2025,07:20:00 am,0,2025-05-31 07:20:00,9.0094,7.838,0.0
KHR-1,5/31/2025,07:30:00 am,0,2025-05-31 07:30:00,9.0091,7.838,0.00030000000000001136
KHR-1,5/31/2025,07:40:00 am,0,2025-05-31 07:40:00,9.0091,7.841,0.0001000000000000334
KHR-1,5/31/2025,07:50:00 am,0,2025-05-31 07:50:00,9.0096,7.84,0.00030000000000001136
KHR-1,5/31/2025,08:00:00 am,0,2025-05-31 08:00:00,9.0101,7.843,0.0
KHR-1,5/31/2025,08:10:00 am,0,2025-05-31 08:10:00,9.01,7.843,0.00040000000000004474
KHR-1,5/31/2025,08:20:00 am,0,2025-05-31 08:20:00,9.0103,7.847,0.0001000000000000334
KHR-1,5/31/2025,08:30:00 am,0,2025-05-31 08:30:00,9.0103,7.846,0.00019999999999997797
KHR-1,5/31/2025,08:40:00 am,0,2025-05-31 08:40:00,9.0106,7.848,0.00019999999999997797
KHR-1,5/31/2025,08:50:00 am,0,2025-05-31 08:50:00,9.0104,7.85,0.0
KHR-1,5/31/2025,09:00:00 am,0,2025-05-31 09:00:00,9.0102,7.85,9.999999999994457e-05
KHR-1,5/31/2025,09:10:00 am,0,2025-05-31 09:10:00,9.0104,7.849,0.00039999999999995595
KHR-1,5/31/2025,09:20:00 am,0,2025-05-31 09:20:00,9.0106,7.853,0.0002000000000000668
KHR-1,5/31/2025,09:30:00 am,0,2025-05-31 09:30:00,9.0102,7.855,0.00039999999999995595
KHR-1,5/31/2025,09:40:00 am,0,2025-05-31 09:40:00,9.0096,7.859,0.0004999999999999894
KHR-1,5/31/2025,09:50:00 am,0,2025-05-31 09:50:00,9.0092,7.864,0.0001000000000000334
KHR-1,5/31/2025,10:00:00 am,0,2025-05-31 10:00:00,9.0083,7.865,0.0004999999999999894
KHR-1,5/31/2025,10:10:00 am,0,2025-05-31 10:10:00,9.0074,7.87,0.00019999999999997797
KHR-1,5/31/2025,10:20:00 am,0,2025-05-31 10:20:00,9.0061,7.872,0.00019999999999997797
KHR-1,5/31/2025,10:30:00 am,0,2025-05-31 10:30:00,9.0053,7.874,0.0001000000000000334
KHR-1,5/31/2025,10:40:00 am,0,2025-05-31 10:40:00,9.0039,7.875,0.00030000000000001136
KHR-1,5/31/2025,10:50:00 am,0,2025-05-31 10:50:00,9.0026,7.878,0.0004999999999999894
KHR-1,5/31/2025,11:00:00 am,0,2025-05-31 11:00:00,9.0007,7.883,0.0
KHR-1,5/31/2025,11:10:00 am,0,2025-05-31 11:10:00,8.9992,7.883,0.00019999999999997797
KHR-1,5/31/2025,11:20:00 am,0,2025-05-31 11:20:00,8.9977,7.885,0.0001000000000000334
KHR-1,5/31/2025,11:30:00 am,0,2025-05-31 11:30:00,8.9964,7.886,0.00030000000000001136
KHR-1,5/31/2025,11:40:00 am,0,2025-05-31 11:40:00,8.9941,7.889,0.00019999999999997797
KHR-1,5/31/2025,11:50:00 am,0,2025-05-31 11:50:00,8.9917,7.891,0.0001000000000000334
KHR-1,5/31/2025,12:00:00 pm,0,2025-05-31 12:00:00,8.9894,7.892,0.00019999999999997797
KHR-1,5/31/2025,12:10:00 pm,0,2025-05-31 12:10:00,8.9881,7.894,9.999999999994457e-05
KHR-1,5/31/2025,12:20:00 pm,0,2025-05-31 12:20:00,8.986,7.895,0.0
KHR-1,5/31/2025,12:30:00 pm,0,2025-05-31 12:30:00,8.9841,7.895,0.00029999999999992256
KHR-1,5/31/2025,12:40:00 pm,0,2025-05-31 12:40:00,8.9817,7.892,0.00039999999999995595
KHR-1,5/31/2025,12:50:00 pm,0,2025-05-31 12:50:00,8.9792,7.896,0.00030000000000001136
KHR-1,5/31/2025,01:00:00 pm,0,2025-05-31 13:00:00,8.9777,7.899,0.0
KHR-1,5/31/2025,01:10:00 pm,0,2025-05-31 13:10:00,8.9745,7.899,0.0001000000000000334
KHR-1,5/31/2025,01:20:00 pm,0,2025-05-31 13:20:00,8.9721,7.9,0.00019999999999997797
KHR-1,5/31/2025,01:30:00 pm,0,2025-05-31 13:30:00,8.9704,7.902,0.00019999999999997797
KHR-1,5/31/2025,01:40:00 pm,0,2025-05-31 13:40:00,8.9681,7.9,9.999999999994457e-05
KHR-1,5/31/2025,01:50:00 pm,0,2025-05-31 13:50:00,8.9666,7.901,0.0001000000000000334
KHR-1,5/31/2025,02:00:00 pm,0,2025-05-31 14:00:00,8.9644,7.902,9.999999999994457e-05
KHR-1,5/31/2025,02:10:00 pm,0,2025-05-31 14:10:00,8.9628,7.903,0.0001000000000000334
KHR-1,5/31/2025,02:20:00 pm,0,2025-05-31 14:20:00,8.9611,7.904,0.00019999999999997797
KHR-1,5/31/2025,02:30:00 pm,0,2025-05-31 14:30:00,8.9589,7.906,0.0
KHR-1,5/31/2025,02:40:00 pm,0,2025-05-31 14:40:00,8.9569,7.906,0.0001000000000000334
KHR-1,5/31/2025,02:50:00 pm,0,2025-05-31 14:50:00,8.955,7.907,0.0
KHR-1,5/31/2025,03:00:00 pm,0,2025-05-31 15:00:00,8.9539,7.907,0.00019999999999997797
KHR-1,5/31/2025,03:10:00 pm,0,2025-05-31 15:10:00,8.9524,7.909,0.0001000000000000334
KHR-1,5/31/2025,03:20:00 pm,0,2025-05-31 15:20:00,8.951,7.91,9.999999999994457e-05
KHR-1,5/31/2025,03:30:00 pm,0,2025-05-31 15:30:00,8.9496,7.911,0.0005000000000000782
KHR-1,5/31/2025,03:40:00 pm,0,2025-05-31 15:40:00,8.9481,7.916,9.999999999994457e-05
KHR-1,5/31/2025,03:50:00 pm,0,2025-05-31 15:50:00,8.9463,7.917,0.00030000000000001136
KHR-1,5/31/2025,04:00:00 pm,0,2025-05-31 16:00:00,8.9449,7.92,0.00019999999999997797
KHR-1,5/31/2025,04:10:00 pm,0,2025-05-31 16:10:00,8.9438,7.918,0.00030000000000001136
KHR-1,5/31/2025,04:20:00 pm,0,2025-05-31 16:20:00,8.9421,7.921,0.00019999999999997797
KHR-1,5/31/2025,04:30:00 pm,0,2025-05-31 16:30:00,8.9416,7.923,0.0
KHR-1,5/31/2025,04:40:00 pm,0,2025-05-31 16:40:00,8.9402,7.923,0.00019999999999997797
KHR-1,5/31/2025,04:50:00 pm,0,2025-05-31 16:50:00,8.9396,7.925,0.0004999999999999894
KHR-1,5/31/2025,05:00:00 pm,0,2025-05-31 17:00:00,8.9377,7.93,0.0
KHR-1,5/31/2025,05:10:00 pm,0,2025-05-31 17:10:00,8.9375,7.93,9.999999999994457e-05
KHR-1,5/31/2025,05:20:00 pm,0,2025-05-31 17:20:00,8.9362,7.929,0.00039999999999995595
KHR-1,5/31/2025,05:30:00 pm,0,2025-05-31 17:30:00,8.9357,7.933,0.00019999999999997797
KHR-1,5/31/2025,05:40:00 pm,0,2025-05-31 17:40:00,8.9335,7.935,0.0
KHR-1,5/31/2025,05:50:00 pm,0,2025-05-31 17:50:00,8.9325,7.935,0.0002000000000000668
KHR-1,5/31/2025,06:00:00 pm,0,2025-05-31 18:00:00,8.931,7.937,0.0002000000000000668
KHR-1,5/31/2025,06:10:00 pm,0,2025-05-31 18:10:00,8.9297,7.935,0.00030000000000001136
KHR-1,5/31/2025,06:20:00 pm,0,2025-05-31 18:20:00,8.9294,7.938,0.0001000000000000334
KHR-1,5/31/2025,06:30:00 pm,0,2025-05-31 18:30:00,8.9283,7.939,0.00019999999999997797
KHR-1,5/31/2025,06:40:00 pm,0,2025-05-31 18:40:00,8.9274,7.941,0.00019999999999997797
KHR-1,5/31/2025,06:50:00 pm,0,2025-05-31 18:50:00,8.9269,7.939,0.00019999999999997797
KHR-1,5/31/2025,07:00:00 pm,0,2025-05-31 19:00:00,8.9266,7.941,9.999999999994457e-05
KHR-1,5/31/2025,07:10:00 pm,0,2025-05-31 19:10:00,8.927,7.94,0.0001000000000000334
KHR-1,5/31/2025,07:20:00 pm,0,2025-05-31 19:20:00,8.9269,7.939,0.0
KHR-1,5/31/2025,07:30:00 pm,0,2025-05-31 19:30:00,8.9273,7.939,0.00030000000000001136
KHR-1,5/31/2025,07:40:00 pm,0,2025-05-31 19:40:00,8.9277,7.936,0.00019999999999997797
KHR-1,5/31/2025,07:50:00 pm,0,2025-05-31 19:50:00,8.9275,7.934,0.0
KHR-1,5/31/2025,08:00:00 pm,0,2025-05-31 20:00:00,8.9277,7.934,0.00019999999999997797
KHR-1,5/31/2025,08:10:00 pm,0,2025-05-31 20:10:00,8.9278,7.932,0.0
KHR-1,5/31/2025,08:20:00 pm,0,2025-05-31 20:20:00,8.9276,7.932,0.0
KHR-1,5/31/2025,08:30:00 pm,0,2025-05-31 20:30:00,8.9278,7.932,0.0001000000000000334
KHR-1,5/31/2025,08:40:00 pm,0,2025-05-31 20:40:00,8.9282,7.931,0.0001000000000000334
KHR-1,5/31/2025,08:50:00 pm,0,2025-05-31 20:50:00,8.9286,7.932,0.0001000000000000334
KHR-1,5/31/2025,09:00:00 pm,0,2025-05-31 21:00:00,8.9293,7.931,0.0001000000000000334
KHR-1,5/31/2025,09:10:00 pm,0,2025-05-31 21:10:00,8.9301,7.932,0.00019999999999997797
KHR-1,5/31/2025,09:20:00 pm,0,2025-05-31 21:20:00,8.9306,7.934,0.0
KHR-1,5/31/2025,09:30:00 pm,0,2025-05-31 21:30:00,8.931,7.934,9.999999999994457e-05
KHR-1,5/31/2025,09:40:00 pm,0,2025-05-31 21:40:00,8.9318,7.935,0.0001000000000000334
KHR-1,5/31/2025,09:50:00 pm,0,2025-05-31 21:50:00,8.9323,7.936,0.0001000000000000334
KHR-1,5/31/2025,10:00:00 pm,0,2025-05-31 22:00:00,8.9326,7.937,0.00019999999999997797
KHR-1,5/31/2025,10:10:00 pm,0,2025-05-31 22:10:00,8.9325,7.939,0.0
KHR-1,5/31/2025,10:20:00 pm,0,2025-05-31 22:20:00,8.9324,7.939,0.0
KHR-1,5/31/2025,10:30:00 pm,0,2025-05-31 22:30:00,8.9326,7.939,0.00019999999999997797
KHR-1,5/31/2025,10:40:00 pm,0,2025-05-31 22:40:00,8.9335,7.941,9.999999999994457e-05
KHR-1,5/31/2025,10:50:00 pm,0,2025-05-31 22:50:00,8.9339,7.94,0.0004999999999999894
KHR-1,5/31/2025,11:00:00 pm,0,2025-05-31 23:00:00,8.9349,7.945,0.0001000000000000334
KHR-1,5/31/2025,11:10:00 pm,0,2025-05-31 23:10:00,8.9355,7.944,0.00019999999999997797
KHR-1,5/31/2025,11:20:00 pm,0,2025-05-31 23:20:00,8.9357,7.946,0.0002000000000000668
KHR-1,5/31/2025,11:30:00 pm,0,2025-05-31 23:30:00,8.9363,7.948,0.0001000000000000334
KHR-1,5/31/2025,11:40:00 pm,0,2025-05-31 23:40:00,8.9367,7.947,0.00030000000000001136
KHR-1,5/31/2025,11:50:00 pm,0,2025-05-31 23:50:00,8.937,7.95,0.0
KHR-1,6/1/2025,12:00:00 am,0,2025-06-01 00:00:00,8.9371,7.95,0.0
KHR-1,6/1/2025,12:10:00 am,0,2025-06-01 00:10:00,8.9369,7.95,0.00030000000000001136
KHR-1,6/1/2025,12:20:00 am,0,2025-06-01 00:20:00,8.9368,7.953,0.0001000000000000334
KHR-1,6/1/2025,12:30:00 am,0,2025-06-01 00:30:00,8.9361,7.952,0.00019999999999997797
KHR-1,6/1/2025,12:40:00 am,0,2025-06-01 00:40:00,8.9358,7.954,0.0001000000000000334
KHR-1,6/1/2025,12:50:00 am,0,2025-06-01 00:50:00,8.9352,7.955,0.0001000000000000334
KHR-1,6/1/2025,01:00:00 am,0,2025-06-01 01:00:00,8.9352,7.956,9.999999999994457e-05
KHR-1,6/1/2025,01:10:00 am,0,2025-06-01 01:10:00,8.9352,7.957,0.0001000000000000334
KHR-1,6/1/2025,01:20:00 am,0,2025-06-01 01:20:00,8.9353,7.958,0.00019999999999997797
KHR-1,6/1/2025,01:30:00 am,0,2025-06-01 01:30:00,8.9354,7.96,0.0001000000000000334
KHR-1,6/1/2025,01:40:00 am,0,2025-06-01 01:40:00,8.9357,7.959,0.0002000000000000668
KHR-1,6/1/2025,01:50:00 am,0,2025-06-01 01:50:00,8.9358,7.961,0.00019999999999997797
KHR-1,6/1/2025,02:00:00 am,0,2025-06-01 02:00:00,8.936,7.963,0.0
KHR-1,6/1/2025,02:10:00 am,0,2025-06-01 02:10:00,8.9361,7.963,0.00019999999999997797
KHR-1,6/1/2025,02:20:00 am,0,2025-06-01 02:20:00,8.9365,7.965,0.0001000000000000334
KHR-1,6/1/2025,02:30:00 am,0,2025-06-01 02:30:00,8.9372,7.966,9.999999999994457e-05
KHR-1,6/1/2025,02:40:00 am,0,2025-06-01 02:40:00,8.9373,7.967,0.0
KHR-1,6/1/2025,02:50:00 am,0,2025-06-01 02:50:00,8.9375,7.967,0.0002000000000000668
KHR-1,6/1/2025,03:00:00 am,0,2025-06-01 03:00:00,8.9376,7.969,0.0
KHR-1,6/1/2025,03:10:00 am,0,2025-06-01 03:10:00,8.9378,7.969,0.00019999999999997797
KHR-1,6/1/2025,03:20:00 am,0,2025-06-01 03:20:00,8.9378,7.971,0.00019999999999997797
KHR-1,6/1/2025,03:30:00 am,0,2025-06-01 03:30:00,8.9383,7.973,9.999999999994457e-05
KHR-1,6/1/2025,03:40:00 am,0,2025-06-01 03:40:00,8.9385,7.972,0.00029999999999992256
KHR-1,6/1/2025,03:50:00 am,0,2025-06-01 03:50:00,8.9387,7.975,0.0001000000000000334
KHR-1,6/1/2025,04:00:00 am,0,2025-06-01 04:00:00,8.939,7.976,0.0
KHR-1,6/1/2025,04:10:00 am,0,2025-06-01 04:10:00,8.9391,7.976,0.00019999999999997797
KHR-1,6/1/2025,04:20:00 am,0,2025-06-01 04:20:00,8.939,7.978,0.0001000000000000334
KHR-1,6/1/2025,04:30:00 am,0,2025-06-01 04:30:00,8.9392,7.979,0.0001000000000000334
KHR-1,6/1/2025,04:40:00 am,0,2025-06-01 04:40:00,8.9394,7.98,9.999999999994457e-05
KHR-1,6/1/2025,04:50:00 am,0,2025-06-01 04:50:00,8.9392,7.981,0.0001000000000000334
KHR-1,6/1/2025,05:00:00 am,0,2025-06-01 05:00:00,8.9395,7.982,9.999999999994457e-05
KHR-1,6/1/2025,05:10:00 am,0,2025-06-01 05:10:00,8.9399,7.983,0.0001000000000000334
KHR-1,6/1/2025,05:20:00 am,0,2025-06-01 05:20:00,8.9399,7.984,0.0001000000000000334
KHR-1,6/1/2025,05:30:00 am,0,2025-06-01 05:30:00,8.9401,7.985,9.999999999994457e-05
KHR-1,6/1/2025,05:40:00 am,0,2025-06-01 05:40:00,8.9402,7.986,0.0001000000000000334
KHR-1,6/1/2025,05:50:00 am,0,2025-06-01 05:50:00,8.9405,7.987,0.00030000000000001136
KHR-1,6/1/2025,06:00:00 am,0,2025-06-01 06:00:00,8.9406,7.99,0.0
KHR-1,6/1/2025,06:10:00 am,0,2025-06-01 06:10:00,8.9405,7.99,0.0
KHR-1,6/1/2025,06:20:00 am,0,2025-06-01 06:20:00,8.9404,7.99,0.00030000000000001136
KHR-1,6/1/2025,06:30:00 am,0,2025-06-01 06:30:00,8.9408,7.993,0.0001000000000000334
KHR-1,6/1/2025,06:40:00 am,0,2025-06-01 06:40:00,8.9414,7.992,0.00019999999999997797
KHR-1,6/1/2025,06:50:00 am,0,2025-06-01 06:50:00,8.9422,7.994,0.0001000000000000334
KHR-1,6/1/2025,07:00:00 am,0,2025-06-01 07:00:00,8.9431,7.995,0.0
KHR-1,6/1/2025,07:10:00 am,0,2025-06-01 07:10:00,8.9437,7.995,0.00030000000000001136
KHR-1,6/1/2025,07:20:00 am,0,2025-06-01 07:20:00,8.9436,7.998,0.0
KHR-1,6/1/2025,07:30:00 am,0,2025-06-01 07:30:00,8.9436,7.998,0.00019999999999997797
KHR-1,6/1/2025,07:40:00 am,0,2025-06-01 07:40:00,8.9434,8.0,9.999999999994457e-05
KHR-1,6/1/2025,07:50:00 am,0,2025-06-01 07:50:00,8.9432,8.001,0.00010000000000012221
KHR-1,6/1/2025,08:00:00 am,0,2025-06-01 08:00:00,8.943,8.002,0.00019999999999988915
KHR-1,6/1/2025,08:10:00 am,0,2025-06-01 08:10:00,8.9429,8.004,0.0
KHR-1,6/1/2025,08:20:00 am,0,2025-06-01 08:20:00,8.9428,8.004,0.0002000000000000668
KHR-1,6/1/2025,08:30:00 am,0,2025-06-01 08:30:00,8.9424,8.006,0.0
KHR-1,6/1/2025,08:40:00 am,0,2025-06-01 08:40:00,8.9426,8.006,0.00019999999999988915
KHR-1,6/1/2025,08:50:00 am,0,2025-06-01 08:50:00,8.9427,8.008,9.999999999994457e-05
KHR-1,6/1/2025,09:00:00 am,0,2025-06-01 09:00:00,8.9427,8.007,0.0002000000000000668
KHR-1,6/1/2025,09:10:00 am,0,2025-06-01 09:10:00,8.9426,8.009,0.0004999999999999005
KHR-1,6/1/2025,09:20:00 am,0,2025-06-01 09:20:00,8.9425,8.014,0.0
KHR-1,6/1/2025,09:30:00 am,0,2025-06-01 09:30:00,8.9427,8.014,0.0
KHR-1,6/1/2025,09:40:00 am,0,2025-06-01 09:40:00,8.9422,8.014,0.00010000000000012221
KHR-1,6/1/2025,09:50:00 am,0,2025-06-01 09:50:00,8.9412,8.015,0.00019999999999988915
KHR-1,6/1/2025,10:00:00 am,0,2025-06-01 10:00:00,8.941,8.017,0.0004000000000001336
KHR-1,6/1/2025,10:10:00 am,0,2025-06-01 10:10:00,8.9394,8.021,0.00019999999999988915
KHR-1,6/1/2025,10:20:00 am,0,2025-06-01 10:20:00,8.939,8.023,0.0002000000000000668
KHR-1,6/1/2025,10:30:00 am,0,2025-06-01 10:30:00,8.9381,8.025,0.00019999999999988915
KHR-1,6/1/2025,10:40:00 am,0,2025-06-01 10:40:00,8.937,8.027,0.0004000000000001336
KHR-1,6/1/2025,10:50:00 am,0,2025-06-01 10:50:00,8.9361,8.031,9.999999999994457e-05
KHR-1,6/1/2025,11:00:00 am,0,2025-06-01 11:00:00,8.9347,8.032,0.0
KHR-1,6/1/2025,11:10:00 am,0,2025-06-01 11:10:00,8.9334,8.032,0.0005000000000000782
KHR-1,6/1/2025,11:20:00 am,0,2025-06-01 11:20:00,8.9326,8.037,0.00039999999999995595
KHR-1,6/1/2025,11:30:00 am,0,2025-06-01 11:30:00,8.931,8.041,0.00010000000000012221
KHR-1,6/1/2025,11:40:00 am,0,2025-06-01 11:40:00,8.9303,8.04,9.999999999994457e-05
KHR-1,6/1/2025,11:50:00 am,0,2025-06-01 11:50:00,8.9272,8.039,0.0002000000000000668
KHR-1,6/1/2025,12:00:00 pm,0,2025-06-01 12:00:00,8.9259,8.041,0.0
KHR-1,6/1/2025,12:10:00 pm,0,2025-06-01 12:10:00,8.925,8.041,9.999999999994457e-05
KHR-1,6/1/2025,12:20:00 pm,0,2025-06-01 12:20:00,8.9237,8.042,9.999999999994457e-05
KHR-1,6/1/2025,12:30:00 pm,0,2025-06-01 12:30:00,8.9224,8.041,0.00019999999999988915
KHR-1,6/1/2025,12:40:00 pm,0,2025-06-01 12:40:00,8.9209,8.043,0.0
KHR-1,6/1/2025,12:50:00 pm,0,2025-06-01 12:50:00,8.9197,8.043,0.0
KHR-1,6/1/2025,01:00:00 pm,0,2025-06-01 13:00:00,8.918,8.043,0.0002000000000000668
KHR-1,6/1/2025,01:10:00 pm,0,2025-06-01 13:10:00,8.9167,8.045,9.999999999994457e-05
KHR-1,6/1/2025,01:20:00 pm,0,2025-06-01 13:20:00,8.9152,8.044,9.999999999994457e-05
KHR-1,6/1/2025,01:30:00 pm,0,2025-06-01 13:30:00,8.9134,8.045,0.00030000000000001136
KHR-1,6/1/2025,01:40:00 pm,0,2025-06-01 13:40:00,8.9121,8.048,9.999999999994457e-05
KHR-1,6/1/2025,01:50:00 pm,0,2025-06-01 13:50:00,8.9113,8.049,0.0
KHR-1,6/1/2025,02:00:00 pm,0,2025-06-01 14:00:00,8.9097,8.049,0.00030000000000001136
KHR-1,6/1/2025,02:10:00 pm,0,2025-06-01 14:10:00,8.9075,8.052,0.00039999999999995595
KHR-1,6/1/2025,02:20:00 pm,0,2025-06-01 14:20:00,8.9053,8.056,0.0002000000000000668
KHR-1,6/1/2025,02:30:00 pm,0,2025-06-01 14:30:00,8.9034,8.058,9.999999999994457e-05
KHR-1,6/1/2025,02:40:00 pm,0,2025-06-01 14:40:00,8.9023,8.057,0.00019999999999988915
KHR-1,6/1/2025,02:50:00 pm,0,2025-06-01 14:50:00,8.8999,8.059,0.00010000000000012221
KHR-1,6/1/2025,03:00:00 pm,0,2025-06-01 15:00:00,8.8976,8.06,0.00030000000000001136
KHR-1,6/1/2025,03:10:00 pm,0,2025-06-01 15:10:00,8.8962,8.063,9.999999999994457e-05
KHR-1,6/1/2025,03:20:00 pm,0,2025-06-01 15:20:00,8.8943,8.064,9.999999999994457e-05
KHR-1,6/1/2025,03:30:00 pm,0,2025-06-01 15:30:00,8.8933,8.063,0.00019999999999988915
KHR-1,6/1/2025,03:40:00 pm,0,2025-06-01 15:40:00,8.8904,8.065,0.00010000000000012221
KHR-1,6/1/2025,03:50:00 pm,0,2025-06-01 15:50:00,8.8886,8.066,0.00010000000000012221
KHR-1,6/1/2025,04:00:00 pm,0,2025-06-01 16:00:00,8.8866,8.065,0.0002000000000000668
KHR-1,6/1/2025,04:10:00 pm,0,2025-06-01 16:10:00,8.8854,8.067,0.0002000000000000668
KHR-1,6/1/2025,04:20:00 pm,0,2025-06-01 16:20:00,8.8849,8.069,0.0
KHR-1,6/1/2025,04:30:00 pm,0,2025-06-01 16:30:00,8.8833,8.069,0.00019999999999988915
KHR-1,6/1/2025,04:40:00 pm,0,2025-06-01 16:40:00,8.8824,8.071,9.999999999994457e-05
KHR-1,6/1/2025,04:50:00 pm,0,2025-06-01 16:50:00,8.8821,8.072,0.0002000000000000668
KHR-1,6/1/2025,05:00:00 pm,0,2025-06-01 17:00:00,8.8813,8.074,0.0
KHR-1,6/1/2025,05:10:00 pm,0,2025-06-01 17:10:00,8.8814,8.074,0.0
KHR-1,6/1/2025,05:20:00 pm,0,2025-06-01 17:20:00,8.88,8.074,9.999999999994457e-05
KHR-1,6/1/2025,05:30:00 pm,0,2025-06-01 17:30:00,8.8795,8.075,0.00030000000000001136
KHR-1,6/1/2025,05:40:00 pm,0,2025-06-01 17:40:00,8.879,8.078,0.0
KHR-1,6/1/2025,05:50:00 pm,0,2025-06-01 17:50:00,8.8788,8.078,0.00010000000000012221
KHR-1,6/1/2025,06:00:00 pm,0,2025-06-01 18:00:00,8.8785,8.079,9.999999999994457e-05
KHR-1,6/1/2025,06:10:00 pm,0,2025-06-01 18:10:00,8.8785,8.08,0.0002000000000000668
KHR-1,6/1/2025,06:20:00 pm,0,2025-06-01 18:20:00,8.8784,8.082,0.00030000000000001136
KHR-1,6/1/2025,06:30:00 pm,0,2025-06-01 18:30:00,8.8784,8.085,0.0
KHR-1,6/1/2025,06:40:00 pm,0,2025-06-01 18:40:00,8.8776,8.085,0.00019999999999988915
KHR-1,6/1/2025,06:50:00 pm,0,2025-06-01 18:50:00,8.8775,8.087,9.999999999994457e-05
KHR-1,6/1/2025,07:00:00 pm,0,2025-06-01 19:00:00,8.8773,8.086,0.00019999999999988915
KHR-1,6/1/2025,07:10:00 pm,0,2025-06-01 19:10:00,8.878,8.088,0.0
KHR-1,6/1/2025,07:20:00 pm,0,2025-06-01 19:20:00,8.8788,8.088,0.00019999999999988915
KHR-1,6/1/2025,07:30:00 pm,0,2025-06-01 19:30:00,8.8792,8.086,9.999999999994457e-05
KHR-1,6/1/2025,07:40:00 pm,0,2025-06-01 19:40:00,8.8801,8.085,0.0
KHR-1,6/1/2025,07:50:00 pm,0,2025-06-01 19:50:00,8.8813,8.085,9.999999999994457e-05
KHR-1,6/1/2025,08:00:00 pm,0,2025-06-01 20:00:00,8.8825,8.086,0.0
KHR-1,6/1/2025,08:10:00 pm,0,2025-06-01 20:10:00,8.8834,8.086,9.999999999994457e-05
KHR-1,6/1/2025,08:20:00 pm,0,2025-06-01 20:20:00,8.8839,8.085,0.0002999999999998337
KHR-1,6/1/2025,08:30:00 pm,0,2025-06-01 20:30:00,8.8848,8.088,9.999999999994457e-05
KHR-1,6/1/2025,08:40:00 pm,0,2025-06-01 20:40:00,8.8851,8.087,0.0002000000000000668
KHR-1,6/1/2025,08:50:00 pm,0,2025-06-01 20:50:00,8.8861,8.089,0.00030000000000001136
KHR-1,6/1/2025,09:00:00 pm,0,2025-06-01 21:00:00,8.8878,8.092,0.0
KHR-1,6/1/2025,09:10:00 pm,0,2025-06-01 21:10:00,8.8905,8.092,0.0002000000000000668
KHR-1,6/1/2025,09:20:00 pm,0,2025-06-01 21:20:00,8.8928,8.09,0.0002000000000000668
KHR-1,6/1/2025,09:30:00 pm,0,2025-06-01 21:30:00,8.8945,8.092,0.00030000000000001136
KHR-1,6/1/2025,09:40:00 pm,0,2025-06-01 21:40:00,8.8961,8.095,0.0
KHR-1,6/1/2025,09:50:00 pm,0,2025-06-01 21:50:00,8.8982,8.095,0.00030000000000001136
KHR-1,6/1/2025,10:00:00 pm,0,2025-06-01 22:00:00,8.9003,8.098,0.00010000000000012221
KHR-1,6/1/2025,10:10:00 pm,0,2025-06-01 22:10:00,8.9026,8.097,0.0
KHR-1,6/1/2025,10:20:00 pm,0,2025-06-01 22:20:00,8.9044,8.097,0.0002000000000000668
KHR-1,6/1/2025,10:30:00 pm,0,2025-06-01 22:30:00,8.9055,8.099,0.00030000000000001136
KHR-1,6/1/2025,10:40:00 pm,0,2025-06-01 22:40:00,8.9067,8.102,9.999999999994457e-05
KHR-1,6/1/2025,10:50:00 pm,0,2025-06-01 22:50:00,8.9073,8.103,0.0
KHR-1,6/1/2025,11:00:00 pm,0,2025-06-01 23:00:00,8.9074,8.103,9.999999999994457e-05
KHR-1,6/1/2025,11:10:00 pm,0,2025-06-01 23:10:00,8.9071,8.104,0.0002000000000000668
KHR-1,6/1/2025,11:20:00 pm,0,2025-06-01 23:20:00,8.9067,8.106,9.999999999994457e-05
KHR-1,6/1/2025,11:30:00 pm,0,2025-06-01 23:30:00,8.9065,8.105,9.999999999994457e-05
KHR-1,6/1/2025,11:40:00 pm,0,2025-06-01 23:40:00,8.9081,8.106,0.0002000000000000668
KHR-1,6/1/2025,11:50:00 pm,0,2025-06-01 23:50:00,8.9108,8.108,0.00019999999999988915
KHR-1,6/2/2025,12:00:00 am,0,2025-06-02 00:00:00,8.9112,8.11,0.00019999999999988915
KHR-1,6/2/2025,12:10:00 am,0,2025-06-02 00:10:00,8.9116,8.108,9.999999999994457e-05
KHR-1,6/2/2025,12:20:00 am,0,2025-06-02 00:20:00,8.9122,8.109,0.0002000000000000668
KHR-1,6/2/2025,12:30:00 am,0,2025-06-02 00:30:00,8.9134,8.111,0.00019999999999988915
KHR-1,6/2/2025,12:40:00 am,0,2025-06-02 00:40:00,8.9144,8.113,0.00010000000000012221
KHR-1,6/2/2025,12:50:00 am,0,2025-06-02 00:50:00,8.9144,8.114,0.0
KHR-1,6/2/2025,01:00:00 am,0,2025-06-02 01:00:00,8.9148,8.114,0.00019999999999988915
KHR-1,6/2/2025,01:10:00 am,0,2025-06-02 01:10:00,8.9166,8.116,0.00030000000000001136
KHR-1,6/2/2025,01:20:00 am,0,2025-06-02 01:20:00,8.9172,8.119,9.999999999994457e-05
KHR-1,6/2/2025,01:30:00 am,0,2025-06-02 01:30:00,8.9181,8.118,0.0
KHR-1,6/2/2025,01:40:00 am,0,2025-06-02 01:40:00,8.918,8.118,0.00019999999999988915
KHR-1,6/2/2025,01:50:00 am,0,2025-06-02 01:50:00,8.9184,8.12,0.0
KHR-1,6/2/2025,02:00:00 am,0,2025-06-02 02:00:00,8.9197,8.12,0.0002000000000000668
KHR-1,6/2/2025,02:10:00 am,0,2025-06-02 02:10:00,8.9198,8.122,0.00030000000000001136
KHR-1,6/2/2025,02:20:00 am,0,2025-06-02 02:20:00,8.9205,8.125,9.999999999994457e-05
KHR-1,6/2/2025,02:30:00 am,0,2025-06-02 02:30:00,8.921,8.126,0.0
KHR-1,6/2/2025,02:40:00 am,0,2025-06-02 02:40:00,8.9217,8.126,0.00010000000000012221
KHR-1,6/2/2025,02:50:00 am,0,2025-06-02 02:50:00,8.923,8.127,9.999999999994457e-05
KHR-1,6/2/2025,03:00:00 am,0,2025-06-02 03:00:00,8.9235,8.128,0.0
KHR-1,6/2/2025,03:10:00 am,0,2025-06-02 03:10:00,8.9245,8.128,0.0002000000000000668
KHR-1,6/2/2025,03:20:00 am,0,2025-06-02 03:20:00,8.9253,8.13,0.00019999999999988915
KHR-1,6/2/2025,03:30:00 am,0,2025-06-02 03:30:00,8.9261,8.132,0.0
KHR-1,6/2/2025,03:40:00 am,0,2025-06-02 03:40:00,8.9271,8.132,0.0002000000000000668
KHR-1,6/2/2025,03:50:00 am,0,2025-06-02 03:50:00,8.9285,8.134,9.999999999994457e-05
KHR-1,6/2/2025,04:00:00 am,0,2025-06-02 04:00:00,8.9301,8.135,9.999999999994457e-05
KHR-1,6/2/2025,04:10:00 am,0,2025-06-02 04:10:00,8.9308,8.136,9.999999999994457e-05
KHR-1,6/2/2025,04:20:00 am,0,2025-06-02 04:20:00,8.9316,8.135,0.00039999999999995595
KHR-1,6/2/2025,04:30:00 am,0,2025-06-02 04:30:00,8.9329,8.139,0.0
KHR-1,6/2/2025,04:40:00 am,0,2025-06-02 04:40:00,8.9345,8.139,0.0
KHR-1,6/2/2025,04:50:00 am,0,2025-06-02 04:50:00,8.9358,8.139,0.00030000000000001136
KHR-1,6/2/2025,05:00:00 am,0,2025-06-02 05:00:00,8.9365,8.142,0.00010000000000012221
KHR-1,6/2/2025,05:10:00 am,0,2025-06-02 05:10:00,8.9375,8.143,9.999999999994457e-05
KHR-1,6/2/2025,05:20:00 am,0,2025-06-02 05:20:00,8.939,8.144,0.0002000000000000668
KHR-1,6/2/2025,05:30:00 am,0,2025-06-02 05:30:00,8.9407,8.142,0.00030000000000001136
KHR-1,6/2/2025,05:40:00 am,0,2025-06-02 05:40:00,8.9422,8.145,0.0
KHR-1,6/2/2025,05:50:00 am,0,2025-06-02 05:50:00,8.9436,8.145,0.0002000000000000668
KHR-1,6/2/2025,06:00:00 am,0,2025-06-02 06:00:00,8.9447,8.147,0.00019999999999988915
KHR-1,6/2/2025,06:10:00 am,0,2025-06-02 06:10:00,8.9452,8.149,0.0
KHR-1,6/2/2025,06:20:00 am,0,2025-06-02 06:20:00,8.9463,8.149,0.00010000000000012221
KHR-1,6/2/2025,06:30:00 am,0,2025-06-02 06:30:00,8.9475,8.15,0.00019999999999988915
KHR-1,6/2/2025,06:40:00 am,0,2025-06-02 06:40:00,8.9495,8.152,0.00010000000000012221
KHR-1,6/2/2025,06:50:00 am,0,2025-06-02 06:50:00,8.9504,8.153,0.00010000000000012221
KHR-1,6/2/2025,07:00:00 am,0,2025-06-02 07:00:00,8.9513,8.152,0.0002000000000000668
KHR-1,6/2/2025,07:10:00 am,0,2025-06-02 07:10:00,8.9521,8.154,9.999999999994457e-05
KHR-1,6/2/2025,07:20:00 am,0,2025-06-02 07:20:00,8.9531,8.155,0.00010000000000012221
KHR-1,6/2/2025,07:30:00 am,0,2025-06-02 07:30:00,8.954,8.156,0.00019999999999988915
KHR-1,6/2/2025,07:40:00 am,0,2025-06-02 07:40:00,8.9539,8.158,0.0
KHR-1,6/2/2025,07:50:00 am,0,2025-06-02 07:50:00,8.9548,8.158,0.00010000000000012221
KHR-1,6/2/2025,08:00:00 am,0,2025-06-02 08:00:00,8.956,8.159,0.00019999999999988915
KHR-1,6/2/2025,08:10:00 am,0,2025-06-02 08:10:00,8.9561,8.161,0.00030000000000001136
KHR-1,6/2/2025,08:20:00 am,0,2025-06-02 08:20:00,8.9572,8.164,0.00019999999999988915
KHR-1,6/2/2025,08:30:00 am,0,2025-06-02 08:30:00,8.9582,8.162,9.999999999994457e-05
KHR-1,6/2/2025,08:40:00 am,0,2025-06-02 08:40:00,8.9596,8.163,0.00039999999999995595
KHR-1,6/2/2025,08:50:00 am,0,2025-06-02 08:50:00,8.9603,8.167,9.999999999994457e-05
KHR-1,6/2/2025,09:00:00 am,0,2025-06-02 09:00:00,8.9604,8.166,0.0
KHR-1,6/2/2025,09:10:00 am,0,2025-06-02 09:10:00,8.9601,8.166,0.00030000000000001136
KHR-1,6/2/2025,09:20:00 am,0,2025-06-02 09:20:00,8.9602,8.169,0.00019999999999988915
KHR-1,6/2/2025,09:30:00 am,0,2025-06-02 09:30:00,8.9603,8.171,0.00010000000000012221
KHR-1,6/2/2025,09:40:00 am,0,2025-06-02 09:40:00,8.9608,8.172,0.00019999999999988915
KHR-1,6/2/2025,09:50:00 am,0,2025-06-02 09:50:00,8.9607,8.174,0.00010000000000012221
KHR-1,6/2/2025,10:00:00 am,0,2025-06-02 10:00:00,8.9601,8.175,0.00030000000000001136
KHR-1,6/2/2025,10:10:00 am,0,2025-06-02 10:10:00,8.9599,8.178,0.0002999999999998337
KHR-1,6/2/2025,10:20:00 am,0,2025-06-02 10:20:00,8.9593,8.181,0.0002000000000000668
KHR-1,6/2/2025,10:30:00 am,0,2025-06-02 10:30:00,8.9579,8.183,0.0002000000000000668
KHR-1,6/2/2025,10:40:00 am,0,2025-06-02 10:40:00,8.9574,8.185,0.00019999999999988915
KHR-1,6/2/2025,10:50:00 am,0,2025-06-02 10:50:00,8.9564,8.187,0.0002000000000000668
KHR-1,6/2/2025,11:00:00 am,0,2025-06-02 11:00:00,8.9553,8.189,0.0002000000000000668
KHR-1,6/2/2025,11:10:00 am,0,2025-06-02 11:10:00,8.9544,8.191,0.00030000000000001136
KHR-1,6/2/2025,11:20:00 am,0,2025-06-02 11:20:00,8.9536,8.194,0.00019999999999988915
KHR-1,6/2/2025,11:30:00 am,0,2025-06-02 11:30:00,8.9525,8.196,9.999999999994457e-05
KHR-1,6/2/2025,11:40:00 am,0,2025-06-02 11:40:00,8.9515,8.197,0.00010000000000012221
KHR-1,6/2/2025,11:50:00 am,0,2025-06-02 11:50:00,8.9502,8.198,0.00030000000000001136
KHR-1,6/2/2025,12:00:00 pm,0,2025-06-02 12:00:00,8.9487,8.201,9.999999999994457e-05
KHR-1,6/2/2025,12:10:00 pm,0,2025-06-02 12:10:00,8.9473,8.202,0.0002000000000000668
KHR-1,6/2/2025,12:20:00 pm,0,2025-06-02 12:20:00,8.9459,8.204,0.0
KHR-1,6/2/2025,12:30:00 pm,0,2025-06-02 12:30:00,8.9438,8.204,9.999999999994457e-05
KHR-1,6/2/2025,12:40:00 pm,0,2025-06-02 12:40:00,8.9419,8.205,9.999999999994457e-05
KHR-1,6/2/2025,12:50:00 pm,0,2025-06-02 12:50:00,8.9404,8.206,0.0002000000000000668
KHR-1,6/2/2025,01:00:00 pm,0,2025-06-02 13:00:00,8.9384,8.208,9.999999999994457e-05
KHR-1,6/2/2025,01:10:00 pm,0,2025-06-02 13:10:00,8.9359,8.209,0.0
KHR-1,6/2/2025,01:20:00 pm,0,2025-06-02 13:20:00,8.9335,8.209,0.00030000000000001136
KHR-1,6/2/2025,01:30:00 pm,0,2025-06-02 13:30:00,8.9318,8.212,0.0
KHR-1,6/2/2025,01:40:00 pm,0,2025-06-02 13:40:00,8.9299,8.212,0.0
KHR-1,6/2/2025,01:50:00 pm,0,2025-06-02 13:50:00,8.9276,8.212,9.999999999994457e-05
KHR-1,6/2/2025,02:00:00 pm,0,2025-06-02 14:00:00,8.9257,8.211,0.00019999999999988915
KHR-1,6/2/2025,02:10:00 pm,0,2025-06-02 14:10:00,8.9235,8.213,0.0002000000000000668
KHR-1,6/2/2025,02:20:00 pm,0,2025-06-02 14:20:00,8.9214,8.215,9.999999999994457e-05
KHR-1,6/2/2025,02:30:00 pm,0,2025-06-02 14:30:00,8.9193,8.216,0.0
KHR-1,6/2/2025,02:40:00 pm,0,2025-06-02 14:40:00,8.9169,8.216,0.00010000000000012221
KHR-1,6/2/2025,02:50:00 pm,0,2025-06-02 14:50:00,8.9153,8.217,0.00019999999999988915
KHR-1,6/2/2025,03:00:00 pm,0,2025-06-02 15:00:00,8.9136,8.219,0.0
KHR-1,6/2/2025,03:10:00 pm,0,2025-06-02 15:10:00,8.9117,8.219,0.0
KHR-1,6/2/2025,03:20:00 pm,0,2025-06-02 15:20:00,8.91,8.219,0.0002000000000000668
KHR-1,6/2/2025,03:30:00 pm,0,2025-06-02 15:30:00,8.9087,8.221,0.0
KHR-1,6/2/2025,03:40:00 pm,0,2025-06-02 15:40:00,8.9072,8.221,0.0002000000000000668
KHR-1,6/2/2025,03:50:00 pm,0,2025-06-02 15:50:00,8.9062,8.223,0.0
KHR-1,6/2/2025,04:00:00 pm,0,2025-06-02 16:00:00,8.905,8.223,0.0002000000000000668
KHR-1,6/2/2025,04:10:00 pm,0,2025-06-02 16:10:00,8.9044,8.221,0.00039999999999995595
KHR-1,6/2/2025,04:20:00 pm,0,2025-06-02 16:20:00,8.9033,8.225,0.0
KHR-1,6/2/2025,04:30:00 pm,0,2025-06-02 16:30:00,8.9019,8.225,0.0
KHR-1,6/2/2025,04:40:00 pm,0,2025-06-02 16:40:00,8.9013,8.225,0.00019999999999988915
KHR-1,6/2/2025,04:50:00 pm,0,2025-06-02 16:50:00,8.9016,8.223,0.00030000000000001136
KHR-1,6/2/2025,05:00:00 pm,0,2025-06-02 17:00:00,8.9008,8.226,0.0002000000000000668
KHR-1,6/2/2025,05:10:00 pm,0,2025-06-02 17:10:00,8.8997,8.224,0.0002000000000000668
KHR-1,6/2/2025,05:20:00 pm,0,2025-06-02 17:20:00,8.8989,8.226,0.00019999999999988915
KHR-1,6/2/2025,05:30:00 pm,0,2025-06-02 17:30:00,8.8983,8.228,0.0
KHR-1,6/2/2025,05:40:00 pm,0,2025-06-02 17:40:00,8.8985,8.228,0.0
KHR-1,6/2/2025,05:50:00 pm,0,2025-06-02 17:50:00,8.8975,8.228,9.999999999994457e-05
KHR-1,6/2/2025,06:00:00 pm,0,2025-06-02 18:00:00,8.8973,8.229,0.0002000000000000668
KHR-1,6/2/2025,06:10:00 pm,0,2025-06-02 18:10:00,8.897,8.231,0.0002000000000000668
KHR-1,6/2/2025,06:20:00 pm,0,2025-06-02 18:20:00,8.8966,8.233,0.00010000000000012221
KHR-1,6/2/2025,06:30:00 pm,0,2025-06-02 18:30:00,8.8966,8.232,0.00010000000000012221
KHR-1,6/2/2025,06:40:00 pm,0,2025-06-02 18:40:00,8.8969,8.233,0.0
KHR-1,6/2/2025,06:50:00 pm,0,2025-06-02 18:50:00,8.8967,8.233,0.00010000000000012221
KHR-1,6/2/2025,07:00:00 pm,0,2025-06-02 19:00:00,8.8974,8.232,0.00030000000000001136
KHR-1,6/2/2025,07:10:00 pm,0,2025-06-02 19:10:00,8.8971,8.235,9.999999999994457e-05
KHR-1,6/2/2025,07:20:00 pm,0,2025-06-02 19:20:00,8.8973,8.234,0.0
KHR-1,6/2/2025,07:30:00 pm,0,2025-06-02 19:30:00,8.8978,8.234,0.0
KHR-1,6/2/2025,07:40:00 pm,0,2025-06-02 19:40:00,8.8985,8.234,9.999999999994457e-05
KHR-1,6/2/2025,07:50:00 pm,0,2025-06-02 19:50:00,8.8986,8.235,0.0002000000000000668
KHR-1,6/2/2025,08:00:00 pm,0,2025-06-02 20:00:00,8.8991,8.237,0.0
KHR-1,6/2/2025,08:10:00 pm,0,2025-06-02 20:10:00,8.8995,8.237,0.0
KHR-1,6/2/2025,08:20:00 pm,0,2025-06-02 20:20:00,8.9,8.237,0.0
KHR-1,6/2/2025,08:30:00 pm,0,2025-06-02 20:30:00,8.9004,8.237,0.00030000000000001136
KHR-1,6/2/2025,08:40:00 pm,0,2025-06-02 20:40:00,8.9014,8.24,0.0
KHR-1,6/2/2025,08:50:00 pm,0,2025-06-02 20:50:00,8.9021,8.24,9.999999999994457e-05
KHR-1,6/2/2025,09:00:00 pm,0,2025-06-02 21:00:00,8.9027,8.241,0.0
KHR-1,6/2/2025,09:10:00 pm,0,2025-06-02 21:10:00,8.9039,8.241,0.0002000000000000668
KHR-1,6/2/2025,09:20:00 pm,0,2025-06-02 21:20:00,8.9054,8.243,0.0
KHR-1,6/2/2025,09:30:00 pm,0,2025-06-02 21:30:00,8.9067,8.243,0.00019999999999988915
KHR-1,6/2/2025,09:40:00 pm,0,2025-06-02 21:40:00,8.9083,8.245,0.0
KHR-1,6/2/2025,09:50:00 pm,0,2025-06-02 21:50:00,8.9097,8.245,0.0002000000000000668
KHR-1,6/2/2025,10:00:00 pm,0,2025-06-02 22:00:00,8.9108,8.247,0.0
KHR-1,6/2/2025,10:10:00 pm,0,2025-06-02 22:10:00,8.9118,8.247,9.999999999994457e-05
KHR-1,6/2/2025,10:20:00 pm,0,2025-06-02 22:20:00,8.913,8.248,0.0002000000000000668
KHR-1,6/2/2025,10:30:00 pm,0,2025-06-02 22:30:00,8.9148,8.25,0.0
KHR-1,6/2/2025,10:40:00 pm,0,2025-06-02 22:40:00,8.9158,8.25,9.999999999994457e-05
KHR-1,6/2/2025,10:50:00 pm,0,2025-06-02 22:50:00,8.9173,8.251,0.0002000000000000668
KHR-1,6/2/2025,11:00:00 pm,0,2025-06-02 23:00:00,8.9182,8.253,0.0002000000000000668
KHR-1,6/2/2025,11:10:00 pm,0,2025-06-02 23:10:00,8.9196,8.251,0.00030000000000001136
KHR-1,6/2/2025,11:20:00 pm,0,2025-06-02 23:20:00,8.9201,8.254,0.00010000000000012221
KHR-1,6/2/2025,11:30:00 pm,0,2025-06-02 23:30:00,8.9204,8.255,0.0
KHR-1,6/2/2025,11:40:00 pm,0,2025-06-02 23:40:00,8.9209,8.255,0.0
KHR-1,6/2/2025,11:50:00 pm,0,2025-06-02 23:50:00,8.9214,8.255,0.00019999999999988915
KHR-1,6/3/2025,12:00:00 am,0,2025-06-03 00:00:00,8.9221,8.257,0.0
KHR-1,6/3/2025,12:10:00 am,0,2025-06-03 00:10:00,8.9228,8.257,9.999999999994457e-05
KHR-1,6/3/2025,12:20:00 am,0,2025-06-03 00:20:00,8.9238,8.258,0.0002000000000000668
KHR-1,6/3/2025,12:30:00 am,0,2025-06-03 00:30:00,8.9245,8.26,9.999999999994457e-05
KHR-1,6/3/2025,12:40:00 am,0,2025-06-03 00:40:00,8.9246,8.261,0.00010000000000012221
KHR-1,6/3/2025,12:50:00 am,0,2025-06-03 00:50:00,8.9248,8.262,0.00010000000000012221
KHR-1,6/3/2025,01:00:00 am,0,2025-06-03 01:00:00,8.925,8.261,0.00010000000000012221
KHR-1,6/3/2025,01:10:00 am,0,2025-06-03 01:10:00,8.9251,8.262,0.00030000000000001136
KHR-1,6/3/2025,01:20:00 am,0,2025-06-03 01:20:00,8.9258,8.265,9.999999999994457e-05
KHR-1,6/3/2025,01:30:00 am,0,2025-06-03 01:30:00,8.926,8.266,9.999999999994457e-05
KHR-1,6/3/2025,01:40:00 am,0,2025-06-03 01:40:00,8.9265,8.267,0.0
KHR-1,6/3/2025,01:50:00 am,0,2025-06-03 01:50:00,8.9265,8.267,0.0002000000000000668
KHR-1,6/3/2025,02:00:00 am,0,2025-06-03 02:00:00,8.9268,8.269,0.0
KHR-1,6/3/2025,02:10:00 am,0,2025-06-03 02:10:00,8.9273,8.269,9.999999999994457e-05
KHR-1,6/3/2025,02:20:00 am,0,2025-06-03 02:20:00,8.9275,8.27,0.00030000000000001136
KHR-1,6/3/2025,02:30:00 am,0,2025-06-03 02:30:00,8.9286,8.273,0.00019999999999988915
KHR-1,6/3/2025,02:40:00 am,0,2025-06-03 02:40:00,8.9294,8.271,0.0
KHR-1,6/3/2025,02:50:00 am,0,2025-06-03 02:50:00,8.9303,8.271,0.00019999999999988915
KHR-1,6/3/2025,03:00:00 am,0,2025-06-03 03:00:00,8.9309,8.273,0.00030000000000001136
KHR-1,6/3/2025,03:10:00 am,0,2025-06-03 03:10:00,8.9316,8.276,9.999999999994457e-05
KHR-1,6/3/2025,03:20:00 am,0,2025-06-03 03:20:00,8.9315,8.275,9.999999999994457e-05
KHR-1,6/3/2025,03:30:00 am,0,2025-06-03 03:30:00,8.9325,8.276,9.999999999994457e-05
KHR-1,6/3/2025,03:40:00 am,0,2025-06-03 03:40:00,8.933,8.277,0.00030000000000001136
KHR-1,6/3/2025,03:50:00 am,0,2025-06-03 03:50:00,8.9332,8.28,0.0
KHR-1,6/3/2025,04:00:00 am,0,2025-06-03 04:00:00,8.9338,8.28,9.999999999994457e-05
KHR-1,6/3/2025,04:10:00 am,0,2025-06-03 04:10:00,8.9343,8.279,0.0002000000000000668
KHR-1,6/3/2025,04:20:00 am,0,2025-06-03 04:20:00,8.9352,8.281,0.0
KHR-1,6/3/2025,04:30:00 am,0,2025-06-03 04:30:00,8.9358,8.281,0.0
KHR-1,6/3/2025,04:40:00 am,0,2025-06-03 04:40:00,8.9371,8.281,0.00019999999999988915
KHR-1,6/3/2025,04:50:00 am,0,2025-06-03 04:50:00,8.9373,8.283,0.0002000000000000668
KHR-1,6/3/2025,05:00:00 am,0,2025-06-03 05:00:00,8.9378,8.285,9.999999999994457e-05
KHR-1,6/3/2025,05:10:00 am,0,2025-06-03 05:10:00,8.9385,8.284,0.00019999999999988915
KHR-1,6/3/2025,05:20:00 am,0,2025-06-03 05:20:00,8.9392,8.286,0.0002000000000000668
KHR-1,6/3/2025,05:30:00 am,0,2025-06-03 05:30:00,8.9397,8.288,0.0
KHR-1,6/3/2025,05:40:00 am,0,2025-06-03 05:40:00,8.9401,8.288,0.00030000000000001136
KHR-1,6/3/2025,05:50:00 am,0,2025-06-03 05:50:00,8.9407,8.291,0.00010000000000012221
KHR-1,6/3/2025,06:00:00 am,0,2025-06-03 06:00:00,8.9411,8.29,0.0
KHR-1,6/3/2025,06:10:00 am,0,2025-06-03 06:10:00,8.9422,8.29,0.0
KHR-1,6/3/2025,06:20:00 am,0,2025-06-03 06:20:00,8.9434,8.29,0.0002000000000000668
KHR-1,6/3/2025,06:30:00 am,0,2025-06-03 06:30:00,8.9444,8.292,0.0
KHR-1,6/3/2025,06:40:00 am,0,2025-06-03 06:40:00,8.9446,8.292,0.0002000000000000668
KHR-1,6/3/2025,06:50:00 am,0,2025-06-03 06:50:00,8.9454,8.294,9.999999999994457e-05
KHR-1,6/3/2025,07:00:00 am,0,2025-06-03 07:00:00,8.9455,8.295,0.0
KHR-1,6/3/2025,07:10:00 am,0,2025-06-03 07:10:00,8.9462,8.295,9.999999999994457e-05
KHR-1,6/3/2025,07:20:00 am,0,2025-06-03 07:20:00,8.947,8.296,0.00030000000000001136
KHR-1,6/3/2025,07:30:00 am,0,2025-06-03 07:30:00,8.9471,8.299,0.00019999999999988915
KHR-1,6/3/2025,07:40:00 am,0,2025-06-03 07:40:00,8.9477,8.297,9.999999999994457e-05
KHR-1,6/3/2025,07:50:00 am,0,2025-06-03 07:50:00,8.948,8.298,0.0002000000000000668
KHR-1,6/3/2025,08:00:00 am,0,2025-06-03 08:00:00,8.9486,8.3,9.999999999994457e-05
KHR-1,6/3/2025,08:10:00 am,0,2025-06-03 08:10:00,8.9492,8.301,0.0
KHR-1,6/3/2025,08:20:00 am,0,2025-06-03 08:20:00,8.9498,8.301,0.0002000000000000668
KHR-1,6/3/2025,08:30:00 am,0,2025-06-03 08:30:00,8.9505,8.303,9.999999999994457e-05
KHR-1,6/3/2025,08:40:00 am,0,2025-06-03 08:40:00,8.951,8.304,0.0
KHR-1,6/3/2025,08:50:00 am,0,2025-06-03 08:50:00,8.9515,8.304,0.00019999999999988915
KHR-1,6/3/2025,09:00:00 am,0,2025-06-03 09:00:00,8.9526,8.306,0.00010000000000012221
KHR-1,6/3/2025,09:10:00 am,0,2025-06-03 09:10:00,8.9531,8.307,0.00019999999999988915
KHR-1,6/3/2025,09:20:00 am,0,2025-06-03 09:20:00,8.9538,8.309,9.999999999994457e-05
KHR-1,6/3/2025,09:30:00 am,0,2025-06-03 09:30:00,8.9543,8.308,0.00039999999999995595
KHR-1,6/3/2025,09:40:00 am,0,2025-06-03 09:40:00,8.9552,8.312,0.0
KHR-1,6/3/2025,09:50:00 am,0,2025-06-03 09:50:00,8.9557,8.312,0.00010000000000012221
KHR-1,6/3/2025,10:00:00 am,0,2025-06-03 10:00:00,8.9551,8.313,0.00019999999999988915
KHR-1,6/3/2025,10:10:00 am,0,2025-06-03 10:10:00,8.9541,8.315,0.00030000000000001136
KHR-1,6/3/2025,10:20:00 am,0,2025-06-03 10:20:00,8.9529,8.318,0.00039999999999995595
KHR-1,6/3/2025,10:30:00 am,0,2025-06-03 10:30:00,8.9521,8.322,0.00010000000000012221
KHR-1,6/3/2025,10:40:00 am,0,2025-06-03 10:40:00,8.9508,8.323,9.999999999994457e-05
KHR-1,6/3/2025,10:50:00 am,0,2025-06-03 10:50:00,8.9498,8.324,0.0005000000000000782
KHR-1,6/3/2025,11:00:00 am,0,2025-06-03 11:00:00,8.9484,8.329,0.00010000000000012221
KHR-1,6/3/2025,11:10:00 am,0,2025-06-03 11:10:00,8.9468,8.328,0.0005000000000000782
KHR-1,6/3/2025,11:20:00 am,0,2025-06-03 11:20:00,8.9453,8.333,9.999999999994457e-05
KHR-1,6/3/2025,11:30:00 am,0,2025-06-03 11:30:00,8.9441,8.332,9.999999999994457e-05
KHR-1,6/3/2025,11:40:00 am,0,2025-06-03 11:40:00,8.9427,8.333,0.00030000000000001136
KHR-1,6/3/2025,11:50:00 am,0,2025-06-03 11:50:00,8.9412,8.336,0.00019999999999988915
KHR-1,6/3/2025,12:00:00 pm,0,2025-06-03 12:00:00,8.94,8.338,0.0
KHR-1,6/3/2025,12:10:00 pm,0,2025-06-03 12:10:00,8.938,8.338,0.00010000000000012221
KHR-1,6/3/2025,12:20:00 pm,0,2025-06-03 12:20:00,8.9357,8.339,0.00019999999999988915
KHR-1,6/3/2025,12:30:00 pm,0,2025-06-03 12:30:00,8.9338,8.341,0.00019999999999988915
KHR-1,6/3/2025,12:40:00 pm,0,2025-06-03 12:40:00,8.9316,8.339,0.00030000000000001136
KHR-1,6/3/2025,12:50:00 pm,0,2025-06-03 12:50:00,8.9294,8.342,0.00010000000000012221
KHR-1,6/3/2025,01:00:00 pm,0,2025-06-03 13:00:00,8.9277,8.341,0.0
KHR-1,6/3/2025,01:10:00 pm,0,2025-06-03 13:10:00,8.9254,8.341,0.00010000000000012221
KHR-1,6/3/2025,01:20:00 pm,0,2025-06-03 13:20:00,8.9232,8.342,9.999999999994457e-05
KHR-1,6/3/2025,01:30:00 pm,0,2025-06-03 13:30:00,8.9219,8.343,0.0
KHR-1,6/3/2025,01:40:00 pm,0,2025-06-03 13:40:00,8.9194,8.343,0.0002000000000000668
KHR-1,6/3/2025,01:50:00 pm,0,2025-06-03 13:50:00,8.9172,8.345,0.0
KHR-1,6/3/2025,02:00:00 pm,0,2025-06-03 14:00:00,8.9149,8.345,0.0
KHR-1,6/3/2025,02:10:00 pm,0,2025-06-03 14:10:00,8.9122,8.345,9.999999999994457e-05
KHR-1,6/3/2025,02:20:00 pm,0,2025-06-03 14:20:00,8.9106,8.346,9.999999999994457e-05
KHR-1,6/3/2025,02:30:00 pm,0,2025-06-03 14:30:00,8.9085,8.347,0.00019999999999988915
KHR-1,6/3/2025,02:40:00 pm,0,2025-06-03 14:40:00,8.9068,8.345,0.00030000000000001136
KHR-1,6/3/2025,02:50:00 pm,0,2025-06-03 14:50:00,8.904,8.348,0.00030000000000001136
KHR-1,6/3/2025,03:00:00 pm,0,2025-06-03 15:00:00,8.9033,8.351,0.00030000000000001136
KHR-1,6/3/2025,03:10:00 pm,0,2025-06-03 15:10:00,8.9018,8.348,0.00019999999999988915
KHR-1,6/3/2025,03:20:00 pm,0,2025-06-03 15:20:00,8.9004,8.35,0.0002000000000000668
KHR-1,6/3/2025,03:30:00 pm,0,2025-06-03 15:30:00,8.8996,8.352,9.999999999994457e-05
KHR-1,6/3/2025,03:40:00 pm,0,2025-06-03 15:40:00,8.898,8.351,0.0
KHR-1,6/3/2025,03:50:00 pm,0,2025-06-03 15:50:00,8.8969,8.351,9.999999999994457e-05
KHR-1,6/3/2025,04:00:00 pm,0,2025-06-03 16:00:00,8.896,8.352,9.999999999994457e-05
KHR-1,6/3/2025,04:10:00 pm,0,2025-06-03 16:10:00,8.8946,8.353,9.999999999994457e-05
KHR-1,6/3/2025,04:20:00 pm,0,2025-06-03 16:20:00,8.8942,8.352,0.00019999999999988915
KHR-1,6/3/2025,04:30:00 pm,0,2025-06-03 16:30:00,8.893,8.354,0.0
KHR-1,6/3/2025,04:40:00 pm,0,2025-06-03 16:40:00,8.8923,8.354,0.00010000000000012221
KHR-1,6/3/2025,04:50:00 pm,0,2025-06-03 16:50:00,8.8915,8.355,9.999999999994457e-05
KHR-1,6/3/2025,05:00:00 pm,0,2025-06-03 17:00:00,8.8914,8.356,0.0
KHR-1,6/3/2025,05:10:00 pm,0,2025-06-03 17:10:00,8.8905,8.356,0.00030000000000001136
KHR-1,6/3/2025,05:20:00 pm,0,2025-06-03 17:20:00,8.8894,8.359,9.999999999994457e-05
KHR-1,6/3/2025,05:30:00 pm,0,2025-06-03 17:30:00,8.8886,8.358,9.999999999994457e-05
KHR-1,6/3/2025,05:40:00 pm,0,2025-06-03 17:40:00,8.8883,8.359,9.999999999994457e-05
KHR-1,6/3/2025,05:50:00 pm,0,2025-06-03 17:50:00,8.8876,8.36,0.0
KHR-1,6/3/2025,06:00:00 pm,0,2025-06-03 18:00:00,8.8869,8.36,9.999999999994457e-05
KHR-1,6/3/2025,06:10:00 pm,0,2025-06-03 18:10:00,8.8865,8.359,0.0
KHR-1,6/3/2025,06:20:00 pm,0,2025-06-03 18:20:00,8.8858,8.359,9.999999999994457e-05
KHR-1,6/3/2025,06:30:00 pm,0,2025-06-03 18:30:00,8.8851,8.36,0.0
KHR-1,6/3/2025,06:40:00 pm,0,2025-06-03 18:40:00,8.8852,8.36,0.0002000000000000668
KHR-1,6/3/2025,06:50:00 pm,0,2025-06-03 18:50:00,8.8849,8.362,0.0
KHR-1,6/3/2025,07:00:00 pm,0,2025-06-03 19:00:00,8.8846,8.362,0.0002000000000000668
KHR-1,6/3/2025,07:10:00 pm,0,2025-06-03 19:10:00,8.8839,8.36,0.0002000000000000668
KHR-1,6/3/2025,07:20:00 pm,0,2025-06-03 19:20:00,8.8843,8.362,9.999999999994457e-05
KHR-1,6/3/2025,07:30:00 pm,0,2025-06-03 19:30:00,8.885,8.363,0.00010000000000012221
KHR-1,6/3/2025,07:40:00 pm,0,2025-06-03 19:40:00,8.8856,8.364,0.00010000000000012221
KHR-1,6/3/2025,07:50:00 pm,0,2025-06-03 19:50:00,8.8858,8.363,0.00010000000000012221
KHR-1,6/3/2025,08:00:00 pm,0,2025-06-03 20:00:00,8.8864,8.364,9.999999999994457e-05
KHR-1,6/3/2025,08:10:00 pm,0,2025-06-03 20:10:00,8.8875,8.365,9.999999999994457e-05
KHR-1,6/3/2025,08:20:00 pm,0,2025-06-03 20:20:00,8.8878,8.364,9.999999999994457e-05
KHR-1,6/3/2025,08:30:00 pm,0,2025-06-03 20:30:00,8.8881,8.365,0.00030000000000001136
KHR-1,6/3/2025,08:40:00 pm,0,2025-06-03 20:40:00,8.8888,8.368,0.0
KHR-1,6/3/2025,08:50:00 pm,0,2025-06-03 20:50:00,8.889,8.368,0.0
KHR-1,6/3/2025,09:00:00 pm,0,2025-06-03 21:00:00,8.8891,8.368,0.0002000000000000668
KHR-1,6/3/2025,09:10:00 pm,0,2025-06-03 21:10:00,8.8897,8.366,0.00039999999999995595
KHR-1,6/3/2025,09:20:00 pm,0,2025-06-03 21:20:00,8.8906,8.37,9.999999999994457e-05
KHR-1,6/3/2025,09:30:00 pm,0,2025-06-03 21:30:00,8.8923,8.369,0.00030000000000001136
KHR-1,6/3/2025,09:40:00 pm,0,2025-06-03 21:40:00,8.8932,8.372,9.999999999994457e-05
KHR-1,6/3/2025,09:50:00 pm,0,2025-06-03 21:50:00,8.8939,8.373,0.00010000000000012221
KHR-1,6/3/2025,10:00:00 pm,0,2025-06-03 22:00:00,8.8946,8.374,0.00010000000000012221
KHR-1,6/3/2025,10:10:00 pm,0,2025-06-03 22:10:00,8.8954,8.373,0.0002000000000000668
KHR-1,6/3/2025,10:20:00 pm,0,2025-06-03 22:20:00,8.8959,8.375,9.999999999994457e-05
KHR-1,6/3/2025,10:30:00 pm,0,2025-06-03 22:30:00,8.8961,8.374,9.999999999994457e-05
KHR-1,6/3/2025,10:40:00 pm,0,2025-06-03 22:40:00,8.8965,8.375,0.0002000000000000668
KHR-1,6/3/2025,10:50:00 pm,0,2025-06-03 22:50:00,8.8965,8.377,0.0
KHR-1,6/3/2025,11:00:00 pm,0,2025-06-03 23:00:00,8.8967,8.377,9.999999999994457e-05
KHR-1,6/3/2025,11:10:00 pm,0,2025-06-03 23:10:00,8.897,8.378,0.0
KHR-1,6/3/2025,11:20:00 pm,0,2025-06-03 23:20:00,8.8978,8.378,0.0
KHR-1,6/3/2025,11:30:00 pm,0,2025-06-03 23:30:00,8.8982,8.378,0.0002000000000000668
KHR-1,6/3/2025,11:40:00 pm,0,2025-06-03 23:40:00,8.8992,8.38,9.999999999994457e-05
KHR-1,6/3/2025,11:50:00 pm,0,2025-06-03 23:50:00,8.9003,8.381,0.0
KHR-1,6/4/2025,12:00:00 am,0,2025-06-04 00:00:00,8.9008,8.381,9.999999999994457e-05
KHR-1,6/4/2025,12:10:00 am,0,2025-06-04 00:10:00,8.9011,8.382,0.0002000000000000668
KHR-1,6/4/2025,12:20:00 am,0,2025-06-04 00:20:00,8.9014,8.384,9.999999999994457e-05
KHR-1,6/4/2025,12:30:00 am,0,2025-06-04 00:30:00,8.9015,8.385,9.999999999994457e-05
KHR-1,6/4/2025,12:40:00 am,0,2025-06-04 00:40:00,8.902,8.386,0.0
KHR-1,6/4/2025,12:50:00 am,0,2025-06-04 00:50:00,8.9019,8.386,0.0
KHR-1,6/4/2025,01:00:00 am,0,2025-06-04 01:00:00,8.9027,8.386,0.0002000000000000668
KHR-1,6/4/2025,01:10:00 am,0,2025-06-04 01:10:00,8.9032,8.388,9.999999999994457e-05
KHR-1,6/4/2025,01:20:00 am,0,2025-06-04 01:20:00,8.9038,8.387,0.00030000000000001136
KHR-1,6/4/2025,01:30:00 am,0,2025-06-04 01:30:00,8.9038,8.39,0.0
KHR-1,6/4/2025,01:40:00 am,0,2025-06-04 01:40:00,8.9042,8.39,0.0
KHR-1,6/4/2025,01:50:00 am,0,2025-06-04 01:50:00,8.9043,8.39,0.0
KHR-1,6/4/2025,02:00:00 am,0,2025-06-04 02:00:00,8.9046,8.39,0.00030000000000001136
KHR-1,6/4/2025,02:10:00 am,0,2025-06-04 02:10:00,8.905,8.393,0.0
KHR-1,6/4/2025,02:20:00 am,0,2025-06-04 02:20:00,8.9058,8.393,0.00019999999999988915
KHR-1,6/4/2025,02:30:00 am,0,2025-06-04 02:30:00,8.9065,8.395,0.00019999999999988915
KHR-1,6/4/2025,02:40:00 am,0,2025-06-04 02:40:00,8.9069,8.393,0.00019999999999988915
KHR-1,6/4/2025,02:50:00 am,0,2025-06-04 02:50:00,8.9072,8.395,0.00010000000000012221
KHR-1,6/4/2025,03:00:00 am,0,2025-06-04 03:00:00,8.9079,8.396,0.0002999999999998337
KHR-1,6/4/2025,03:10:00 am,0,2025-06-04 03:10:00,8.9081,8.399,9.999999999994457e-05
KHR-1,6/4/2025,03:20:00 am,0,2025-06-04 03:20:00,8.9085,8.398,0.0
KHR-1,6/4/2025,03:30:00 am,0,2025-06-04 03:30:00,8.909,8.398,0.0002000000000000668
KHR-1,6/4/2025,03:40:00 am,0,2025-06-04 03:40:00,8.9096,8.4,0.0
KHR-1,6/4/2025,03:50:00 am,0,2025-06-04 03:50:00,8.9104,8.4,0.0
KHR-1,6/4/2025,04:00:00 am,0,2025-06-04 04:00:00,8.9106,8.4,0.00030000000000001136
KHR-1,6/4/2025,04:10:00 am,0,2025-06-04 04:10:00,8.9116,8.403,0.00010000000000012221
KHR-1,6/4/2025,04:20:00 am,0,2025-06-04 04:20:00,8.9116,8.402,0.0002000000000000668
KHR-1,6/4/2025,04:30:00 am,0,2025-06-04 04:30:00,8.912,8.404,0.00030000000000001136
KHR-1,6/4/2025,04:40:00 am,0,2025-06-04 04:40:00,8.9127,8.401,0.00039999999999995595
KHR-1,6/4/2025,04:50:00 am,0,2025-06-04 04:50:00,8.9128,8.405,0.0
KHR-1,6/4/2025,05:00:00 am,0,2025-06-04 05:00:00,8.9128,8.405,0.00010000000000012221
KHR-1,6/4/2025,05:10:00 am,0,2025-06-04 05:10:00,8.9132,8.406,9.999999999994457e-05
KHR-1,6/4/2025,05:20:00 am,0,2025-06-04 05:20:00,8.9132,8.407,9.999999999994457e-05
KHR-1,6/4/2025,05:30:00 am,0,2025-06-04 05:30:00,8.9142,8.408,0.00010000000000012221
KHR-1,6/4/2025,05:40:00 am,0,2025-06-04 05:40:00,8.9148,8.409,0.0
KHR-1,6/4/2025,05:50:00 am,0,2025-06-04 05:50:00,8.9156,8.409,0.00019999999999988915
KHR-1,6/4/2025,06:00:00 am,0,2025-06-04 06:00:00,8.9164,8.411,0.00010000000000012221
KHR-1,6/4/2025,06:10:00 am,0,2025-06-04 06:10:00,8.9174,8.412,0.0
KHR-1,6/4/2025,06:20:00 am,0,2025-06-04 06:20:00,8.9186,8.412,0.0
KHR-1,6/4/2025,06:30:00 am,0,2025-06-04 06:30:00,8.9195,8.412,9.999999999994457e-05
KHR-1,6/4/2025,06:40:00 am,0,2025-06-04 06:40:00,8.9201,8.413,9.999999999994457e-05
KHR-1,6/4/2025,06:50:00 am,0,2025-06-04 06:50:00,8.9205,8.414,0.0002000000000000668
KHR-1,6/4/2025,07:00:00 am,0,2025-06-04 07:00:00,8.921,8.416,0.0002000000000000668
KHR-1,6/4/2025,07:10:00 am,0,2025-06-04 07:10:00,8.9211,8.414,9.999999999994457e-05
KHR-1,6/4/2025,07:20:00 am,0,2025-06-04 07:20:00,8.9213,8.415,0.0002000000000000668
KHR-1,6/4/2025,07:30:00 am,0,2025-06-04 07:30:00,8.9219,8.417,9.999999999994457e-05
KHR-1,6/4/2025,07:40:00 am,0,2025-06-04 07:40:00,8.9218,8.418,0.0002000000000000668
KHR-1,6/4/2025,07:50:00 am,0,2025-06-04 07:50:00,8.922,8.42,9.999999999994457e-05
KHR-1,6/4/2025,08:00:00 am,0,2025-06-04 08:00:00,8.9221,8.419,9.999999999994457e-05
KHR-1,6/4/2025,08:10:00 am,0,2025-06-04 08:10:00,8.9227,8.42,0.0002000000000000668
KHR-1,6/4/2025,08:20:00 am,0,2025-06-04 08:20:00,8.9234,8.418,0.0004000000000001336
KHR-1,6/4/2025,08:30:00 am,0,2025-06-04 08:30:00,8.9244,8.422,9.999999999994457e-05
KHR-1,6/4/2025,08:40:00 am,0,2025-06-04 08:40:00,8.9247,8.423,0.0
KHR-1,6/4/2025,08:50:00 am,0,2025-06-04 08:50:00,8.9253,8.423,0.0
KHR-1,6/4/2025,09:00:00 am,0,2025-06-04 09:00:00,8.9261,8.423,9.999999999994457e-05
KHR-1,6/4/2025,09:10:00 am,0,2025-06-04 09:10:00,8.9271,8.424,0.00010000000000012221
KHR-1,6/4/2025,09:20:00 am,0,2025-06-04 09:20:00,8.9266,8.425,0.00019999999999988915
KHR-1,6/4/2025,09:30:00 am,0,2025-06-04 09:30:00,8.9262,8.427,0.0
KHR-1,6/4/2025,09:40:00 am,0,2025-06-04 09:40:00,8.926,8.427,0.00030000000000001136
KHR-1,6/4/2025,09:50:00 am,0,2025-06-04 09:50:00,8.9262,8.43,0.0
KHR-1,6/4/2025,10:00:00 am,0,2025-06-04 10:00:00,8.9255,8.43,9.999999999994457e-05
KHR-1,6/4/2025,10:10:00 am,0,2025-06-04 10:10:00,8.9248,8.431,0.0002000000000000668
