well_id,Date,Time,ms,DT,raw_Level_m,TEMPERATURE,Rate of Change
KHF-1,6/24/2025,05:30:00 pm,0,2025-06-24 17:30:00,9.2909,21.331,1.2590999999999999
KHF-1,6/24/2025,05:40:00 pm,0,2025-06-24 17:40:00,9.3032,8.74,0.05960000000000001
KHF-1,6/24/2025,05:50:00 pm,0,2025-06-24 17:50:00,9.303,8.144,0.022700000000000033
KHF-1,6/24/2025,06:00:00 pm,0,2025-06-24 18:00:00,9.3028,7.917,0.012899999999999957
KHF-1,6/24/2025,06:10:00 pm,0,2025-06-24 18:10:00,9.3034,7.788,0.007900000000000063
KHF-1,6/24/2025,06:20:00 pm,0,2025-06-24 18:20:00,9.3041,7.709,0.004999999999999982
KHF-1,6/24/2025,06:30:00 pm,0,2025-06-24 18:30:00,9.3043,7.659,0.0035999999999999587
KHF-1,6/24/2025,06:40:00 pm,0,2025-06-24 18:40:00,9.3026,7.623,0.0023000000000000576
KHF-1,6/24/2025,06:50:00 pm,0,2025-06-24 18:50:00,9.302,7.6,0.001699999999999946
KHF-1,6/24/2025,07:00:00 pm,0,2025-06-24 19:00:00,9.3011,7.583,0.0012000000000000454
KHF-1,6/24/2025,07:10:00 pm,0,2025-06-24 19:10:00,9.3009,7.571,0.0005999999999999339
KHF-1,6/24/2025,07:20:00 pm,0,2025-06-24 19:20:00,9.3004,7.565,0.0008000000000000007
KHF-1,6/24/2025,07:30:00 pm,0,2025-06-24 19:30:00,9.3006,7.557,0.0007000000000000562
KHF-1,6/24/2025,07:40:00 pm,0,2025-06-24 19:40:00,9.3007,7.55,0.00039999999999995595
KHF-1,6/24/2025,07:50:00 pm,0,2025-06-24 19:50:00,9.3007,7.546,0.0
KHF-1,6/24/2025,08:00:00 pm,0,2025-06-24 20:00:00,9.3008,7.546,0.0004999999999999894
KHF-1,6/24/2025,08:10:00 pm,0,2025-06-24 20:10:00,9.3011,7.541,0.0
KHF-1,6/24/2025,08:20:00 pm,0,2025-06-24 20:20:00,9.3013,7.541,0.00030000000000001136
KHF-1,6/24/2025,08:30:00 pm,0,2025-06-24 20:30:00,9.3012,7.538,0.0001000000000000334
KHF-1,6/24/2025,08:40:00 pm,0,2025-06-24 20:40:00,9.3015,7.537,0.00030000000000001136
KHF-1,6/24/2025,08:50:00 pm,0,2025-06-24 20:50:00,9.3016,7.534,0.0001000000000000334
KHF-1,6/24/2025,09:00:00 pm,0,2025-06-24 21:00:00,9.3016,7.535,0.0001000000000000334
KHF-1,6/24/2025,09:10:00 pm,0,2025-06-24 21:10:00,9.3021,7.534,0.0
KHF-1,6/24/2025,09:20:00 pm,0,2025-06-24 21:20:00,9.3025,7.534,0.0
KHF-1,6/24/2025,09:30:00 pm,0,2025-06-24 21:30:00,9.3027,7.534,0.00019999999999997797
KHF-1,6/24/2025,09:40:00 pm,0,2025-06-24 21:40:00,9.3038,7.532,0.0001000000000000334
KHF-1,6/24/2025,09:50:00 pm,0,2025-06-24 21:50:00,9.3042,7.533,0.0002000000000000668
KHF-1,6/24/2025,10:00:00 pm,0,2025-06-24 22:00:00,9.3067,7.531,0.0002000000000000668
KHF-1,6/24/2025,10:10:00 pm,0,2025-06-24 22:10:00,9.3069,7.533,0.0002000000000000668
KHF-1,6/24/2025,10:20:00 pm,0,2025-06-24 22:20:00,9.3068,7.531,0.0
KHF-1,6/24/2025,10:30:00 pm,0,2025-06-24 22:30:00,9.3074,7.531,0.0002000000000000668
KHF-1,6/24/2025,10:40:00 pm,0,2025-06-24 22:40:00,9.3078,7.533,0.0
KHF-1,6/24/2025,10:50:00 pm,0,2025-06-24 22:50:00,9.3079,7.533,0.00040000000000004474
KHF-1,6/24/2025,11:00:00 pm,0,2025-06-24 23:00:00,9.3078,7.529,0.0001000000000000334
KHF-1,6/24/2025,11:10:00 pm,0,2025-06-24 23:10:00,9.3077,7.53,0.0
KHF-1,6/24/2025,11:20:00 pm,0,2025-06-24 23:20:00,9.3086,7.53,0.0
KHF-1,6/24/2025,11:30:00 pm,0,2025-06-24 23:30:00,9.3087,7.53,0.00019999999999997797
KHF-1,6/24/2025,11:40:00 pm,0,2025-06-24 23:40:00,9.309,7.532,0.00019999999999997797
KHF-1,6/24/2025,11:50:00 pm,0,2025-06-24 23:50:00,9.3093,7.53,0.00019999999999997797
KHF-1,6/25/2025,12:00:00 am,0,2025-06-25 00:00:00,9.3095,7.532,0.00019999999999997797
KHF-1,6/25/2025,12:10:00 am,0,2025-06-25 00:10:00,9.3095,7.53,0.0001000000000000334
KHF-1,6/25/2025,12:20:00 am,0,2025-06-25 00:20:00,9.3095,7.529,0.0001000000000000334
KHF-1,6/25/2025,12:30:00 am,0,2025-06-25 00:30:00,9.3094,7.53,0.0001000000000000334
KHF-1,6/25/2025,12:40:00 am,0,2025-06-25 00:40:00,9.3098,7.529,0.00019999999999997797
KHF-1,6/25/2025,12:50:00 am,0,2025-06-25 00:50:00,9.3095,7.531,9.999999999994457e-05
KHF-1,6/25/2025,01:00:00 am,0,2025-06-25 01:00:00,9.3099,7.53,9.999999999994457e-05
KHF-1,6/25/2025,01:10:00 am,0,2025-06-25 01:10:00,9.3101,7.531,0.0001000000000000334
KHF-1,6/25/2025,01:20:00 am,0,2025-06-25 01:20:00,9.31,7.532,0.0
KHF-1,6/25/2025,01:30:00 am,0,2025-06-25 01:30:00,9.3102,7.532,0.00019999999999997797
KHF-1,6/25/2025,01:40:00 am,0,2025-06-25 01:40:00,9.3102,7.53,0.0001000000000000334
KHF-1,6/25/2025,01:50:00 am,0,2025-06-25 01:50:00,9.31,7.529,0.0001000000000000334
KHF-1,6/25/2025,02:00:00 am,0,2025-06-25 02:00:00,9.3105,7.53,0.00019999999999997797
KHF-1,6/25/2025,02:10:00 am,0,2025-06-25 02:10:00,9.3111,7.532,0.0
KHF-1,6/25/2025,02:20:00 am,0,2025-06-25 02:20:00,9.3119,7.532,0.00019999999999997797
KHF-1,6/25/2025,02:30:00 am,0,2025-06-25 02:30:00,9.3126,7.534,9.999999999994457e-05
KHF-1,6/25/2025,02:40:00 am,0,2025-06-25 02:40:00,9.3132,7.533,0.0001000000000000334
KHF-1,6/25/2025,02:50:00 am,0,2025-06-25 02:50:00,9.3139,7.532,0.0001000000000000334
KHF-1,6/25/2025,03:00:00 am,0,2025-06-25 03:00:00,9.3145,7.533,0.0
KHF-1,6/25/2025,03:10:00 am,0,2025-06-25 03:10:00,9.3151,7.533,0.0
KHF-1,6/25/2025,03:20:00 am,0,2025-06-25 03:20:00,9.3157,7.533,0.0
KHF-1,6/25/2025,03:30:00 am,0,2025-06-25 03:30:00,9.3161,7.533,0.0
KHF-1,6/25/2025,03:40:00 am,0,2025-06-25 03:40:00,9.3163,7.533,0.0
KHF-1,6/25/2025,03:50:00 am,0,2025-06-25 03:50:00,9.3161,7.533,0.00029999999999992256
KHF-1,6/25/2025,04:00:00 am,0,2025-06-25 04:00:00,9.3162,7.536,0.00019999999999997797
KHF-1,6/25/2025,04:10:00 am,0,2025-06-25 04:10:00,9.3162,7.534,0.00019999999999997797
KHF-1,6/25/2025,04:20:00 am,0,2025-06-25 04:20:00,9.3166,7.536,0.0
KHF-1,6/25/2025,04:30:00 am,0,2025-06-25 04:30:00,9.3174,7.536,0.0
KHF-1,6/25/2025,04:40:00 am,0,2025-06-25 04:40:00,9.3183,7.536,0.0
KHF-1,6/25/2025,04:50:00 am,0,2025-06-25 04:50:00,9.3186,7.536,0.0001000000000000334
KHF-1,6/25/2025,05:00:00 am,0,2025-06-25 05:00:00,9.3189,7.537,0.0001000000000000334
KHF-1,6/25/2025,05:10:00 am,0,2025-06-25 05:10:00,9.3194,7.538,0.0001000000000000334
KHF-1,6/25/2025,05:20:00 am,0,2025-06-25 05:20:00,9.3206,7.537,0.00019999999999997797
KHF-1,6/25/2025,05:30:00 am,0,2025-06-25 05:30:00,9.3216,7.539,9.999999999994457e-05
KHF-1,6/25/2025,05:40:00 am,0,2025-06-25 05:40:00,9.3224,7.538,9.999999999994457e-05
KHF-1,6/25/2025,05:50:00 am,0,2025-06-25 05:50:00,9.3228,7.539,0.0
KHF-1,6/25/2025,06:00:00 am,0,2025-06-25 06:00:00,9.3234,7.539,9.999999999994457e-05
KHF-1,6/25/2025,06:10:00 am,0,2025-06-25 06:10:00,9.3242,7.538,9.999999999994457e-05
KHF-1,6/25/2025,06:20:00 am,0,2025-06-25 06:20:00,9.3252,7.539,9.999999999994457e-05
KHF-1,6/25/2025,06:30:00 am,0,2025-06-25 06:30:00,9.3259,7.538,0.00019999999999997797
KHF-1,6/25/2025,06:40:00 am,0,2025-06-25 06:40:00,9.3263,7.54,0.0001000000000000334
KHF-1,6/25/2025,06:50:00 am,0,2025-06-25 06:50:00,9.3267,7.541,9.999999999994457e-05
KHF-1,6/25/2025,07:00:00 am,0,2025-06-25 07:00:00,9.3268,7.542,0.00019999999999997797
KHF-1,6/25/2025,07:10:00 am,0,2025-06-25 07:10:00,9.3266,7.54,0.0
KHF-1,6/25/2025,07:20:00 am,0,2025-06-25 07:20:00,9.3272,7.54,0.0001000000000000334
KHF-1,6/25/2025,07:30:00 am,0,2025-06-25 07:30:00,9.3278,7.539,0.00030000000000001136
KHF-1,6/25/2025,07:40:00 am,0,2025-06-25 07:40:00,9.3284,7.542,0.0
KHF-1,6/25/2025,07:50:00 am,0,2025-06-25 07:50:00,9.3287,7.542,9.999999999994457e-05
KHF-1,6/25/2025,08:00:00 am,0,2025-06-25 08:00:00,9.3297,7.541,0.00029999999999992256
KHF-1,6/25/2025,08:10:00 am,0,2025-06-25 08:10:00,9.3301,7.544,9.999999999994457e-05
KHF-1,6/25/2025,08:20:00 am,0,2025-06-25 08:20:00,9.3308,7.543,0.00019999999999997797
KHF-1,6/25/2025,08:30:00 am,0,2025-06-25 08:30:00,9.3311,7.541,0.00019999999999997797
KHF-1,6/25/2025,08:40:00 am,0,2025-06-25 08:40:00,9.3313,7.543,0.0
KHF-1,6/25/2025,08:50:00 am,0,2025-06-25 08:50:00,9.3314,7.543,0.0
KHF-1,6/25/2025,09:00:00 am,0,2025-06-25 09:00:00,9.3315,7.543,0.0001000000000000334
KHF-1,6/25/2025,09:10:00 am,0,2025-06-25 09:10:00,9.3309,7.542,0.00019999999999997797
KHF-1,6/25/2025,09:20:00 am,0,2025-06-25 09:20:00,9.3301,7.544,0.0
KHF-1,6/25/2025,09:30:00 am,0,2025-06-25 09:30:00,9.3297,7.544,0.0
KHF-1,6/25/2025,09:40:00 am,0,2025-06-25 09:40:00,9.3293,7.544,9.999999999994457e-05
KHF-1,6/25/2025,09:50:00 am,0,2025-06-25 09:50:00,9.3287,7.543,0.00019999999999997797
KHF-1,6/25/2025,10:00:00 am,0,2025-06-25 10:00:00,9.3278,7.545,0.0
KHF-1,6/25/2025,10:10:00 am,0,2025-06-25 10:10:00,9.3274,7.545,0.0001000000000000334
KHF-1,6/25/2025,10:20:00 am,0,2025-06-25 10:20:00,9.3273,7.546,0.0001000000000000334
KHF-1,6/25/2025,10:30:00 am,0,2025-06-25 10:30:00,9.3258,7.545,0.0001000000000000334
KHF-1,6/25/2025,10:40:00 am,0,2025-06-25 10:40:00,9.3252,7.546,0.0
KHF-1,6/25/2025,10:50:00 am,0,2025-06-25 10:50:00,9.3244,7.546,9.999999999994457e-05
KHF-1,6/25/2025,11:00:00 am,0,2025-06-25 11:00:00,9.3236,7.547,9.999999999994457e-05
KHF-1,6/25/2025,11:10:00 am,0,2025-06-25 11:10:00,9.3232,7.546,0.0
KHF-1,6/25/2025,11:20:00 am,0,2025-06-25 11:20:00,9.3225,7.546,0.00019999999999997797
KHF-1,6/25/2025,11:30:00 am,0,2025-06-25 11:30:00,9.3229,7.548,0.0
KHF-1,6/25/2025,11:40:00 am,0,2025-06-25 11:40:00,9.3222,7.548,0.00019999999999997797
KHF-1,6/25/2025,11:50:00 am,0,2025-06-25 11:50:00,9.3218,7.55,0.0001000000000000334
KHF-1,6/25/2025,12:00:00 pm,0,2025-06-25 12:00:00,9.3213,7.551,0.00030000000000001136
KHF-1,6/25/2025,12:10:00 pm,0,2025-06-25 12:10:00,9.3201,7.548,0.0001000000000000334
KHF-1,6/25/2025,12:20:00 pm,0,2025-06-25 12:20:00,9.3177,7.549,9.999999999994457e-05
KHF-1,6/25/2025,12:30:00 pm,0,2025-06-25 12:30:00,9.3165,7.55,0.0
KHF-1,6/25/2025,12:40:00 pm,0,2025-06-25 12:40:00,9.3153,7.55,0.0001000000000000334
KHF-1,6/25/2025,12:50:00 pm,0,2025-06-25 12:50:00,9.3139,7.551,0.0001000000000000334
KHF-1,6/25/2025,01:00:00 pm,0,2025-06-25 13:00:00,9.3129,7.55,0.0001000000000000334
KHF-1,6/25/2025,01:10:00 pm,0,2025-06-25 13:10:00,9.312,7.551,9.999999999994457e-05
KHF-1,6/25/2025,01:20:00 pm,0,2025-06-25 13:20:00,9.3105,7.552,0.0001000000000000334
KHF-1,6/25/2025,01:30:00 pm,0,2025-06-25 13:30:00,9.3099,7.553,0.0
KHF-1,6/25/2025,01:40:00 pm,0,2025-06-25 13:40:00,9.3094,7.553,0.0001000000000000334
KHF-1,6/25/2025,01:50:00 pm,0,2025-06-25 13:50:00,9.3079,7.554,0.0001000000000000334
KHF-1,6/25/2025,02:00:00 pm,0,2025-06-25 14:00:00,9.3081,7.553,0.0
KHF-1,6/25/2025,02:10:00 pm,0,2025-06-25 14:10:00,9.3075,7.553,0.0001000000000000334
KHF-1,6/25/2025,02:20:00 pm,0,2025-06-25 14:20:00,9.3059,7.552,0.0001000000000000334
KHF-1,6/25/2025,02:30:00 pm,0,2025-06-25 14:30:00,9.3058,7.553,0.00019999999999997797
KHF-1,6/25/2025,02:40:00 pm,0,2025-06-25 14:40:00,9.3053,7.555,0.0
KHF-1,6/25/2025,02:50:00 pm,0,2025-06-25 14:50:00,9.3052,7.555,0.0
KHF-1,6/25/2025,03:00:00 pm,0,2025-06-25 15:00:00,9.3044,7.555,0.00030000000000001136
KHF-1,6/25/2025,03:10:00 pm,0,2025-06-25 15:10:00,9.3031,7.552,0.0002000000000000668
KHF-1,6/25/2025,03:20:00 pm,0,2025-06-25 15:20:00,9.3028,7.554,0.00019999999999997797
KHF-1,6/25/2025,03:30:00 pm,0,2025-06-25 15:30:00,9.3018,7.556,0.0
KHF-1,6/25/2025,03:40:00 pm,0,2025-06-25 15:40:00,9.3011,7.556,0.0
KHF-1,6/25/2025,03:50:00 pm,0,2025-06-25 15:50:00,9.2994,7.556,0.00019999999999997797
KHF-1,6/25/2025,04:00:00 pm,0,2025-06-25 16:00:00,9.2985,7.558,9.999999999994457e-05
KHF-1,6/25/2025,04:10:00 pm,0,2025-06-25 16:10:00,9.2974,7.557,0.0
KHF-1,6/25/2025,04:20:00 pm,0,2025-06-25 16:20:00,9.2972,7.557,9.999999999994457e-05
KHF-1,6/25/2025,04:30:00 pm,0,2025-06-25 16:30:00,9.2968,7.558,0.0
KHF-1,6/25/2025,04:40:00 pm,0,2025-06-25 16:40:00,9.2964,7.558,9.999999999994457e-05
KHF-1,6/25/2025,04:50:00 pm,0,2025-06-25 16:50:00,9.2953,7.557,0.0
KHF-1,6/25/2025,05:00:00 pm,0,2025-06-25 17:00:00,9.2943,7.557,0.00019999999999997797
KHF-1,6/25/2025,05:10:00 pm,0,2025-06-25 17:10:00,9.2939,7.559,0.0
KHF-1,6/25/2025,05:20:00 pm,0,2025-06-25 17:20:00,9.2933,7.559,0.00019999999999997797
KHF-1,6/25/2025,05:30:00 pm,0,2025-06-25 17:30:00,9.2923,7.557,9.999999999994457e-05
KHF-1,6/25/2025,05:40:00 pm,0,2025-06-25 17:40:00,9.2918,7.558,0.0001000000000000334
KHF-1,6/25/2025,05:50:00 pm,0,2025-06-25 17:50:00,9.2917,7.559,0.0001000000000000334
KHF-1,6/25/2025,06:00:00 pm,0,2025-06-25 18:00:00,9.2913,7.558,0.0001000000000000334
KHF-1,6/25/2025,06:10:00 pm,0,2025-06-25 18:10:00,9.2906,7.559,0.0001000000000000334
KHF-1,6/25/2025,06:20:00 pm,0,2025-06-25 18:20:00,9.29,7.558,0.0001000000000000334
KHF-1,6/25/2025,06:30:00 pm,0,2025-06-25 18:30:00,9.2895,7.559,9.999999999994457e-05
KHF-1,6/25/2025,06:40:00 pm,0,2025-06-25 18:40:00,9.2889,7.56,9.999999999994457e-05
KHF-1,6/25/2025,06:50:00 pm,0,2025-06-25 18:50:00,9.2886,7.559,9.999999999994457e-05
KHF-1,6/25/2025,07:00:00 pm,0,2025-06-25 19:00:00,9.2885,7.56,0.0001000000000000334
KHF-1,6/25/2025,07:10:00 pm,0,2025-06-25 19:10:00,9.2882,7.561,0.0001000000000000334
KHF-1,6/25/2025,07:20:00 pm,0,2025-06-25 19:20:00,9.2882,7.56,9.999999999994457e-05
KHF-1,6/25/2025,07:30:00 pm,0,2025-06-25 19:30:00,9.2882,7.559,0.00019999999999997797
KHF-1,6/25/2025,07:40:00 pm,0,2025-06-25 19:40:00,9.2883,7.561,0.0001000000000000334
KHF-1,6/25/2025,07:50:00 pm,0,2025-06-25 19:50:00,9.2882,7.56,0.00030000000000001136
KHF-1,6/25/2025,08:00:00 pm,0,2025-06-25 20:00:00,9.2881,7.563,0.00030000000000001136
KHF-1,6/25/2025,08:10:00 pm,0,2025-06-25 20:10:00,9.2882,7.56,0.00030000000000001136
KHF-1,6/25/2025,08:20:00 pm,0,2025-06-25 20:20:00,9.2882,7.563,9.999999999994457e-05
KHF-1,6/25/2025,08:30:00 pm,0,2025-06-25 20:30:00,9.288,7.562,0.0002000000000000668
KHF-1,6/25/2025,08:40:00 pm,0,2025-06-25 20:40:00,9.2877,7.56,0.0002000000000000668
KHF-1,6/25/2025,08:50:00 pm,0,2025-06-25 20:50:00,9.2878,7.562,0.0
KHF-1,6/25/2025,09:00:00 pm,0,2025-06-25 21:00:00,9.2878,7.562,0.0
KHF-1,6/25/2025,09:10:00 pm,0,2025-06-25 21:10:00,9.2882,7.562,0.0
KHF-1,6/25/2025,09:20:00 pm,0,2025-06-25 21:20:00,9.2885,7.562,0.0
KHF-1,6/25/2025,09:30:00 pm,0,2025-06-25 21:30:00,9.2889,7.562,9.999999999994457e-05
KHF-1,6/25/2025,09:40:00 pm,0,2025-06-25 21:40:00,9.2891,7.563,0.0001000000000000334
KHF-1,6/25/2025,09:50:00 pm,0,2025-06-25 21:50:00,9.289,7.564,0.0
KHF-1,6/25/2025,10:00:00 pm,0,2025-06-25 22:00:00,9.2883,7.564,0.0001000000000000334
KHF-1,6/25/2025,10:10:00 pm,0,2025-06-25 22:10:00,9.2882,7.563,0.0
KHF-1,6/25/2025,10:20:00 pm,0,2025-06-25 22:20:00,9.2885,7.563,0.0001000000000000334
KHF-1,6/25/2025,10:30:00 pm,0,2025-06-25 22:30:00,9.2883,7.564,0.0
KHF-1,6/25/2025,10:40:00 pm,0,2025-06-25 22:40:00,9.2883,7.564,0.0
KHF-1,6/25/2025,10:50:00 pm,0,2025-06-25 22:50:00,9.2889,7.564,0.0001000000000000334
KHF-1,6/25/2025,11:00:00 pm,0,2025-06-25 23:00:00,9.289,7.563,9.999999999994457e-05
KHF-1,6/25/2025,11:10:00 pm,0,2025-06-25 23:10:00,9.2889,7.562,0.0
KHF-1,6/25/2025,11:20:00 pm,0,2025-06-25 23:20:00,9.2888,7.562,0.00019999999999997797
KHF-1,6/25/2025,11:30:00 pm,0,2025-06-25 23:30:00,9.2887,7.564,0.0001000000000000334
KHF-1,6/25/2025,11:40:00 pm,0,2025-06-25 23:40:00,9.2888,7.563,0.0001000000000000334
KHF-1,6/25/2025,11:50:00 pm,0,2025-06-25 23:50:00,9.2884,7.564,0.0001000000000000334
KHF-1,6/26/2025,12:00:00 am,0,2025-06-26 00:00:00,9.2886,7.565,0.0001000000000000334
KHF-1,6/26/2025,12:10:00 am,0,2025-06-26 00:10:00,9.2883,7.564,0.0001000000000000334
KHF-1,6/26/2025,12:20:00 am,0,2025-06-26 00:20:00,9.2879,7.565,0.00030000000000001136
KHF-1,6/26/2025,12:30:00 am,0,2025-06-26 00:30:00,9.2877,7.562,0.00030000000000001136
KHF-1,6/26/2025,12:40:00 am,0,2025-06-26 00:40:00,9.2878,7.565,0.0
KHF-1,6/26/2025,12:50:00 am,0,2025-06-26 00:50:00,9.2878,7.565,9.999999999994457e-05
KHF-1,6/26/2025,01:00:00 am,0,2025-06-26 01:00:00,9.2873,7.566,0.0
KHF-1,6/26/2025,01:10:00 am,0,2025-06-26 01:10:00,9.2873,7.566,0.0
KHF-1,6/26/2025,01:20:00 am,0,2025-06-26 01:20:00,9.2875,7.566,9.999999999994457e-05
KHF-1,6/26/2025,01:30:00 am,0,2025-06-26 01:30:00,9.2876,7.565,0.0
KHF-1,6/26/2025,01:40:00 am,0,2025-06-26 01:40:00,9.2876,7.565,9.999999999994457e-05
KHF-1,6/26/2025,01:50:00 am,0,2025-06-26 01:50:00,9.2877,7.566,0.0
KHF-1,6/26/2025,02:00:00 am,0,2025-06-26 02:00:00,9.2875,7.566,9.999999999994457e-05
KHF-1,6/26/2025,02:10:00 am,0,2025-06-26 02:10:00,9.2871,7.565,0.0
KHF-1,6/26/2025,02:20:00 am,0,2025-06-26 02:20:00,9.287,7.565,9.999999999994457e-05
KHF-1,6/26/2025,02:30:00 am,0,2025-06-26 02:30:00,9.2867,7.566,0.0
KHF-1,6/26/2025,02:40:00 am,0,2025-06-26 02:40:00,9.2868,7.566,0.0
KHF-1,6/26/2025,02:50:00 am,0,2025-06-26 02:50:00,9.2865,7.566,0.0001000000000000334
KHF-1,6/26/2025,03:00:00 am,0,2025-06-26 03:00:00,9.2859,7.567,0.00019999999999997797
KHF-1,6/26/2025,03:10:00 am,0,2025-06-26 03:10:00,9.2859,7.565,0.00019999999999997797
KHF-1,6/26/2025,03:20:00 am,0,2025-06-26 03:20:00,9.2862,7.567,0.0001000000000000334
KHF-1,6/26/2025,03:30:00 am,0,2025-06-26 03:30:00,9.2863,7.566,0.0001000000000000334
KHF-1,6/26/2025,03:40:00 am,0,2025-06-26 03:40:00,9.2862,7.567,9.999999999994457e-05
KHF-1,6/26/2025,03:50:00 am,0,2025-06-26 03:50:00,9.2862,7.568,0.0001000000000000334
KHF-1,6/26/2025,04:00:00 am,0,2025-06-26 04:00:00,9.286,7.569,0.00030000000000001136
KHF-1,6/26/2025,04:10:00 am,0,2025-06-26 04:10:00,9.2861,7.566,0.0
KHF-1,6/26/2025,04:20:00 am,0,2025-06-26 04:20:00,9.2861,7.566,0.0001000000000000334
KHF-1,6/26/2025,04:30:00 am,0,2025-06-26 04:30:00,9.2862,7.567,0.00019999999999997797
KHF-1,6/26/2025,04:40:00 am,0,2025-06-26 04:40:00,9.2866,7.569,0.0
KHF-1,6/26/2025,04:50:00 am,0,2025-06-26 04:50:00,9.2867,7.569,0.0
KHF-1,6/26/2025,05:00:00 am,0,2025-06-26 05:00:00,9.2867,7.569,0.0001000000000000334
KHF-1,6/26/2025,05:10:00 am,0,2025-06-26 05:10:00,9.287,7.568,0.0
KHF-1,6/26/2025,05:20:00 am,0,2025-06-26 05:20:00,9.287,7.568,0.0002000000000000668
KHF-1,6/26/2025,05:30:00 am,0,2025-06-26 05:30:00,9.2874,7.57,0.0002000000000000668
KHF-1,6/26/2025,05:40:00 am,0,2025-06-26 05:40:00,9.2877,7.568,0.0001000000000000334
KHF-1,6/26/2025,05:50:00 am,0,2025-06-26 05:50:00,9.2873,7.569,0.0
KHF-1,6/26/2025,06:00:00 am,0,2025-06-26 06:00:00,9.2871,7.569,0.0
KHF-1,6/26/2025,06:10:00 am,0,2025-06-26 06:10:00,9.2873,7.569,0.0
KHF-1,6/26/2025,06:20:00 am,0,2025-06-26 06:20:00,9.2871,7.569,0.0
KHF-1,6/26/2025,06:30:00 am,0,2025-06-26 06:30:00,9.2869,7.569,0.0001000000000000334
KHF-1,6/26/2025,06:40:00 am,0,2025-06-26 06:40:00,9.2872,7.568,0.0
KHF-1,6/26/2025,06:50:00 am,0,2025-06-26 06:50:00,9.2877,7.568,0.0001000000000000334
KHF-1,6/26/2025,07:00:00 am,0,2025-06-26 07:00:00,9.2872,7.569,0.0
KHF-1,6/26/2025,07:10:00 am,0,2025-06-26 07:10:00,9.2866,7.569,0.0001000000000000334
KHF-1,6/26/2025,07:20:00 am,0,2025-06-26 07:20:00,9.2864,7.57,0.0001000000000000334
KHF-1,6/26/2025,07:30:00 am,0,2025-06-26 07:30:00,9.2863,7.569,0.0001000000000000334
KHF-1,6/26/2025,07:40:00 am,0,2025-06-26 07:40:00,9.2866,7.568,0.0
KHF-1,6/26/2025,07:50:00 am,0,2025-06-26 07:50:00,9.2867,7.568,0.0002000000000000668
KHF-1,6/26/2025,08:00:00 am,0,2025-06-26 08:00:00,9.2868,7.57,0.00019999999999997797
KHF-1,6/26/2025,08:10:00 am,0,2025-06-26 08:10:00,9.2868,7.572,0.0001000000000000334
KHF-1,6/26/2025,08:20:00 am,0,2025-06-26 08:20:00,9.2867,7.571,0.0001000000000000334
KHF-1,6/26/2025,08:30:00 am,0,2025-06-26 08:30:00,9.2865,7.572,0.00019999999999997797
KHF-1,6/26/2025,08:40:00 am,0,2025-06-26 08:40:00,9.2866,7.57,9.999999999994457e-05
KHF-1,6/26/2025,08:50:00 am,0,2025-06-26 08:50:00,9.2868,7.571,0.0001000000000000334
KHF-1,6/26/2025,09:00:00 am,0,2025-06-26 09:00:00,9.2863,7.572,0.0001000000000000334
KHF-1,6/26/2025,09:10:00 am,0,2025-06-26 09:10:00,9.2863,7.573,0.0002000000000000668
KHF-1,6/26/2025,09:20:00 am,0,2025-06-26 09:20:00,9.2858,7.571,0.00030000000000001136
KHF-1,6/26/2025,09:30:00 am,0,2025-06-26 09:30:00,9.2854,7.574,0.00019999999999997797
KHF-1,6/26/2025,09:40:00 am,0,2025-06-26 09:40:00,9.2861,7.572,0.0001000000000000334
KHF-1,6/26/2025,09:50:00 am,0,2025-06-26 09:50:00,9.2857,7.571,0.0001000000000000334
KHF-1,6/26/2025,10:00:00 am,0,2025-06-26 10:00:00,9.286,7.572,0.0
KHF-1,6/26/2025,10:10:00 am,0,2025-06-26 10:10:00,9.2854,7.572,0.0001000000000000334
KHF-1,6/26/2025,10:20:00 am,0,2025-06-26 10:20:00,9.2853,7.573,0.0001000000000000334
KHF-1,6/26/2025,10:30:00 am,0,2025-06-26 10:30:00,9.2849,7.572,0.00030000000000001136
KHF-1,6/26/2025,10:40:00 am,0,2025-06-26 10:40:00,9.2843,7.575,0.00019999999999997797
KHF-1,6/26/2025,10:50:00 am,0,2025-06-26 10:50:00,9.2844,7.573,0.0
KHF-1,6/26/2025,11:00:00 am,0,2025-06-26 11:00:00,9.2839,7.573,0.00019999999999997797
KHF-1,6/26/2025,11:10:00 am,0,2025-06-26 11:10:00,9.2837,7.575,0.0
KHF-1,6/26/2025,11:20:00 am,0,2025-06-26 11:20:00,9.2832,7.575,0.0
KHF-1,6/26/2025,11:30:00 am,0,2025-06-26 11:30:00,9.2833,7.575,0.0001000000000000334
KHF-1,6/26/2025,11:40:00 am,0,2025-06-26 11:40:00,9.2831,7.574,0.0001000000000000334
KHF-1,6/26/2025,11:50:00 am,0,2025-06-26 11:50:00,9.2825,7.575,0.0001000000000000334
KHF-1,6/26/2025,12:00:00 pm,0,2025-06-26 12:00:00,9.2825,7.574,0.0
KHF-1,6/26/2025,12:10:00 pm,0,2025-06-26 12:10:00,9.2825,7.574,0.00040000000000004474
KHF-1,6/26/2025,12:20:00 pm,0,2025-06-26 12:20:00,9.2821,7.578,0.0
KHF-1,6/26/2025,12:30:00 pm,0,2025-06-26 12:30:00,9.2817,7.578,0.0001000000000000334
KHF-1,6/26/2025,12:40:00 pm,0,2025-06-26 12:40:00,9.2813,7.577,0.0001000000000000334
KHF-1,6/26/2025,12:50:00 pm,0,2025-06-26 12:50:00,9.281,7.578,0.0001000000000000334
KHF-1,6/26/2025,01:00:00 pm,0,2025-06-26 13:00:00,9.28,7.577,0.0
KHF-1,6/26/2025,01:10:00 pm,0,2025-06-26 13:10:00,9.2796,7.577,0.00019999999999997797
KHF-1,6/26/2025,01:20:00 pm,0,2025-06-26 13:20:00,9.2789,7.579,0.0
KHF-1,6/26/2025,01:30:00 pm,0,2025-06-26 13:30:00,9.2785,7.579,0.0
KHF-1,6/26/2025,01:40:00 pm,0,2025-06-26 13:40:00,9.2781,7.579,0.0
KHF-1,6/26/2025,01:50:00 pm,0,2025-06-26 13:50:00,9.2775,7.579,0.0001000000000000334
KHF-1,6/26/2025,02:00:00 pm,0,2025-06-26 14:00:00,9.2765,7.58,0.00019999999999997797
KHF-1,6/26/2025,02:10:00 pm,0,2025-06-26 14:10:00,9.2757,7.578,9.999999999994457e-05
KHF-1,6/26/2025,02:20:00 pm,0,2025-06-26 14:20:00,9.2738,7.579,9.999999999994457e-05
KHF-1,6/26/2025,02:30:00 pm,0,2025-06-26 14:30:00,9.2729,7.578,0.00019999999999997797
KHF-1,6/26/2025,02:40:00 pm,0,2025-06-26 14:40:00,9.2699,7.58,0.0001000000000000334
KHF-1,6/26/2025,02:50:00 pm,0,2025-06-26 14:50:00,9.2679,7.581,0.0002000000000000668
KHF-1,6/26/2025,03:00:00 pm,0,2025-06-26 15:00:00,9.2683,7.579,0.0002000000000000668
KHF-1,6/26/2025,03:10:00 pm,0,2025-06-26 15:10:00,9.2667,7.581,0.0
KHF-1,6/26/2025,03:20:00 pm,0,2025-06-26 15:20:00,9.2666,7.581,0.0
KHF-1,6/26/2025,03:30:00 pm,0,2025-06-26 15:30:00,9.2652,7.581,9.999999999994457e-05
KHF-1,6/26/2025,03:40:00 pm,0,2025-06-26 15:40:00,9.2642,7.582,0.0
KHF-1,6/26/2025,03:50:00 pm,0,2025-06-26 15:50:00,9.2633,7.582,0.0
KHF-1,6/26/2025,04:00:00 pm,0,2025-06-26 16:00:00,9.2621,7.582,0.0
KHF-1,6/26/2025,04:10:00 pm,0,2025-06-26 16:10:00,9.2615,7.582,0.0001000000000000334
KHF-1,6/26/2025,04:20:00 pm,0,2025-06-26 16:20:00,9.2613,7.583,0.0001000000000000334
KHF-1,6/26/2025,04:30:00 pm,0,2025-06-26 16:30:00,9.2611,7.582,0.0001000000000000334
KHF-1,6/26/2025,04:40:00 pm,0,2025-06-26 16:40:00,9.2608,7.583,0.0001000000000000334
KHF-1,6/26/2025,04:50:00 pm,0,2025-06-26 16:50:00,9.2605,7.582,0.0
KHF-1,6/26/2025,05:00:00 pm,0,2025-06-26 17:00:00,9.2602,7.582,0.0001000000000000334
KHF-1,6/26/2025,05:10:00 pm,0,2025-06-26 17:10:00,9.2598,7.583,0.0
KHF-1,6/26/2025,05:20:00 pm,0,2025-06-26 17:20:00,9.2591,7.583,0.0001000000000000334
KHF-1,6/26/2025,05:30:00 pm,0,2025-06-26 17:30:00,9.259,7.582,0.00030000000000001136
KHF-1,6/26/2025,05:40:00 pm,0,2025-06-26 17:40:00,9.259,7.585,0.0001000000000000334
KHF-1,6/26/2025,05:50:00 pm,0,2025-06-26 17:50:00,9.258,7.584,0.0
KHF-1,6/26/2025,06:00:00 pm,0,2025-06-26 18:00:00,9.258,7.584,0.0
KHF-1,6/26/2025,06:10:00 pm,0,2025-06-26 18:10:00,9.2574,7.584,0.0
KHF-1,6/26/2025,06:20:00 pm,0,2025-06-26 18:20:00,9.2569,7.584,0.0001000000000000334
KHF-1,6/26/2025,06:30:00 pm,0,2025-06-26 18:30:00,9.2569,7.585,0.0
KHF-1,6/26/2025,06:40:00 pm,0,2025-06-26 18:40:00,9.2571,7.585,0.0001000000000000334
KHF-1,6/26/2025,06:50:00 pm,0,2025-06-26 18:50:00,9.2572,7.584,0.00019999999999997797
KHF-1,6/26/2025,07:00:00 pm,0,2025-06-26 19:00:00,9.2567,7.582,0.0001000000000000334
KHF-1,6/26/2025,07:10:00 pm,0,2025-06-26 19:10:00,9.2568,7.583,0.00030000000000001136
KHF-1,6/26/2025,07:20:00 pm,0,2025-06-26 19:20:00,9.2568,7.586,0.0002000000000000668
KHF-1,6/26/2025,07:30:00 pm,0,2025-06-26 19:30:00,9.2569,7.584,0.0001000000000000334
KHF-1,6/26/2025,07:40:00 pm,0,2025-06-26 19:40:00,9.2572,7.585,0.0
KHF-1,6/26/2025,07:50:00 pm,0,2025-06-26 19:50:00,9.2574,7.585,0.0001000000000000334
KHF-1,6/26/2025,08:00:00 pm,0,2025-06-26 20:00:00,9.2576,7.584,0.0002000000000000668
KHF-1,6/26/2025,08:10:00 pm,0,2025-06-26 20:10:00,9.2576,7.586,0.0
KHF-1,6/26/2025,08:20:00 pm,0,2025-06-26 20:20:00,9.2576,7.586,0.0
KHF-1,6/26/2025,08:30:00 pm,0,2025-06-26 20:30:00,9.2577,7.586,0.0002000000000000668
KHF-1,6/26/2025,08:40:00 pm,0,2025-06-26 20:40:00,9.258,7.584,0.0001000000000000334
KHF-1,6/26/2025,08:50:00 pm,0,2025-06-26 20:50:00,9.2585,7.585,0.0001000000000000334
KHF-1,6/26/2025,09:00:00 pm,0,2025-06-26 21:00:00,9.2591,7.586,0.0001000000000000334
KHF-1,6/26/2025,09:10:00 pm,0,2025-06-26 21:10:00,9.259,7.585,0.0
KHF-1,6/26/2025,09:20:00 pm,0,2025-06-26 21:20:00,9.2597,7.585,0.00019999999999997797
KHF-1,6/26/2025,09:30:00 pm,0,2025-06-26 21:30:00,9.2598,7.583,0.00019999999999997797
KHF-1,6/26/2025,09:40:00 pm,0,2025-06-26 21:40:00,9.2605,7.585,0.0
KHF-1,6/26/2025,09:50:00 pm,0,2025-06-26 21:50:00,9.2611,7.585,0.0001000000000000334
KHF-1,6/26/2025,10:00:00 pm,0,2025-06-26 22:00:00,9.2612,7.584,0.0
KHF-1,6/26/2025,10:10:00 pm,0,2025-06-26 22:10:00,9.2612,7.584,0.0002000000000000668
KHF-1,6/26/2025,10:20:00 pm,0,2025-06-26 22:20:00,9.2615,7.586,0.0001000000000000334
KHF-1,6/26/2025,10:30:00 pm,0,2025-06-26 22:30:00,9.2618,7.585,0.0001000000000000334
KHF-1,6/26/2025,10:40:00 pm,0,2025-06-26 22:40:00,9.2621,7.586,0.0
KHF-1,6/26/2025,10:50:00 pm,0,2025-06-26 22:50:00,9.2622,7.586,0.0002000000000000668
KHF-1,6/26/2025,11:00:00 pm,0,2025-06-26 23:00:00,9.2618,7.584,0.0002000000000000668
KHF-1,6/26/2025,11:10:00 pm,0,2025-06-26 23:10:00,9.2625,7.586,0.0001000000000000334
KHF-1,6/26/2025,11:20:00 pm,0,2025-06-26 23:20:00,9.2624,7.585,0.00019999999999997797
KHF-1,6/26/2025,11:30:00 pm,0,2025-06-26 23:30:00,9.2632,7.587,0.0
KHF-1,6/26/2025,11:40:00 pm,0,2025-06-26 23:40:00,9.2639,7.587,0.0001000000000000334
KHF-1,6/26/2025,11:50:00 pm,0,2025-06-26 23:50:00,9.2642,7.588,0.0001000000000000334
KHF-1,6/27/2025,12:00:00 am,0,2025-06-27 00:00:00,9.2644,7.587,9.999999999994457e-05
KHF-1,6/27/2025,12:10:00 am,0,2025-06-27 00:10:00,9.2653,7.586,0.0
KHF-1,6/27/2025,12:20:00 am,0,2025-06-27 00:20:00,9.2658,7.586,9.999999999994457e-05
KHF-1,6/27/2025,12:30:00 am,0,2025-06-27 00:30:00,9.2673,7.587,9.999999999994457e-05
KHF-1,6/27/2025,12:40:00 am,0,2025-06-27 00:40:00,9.2668,7.586,9.999999999994457e-05
KHF-1,6/27/2025,12:50:00 am,0,2025-06-27 00:50:00,9.2667,7.587,0.0001000000000000334
KHF-1,6/27/2025,01:00:00 am,0,2025-06-27 01:00:00,9.2666,7.588,0.00019999999999997797
KHF-1,6/27/2025,01:10:00 am,0,2025-06-27 01:10:00,9.2666,7.586,0.00019999999999997797
KHF-1,6/27/2025,01:20:00 am,0,2025-06-27 01:20:00,9.267,7.588,0.0001000000000000334
KHF-1,6/27/2025,01:30:00 am,0,2025-06-27 01:30:00,9.2673,7.589,0.0001000000000000334
KHF-1,6/27/2025,01:40:00 am,0,2025-06-27 01:40:00,9.2676,7.588,0.0001000000000000334
KHF-1,6/27/2025,01:50:00 am,0,2025-06-27 01:50:00,9.2673,7.587,0.0002000000000000668
KHF-1,6/27/2025,02:00:00 am,0,2025-06-27 02:00:00,9.267,7.589,0.0001000000000000334
KHF-1,6/27/2025,02:10:00 am,0,2025-06-27 02:10:00,9.2667,7.588,0.0
KHF-1,6/27/2025,02:20:00 am,0,2025-06-27 02:20:00,9.2666,7.588,0.00019999999999997797
KHF-1,6/27/2025,02:30:00 am,0,2025-06-27 02:30:00,9.2661,7.59,0.00019999999999997797
KHF-1,6/27/2025,02:40:00 am,0,2025-06-27 02:40:00,9.2661,7.588,0.0001000000000000334
KHF-1,6/27/2025,02:50:00 am,0,2025-06-27 02:50:00,9.2661,7.589,0.0
KHF-1,6/27/2025,03:00:00 am,0,2025-06-27 03:00:00,9.2659,7.589,0.0001000000000000334
KHF-1,6/27/2025,03:10:00 am,0,2025-06-27 03:10:00,9.2661,7.588,0.00019999999999997797
KHF-1,6/27/2025,03:20:00 am,0,2025-06-27 03:20:00,9.2662,7.59,0.0
KHF-1,6/27/2025,03:30:00 am,0,2025-06-27 03:30:00,9.2662,7.59,0.0
KHF-1,6/27/2025,03:40:00 am,0,2025-06-27 03:40:00,9.2664,7.59,0.00019999999999997797
KHF-1,6/27/2025,03:50:00 am,0,2025-06-27 03:50:00,9.2664,7.588,0.0001000000000000334
KHF-1,6/27/2025,04:00:00 am,0,2025-06-27 04:00:00,9.2663,7.589,0.00019999999999997797
KHF-1,6/27/2025,04:10:00 am,0,2025-06-27 04:10:00,9.266,7.591,0.00019999999999997797
KHF-1,6/27/2025,04:20:00 am,0,2025-06-27 04:20:00,9.266,7.589,0.0
KHF-1,6/27/2025,04:30:00 am,0,2025-06-27 04:30:00,9.2663,7.589,0.0
KHF-1,6/27/2025,04:40:00 am,0,2025-06-27 04:40:00,9.2668,7.589,0.00029999999999992256
KHF-1,6/27/2025,04:50:00 am,0,2025-06-27 04:50:00,9.2683,7.592,0.00019999999999997797
KHF-1,6/27/2025,05:00:00 am,0,2025-06-27 05:00:00,9.2687,7.59,0.0
KHF-1,6/27/2025,05:10:00 am,0,2025-06-27 05:10:00,9.2692,7.59,9.999999999994457e-05
KHF-1,6/27/2025,05:20:00 am,0,2025-06-27 05:20:00,9.2692,7.589,9.999999999994457e-05
KHF-1,6/27/2025,05:30:00 am,0,2025-06-27 05:30:00,9.2697,7.59,0.0
KHF-1,6/27/2025,05:40:00 am,0,2025-06-27 05:40:00,9.27,7.59,9.999999999994457e-05
KHF-1,6/27/2025,05:50:00 am,0,2025-06-27 05:50:00,9.2702,7.589,9.999999999994457e-05
KHF-1,6/27/2025,06:00:00 am,0,2025-06-27 06:00:00,9.2705,7.59,0.00019999999999997797
KHF-1,6/27/2025,06:10:00 am,0,2025-06-27 06:10:00,9.2705,7.592,0.0001000000000000334
KHF-1,6/27/2025,06:20:00 am,0,2025-06-27 06:20:00,9.2707,7.593,0.00019999999999997797
KHF-1,6/27/2025,06:30:00 am,0,2025-06-27 06:30:00,9.2709,7.591,0.0
KHF-1,6/27/2025,06:40:00 am,0,2025-06-27 06:40:00,9.2713,7.591,9.999999999994457e-05
KHF-1,6/27/2025,06:50:00 am,0,2025-06-27 06:50:00,9.2713,7.592,9.999999999994457e-05
KHF-1,6/27/2025,07:00:00 am,0,2025-06-27 07:00:00,9.271,7.591,9.999999999994457e-05
KHF-1,6/27/2025,07:10:00 am,0,2025-06-27 07:10:00,9.2714,7.592,0.0
KHF-1,6/27/2025,07:20:00 am,0,2025-06-27 07:20:00,9.2715,7.592,0.0
KHF-1,6/27/2025,07:30:00 am,0,2025-06-27 07:30:00,9.2716,7.592,0.0001000000000000334
KHF-1,6/27/2025,07:40:00 am,0,2025-06-27 07:40:00,9.2718,7.593,0.0
KHF-1,6/27/2025,07:50:00 am,0,2025-06-27 07:50:00,9.272,7.593,0.0001000000000000334
KHF-1,6/27/2025,08:00:00 am,0,2025-06-27 08:00:00,9.2721,7.592,0.0001000000000000334
KHF-1,6/27/2025,08:10:00 am,0,2025-06-27 08:10:00,9.272,7.593,0.0001000000000000334
KHF-1,6/27/2025,08:20:00 am,0,2025-06-27 08:20:00,9.2725,7.594,0.00019999999999997797
KHF-1,6/27/2025,08:30:00 am,0,2025-06-27 08:30:00,9.2723,7.596,0.00030000000000001136
KHF-1,6/27/2025,08:40:00 am,0,2025-06-27 08:40:00,9.2722,7.593,0.0001000000000000334
KHF-1,6/27/2025,08:50:00 am,0,2025-06-27 08:50:00,9.272,7.594,0.0002000000000000668
KHF-1,6/27/2025,09:00:00 am,0,2025-06-27 09:00:00,9.2719,7.592,0.0002000000000000668
KHF-1,6/27/2025,09:10:00 am,0,2025-06-27 09:10:00,9.2717,7.594,0.0
KHF-1,6/27/2025,09:20:00 am,0,2025-06-27 09:20:00,9.2719,7.594,9.999999999994457e-05
KHF-1,6/27/2025,09:30:00 am,0,2025-06-27 09:30:00,9.2721,7.595,9.999999999994457e-05
KHF-1,6/27/2025,09:40:00 am,0,2025-06-27 09:40:00,9.2722,7.594,0.00019999999999997797
KHF-1,6/27/2025,09:50:00 am,0,2025-06-27 09:50:00,9.2718,7.596,0.0001000000000000334
KHF-1,6/27/2025,10:00:00 am,0,2025-06-27 10:00:00,9.2715,7.595,9.999999999994457e-05
KHF-1,6/27/2025,10:10:00 am,0,2025-06-27 10:10:00,9.2712,7.594,0.00030000000000001136
KHF-1,6/27/2025,10:20:00 am,0,2025-06-27 10:20:00,9.2713,7.597,0.0002000000000000668
KHF-1,6/27/2025,10:30:00 am,0,2025-06-27 10:30:00,9.271,7.595,0.0
KHF-1,6/27/2025,10:40:00 am,0,2025-06-27 10:40:00,9.2708,7.595,0.0
KHF-1,6/27/2025,10:50:00 am,0,2025-06-27 10:50:00,9.2704,7.595,0.0
KHF-1,6/27/2025,11:00:00 am,0,2025-06-27 11:00:00,9.2698,7.595,0.0
KHF-1,6/27/2025,11:10:00 am,0,2025-06-27 11:10:00,9.2699,7.595,0.0002000000000000668
KHF-1,6/27/2025,11:20:00 am,0,2025-06-27 11:20:00,9.2695,7.597,9.999999999994457e-05
KHF-1,6/27/2025,11:30:00 am,0,2025-06-27 11:30:00,9.2691,7.598,9.999999999994457e-05
KHF-1,6/27/2025,11:40:00 am,0,2025-06-27 11:40:00,9.2684,7.597,9.999999999994457e-05
KHF-1,6/27/2025,11:50:00 am,0,2025-06-27 11:50:00,9.2682,7.598,9.999999999994457e-05
KHF-1,6/27/2025,12:00:00 pm,0,2025-06-27 12:00:00,9.2678,7.597,0.00019999999999997797
KHF-1,6/27/2025,12:10:00 pm,0,2025-06-27 12:10:00,9.2675,7.599,9.999999999994457e-05
KHF-1,6/27/2025,12:20:00 pm,0,2025-06-27 12:20:00,9.267,7.6,0.00019999999999997797
KHF-1,6/27/2025,12:30:00 pm,0,2025-06-27 12:30:00,9.2672,7.598,0.0001000000000000334
KHF-1,6/27/2025,12:40:00 pm,0,2025-06-27 12:40:00,9.2666,7.599,9.999999999994457e-05
KHF-1,6/27/2025,12:50:00 pm,0,2025-06-27 12:50:00,9.2662,7.6,0.0
KHF-1,6/27/2025,01:00:00 pm,0,2025-06-27 13:00:00,9.266,7.6,0.0001000000000000334
KHF-1,6/27/2025,01:10:00 pm,0,2025-06-27 13:10:00,9.2658,7.601,0.0001000000000000334
KHF-1,6/27/2025,01:20:00 pm,0,2025-06-27 13:20:00,9.2653,7.6,0.0001000000000000334
KHF-1,6/27/2025,01:30:00 pm,0,2025-06-27 13:30:00,9.2649,7.601,0.0001000000000000334
KHF-1,6/27/2025,01:40:00 pm,0,2025-06-27 13:40:00,9.2649,7.6,0.0
KHF-1,6/27/2025,01:50:00 pm,0,2025-06-27 13:50:00,9.2643,7.6,9.999999999994457e-05
KHF-1,6/27/2025,02:00:00 pm,0,2025-06-27 14:00:00,9.2642,7.599,9.999999999994457e-05
KHF-1,6/27/2025,02:10:00 pm,0,2025-06-27 14:10:00,9.2635,7.6,0.0002000000000000668
KHF-1,6/27/2025,02:20:00 pm,0,2025-06-27 14:20:00,9.2632,7.602,9.999999999994457e-05
KHF-1,6/27/2025,02:30:00 pm,0,2025-06-27 14:30:00,9.2627,7.603,9.999999999994457e-05
KHF-1,6/27/2025,02:40:00 pm,0,2025-06-27 14:40:00,9.262,7.602,0.0
KHF-1,6/27/2025,02:50:00 pm,0,2025-06-27 14:50:00,9.2614,7.602,0.0001000000000000334
KHF-1,6/27/2025,03:00:00 pm,0,2025-06-27 15:00:00,9.2607,7.601,0.0001000000000000334
KHF-1,6/27/2025,03:10:00 pm,0,2025-06-27 15:10:00,9.2598,7.602,0.0
KHF-1,6/27/2025,03:20:00 pm,0,2025-06-27 15:20:00,9.2589,7.602,9.999999999994457e-05
KHF-1,6/27/2025,03:30:00 pm,0,2025-06-27 15:30:00,9.2582,7.603,9.999999999994457e-05
KHF-1,6/27/2025,03:40:00 pm,0,2025-06-27 15:40:00,9.2569,7.602,9.999999999994457e-05
KHF-1,6/27/2025,03:50:00 pm,0,2025-06-27 15:50:00,9.256,7.603,0.0002000000000000668
KHF-1,6/27/2025,04:00:00 pm,0,2025-06-27 16:00:00,9.2558,7.605,0.00030000000000001136
KHF-1,6/27/2025,04:10:00 pm,0,2025-06-27 16:10:00,9.2557,7.602,0.00019999999999997797
KHF-1,6/27/2025,04:20:00 pm,0,2025-06-27 16:20:00,9.2557,7.604,0.0
KHF-1,6/27/2025,04:30:00 pm,0,2025-06-27 16:30:00,9.2553,7.604,0.0001000000000000334
KHF-1,6/27/2025,04:40:00 pm,0,2025-06-27 16:40:00,9.2551,7.603,0.0002000000000000668
KHF-1,6/27/2025,04:50:00 pm,0,2025-06-27 16:50:00,9.2542,7.605,0.0001000000000000334
KHF-1,6/27/2025,05:00:00 pm,0,2025-06-27 17:00:00,9.2538,7.604,0.00019999999999997797
KHF-1,6/27/2025,05:10:00 pm,0,2025-06-27 17:10:00,9.2532,7.606,0.00019999999999997797
KHF-1,6/27/2025,05:20:00 pm,0,2025-06-27 17:20:00,9.2531,7.604,0.0001000000000000334
KHF-1,6/27/2025,05:30:00 pm,0,2025-06-27 17:30:00,9.2529,7.605,0.0001000000000000334
KHF-1,6/27/2025,05:40:00 pm,0,2025-06-27 17:40:00,9.2531,7.604,0.0
KHF-1,6/27/2025,05:50:00 pm,0,2025-06-27 17:50:00,9.2531,7.604,0.0001000000000000334
KHF-1,6/27/2025,06:00:00 pm,0,2025-06-27 18:00:00,9.253,7.603,0.0001000000000000334
KHF-1,6/27/2025,06:10:00 pm,0,2025-06-27 18:10:00,9.2529,7.604,0.0001000000000000334
KHF-1,6/27/2025,06:20:00 pm,0,2025-06-27 18:20:00,9.2528,7.605,0.0
KHF-1,6/27/2025,06:30:00 pm,0,2025-06-27 18:30:00,9.2531,7.605,0.0
KHF-1,6/27/2025,06:40:00 pm,0,2025-06-27 18:40:00,9.2532,7.605,0.0
KHF-1,6/27/2025,06:50:00 pm,0,2025-06-27 18:50:00,9.2531,7.605,0.0
KHF-1,6/27/2025,07:00:00 pm,0,2025-06-27 19:00:00,9.2532,7.605,9.999999999994457e-05
KHF-1,6/27/2025,07:10:00 pm,0,2025-06-27 19:10:00,9.2534,7.606,9.999999999994457e-05
KHF-1,6/27/2025,07:20:00 pm,0,2025-06-27 19:20:00,9.2534,7.605,0.0
KHF-1,6/27/2025,07:30:00 pm,0,2025-06-27 19:30:00,9.2536,7.605,9.999999999994457e-05
KHF-1,6/27/2025,07:40:00 pm,0,2025-06-27 19:40:00,9.2536,7.606,0.0
KHF-1,6/27/2025,07:50:00 pm,0,2025-06-27 19:50:00,9.2537,7.606,0.0
KHF-1,6/27/2025,08:00:00 pm,0,2025-06-27 20:00:00,9.2535,7.606,0.00019999999999997797
KHF-1,6/27/2025,08:10:00 pm,0,2025-06-27 20:10:00,9.2536,7.604,0.0001000000000000334
KHF-1,6/27/2025,08:20:00 pm,0,2025-06-27 20:20:00,9.2539,7.605,0.0001000000000000334
KHF-1,6/27/2025,08:30:00 pm,0,2025-06-27 20:30:00,9.2542,7.604,0.0001000000000000334
KHF-1,6/27/2025,08:40:00 pm,0,2025-06-27 20:40:00,9.2542,7.605,0.00019999999999997797
KHF-1,6/27/2025,08:50:00 pm,0,2025-06-27 20:50:00,9.2544,7.607,0.0
KHF-1,6/27/2025,09:00:00 pm,0,2025-06-27 21:00:00,9.2547,7.607,0.0001000000000000334
KHF-1,6/27/2025,09:10:00 pm,0,2025-06-27 21:10:00,9.2555,7.606,9.999999999994457e-05
KHF-1,6/27/2025,09:20:00 pm,0,2025-06-27 21:20:00,9.2557,7.605,0.00029999999999992256
KHF-1,6/27/2025,09:30:00 pm,0,2025-06-27 21:30:00,9.2569,7.608,9.999999999994457e-05
KHF-1,6/27/2025,09:40:00 pm,0,2025-06-27 21:40:00,9.2579,7.607,0.0001000000000000334
KHF-1,6/27/2025,09:50:00 pm,0,2025-06-27 21:50:00,9.2588,7.606,0.0001000000000000334
KHF-1,6/27/2025,10:00:00 pm,0,2025-06-27 22:00:00,9.2597,7.607,0.0
KHF-1,6/27/2025,10:10:00 pm,0,2025-06-27 22:10:00,9.26,7.607,0.0
KHF-1,6/27/2025,10:20:00 pm,0,2025-06-27 22:20:00,9.2602,7.607,0.0001000000000000334
KHF-1,6/27/2025,10:30:00 pm,0,2025-06-27 22:30:00,9.2601,7.606,0.0
KHF-1,6/27/2025,10:40:00 pm,0,2025-06-27 22:40:00,9.2599,7.606,9.999999999994457e-05
KHF-1,6/27/2025,10:50:00 pm,0,2025-06-27 22:50:00,9.26,7.605,0.00029999999999992256
KHF-1,6/27/2025,11:00:00 pm,0,2025-06-27 23:00:00,9.2609,7.608,0.00019999999999997797
KHF-1,6/27/2025,11:10:00 pm,0,2025-06-27 23:10:00,9.2612,7.606,0.0001000000000000334
KHF-1,6/27/2025,11:20:00 pm,0,2025-06-27 23:20:00,9.261,7.607,0.0
KHF-1,6/27/2025,11:30:00 pm,0,2025-06-27 23:30:00,9.2612,7.607,9.999999999994457e-05
KHF-1,6/27/2025,11:40:00 pm,0,2025-06-27 23:40:00,9.2611,7.608,0.0
KHF-1,6/27/2025,11:50:00 pm,0,2025-06-27 23:50:00,9.2611,7.608,0.00019999999999997797
KHF-1,6/28/2025,12:00:00 am,0,2025-06-28 00:00:00,9.2613,7.606,0.00030000000000001136
KHF-1,6/28/2025,12:10:00 am,0,2025-06-28 00:10:00,9.2615,7.609,0.00019999999999997797
KHF-1,6/28/2025,12:20:00 am,0,2025-06-28 00:20:00,9.262,7.607,0.00019999999999997797
KHF-1,6/28/2025,12:30:00 am,0,2025-06-28 00:30:00,9.2615,7.605,0.0
KHF-1,6/28/2025,12:40:00 am,0,2025-06-28 00:40:00,9.2617,7.605,0.00039999999999995595
KHF-1,6/28/2025,12:50:00 am,0,2025-06-28 00:50:00,9.2617,7.609,0.0001000000000000334
KHF-1,6/28/2025,01:00:00 am,0,2025-06-28 01:00:00,9.262,7.608,9.999999999994457e-05
KHF-1,6/28/2025,01:10:00 am,0,2025-06-28 01:10:00,9.2622,7.607,9.999999999994457e-05
KHF-1,6/28/2025,01:20:00 am,0,2025-06-28 01:20:00,9.2619,7.608,9.999999999994457e-05
KHF-1,6/28/2025,01:30:00 am,0,2025-06-28 01:30:00,9.2622,7.607,9.999999999994457e-05
KHF-1,6/28/2025,01:40:00 am,0,2025-06-28 01:40:00,9.2625,7.608,0.00019999999999997797
KHF-1,6/28/2025,01:50:00 am,0,2025-06-28 01:50:00,9.2625,7.606,0.0001000000000000334
KHF-1,6/28/2025,02:00:00 am,0,2025-06-28 02:00:00,9.2625,7.607,9.999999999994457e-05
KHF-1,6/28/2025,02:10:00 am,0,2025-06-28 02:10:00,9.2625,7.608,0.00019999999999997797
KHF-1,6/28/2025,02:20:00 am,0,2025-06-28 02:20:00,9.2626,7.606,0.00019999999999997797
KHF-1,6/28/2025,02:30:00 am,0,2025-06-28 02:30:00,9.2627,7.608,0.0002000000000000668
KHF-1,6/28/2025,02:40:00 am,0,2025-06-28 02:40:00,9.2629,7.61,0.00040000000000004474
KHF-1,6/28/2025,02:50:00 am,0,2025-06-28 02:50:00,9.2627,7.606,0.0001000000000000334
KHF-1,6/28/2025,03:00:00 am,0,2025-06-28 03:00:00,9.2632,7.607,9.999999999994457e-05
KHF-1,6/28/2025,03:10:00 am,0,2025-06-28 03:10:00,9.264,7.608,0.0002000000000000668
KHF-1,6/28/2025,03:20:00 am,0,2025-06-28 03:20:00,9.2639,7.61,0.00040000000000004474
KHF-1,6/28/2025,03:30:00 am,0,2025-06-28 03:30:00,9.2638,7.606,0.00030000000000001136
KHF-1,6/28/2025,03:40:00 am,0,2025-06-28 03:40:00,9.264,7.609,0.0001000000000000334
KHF-1,6/28/2025,03:50:00 am,0,2025-06-28 03:50:00,9.2642,7.608,0.0
KHF-1,6/28/2025,04:00:00 am,0,2025-06-28 04:00:00,9.2643,7.608,0.0001000000000000334
KHF-1,6/28/2025,04:10:00 am,0,2025-06-28 04:10:00,9.2644,7.609,0.0001000000000000334
KHF-1,6/28/2025,04:20:00 am,0,2025-06-28 04:20:00,9.2647,7.608,0.0
KHF-1,6/28/2025,04:30:00 am,0,2025-06-28 04:30:00,9.265,7.608,0.0001000000000000334
KHF-1,6/28/2025,04:40:00 am,0,2025-06-28 04:40:00,9.265,7.609,0.0001000000000000334
KHF-1,6/28/2025,04:50:00 am,0,2025-06-28 04:50:00,9.2653,7.608,0.00030000000000001136
KHF-1,6/28/2025,05:00:00 am,0,2025-06-28 05:00:00,9.2657,7.611,0.0
KHF-1,6/28/2025,05:10:00 am,0,2025-06-28 05:10:00,9.2663,7.611,0.00019999999999997797
KHF-1,6/28/2025,05:20:00 am,0,2025-06-28 05:20:00,9.2668,7.609,0.00019999999999997797
KHF-1,6/28/2025,05:30:00 am,0,2025-06-28 05:30:00,9.2674,7.611,0.00019999999999997797
KHF-1,6/28/2025,05:40:00 am,0,2025-06-28 05:40:00,9.2676,7.609,0.0001000000000000334
KHF-1,6/28/2025,05:50:00 am,0,2025-06-28 05:50:00,9.2685,7.61,9.999999999994457e-05
KHF-1,6/28/2025,06:00:00 am,0,2025-06-28 06:00:00,9.2692,7.611,0.00030000000000001136
KHF-1,6/28/2025,06:10:00 am,0,2025-06-28 06:10:00,9.2698,7.608,0.00030000000000001136
KHF-1,6/28/2025,06:20:00 am,0,2025-06-28 06:20:00,9.2704,7.611,9.999999999994457e-05
KHF-1,6/28/2025,06:30:00 am,0,2025-06-28 06:30:00,9.2709,7.61,0.0001000000000000334
KHF-1,6/28/2025,06:40:00 am,0,2025-06-28 06:40:00,9.2714,7.609,0.0
KHF-1,6/28/2025,06:50:00 am,0,2025-06-28 06:50:00,9.2716,7.609,0.0
KHF-1,6/28/2025,07:00:00 am,0,2025-06-28 07:00:00,9.2719,7.609,0.00019999999999997797
KHF-1,6/28/2025,07:10:00 am,0,2025-06-28 07:10:00,9.2723,7.611,0.0
KHF-1,6/28/2025,07:20:00 am,0,2025-06-28 07:20:00,9.2728,7.611,0.0
KHF-1,6/28/2025,07:30:00 am,0,2025-06-28 07:30:00,9.2732,7.611,0.0
KHF-1,6/28/2025,07:40:00 am,0,2025-06-28 07:40:00,9.2739,7.611,0.00019999999999997797
KHF-1,6/28/2025,07:50:00 am,0,2025-06-28 07:50:00,9.2745,7.609,0.00019999999999997797
KHF-1,6/28/2025,08:00:00 am,0,2025-06-28 08:00:00,9.2754,7.611,0.0
KHF-1,6/28/2025,08:10:00 am,0,2025-06-28 08:10:00,9.2758,7.611,9.999999999994457e-05
KHF-1,6/28/2025,08:20:00 am,0,2025-06-28 08:20:00,9.2765,7.61,0.00030000000000001136
KHF-1,6/28/2025,08:30:00 am,0,2025-06-28 08:30:00,9.2768,7.613,0.0001000000000000334
KHF-1,6/28/2025,08:40:00 am,0,2025-06-28 08:40:00,9.2772,7.612,0.00019999999999997797
KHF-1,6/28/2025,08:50:00 am,0,2025-06-28 08:50:00,9.2773,7.614,0.00019999999999997797
KHF-1,6/28/2025,09:00:00 am,0,2025-06-28 09:00:00,9.2772,7.612,0.0
KHF-1,6/28/2025,09:10:00 am,0,2025-06-28 09:10:00,9.2773,7.612,0.00019999999999997797
KHF-1,6/28/2025,09:20:00 am,0,2025-06-28 09:20:00,9.2766,7.61,0.00039999999999995595
KHF-1,6/28/2025,09:30:00 am,0,2025-06-28 09:30:00,9.2763,7.614,0.00019999999999997797
KHF-1,6/28/2025,09:40:00 am,0,2025-06-28 09:40:00,9.2762,7.612,0.0001000000000000334
KHF-1,6/28/2025,09:50:00 am,0,2025-06-28 09:50:00,9.2758,7.613,0.0
KHF-1,6/28/2025,10:00:00 am,0,2025-06-28 10:00:00,9.2757,7.613,9.999999999994457e-05
KHF-1,6/28/2025,10:10:00 am,0,2025-06-28 10:10:00,9.2754,7.614,0.0
KHF-1,6/28/2025,10:20:00 am,0,2025-06-28 10:20:00,9.2749,7.614,0.0
KHF-1,6/28/2025,10:30:00 am,0,2025-06-28 10:30:00,9.2742,7.614,0.0
KHF-1,6/28/2025,10:40:00 am,0,2025-06-28 10:40:00,9.2733,7.614,0.0
KHF-1,6/28/2025,10:50:00 am,0,2025-06-28 10:50:00,9.2722,7.614,0.0001000000000000334
KHF-1,6/28/2025,11:00:00 am,0,2025-06-28 11:00:00,9.2713,7.615,0.00019999999999997797
KHF-1,6/28/2025,11:10:00 am,0,2025-06-28 11:10:00,9.2705,7.617,0.00019999999999997797
KHF-1,6/28/2025,11:20:00 am,0,2025-06-28 11:20:00,9.2696,7.615,0.0
KHF-1,6/28/2025,11:30:00 am,0,2025-06-28 11:30:00,9.269,7.615,0.0
KHF-1,6/28/2025,11:40:00 am,0,2025-06-28 11:40:00,9.2684,7.615,0.00019999999999997797
KHF-1,6/28/2025,11:50:00 am,0,2025-06-28 11:50:00,9.2676,7.617,0.0001000000000000334
KHF-1,6/28/2025,12:00:00 pm,0,2025-06-28 12:00:00,9.2671,7.616,0.0
KHF-1,6/28/2025,12:10:00 pm,0,2025-06-28 12:10:00,9.2656,7.616,0.0
KHF-1,6/28/2025,12:20:00 pm,0,2025-06-28 12:20:00,9.2651,7.616,0.0001000000000000334
KHF-1,6/28/2025,12:30:00 pm,0,2025-06-28 12:30:00,9.2642,7.617,0.0001000000000000334
KHF-1,6/28/2025,12:40:00 pm,0,2025-06-28 12:40:00,9.2634,7.618,9.999999999994457e-05
KHF-1,6/28/2025,12:50:00 pm,0,2025-06-28 12:50:00,9.263,7.619,9.999999999994457e-05
KHF-1,6/28/2025,01:00:00 pm,0,2025-06-28 13:00:00,9.262,7.618,0.0001000000000000334
KHF-1,6/28/2025,01:10:00 pm,0,2025-06-28 13:10:00,9.2612,7.617,0.0001000000000000334
KHF-1,6/28/2025,01:20:00 pm,0,2025-06-28 13:20:00,9.2603,7.618,0.0
KHF-1,6/28/2025,01:30:00 pm,0,2025-06-28 13:30:00,9.2596,7.618,0.0
KHF-1,6/28/2025,01:40:00 pm,0,2025-06-28 13:40:00,9.2586,7.618,9.999999999994457e-05
KHF-1,6/28/2025,01:50:00 pm,0,2025-06-28 13:50:00,9.2583,7.619,0.0001000000000000334
KHF-1,6/28/2025,02:00:00 pm,0,2025-06-28 14:00:00,9.2579,7.62,0.0001000000000000334
KHF-1,6/28/2025,02:10:00 pm,0,2025-06-28 14:10:00,9.2577,7.619,0.0001000000000000334
KHF-1,6/28/2025,02:20:00 pm,0,2025-06-28 14:20:00,9.2569,7.62,0.0
KHF-1,6/28/2025,02:30:00 pm,0,2025-06-28 14:30:00,9.2561,7.62,0.00019999999999997797
KHF-1,6/28/2025,02:40:00 pm,0,2025-06-28 14:40:00,9.2561,7.622,0.00019999999999997797
KHF-1,6/28/2025,02:50:00 pm,0,2025-06-28 14:50:00,9.2561,7.62,0.00019999999999997797
KHF-1,6/28/2025,03:00:00 pm,0,2025-06-28 15:00:00,9.255,7.622,0.0001000000000000334
KHF-1,6/28/2025,03:10:00 pm,0,2025-06-28 15:10:00,9.2549,7.623,0.00019999999999997797
KHF-1,6/28/2025,03:20:00 pm,0,2025-06-28 15:20:00,9.2551,7.621,0.0
KHF-1,6/28/2025,03:30:00 pm,0,2025-06-28 15:30:00,9.2544,7.621,9.999999999994457e-05
KHF-1,6/28/2025,03:40:00 pm,0,2025-06-28 15:40:00,9.2542,7.622,0.0001000000000000334
KHF-1,6/28/2025,03:50:00 pm,0,2025-06-28 15:50:00,9.2537,7.623,0.0001000000000000334
KHF-1,6/28/2025,04:00:00 pm,0,2025-06-28 16:00:00,9.2534,7.622,0.0001000000000000334
KHF-1,6/28/2025,04:10:00 pm,0,2025-06-28 16:10:00,9.2528,7.623,0.0001000000000000334
KHF-1,6/28/2025,04:20:00 pm,0,2025-06-28 16:20:00,9.2524,7.622,0.00019999999999997797
KHF-1,6/28/2025,04:30:00 pm,0,2025-06-28 16:30:00,9.2519,7.624,9.999999999994457e-05
KHF-1,6/28/2025,04:40:00 pm,0,2025-06-28 16:40:00,9.252,7.623,0.00019999999999997797
KHF-1,6/28/2025,04:50:00 pm,0,2025-06-28 16:50:00,9.2515,7.625,0.0001000000000000334
KHF-1,6/28/2025,05:00:00 pm,0,2025-06-28 17:00:00,9.2513,7.626,0.00040000000000004474
KHF-1,6/28/2025,05:10:00 pm,0,2025-06-28 17:10:00,9.2509,7.622,0.00019999999999997797
KHF-1,6/28/2025,05:20:00 pm,0,2025-06-28 17:20:00,9.2507,7.624,0.0001000000000000334
KHF-1,6/28/2025,05:30:00 pm,0,2025-06-28 17:30:00,9.2508,7.625,0.00019999999999997797
KHF-1,6/28/2025,05:40:00 pm,0,2025-06-28 17:40:00,9.2503,7.623,0.00019999999999997797
KHF-1,6/28/2025,05:50:00 pm,0,2025-06-28 17:50:00,9.2498,7.621,0.00029999999999992256
KHF-1,6/28/2025,06:00:00 pm,0,2025-06-28 18:00:00,9.2496,7.624,9.999999999994457e-05
KHF-1,6/28/2025,06:10:00 pm,0,2025-06-28 18:10:00,9.2498,7.623,9.999999999994457e-05
KHF-1,6/28/2025,06:20:00 pm,0,2025-06-28 18:20:00,9.2494,7.624,0.0001000000000000334
KHF-1,6/28/2025,06:30:00 pm,0,2025-06-28 18:30:00,9.2494,7.625,0.0001000000000000334
KHF-1,6/28/2025,06:40:00 pm,0,2025-06-28 18:40:00,9.2493,7.624,0.0001000000000000334
KHF-1,6/28/2025,06:50:00 pm,0,2025-06-28 18:50:00,9.2494,7.625,0.0001000000000000334
KHF-1,6/28/2025,07:00:00 pm,0,2025-06-28 19:00:00,9.2494,7.624,9.999999999994457e-05
KHF-1,6/28/2025,07:10:00 pm,0,2025-06-28 19:10:00,9.2496,7.623,9.999999999994457e-05
KHF-1,6/28/2025,07:20:00 pm,0,2025-06-28 19:20:00,9.2495,7.624,0.0001000000000000334
KHF-1,6/28/2025,07:30:00 pm,0,2025-06-28 19:30:00,9.2498,7.625,0.0
KHF-1,6/28/2025,07:40:00 pm,0,2025-06-28 19:40:00,9.25,7.625,0.0
KHF-1,6/28/2025,07:50:00 pm,0,2025-06-28 19:50:00,9.25,7.625,0.00019999999999997797
KHF-1,6/28/2025,08:00:00 pm,0,2025-06-28 20:00:00,9.2502,7.627,0.0
KHF-1,6/28/2025,08:10:00 pm,0,2025-06-28 20:10:00,9.2501,7.627,9.999999999994457e-05
KHF-1,6/28/2025,08:20:00 pm,0,2025-06-28 20:20:00,9.25,7.626,0.0001000000000000334
KHF-1,6/28/2025,08:30:00 pm,0,2025-06-28 20:30:00,9.2501,7.625,0.00019999999999997797
KHF-1,6/28/2025,08:40:00 pm,0,2025-06-28 20:40:00,9.2504,7.627,0.0001000000000000334
KHF-1,6/28/2025,08:50:00 pm,0,2025-06-28 20:50:00,9.2508,7.628,0.0
KHF-1,6/28/2025,09:00:00 pm,0,2025-06-28 21:00:00,9.2511,7.628,0.0001000000000000334
KHF-1,6/28/2025,09:10:00 pm,0,2025-06-28 21:10:00,9.2515,7.627,0.0
KHF-1,6/28/2025,09:20:00 pm,0,2025-06-28 21:20:00,9.252,7.627,0.0001000000000000334
KHF-1,6/28/2025,09:30:00 pm,0,2025-06-28 21:30:00,9.252,7.628,0.0
KHF-1,6/28/2025,09:40:00 pm,0,2025-06-28 21:40:00,9.252,7.628,0.0001000000000000334
KHF-1,6/28/2025,09:50:00 pm,0,2025-06-28 21:50:00,9.2521,7.627,0.0001000000000000334
KHF-1,6/28/2025,10:00:00 pm,0,2025-06-28 22:00:00,9.2522,7.628,9.999999999994457e-05
KHF-1,6/28/2025,10:10:00 pm,0,2025-06-28 22:10:00,9.2525,7.629,9.999999999994457e-05
KHF-1,6/28/2025,10:20:00 pm,0,2025-06-28 22:20:00,9.2523,7.628,9.999999999994457e-05
KHF-1,6/28/2025,10:30:00 pm,0,2025-06-28 22:30:00,9.2522,7.629,0.00019999999999997797
KHF-1,6/28/2025,10:40:00 pm,0,2025-06-28 22:40:00,9.2522,7.627,9.999999999994457e-05
KHF-1,6/28/2025,10:50:00 pm,0,2025-06-28 22:50:00,9.2527,7.626,0.00019999999999997797
KHF-1,6/28/2025,11:00:00 pm,0,2025-06-28 23:00:00,9.2526,7.628,0.0001000000000000334
KHF-1,6/28/2025,11:10:00 pm,0,2025-06-28 23:10:00,9.2527,7.627,0.00030000000000001136
KHF-1,6/28/2025,11:20:00 pm,0,2025-06-28 23:20:00,9.2527,7.624,0.00030000000000001136
KHF-1,6/28/2025,11:30:00 pm,0,2025-06-28 23:30:00,9.2532,7.627,0.0001000000000000334
KHF-1,6/28/2025,11:40:00 pm,0,2025-06-28 23:40:00,9.2537,7.628,0.0
KHF-1,6/28/2025,11:50:00 pm,0,2025-06-28 23:50:00,9.2541,7.628,0.0001000000000000334
KHF-1,6/29/2025,12:00:00 am,0,2025-06-29 00:00:00,9.2539,7.627,0.0001000000000000334
KHF-1,6/29/2025,12:10:00 am,0,2025-06-29 00:10:00,9.2539,7.628,9.999999999994457e-05
KHF-1,6/29/2025,12:20:00 am,0,2025-06-29 00:20:00,9.254,7.629,9.999999999994457e-05
KHF-1,6/29/2025,12:30:00 am,0,2025-06-29 00:30:00,9.254,7.628,9.999999999994457e-05
KHF-1,6/29/2025,12:40:00 am,0,2025-06-29 00:40:00,9.254,7.629,9.999999999994457e-05
KHF-1,6/29/2025,12:50:00 am,0,2025-06-29 00:50:00,9.2542,7.628,0.00019999999999997797
KHF-1,6/29/2025,01:00:00 am,0,2025-06-29 01:00:00,9.2543,7.63,0.00030000000000001136
KHF-1,6/29/2025,01:10:00 am,0,2025-06-29 01:10:00,9.2549,7.627,0.0
KHF-1,6/29/2025,01:20:00 am,0,2025-06-29 01:20:00,9.2552,7.627,0.0
KHF-1,6/29/2025,01:30:00 am,0,2025-06-29 01:30:00,9.2556,7.627,0.0001000000000000334
KHF-1,6/29/2025,01:40:00 am,0,2025-06-29 01:40:00,9.2557,7.628,9.999999999994457e-05
KHF-1,6/29/2025,01:50:00 am,0,2025-06-29 01:50:00,9.2559,7.629,0.0
KHF-1,6/29/2025,02:00:00 am,0,2025-06-29 02:00:00,9.2559,7.629,0.0
KHF-1,6/29/2025,02:10:00 am,0,2025-06-29 02:10:00,9.256,7.629,9.999999999994457e-05
KHF-1,6/29/2025,02:20:00 am,0,2025-06-29 02:20:00,9.2561,7.628,9.999999999994457e-05
KHF-1,6/29/2025,02:30:00 am,0,2025-06-29 02:30:00,9.2562,7.629,9.999999999994457e-05
KHF-1,6/29/2025,02:40:00 am,0,2025-06-29 02:40:00,9.2562,7.628,9.999999999994457e-05
KHF-1,6/29/2025,02:50:00 am,0,2025-06-29 02:50:00,9.2563,7.629,0.0
KHF-1,6/29/2025,03:00:00 am,0,2025-06-29 03:00:00,9.2565,7.629,9.999999999994457e-05
KHF-1,6/29/2025,03:10:00 am,0,2025-06-29 03:10:00,9.2565,7.628,9.999999999994457e-05
KHF-1,6/29/2025,03:20:00 am,0,2025-06-29 03:20:00,9.2567,7.629,0.0001000000000000334
KHF-1,6/29/2025,03:30:00 am,0,2025-06-29 03:30:00,9.2565,7.63,0.0001000000000000334
KHF-1,6/29/2025,03:40:00 am,0,2025-06-29 03:40:00,9.2567,7.631,0.0002000000000000668
KHF-1,6/29/2025,03:50:00 am,0,2025-06-29 03:50:00,9.2565,7.629,0.0001000000000000334
KHF-1,6/29/2025,04:00:00 am,0,2025-06-29 04:00:00,9.2565,7.63,0.0001000000000000334
KHF-1,6/29/2025,04:10:00 am,0,2025-06-29 04:10:00,9.2571,7.629,9.999999999994457e-05
KHF-1,6/29/2025,04:20:00 am,0,2025-06-29 04:20:00,9.2569,7.628,0.00019999999999997797
KHF-1,6/29/2025,04:30:00 am,0,2025-06-29 04:30:00,9.2568,7.63,0.0
KHF-1,6/29/2025,04:40:00 am,0,2025-06-29 04:40:00,9.257,7.63,0.0001000000000000334
KHF-1,6/29/2025,04:50:00 am,0,2025-06-29 04:50:00,9.2574,7.629,0.0002000000000000668
KHF-1,6/29/2025,05:00:00 am,0,2025-06-29 05:00:00,9.2581,7.631,0.0001000000000000334
KHF-1,6/29/2025,05:10:00 am,0,2025-06-29 05:10:00,9.2586,7.63,0.0
KHF-1,6/29/2025,05:20:00 am,0,2025-06-29 05:20:00,9.2591,7.63,0.0001000000000000334
KHF-1,6/29/2025,05:30:00 am,0,2025-06-29 05:30:00,9.259,7.631,0.0002000000000000668
KHF-1,6/29/2025,05:40:00 am,0,2025-06-29 05:40:00,9.2596,7.629,0.0002000000000000668
KHF-1,6/29/2025,05:50:00 am,0,2025-06-29 05:50:00,9.2603,7.631,0.0001000000000000334
KHF-1,6/29/2025,06:00:00 am,0,2025-06-29 06:00:00,9.261,7.63,0.0
KHF-1,6/29/2025,06:10:00 am,0,2025-06-29 06:10:00,9.2612,7.63,0.00019999999999997797
KHF-1,6/29/2025,06:20:00 am,0,2025-06-29 06:20:00,9.2618,7.632,0.00019999999999997797
KHF-1,6/29/2025,06:30:00 am,0,2025-06-29 06:30:00,9.2621,7.63,0.0001000000000000334
KHF-1,6/29/2025,06:40:00 am,0,2025-06-29 06:40:00,9.2629,7.631,0.0001000000000000334
KHF-1,6/29/2025,06:50:00 am,0,2025-06-29 06:50:00,9.2635,7.63,0.0
KHF-1,6/29/2025,07:00:00 am,0,2025-06-29 07:00:00,9.2643,7.63,0.0
KHF-1,6/29/2025,07:10:00 am,0,2025-06-29 07:10:00,9.265,7.63,0.0001000000000000334
KHF-1,6/29/2025,07:20:00 am,0,2025-06-29 07:20:00,9.2649,7.631,0.0
KHF-1,6/29/2025,07:30:00 am,0,2025-06-29 07:30:00,9.2648,7.631,0.0
KHF-1,6/29/2025,07:40:00 am,0,2025-06-29 07:40:00,9.2649,7.631,0.00030000000000001136
KHF-1,6/29/2025,07:50:00 am,0,2025-06-29 07:50:00,9.2649,7.634,0.0002000000000000668
KHF-1,6/29/2025,08:00:00 am,0,2025-06-29 08:00:00,9.265,7.632,9.999999999994457e-05
KHF-1,6/29/2025,08:10:00 am,0,2025-06-29 08:10:00,9.2656,7.631,0.00030000000000001136
KHF-1,6/29/2025,08:20:00 am,0,2025-06-29 08:20:00,9.2659,7.634,0.0001000000000000334
KHF-1,6/29/2025,08:30:00 am,0,2025-06-29 08:30:00,9.2665,7.633,0.0001000000000000334
KHF-1,6/29/2025,08:40:00 am,0,2025-06-29 08:40:00,9.2667,7.632,0.0001000000000000334
KHF-1,6/29/2025,08:50:00 am,0,2025-06-29 08:50:00,9.2667,7.633,0.00019999999999997797
KHF-1,6/29/2025,09:00:00 am,0,2025-06-29 09:00:00,9.2669,7.635,9.999999999994457e-05
KHF-1,6/29/2025,09:10:00 am,0,2025-06-29 09:10:00,9.2669,7.634,0.0001000000000000334
KHF-1,6/29/2025,09:20:00 am,0,2025-06-29 09:20:00,9.2666,7.633,0.0001000000000000334
KHF-1,6/29/2025,09:30:00 am,0,2025-06-29 09:30:00,9.2664,7.634,0.0001000000000000334
KHF-1,6/29/2025,09:40:00 am,0,2025-06-29 09:40:00,9.2664,7.633,0.00019999999999997797
KHF-1,6/29/2025,09:50:00 am,0,2025-06-29 09:50:00,9.2666,7.635,0.00019999999999997797
KHF-1,6/29/2025,10:00:00 am,0,2025-06-29 10:00:00,9.2666,7.633,0.00019999999999997797
KHF-1,6/29/2025,10:10:00 am,0,2025-06-29 10:10:00,9.2665,7.635,0.00019999999999997797
KHF-1,6/29/2025,10:20:00 am,0,2025-06-29 10:20:00,9.2666,7.633,0.00019999999999997797
KHF-1,6/29/2025,10:30:00 am,0,2025-06-29 10:30:00,9.2659,7.635,0.0
KHF-1,6/29/2025,10:40:00 am,0,2025-06-29 10:40:00,9.2626,7.635,0.0
KHF-1,6/29/2025,10:50:00 am,0,2025-06-29 10:50:00,9.2618,7.635,9.999999999994457e-05
KHF-1,6/29/2025,11:00:00 am,0,2025-06-29 11:00:00,9.2606,7.634,0.0
KHF-1,6/29/2025,11:10:00 am,0,2025-06-29 11:10:00,9.2596,7.634,0.0
KHF-1,6/29/2025,11:20:00 am,0,2025-06-29 11:20:00,9.2594,7.634,9.999999999994457e-05
KHF-1,6/29/2025,11:30:00 am,0,2025-06-29 11:30:00,9.2593,7.635,0.00019999999999997797
KHF-1,6/29/2025,11:40:00 am,0,2025-06-29 11:40:00,9.259,7.637,0.00019999999999997797
KHF-1,6/29/2025,11:50:00 am,0,2025-06-29 11:50:00,9.2586,7.635,0.00019999999999997797
KHF-1,6/29/2025,12:00:00 pm,0,2025-06-29 12:00:00,9.2576,7.637,9.999999999994457e-05
KHF-1,6/29/2025,12:10:00 pm,0,2025-06-29 12:10:00,9.2563,7.636,9.999999999994457e-05
KHF-1,6/29/2025,12:20:00 pm,0,2025-06-29 12:20:00,9.2549,7.637,0.0
KHF-1,6/29/2025,12:30:00 pm,0,2025-06-29 12:30:00,9.253,7.637,0.0001000000000000334
KHF-1,6/29/2025,12:40:00 pm,0,2025-06-29 12:40:00,9.2516,7.638,0.0001000000000000334
KHF-1,6/29/2025,12:50:00 pm,0,2025-06-29 12:50:00,9.2506,7.637,9.999999999994457e-05
KHF-1,6/29/2025,01:00:00 pm,0,2025-06-29 13:00:00,9.2493,7.636,9.999999999994457e-05
KHF-1,6/29/2025,01:10:00 pm,0,2025-06-29 13:10:00,9.2476,7.637,0.0001000000000000334
KHF-1,6/29/2025,01:20:00 pm,0,2025-06-29 13:20:00,9.2461,7.638,0.0
KHF-1,6/29/2025,01:30:00 pm,0,2025-06-29 13:30:00,9.2452,7.638,0.0
KHF-1,6/29/2025,01:40:00 pm,0,2025-06-29 13:40:00,9.2442,7.638,0.0
KHF-1,6/29/2025,01:50:00 pm,0,2025-06-29 13:50:00,9.2433,7.638,0.00019999999999997797
KHF-1,6/29/2025,02:00:00 pm,0,2025-06-29 14:00:00,9.2426,7.64,0.00019999999999997797
KHF-1,6/29/2025,02:10:00 pm,0,2025-06-29 14:10:00,9.2421,7.638,0.0
KHF-1,6/29/2025,02:20:00 pm,0,2025-06-29 14:20:00,9.2414,7.638,0.00019999999999997797
KHF-1,6/29/2025,02:30:00 pm,0,2025-06-29 14:30:00,9.2408,7.64,9.999999999994457e-05
KHF-1,6/29/2025,02:40:00 pm,0,2025-06-29 14:40:00,9.2404,7.639,0.0
KHF-1,6/29/2025,02:50:00 pm,0,2025-06-29 14:50:00,9.2393,7.639,9.999999999994457e-05
KHF-1,6/29/2025,03:00:00 pm,0,2025-06-29 15:00:00,9.2389,7.64,9.999999999994457e-05
KHF-1,6/29/2025,03:10:00 pm,0,2025-06-29 15:10:00,9.2385,7.639,9.999999999994457e-05
KHF-1,6/29/2025,03:20:00 pm,0,2025-06-29 15:20:00,9.2383,7.64,0.0001000000000000334
KHF-1,6/29/2025,03:30:00 pm,0,2025-06-29 15:30:00,9.2377,7.641,0.0001000000000000334
KHF-1,6/29/2025,03:40:00 pm,0,2025-06-29 15:40:00,9.2373,7.64,9.999999999994457e-05
KHF-1,6/29/2025,03:50:00 pm,0,2025-06-29 15:50:00,9.237,7.639,9.999999999994457e-05
KHF-1,6/29/2025,04:00:00 pm,0,2025-06-29 16:00:00,9.2363,7.64,0.0002000000000000668
KHF-1,6/29/2025,04:10:00 pm,0,2025-06-29 16:10:00,9.2359,7.642,0.0001000000000000334
KHF-1,6/29/2025,04:20:00 pm,0,2025-06-29 16:20:00,9.2347,7.641,0.0
KHF-1,6/29/2025,04:30:00 pm,0,2025-06-29 16:30:00,9.233,7.641,0.0001000000000000334
KHF-1,6/29/2025,04:40:00 pm,0,2025-06-29 16:40:00,9.232,7.64,0.0
KHF-1,6/29/2025,04:50:00 pm,0,2025-06-29 16:50:00,9.2318,7.64,0.00030000000000001136
KHF-1,6/29/2025,05:00:00 pm,0,2025-06-29 17:00:00,9.2307,7.643,0.0
KHF-1,6/29/2025,05:10:00 pm,0,2025-06-29 17:10:00,9.2292,7.643,0.0
KHF-1,6/29/2025,05:20:00 pm,0,2025-06-29 17:20:00,9.2287,7.643,0.0
KHF-1,6/29/2025,05:30:00 pm,0,2025-06-29 17:30:00,9.2276,7.643,0.0001000000000000334
KHF-1,6/29/2025,05:40:00 pm,0,2025-06-29 17:40:00,9.2263,7.644,0.0
KHF-1,6/29/2025,05:50:00 pm,0,2025-06-29 17:50:00,9.2254,7.644,0.0001000000000000334
KHF-1,6/29/2025,06:00:00 pm,0,2025-06-29 18:00:00,9.2244,7.643,0.0001000000000000334
KHF-1,6/29/2025,06:10:00 pm,0,2025-06-29 18:10:00,9.2235,7.644,0.0
KHF-1,6/29/2025,06:20:00 pm,0,2025-06-29 18:20:00,9.2226,7.644,0.0001000000000000334
KHF-1,6/29/2025,06:30:00 pm,0,2025-06-29 18:30:00,9.2221,7.643,0.0001000000000000334
KHF-1,6/29/2025,06:40:00 pm,0,2025-06-29 18:40:00,9.2218,7.644,9.999999999994457e-05
KHF-1,6/29/2025,06:50:00 pm,0,2025-06-29 18:50:00,9.2213,7.645,9.999999999994457e-05
KHF-1,6/29/2025,07:00:00 pm,0,2025-06-29 19:00:00,9.2213,7.644,0.00019999999999997797
KHF-1,6/29/2025,07:10:00 pm,0,2025-06-29 19:10:00,9.2213,7.642,0.00019999999999997797
KHF-1,6/29/2025,07:20:00 pm,0,2025-06-29 19:20:00,9.2211,7.644,9.999999999994457e-05
KHF-1,6/29/2025,07:30:00 pm,0,2025-06-29 19:30:00,9.2211,7.645,9.999999999994457e-05
KHF-1,6/29/2025,07:40:00 pm,0,2025-06-29 19:40:00,9.2204,7.644,0.0
KHF-1,6/29/2025,07:50:00 pm,0,2025-06-29 19:50:00,9.2198,7.644,0.0
KHF-1,6/29/2025,08:00:00 pm,0,2025-06-29 20:00:00,9.2197,7.644,9.999999999994457e-05
KHF-1,6/29/2025,08:10:00 pm,0,2025-06-29 20:10:00,9.2194,7.645,0.0
KHF-1,6/29/2025,08:20:00 pm,0,2025-06-29 20:20:00,9.2192,7.645,9.999999999994457e-05
KHF-1,6/29/2025,08:30:00 pm,0,2025-06-29 20:30:00,9.219,7.644,0.0
KHF-1,6/29/2025,08:40:00 pm,0,2025-06-29 20:40:00,9.2193,7.644,0.0001000000000000334
KHF-1,6/29/2025,08:50:00 pm,0,2025-06-29 20:50:00,9.2197,7.643,0.0001000000000000334
KHF-1,6/29/2025,09:00:00 pm,0,2025-06-29 21:00:00,9.22,7.644,9.999999999994457e-05
KHF-1,6/29/2025,09:10:00 pm,0,2025-06-29 21:10:00,9.2204,7.645,0.0
KHF-1,6/29/2025,09:20:00 pm,0,2025-06-29 21:20:00,9.2207,7.645,0.0
KHF-1,6/29/2025,09:30:00 pm,0,2025-06-29 21:30:00,9.2212,7.645,0.0001000000000000334
KHF-1,6/29/2025,09:40:00 pm,0,2025-06-29 21:40:00,9.2213,7.646,0.00030000000000001136
KHF-1,6/29/2025,09:50:00 pm,0,2025-06-29 21:50:00,9.2215,7.643,0.0
KHF-1,6/29/2025,10:00:00 pm,0,2025-06-29 22:00:00,9.2215,7.643,0.0001000000000000334
KHF-1,6/29/2025,10:10:00 pm,0,2025-06-29 22:10:00,9.2218,7.644,0.0001000000000000334
KHF-1,6/29/2025,10:20:00 pm,0,2025-06-29 22:20:00,9.2221,7.643,0.0
KHF-1,6/29/2025,10:30:00 pm,0,2025-06-29 22:30:00,9.222,7.643,0.0001000000000000334
KHF-1,6/29/2025,10:40:00 pm,0,2025-06-29 22:40:00,9.2226,7.644,0.00019999999999997797
KHF-1,6/29/2025,10:50:00 pm,0,2025-06-29 22:50:00,9.2228,7.646,0.0001000000000000334
KHF-1,6/29/2025,11:00:00 pm,0,2025-06-29 23:00:00,9.2231,7.645,0.0
KHF-1,6/29/2025,11:10:00 pm,0,2025-06-29 23:10:00,9.2236,7.645,0.0
KHF-1,6/29/2025,11:20:00 pm,0,2025-06-29 23:20:00,9.2235,7.645,0.0001000000000000334
KHF-1,6/29/2025,11:30:00 pm,0,2025-06-29 23:30:00,9.2235,7.646,0.0001000000000000334
KHF-1,6/29/2025,11:40:00 pm,0,2025-06-29 23:40:00,9.2237,7.645,0.0
KHF-1,6/29/2025,11:50:00 pm,0,2025-06-29 23:50:00,9.2241,7.645,0.0002000000000000668
KHF-1,6/30/2025,12:00:00 am,0,2025-06-30 00:00:00,9.224,7.647,0.0002000000000000668
KHF-1,6/30/2025,12:10:00 am,0,2025-06-30 00:10:00,9.224,7.645,0.0
KHF-1,6/30/2025,12:20:00 am,0,2025-06-30 00:20:00,9.2237,7.645,0.0002000000000000668
KHF-1,6/30/2025,12:30:00 am,0,2025-06-30 00:30:00,9.2235,7.647,9.999999999994457e-05
KHF-1,6/30/2025,12:40:00 am,0,2025-06-30 00:40:00,9.2239,7.648,0.00030000000000001136
KHF-1,6/30/2025,12:50:00 am,0,2025-06-30 00:50:00,9.2237,7.645,0.0001000000000000334
KHF-1,6/30/2025,01:00:00 am,0,2025-06-30 01:00:00,9.2238,7.646,0.00019999999999997797
KHF-1,6/30/2025,01:10:00 am,0,2025-06-30 01:10:00,9.2238,7.644,0.0
KHF-1,6/30/2025,01:20:00 am,0,2025-06-30 01:20:00,9.2239,7.644,0.00030000000000001136
KHF-1,6/30/2025,01:30:00 am,0,2025-06-30 01:30:00,9.2239,7.647,9.999999999994457e-05
KHF-1,6/30/2025,01:40:00 am,0,2025-06-30 01:40:00,9.2238,7.648,9.999999999994457e-05
KHF-1,6/30/2025,01:50:00 am,0,2025-06-30 01:50:00,9.2239,7.647,0.00019999999999997797
KHF-1,6/30/2025,02:00:00 am,0,2025-06-30 02:00:00,9.2237,7.649,0.00030000000000001136
KHF-1,6/30/2025,02:10:00 am,0,2025-06-30 02:10:00,9.2236,7.646,0.00019999999999997797
KHF-1,6/30/2025,02:20:00 am,0,2025-06-30 02:20:00,9.224,7.648,9.999999999994457e-05
KHF-1,6/30/2025,02:30:00 am,0,2025-06-30 02:30:00,9.2244,7.647,9.999999999994457e-05
KHF-1,6/30/2025,02:40:00 am,0,2025-06-30 02:40:00,9.2245,7.648,0.0001000000000000334
KHF-1,6/30/2025,02:50:00 am,0,2025-06-30 02:50:00,9.225,7.649,0.00019999999999997797
KHF-1,6/30/2025,03:00:00 am,0,2025-06-30 03:00:00,9.2267,7.647,0.0
KHF-1,6/30/2025,03:10:00 am,0,2025-06-30 03:10:00,9.2272,7.647,0.00019999999999997797
KHF-1,6/30/2025,03:20:00 am,0,2025-06-30 03:20:00,9.2281,7.649,0.0001000000000000334
KHF-1,6/30/2025,03:30:00 am,0,2025-06-30 03:30:00,9.2287,7.648,0.0001000000000000334
KHF-1,6/30/2025,03:40:00 am,0,2025-06-30 03:40:00,9.2284,7.649,0.0001000000000000334
KHF-1,6/30/2025,03:50:00 am,0,2025-06-30 03:50:00,9.2283,7.648,0.0001000000000000334
KHF-1,6/30/2025,04:00:00 am,0,2025-06-30 04:00:00,9.2296,7.649,0.00019999999999997797
KHF-1,6/30/2025,04:10:00 am,0,2025-06-30 04:10:00,9.23,7.647,9.999999999994457e-05
KHF-1,6/30/2025,04:20:00 am,0,2025-06-30 04:20:00,9.2306,7.648,9.999999999994457e-05
KHF-1,6/30/2025,04:30:00 am,0,2025-06-30 04:30:00,9.2313,7.647,9.999999999994457e-05
KHF-1,6/30/2025,04:40:00 am,0,2025-06-30 04:40:00,9.2325,7.648,0.0002000000000000668
KHF-1,6/30/2025,04:50:00 am,0,2025-06-30 04:50:00,9.2328,7.65,0.0001000000000000334
KHF-1,6/30/2025,05:00:00 am,0,2025-06-30 05:00:00,9.2327,7.649,0.0
KHF-1,6/30/2025,05:10:00 am,0,2025-06-30 05:10:00,9.2325,7.649,0.00019999999999997797
KHF-1,6/30/2025,05:20:00 am,0,2025-06-30 05:20:00,9.2325,7.651,0.0
KHF-1,6/30/2025,05:30:00 am,0,2025-06-30 05:30:00,9.2333,7.651,0.0001000000000000334
KHF-1,6/30/2025,05:40:00 am,0,2025-06-30 05:40:00,9.2339,7.652,0.00019999999999997797
KHF-1,6/30/2025,05:50:00 am,0,2025-06-30 05:50:00,9.2343,7.65,0.0
KHF-1,6/30/2025,06:00:00 am,0,2025-06-30 06:00:00,9.2341,7.65,0.00019999999999997797
KHF-1,6/30/2025,06:10:00 am,0,2025-06-30 06:10:00,9.2341,7.652,0.0
KHF-1,6/30/2025,06:20:00 am,0,2025-06-30 06:20:00,9.2343,7.652,0.00019999999999997797
KHF-1,6/30/2025,06:30:00 am,0,2025-06-30 06:30:00,9.2348,7.65,9.999999999994457e-05
KHF-1,6/30/2025,06:40:00 am,0,2025-06-30 06:40:00,9.2353,7.651,0.0
KHF-1,6/30/2025,06:50:00 am,0,2025-06-30 06:50:00,9.2356,7.651,9.999999999994457e-05
KHF-1,6/30/2025,07:00:00 am,0,2025-06-30 07:00:00,9.2362,7.65,0.00019999999999997797
KHF-1,6/30/2025,07:10:00 am,0,2025-06-30 07:10:00,9.2366,7.652,0.0001000000000000334
KHF-1,6/30/2025,07:20:00 am,0,2025-06-30 07:20:00,9.2369,7.651,0.0
KHF-1,6/30/2025,07:30:00 am,0,2025-06-30 07:30:00,9.2374,7.651,0.0001000000000000334
KHF-1,6/30/2025,07:40:00 am,0,2025-06-30 07:40:00,9.2374,7.652,0.0
KHF-1,6/30/2025,07:50:00 am,0,2025-06-30 07:50:00,9.2377,7.652,0.0001000000000000334
KHF-1,6/30/2025,08:00:00 am,0,2025-06-30 08:00:00,9.2379,7.651,0.0
KHF-1,6/30/2025,08:10:00 am,0,2025-06-30 08:10:00,9.2378,7.651,0.00019999999999997797
KHF-1,6/30/2025,08:20:00 am,0,2025-06-30 08:20:00,9.2379,7.653,0.0001000000000000334
KHF-1,6/30/2025,08:30:00 am,0,2025-06-30 08:30:00,9.238,7.654,0.0
KHF-1,6/30/2025,08:40:00 am,0,2025-06-30 08:40:00,9.2384,7.654,0.0
KHF-1,6/30/2025,08:50:00 am,0,2025-06-30 08:50:00,9.2388,7.654,0.0001000000000000334
KHF-1,6/30/2025,09:00:00 am,0,2025-06-30 09:00:00,9.239,7.655,9.999999999994457e-05
KHF-1,6/30/2025,09:10:00 am,0,2025-06-30 09:10:00,9.2391,7.656,9.999999999994457e-05
KHF-1,6/30/2025,09:20:00 am,0,2025-06-30 09:20:00,9.2389,7.655,9.999999999994457e-05
KHF-1,6/30/2025,09:30:00 am,0,2025-06-30 09:30:00,9.2386,7.656,0.0001000000000000334
KHF-1,6/30/2025,09:40:00 am,0,2025-06-30 09:40:00,9.2383,7.657,0.00019999999999997797
KHF-1,6/30/2025,09:50:00 am,0,2025-06-30 09:50:00,9.2384,7.655,9.999999999994457e-05
KHF-1,6/30/2025,10:00:00 am,0,2025-06-30 10:00:00,9.2344,7.656,9.999999999994457e-05
KHF-1,6/30/2025,10:10:00 am,0,2025-06-30 10:10:00,9.2336,7.655,9.999999999994457e-05
KHF-1,6/30/2025,10:20:00 am,0,2025-06-30 10:20:00,9.2335,7.656,0.0001000000000000334
KHF-1,6/30/2025,10:30:00 am,0,2025-06-30 10:30:00,9.2336,7.657,0.0001000000000000334
KHF-1,6/30/2025,10:40:00 am,0,2025-06-30 10:40:00,9.2338,7.656,9.999999999994457e-05
KHF-1,6/30/2025,10:50:00 am,0,2025-06-30 10:50:00,9.2339,7.655,0.0
KHF-1,6/30/2025,11:00:00 am,0,2025-06-30 11:00:00,9.2337,7.655,9.999999999994457e-05
KHF-1,6/30/2025,11:10:00 am,0,2025-06-30 11:10:00,9.2338,7.656,0.0
KHF-1,6/30/2025,11:20:00 am,0,2025-06-30 11:20:00,9.2337,7.656,0.0
KHF-1,6/30/2025,11:30:00 am,0,2025-06-30 11:30:00,9.2332,7.656,0.0001000000000000334
KHF-1,6/30/2025,11:40:00 am,0,2025-06-30 11:40:00,9.2328,7.657,0.00019999999999997797
KHF-1,6/30/2025,11:50:00 am,0,2025-06-30 11:50:00,9.2326,7.659,9.999999999994457e-05
KHF-1,6/30/2025,12:00:00 pm,0,2025-06-30 12:00:00,9.2316,7.658,0.0
KHF-1,6/30/2025,12:10:00 pm,0,2025-06-30 12:10:00,9.2301,7.658,9.999999999994457e-05
KHF-1,6/30/2025,12:20:00 pm,0,2025-06-30 12:20:00,9.2284,7.659,9.999999999994457e-05
KHF-1,6/30/2025,12:30:00 pm,0,2025-06-30 12:30:00,9.2274,7.658,9.999999999994457e-05
KHF-1,6/30/2025,12:40:00 pm,0,2025-06-30 12:40:00,9.2265,7.659,0.0001000000000000334
KHF-1,6/30/2025,12:50:00 pm,0,2025-06-30 12:50:00,9.2262,7.66,0.00019999999999997797
KHF-1,6/30/2025,01:00:00 pm,0,2025-06-30 13:00:00,9.2229,7.662,0.00019999999999997797
KHF-1,6/30/2025,01:10:00 pm,0,2025-06-30 13:10:00,9.2213,7.66,9.999999999994457e-05
KHF-1,6/30/2025,01:20:00 pm,0,2025-06-30 13:20:00,9.2201,7.661,0.0
KHF-1,6/30/2025,01:30:00 pm,0,2025-06-30 13:30:00,9.2187,7.661,9.999999999994457e-05
KHF-1,6/30/2025,01:40:00 pm,0,2025-06-30 13:40:00,9.2178,7.66,0.00019999999999997797
KHF-1,6/30/2025,01:50:00 pm,0,2025-06-30 13:50:00,9.2167,7.662,0.0001000000000000334
KHF-1,6/30/2025,02:00:00 pm,0,2025-06-30 14:00:00,9.2162,7.661,0.0001000000000000334
KHF-1,6/30/2025,02:10:00 pm,0,2025-06-30 14:10:00,9.2155,7.662,0.0
KHF-1,6/30/2025,02:20:00 pm,0,2025-06-30 14:20:00,9.2151,7.662,0.0001000000000000334
KHF-1,6/30/2025,02:30:00 pm,0,2025-06-30 14:30:00,9.2141,7.663,9.999999999994457e-05
KHF-1,6/30/2025,02:40:00 pm,0,2025-06-30 14:40:00,9.214,7.664,9.999999999994457e-05
KHF-1,6/30/2025,02:50:00 pm,0,2025-06-30 14:50:00,9.2127,7.663,0.0
KHF-1,6/30/2025,03:00:00 pm,0,2025-06-30 15:00:00,9.2122,7.663,0.0001000000000000334
KHF-1,6/30/2025,03:10:00 pm,0,2025-06-30 15:10:00,9.2117,7.662,0.00019999999999997797
KHF-1,6/30/2025,03:20:00 pm,0,2025-06-30 15:20:00,9.2114,7.664,9.999999999994457e-05
KHF-1,6/30/2025,03:30:00 pm,0,2025-06-30 15:30:00,9.2105,7.663,9.999999999994457e-05
KHF-1,6/30/2025,03:40:00 pm,0,2025-06-30 15:40:00,9.2104,7.664,0.0001000000000000334
KHF-1,6/30/2025,03:50:00 pm,0,2025-06-30 15:50:00,9.21,7.665,0.0
KHF-1,6/30/2025,04:00:00 pm,0,2025-06-30 16:00:00,9.2095,7.665,0.0001000000000000334
KHF-1,6/30/2025,04:10:00 pm,0,2025-06-30 16:10:00,9.2096,7.666,9.999999999994457e-05
KHF-1,6/30/2025,04:20:00 pm,0,2025-06-30 16:20:00,9.2094,7.667,0.00019999999999997797
KHF-1,6/30/2025,04:30:00 pm,0,2025-06-30 16:30:00,9.2051,7.665,0.00019999999999997797
KHF-1,6/30/2025,04:40:00 pm,0,2025-06-30 16:40:00,9.2044,7.667,0.00019999999999997797
KHF-1,6/30/2025,04:50:00 pm,0,2025-06-30 16:50:00,9.2044,7.665,0.0001000000000000334
KHF-1,6/30/2025,05:00:00 pm,0,2025-06-30 17:00:00,9.2042,7.666,0.0002000000000000668
KHF-1,6/30/2025,05:10:00 pm,0,2025-06-30 17:10:00,9.2041,7.664,0.0001000000000000334
KHF-1,6/30/2025,05:20:00 pm,0,2025-06-30 17:20:00,9.2039,7.665,0.00019999999999997797
KHF-1,6/30/2025,05:30:00 pm,0,2025-06-30 17:30:00,9.2042,7.667,9.999999999994457e-05
KHF-1,6/30/2025,05:40:00 pm,0,2025-06-30 17:40:00,9.2038,7.666,0.0001000000000000334
KHF-1,6/30/2025,05:50:00 pm,0,2025-06-30 17:50:00,9.2032,7.665,0.0001000000000000334
KHF-1,6/30/2025,06:00:00 pm,0,2025-06-30 18:00:00,9.2016,7.666,0.0
KHF-1,6/30/2025,06:10:00 pm,0,2025-06-30 18:10:00,9.2019,7.666,0.00019999999999997797
KHF-1,6/30/2025,06:20:00 pm,0,2025-06-30 18:20:00,9.2014,7.668,0.00019999999999997797
KHF-1,6/30/2025,06:30:00 pm,0,2025-06-30 18:30:00,9.2017,7.666,0.0
KHF-1,6/30/2025,06:40:00 pm,0,2025-06-30 18:40:00,9.2019,7.666,0.0
KHF-1,6/30/2025,06:50:00 pm,0,2025-06-30 18:50:00,9.2016,7.666,9.999999999994457e-05
KHF-1,6/30/2025,07:00:00 pm,0,2025-06-30 19:00:00,9.2018,7.667,0.0
KHF-1,6/30/2025,07:10:00 pm,0,2025-06-30 19:10:00,9.202,7.667,0.00019999999999997797
KHF-1,6/30/2025,07:20:00 pm,0,2025-06-30 19:20:00,9.2025,7.669,0.0
KHF-1,6/30/2025,07:30:00 pm,0,2025-06-30 19:30:00,9.2024,7.669,0.0001000000000000334
KHF-1,6/30/2025,07:40:00 pm,0,2025-06-30 19:40:00,9.2025,7.67,0.0001000000000000334
KHF-1,6/30/2025,07:50:00 pm,0,2025-06-30 19:50:00,9.2026,7.669,9.999999999994457e-05
KHF-1,6/30/2025,08:00:00 pm,0,2025-06-30 20:00:00,9.2027,7.668,0.00019999999999997797
KHF-1,6/30/2025,08:10:00 pm,0,2025-06-30 20:10:00,9.2027,7.67,0.00030000000000001136
KHF-1,6/30/2025,08:20:00 pm,0,2025-06-30 20:20:00,9.2025,7.667,0.00019999999999997797
KHF-1,6/30/2025,08:30:00 pm,0,2025-06-30 20:30:00,9.2032,7.669,0.0001000000000000334
KHF-1,6/30/2025,08:40:00 pm,0,2025-06-30 20:40:00,9.2032,7.67,0.0
KHF-1,6/30/2025,08:50:00 pm,0,2025-06-30 20:50:00,9.2032,7.67,0.00019999999999997797
KHF-1,6/30/2025,09:00:00 pm,0,2025-06-30 21:00:00,9.2034,7.672,0.00019999999999997797
KHF-1,6/30/2025,09:10:00 pm,0,2025-06-30 21:10:00,9.2036,7.67,0.0
KHF-1,6/30/2025,09:20:00 pm,0,2025-06-30 21:20:00,9.2039,7.67,0.0001000000000000334
KHF-1,6/30/2025,09:30:00 pm,0,2025-06-30 21:30:00,9.2043,7.669,0.0001000000000000334
KHF-1,6/30/2025,09:40:00 pm,0,2025-06-30 21:40:00,9.2047,7.67,0.00019999999999997797
KHF-1,6/30/2025,09:50:00 pm,0,2025-06-30 21:50:00,9.2048,7.668,0.00030000000000001136
KHF-1,6/30/2025,10:00:00 pm,0,2025-06-30 22:00:00,9.2057,7.671,0.0001000000000000334
KHF-1,6/30/2025,10:10:00 pm,0,2025-06-30 22:10:00,9.2057,7.67,0.0
KHF-1,6/30/2025,10:20:00 pm,0,2025-06-30 22:20:00,9.2055,7.67,0.0001000000000000334
KHF-1,6/30/2025,10:30:00 pm,0,2025-06-30 22:30:00,9.2055,7.669,0.0
KHF-1,6/30/2025,10:40:00 pm,0,2025-06-30 22:40:00,9.2059,7.669,0.0001000000000000334
KHF-1,6/30/2025,10:50:00 pm,0,2025-06-30 22:50:00,9.2062,7.67,0.00019999999999997797
KHF-1,6/30/2025,11:00:00 pm,0,2025-06-30 23:00:00,9.2064,7.668,0.00030000000000001136
KHF-1,6/30/2025,11:10:00 pm,0,2025-06-30 23:10:00,9.2064,7.671,0.0001000000000000334
KHF-1,6/30/2025,11:20:00 pm,0,2025-06-30 23:20:00,9.2069,7.67,0.0
KHF-1,6/30/2025,11:30:00 pm,0,2025-06-30 23:30:00,9.2077,7.67,0.0
KHF-1,6/30/2025,11:40:00 pm,0,2025-06-30 23:40:00,9.2081,7.67,0.00019999999999997797
KHF-1,6/30/2025,11:50:00 pm,0,2025-06-30 23:50:00,9.2091,7.668,0.00030000000000001136
KHF-1,7/1/2025,12:00:00 am,0,2025-07-01 00:00:00,9.209,7.671,0.0001000000000000334
KHF-1,7/1/2025,12:10:00 am,0,2025-07-01 00:10:00,9.2088,7.67,0.0001000000000000334
KHF-1,7/1/2025,12:20:00 am,0,2025-07-01 00:20:00,9.209,7.671,0.0
KHF-1,7/1/2025,12:30:00 am,0,2025-07-01 00:30:00,9.2089,7.671,0.0001000000000000334
KHF-1,7/1/2025,12:40:00 am,0,2025-07-01 00:40:00,9.209,7.67,0.00019999999999997797
KHF-1,7/1/2025,12:50:00 am,0,2025-07-01 00:50:00,9.2088,7.672,0.0
KHF-1,7/1/2025,01:00:00 am,0,2025-07-01 01:00:00,9.2103,7.672,9.999999999994457e-05
KHF-1,7/1/2025,01:10:00 am,0,2025-07-01 01:10:00,9.2115,7.671,0.0
KHF-1,7/1/2025,01:20:00 am,0,2025-07-01 01:20:00,9.2121,7.671,0.0
KHF-1,7/1/2025,01:30:00 am,0,2025-07-01 01:30:00,9.2124,7.671,0.00019999999999997797
KHF-1,7/1/2025,01:40:00 am,0,2025-07-01 01:40:00,9.2121,7.673,0.00019999999999997797
KHF-1,7/1/2025,01:50:00 am,0,2025-07-01 01:50:00,9.2118,7.671,0.00019999999999997797
KHF-1,7/1/2025,02:00:00 am,0,2025-07-01 02:00:00,9.2116,7.673,0.0001000000000000334
KHF-1,7/1/2025,02:10:00 am,0,2025-07-01 02:10:00,9.2116,7.674,0.0002000000000000668
KHF-1,7/1/2025,02:20:00 am,0,2025-07-01 02:20:00,9.2114,7.672,0.0001000000000000334
KHF-1,7/1/2025,02:30:00 am,0,2025-07-01 02:30:00,9.2115,7.673,0.0001000000000000334
KHF-1,7/1/2025,02:40:00 am,0,2025-07-01 02:40:00,9.2114,7.672,0.0001000000000000334
KHF-1,7/1/2025,02:50:00 am,0,2025-07-01 02:50:00,9.211,7.673,0.0
KHF-1,7/1/2025,03:00:00 am,0,2025-07-01 03:00:00,9.2112,7.673,0.00019999999999997797
KHF-1,7/1/2025,03:10:00 am,0,2025-07-01 03:10:00,9.2116,7.675,0.00019999999999997797
KHF-1,7/1/2025,03:20:00 am,0,2025-07-01 03:20:00,9.2115,7.673,0.0001000000000000334
KHF-1,7/1/2025,03:30:00 am,0,2025-07-01 03:30:00,9.2118,7.674,0.0001000000000000334
KHF-1,7/1/2025,03:40:00 am,0,2025-07-01 03:40:00,9.2118,7.673,0.00019999999999997797
KHF-1,7/1/2025,03:50:00 am,0,2025-07-01 03:50:00,9.2117,7.675,9.999999999994457e-05
KHF-1,7/1/2025,04:00:00 am,0,2025-07-01 04:00:00,9.2113,7.674,0.0
KHF-1,7/1/2025,04:10:00 am,0,2025-07-01 04:10:00,9.2111,7.674,9.999999999994457e-05
KHF-1,7/1/2025,04:20:00 am,0,2025-07-01 04:20:00,9.2112,7.675,0.0
KHF-1,7/1/2025,04:30:00 am,0,2025-07-01 04:30:00,9.2112,7.675,9.999999999994457e-05
KHF-1,7/1/2025,04:40:00 am,0,2025-07-01 04:40:00,9.2111,7.674,0.0
KHF-1,7/1/2025,04:50:00 am,0,2025-07-01 04:50:00,9.2113,7.674,0.00019999999999997797
KHF-1,7/1/2025,05:00:00 am,0,2025-07-01 05:00:00,9.2115,7.676,0.0001000000000000334
KHF-1,7/1/2025,05:10:00 am,0,2025-07-01 05:10:00,9.2126,7.675,0.0001000000000000334
KHF-1,7/1/2025,05:20:00 am,0,2025-07-01 05:20:00,9.2133,7.676,9.999999999994457e-05
KHF-1,7/1/2025,05:30:00 am,0,2025-07-01 05:30:00,9.2147,7.677,9.999999999994457e-05
KHF-1,7/1/2025,05:40:00 am,0,2025-07-01 05:40:00,9.2153,7.676,0.0
KHF-1,7/1/2025,05:50:00 am,0,2025-07-01 05:50:00,9.2165,7.676,0.0001000000000000334
KHF-1,7/1/2025,06:00:00 am,0,2025-07-01 06:00:00,9.2181,7.675,0.00040000000000004474
KHF-1,7/1/2025,06:10:00 am,0,2025-07-01 06:10:00,9.2191,7.679,0.0002000000000000668
KHF-1,7/1/2025,06:20:00 am,0,2025-07-01 06:20:00,9.22,7.677,0.0
KHF-1,7/1/2025,06:30:00 am,0,2025-07-01 06:30:00,9.2217,7.677,0.0
KHF-1,7/1/2025,06:40:00 am,0,2025-07-01 06:40:00,9.2217,7.677,9.999999999994457e-05
KHF-1,7/1/2025,06:50:00 am,0,2025-07-01 06:50:00,9.2224,7.676,0.00019999999999997797
KHF-1,7/1/2025,07:00:00 am,0,2025-07-01 07:00:00,9.2226,7.678,0.0001000000000000334
KHF-1,7/1/2025,07:10:00 am,0,2025-07-01 07:10:00,9.2226,7.679,0.0
KHF-1,7/1/2025,07:20:00 am,0,2025-07-01 07:20:00,9.2227,7.679,0.0
KHF-1,7/1/2025,07:30:00 am,0,2025-07-01 07:30:00,9.2228,7.679,0.0
KHF-1,7/1/2025,07:40:00 am,0,2025-07-01 07:40:00,9.2229,7.679,0.00019999999999997797
KHF-1,7/1/2025,07:50:00 am,0,2025-07-01 07:50:00,9.2231,7.681,0.00019999999999997797
KHF-1,7/1/2025,08:00:00 am,0,2025-07-01 08:00:00,9.2231,7.679,9.999999999994457e-05
KHF-1,7/1/2025,08:10:00 am,0,2025-07-01 08:10:00,9.2229,7.68,0.0001000000000000334
KHF-1,7/1/2025,08:20:00 am,0,2025-07-01 08:20:00,9.2232,7.681,0.0
KHF-1,7/1/2025,08:30:00 am,0,2025-07-01 08:30:00,9.2232,7.681,0.0001000000000000334
KHF-1,7/1/2025,08:40:00 am,0,2025-07-01 08:40:00,9.2231,7.682,0.0
KHF-1,7/1/2025,08:50:00 am,0,2025-07-01 08:50:00,9.2227,7.682,0.0001000000000000334
KHF-1,7/1/2025,09:00:00 am,0,2025-07-01 09:00:00,9.2227,7.681,0.00030000000000001136
KHF-1,7/1/2025,09:10:00 am,0,2025-07-01 09:10:00,9.223,7.684,0.00019999999999997797
KHF-1,7/1/2025,09:20:00 am,0,2025-07-01 09:20:00,9.2232,7.682,9.999999999994457e-05
KHF-1,7/1/2025,09:30:00 am,0,2025-07-01 09:30:00,9.223,7.683,9.999999999994457e-05
KHF-1,7/1/2025,09:40:00 am,0,2025-07-01 09:40:00,9.2233,7.682,9.999999999994457e-05
KHF-1,7/1/2025,09:50:00 am,0,2025-07-01 09:50:00,9.2234,7.683,0.0001000000000000334
KHF-1,7/1/2025,10:00:00 am,0,2025-07-01 10:00:00,9.2232,7.684,0.0
KHF-1,7/1/2025,10:10:00 am,0,2025-07-01 10:10:00,9.2232,7.684,0.0
KHF-1,7/1/2025,10:20:00 am,0,2025-07-01 10:20:00,9.223,7.684,0.0
KHF-1,7/1/2025,10:30:00 am,0,2025-07-01 10:30:00,9.2233,7.684,0.0
KHF-1,7/1/2025,10:40:00 am,0,2025-07-01 10:40:00,9.2229,7.684,0.00019999999999997797
KHF-1,7/1/2025,10:50:00 am,0,2025-07-01 10:50:00,9.2228,7.686,0.0001000000000000334
KHF-1,7/1/2025,11:00:00 am,0,2025-07-01 11:00:00,9.2227,7.687,0.0002000000000000668
KHF-1,7/1/2025,11:10:00 am,0,2025-07-01 11:10:00,9.2228,7.685,0.0001000000000000334
KHF-1,7/1/2025,11:20:00 am,0,2025-07-01 11:20:00,9.2229,7.686,0.0001000000000000334
KHF-1,7/1/2025,11:30:00 am,0,2025-07-01 11:30:00,9.2224,7.687,0.0001000000000000334
KHF-1,7/1/2025,11:40:00 am,0,2025-07-01 11:40:00,9.2217,7.686,0.00030000000000001136
KHF-1,7/1/2025,11:50:00 am,0,2025-07-01 11:50:00,9.2215,7.689,0.00019999999999997797
KHF-1,7/1/2025,12:00:00 pm,0,2025-07-01 12:00:00,9.221,7.687,0.00030000000000001136
KHF-1,7/1/2025,12:10:00 pm,0,2025-07-01 12:10:00,9.2206,7.69,0.0002000000000000668
KHF-1,7/1/2025,12:20:00 pm,0,2025-07-01 12:20:00,9.2202,7.688,0.0001000000000000334
KHF-1,7/1/2025,12:30:00 pm,0,2025-07-01 12:30:00,9.22,7.689,0.0001000000000000334
KHF-1,7/1/2025,12:40:00 pm,0,2025-07-01 12:40:00,9.2197,7.688,0.0002000000000000668
KHF-1,7/1/2025,12:50:00 pm,0,2025-07-01 12:50:00,9.2187,7.69,9.999999999994457e-05
KHF-1,7/1/2025,01:00:00 pm,0,2025-07-01 13:00:00,9.218,7.691,9.999999999994457e-05
KHF-1,7/1/2025,01:10:00 pm,0,2025-07-01 13:10:00,9.2177,7.69,0.00019999999999997797
KHF-1,7/1/2025,01:20:00 pm,0,2025-07-01 13:20:00,9.2165,7.692,0.0
KHF-1,7/1/2025,01:30:00 pm,0,2025-07-01 13:30:00,9.2158,7.692,9.999999999994457e-05
KHF-1,7/1/2025,01:40:00 pm,0,2025-07-01 13:40:00,9.2154,7.693,0.0
KHF-1,7/1/2025,01:50:00 pm,0,2025-07-01 13:50:00,9.2138,7.693,0.00019999999999997797
KHF-1,7/1/2025,02:00:00 pm,0,2025-07-01 14:00:00,9.2107,7.691,0.0001000000000000334
KHF-1,7/1/2025,02:10:00 pm,0,2025-07-01 14:10:00,9.2079,7.692,0.00019999999999997797
KHF-1,7/1/2025,02:20:00 pm,0,2025-07-01 14:20:00,9.2058,7.694,0.0001000000000000334
KHF-1,7/1/2025,02:30:00 pm,0,2025-07-01 14:30:00,9.2048,7.693,0.0
KHF-1,7/1/2025,02:40:00 pm,0,2025-07-01 14:40:00,9.2035,7.693,0.0
KHF-1,7/1/2025,02:50:00 pm,0,2025-07-01 14:50:00,9.2016,7.693,0.00030000000000001136
KHF-1,7/1/2025,03:00:00 pm,0,2025-07-01 15:00:00,9.2011,7.696,0.00019999999999997797
KHF-1,7/1/2025,03:10:00 pm,0,2025-07-01 15:10:00,9.2009,7.694,0.00019999999999997797
KHF-1,7/1/2025,03:20:00 pm,0,2025-07-01 15:20:00,9.2,7.696,9.999999999994457e-05
KHF-1,7/1/2025,03:30:00 pm,0,2025-07-01 15:30:00,9.1995,7.695,0.0001000000000000334
KHF-1,7/1/2025,03:40:00 pm,0,2025-07-01 15:40:00,9.1986,7.694,0.0001000000000000334
KHF-1,7/1/2025,03:50:00 pm,0,2025-07-01 15:50:00,9.1971,7.693,0.0002000000000000668
KHF-1,7/1/2025,04:00:00 pm,0,2025-07-01 16:00:00,9.1978,7.695,0.0
KHF-1,7/1/2025,04:10:00 pm,0,2025-07-01 16:10:00,9.1993,7.695,0.0
KHF-1,7/1/2025,04:20:00 pm,0,2025-07-01 16:20:00,9.2012,7.695,9.999999999994457e-05
KHF-1,7/1/2025,04:30:00 pm,0,2025-07-01 16:30:00,9.2009,7.696,0.00019999999999997797
KHF-1,7/1/2025,04:40:00 pm,0,2025-07-01 16:40:00,9.2005,7.694,0.0
KHF-1,7/1/2025,04:50:00 pm,0,2025-07-01 16:50:00,9.1978,7.694,0.0
KHF-1,7/1/2025,05:00:00 pm,0,2025-07-01 17:00:00,9.1997,7.694,0.0
KHF-1,7/1/2025,05:10:00 pm,0,2025-07-01 17:10:00,9.1985,7.694,0.0001000000000000334
KHF-1,7/1/2025,05:20:00 pm,0,2025-07-01 17:20:00,9.1989,7.695,0.00030000000000001136
KHF-1,7/1/2025,05:30:00 pm,0,2025-07-01 17:30:00,9.1989,7.698,0.0002000000000000668
KHF-1,7/1/2025,05:40:00 pm,0,2025-07-01 17:40:00,9.1986,7.696,0.0002000000000000668
KHF-1,7/1/2025,05:50:00 pm,0,2025-07-01 17:50:00,9.1993,7.698,0.0002000000000000668
KHF-1,7/1/2025,06:00:00 pm,0,2025-07-01 18:00:00,9.1998,7.696,0.0002000000000000668
KHF-1,7/1/2025,06:10:00 pm,0,2025-07-01 18:10:00,9.2004,7.698,0.0001000000000000334
KHF-1,7/1/2025,06:20:00 pm,0,2025-07-01 18:20:00,9.201,7.697,0.0001000000000000334
KHF-1,7/1/2025,06:30:00 pm,0,2025-07-01 18:30:00,9.201,7.698,9.999999999994457e-05
KHF-1,7/1/2025,06:40:00 pm,0,2025-07-01 18:40:00,9.2001,7.699,0.00019999999999997797
KHF-1,7/1/2025,06:50:00 pm,0,2025-07-01 18:50:00,9.1996,7.697,0.00019999999999997797
KHF-1,7/1/2025,07:00:00 pm,0,2025-07-01 19:00:00,9.1985,7.699,0.0
KHF-1,7/1/2025,07:10:00 pm,0,2025-07-01 19:10:00,9.1963,7.699,0.0001000000000000334
KHF-1,7/1/2025,07:20:00 pm,0,2025-07-01 19:20:00,9.1934,7.7,0.0
KHF-1,7/1/2025,07:30:00 pm,0,2025-07-01 19:30:00,9.1926,7.7,0.0001000000000000334
KHF-1,7/1/2025,07:40:00 pm,0,2025-07-01 19:40:00,9.1935,7.699,0.00019999999999997797
KHF-1,7/1/2025,07:50:00 pm,0,2025-07-01 19:50:00,9.1949,7.701,0.0
KHF-1,7/1/2025,08:00:00 pm,0,2025-07-01 20:00:00,9.1953,7.701,0.0
KHF-1,7/1/2025,08:10:00 pm,0,2025-07-01 20:10:00,9.1978,7.701,9.999999999994457e-05
KHF-1,7/1/2025,08:20:00 pm,0,2025-07-01 20:20:00,9.198,7.7,0.0001000000000000334
KHF-1,7/1/2025,08:30:00 pm,0,2025-07-01 20:30:00,9.1968,7.699,0.00030000000000001136
KHF-1,7/1/2025,08:40:00 pm,0,2025-07-01 20:40:00,9.1954,7.702,0.0001000000000000334
KHF-1,7/1/2025,08:50:00 pm,0,2025-07-01 20:50:00,9.1962,7.701,9.999999999994457e-05
KHF-1,7/1/2025,09:00:00 pm,0,2025-07-01 21:00:00,9.1962,7.7,0.00019999999999997797
KHF-1,7/1/2025,09:10:00 pm,0,2025-07-01 21:10:00,9.1963,7.702,0.00019999999999997797
KHF-1,7/1/2025,09:20:00 pm,0,2025-07-01 21:20:00,9.1967,7.7,0.0001000000000000334
KHF-1,7/1/2025,09:30:00 pm,0,2025-07-01 21:30:00,9.1968,7.699,0.00030000000000001136
KHF-1,7/1/2025,09:40:00 pm,0,2025-07-01 21:40:00,9.1975,7.702,0.0001000000000000334
KHF-1,7/1/2025,09:50:00 pm,0,2025-07-01 21:50:00,9.1989,7.701,0.0001000000000000334
KHF-1,7/1/2025,10:00:00 pm,0,2025-07-01 22:00:00,9.2014,7.702,0.00030000000000001136
KHF-1,7/1/2025,10:10:00 pm,0,2025-07-01 22:10:00,9.2019,7.699,0.00030000000000001136
KHF-1,7/1/2025,10:20:00 pm,0,2025-07-01 22:20:00,9.2028,7.702,0.0
KHF-1,7/1/2025,10:30:00 pm,0,2025-07-01 22:30:00,9.2036,7.702,0.0001000000000000334
KHF-1,7/1/2025,10:40:00 pm,0,2025-07-01 22:40:00,9.2041,7.703,0.0
KHF-1,7/1/2025,10:50:00 pm,0,2025-07-01 22:50:00,9.2045,7.703,0.0001000000000000334
KHF-1,7/1/2025,11:00:00 pm,0,2025-07-01 23:00:00,9.2056,7.702,0.0001000000000000334
KHF-1,7/1/2025,11:10:00 pm,0,2025-07-01 23:10:00,9.2065,7.703,0.0
KHF-1,7/1/2025,11:20:00 pm,0,2025-07-01 23:20:00,9.2077,7.703,9.999999999994457e-05
KHF-1,7/1/2025,11:30:00 pm,0,2025-07-01 23:30:00,9.208,7.704,9.999999999994457e-05
KHF-1,7/1/2025,11:40:00 pm,0,2025-07-01 23:40:00,9.2088,7.703,0.0
KHF-1,7/1/2025,11:50:00 pm,0,2025-07-01 23:50:00,9.2104,7.703,0.0
KHF-1,7/2/2025,12:00:00 am,0,2025-07-02 00:00:00,9.2119,7.703,0.00019999999999997797
KHF-1,7/2/2025,12:10:00 am,0,2025-07-02 00:10:00,9.2118,7.705,0.00019999999999997797
KHF-1,7/2/2025,12:20:00 am,0,2025-07-02 00:20:00,9.2116,7.703,9.999999999994457e-05
KHF-1,7/2/2025,12:30:00 am,0,2025-07-02 00:30:00,9.2116,7.704,0.0001000000000000334
KHF-1,7/2/2025,12:40:00 am,0,2025-07-02 00:40:00,9.2112,7.705,0.00030000000000001136
KHF-1,7/2/2025,12:50:00 am,0,2025-07-02 00:50:00,9.2109,7.702,0.00019999999999997797
KHF-1,7/2/2025,01:00:00 am,0,2025-07-02 01:00:00,9.211,7.704,0.0002000000000000668
KHF-1,7/2/2025,01:10:00 am,0,2025-07-02 01:10:00,9.2109,7.706,0.00019999999999997797
KHF-1,7/2/2025,01:20:00 am,0,2025-07-02 01:20:00,9.2112,7.708,0.0001000000000000334
KHF-1,7/2/2025,01:30:00 am,0,2025-07-02 01:30:00,9.2116,7.707,0.0
KHF-1,7/2/2025,01:40:00 am,0,2025-07-02 01:40:00,9.2134,7.707,9.999999999994457e-05
KHF-1,7/2/2025,01:50:00 am,0,2025-07-02 01:50:00,9.2139,7.706,9.999999999994457e-05
KHF-1,7/2/2025,02:00:00 am,0,2025-07-02 02:00:00,9.2147,7.707,0.0001000000000000334
KHF-1,7/2/2025,02:10:00 am,0,2025-07-02 02:10:00,9.2146,7.708,9.999999999994457e-05
KHF-1,7/2/2025,02:20:00 am,0,2025-07-02 02:20:00,9.215,7.709,0.0
KHF-1,7/2/2025,02:30:00 am,0,2025-07-02 02:30:00,9.215,7.709,9.999999999994457e-05
KHF-1,7/2/2025,02:40:00 am,0,2025-07-02 02:40:00,9.2145,7.708,0.0
KHF-1,7/2/2025,02:50:00 am,0,2025-07-02 02:50:00,9.2147,7.708,9.999999999994457e-05
KHF-1,7/2/2025,03:00:00 am,0,2025-07-02 03:00:00,9.2147,7.709,0.0
KHF-1,7/2/2025,03:10:00 am,0,2025-07-02 03:10:00,9.215,7.709,0.0
KHF-1,7/2/2025,03:20:00 am,0,2025-07-02 03:20:00,9.2151,7.709,0.0
KHF-1,7/2/2025,03:30:00 am,0,2025-07-02 03:30:00,9.2154,7.709,0.0
KHF-1,7/2/2025,03:40:00 am,0,2025-07-02 03:40:00,9.215,7.709,9.999999999994457e-05
KHF-1,7/2/2025,03:50:00 am,0,2025-07-02 03:50:00,9.2151,7.708,0.00019999999999997797
KHF-1,7/2/2025,04:00:00 am,0,2025-07-02 04:00:00,9.2159,7.71,0.0
KHF-1,7/2/2025,04:10:00 am,0,2025-07-02 04:10:00,9.2159,7.71,0.0001000000000000334
KHF-1,7/2/2025,04:20:00 am,0,2025-07-02 04:20:00,9.2161,7.709,0.0001000000000000334
KHF-1,7/2/2025,04:30:00 am,0,2025-07-02 04:30:00,9.2167,7.71,0.0
KHF-1,7/2/2025,04:40:00 am,0,2025-07-02 04:40:00,9.2165,7.71,0.0001000000000000334
KHF-1,7/2/2025,04:50:00 am,0,2025-07-02 04:50:00,9.2165,7.711,0.0001000000000000334
KHF-1,7/2/2025,05:00:00 am,0,2025-07-02 05:00:00,9.2169,7.71,0.00019999999999997797
KHF-1,7/2/2025,05:10:00 am,0,2025-07-02 05:10:00,9.2172,7.712,9.999999999994457e-05
KHF-1,7/2/2025,05:20:00 am,0,2025-07-02 05:20:00,9.2174,7.711,0.00019999999999997797
KHF-1,7/2/2025,05:30:00 am,0,2025-07-02 05:30:00,9.2179,7.713,0.0001000000000000334
KHF-1,7/2/2025,05:40:00 am,0,2025-07-02 05:40:00,9.218,7.712,0.0
KHF-1,7/2/2025,05:50:00 am,0,2025-07-02 05:50:00,9.2182,7.712,0.0
KHF-1,7/2/2025,06:00:00 am,0,2025-07-02 06:00:00,9.2181,7.712,9.999999999994457e-05
KHF-1,7/2/2025,06:10:00 am,0,2025-07-02 06:10:00,9.2184,7.711,9.999999999994457e-05
KHF-1,7/2/2025,06:20:00 am,0,2025-07-02 06:20:00,9.2185,7.712,0.0002000000000000668
KHF-1,7/2/2025,06:30:00 am,0,2025-07-02 06:30:00,9.2186,7.714,0.0002000000000000668
KHF-1,7/2/2025,06:40:00 am,0,2025-07-02 06:40:00,9.2185,7.712,0.0002000000000000668
KHF-1,7/2/2025,06:50:00 am,0,2025-07-02 06:50:00,9.2186,7.714,9.999999999994457e-05
KHF-1,7/2/2025,07:00:00 am,0,2025-07-02 07:00:00,9.219,7.715,0.0
KHF-1,7/2/2025,07:10:00 am,0,2025-07-02 07:10:00,9.2193,7.715,0.00030000000000001136
KHF-1,7/2/2025,07:20:00 am,0,2025-07-02 07:20:00,9.2194,7.712,0.0002000000000000668
KHF-1,7/2/2025,07:30:00 am,0,2025-07-02 07:30:00,9.2198,7.714,9.999999999994457e-05
KHF-1,7/2/2025,07:40:00 am,0,2025-07-02 07:40:00,9.22,7.715,0.00019999999999997797
KHF-1,7/2/2025,07:50:00 am,0,2025-07-02 07:50:00,9.2197,7.713,0.00019999999999997797
KHF-1,7/2/2025,08:00:00 am,0,2025-07-02 08:00:00,9.2196,7.715,0.0001000000000000334
KHF-1,7/2/2025,08:10:00 am,0,2025-07-02 08:10:00,9.2198,7.716,0.0
KHF-1,7/2/2025,08:20:00 am,0,2025-07-02 08:20:00,9.2195,7.716,9.999999999994457e-05
KHF-1,7/2/2025,08:30:00 am,0,2025-07-02 08:30:00,9.2196,7.717,9.999999999994457e-05
KHF-1,7/2/2025,08:40:00 am,0,2025-07-02 08:40:00,9.2196,7.716,9.999999999994457e-05
KHF-1,7/2/2025,08:50:00 am,0,2025-07-02 08:50:00,9.2196,7.717,0.0
KHF-1,7/2/2025,09:00:00 am,0,2025-07-02 09:00:00,9.2193,7.717,0.0
KHF-1,7/2/2025,09:10:00 am,0,2025-07-02 09:10:00,9.2195,7.717,0.0002000000000000668
KHF-1,7/2/2025,09:20:00 am,0,2025-07-02 09:20:00,9.2195,7.719,0.0002000000000000668
KHF-1,7/2/2025,09:30:00 am,0,2025-07-02 09:30:00,9.2193,7.717,0.00019999999999997797
KHF-1,7/2/2025,09:40:00 am,0,2025-07-02 09:40:00,9.2191,7.715,0.00030000000000001136
KHF-1,7/2/2025,09:50:00 am,0,2025-07-02 09:50:00,9.2188,7.718,0.0001000000000000334
KHF-1,7/2/2025,10:00:00 am,0,2025-07-02 10:00:00,9.2186,7.717,0.0
KHF-1,7/2/2025,10:10:00 am,0,2025-07-02 10:10:00,9.2187,7.717,0.00030000000000001136
KHF-1,7/2/2025,10:20:00 am,0,2025-07-02 10:20:00,9.2184,7.72,9.999999999994457e-05
KHF-1,7/2/2025,10:30:00 am,0,2025-07-02 10:30:00,9.2181,7.719,9.999999999994457e-05
KHF-1,7/2/2025,10:40:00 am,0,2025-07-02 10:40:00,9.2179,7.72,9.999999999994457e-05
KHF-1,7/2/2025,10:50:00 am,0,2025-07-02 10:50:00,9.2175,7.719,0.0
KHF-1,7/2/2025,11:00:00 am,0,2025-07-02 11:00:00,9.2174,7.719,0.00019999999999997797
KHF-1,7/2/2025,11:10:00 am,0,2025-07-02 11:10:00,9.217,7.721,0.0
KHF-1,7/2/2025,11:20:00 am,0,2025-07-02 11:20:00,9.2167,7.721,0.0001000000000000334
KHF-1,7/2/2025,11:30:00 am,0,2025-07-02 11:30:00,9.2165,7.722,0.0
KHF-1,7/2/2025,11:40:00 am,0,2025-07-02 11:40:00,9.2162,7.722,9.999999999994457e-05
KHF-1,7/2/2025,11:50:00 am,0,2025-07-02 11:50:00,9.2156,7.723,0.0
KHF-1,7/2/2025,12:00:00 pm,0,2025-07-02 12:00:00,9.2154,7.723,0.00019999999999997797
KHF-1,7/2/2025,12:10:00 pm,0,2025-07-02 12:10:00,9.2153,7.725,0.0
KHF-1,7/2/2025,12:20:00 pm,0,2025-07-02 12:20:00,9.2146,7.725,9.999999999994457e-05
KHF-1,7/2/2025,12:30:00 pm,0,2025-07-02 12:30:00,9.2143,7.724,9.999999999994457e-05
KHF-1,7/2/2025,12:40:00 pm,0,2025-07-02 12:40:00,9.2135,7.725,0.0002000000000000668
KHF-1,7/2/2025,12:50:00 pm,0,2025-07-02 12:50:00,9.213,7.727,9.999999999994457e-05
KHF-1,7/2/2025,01:00:00 pm,0,2025-07-02 13:00:00,9.2122,7.728,0.0001000000000000334
KHF-1,7/2/2025,01:10:00 pm,0,2025-07-02 13:10:00,9.2113,7.729,0.00019999999999997797
KHF-1,7/2/2025,01:20:00 pm,0,2025-07-02 13:20:00,9.209,7.727,0.0001000000000000334
KHF-1,7/2/2025,01:30:00 pm,0,2025-07-02 13:30:00,9.2003,7.726,0.0
KHF-1,7/2/2025,01:40:00 pm,0,2025-07-02 13:40:00,9.1995,7.726,0.0001000000000000334
KHF-1,7/2/2025,01:50:00 pm,0,2025-07-02 13:50:00,9.1991,7.727,0.0001000000000000334
KHF-1,7/2/2025,02:00:00 pm,0,2025-07-02 14:00:00,9.1986,7.726,0.0001000000000000334
KHF-1,7/2/2025,02:10:00 pm,0,2025-07-02 14:10:00,9.1977,7.727,0.0
KHF-1,7/2/2025,02:20:00 pm,0,2025-07-02 14:20:00,9.1959,7.727,9.999999999994457e-05
KHF-1,7/2/2025,02:30:00 pm,0,2025-07-02 14:30:00,9.1943,7.728,9.999999999994457e-05
KHF-1,7/2/2025,02:40:00 pm,0,2025-07-02 14:40:00,9.194,7.727,0.0001000000000000334
KHF-1,7/2/2025,02:50:00 pm,0,2025-07-02 14:50:00,9.1924,7.726,0.00030000000000001136
KHF-1,7/2/2025,03:00:00 pm,0,2025-07-02 15:00:00,9.1918,7.729,0.0001000000000000334
KHF-1,7/2/2025,03:10:00 pm,0,2025-07-02 15:10:00,9.191,7.728,0.0
KHF-1,7/2/2025,03:20:00 pm,0,2025-07-02 15:20:00,9.1903,7.728,0.0001000000000000334
KHF-1,7/2/2025,03:30:00 pm,0,2025-07-02 15:30:00,9.1895,7.729,0.00019999999999997797
KHF-1,7/2/2025,03:40:00 pm,0,2025-07-02 15:40:00,9.1892,7.731,0.00019999999999997797
KHF-1,7/2/2025,03:50:00 pm,0,2025-07-02 15:50:00,9.1886,7.729,0.0001000000000000334
KHF-1,7/2/2025,04:00:00 pm,0,2025-07-02 16:00:00,9.1859,7.73,9.999999999994457e-05
KHF-1,7/2/2025,04:10:00 pm,0,2025-07-02 16:10:00,9.1858,7.731,0.0001000000000000334
KHF-1,7/2/2025,04:20:00 pm,0,2025-07-02 16:20:00,9.1856,7.732,0.0
KHF-1,7/2/2025,04:30:00 pm,0,2025-07-02 16:30:00,9.185,7.732,0.00019999999999997797
KHF-1,7/2/2025,04:40:00 pm,0,2025-07-02 16:40:00,9.1844,7.734,0.0001000000000000334
KHF-1,7/2/2025,04:50:00 pm,0,2025-07-02 16:50:00,9.1839,7.733,0.0
KHF-1,7/2/2025,05:00:00 pm,0,2025-07-02 17:00:00,9.1837,7.733,9.999999999994457e-05
KHF-1,7/2/2025,05:10:00 pm,0,2025-07-02 17:10:00,9.1829,7.732,9.999999999994457e-05
KHF-1,7/2/2025,05:20:00 pm,0,2025-07-02 17:20:00,9.1824,7.733,0.00019999999999997797
KHF-1,7/2/2025,05:30:00 pm,0,2025-07-02 17:30:00,9.1818,7.731,0.00030000000000001136
KHF-1,7/2/2025,05:40:00 pm,0,2025-07-02 17:40:00,9.1809,7.734,0.00019999999999997797
KHF-1,7/2/2025,05:50:00 pm,0,2025-07-02 17:50:00,9.1801,7.732,0.0
KHF-1,7/2/2025,06:00:00 pm,0,2025-07-02 18:00:00,9.1795,7.732,9.999999999994457e-05
KHF-1,7/2/2025,06:10:00 pm,0,2025-07-02 18:10:00,9.1794,7.733,0.0002000000000000668
KHF-1,7/2/2025,06:20:00 pm,0,2025-07-02 18:20:00,9.1796,7.735,0.0002000000000000668
KHF-1,7/2/2025,06:30:00 pm,0,2025-07-02 18:30:00,9.1796,7.733,0.0
KHF-1,7/2/2025,06:40:00 pm,0,2025-07-02 18:40:00,9.1801,7.733,0.0001000000000000334
KHF-1,7/2/2025,06:50:00 pm,0,2025-07-02 18:50:00,9.1802,7.734,0.00019999999999997797
KHF-1,7/2/2025,07:00:00 pm,0,2025-07-02 19:00:00,9.1802,7.736,0.0
KHF-1,7/2/2025,07:10:00 pm,0,2025-07-02 19:10:00,9.1804,7.736,9.999999999994457e-05
KHF-1,7/2/2025,07:20:00 pm,0,2025-07-02 19:20:00,9.1799,7.735,9.999999999994457e-05
KHF-1,7/2/2025,07:30:00 pm,0,2025-07-02 19:30:00,9.1805,7.736,9.999999999994457e-05
KHF-1,7/2/2025,07:40:00 pm,0,2025-07-02 19:40:00,9.1808,7.735,0.0
KHF-1,7/2/2025,07:50:00 pm,0,2025-07-02 19:50:00,9.181,7.735,0.0001000000000000334
KHF-1,7/2/2025,08:00:00 pm,0,2025-07-02 20:00:00,9.1817,7.734,0.00019999999999997797
KHF-1,7/2/2025,08:10:00 pm,0,2025-07-02 20:10:00,9.1822,7.736,0.0001000000000000334
KHF-1,7/2/2025,08:20:00 pm,0,2025-07-02 20:20:00,9.1823,7.737,0.0001000000000000334
KHF-1,7/2/2025,08:30:00 pm,0,2025-07-02 20:30:00,9.1828,7.736,0.0001000000000000334
KHF-1,7/2/2025,08:40:00 pm,0,2025-07-02 20:40:00,9.183,7.737,0.00019999999999997797
KHF-1,7/2/2025,08:50:00 pm,0,2025-07-02 20:50:00,9.1834,7.735,0.00019999999999997797
KHF-1,7/2/2025,09:00:00 pm,0,2025-07-02 21:00:00,9.1839,7.737,0.0001000000000000334
KHF-1,7/2/2025,09:10:00 pm,0,2025-07-02 21:10:00,9.1841,7.736,0.0002000000000000668
KHF-1,7/2/2025,09:20:00 pm,0,2025-07-02 21:20:00,9.1852,7.738,0.0
KHF-1,7/2/2025,09:30:00 pm,0,2025-07-02 21:30:00,9.186,7.738,0.0002000000000000668
KHF-1,7/2/2025,09:40:00 pm,0,2025-07-02 21:40:00,9.1862,7.736,0.0001000000000000334
KHF-1,7/2/2025,09:50:00 pm,0,2025-07-02 21:50:00,9.186,7.737,0.00019999999999997797
KHF-1,7/2/2025,10:00:00 pm,0,2025-07-02 22:00:00,9.1873,7.739,0.00019999999999997797
KHF-1,7/2/2025,10:10:00 pm,0,2025-07-02 22:10:00,9.1872,7.737,0.00019999999999997797
KHF-1,7/2/2025,10:20:00 pm,0,2025-07-02 22:20:00,9.1877,7.739,0.0001000000000000334
KHF-1,7/2/2025,10:30:00 pm,0,2025-07-02 22:30:00,9.1878,7.74,0.0001000000000000334
KHF-1,7/2/2025,10:40:00 pm,0,2025-07-02 22:40:00,9.1878,7.739,0.0
KHF-1,7/2/2025,10:50:00 pm,0,2025-07-02 22:50:00,9.1885,7.739,9.999999999994457e-05
KHF-1,7/2/2025,11:00:00 pm,0,2025-07-02 23:00:00,9.1897,7.738,9.999999999994457e-05
KHF-1,7/2/2025,11:10:00 pm,0,2025-07-02 23:10:00,9.1916,7.739,0.00019999999999997797
KHF-1,7/2/2025,11:20:00 pm,0,2025-07-02 23:20:00,9.1923,7.741,0.0
KHF-1,7/2/2025,11:30:00 pm,0,2025-07-02 23:30:00,9.1928,7.741,9.999999999994457e-05
KHF-1,7/2/2025,11:40:00 pm,0,2025-07-02 23:40:00,9.1935,7.74,0.0
KHF-1,7/2/2025,11:50:00 pm,0,2025-07-02 23:50:00,9.1936,7.74,0.00019999999999997797
KHF-1,7/3/2025,12:00:00 am,0,2025-07-03 00:00:00,9.1938,7.742,0.0
KHF-1,7/3/2025,12:10:00 am,0,2025-07-03 00:10:00,9.1944,7.742,0.0001000000000000334
KHF-1,7/3/2025,12:20:00 am,0,2025-07-03 00:20:00,9.1948,7.741,0.0001000000000000334
KHF-1,7/3/2025,12:30:00 am,0,2025-07-03 00:30:00,9.1953,7.742,0.0
KHF-1,7/3/2025,12:40:00 am,0,2025-07-03 00:40:00,9.1951,7.742,0.00019999999999997797
KHF-1,7/3/2025,12:50:00 am,0,2025-07-03 00:50:00,9.1952,7.74,0.00039999999999995595
KHF-1,7/3/2025,01:00:00 am,0,2025-07-03 01:00:00,9.1955,7.744,9.999999999994457e-05
KHF-1,7/3/2025,01:10:00 am,0,2025-07-03 01:10:00,9.1956,7.743,0.0001000000000000334
KHF-1,7/3/2025,01:20:00 am,0,2025-07-03 01:20:00,9.1955,7.742,0.0
KHF-1,7/3/2025,01:30:00 am,0,2025-07-03 01:30:00,9.1957,7.742,0.0001000000000000334
KHF-1,7/3/2025,01:40:00 am,0,2025-07-03 01:40:00,9.1956,7.743,9.999999999994457e-05
KHF-1,7/3/2025,01:50:00 am,0,2025-07-03 01:50:00,9.1965,7.744,9.999999999994457e-05
KHF-1,7/3/2025,02:00:00 am,0,2025-07-03 02:00:00,9.1968,7.743,0.0
KHF-1,7/3/2025,02:10:00 am,0,2025-07-03 02:10:00,9.1965,7.743,0.0
KHF-1,7/3/2025,02:20:00 am,0,2025-07-03 02:20:00,9.1966,7.743,0.00019999999999997797
KHF-1,7/3/2025,02:30:00 am,0,2025-07-03 02:30:00,9.1969,7.745,0.0001000000000000334
KHF-1,7/3/2025,02:40:00 am,0,2025-07-03 02:40:00,9.1973,7.746,0.0002000000000000668
KHF-1,7/3/2025,02:50:00 am,0,2025-07-03 02:50:00,9.1969,7.744,0.0
KHF-1,7/3/2025,03:00:00 am,0,2025-07-03 03:00:00,9.1966,7.744,0.0001000000000000334
KHF-1,7/3/2025,03:10:00 am,0,2025-07-03 03:10:00,9.1964,7.745,0.0001000000000000334
KHF-1,7/3/2025,03:20:00 am,0,2025-07-03 03:20:00,9.1965,7.744,0.0
KHF-1,7/3/2025,03:30:00 am,0,2025-07-03 03:30:00,9.1966,7.744,0.00030000000000001136
KHF-1,7/3/2025,03:40:00 am,0,2025-07-03 03:40:00,9.1967,7.747,0.00019999999999997797
KHF-1,7/3/2025,03:50:00 am,0,2025-07-03 03:50:00,9.1967,7.749,0.0004999999999999894
KHF-1,7/3/2025,04:00:00 am,0,2025-07-03 04:00:00,9.1963,7.744,0.00030000000000001136
KHF-1,7/3/2025,04:10:00 am,0,2025-07-03 04:10:00,9.1963,7.747,0.0
KHF-1,7/3/2025,04:20:00 am,0,2025-07-03 04:20:00,9.1965,7.747,9.999999999994457e-05
KHF-1,7/3/2025,04:30:00 am,0,2025-07-03 04:30:00,9.1973,7.746,0.00019999999999997797
KHF-1,7/3/2025,04:40:00 am,0,2025-07-03 04:40:00,9.1972,7.748,0.0
KHF-1,7/3/2025,04:50:00 am,0,2025-07-03 04:50:00,9.1975,7.748,0.0001000000000000334
KHF-1,7/3/2025,05:00:00 am,0,2025-07-03 05:00:00,9.1972,7.747,9.999999999994457e-05
KHF-1,7/3/2025,05:10:00 am,0,2025-07-03 05:10:00,9.1972,7.746,0.00019999999999997797
KHF-1,7/3/2025,05:20:00 am,0,2025-07-03 05:20:00,9.1994,7.748,9.999999999994457e-05
KHF-1,7/3/2025,05:30:00 am,0,2025-07-03 05:30:00,9.2007,7.749,9.999999999994457e-05
KHF-1,7/3/2025,05:40:00 am,0,2025-07-03 05:40:00,9.2028,7.748,9.999999999994457e-05
KHF-1,7/3/2025,05:50:00 am,0,2025-07-03 05:50:00,9.2029,7.749,0.0001000000000000334
KHF-1,7/3/2025,06:00:00 am,0,2025-07-03 06:00:00,9.2029,7.75,0.0001000000000000334
KHF-1,7/3/2025,06:10:00 am,0,2025-07-03 06:10:00,9.2038,7.749,0.0
KHF-1,7/3/2025,06:20:00 am,0,2025-07-03 06:20:00,9.2038,7.749,0.0001000000000000334
KHF-1,7/3/2025,06:30:00 am,0,2025-07-03 06:30:00,9.2037,7.75,0.0001000000000000334
KHF-1,7/3/2025,06:40:00 am,0,2025-07-03 06:40:00,9.204,7.749,0.0002000000000000668
KHF-1,7/3/2025,06:50:00 am,0,2025-07-03 06:50:00,9.2042,7.751,0.0001000000000000334
KHF-1,7/3/2025,07:00:00 am,0,2025-07-03 07:00:00,9.2042,7.75,0.0
KHF-1,7/3/2025,07:10:00 am,0,2025-07-03 07:10:00,9.2045,7.75,0.00039999999999995595
KHF-1,7/3/2025,07:20:00 am,0,2025-07-03 07:20:00,9.2051,7.754,9.999999999994457e-05
KHF-1,7/3/2025,07:30:00 am,0,2025-07-03 07:30:00,9.2051,7.753,9.999999999994457e-05
KHF-1,7/3/2025,07:40:00 am,0,2025-07-03 07:40:00,9.2056,7.754,0.00029999999999992256
KHF-1,7/3/2025,07:50:00 am,0,2025-07-03 07:50:00,9.2057,7.751,9.999999999994457e-05
KHF-1,7/3/2025,08:00:00 am,0,2025-07-03 08:00:00,9.2057,7.752,0.0
KHF-1,7/3/2025,08:10:00 am,0,2025-07-03 08:10:00,9.2058,7.752,0.0001000000000000334
KHF-1,7/3/2025,08:20:00 am,0,2025-07-03 08:20:00,9.2056,7.753,0.0
KHF-1,7/3/2025,08:30:00 am,0,2025-07-03 08:30:00,9.2057,7.753,0.00019999999999997797
KHF-1,7/3/2025,08:40:00 am,0,2025-07-03 08:40:00,9.2059,7.755,0.0001000000000000334
KHF-1,7/3/2025,08:50:00 am,0,2025-07-03 08:50:00,9.2062,7.754,0.0001000000000000334
KHF-1,7/3/2025,09:00:00 am,0,2025-07-03 09:00:00,9.2061,7.755,0.00019999999999997797
KHF-1,7/3/2025,09:10:00 am,0,2025-07-03 09:10:00,9.206,7.757,0.00019999999999997797
KHF-1,7/3/2025,09:20:00 am,0,2025-07-03 09:20:00,9.2059,7.755,0.0
